start	end	text
3.677	42.806	弟兄姊妹平安，我們一起來思想耶利敏書第二十一章從二十一章到二十四章是一連串的對於以色列的君王跟先知這些領袖的失職做了最嚴厲的審判二十一節耶和華的話臨到耶利敏 那時西底加王打發馬基雅的兒子巴斯護爾,這個跟第二十章把耶利米關起來的那個巴斯護爾是不同人,以及馬西雅的兒子祭司西番雅去見耶利米,說,請你為我們求問耶和華,因為巴比倫王尼布賈尼薩來攻擊我們。
43.882	52.111	或者耶和華照祂一切奇妙的作為﹐帶我們﹐使巴比倫王離開我們上去。
52.111	59.479	這個時間呢﹐很可能是在祖前五百八十八年﹐也就是西底加王作王的第九年。
59.479	63.463	那巴比倫來進攻耶路撒冷。
63.463	65.665	再過兩年之後﹐他們就會亡國了。
66.613	73.538	那在這個之前呢﹐其實不論是國王﹐祭司﹐先知﹐也都不太把耶利米的話當一回事。
73.538	76.721	但是現在看起來怎麼樣﹐局勢非常的險惡。
76.721	87.489	因此連西底加王﹐他都派人來問這個耶利米﹐其實是請耶利米為他們哀求上帝﹐讓他們逃過這一劫。
87.489	99.138	那西底加王呢﹐他是在祖前597年的時候上臺﹐那個時候是這個﹐ 猶大第二次被巴比倫擄掠。
99.138	101.659	然後有一批人就被擄到巴比倫去了。
101.659	105.721	第一批被擄掠的,包含但以領。
105.721	109.363	第二批被擄掠的,包含這個以西捷。
109.363	119.048	然後呢,當第二次被擄掠完之後呢,這個巴比倫王尼布賈尼薩,他就立了傀儡的國王,就是西底加。
120.282	127.826	那但是呢,西底加呢,他就是一直遊走在這個巴比倫跟埃及中間。
127.826	134.589	那後來就是巴比倫王就受不了了,就來懲罰這個西底加。
134.589	172.954	第三節,耶利米對他們說,你們當對西底加這樣說,耶和華以色列的神如此說, 我要使你們手中的兵器就是你們在城外與巴比倫王和圍困你們的迦勒底人打仗的兵器翻轉過來又要使這些都聚集在城中也就是說這些拿兵器到外面去打仗的猶大人他們會逃跑拿著兵器又跑回到城裡面第五節並且我要在怒氣憤怒和大腦恨中用伸出來的手 並大量的綁臂，親自攻擊你們。
172.954	184.992	在第五節裡面用了兩組生命計的話語第一組是上帝要用怒氣 憤怒﹑大惱恨﹐來審判百姓。
184.992	188.094	這個出現在生命記29章的28節。
188.094	193.619	再來就是用伸出來的手﹐並大能的綁臂﹐親自攻擊你們。
193.619	197.703	這個也是出自於生命記裡面﹐很多的經文。
197.703	206.270	這個經文本來在生命記裡面是描寫﹐耶和華上帝用他這個﹐大能的綁臂﹐跟伸出來的手﹐攻擊埃及人。
208.507	217.031	而且保證他的大腦的綁臂跟伸出來的時候,攻擊埃及人之後,埃及人一定會讓以色列人離開。
217.031	228.737	而現在耶利米就使用生命記的這兩個經文組合在一起,宣告神是非常的怒氣、憤怒、大腦恨。
228.737	243.045	並且他要用以前懲罰埃及, 然後把以色列百姓﹐帶出埃及的那一個﹐強大的綁臂跟力量﹐今天反過來要擊打在尤大人的身上。
243.045	252.851	那我們也知道生命紀的神學﹐一直是葉利米擔任先知的時代﹐一個主流的神學氛圍。
252.851	261.269	因為約西亞王做國王的時候﹐在聖殿裡面重新發現律法書﹐ 而律法書裡面最重要的就是一個約的觀念。
261.269	263.871	西乃山之約的約的觀念。
263.871	266.053	上帝跟祂的百姓立約。
266.053	272.737	而這個約裡面的就講到就是,順服摩西律法,神就必賜福。
272.737	275.680	違背摩西的律法,神必做主審判。
276.340	280.244	因此約西亞王就帶著百姓重新跟神立約。
280.244	285.769	所以這個立約的一個觀念跟神學是耶利米作先知時候的主流神學思想。
285.769	290.733	但是所有的君王先知祭司領袖百姓通通不當一回事。
290.733	292.195	我們繼續往下看。
292.195	298.841	第六節又要擊打這城的居民連人帶牲畜都必遭遇大瘟疫死亡。
298.841	317.001	以後我要將猶大王西底加 和他臣僕百姓,就是在城內,從瘟疫刀劍饑荒中剩下的人,都交在巴比倫王尼布賈尼撒的手中和他們的仇敵,並尋索其命的人手中。
317.001	321.904	巴比倫王必用刀劍擊殺他們,不顧惜、不可憐、不憐憫。
321.904	324.386	這是耶和華說的。
324.386	377.146	透過耶利米的宣告, 果然要應驗在第15章所說的四個命定就是耶華要用瘟疫、刀劍、饑荒以及被俘虜來作為悖逆的猶大他們的結局那並且呢這邊也講到在第7節連續用三個部就是巴比倫王是不顧惜他們的不可憐他們的也不憐憫他們的以至於他們會遭到極大極大的一個傷害第8節 你要對這百姓說,耶和華如此說,看哪,我將生命的路和死亡的路擺在你們面前,住在這城裡必遭刀劍饑荒,瘟疫而死,但出去歸鄉,圍困你們迦勒底人的必得存活,要以自己的命為略務。
377.146	385.868	在這邊耶和華要給願意信靠他的百姓一條生路,就是出城投降。
387.125	392.908	耶和華已經對他們的最終的審判已經命定了,就是要把他們趕出這個地方。
392.908	400.392	但是如果他們信不過耶和華,仍然要觀望,然後繼續來抵抗巴比倫,那他們的結局就是被屠殺。
400.392	411.669	但如果他們願意信得過耶和華,知道說他們現在會被巴比倫滅亡是出於神的審判, 然後接受這個審判的事實。
411.669	413.731	就算被俘虜到巴比倫之地。
413.731	414.732	有一天。
414.732	417.295	神也會照著他透過耶利米的。
417.295	419.538	在一章十節的信息。
419.538	420.859	他拔出。
420.859	423.522	他也會重新把他栽植回去。
423.522	424.303	他毀壞。
424.303	426.326	他也會重新把他建立。
426.326	427.427	也就是說你們信得過神。
428.353	429.555	你們就悔改。
429.555	430.936	你們就被開懲。
430.936	432.418	投降被俘虜。
432.418	434.361	我也會把你們帶回來。
434.361	436.824	就看你們信或不信。
436.824	437.365	所以說呢。
437.365	440.449	你們就是會被擄走。
440.449	441.410	作為掠物。
441.410	443.293	就是被搶奪的東西被擄走。
443.293	444.034	這是一條生路。
444.855	453.501	第十節耶和華說,我向這城變臉,降禍不降福,這城必交在巴比倫王手中,他必用火焚燒。
453.501	462.148	他再一次堅定說,這個城是一定要滅亡的,因為我已經做這個決定,因此你們最好是信得過,我就開城投降。
462.148	470.834	十一節,至於猶大王的家,你們當聽耶和華的話,大衛家,就是指的王室。
470.834	479.186	耶和華如此說,你們每早晨要施行公平, 拯救被搶奪的,脫離欺壓人的手。
479.186	486.768	這是一個諷刺,因為這幾個壞國王,約西亞王之後這幾個壞國王,根本沒有人是這樣做的。
486.768	491.550	但同時這也是一個規勸,如果你們現在願意悔改,我都還願意悅納你們。
492.654	498.996	恐怕我的憤怒因你們的惡行發作如火早起甚至無人能以熄滅。
498.996	507.638	耶和華說住山谷和平原磐石上的居民你們說誰能下來攻擊我們誰能進入我們的住處呢?
507.638	524.704	因為這些住在山谷有這個天然的地勢可以防守的還有住在平原磐石磐石就是山山上的居民他們認為他們是這個南宮易守之地 他們認為他們應該不會輸。
524.704	530.169	十四節耶和華說,我必按你們的做事的結果刑罰你們。
530.169	537.094	我也必使火在耶路撒冷的林中早起,將它視為所有的進行燒滅。
537.094	542.979	二十二章第一節,耶和華繼續審判這些猶大壞的君王。
542.979	550.171	第一節,耶和華如此說,你下到猶大的王宮中, 在那裡說這話。
550.171	551.912	耶利米常常奉差前。
551.912	553.994	他從第一章蒙召的時候。
553.994	557.116	耶和華就說我吩咐你去哪裡就去哪裡。
557.116	558.957	說什麼話就說什麼話。
558.957	560.719	他也被吩咐到聖殿。
560.719	562.620	被吩咐到大街小巷。
562.620	566.903	被吩咐到這個新嫩子谷。
566.903	569.505	到處去傳講上帝的信息。
569.505	573.188	現在他被吩咐到王宮去傳講信息。
573.188	573.668	第二節說。
574.667	583.171	做大衛寶座的猶大王﹐和你和你的臣僕﹐並進入城門的百姓﹐都當聽耶和華的話。
583.171	600.798	耶和華如此說,你們要施行公平和公義,拯救被搶奪的脫離欺壓人的手,不可虧負寄居的和孤兒寡婦,不可以強暴待他們, 在這地方也不可流無辜人的血。
600.798	606.940	這是上帝託付給君王、先知、祭司、領袖、智慧人他們的託付。
606.940	611.601	要他們以神的律法以公義、信實、慈愛來待百姓。
611.601	614.322	但是這些君王真的都很糟糕。
614.322	619.763	對外一籌莫展都被仇敵、敵人攻打欺負。
619.763	623.124	對內只會剝削百姓、欺壓百姓。
623.124	625.305	然後欺負弱勢的群體。
625.725	627.327	流無辜人的血。
627.327	630.691	因此這些都是失職的百姓,惹動神的憤怒。
630.691	636.098	弟兄姊妹,如果神設立我們做帶領者,我們真的要很謹慎。
636.098	639.883	因為神給誰多,就向誰要得多。
639.883	640.584	我們要對神交賬。
641.886	655.376	接下來,你們若認真行這事,就必有做大衛寶座的君王和他的臣僕百姓和坐車或騎馬,從這城的各門進入。
655.376	662.221	你們若不聽這些話,耶和華說,我指著自己啟示,這城必變為荒廠。
662.841	676.847	第四節這邊的一個應許,你們若願意悔改聽神的話,我就讓你們這些國王大臣以及所有的人,都能夠永遠在這個城裡面生活,進出這個耶路撒冷大城。
676.847	684.110	這個在17章的24節、25節,就是指責他們不守安息日的那個講道裡面已經重複提過了。
684.650	686.672	但是呢,他們就是都不聽。
686.672	690.937	所以呢,神就會讓這個地方變為荒廠,無人居住。
690.937	703.445	第六節,耶和華論到猶大王的家,如此說,我看你如積烈,如梨巴嫩鼎, 然而我必使你，變為曠野，為無人居住的誠意。
703.445	730.590	激烈或是黎巴嫩鼎就代表說那邊是樹木非常的茂盛清脆代表王公很華麗王公也是用這些上好的木頭所做的王公那但是神說我要讓你成為荒廠、曠野、無人居住第七節我要預備行毀滅的人各拿器械攻擊你 他們要砍下你家美的香柏樹, 扔在火中。
730.590	734.536	到時候呢,第八節,許多國的民要經過這城。
734.536	740.344	個人對林瑟說,耶和華為何向這大城如此行呢?
740.344	741.265	指的就是耶路撒冷。
742.449	755.757	他們必回答說是因為離棄了耶和華他們的神的約去侍奉敬拜別神因為他們跟他們神立了約不遵守因此毀約被審判。
755.757	773.748	我們一同低頭來禱告親愛的主我們在祢面前特別是我們被設立做領袖的在祢面前要查驗自己是不是有虧乎我們的職守是否有帶領我們的百姓 帶領我們的家人﹐主來遵行祢的話語。
773.748	780.309	還是我們﹐帶頭做邪惡的榜樣﹐帶頭做玩梗悖逆﹐偏行己路的榜樣。
780.309	789.732	主啊﹐我們要向祢交賬的﹐求主使我們﹐真實的面對祢給我們的﹐領袖的護照﹐使我們不敢怠慢﹐奉主耶穌的名禱告。
789.732	790.412	阿們。
790.412	791.472	願神祝福大家。