start	end	text
4.292	31.963	弟兄姊妹平安，我們一起來思想。耶利敏書第五十章一到二十節。五十章跟五十一章，這兩章都是論到巴比倫的信息。從四十六章到五十一章，總共六章裡面。前面已經有四章，論到了其他的九個國家或民族。而最後的兩章，留給了最重要的巴比倫。我們會看見這個巴比倫他是
32.79	60.986	上帝手中管教列國的工具。但他們後來非常的猖狂。把自己當作是神。因此呢。神就給他們審判。讓他以前坐在別人身上的。通通奉還給他。而且他所受到的審判也是最嚴厲的。我們來看第50章。耶和華藉先知耶利米論巴比倫和迦勒底人之地所說的話。
61.937	91.396	你們要在萬國中傳揚報告。樹立大旗要報告不可以瞞說。巴比倫被攻取。彼勒蒙羞。米羅達金黃。巴比倫的神像都蒙羞。他的偶像都金黃。在耶利米的時代。說。要在萬國中都傳揚報告。巴比倫會滅亡的。這一個信息。對那時候。這個聲勢如日中天。
92.568	115.449	的這個巴比倫來講。大家覺得這怎麼可能。但是呢。神的信息已經出來了。不然。這個貝魯七十年。這個信息。怎麼可能會實現呢。因為。原本一切都在。神的掌握之中。那彼勒呢。他的意思就是主人的意思。彼勒呢就是巴力。
116.51	143.518	米羅達他是這個巴比倫最主要的神明另外一個翻譯叫馬爾杜克而這些巴比倫的神明都會失敗、羞愧第三因有一國從北方上來攻擊他使他的地荒涼無人居住連人帶牲畜都逃走了從北方也會有毀滅的信息連到巴比倫
144.411	167.402	50章跟51章用了很多這種﹐對比的手法。就是以前﹐怎麼樣來描寫巴比倫﹐成為眾人的刑罰﹐成為列國的審判。在50章跟51章論到﹐巴比倫末後的命運的時候﹐也會一樣喔。他以前怎麼樣對別人﹐現在神就讓﹐
168.08	195.738	別人怎麼樣對他。以前他是大家從北方來的審判。他自己以後也會面臨從北方來的審判。那指的就是波斯、馬代。馬代就是在北伊朗。然後波斯是在南伊朗。那這個巴比倫是在南伊拉克。因此所講到的從北方上來攻擊他的指的就是馬代和波斯。
197.381	211.236	第四節耶和華說當那日子那時候﹐以色列人和猶大人同來﹐誰走誰哭尋求耶和華他們的神。當巴比倫被審判的時候﹐也就是貝魯70年期滿的時候﹐
212.073	234.729	以色列人跟猶大人都要歸回因為神感動取代巴比倫帝國的波斯帝國他採取的宗教寬容政策將這些被巴比倫還有更早之前被亞述所俘虜到兩河流域地區的許多國家的國民他都放他們自由讓他們可以回去
235.367	252.73	那這時候就應驗了70年貝魯歸回的預言。而百姓們在一個感恩裡面﹐誰走誰哭﹐要回到耶路撒冷。他們必訪問錫安﹐又面向這裡說﹐來吧﹐你們要與耶和華聯合﹐為永遠不忘的約。
254.411	283.282	他們在那時候要與神﹐重新訂新的約。是永遠不會忘記的約。其實神從來沒有忘記過他們。我們已經講過很多次了。整個耶利敏蘇的時代的神學氛圍。就是生命祭神學。所謂的生命祭神學講的就是西乃山之約。上帝將以色列人從埃及救出來。在曠野的時候。在西乃山那邊與他們立約說。你們如果願意聽從我的話語。
283.746	291.198	我就願意做你們的神。你們就可以做我的百姓。這是我與你們所立的約。我們所說的舊約。
292.756	319.82	那在這個約西亞王他整理聖殿的時候他發現了這個律法書就是約書他沒有讀過聖經耶所以那時候呢他的部下沙番念這個律法書給他聽的時候哇!約西亞就哭了就撕裂衣裳就說我終於明白為什麼我們國家搞成現在這麼辛苦的地步就是因為我們沒有跟神守這個約我們按照約裡面的規定
320.52	349.204	如果順服神的話語而行﹐就得祝福。如果違背神的話語﹐偏偏要去作惡﹐就必受咒詛。我們就是被咒詛了。因此約西亞才帶領百姓﹐與神重新立約。這就是那個時候的主流神學氛圍。耶利敏的整個神學﹐也是在講這個概念。再次與神立約﹐雖然百姓都不聽。第六節﹐我的百姓做了迷失的羊﹐牧人使他走的岔路﹐
350.35	373.492	使他們轉到山上,他們從大山走到小山,竟忘了安歇之處。百姓遠離神,而牧羊人就是這些失職的國王先知祭司領袖。他們更糟,他們沒有把百姓帶回來,反而帶頭把百姓也帶走了。所以他們就到流浪的地方,遠離了安歇之處。
374.462	385.152	凡遇見他們的﹐就把他們吞滅﹐敵人說﹐我們沒有罪﹐因為他們得罪那做公益居所的耶和華﹐就是他們獵主所仰望的耶和華。
386.135	412.038	當然上帝藉由仇敵的手來管教審判祂的百姓。但是這些仇敵的國家﹐對待他們的方式﹐對待以色列跟猶大方式﹐是非常殘忍的。所以他們也會被神審判。雖然他們被審判的時候﹐他們會狡辯說﹐我們沒有罪啊﹐是你自己得罪你的神﹐神派我們來管教你。但是他們做得太過分﹐也太過頭。
412.398	437.443	顯出他們邪惡的本質。他們也必被神審判。我明啊。你們要從巴比倫衝逃走。從迦勒底人之地出去。要向羊群。要向羊群前面走的公山羊。巴比倫會被審判。所以呢。神的百姓要逃出去。逃出去很像那個羊圈被打開。
438.968	463.75	公的羊會率先衝出來那樣,急切的要離開貝魯之地,要歸回到他們的安息之所,就是耶路撒冷。第九節,我必激動聯合的大國從北方上來,攻擊巴比倫。他們要擺正式攻擊他,他必從那裡被攻取。他們的劍好像散射之勇士的劍,一支也不突然返回。
465.196	492.911	會有其他的這些國家興起。他們會聯合起來攻擊巴比倫。那我們印象最深刻的當然就是馬代跟波斯的聯合王國。他們箭無須發。他們所發射出去的每一支箭都要擊殺巴比倫的軍兵和百姓。第十節加勒底必成為略物。凡擄掠他的都必心滿意足。這是耶和華說的。
493.865	505.903	搶奪我產業的﹖你們應歡喜快樂﹖且向踹鼓灑歡的母牛賭﹖又向發私生的壯馬。搶奪一和華產業的﹖
506.578	529.486	就是搶奪耶和華百姓的。就是巴比倫。你們很歡喜快樂喔。你們很像在那邊踐踏那個鼓。在踹鼓的。高很開心的母牛賭。又很像很開心。來欺負我百姓發出嘶聲的。強壯的馬。你們的母親巴比倫。就極其爆潰。
530.452	552.687	生你們的必然蒙羞。他要列在諸國之末,成為曠野和地沙漠。這些之前囂張欺負上帝百姓的巴比倫,如今要蒙羞報愧。他要列在諸國的最後一名,最後要成為荒廠。因為耶和華的憤怒,必無人居住。
553.217	581.074	要全然荒涼﹐凡經過巴比倫的﹐要受驚駭﹐又因他所遭的央﹐而恥笑他們。這些都是以前巴比倫﹐坐在列國身上的。現在列國要做這樣的事情﹐來使巴比倫羞愧。所有拉弓的﹐你們要在巴比倫的四圍擺陣﹐射箭攻擊他﹐不要愛惜箭枝﹐拼命的射就對了。因為他得罪了耶和華﹐
581.869	611.293	以前巴比倫成為上帝手中的弓箭去射擊這些獵國但是他囂張不可一世如今神要使獵國反過來攻擊他你們要在他勢為吶喊他已經投降外國坍塌了城牆拆毀了因為這是耶和華報仇的事你們要向巴比倫報仇他怎樣待人也要怎樣待他
612.21	632.646	這就是巴比倫所遭到的報應。你們要將巴比倫撒種的和收割的,收割時拿鐮刀的都檢出了。就是巴比倫再也沒有人撒種,再也沒有人去收割這些莊稼。他們個人都因害怕欺壓的刀劍,必歸回本族,逃回本土。
633.797	649.432	以色列是打散的羊﹐是被獅子趕出來的﹐首先是亞述王將他吞滅﹐後來是巴比倫王﹐將他的骨頭折斷﹐以色列和猶大先後被亞述和巴比倫擄走﹐
650.333	674.849	18節,所以萬君之耶和華ﷺ以色列的神如此說,我必罰巴比倫王和他的弟,像我從前罰亞素王一樣。亞素毀在巴比倫手中,這邊告訴我們,這也都是出於上帝對亞素的管教。當初上帝用亞素管教北國,但是亞素做了非常兇殘的事,以至於神就用巴比倫管教滅了亞素。
675.862	689.116	十九節,我必再領以色列回到他的草場,他必住在加密和巴山吃草,那邊都是草很茂盛的地方,又必在伊法蓮山上和激烈的境內,得以飽足。
690.06	708.508	耶和華說,當那日子,那時候,雖尋以色列的罪孽一無所有,雖尋猶大的罪惡也無所見,因為我所留下的人,我必赦免。這邊講到貝魯七十年之後,上帝要賜給他們一顆新的心,使他們悔改,
708.848	729.464	而回來歸向神。與神重新立約。在那時候。神赦免他們一切的過犯。以至於要尋找他們的過犯的時候。找不到了。因為神赦免他們。我們一同來禱告。主啊!我們今天看見巴比倫的下場。主我們真的是在禰面前。要謹慎、恐懼。主因為。
730.52	746.41	我們怎麼帶人﹐你也讓人怎麼對待我們。巴比倫﹐用殘忍的方式﹐對待列國﹐上帝就管教他們﹐讓他們所施行在別人身上的﹐完全的得到報應。主啊,你教導我們﹐
747.125	774.597	就算我們是禰的僕人使女﹐也不可行義過分﹐以至於犯罪。主我們都是禰手中的器皿﹐我們不可妄自驕傲﹐像巴比倫一樣。我們就算我們是對的﹐是公義的﹐我們也不可行義過分﹐以至於我們入沒了上帝的﹐榮耀、公義跟慈愛的名。謝謝主。奉主耶穌的名禱告。阿們。願神祝福大家﹐