start	end	text
4.411	6.152	弟兄姊妹平安，我們一起來思想。
6.152	32.628	列王記下第四章的第一節到第十七節第一節有一個先知門徒的妻子哀求以利亞說你仆人我丈夫死了他敬畏耶和華是你所知道的現在他死了可是有債主來要娶我兩個兒子做奴仆 以利沙問他說,我可以為你做什麼呢?
32.628	36.410	你告訴我,你家裡有什麼呢?
36.410	41.573	他說,卑女家中除了一瓶油之外,沒有什麼。
41.573	48.997	以利沙說,你去,向你眾人社借空氣泥,不要少借,回到家裡,關上門。
50.009	60.960	你和你兒子在裡面,就將油倒在所有的這個器皿裡面,倒滿了之後,就把它放到一邊。
60.960	67.346	於是婦人離開以利沙去了,關上門,自己和兒子在裡面。
67.346	72.832	兒子把器皿拿來,他就倒油,器皿都倒滿了。
73.336	78.724	一直到他對兒子說,再多拿一點給我,器皿來。
78.724	82.550	兒子說,全部都倒滿了,再也沒有器皿了。
82.550	84.854	在那時候,有就止住了。
85.879	95.141	妇人去告訴神人,神人說你去邁遊還債所剩的你和你兒子可以靠著度日。
95.141	140.549	從這個第一段經我們可以看出來先知門徒們他們大部分都可能過著貧窮的日子很像這個先知學校的創辦人以利亞一樣在經濟上就是都在過一種依靠神的信心生活 其中有一個先知門徒他過世了留下了一些債務那如今以利沙就要來幫助這個先知門徒的妻子來解決這個債務的問題 在這邊,透過油的神蹟,讓我們想起以利沙勒師父以利亞,在《列王記》上17章的時候,也行過一個油的神蹟。
140.549	154.575	祂讓一個西頓撒勒法的寡婦,讓祂的壇裡面的麵粉, 不會少,然後瓶裡面的油也不會減少。
154.575	164.802	神會每一天,讓這個壇裡面的麵,跟這個瓶裡面的油,每一天都重新被恢復。
164.802	169.546	這裡,以利沙就像祂的師父一樣,行了一個油的神蹟。
170.333	201.977	其實在第三章的下半段這邊是第四章第三章的下半段以利沙已經行過一個水的神蹟第四章的上半段行了一個油的神蹟第四章的下半段行了一個叫婦人的兒子從死裡復活的神蹟這完全對照王上十七章 上帝在预备以利亚的过程里面,让以利亚经过三个信心考验,所行出来的三个神迹。
201.977	214.021	因此,这边让我们可以看见,以利沙他接续他的师父先知的职份之后,神在他生命中,也是有给他信心的考验,和一个养成的过程。
215.930	233.214	再來我們可以來看見,這個由的神蹟裡面,神常常就是藉著我們手上還有的,或是手上能夠運用的,神就用這個做管道,使我們可以經歷祂。
233.214	237.895	因此有時候我們不要埋怨自己能夠擁有的,看起來比別人少。
238.695	294.774	很多時候就是看起來比別人少可是仍然神有給你一些恩賜、才幹、機會、恩典就要透過這少少的由神就可以供應你而且還使你有餘 就透過這少少的恩賜、才幹、資源你只要願意被神使用神就讓他源源不絕的來成就大事所以千萬不要妄自菲薄妄自菲薄不叫謙卑妄自菲薄叫小看神的恩典因此呢這個婦人和她的兒子他們跟鄰居收集了很多的器皿收集的越多他越相信神的話 祂就收集的越多,神就讓祂的油,一直救的那瓶油,一直永遠倒不完,倒不完,倒不完,直到祂們器皿全部都用完了為止。
294.774	300.397	弟兄姊妹,如果神要行這樣的恩典在你生命裡面,你願意預備多少的器皿呢?
301.237	305.620	当他们去跟邻舍借器皿的时候,别人会不会笑他们呢?
305.620	307.140	很可能会的。
307.140	312.203	想说,你只有一点点油,你要那么多器皿做什么?
312.203	317.206	很多时候,人家会认为,你是在吃人说梦话,或是说大话。
317.206	323.770	但是很多时候,我们对神有信心,我们知道我们在做什么,这才是最要紧的事情。
323.770	343.938	第八节,我们可以看见,另外一个妇人,对以利沙来祝福和帮助, 一日,以利沙走到蘇念,蘇念在以色列北邊的這個耶穌列平原,在那裡有一個大戶的婦人,有錢人的婦人,強流她吃飯。
343.938	356.687	從此以後,以利沙每次從那裡經過,就進去吃飯,就是這個有錢的家庭的這個女主人, 她就是款待神的仆人。
356.687	364.473	第九節,婦人對丈夫說,我看出那常從我們這裡經過的是聖節的神人。
364.473	368.296	我們可以為祂在牆上蓋一間小樓。
368.296	373.681	不僅如此,在其中還要安放床榻、桌子、椅子、燈台。
373.681	378.364	祂來到我們這裡的時候,就可以住在裡面來休息。
378.985	379.445	哇!
379.445	427.881	真的是設想得非常周到祂想要來接待神的仆人祂不僅以前是聽聞這個以利沙是一個神所重用的仆人而如今跟祂實際的接觸更看出祂的生命的品格以及祂的原形舉止真的跟別人給祂的評價是吻合的所以弟兄姊妹這邊可以讓我們學習到幾件事情 第一個就是書念的婦人她願意來接待神的仆人最後她就被神的仆人來祝福凡給人的就怎麼樣必有給你的 我们接待人,我们恩待别人,神就也要用各种的方式,恩待我们的需要。
427.881	432.144	所以凡给人的,就必有给你的。
432.144	494.835	第二个我们看见就是以利沙,她不仅是这个空有这样的别人对她的一个评价、风闻,而是当她实际跟别人接触之后, 跟祂接觸人就看出祂的品格祂的好行為祂是一個表裡如一的人就更贏得別人的敬重讓別人也願意來接待跟服侍這位神國的仆人 很多時候我們就要留意就是說我們可能有一些恩賜才幹可是我們在待人接物在真實的跟人家共同生活裡面是不是讓人家愈發的敬重我們還是讓人家看出我們不過是空有一些恩賜服侍的人而已但是生命品格各方面卻遠遠的夠不上這就是給我們一個很好的提醒 11節,有一天以利沙就來到那裡,就進到那個樓去躺臥。
494.835	500.780	以利沙就吩咐仆人基哈西說:「你叫這書念的婦人來。
500.780	503.383	」他就把婦人叫了來。
503.383	523.423	婦人站在以利沙面前,看起來應該是站在他房間的門口, 然後呢,所以呢,以利沙就對仆人說,你去傳話跟他說,你對他說,你既為我們費了許多心思,可以為你做什麼呢?
523.423	527.545	你向王或元帥有所求的沒有?
528.166	566.028	他回答說我在我本鄉安居無事這段對話也非常的有意思我們可以看出來在第四章裡面以利沙的服飾是非常寬廣的他 向左向右都可以服侍他可以服侍最貧窮的這個先知門徒的寡婦跟他貧窮的家庭他也可以服侍非常有錢的非常富有的這書念的婦人甚至他還跟書念的婦人說有什麼我可以祝福你的嗎?
566.028	601.242	我可以影響甚至吩咐 國王或元帥來問你做事情所以你可以看見說以利沙祂可以服侍看起來很低位的人祂也可以服侍看起來很高位的人這就是祂這個器皿向左和向右都被神擴張境界 不像祂的師父,祂的師父就比較專注在服侍這些可能比較貧窮的人,或是對抗這些國王、元帥、權貴。
601.242	606.947	但以利沙的服侍看起來就是比祂的師父面相更廣一點。
606.947	613.874	這邊在講很多以利沙所行的神蹟,對照祂師父曾經所行過的神蹟,很雷同。
614.394	649.523	因此我們整理出來就是說以利沙所行的神蹟是他師父以利亞所行的神蹟的記載上是兩倍以利亞做了七件以利沙做了十四件數量上是兩倍然後面相上也是兩倍以利沙能夠像以利亞一樣服侍卑微的族群但他跟他師父不一樣的是他也可以來服侍 甚至可以影響到，這個國王、元帥，他甚至成為列國的先知。
649.523	652.466	所以他是一個，比較寬闊的器皿。
652.466	658.071	這讓我們想到，這個他在他師父要走的時候，跟他師父求的是什麼?
658.071	668.238	他求的是， 願祢的靈,原文沒有感動兩個字,感動是中文加上去的,願祢的靈加倍在我身上。
668.238	675.063	因此呢,就變成一個double的,加倍的恩膏,加倍的姓名。
675.063	678.106	我想這個是非常難得的。
678.106	683.690	那以利斯阿就對仆人說,究竟當為他做什麼呢?
683.690	692.442	吉哈西就說,他沒有兒子,而且他丈夫也老了, 以利沙說:「好,那你叫他再來一次。
692.442	696.304	」於是就叫了他來,他就繼續的站在門口。
696.304	701.206	以利沙就說:「明年到這時候,你必抱一個兒子。
701.206	713.714	」他說:「神人,我主啊,不要那樣欺哄卑女, 妇人果然懷孕,到了那時候生了一個兒子,正如以利沙所說的。
713.714	715.475	這讓我們想起誰?
715.475	722.537	想起當初上帝應許這個撒拉明年要生一個兒子。
722.537	727.899	然後呢,撒拉就噗吱一笑,想說 不要玩弄我。
727.899	729.020	不要開我玩笑。
729.020	731.222	我這麼老,怎麼可能?
731.222	736.487	但是,這個神就真的在明年給他們一個孩子。
736.487	737.988	就跟這邊的記載很像。
737.988	741.311	弟兄姊妹透過今天的經文,給我們什麼學習?
741.311	744.054	第一,凡給人的,就必有給你的。
744.394	752.863	我們看見书念的妇人ﷺ她尽心尽力的ﷺ服侍神的仆人ﷺ为神的国度来摆上。
752.863	756.307	这个神人就一直ﷺ想要为他做一点什么。
756.307	762.573	三番两次的想办法ﷺ要来服侍他ﷺ凡给人的ﷺ就必有给你的。
762.573	813.351	我们顾念神的家ﷺ神就顾念我们的家ﷺ 透過寡婦行之門徒的婦人這件事情讓我們看見神就是會顧念我們的需要就算我們手上的油只剩最後一瓶我們手上的資源看起來沒有別人多但神 就是可以用我們手上所僅有的來祝福我們來供應我們使我們看起來手上的東西不多手上的資源不多但是在上帝手上的卻是無窮無止盡的因此不要只看你手上擁有的很少就埋怨,怨天尤人或是抱怨神不,手上擁有的多和少不重要 要相信神手上擁有的是無限的。
813.351	818.757	神若施恩於我們,我們何必在乎自己小小的手捧多少油呢?
818.757	821.880	只要神供應,這一切都不是問題了。
821.880	828.808	我們要對神有信心,要定心仰望上帝的手,而不是看自己小小的手。
828.808	829.709	願神祝福大家。