start	end	text
3.951	5.472	弟兄姊妹平安，我們一起來思想。
5.472	14.975	馬可福音第五章21節到最後,從第四章的後半段到整個第五章,總共記載了四個耶穌所行的神蹟。
14.975	25.660	那這四個神蹟的記載,都是為了馬可要問大家一個問題,就是那大家知道耶穌到底是誰嗎?
25.660	27.681	那我們繼續來看21節以後的記載。
28.541	37.626	耶穌又坐船渡到那邊去,祂又再一次的從這個加利利海的東岸坐船回到西岸去。
37.626	43.029	那就有許多人到祂那裡聚集,祂正在海邊上。
43.029	48.492	有一個管會堂的人,名叫矮魯,來見耶穌,就伏伏在祂腳前。
49.411	78.078	管會堂就是猶太人他們的聚會的這個很像我們的教堂他們叫會堂那管會堂的人通常都是在這個當地算是大家尊敬的有名望的人管會堂的人主要他的職責是安排這個安息日的講道的講員以及管理這個會堂的事務因此是非常重要的人 那有一個管會堂的人叫做艾魯。
78.078	80.559	他來到耶穌的面前。
80.559	82.260	俯伏在祂的腳前。
82.260	83.701	跪在祂的面前。
83.701	86.603	而且是再三的求祂。
86.603	87.583	為什麼呢?
87.583	90.204	祂說我的小女兒快要死了。
90.204	92.485	求祢去按手在她身上。
92.485	95.367	使她痊癒得以活了。
95.367	97.988	耶穌就和她同去。
97.988	101.550	在這邊有很多的類似的描述。
101.550	104.792	也是這個馬可慣用的一個描述的筆法。
105.452	115.319	包含說,之前在那個格拉森被鬼婦人身上,那個人去迎見耶穌的時候,也是怎麼樣?
115.319	119.262	也是去跪拜祂,然後也是再三的求祂。
119.262	124.165	這邊埃魯也是一樣,跪拜耶穌,再三的求祂。
124.165	125.947	那祂的問題是什麼?
125.947	154.862	祂的問題是祂的小女兒, 小女兒意思是說這個孩子還沒有成年快要死了他求耶穌去為他按手使他可以痊癒不要死那耶穌同意耶穌願意耶穌就和他同去在這個要往埃魯加的過程當中因為有太多的人跟隨著 耶穌並且不斷的擁擠祂。
154.862	157.663	擁擠的意思是推擠祂,因為大家都想要靠近耶穌。
157.663	161.245	所以就是場面非常的推擠。
161.245	166.347	而在這個推擠的人群當中,有一個女人患了12年的血漏。
166.347	173.450	血漏指的就是,婦女在月經的時間,一般來講,經期是七天。
173.450	174.811	七天的過程中會出血。
175.111	180.995	但是就是在出血七天之後,血仍然沒有停,還是會一直出血。
180.995	182.236	這就是一個血漏。
182.236	186.459	血漏在這個舊約的律法裡面規定是不潔淨的。
186.459	191.062	因此一個有血漏的婦人基本上是不可以出來的。
191.062	196.146	第五章上半段那個被鬼婦人一樣,她也是不潔淨的。
196.146	198.228	所以第五章就在講這些不潔淨的。
199.189	202.211	包含待會兒那個挨戮的女兒會死。
202.211	206.974	他女兒死的時候是屍體也是不潔淨的。
206.974	212.638	第五章就是記載了耶穌釋放了医治的復活了三個不潔淨的人。
214.462	242.702	那二十六節告訴我們說這個患了十二年血肉的婦人在好些就是許多的醫生手裡受了許多的苦而且又花盡了他所有的錢財積蓄但卻一點也不見好轉而且病逝反而更加的嚴重因此他真的是走投無路但非常的感謝神弟兄姊妹常常人的盡頭就是神的啟頭 二十七節他聽見耶穌的事情。
242.702	243.843	耶穌什麼事?
243.843	246.447	耶穌趕出污鬼。
246.447	248.149	耶穌醫治疾病。
248.149	252.154	耶穌解決我們生命中重大的關鍵的困難。
252.154	256.640	祂用祂的權柄施行拯救在這些可憐的百姓的身上。
257.346	263.135	因此呢,他就從後頭來,他本來是什麼叫後頭?
263.135	270.826	他原本可能是在人群的後面,因為他不敢過去,因為他是不潔淨的人。
271.800	293.819	因為他不潔淨所以他靠近人他碰到的人也會不潔淨所以他受這個律法的約束他不敢去可是他很想被醫治因此他本來從他在外圍他就從後頭往裡面 也夾雜在眾人中間,要去摸耶穌的衣裳。
293.819	298.483	他的心裡面的想法是說,我只要摸祂的衣裳,就必痊癒。
298.483	305.729	我想這也是每個人擁擠耶穌,要去摸耶穌的原因。
305.729	315.717	二十九節,因此當他摸到耶穌的衣服的時候,於是他血肉的源頭立刻乾了,他便覺得身上的災病好了。
316.869	338.472	這麼多人在摸耶穌的過程中,我們看見這一位婦人,她用她信心的行動,她從人群的後頭,她用她一個僅存的,想要從神那邊得到醫治的一種這麼微小的信心,她終於勇敢的衝進人群,然後去摸到耶穌。
339.753	343.797	他就覺得,感覺到他身上的疾病好了。
343.797	346.119	三十節,而耶穌這邊呢?
346.119	353.285	耶穌也頓時心裡面,覺得有能力,有醫治的大能,從自己的身上出去。
353.285	358.690	就在眾人中間轉過來說,誰摸我的衣裳呢?
358.690	361.413	那這個問題讓他的門徒覺得很可笑。
361.413	372.512	三十一節,門徒就對耶穌說, 你看眾人都擁擠你推擠你都在摸你你還說誰摸我這不是很奇怪嗎?
372.512	374.232	耶穌你怎麼問這個問題?
374.232	383.157	但耶穌沒有理會門徒三十二節耶穌就停下來周圍觀看記得這時候旁邊有一個很著急的人叫什麼名字?
383.157	398.967	叫做管會堂的埃魯那原本耶穌是跟著他要去他家拯救他快要病死的小女兒這時候耶穌竟然停下來 問說誰摸我,而且還停下來,視為觀看。
398.967	404.431	要看到底做這件事情的這個人是誰。
404.431	415.799	那33節,這女人知道在自己身上所成的事,就恐懼戰驚,來伏伏在耶穌的跟前,將實情全告訴她。
415.799	418.641	耶穌就對她說,女兒,你的信救了你。
419.121	424.803	平平安安的回去吧,你的災病痊癒了。
424.803	427.465	这边让我们可以思想一件事情。
427.465	433.487	在福音书里面我们看见,耶稣祂没有问题,祂是百分之百的神子。
433.487	437.449	但祂也没有问题,祂是道成的肉身,百分之百的人子。
438.029	441.010	祂是完全的神也是完全的人。
441.010	465.544	我们在福音书里面看见有时候耶稣会去祂自己会去限制祂自己的神性的一些能力例如说祂有时候会不知道一些事情所以我们其实不太知道耶稣 觉得祂身上有医治的能力涌流出去的时候,祂知不知道是那个女人摸了祂。
465.544	478.636	就包含说,我们看见耶稣在第四章的时候,他们从加利利海的西岸,经历千辛万苦,甚至差一点船都沉了。
479.377	482.539	然後耶穌在船上是累到都睡著。
482.539	487.262	耶穌祂從西岸渡到東岸是付這麼大的代價。
487.262	491.564	祂到東岸去的時候釋放了那位格拉森被鬼附的人。
491.564	493.826	這個問題也是值得我們思考。
493.826	506.235	如果耶穌祂這個 知道祂是要去這個東岸,只是為了要去釋放一個被社會遺棄的人。
506.235	514.046	然後因此這個船還差點,船在半途中還差點滅頂,而且耶穌服侍一整天是這麼疲憊。
514.787	519.089	就更顯出耶穌的憐憫是何等的大。
519.089	527.975	那但是因為我們不太知道耶穌到底知不知道祂去東岸就是為了要去釋放這個格拉森被鬼附的人。
527.975	529.596	我們是不知道的。
529.596	538.901	也就是說其實很多時候我們不太能夠確定耶穌祂在那時候有沒有限制自己的神性的一些能力。
538.901	540.942	那我們繼續回來看第35節。
542.708	544.269	還說話的時候。
544.269	548.332	有人從管會堂的家裡來。
548.332	549.373	這個人是富庶。
549.373	552.936	就是有一些人急急忙忙從矮乳的家裡那邊過來。
552.936	554.657	說你的女兒已經死了。
554.657	556.038	何必勞動先生呢?
556.038	557.199	哇!
557.199	561.061	看起來好像耶穌被這個血肉的婦人耽擱了時間。
561.061	562.442	以至於趕不及。
563.302	565.904	回去救這個埃魯的女兒。
565.904	578.252	因此,當耶穌一聽到這些人說這樣的話給埃魯聽的時候,耶穌在埃魯還沒有反應過來的時候,耶穌立刻就對管會堂的埃魯說,不要怕,只要信。
579.053	594.331	我們可以看一下,其實整個第四章的後半段跟第五章的全部,這四個神蹟的故事,懼怕、害怕,都是它的一個重複出現的關鍵字。
594.331	597.094	但是懼怕跟害怕有不一樣的意思。
597.875	609.122	一個是,不知道耶穌是誰,以至於看見耶穌做的偉大奇妙的事的時候,更加的害怕耶穌。
609.122	619.028	第二個是,單純的信心信靠神,以至於經歷了耶穌所行的大事的時候,就更加的敬畏神。
619.028	621.189	這是兩種不同的懼怕。
621.189	625.492	在這個時候,耶穌就用命令句,不要怕!
626.749	630.752	只要信,對艾魯的信心說話。
630.752	635.355	艾魯這時候可能就是,信心可能就是會受到很大的打擊。
635.355	643.640	那但是耶穌就立刻鼓勵他的信心,讓他敬畏神,相信神,倚靠神,不要懼怕。
643.640	653.206	因此在這個時候呢,耶穌就37節就帶著彼得、雅各跟這個雅各的兄弟約翰同去,不許別人跟隨他。
654.309	718.054	很可能就是這個艾魯的家裡面可能也不容許這個帶那麼多群眾跟祂的門徒過去那當然也可能包含事情緊急因此耶穌就快速的過去那就帶了幾個祂最親近的門徒就是彼得、雅各還有這個約翰那就到了這個38節來到管會堂的家裡耶穌看見那裡 以色列人的習俗是這樣,就是你家裡再窮, 你家裡再窮,不管你家裡有多窮,只要有人死了,最少都要找一個專門幫人家死人哭泣的女人,有一種職業專門幫死人哀哭的人。
718.054	720.616	你家再窮,你也要去找一個這樣的女人來哭。
721.988	746.427	而且最少也要再找另外一個找一個吹那個吹號手來吹那個喇叭吹號然後來這個表達這個哀泣悲痛那到艾魯家裡面的時候發現已經這個家屬已經請了不少哀哭的人來也請了不少的吹號手來但是耶穌說你們為什麼吵吵鬧鬧呢?
746.427	752.536	這個孩子不是死了這個孩子只是睡著而已 他們就嘲笑耶穌說。
752.536	754.477	這個耶穌在講什麼。
754.477	756.598	明明就死了。
756.598	759.179	接下來耶穌就把他們都全部撵出去。
759.179	761.139	把他們全部趕出去。
761.139	764.701	就帶著孩子的父母和跟隨祂的人。
764.701	767.242	進了孩子所在的地方。
767.242	770.463	孩子這時候已經被當作屍體處理了。
770.463	774.345	耶穌就拉著已經死掉的孩子的手。
774.345	776.206	記得祂已經死了祂就是不潔淨。
777.466	781.449	耶穌祂才不管什麽捷徑不捷徑。
781.449	795.300	耶穌祂讓那個雪洛的婦人摸,耶穌祂釋放被鬼附的人,還記得之前耶穌也曾經摸了一個長大麻瘋的人,大麻瘋也是不捷徑。
795.981	800.422	耶穌都很愛他們,因此耶穌才不管這些。
800.422	807.925	在這邊也是耶穌就摸了這個屍體,拉了這個小女孩的手,對她說,大力大鼓勵。
807.925	813.186	這是雅蘭文,翻出來的意思就是,閨女,我吩咐你起來。
813.186	815.427	那閨女呢,就立刻怎麼樣起來?
816.254	818.575	他們就大大的驚奇。
818.575	819.875	代表誰?
819.875	825.077	這個閨女的父母,跟這個耶穌的門徒,他們就大大驚奇。
825.077	829.579	每次耶穌行神蹟,旁邊人反應就是大大的驚奇。
829.579	838.822	然後呢,閨女已經十二歲了,耶穌就切切的囑咐他們,不要叫人知道這事,又吩咐給這個閨女東西吃。
840.128	842.770	這邊有講到所謂的彌賽亞的秘密。
842.770	849.095	耶穌不太希望大家﹐總是把焦點放在﹐耶穌所行的神跡啟示上。
849.095	857.561	也不希望因此而引來﹐法利塞人或宗教領袖﹐這個又來強烈的對抗祂。
857.561	866.048	因為耶穌還希望﹐能夠把握更多的機會跟時間﹐來向更多的人傳揚這個神國的﹐彌賽亞福音。
866.048	867.929	我們一起來禱告。
867.929	873.274	主在祢裡面沒有﹐ 啊,這個,耽擱。
873.274	875.075	主祢不是不務事的神。
875.075	882.339	我們看見,主啊,就算耶穌在去矮乳的家的路上,有事情,啊,耽擱了。
882.339	887.121	啊,就算,啊,小女孩因此死了。
887.121	890.063	但是主啊,在祢沒有務事。
890.063	892.624	主,在祢也沒有難成的事。
892.624	896.647	主,願祢常常,像祢吩咐矮乳一樣,吩咐我們。
897.466	900.930	就是說,不要怕,只要信。
900.930	910.940	主讓我們遇到生命的風浪的時候,遇到生命的變故的時候,主啊,你就立刻對我們說,不要怕,只要信。
910.940	912.682	讓我們專心依靠祢。
912.682	915.344	謝謝主,奉主耶穌的名祷告。
915.344	916.145	阿們。
916.145	917.427	願神祝福大家。