start	end	text
18.387	23.428	弟兄姊妹平安，我們繼續按照《美日言經》詩意的進度,繼續來思想。
23.428	28.549	《歷代志上》第28章,來看大衛建造聖殿的計畫。
28.549	45.353	大衛就召聚以色列各支派的首領和倫班服侍王的君長與千夫長、百夫長,還有掌管王和王子產業、牲畜的,並太監以及大能的勇士都來到耶路撒冷。
46.271	71.323	剛所念到的這些人在前面幾章大衛都已經讓他們的服事能夠分成不同的班次而且每個人都在他應該服事的崗位上盡忠職守我們可以看見大衛是一個領導統一跟管理方面的長才 那如今大衛特別把這些他所設立的領袖們都聚集在伊路撒冷,要做什麼呢?
71.323	98.679	第二節,大衛王就站起來,對他們說話,他說:「我的弟兄,我的百姓啊, 大衛就首先來稱呼這些領袖說,你們是我的弟兄,你們是我的百姓,你們當聽我言,我心裡本想建造殿宇,安放耶和華的約櫃,作為我神的腳凳, 什麼意思呢?
98.679	121.399	就是說我本來心裡面有為神建造聖殿的這樣的一個心意因為我們把約櫃從外地營到了耶路撒冷不應該只是把它放在我臨時搭建的帳篷裡面所以我想為神蓋一個聖殿來安放約櫃 作為我神的腳凳。
121.399	122.239	什麼叫腳凳呢?
122.239	130.364	以前的國王坐在寶座上,寶座下面讓國王放腳的,就是叫腳凳。
130.364	140.510	所以國王要坐上寶座之前,他會先踩在那個腳凳上,然後再坐在寶座的椅子上。
140.510	154.961	所以呢,他告訴我們一個觀念, 為神所蓋的聖殿,不過是上帝寶座前的一個腳凳而已,因為天地之大根本就容不下偉大的耶和華。
154.961	168.872	小小的聖殿只是上帝垂聽那些願意真心悔改的人的禱告跟獻祭的地方,神就願意與真心悔改的人同在,那才是聖殿真正的意思。
170.026	183.219	然後這邊說,我已經預備建造的材料,只是神對我說,你不可為我的名建造電雨,因你是一個戰士,流了人的血。
183.219	195.059	不是說大衛比較倒楣,因為他是一個戰士,然後打敗敵人、殺敗敵人, 所以他比較倒楣,就不可以來擔任建造聖殿的工作。
195.059	208.180	是有兩個原因,第一個,因為他的手沾染了敵人的血, 他就成為一個在禮儀上﹐或是律法上﹐守不潔淨的人。
208.180	214.381	那守不潔淨﹐就不能用這個不潔淨的守﹐為聖潔的神蓋一個聖殿。
214.381	224.784	第二個我們也提到﹐那時候的近東地區﹐其他的國家﹐民族﹐他們的神廟﹐都是蓋得很誇張﹐很大這樣子。
224.784	311.279	就是要表達說﹐我們之所以能夠把敵人殺敗﹐ 打聖仗就是因為我們的神很猛很厲害所以外邦人基本上他們的神廟就是要來證明他們能夠打敗或是擄掠仇敵是因為我的神很勇猛的緣故可是以色列人祂的聖殿重點不是這一個重點是神願意跟真正遵守祂誡命在祂面前謙卑悔改禱告人同在 的一個地方所以以色列人強調是神願意與謙卑悔改的人同在而不是要去誇張說我的神有多厲害所以我的聖殿要蓋得多大多輝煌這樣子第四節然而耶和華以色列的神在我父的全家前選我做以色列的王直到永遠 這邊談到就是當大衛想要為上帝蓋一個聖殿但是這個上帝告訴大衛說你的好意我心領了因為呢我拣選你你最主要的使命還不是幫我蓋聖殿而是要帶領我的百姓你要做好國王要做好榜樣帶領他們都真心真意的來侍奉我 不要犯罪。
311.279	315.582	因此這個是上帝拣選他的一個目的。
315.582	319.084	神說謝謝你顧念我的家的需要。
319.084	326.308	因為聖殿,這個殿這個字,其實它的希伯來文就是房子的意思,也就是家的意思。
326.308	334.073	所以你顧念我的家,我就更顧念你的家,以及你世世代代的家。
334.073	384.972	所以上帝主動跟大衛立了一個大衛之約, 就是要讓你還有你的後代世世代代你的父親你的全家都要來侍奉我做君王帶領百姓來敬拜我 因他拣選尤大為首領,大衛明白因為在雅各為他的十二個兒子來祝福的時候,讓君王的權柄是賞賜給第四個兒子尤大,所以大衛就更加的知道,其實神在很久以前就拣選了尤大支派來做君王領袖, 但是呢,他說在猶大制派中,拣選我的父家,在我父的眾子裡面喜悅我,令我做以色列眾人的王。
384.972	397.502	大衛他很卑微,他知道就算拣選的是猶大制派,也輪不到他的父家,更輪不到他父家裡面最小的兒子,大衛。
397.502	400.705	因此他是卑微的,但神卻拣選他。
401.305	410.285	第五節,耶和華賜我許多兒子,在我兒子中拣選所羅門做耶和華的國尉,治理以色列人。
411.442	425.709	大衛也再次告訴他的臣僕百姓,並不是因為我偏心誰而立他做國王的王儲,而是因為出於耶和華的啟示跟簡選。
425.709	438.255	我們在其他的經文裡面也看見,就是神從這個所羅門出生就非常的喜悅他,所以那時候神就已經簡選他,大衛也知道這件事情。
439.787	451.231	第六節,耶和華對我說,你兒子所羅門必建造我的殿和怨語,因為我拣選他做我的子,我也必做他的父。
451.231	458.394	他若恒久遵行我的誡命典章,如今日一樣,我就必堅定他的國位直到永遠。
458.814	530.895	在大魏之前的掃羅王朝以及掃羅王朝之前的三四百年的士師紀時代基本上沒有什麼哪一個領袖他能夠很順利的把他的領袖的位置傳給他的下一代甚至是下一代的下一代 所以當上帝主動跟大衛立了這個大衛之約要讓他跟他的世世代代都做君王來帶領百姓服侍神這是一個從來沒有發生過的事情所以大衛覺得非常的感恩所以他知道一件事情神在大衛死掉之後神要代替大衛 做所羅門的父親親自來教導他來引導他甚至當所羅門犯罪犯錯的時候上帝也會代替大衛做父親來管教他使他歸正這樣子才可以讓這個大衛之約一直存續下去讓大衛的後代都可以坐在國王的位置上帶領百姓敬拜上帝第八節現今在耶和華的會中以色列眾人眼前所說的 我們的神也聽見了。
530.895	536.719	代表我現在跟你們所說的不是假的,真的都是出自於神吩咐我的。
536.719	544.446	所以,不僅你們聽見了我所說的,神現在在我們當中也聽見我所說的句句屬實。
544.446	556.656	你們應當尋求耶和華你們神的一切誡命,謹守遵行,如此你們可以承受這美地,遺留給你們子孫永遠為業。
557.312	585.168	大衛剛剛講到上帝主動與他立了大衛之約關乎他和他世世代代的子孫可以永遠做國王的位子帶領百姓敬拜神大衛也對他的臣僕說你們自己也要跟我一樣要來遵行神一切的誡命謹守遵行 這樣,你們才可以真正的得地為業,而留給你們的子孫永遠為業。
585.168	592.413	所以不論是王家還是臣僕的家,其實都是要謹守遵行神的誡命。
592.413	596.735	不要忘記,這個地方以前不是我們住的,是誰住的?
596.735	598.036	迦南人住的。
598.036	642.803	神曾經給迦南人四百年的機會,讓他們悔改, 可是迦南人沒有把握這個機會所以400年之後亞伯拉罕的子孫他們就離開埃及進入曠野最後得地為業把迦南人趕出去了所以如果我們像迦南人一樣不遵行神的旨意每天行惡那完蛋了我們的下場也會像迦南人一樣被神趕出去第九節大衛就來鼓勵他的兒子所羅門 你當認識耶和華你父親的神,誠心樂意地侍奉他,因為他見察眾人的心,知道一切心思意念。
642.803	645.224	這是大衛的親身的經驗。
645.224	657.468	不論大衛心中那時候所存的是愛神的心意,還是他所存的是犯罪的心意,神一一都知道、都見察他的心,讓他根本無所隱藏。
658.712	661.713	你若尋求祂,祂必使你尋見。
661.713	667.234	你若離棄祂,祂必永遠丟棄你,你當謹慎。
667.234	673.776	因耶和華拣選你建造殿宇作為聖所,你當鋼牆去行。
673.776	684.419	大衛他深知他那時候離棄耶和華,結果他就讓他自己跟他的家陷入可怕的懲罰裡面。
685.043	779.689	他再一次交代所羅門不要忘記了神拣選你來建造殿宇作為聖所所以你自己在神的面前要遵行神的話語成為一個聖潔的器皿所以你要剛強遵行神的話語去行十一節大衛將殿的遊廊、棚屋、府庫、樓門、內殿和施恩所的樣式 指示祂的兒子所羅門,又將被靈感動所得的樣式,就是耶和華殿的院子、周圍的房屋、殿的府庫和聖物府庫的一切樣式都指示祂,又指示祂祭司和立位人的班次, 與耶和華殿裡各樣的工作並耶和華殿裡一切器皿的樣式以及各樣應用金器的分量分量就是重量和各樣應用銀器的分量 這邊大衛說我現在告訴你所羅門一切的這一些藍圖包含聖殿以及聖殿周遭的所有的這一些建築的藍圖都是聖靈感動我的樣式 而且不僅是這些硬體的藍圖,包含軟體,就是祭司、立位人,他們的班次,他們各樣的工作,以及這個聖殿裡面以後,該有哪一些器皿的樣式。
779.689	787.494	他們如果是用金子或是銀子做的時候,他們的分量,就他們的重量,應該是多少。
787.494	791.497	這都是聖靈感動我的,所以我現在要把它告訴你。
792.363	817.706	包含十五節他繼續講還有金燈台跟金燈的分量銀燈台和銀燈的分量輕重各都合宜橙色丙金桌子的分量銀桌子的分量這邊讓我們看見大衛 他也得到聖靈的感動,增加了一些例如銀燈台、銀桌子,要擺放在聖殿裡面。
817.706	831.440	17節,金金的肉叉子,盤子和蕨的分量,各個金碗跟各個銀碗的分量, 還有金香檀的分量，並用金子做的基路帛。
831.440	835.684	原文叫做用金子做車子樣式的基路帛。
835.684	839.667	就代表說好像約和華是駕駛著天使基路帛。
839.667	845.031	好像駕著車一樣來尋行他所創造的各地。
845.031	850.715	基路帛張開翅膀遮掩約和華的約櫃。
850.715	893.897	我們不是很清楚利太斯的作者是不是想告訴我們 大衛交代所羅門要將這個原本約貴上面的基路博再重新打造或是是不是有這個意思我們不是很確定但是因為我們看到大衛 他主動加了銀燈台、銀桌子還有一些其他的東西所以也有可能這個是大衛吩咐所羅門以後要將約會上面的二紀錄伯的部分是不是要做一點改變這個我們不是很確定 十九節大衛說這一切工作的樣式都是耶和華用手畫出來使我明白的。
893.897	909.109	大衛講得很生動他說我就好像看見這是耶和華他自己用手畫出來給我看的所以你要像摩西一樣 摩西他從神的名領受,繪木該怎麼製作?
909.109	911.550	繪木裡面所有的東西該怎麼製作?
911.550	918.875	它的尺寸、它的大小、它的材質,他就吩咐以色列人都照辦,這樣神就會喜悅。
918.875	932.904	今天也是,大衛說,我現在像摩西一樣,所以我從神的名所領受的聖殿裡面的各種的軟體硬體的規格,我就是告訴你,你就是照做就對了,這樣子就能夠討神的喜悅。
933.729	945.574	二十節,大威又對他的兒子所羅門說,你當鋼牆壯膽去行,不要懼怕,也不要驚慌,因為耶和華神就是我的神,與你同在。
946.391	974.484	這邊讓我們想到這個摩西交代這個約書亞也是一樣的交代我們想起約書亞記第一章1到9節那邊就是要約書亞剛強壯膽不要懼怕然後遵守神所吩咐的神就必與你同在不會撇下你 然後他說,祂必不撇下你,也不丟棄你,直到耶和華殿的工作都完畢了。
974.484	988.689	大衛勉勵,這個所羅門不要懼怕,不要看建造聖殿的工程好像很困難,你只要專心服侍神,神會給你聰明、智慧跟資源,還有好幫手,祂不會撇下丟棄你的。
989.531	1019.411	直到耶和華的殿的工作都完畢了二十一節有祭司和立位人的各個班次為要辦理神殿各樣的事不要害怕我也把人手都幫你安排好了也分了班次他們會人人都有機會輪班的來跟你一起服事建造聖殿而且又有靈巧的人在各樣的工作上都樂意幫助你 並有眾首領和眾民一心聽從你的命令。
1019.411	1024.935	不是你一個人挑起這個困難的重擔,是全民總動員。
1024.935	1029.138	他們會一起來協助你,完成建造聖殿的工作。
1029.138	1032.920	所以你當鋼強壯膽去執行,不要懼怕。
1032.920	1043.666	我們可以看見在歷代至上的第28章裡面, 大衛是先教導所羅門心中正確服侍神的態度。
1043.666	1049.108	態度講完,才交代他建造聖殿的進度。
1049.108	1060.552	我們今天很多時候講求的是這些服侍的外在的東西,這些進度啊,人數成長的進度啊,或是教會硬體工程的進度。
1060.552	1064.534	但是其實是應該先從態度裡面先講究,備神調整。
1064.974	1072.061	先講態度,再講進度,這樣神必不丟棄我們,直到耶和華殿的工作完成。
1072.061	1073.482	我們一起來禱告。
1073.482	1075.684	謝謝主,真的是幫助我們。
1075.684	1079.248	凡事先有敬畏你的心,你就與我們同在。
1079.248	1085.552	先調整我們內心的態度, 再來提我們建造工程的進度。
1085.552	1101.661	願神鼓勵我們,人人都像大衛所說的,人人都被你調整態度,以至於就能夠長長久久在神面前蒙恩,並且得著事奉神的機會,就一起來建造教會、建造聖殿,奉主耶穌的名禱告。
1101.661	1102.521	阿們。
1102.521	1103.602	願神賜福大家。