start	end	text
3.66	30.254	弟兄姊妹平安，我們一起來思想。民宿記第八章的第五節到最後。我們在第七章的時候回顧了之前摩西他們把會幕整個支搭起來之後十二支派他們每一天都輪流來獻上他們的禮物討神的喜悅。所以在第八章這邊第五節以後要開始談到
30.947	59.251	以色列人。他們把另外一個禮物。來奉獻給神。就是他們把利未人。當作獻祭。當作活祭。來獻給神。分別為聖。討神的喜悅。我們來看一下。第五節。耶和華小喻摩西說。你從以色列人中。要選出利未人來。潔淨他們。潔淨他們。當這樣行。
60.077	88.625	第一,用除罪水彈在他們的身上。又叫他們用剃頭刀刮全身。然後洗衣服、潔淨自己。我們之前在立位記第八章的時候也看到祭司要就任的時候也要進行這個分別為聖之禮。那我們這邊看到立位人要被獻為活祭
89.172	116.335	給神的時候祂也有一些要求但是這些要求跟這個祭司的部分不太一樣像這個除罪水彈在他們身上就代表怎麼樣使他們罪得潔淨然後用這個剃頭刀刮掉全身的毛髮代表怎麼樣代表這個之前祭司也沒有這樣做他們要洗衣服潔淨自己
117.227	146.828	祭司則是直接換全新的衣服來服侍所以有一點不太一樣但是呢意義是一樣的也就是說這些要獻給神的祂們都是需要聖結的弟兄姊妹我們所獻給神的一切不論是包含你獻給神的金錢你獻給神的禱告你獻給神的恩賜才幹這一切你所獻的其實都在代表你自己
147.585	170.775	這是舊約獻祭的意義。所以你獻的時候是隨隨便便挑那個爛的、比較次好的給神。其實在代表你跟神說我就是爛爛的、我就是次好的。所以獻祭的意思是怎麼樣?把最好的獻給神。因為那個最好的就是代表你自己。
171.681	185.719	那神其實最喜悅我們獻給祂的祭物,是什麼呢?就是聖節的祭物。因此我們獻祭的時候,總是要反省自己,我們有沒有過一個聖節的生活,討主的喜悅。
186.237	210.848	如果我們不聖結,我們就算獻,世人眼中再好的禮物給神,神都不要,因為神是聖結的神。我們獻給祂汙穢的東西,或是我們獻祭者是一個汙穢的態度,那神收了這個汙穢的東西,那會玷汙祂自己的聖結,祂當然不會收喔。第八節,然後叫他們取一支公牛賭。
211.732	241.273	並同獻的戍祭除了公牛賭之外還要獻戍祭戍祭就是這些農產品穀物就是非肉類的就是調油的細麵你要另取一支公牛賭做贖罪祭將立位人奉到會幕前然後要召聚以色列權會眾然後呢將立位人奉到耶和華面前以色列人要按手在這些立位人的頭上
242.108	270.133	雅倫也將這些立位人奉到耶和華面前,為以色列人當作謠記,使他們好辦耶和華的事。這邊講到按手在他們頭上,讓我們想到在立位記裡面講到要獻動物,然後把這些動物殺了,獻給神的時候,是這個要把手按在這些動物的頭上,
271.118	299.046	所以按手代表什麼?傳遞也代表身分認同什麼意思呢?第一個按手代表把祝福或能力傳遞給被按手的人或是代表把咒詛或罪傳遞過去同時也代表把我的身分傳遞過去所以我按手在他上面代表我認同他就是說他代表我因此呢當以色列人
299.701	321.72	按手在立位人的頭上的時候就代表什麼?代表立位人就代表我們所有以色列的長子。我們要把祂當作活祭,獻給神。祂們就是代表我們的身分。從今以後祂們是給神使用的,要為耶和華辦事的。
322.432	351.08	然後祂們為以色列人祂們替以色列人當作搖祭我們之前也談過搖祭通常跟祭司或是服侍神的職份有關所以代表什麼就是說祂們是要獻給神被神使用的我們繼續往下看12節利未人要按手在那兩隻牛的頭上
352.91	372.258	剛剛是以色列人暗守在利未人的頭上,把他們當作活祭獻給神。因為以前在出埃及的時候,原本上帝是要擊殺這個長子,不僅是要擊殺埃及人的長子,
372.927	401.772	理論上﹐以色列的長子﹐也需要被擊殺。因為長子呢﹐他就好像是這個家庭的代表。所以呢﹐擊殺長子就是有點像說﹐是長子呢﹐他是一個代受處罰的長子。所以呢﹐處罰長子﹐就如同處罰你們全家。但是呢﹐神憐憫以色列人﹐所以就吩咐以色列人說﹐如果你們願意﹐
403.2	427.073	承認自己有罪,接受我的赦免。那你們就殺一隻帶罪羔羊替你們死。然後把這個帶罪羔羊的血,塗在你們的門框上。所以那天晚上,神拆拍滅命審判的天使,要來擊殺全地的長子的時候。因為長子,就是代表他們那一家要接受懲罰,接受罪的審判。
428.456	457.877	經過以色列家的時候,看見已經有戴罪羔羊,替他們受處罰而死。那血在他們的門框上的時候,他們就越過,逾越過這些以色列人家,只去擊殺那些沒有戴罪羔羊替他們死的,這些埃及人家,擊殺他們的長子。所以呢,這些長子呢,基本上,他們算應該已經死了。他們不可以再為自己活。
458.217	486.142	他們要歸耶和華為聖。他們從今以後,不再為自己活,只為耶和華而活。因為他們是屬耶和華的。他們理論上在世界上已經死了。所以長子不再為自己活,而長子又代表他的家。所以代表全以色列的每一家的每一個人,都應該為耶和華而活。那這就是怎麼樣,為什麼這個長子要代表
486.852	515.619	這個全家來受罰。然後也長子也代表全家來服侍神。那這個時候呢。後來神又讓這個立位人。來代替。以色列各家的長子。來服侍神。所以才有以色列會眾。暗守在立位人頭上。讓他們代表他們家的長子去服侍神。所以呢我們繼續往下看十五節那說。此後立位人要進去會墓辦事的時候。你要潔淨他們。
516.578	542.763	然後這個將祂們當作搖祭奉上因為祂們是從以色列人中全然給我的我捲選祂們歸我是代替以色列人中一切投生的而以色列人中一切投生的連人代牲畜就是投生的人和投生的牲畜都是我的
543.575	573.304	為什麼呢?我在埃及地擊殺一切投生的那天就將他們分別為聖歸給我了我揀選立位人代替以色列人中一切投生的我從以色列人中將立位人當作賞賜給亞倫和他的兒子在會幕中辦以色列人的事又為以色列人贖罪免得他們哀敬聖所
573.848	596.101	有災殃臨到他們中間。這邊我稍微再解釋一下。就是利未人代替所有的以色列的長子。然後歸耶和華為聖。所以剛剛以色列人為他們按手在他們頭上。所以他們就被當作活祭獻給神。然後呢又因為他們是
597.193	622.138	被當作是謠記謠記就是這邊是獻祭者這邊是祭壇祭壇上面有祂們所獻的祭物站在中間的就是祭司祭司呢會把祭壇上的祭物拿起來在這個獻祭者這代表人以及祭壇代表神在神人之間把它搖一搖
623.37	651.537	代表祭司作為中間的橋樑作為中堡因此只要講到這個搖祭就是講到說祂好像是一個祭司祂站在人跟神中間祂要來服侍人服侍神因此呢這個上帝已經把立位人賜給了祭司因為那個搖祭的那個祭肉會歸給祭司而今天立位人就如同那個搖祭
652.432	661.93	上帝已經把祂賞賜給祭司。所以立位人就要協助祭司,完成在會幕裡面一切的侍奉。
663.131	692.931	那經文又講到說。他們不僅是搖祭。他們彷彿也是贖罪祭。所以說他們。又為以色列人贖罪。免得他們,他們是指。免得以色列人。他們哀敬聖所。因為以色列人他們不可以隨便靠近聖所。那這些立位人。他是為以色列人贖罪的。讓這個以色列人罪得赦免。免得有災殃臨到。
693.131	723.051	以色列人當中。上帝讓利未人﹐代替以色列人﹐來在聖所裡面﹐會墓裡面服事。好讓這個﹐不潔淨的﹐或是說﹐不討神喜悅的﹐這是以色列人﹐因為他們常常犯罪。就讓他們不要靠近會墓﹐免得他們被神擊殺。二十節﹐摩西、亞倫並、以色列全會眾﹐便向利未人如此行。凡耶和華指責利未人﹐所吩咐摩西的﹐
724.053	753.868	耶和華、以色列人就向他們這樣行。於是利未人就竭盡自己除了罪,洗了衣服。雅倫將他們當作搖祭,奉到耶和華的面前,又為他們贖罪,竭盡他們。然後利未人進去,在雅倫和他兒子面前,在墾墓中辦事。耶和華指著利未人怎樣吩咐摩西,以色列人就怎樣向他行了。耶和華小喻摩西說,利未人是這樣,
754.855	782.107	從25歲以外,就是25歲以上,他們要前來任職,辦理會幕的事。之前我們在第4章講到的是,他們立委人是30歲到50歲,要在會幕裡面任職。這邊為什麼講25歲?有可能是25歲到30歲那段時間是先來見習,先來實習。25節到了50歲,就要來停工退任,不再辦事。
782.671	810.82	因為30到50歲是最精華的黃金的年日。50歲以後可能年紀就比較衰老。所以祂就不再辦事。代表說因為立位人祂很多是要搬東西。不論是這個哥霞、格順、還有一個以拉利。這三個族。他們基本上都是在搬運這些很重的東西。
811.578	835.263	因此呢,我們可以看見之前都還需要牛跟車來幫助這個格順跟米拉利這兩個宗族那當然這個哥俠他們不用牛跟車因為他們被規定只能用康臺會墓裡面這些神聖的物品所以呢,這些立位人到50歲以後他們就
835.913	860.561	不用再做這些粗重的搬運工作。但是呢,二十六節,他們只要在會幕裡,和他們的弟兄一同伺候著。謹守所吩咐的,不再辦事。很可能就是作為顧問,或是比較資深的前輩,來指導年輕人,怎麼樣來服侍神。至於所吩咐立位人的,你要這樣向他們行。因此我們透過今天的經文看見,
861.561	883.433	上帝其實祂的心意是要全民都來服侍祂所以祂就特別挑選了立位人來代替這個以色列的長子們應該這樣講原本是要透過以色列的長子來代表他們每個人的家庭都來服侍主
884.462	912.999	那後來呢因為金牛賭事件所以呢上帝就用這個上帝因為金牛賭事件就不喜悅以色列人而在那個時候立位人跳出來站在上帝這邊所以上帝就用立位人來取代以色列的長子們所以就讓立位人來協助祭司來服侍耶和華上帝我們就一起來禱告主啊感謝禰感謝禰
914.462	943.017	主啊禰原本讓這個長子代表全家受罰主啊果然禰就讓我們的長兄耶穌基督禰的獨生兒子耶穌基督代替我們所有這些神家中的兒女們來受刑罰受管教主啊我們在禰面前說
943.712	968.924	我們既然被禰救贖了。我們應該要一生一世都來侍奉禰。主我們不再是自己的人。我們應該把生命的主權也都要奉獻給禰。其實不只是祭司跟立位人應該來侍奉禰。我們不要忘記立位人是代替以色列家的長子。而長子就是代表他們的家。
969.838	998.122	主啊!我們原本這些代表者都是要來受罰的但後來禰給了奇妙的救贖之恩禰讓禰自己真正的兒子替我們受罰而讓我們原本這些該受罰的搖身一變竟然變成分別為聖歸給禰的侍奉者主啊!我們珍惜這份能侍奉禰的恩典
998.899	1008.849	叫我們在侍奉禰的時候是歡喜快樂是感恩的。謝謝主。奉主耶穌的名禱告。阿們。願神賜福大家。