start	end	text
4.224	5.867	弟兄姊妹平安，我們一起來思想。
5.867	7.650	詩篇一百一十九篇。
7.650	10.534	四十九節到六十四節。
10.534	16.284	我們今天要進到這一首字母詩的第七個字母跟第八個字母。
17.415	29.908	第49節,求祢記念向祢仆人所應許的話,叫我有盼望,這話將我救活了,我在患難中因此得安慰。
29.908	38.597	我們已經有經驗了,詩篇119篇,它分成22個段落,按照它22個字母,分成22個段落。
39.138	78.124	每一個段落有八節而每一個段落裡面的第一節字首的第一個字就會是這八節的關鍵字因此呢,四十九節裡面的句首的那個字是紀念求祢紀念向祢仆人所應許的話叫我有盼望求神紀念祂的話語裡面對我們的寶貴應許 而詩人在患難中,天天紀念一件事情,就是紀念神會紀念祂所說過的應許。
78.124	88.953	因此不僅是神紀念祂所說過的話,信靠神的人,他也紀念神對他所說過的話。
88.953	124.010	因此呢,就算有患難, 但是在相信神一定會紀念我的這一種紀念裡面人就有靠主再一次剛強站立的盼望甚至神所說過的話會使我活過來因為我知道神祂紀念我祂紀念祂所說過的話就算我在安慰中也會因為神祂的話我得安慰因為我知道神沒有丟棄我 祂仍然紀念我。
124.010	126.473	我怎麼知道祂仍然紀念我呢?
126.473	132.581	因為我知道祂紀念祂對我所應許的每一句話語。
132.581	138.748	因此弟兄姊妹,神的話語何等的寶貴,是我們患難中的安慰與力量。
140.589	149.234	51節,驕傲的人甚五漫五,我卻未曾偏離你的律法。
149.234	160.080	就算是那些驕傲狂妄的人,大大的欺負我,羞辱我,看不起我,我也不會因此,就失去了活下去的盼望。
160.080	161.220	為什麼?
161.220	164.382	因為耶和華的話語,紀念我。
165.913	171.994	因此我也要大大來繼續紀念耶和華對我說過的話語。
171.994	176.955	因此我未曾偏離你的律法。
176.955	181.036	52節耶和華我紀念你。
181.036	185.417	你看神紀念我我紀念神。
185.417	189.437	從古以來的典章就得了安慰。
189.437	207.183	當我去紀念神這個話語 不僅只是對我一個人所說過的,是從古以來那一些相信祂的話語必定會實現的這些藝人,他們都有美好的見證。
207.183	210.764	他們都經歷了神,是信實慈愛的神。
210.764	253.132	因此呢,當我去紀念整本聖經已經有多少人 因為祂而得著的生命的盼望跟力量的時候這就更大大給我信心因此呢我的心就更大得了安慰五十三節我見惡人離棄祢的律法就怒氣發作猶如火燒我在世寄居速來以祢的律例為詩歌我看見惡人離棄祢的律法惡人他 不紀念神的話,惡人他不相信神的話。
253.132	260.861	因此,一人看見就有一個公義的憤怒,就從心中興起。
260.861	265.887	他不要與惡人為伍,他要堅守神的應許的話語。
266.954	277.376	五十四節祂說,我雖然是看起來是在世寄居的,雖然不像那些惡人,好像很有權勢,作威作福。
277.376	281.437	但是呢,我要與神同在。
281.437	284.998	我素來以祢的律律為詩歌。
284.998	292.219	上帝的話語,不僅我存記在心,我還要透過我的口,歌頌上帝的話語。
292.219	294.520	我要以上帝的話語做我的詩歌。
296.015	301.765	五十五節,耶和華,我夜間紀念你的名,謹守你的律例。
301.765	306.493	我所以如此,是因我守你的訓詞。
307.381	311.002	夜間代表生命裡面的黑暗夜。
311.002	312.903	生命裡面的低谷。
312.903	316.323	但是一思想到神的話語。
316.323	317.724	神必應驗。
317.724	320.165	神紀念祂對我說過的話語。
320.165	325.206	我在夜間就紀念神的名。
325.206	327.447	遵守神的話語。
327.447	329.107	神的律法。
329.107	330.407	我素來如此。
330.407	333.848	因為我相信神紀念祂的話語。
333.848	336.109	我也紀念神對我說過的話語。
337.807	342.474	57節到64節是第八個段落。
342.474	343.896	我們一起來讀。
343.896	349.123	耶和華是我的福分,我曾說,我要遵守你的言語。
351.015	357.563	五十七節的第一個原文的原文字是福分的那個分。
357.563	369.336	因此呢,這一個段落要告訴我們,神賜給我的福分,賜給我的那一份,賜給我的產業,是何等的美好。
369.336	391.582	所以不論環境如何, 不論曾經有哪一些事情,好像引誘我去走別的路,但是當我一思想到神的話語的時候,我就走回到應有的道路上,一心要得神給我的份,神給我的產業。
391.582	396.925	57節,耶和華是我的福分,我曾說我要遵守你的言語。
398.439	408.305	世界上的人,他得到他那一份,可能是名譽、財富、地位、權勢,各種事情。
408.305	411.727	但詩人想要效法立位人。
411.727	416.209	十二支派都有分到他們的產業,他們的份。
416.209	421.812	但立位人很特別,神特別拣選他們,沒有土地給他們。
421.812	425.374	神卻說,那你的份是什麼呢?
425.374	427.636	我耶和華,就是你的福份。
428.575	434.118	你一生要奔跑,要努力得著的,就是我耶和華。
434.118	437.019	有了我,你就什麼都有了。
437.019	445.543	因此詩人說,我現在看起來像在地上寄居的人,但其實,有了耶和華,我就擁有了一切。
445.543	448.545	耶和華就是我的份。
448.545	454.327	因此,58節他說,我一心求過你的恩,願你照你的話,憐憫我。
456.288	458.151	我思想我所行的道。
459.224	461.866	又轉步歸向你的法度。
461.866	466.669	我急忙遵守你的命令,並不延遲。
466.669	472.493	惡人的繩索纏繞我,我卻沒有忘記你的律法。
472.493	477.916	我因你公義的典章,半夜必起來稱謝你。
477.916	483.660	凡敬畏你、守你訓詞的人,我都與他作伴。
483.660	486.562	耶和華啊,你的慈愛遍滿大地。
487.022	489.824	求祢將祢的律例教訓我。
489.824	504.072	詩人描寫得非常的傳神,好像他的腳步有一點遲疑,好像有一點忘記他一生要追尋的目標,是以耶和華作為他悲中的份。
504.072	511.316	很像詩篇第十六篇第五節所說的,耶和華是我的產業,是我悲中的份。
512.056	528.043	但是呢,世界上的惡人,好像用各樣的方式,用繩索纏繞他,要把他拉離耶和華給他的跑道,不讓他去得著耶和華作為他生命的福分。
528.043	549.107	因此呢,當他一思想,我到底現在所行的道,是通往耶和華作為我的產業,作為我一生 這個努力向前的目標還是我現在正在走的道路是遠離神是失去了耶和華作為我生命的福分的道路呢?
549.107	551.048	他一思想哇!
551.048	555.089	就趕快轉步轉個方向要來怎麼樣?
555.089	572.555	歸向神的法度要急忙來遵守神的命令不要延遲不要就是鬆懈下來就立刻轉換跑道 要奔祂的命定跟祂的志向。
572.555	581.679	就算是在半夜,就算是在生命的低谷跟黑夜的時刻,他一思想到,我到底現在在走哪一條路?
581.679	589.822	喔,他一想清楚,他趕快回來,遵守神的律法,神的話語,要得耶和華為他的福分。
589.822	598.185	因此呢,他在這一條路上,他會看見很多跟他一樣的, 天路之旅的夥伴。
598.185	613.229	因此,凡敬畏祢、守祢訓詞的人,我都與他作伴,與他為友,一起成為同道,一起成為生命中屬靈的同路人,屬靈的同伴。
614.548	620.031	因此呢,一思想到,神就是我的福分,神是我的產業。
620.031	625.195	我就掉轉眼目,掉轉腳步,不要去跟從惡人的計謀。
625.195	632.179	我就掙脫了惡人用繩索纏繞我,要把我拉走的那一股力量。
632.179	641.385	在那時候,我重新來奔走神的道路的時候,我就會看見,耶和華啊,你的慈愛遍滿大地。
642.125	658.294	是的,當我們心思意念被神調整之後,重新奔向神的道路,要與神為我們這一生的產業的時候,你會看見遍地不是困難,你會看見遍地充滿了神的慈愛。
658.294	662.116	慈愛這個字,hesed,就是神的所願之愛。
662.756	665.498	求祢將祢的律例教訓我。
665.498	669.120	這樣我就可以繼續奔祢的道路。
669.120	672.863	得祢耶和華做我生命的福分。
672.863	675.385	我們一起來禱告。
675.385	675.785	謝謝主。
675.785	677.446	主啊!
677.446	682.490	謝謝祢永遠紀念祢應許我的話語。
682.490	689.575	因為我每次紀念祢是如此的紀念祢對我所應許的話語的時候。
689.575	691.256	我就活過來了。
691.256	692.057	我就有盼望了。
693.148	699.971	謝謝主紀念我的過去,紀念我的現在,紀念我的將來。
699.971	706.233	謝謝主透過你的話語,從古以來紀念每一位信靠你的人。
707.227	736.611	主啊當我思想到我現在到底所行的道路是哪一條的時候我就要醒悟過來我要改變跑道重新走上祢的真理之道我一生所要追尋的一生所要得找的其實不是別的是神祢自己祢就是我杯中的份祢就是我的產業求主鼓勵我與 天路上的同路人。
736.611	737.973	屬靈的夥伴們。
737.973	739.795	一起奔你的道路。
739.795	741.117	讓我看見。
741.117	742.379	你的慈愛。
742.379	743.780	遍滿了大地。
743.780	745.542	奉主耶穌的名祷告。
745.542	746.243	阿們。
746.243	747.305	願神祝福大家。