start	end	text
18.968	23.290	弟兄姊妹平安，我們按照每日言經事宜的進度,繼續來思想。
23.290	27.872	詩篇第64篇,詩題是《大衛的詩交與靈長》。
27.872	37.397	第一節,神啊,我哀嘆的時候,求祢聽我的聲音,求祢保護我的性命,不受仇敵的驚恐。
38.097	46.301	第一節,大衛向神哀嘆,懇求主不要推卻,不聽他哀嘆的聲音。
46.301	47.002	為什麼呢?
47.002	55.126	因為他十分的危急,他的性命有危險,並且仇敵不斷在驚恐他。
55.126	65.439	第二節,求祢把我隱藏, 使我脫離作惡之人的暗謀和作孽之人的擾亂。
65.439	68.580	明槍易躲,暗箭難防。
68.580	75.964	大衛心中充滿了恐懼,希望神把他隱藏起來,不再受仇敵的驚擾。
75.964	85.809	因為仇敵跟作惡的人,他們的詭計和這些絞擾的計謀,藏得很深,也佈置得很周全。
86.749	93.615	所以對大衛來講,他唯一的避難所,藏身之處,就是上帝那裡。
93.615	109.330	第三節以後要來形容這些作惡人的惡謀,是規劃得如何的詳細,而且他們也志在必得,認為一定能夠把倚靠神的義人拉下臺,害他的命。
110.776	114.238	第三節,他們磨舌如刀。
114.238	122.644	他們磨他們的舌頭,好像在磨刀子一樣,代表他們的舌頭很毒、很利。
122.644	129.428	他們發出苦毒的言語,他們言語像射出來的苦毒的弓箭,有毒藥。
130.469	136.092	好像比准了的劍,都瞄準我,要射向我。
136.092	145.297	第四節,他們要在暗地射完全人,他們要忽然的射他,並不懼怕。
145.297	157.544	這些惡人知道他們所對付的人是義人,是倚靠上帝的人,是上帝所差派在這些位分上的上帝的僕人使女。
157.944	190.773	但他們心中對神並不懼怕以至於他們對神所拆派來的僕人跟使女他們也毫無懼怕他們已經預備好他們一切的軌跡和這個弓箭要來射向完全人第五節第六節更描寫出他們心中的狂妄以及目中無神目中無人 第五節,他們彼此勉勵,設下惡計。
190.773	193.034	勉勵的意思是壯膽。
193.034	199.476	他們彼此互相結盟,互相鼓勵,互相給對方壯膽。
199.476	204.818	設下了惡毒的計謀,要來對付上帝和上帝的僕人。
205.418	210.663	他們商量要暗示網羅,網羅就是陷阱。
210.663	216.129	他們商量暗示網羅說,誰能看見呢?
216.129	222.976	他們自以為他們的計畫天衣無縫,沒有人可以看見,但上帝都看見了。
223.677	251.591	他們圖謀奸惡說我們是極力圖謀的他們還自誇說他們是費盡了心思極力的圖謀這些抵擋真理抵擋上帝的義人的這些惡謀他們自誇他們個人的意念心思是深的 他們用盡了心思意念裡面的軌跡。
251.591	253.333	就是要來抵擋真理。
253.333	256.217	要來抵擋上帝的僕人使女。
257.551	263.035	那他們如此周詳的計畫,他們的箭已經瞄準了。
263.035	266.298	他們就準備要發射這個惡毒的箭。
266.298	273.383	那大衛向神哀嘆呼求,神有沒有行動呢?
273.383	280.089	倚靠神的完全人,他們的呼求,神是否會垂聽呢?
280.089	282.450	第七節我們來看這個整個轉折。
283.251	291.761	第七節,但是神要射他們,他們忽然要被箭射傷。
291.761	298.790	第一,讓我們看見上帝的箭,比惡人所要發射的箭來得更快。
299.787	301.168	更狠喔!
301.168	329.259	第二個當他們在瞄準這個異人和完全人的時候他們不知道上帝早已瞄準了這些惡人隨時就要制裁他們所以惡人當留意不要以為沒有人看見上帝都看見惡人的一舉一動心中所思想的上帝早已知道上帝的劍 惡人的劍速度還要快。
329.259	332.661	第八節他們必忽然怎麼樣?
332.661	344.346	他們必然會絆倒,然後被自己的舌頭所害,凡看見他們的必都搖頭,多行不義,必自斃。
344.346	354.230	所以他們會被自己的網羅所絆跌倒,會被自己舌頭所設的計謀, 害到自己。
354.230	355.291	所以呢。
355.291	359.093	凡看見他們這樣結局跟下場的人。
359.093	360.494	都必搖頭。
360.494	361.975	搖頭就代表說。
361.975	363.856	嘲笑他們。
363.856	365.317	恥笑他們。
365.317	366.778	第九節。
366.778	368.779	眾人都要害怕。
368.779	371.041	要傳揚神的工作。
371.041	373.142	並且明白祂的作為。
374.650	381.995	大衛相信神的劍比惡人的劍發射的速度還要快。
381.995	387.780	並且神早已瞄準那些正在瞄準義人的惡人。
388.575	410.885	所以當惡人受到制裁的時候不僅看見的人都要向他們恥笑搖頭而且眾人在那時候都會害怕就是會敬畏神他們也都會把神的工作神的手段傳揚出去 警惕,彼此警惕說,不可作惡。
410.885	414.568	不要以為神都沒有看見,神都看見。
414.568	418.151	他們並且要明白上帝祂的作為。
418.151	425.637	之前他們不明白,之前他們以為神都沒在看,神都沒在管,任憑惡人作惡。
425.637	433.164	但如今他們要明白,神都有在看,神都有在管,而且神必出手懲罰惡人。
433.524	436.086	所以我們再把第九節再讀一次。
436.086	443.912	眾人都要害怕,並且眾人要傳揚神的工作,並且明白祂的作為。
443.912	454.660	弟兄姊妹,我們如果看見神在審判、管教、制裁惡人的時候, 你是否心中那時候也敬畏神呢?
454.660	474.734	是否那時候你也能夠明白神的作為並且為我們自己過去不明白神的作為還埋怨神然後還跟神賭氣說神都不聽我們的禱告是否你也為這樣的行為感到慚愧和向神悔改認罪呢?
474.734	485.502	第十節一人必因耶和華歡喜 並要投靠祂,凡心理正直的人都要誇口。
485.502	495.248	當眾人都看見神的工作,神的作為的時候,義人就要因耶和華而歡喜快樂。
495.248	506.756	之前義人因為持守對神的倚靠跟信仰,而讓自己好像陷入了仇敵的攻擊當中。
506.756	513.701	但他們要倚靠神到底, 他們最後的結局就是一人必因神歡喜。
513.701	533.397	不知道是否我們當中有人仍然堅持對神的信心跟倚靠不害怕仇敵的詭計跟瞄準對你的獨見 你要對神有信心,因為義人最後必因耶和華而歡喜,並且要投靠上帝。
533.397	537.560	只有上帝是我們唯一的隱藏之處。
537.560	546.428	所以第二節這邊大位說,求祢把我隱藏,使我脫離作惡之人的暗謀和作孽之人的擾亂。
546.988	552.394	最後大衛說,凡心理正直的人都要誇口。
552.394	553.596	誇什麼口呢?
553.596	563.907	不是為自己誇口,是誇耶和華上帝,祂的劍比仇敵的劍更快,一人必因耶和華而歡喜。
564.753	566.174	我們一起來禱告。
566.174	569.838	主讚美祢,一人必因耶和華而歡喜。
569.838	582.872	當我們看懂祢的作為,明白祢的工作之後,主啊,我們要更加敬畏祢,並且為過去對祢的不耐煩、沒信心跟抱怨,向祢認罪悔改。
583.387	597.838	求主讓我們明白祢的作為,讓我們一生一世都來投靠祢,讓我們因依靠祢而歡喜快樂,而誇口我主的榮耀,奉耶穌基督的名禱告。
597.838	598.439	阿們。
598.439	599.700	願神賜福大家。