start	end	text
10.230	17.176	弟兄姊妹平安，我們一起來思想約翰福音第11章的45節到57節。
17.176	30.246	那些來看馬利亞的猶太人見了耶穌所做的事,只有多有信他的,但其中也有去見法利塞人的,將耶穌所做的事告訴他們。
30.246	38.133	祭司長和法利塞人聚集公會說,這人行好些神蹟,我們怎麼辦呢?
38.985	44.087	若這樣由著祂,人人都要信祂。
44.087	50.009	羅馬人也就會來奪我們的地圖和我們的百姓。
50.009	64.674	內中有一個人,名叫蓋亞法,本年做大祭司,對他們說,你們不知道什麼,獨不想,一個人替百姓死,免得通國滅亡,就是你們的益處。
65.896	70.820	他這話不是出於自己,是因他本年做大祭司。
70.820	81.670	所以預言耶穌將要替這一國死,也不但替這一國死,並要將神四善的子民都聚集歸一。
81.670	85.793	從那日起,他們就商議要殺耶穌。
85.793	102.332	好,弟兄姊妹,為什麼很多人來看 這個瑪莉亞呢,因為她的弟弟拉撒路,耶穌行神蹟,讓她從死裡復活,死了四天之後,完全顛覆猶太人那時候流行的一種觀念。
102.332	111.800	一個人死了,前面三天,那個靈魂好像在屍體附近徘徊, 但到第四天,靈魂就會走。
111.800	114.760	也就是到第四天就是死透了。
114.760	115.820	沒救了。
115.820	116.881	沒機會了。
116.881	118.221	誰來都一樣。
118.221	123.242	但是耶穌就是在他拉撒路死的第四天的時候,叫他從死裡復活。
123.242	127.843	這個完全震撼到這個猶太人那時候的觀念。
127.843	130.463	耶穌好像可以超越人的死透了。
130.463	131.924	超越人的死亡。
131.924	146.773	那在拉撒路這個神蹟復活, 這個之前,其實現場的人,包含馬大、瑪利亞,還有那些村民,都經歷一個非常大的一個信心的一種考驗,甚至是信心的危機。
146.773	157.781	例如說,他們明明就派人去找耶穌來醫治這個拉撒路重病,可是耶穌竟然不立刻來。
157.781	160.022	可是耶穌不是很愛他們嗎?
160.022	162.164	為什麼耶穌不立刻過來?
162.164	163.345	這讓我們信心有一個危機。
163.865	165.627	主啊,祢不是很愛我嗎?
165.627	169.253	可是為什麼我禱告的時候,祢不立刻垂聽呢?
169.253	172.237	祢不立刻施行拯救呢?
172.237	179.367	當然,後來耶穌來了,叫死掉的拉撒路,從死裡復活,就彰顯了更大的榮耀。
179.923	191.849	我們常常是這樣耶穌沒有立刻隨聽我們的禱告可是經過一段時間之後祂出手了而且祂拯救了我們之後我們回過頭看發現哇!
191.849	215.433	這樣所經歷的一個是更大的這樣所認識的這個神的榮耀是更偉大的我們就信心就被兼顧第二個包含說那時候耶穌沒有立刻跟那個來報信的人 回去醫治拉撒路,他反而是對他們說,拉撒路的病不至於死。
215.433	220.558	因為耶穌在第四章的時候,他曾經醫治過一個大臣的兒子。
220.558	231.730	大臣跑來找耶穌說,我的兒子快要死了,可不可以請你跟我去,趁他還活著的時候,為他禱告,使他得醫治,免得他死了就來不及了。
232.551	235.112	對耶穌來講真的沒有什麼來不及的。
235.112	238.995	耶穌就跟這個大臣說,你回去吧,你的兒子活了。
238.995	241.136	結果他回去的時候發現他的兒子真的活了。
241.817	259.000	所以很可能這兩個要來找耶穌,跟他們講說拉撒路重病快死的這兩個人,他可能就想說,像是耶穌也是這樣啊,告訴我們說不會死,回去都真的沒有死,就好了。
259.000	266.822	或許我們這次回去伯大寧的時候,哇,這個拉撒路就已經好了,想不到一回去怎麼樣。
267.551	272.596	要嘛就是一進村子,就發現拉撒路已經死了。
272.596	278.341	要嘛就是回去了,告訴馬大跟瑪利亞,福子說你弟弟不會死。
278.341	279.723	結果很快就死了。
280.333	291.860	我想這對於耶穌這次預言服侍,祂預言拉撒路一定會好的,這個神蹟失敗了。
291.860	294.502	他們一定會留下很多的問號。
294.502	305.028	包含村民後來說,在37節說,他既然能夠開瞎子的眼睛,為什麼不能叫這個人不死呢?
305.028	309.711	好像耶穌面對這個死透的拉撒路,好像是無能為力。
310.452	320.642	像這一些面對死亡,面對人生生命中的絕境,通常會給我們的信心重大的衝擊跟重大的考驗。
321.237	327.881	但是要走過這整個過程,我們才會恍然大悟,原來神的道路高過我們的道路。
327.881	345.431	還記不記得一開始,耶穌就對這個門徒他們說,也對這兩個報信的人說,這並不至於死,乃是為神的榮耀,叫神的兒子因此的榮耀。
345.431	354.500	包含說,很多時候我們經過大的患難, 信心起起伏伏,但仍然緊抓的阻不放。
354.500	364.485	到後來,不僅經歷了神更大的榮耀,也對於我們對神的應許,跟神救恩的工作,有更多的了解。
364.485	369.748	其實在那個時候,我們看這整個十一章,可以明白一件事情。
369.748	386.269	幾乎大部分的猶太人,對於自己,死了之後,在末日的時候, 耶和華神顯現的時候,到底我在神的眼中,到底算不算是一個義人?
386.269	388.230	還是我就是一個罪人?
388.230	392.831	因為只有義人在末日的時候,可以神叫他復活。
392.831	399.594	但大部分人其實真的沒有信心也沒有把握,面對死亡,人人都是沒有把握。
399.594	406.617	真的還不太有把握說,我到底這一生在神的眼中,是加分還是減分?
407.261	410.102	我到底這一生到底有價值還是沒價值?
410.102	415.484	我到底這一生所做的,我在神的面前是義人還是罪人?
415.484	418.405	以至於我不太知道我有沒有永生了。
418.405	420.625	我不太知道在末日我會不會復活。
420.625	424.387	我不知道我可不可以承受神的果。
424.387	427.228	還記得有一個富有的少年官嗎?
427.228	430.029	他說他從小什麼見面都守了。
430.029	430.749	他很認真啊。
432.210	438.216	而且呢,可是祂在耶穌走過來的時候,祂就衝到人群的前面,跪在耶穌的面前。
438.216	443.741	你看,祂是一個有身分有地位的人,竟然跪在耶穌的面前,在眾人面前。
444.889	448.333	因為他真的不知道他到底有沒有永生。
448.333	454.179	他拜託耶穌跟他講說我怎麼樣才可以確定我有永生。
454.179	462.367	你看連一個他這麼認真的人在神面前這麼認真的人他都不確定自己是否被神稱為一。
462.367	468.321	但是透過剛剛耶穌跟瑪利亞跟馬大所說的 他就給馬大一個保證。
468.321	469.402	他說怎麼樣?
469.402	474.342	他說,凡活著信我的人,必永遠不死。
474.342	481.264	信我的人,雖然死了,也必復活,因為復活在我,生命在我。
481.264	489.785	透過耶穌跟馬大講這句話,馬大他才有一個信心說,我的兄弟在末日,可以復活。
489.785	494.066	因為我的兄弟信耶穌,就算他為一人。
494.889	499.371	但是耶穌其實在後面又跟馬大講一個更新的觀念。
499.371	503.873	我不是在末日才叫祂復活,我現在就要叫祂復活。
503.873	505.434	哇,這個就是更震撼了。
506.084	511.966	因為大家認為已經四天了,死透了,所以不會再復活了。
511.966	517.629	耶穌不被這個框架限制,祂現在就要讓拉撒路復活。
517.629	523.991	因此,面對生死問題,人人的信心都會面臨恐慌。
523.991	533.275	親愛的朋友們,你的信心面對生死,面對你這一生到底在上帝面前的評價,你有把握,你有信心嗎?
533.968	550.014	如果憑自己是沒有把握,但是感謝神,透過神的兒子耶穌基督應許我們的,凡活著信祂的人,必永遠不死,而且在末日要復活,並且現在就要得著生命。
550.014	556.396	那我們剛剛所看見的這個蓋亞法, 還有這些猶太人公會的議員。
556.396	558.458	他們有七十一個議員。
558.458	560.219	就類似現在的國會議員。
560.219	563.202	他們都是以色列人領袖。
563.202	568.546	他們就很擔心,逾越節,百姓都跑去信耶穌了。
568.546	569.667	那就會作亂。
570.316	572.858	因為他們就一定要搞革命。
572.858	575.720	他們其實一直誤會, 耶穌在哪裏不是要搞革命的。
575.720	580.624	那羅馬人就有藉口, 把我們的土地跟人民奪走了。
580.624	587.270	因為這個時候, 最少我們在羅馬政府統治之下,還有一點小小的宗教的自治權。
587.270	598.439	如果因為又動亂了, 羅馬又出兵平亂,我們連一點點的宗教自治權都沒有,猶太人就徹底的滅亡了,亡國了。
598.439	602.144	但是, 蓋亞法說, 我們應該逆向操作。
602.144	603.867	我們要讓怎麼樣?
603.867	608.356	讓耶穌就在逾越節這個時候,把祂弄死。
609.070	618.257	讓百姓徹底死了心,不要再怪力亂神,不要再隨便的追隨哪一個人,他號稱他是彌賽亞,就去跟隨他。
618.257	619.538	這樣我們就可以怎麼樣?
619.538	629.745	保持穩定,百姓就不會作亂,羅馬政府就不會來怎麼樣,把我們最後一點點的自尊,最後一點點的自主權奪走。
629.745	630.786	我們這樣就滿足了。
631.391	643.521	很多時候我們就是這樣,我們就只希望說在這個世界裡面,就那一點點的自尊,一點點的安定感,不要被奪走。
643.521	651.828	耶穌,你不要來破壞我的這種小確幸,不要來剝奪我的這麼卑微的安全感,你都要讓他被奪走嗎?
652.363	662.194	很多時候我們的成績就只能到這裡,我們會一直忽略耶穌苦口婆心跟我們說,祂來到底要做什麼?
662.194	680.853	祂來要把我們帶離開這種曠野模式的思想,祂來要讓我們進到我們受造的墓地,進到我們被拯救的墓地,進到我們成為神兒女的墓地, 要把我們帶離曠野,進入祂的國,祂的義,要承受永遠的生命。
680.853	696.870	這是我們常常不敢去想的,這也是一種面對危機,面對動盪,不確定的時候,我們會縮起來,小確幸就好了,卑微的安全感就好了,哇,耶穌,你講的太多了,那個不是我們要的。
697.517	706.608	因此,我們透過今天的經文,我們就可以來思想,到底我們跟隨耶穌,我們要的是什麼呢?
706.608	707.610	願神祝福大家。