start	end	text
18.712	25.879	弟兄姊妹平安，我們繼續按照每日言經史語的進度繼續來思想約伯記第九章一到二十四節。
25.879	72.221	我們曾經講過約伯記它有四十二章但是我們從前閱讀的時候通常只讀前面第一章第二章就直接跳到第四十二章的結論因為這三章是敘述文為主 但不要忘記約伯記是詩歌智慧書所以它裡面大部分都是詩歌體的內容我們如果跳過那些我們對於約伯記的重點跟精神是把握不住的那約伯在第三章就向他的三個朋友請述他裡面即生的難過跟痛苦他有一個哀歌但第四章開始他的三個朋友就覺得 面對約伯這麼大的苦難,他們也不知道該怎麼解釋。
72.221	80.424	而又覺得約伯這樣子的哀嘆,是不是在挑戰上帝的公平或公義呢?
80.424	83.946	所以這三個朋友就跳出來跟約伯辯論。
83.946	88.348	本來是要來輔導約伯,後來變成推導約伯,甚至半導約伯。
88.968	98.541	那就從第四章到二十七章,很長的篇幅,展開了三次的車輪戰。
98.541	105.810	每一次的辯論賽,三個朋友,一號、二號、三號,依序的出來跟約伯辯論。
106.271	158.312	我們現在要來到這個第九章是第一次的測論戰裡面的第二個朋友對約伯提出批評之後約伯對第二位朋友的反擊而這前面這兩個朋友一個叫做以利法他的名字是我的神是 我們就來看一下約伯在第9章怎麼回答彼勒達 彼得達告訴約伯,惡人的帳篷必歸於無有。
158.312	166.459	所以你要切切地懇求、尋求神赦免你,必使你公益的居所能夠重新興旺。
167.039	194.489	並且彼勒達他述諸,我們會有這樣的結論,善有善報,惡有惡報,是因為我們考察這個人世間智慧的傳統,第二個我們觀察大自然,很多事情事出有因,所以你會遭此大難,必定是你犯了不可赦免的大罪,所以趕快認罪悔改,你現在雖然微小, 終究必勝發達。
194.489	196.993	這個是這個彼勒達的觀點。
196.993	201.701	約伯這邊就要來駁斥彼勒達的說法。
201.701	235.027	第一節約伯回答說 我真知道是這樣就是說你講的我都知道啊你講那個道理我比你還清楚但是現在就是不適用在我身上而且不僅不適用在我身上我告訴你這個世界上很多的現象根本就不是善有善報惡有惡報所以約伯開始就提出他的反駁論點了但人在神面前 怎能成為義呢?
235.027	239.009	他就反問彼勒達,你一直講說,惡有惡報,善有善報。
239.009	244.173	然後呢,神必不丟棄完全人,也不輔助邪惡人。
244.173	249.817	請問,在神面前,誰能夠敢說自己是完全人?
249.817	256.442	他就反問這個彼勒達,他說,但人在神的面前,怎能成為義呢?
256.442	260.304	所以你這一套理論推到極致,根本就不適用。
261.715	266.479	若願意與神他爭辯,千宗之一也不能回答。
266.479	267.820	要跟神辯論嗎?
267.820	273.424	一千次的辯論裡面,也無法回答神一次。
273.424	278.608	因此呢,我們基本上在神的面前,沒有人是完全人。
278.608	280.670	沒有人是實行實美的。
280.670	283.492	所以誰敢說自己是異人?
283.492	296.183	那既然誰都不敢說自己真的是異人, 那誰又敢認為神現在不懲罰我,那祂就不公義。
296.183	305.127	或是人不敢說自己完全是義人,而現在明明神正在祝福我,那這樣神是不是也不公義?
305.127	311.391	那反推,那神現在有沒有任憑世界上有一些惡人在掌權呢?
311.391	313.552	有沒有任憑一些不公不義的事正在發生呢?
314.514	316.837	那神為什麼容許這一切呢?
316.837	319.380	不是說善有善報,惡有惡報呢?
319.380	329.693	所以我的朋友們,這個世界不是像你們那一套簡單的理論所能夠這樣子簡化、劃約來說明的。
329.693	336.523	我們有時候基督徒有一個盲點,想用一些很 簡化化約的一些神學理論。
336.523	341.604	就來描述這個世界上所有的事情。
341.604	343.605	沒那麼簡單。
343.605	345.905	這個很多事情是很複雜的。
345.905	349.186	所以這個約伯就在駁斥他的這兩個朋友。
349.186	352.386	都把事情太簡化了。
352.386	353.766	第四節。
353.766	357.287	神他心裡有智慧且大有能力。
357.287	359.867	就是說神是全知全能的。
359.867	362.548	誰向神剛硬而得亨通呢?
363.387	367.653	因為其實神永遠是絕對公義、絕對聖潔的。
367.653	375.425	所以沒有誰能夠在神的面前跟祂辯論什麼、剛硬什麼,而能夠有亨通的好下場。
375.425	377.789	因為我們在神的面前都是不完全的。
378.490	384.334	第五節,他發怒,把山翻倒挪移,山並不知覺。
384.334	388.537	他使地震動,離其本位,地的柱子就搖旱。
388.537	394.541	山跟地基本上都認為根基穩固,不可能移動翻動的。
394.541	400.685	但是對神來講,這根本就不算什麼,因為神是全知,也是全能的神。
401.305	426.623	祂吩咐日頭不出來,日頭就不出來,祂封閉眾星,祂獨自鋪張蒼天,祂步行在海浪之上,祂造北斗,稱星,毛星,並南方的密宮, 他行大事不可徹度,行奇事不可生疏。
426.623	430.186	他從我旁邊經過,我卻不看見。
430.186	433.088	他在我面前行走,我倒不知覺。
433.088	436.691	他奪取,誰能阻擋?
436.691	438.232	誰敢問他,你做什麼?
439.531	473.706	剛剛一口氣約伯講了很多事情就是說神是全知全能的神因此祂行大事行其事都超過我們的測度所以甚至祂很近距離的來到我們面前經過我們 也不知道也看不見甚至他把我們所認為的規律打破他奪取打破我們自認為觀察到的規則他把它打破他奪取誰能阻擋呢?
473.706	477.188	然後誰敢問他說你做什麼?
477.188	478.849	你憑什麼這樣做?
478.849	490.500	沒有人了所以約伯在表達一件事情就是說在神的面前在這位全知全能的神面前 其實誰敢說自己是完全人?
490.500	494.564	誰敢說自己是百分之百的異人?
494.564	500.689	那如果是這樣子的話,你們的論點就有問題了。
500.689	510.217	上帝為什麼容許惡沒有惡報,善沒有善報的現象是存在這個世界上的?
510.217	518.503	那如果這個現象真的是存在這個世界上, 他會不會傷害到上帝是公平公義的屬性?
518.503	541.006	可能他的朋友們就會害怕,如果這個世界上真的有一些惡神沒有懲罰,有些善神沒有保護或是保守他,那他的朋友們剛剛講的一些理論, 就好像站立不住,好像神的公義公平的屬性就會被挑戰。
541.006	545.869	但約伯說,其實你們看的東西很膚淺。
545.869	553.214	神容許世界上有些善人沒有善報,有些惡人沒有惡報。
553.214	632.764	神容許這些東西存在,其實 並不絲毫影響到神公義公平的屬性是因為神祂允許這樣的情形存在另有目的所以現在神允許我這樣一個並沒有犯罪的人卻承受這麼大的苦難跟災難是另有目的的所以你們不可以以此定我為必然有罪而需要來神面前認罪悔改 那再來呢如果按照神他是這麼的絕對公義聖潔的標準沒有人在他面前是完全人的話那神他可以隨時出手對付任何一個人 你這個彼勒達不是在這個第八章跟我談了很多的大自然的植物的例子嗎這些植物上青的時候就被割下這些植物這個藤蔓緊緊的把根盤在石堆就突然被拔出神如果要出手誰能攔阻呢相反的現在很多惡人神並沒有立刻出手對付他們對不對所以你的理論有問題啊 但是你的理論有問題,不代表神的公義的屬性就被損害了。
632.764	637.706	因為神祂另有目的,神另有安排。
637.706	647.509	所以呢,按照神祂是絕對公義的標準,祂完全可以隨時出手去滅了誰,攻擊誰,誰承受得住呢?
647.509	653.671	承受不住的,而且神也沒有立刻這樣做,來對每一個惡人、罪人。
654.411	655.872	所以代表什麼?
655.872	665.721	朋友們,你們都一直在為神的公義公正辯護,你們卻忘記了神是一個公義公正的神,神也是一個憐憫慈愛的神。
665.721	671.251	而我今天就是在呼求這位憐憫慈愛的神, 十三節。
696.817	703.919	神必不收回他的怒氣,輔助拉哈伯的屈身在他以下。
703.919	712.002	當神他要發怒的時候,就是他公義的憤怒審判要發作的時候,沒有人可以攔阻的。
712.002	732.034	輔助拉哈伯,拉哈伯就是海怪, 他專門在大海中興風作浪,所以輔助拉哈伯的,屈身在他以下,就是說,其實沒有人敢在神的面前興風作浪,所以你們不要以為我在神的面前要興風作浪什麼的,沒有人敢在神的面前興風作浪的。
732.034	739.279	14節,既是這樣,我怎敢回答他,怎敢選擇言語與他辯論呢?
741.067	743.508	我不是要來跟神辯論。
743.508	746.350	來辯論神,你是不是公義的。
746.350	749.111	我的重點根本不是針對這一個。
749.111	753.453	十五節,我雖有意,也不回答他。
753.453	755.695	或者說,也不能回答他。
755.695	759.256	只要向那,審判我的懇求。
759.256	764.199	他說,我現在遭苦難試煉,不是因為我有罪。
764.199	772.279	所以呢,在這件事情上,我雖有意,但我也不能來跟他, 辯論。
772.279	778.042	所以我是來向祂呼求、懇求的是祂的憐憫。
778.042	782.024	因為我們在神的面前,永遠是不完全的。
782.024	787.527	就算我在這次的這個遭災難的事情上,我並沒有因為犯什麼罪。
787.527	795.451	但是我要以我那一點點微小的義,來到這位全然公義的神面前,去討價還價。
795.451	796.532	一點意義都沒有了。
797.910	803.991	其實我真正來到神面前要懇求的是祂的憐憫。
803.991	813.653	十六節我若呼籲呼籲祂的憐憫祂應允我我仍不信祂真聽我的聲音。
813.653	814.253	什麼意思呢?
814.253	851.358	因為神還是沒有停手攻擊我就代表我還是沒有得著神對我的真正的回應祂的憐憫沒有連到我身上要麼就停止攻擊我要麼就讓我 不要再活了我這一生勞苦就停在這裡了因為我快撐不住了十七節他用暴風折斷我無故的加增我的損傷我就是喘一口氣他都不容許到時我滿心苦惱若潤力量他真有能力 若論審判。
851.358	855.601	他說誰能將我傳來呢?
855.601	878.545	他說沒有人敢跟神辯論也沒有人敢跟神來比力量那甚至說要討論神公不公平公不公義誰能夠把神呼傳來法庭上 讓神被審判,說你公義還是不公義呢?
878.545	879.785	誰能審判神啊?
879.785	883.606	誰能把神叫來法庭,檢視祂公義或不公義?
883.606	886.147	沒有人,因為神祂完全公義。
886.147	899.691	所以你們不要搞錯方向,我沒有要攻擊神的公義,我只是說,我不知道為什麼神要攻擊我,不代表我在質疑神的公義,但我現在是在呼求神的憐憫。
899.691	909.600	二十節,我雖有義, 我自己的口要定我為有罪,我雖完全,我口必顯我為彎曲。
909.600	912.002	什麼意思呢?
912.002	915.405	我的義在神的面前根本是為不足道。
915.405	922.550	我如果要拿我的義跟神的義來討價還價,這不就剛好顯出我的不義嗎?
922.550	928.535	一個人要不斷的在別人面前說他是一個義人,剛好顯出他的愚昧跟罪。
929.258	937.640	所以我不會以我的這個微薄的義,來跟神的完全的義,討價還價。
937.640	940.200	我要的是祂的憐命。
940.200	945.842	21節,我本完全不顧自己,我厭惡自己的生命。
945.842	952.963	他說我本完全,他是說我是有義的,我在這件事情上我沒有犯罪。
952.963	957.164	不顧自己,其實原文應該是,但是我現在已經不認識我自己了。
957.585	988.774	就是我真的是在這件事情上我有意我是公義的我沒有犯罪我本完全但是現在已經弄到我不認識我自己了因為我不斷的去臆測去檢視我到底裡面到底哪裡得罪神我已經不認識我自己了不斷的去猜想到底還有哪裡有問題嗎以至於讓神公義的審判連到我 所以我不能再走這條路了。
988.774	994.197	再這樣走下去不斷的去找看裡面哪裏有犯罪犯錯。
994.197	997.039	這個我連我自己都不認識了。
997.039	999.601	我會厭惡我自己的生命。
999.601	1002.502	就如同尼採很有名的一句話。
1002.502	1005.064	當你凝視深淵的時候。
1005.064	1008.206	深淵也正在凝視你。
1008.206	1012.128	代表說當一個人永無止境的去懷疑的時候。
1012.128	1013.289	他會感到一種恐懼。
1014.258	1016.739	因為他會發現那是一個無底洞。
1016.739	1019.340	他永遠不斷的在懷疑、懷疑、懷疑。
1019.340	1023.441	他會發現那個深淵也在凝視著他。
1023.441	1025.802	一個無底洞的恐懼。
1025.802	1032.604	所以當約伯如果按照他的朋友的建議,趕快往裡面去檢視你是哪裡得罪神。
1032.604	1035.284	他說,我不要再這樣下去了。
1035.284	1037.465	我已經不認識我自己了。
1037.465	1040.246	這樣子我只是會越來越恨惡我自己的生命。
1041.459	1047.593	善惡無分都是一樣,所以我說,完全人和惡人祂都滅絕。
1048.404	1050.225	善惡無分。
1050.225	1051.705	善惡沒有差別,都是一樣。
1051.705	1054.086	其實原文沒有善惡無分。
1054.086	1057.648	原文是他都是一樣。
1057.648	1059.269	什麼叫他都是一樣?
1059.269	1073.775	就是不要以完全人跟惡人,現在是不是完全得到上帝的獎賞,或是完全得到罪惡的審判。
1074.735	1078.716	來判斷上帝是不是公義的。
1078.716	1086.778	因為神祂有時候就真的容許,這個世界上,看起來有一些人惡,還沒有惡報。
1086.778	1089.818	有些人現在看起來善,還沒有善報。
1089.818	1096.060	因為,你若不把終末的眼光放進來,這個世界的確是如此。
1096.060	1097.040	所以他說怎麼樣?
1097.040	1098.480	都是一樣的。
1098.480	1102.101	所以我說,完全人跟惡人祂都滅絕。
1102.101	1107.261	也就是說, 義人不一定不會遭遇苦難。
1107.261	1111.523	而彼勒達你的論點是,義人一定不會遭遇苦難。
1111.523	1113.123	惡人才會遭遇苦難。
1113.123	1118.225	但是我告訴你,這個世界上就是,很多時候惡人並沒有遭遇苦難。
1118.225	1121.246	而很多時候,義人卻遭遇苦難。
1121.246	1125.407	但是我認為即便如此,神仍然是公義的。
1125.407	1131.489	因為神容許這樣事情發生,祂另有目的。
1131.489	1132.890	所以我並沒有挑戰神的公義。
1133.848	1142.190	23節,若忽然遭殺害之禍﹐他必細笑無辜的人遇難。
1142.190	1149.012	這會讓我們,中文會讓我們誤解,以為這個是神很壞,在故意嘲笑我們的苦難。
1149.012	1159.255	原文比較好的翻譯應該是說,鞭子若突然殺害,鞭子他必細笑無辜的人遇難。
1159.255	1201.050	是指說這個苦難災害突然來臨, 然後苦難災害對那個無辜的人好像沒有任何的憐憫同情不管你是義人還是惡人也就是說即便是義人在世界上仍然會遇到苦難而並不是因為他在這件事情上他犯了什麼罪而這個苦難是神允許讓它發生的神另有原因另有目的二十四節世界交在惡人手中 他蒙蔽世界審判官的臉,若不是他,是誰呢?
1201.050	1216.393	世界原文是地,意思是一樣,這世界看起來常常是被交在這個惡人的手中,你不是說,神是這個必不丟棄完全人,也不輔助邪惡人的上帝嗎?
1216.393	1227.661	可是這個世界看起來常常被交在惡人的手中, 那,蒙蔽這個世界審判官的臉,是公義無法彰顯的,豈不是上帝嗎?
1227.661	1231.503	所以不要再說,義人絕對不會受苦。
1231.503	1234.705	不要再說,惡人一定受苦。
1234.705	1239.487	也不要再說,也不要倒過來說,凡受苦的,必是惡人。
1239.487	1240.688	我不是啊。
1240.688	1242.168	那為什麼我會受苦?
1242.168	1243.989	你解釋不出來。
1243.989	1246.831	因為,神祂有另外一個目的。
1246.831	1248.492	而這個目的是什麼?
1248.492	1248.972	我也不知道。
1249.923	1258.127	我不知道你不知道你就不要妄加的論斷來說我一定是罪人這樣子對我有什麼幫助呢?
1258.127	1281.116	我們一起來禱告主我們尊重祢的主權我們也不因為這世界上有時候惡人還沒有遭報義人也會遇見苦難就慾望的來評論你是不公義的神 因為有時候我們沒有把終末的眼光放進來。
1281.116	1285.258	不知道世人都有一死且死後有審判。
1285.258	1288.360	我們就會被現象所迷惑。
1288.360	1291.522	求神你這位公義憐憫的神。
1291.522	1294.523	不斷的把你的手放在我的生命中。
1294.523	1296.825	使我能夠在各樣的環境裡面。
1296.825	1298.826	仍然尋求你的面。
1298.826	1300.287	奉主耶穌的名禱告。
1300.287	1301.227	阿們。
1301.227	1302.428	願神賜福大家。