start	end	text
4.070	5.991	弟兄姊妹平安，我們一起來思想。
5.991	9.394	《但依理書》第十二章一到七節。
9.394	14.598	那時保佑你本國之民,則是以色列的天使長米加勒。
14.598	18.080	米加勒的意思是誰向上帝呢?
18.080	25.645	必站起來,指的是為以色列百姓徵戰,並且有大艱難,指的是極大的災難毀滅。
25.645	31.650	從有國以來,就是指從有以色列以來,直到此時沒有這樣的。
32.090	34.191	到底指的是什麼呢?
34.191	42.593	指的是歷史上安提亞古四世對耶路撒冷所造成的毀壞、傷害。
42.593	53.196	還是指的,如同有一些人也認為,他指的就是末日的時候,敵基督所要進行的對聖民極大的逼迫跟毀滅。
54.514	62.057	弟兄姊妹我們可能要來思想一下,但以理書十章、十一章、十二章,這是一個段落。
62.057	64.458	他到底是要寫給誰看的?
64.458	67.739	基本上是寫給但以理的本國之名。
67.739	77.303	因為在第十章的時候,第十四節就有提到,天使他為什麼要來跟但以理說一個這麼大的預言。
77.303	85.281	十四節說,十章十四節, 為要使你明白本國之民日後必遭遇的事。
85.281	93.826	因此弟兄姊妹，我們讀但以理書的時候,盡量不要那麼快就用新約的啟示錄來解讀但以理書。
93.826	104.271	再來就是說我們要去留意,到底這一些關乎本國之民以色列的預言,是否已經在歷史上應驗了。
104.271	115.963	我想不需要太快的就是做靈異解經, 那這會影響到我們對十一章三十六節到四十五節的看法。
115.963	163.632	如果十一章的三十六節到四十五節,講的那個可惡的國王,仍然還是指安提阿古四世的話, 那十二章這邊所提的就有可能還是在講一些關於猶太人已經在歷史中應驗的大艱難但如果十一章三十六節到最後所講的已經不是在講安提阿古世事而是講敵基督的話那十二章這邊所講的大艱難當然就很有可能講的是末日的時候敵基督要逼迫聖徒的事情 我們看一下為什麼會產生這樣的一個爭論,就是說十一章後半段講的不是安提阿古事事。
163.632	173.200	第一,安提阿古事事在十一章三十六節, 在歷史上,他真的有用奇異的話攻擊過萬神之神嗎?
173.200	174.741	我想是有的。
174.741	177.362	因為他自稱是神明顯現。
177.362	183.285	他在自己所發行的錢幣上,寫他自己叫做Epiphanes。
183.285	185.326	他很多的行為,驕傲狂妄。
185.326	191.670	因此猶太人給他取一個綽號叫瘋子,叫Epiphanes。
191.670	206.756	第二個呢,就是說安提愛古事是 他有如同11章37節所說的,他必不顧他列祖的神,無論何神他都不顧,因為他必自大高過一切。
206.756	218.780	有質疑者認為說,這個安提阿古士是他還是有敬拜這個希臘的宙斯啊,只有真正的敵基督,他才會什麼神都不敗。
218.780	233.585	但是我們看一下11章38節,他立刻就有講,他有啊, 祂道要敬拜寶藏的神,用金銀寶石和可愛之物,敬奉祂列祖所不認識的神。
233.585	240.527	那,問題在於這個寶藏的神,這個列祖所不認識的神,指的又是什麼呢?
241.425	247.528	我個人認為在單一禮書十一章裡面,有三個地方提到保障。
247.528	253.652	例如十一節,祂必興兵,這兵必褻瀆聖地,就是保障。
253.652	259.215	並且在這裡祂除掉長線的繁紀,設立那行毀壞可證的。
259.906	265.191	因此呢,保障其實在11章裡面指的就是聖地或是聖殿。
265.191	273.118	在真實歷史裡面,安提亞古逝世也的確在聖殿的旁邊蓋了一個城堡,叫做雅吉拉城堡。
273.118	279.343	我們也可以看一下39節,祂必靠外邦神的幫助攻破最堅固的保障。
279.343	280.624	我想指的也是聖殿。
281.596	291.605	因此我們可以說,祂敬拜寶藏的神,或許可以理解,就是祂在聖殿裡面設立了咒師的祭壇。
291.605	298.652	祂在聖殿、在寶藏裡面,祂用金銀、寶石、可愛植物來獻祭給祂的咒師。
299.633	304.234	而這個被他攻破的最堅固的保障,指的就是聖殿。
304.234	307.414	我想我們或許可以從這個角度來理解。
307.414	310.415	安提阿古斯的確有這樣做。
310.415	312.575	第三個就是在第40節。
312.575	318.056	到了末了,南方的王要與他,指的就是北方的王,交戰。
318.056	327.558	而北方的王必用戰車馬兵和許多的戰船,視如暴風來攻擊他,但也必進入獵國如洪水氾濫。
327.978	334.000	有人認為安提阿古四世他沒有用戰船、海軍來攻打埃及。
334.000	336.541	甚至有人說他們根本沒有海軍。
336.541	338.661	但是這跟歷史是不符合的。
338.661	347.984	在十一章十八節的時候就已經講到這個他的父親安提阿古三世這個他必轉回奪取了許多的海島。
347.984	351.305	如果沒有海軍怎麼能夠奪取海島呢?
351.305	362.909	並且這邊十八節也記載有一個羅馬的元帥打敗了 這個安提阿古三世,其中有場很有名的戰役,就是愛琴海戰役。
362.909	365.930	這個他們的海軍被羅馬人殲滅。
365.930	370.031	因此呢,他們是有海軍的,這個是沒有問題的。
370.031	373.892	甚至說,他有進入列國如洪水氾濫嗎?
375.111	380.737	能夠進入列國,只能敵基督吧,才能夠在全世界各地做破壞的工作。
380.737	393.770	我想這邊列國指的是中東這個地區,就如同41節所說的那個多國,還有很多什麼這個中東的國家啦,北非的國家,從這個40節以後都有提到。
393.770	400.216	因此我個人還是認為, 十一章三十六節以後,還是在講歷史。
400.216	402.799	那我們就回來看第十二章。
402.799	405.342	十二章呢,我們繼續往下看。
405.342	410.468	你本國的民衆,凡名錄在冊上的,必得拯救。
410.468	420.367	在這個極大的艱難跟逼迫的時候,這個, 上帝凡這個在生命冊上有祂們名字的,上帝都必拯救。
420.367	430.393	第二節,睡在塵埃中的,必有多人復甦,其中有得永生的,有受羞辱,永遠被證悟的。
430.393	474.176	這邊提到說,那些在大艱難當中, 死掉的人有一天他們會再一次的醒過來其中這個堅持信仰在神面前是一人的祂會得著永生但是有那些背棄信仰的與仇敵同流合污的必受羞辱永遠被證悟當然這邊我們要把他靈異解經來 去理解將來有一天,敵基督在末日來攻打聖民的時候,堅持信仰的,他雖然殉道了,但是神還是要在他復活的時候稱讚他。
474.176	481.181	而那離棄信仰的,與獸同流合污的,與敵基督同流合污的,當然也會得著永遠的羞辱。
482.022	493.151	第三節,智慧人必發光,如同天上的光,那使多人歸意的,必發光如星星,直到永永遠遠。
494.019	500.407	在這個大艱難的時候在信仰考驗的時代需要智慧人。
500.407	501.669	什麼叫智慧人?
501.669	505.274	智慧人就是使多人皈依的。
505.274	535.394	智慧人就是堅持自己的信仰和原則不像這個仇敵的逼迫低頭 因為他們這樣子的堅持信仰,就算他們在十一章裡面,十一章三十三節裡面講到,他們必迅回多人,雖然他們多日必倒在刀劍之下,但是透過他們的堅持,甚至是受苦受難,也會激勵更多的人來堅持信仰,使多人皈依。
535.394	540.877	因此呢,他們在神眼中的價值,如天上發光的星星,要直到永永遠遠。
541.698	548.001	第四節,但以理啊,你要隱藏這話,封閉這書,直到末時。
548.001	552.102	必有多人來往奔跑,知識就必增長。
552.102	554.123	天使已經在提醒但以理了。
554.123	558.025	我現在講了很多的話,你現在是不能明白。
558.025	560.586	到以後,就會明白。
560.586	569.670	因此暫時好像讀不懂,但是到了 時間到的時候﹐就有很多人開始﹐想要來理解這一段預言是什麼。
569.670	573.551	就必有多人來往奔跑﹐切心研究。
573.551	576.013	而那時候知識就必增長。
576.013	585.556	代表說那時候﹐對這個預言的這個認識跟體認﹐ 這會越來越多、越來越深刻。
585.556	592.138	第五節,我但以理觀看,見另有兩個人站立,一個在河這邊,一個在河那邊。
592.138	602.541	還有第三個,第六節,有一個站在河水以上的,穿細麻衣的說,這奇異的事,到幾時才應驗了。
604.787	607.250	這奇異的事指的是什麼呢?
607.250	631.516	我認為他指的就是十二章第一節的從本國以來直到此時所從來沒有發生過的大艱難 那因為這個預言已經快到尾聲了,但伊裡就非常關心,到底在安提阿古逝世,希臘帝國以後,會發生一個這樣的大艱難。
631.516	634.217	這個是什麼時候會發生的呢?
634.217	642.881	因為但伊裡聽了都非常的害怕,也非常的擔憂,所以這個他很想知道這樣的事情。
643.831	656.340	然後第七節,我聽見那站在河水以上穿細麻衣的向天舉起左右手,指著活到永遠的主啟示說。
656.340	667.367	一般以色列人他們啟示只會舉起一隻手,但這個天使他是舉起兩隻手來啟示,就代表說這件事情是一定會發生的。
668.268	677.751	祂說要到一載﹑二載﹑半載﹑打破聖民權力的時候這一切事都應驗了。
677.751	711.012	我們如果認為十一章三十六節以後已經不講歷史了在講末後的日子在講敵基督從那時候就開始用靈異解經或是用新約啟示錄的方式來解釋十一章的後半段跟整個十二章 那我們就一定也會用這個靈異解經的方式來解釋什麼叫做一載、二載、半載,然後打破聖明的權利。
712.739	723.827	如果我們照這個方法可以來了解,祂的意思可能是指,聖民要受一段時間,一載就是一段時間的逼迫。
723.827	729.831	然後呢,逼迫會越來越嚴重,所以是加倍的,變兩載。
729.831	736.915	但是後來因為上帝出手拯救,然後就縮短那個受苦,只剩半載。
738.114	770.775	這是一種解釋但我認為這樣的解釋不太合乎這個字面所說的因為它是指一載、二載、半載都過去了然後在一載、二載、半載連半載也結束了是聖明的權力完全被打破也就是說聖明整個被逼迫就快要死的時候上帝才會出手而不是在一載、兩載 兩載結束,上帝就出手,使祂變半載。
770.775	773.196	我想經文並不是這樣說。
773.196	783.699	那如果我們是從歷史的角度來看呢,如果我們認為,這邊還是在講,一定會發生在以色列百姓身上的事,而且已經發生了。
783.699	791.781	我想從但以理書的整個一到十二章的線索裡面,最直接的,就是第七章,羅馬帝國的那個小角。
792.381	817.677	我們上次提到那邊也指到說他怎麼樣也是有一載、二載、半載 在第七章的第25節,這個羅馬帝國的小角,第十一個王,他必向至高者說誇大的話,必折磨至高者的聖名,必想改變節期跟律法,聖名必交付他的手一載、二載、半載。
817.677	823.502	這個我們之前在第七章已經有解釋過,這邊很可能是指提多。
824.343	829.665	那他跟他的父親一起去彌平耶路撒冷的叛變。
829.665	837.509	耶路撒冷從主後66年開始,因為羅馬人的暴政,他就起來叛變。
837.509	851.933	從66年年中間左右, 然後第一年,如果我們這邊一載解釋成一年的話,第一年,羅馬政府派了一個將軍Galus來鎮壓,輸了,打不下來。
851.933	860.899	因此,就派了一個將軍叫威斯帕先,帶他的兒子提多,來到耶路撒冷繼續攻打。
861.664	868.727	然後呢,Galus,第一年是Galus在負責,第二年跟第三年是威斯帕先在負責。
868.727	878.372	而威斯帕先,他打完第三年之後,他暫時停止了,因為他回羅馬帝國去搶奪王位。
878.372	880.853	所以就把軍隊交給他的兒子。
880.853	887.877	後來他的兒子就用了將近半年的時間,就是半載攻破耶路撒冷,毀壞整個聖殿。
888.677	900.057	因此,弟兄姊妹,我個人認為,這邊在講的,從有國以來,直到此時,所沒有過的大艱難會發生。
901.493	904.176	而且很多人會受苦。
904.176	913.286	我想很可能指的就是,主後七十年,耶路撒冷被攻陷,聖殿整個被拆光光。
913.286	916.789	從此以色列人正式的亡國。
916.789	919.192	我想指的可能是這一段。
919.192	919.933	我們一起來禱告。
921.425	928.292	主啊,我們在祢面前承認,主啊,有很多的事情,我們像但以理一樣,不一定完全明白。
928.292	930.174	我們只是盡量去理解。
930.174	941.367	但是最終的重點是,主你透過但以理,鼓勵以色列人,也鼓勵今天的基督徒, 面對仇敵的徵戰。
941.367	946.213	面對這個世界所給我們的試探、誘惑跟壓力。
946.213	948.215	我們一定要靠主得勝。
948.215	951.379	並且希望我們可以做智慧人。
951.379	954.863	不僅自己在主面前堅定我們的信仰。
954.863	957.326	還可以影響更多的聖徒。
957.927	960.028	引領他們歸義。
960.028	962.848	引領他們走在主的旨意裡面。
962.848	963.649	謝謝主。
963.649	966.269	謝謝祢為我們徵戰。
966.269	967.190	主祢必得勝。
967.190	969.470	而我們也必與祢一同得勝。
969.470	970.631	站立的主。
970.631	972.331	奉主耶穌的名禱告。
972.331	973.111	阿們。
973.111	974.512	願神祝福大家。