start	end	text
0.009	22.388	這位救主的奇妙好消息,而且不管是我們外出,或者是我們自己在家鄉的,我們也求主幫助我們,在這過程當中,求聖靈讓我們敏銳於祂,我們就是要來傳福音,我們就是要來向人分享,神在我們生命當中奇妙的作為,我們同生的來開口。
23.029	29.653	主啊,是的,謝謝祢把那個好消息先傳給我們,讓我們能夠來認識祢。
29.653	34.696	主啊,我們如今領受了這個好消息,領受了這個救恩。
34.696	46.142	主啊,是的,我們也要樂意把這樣的奇妙的經歷,把我們對祢這位奇妙的主的認識,也要分享傳遞出去。
46.142	47.223	主,求祢幫助我們。
47.483	71.969	求祢幫助孩子,幫助我們,無論是我們在家裡,在原本的城市的,或者是出外旅行的,主啊,讓我們在日常生活當中,繼續的更多的來認識祢,繼續更多的來仰望祢,主啊,來經歷祢,祝我們也能夠按著聖靈的感動, 主啊我們向人分享祢的奇妙作為。
71.969	75.111	向人分享祢奇妙的大愛。
75.111	76.912	主我們真的是祈求祢。
76.912	79.353	是的主讓我們去得人如魚。
79.353	81.315	不是靠著我們自己的口才。
81.315	83.816	不是靠著我們的勢力或才能。
83.816	88.420	乃是靠著聖靈祢自的大能大力。
88.420	91.041	主乃靠著聖靈祢的引領。
91.041	93.683	主我們要等候觀看祢奇妙的作為。
93.683	95.004	主我們謝謝祢。
95.004	96.505	我們讚美祢。
96.505	97.145	哈利路亞。
99.138	134.933	接著我們要一起來為暑期的孩子們,你如果家裡有孩子或者是老師是放暑假的,我們或者是在學校工作有暑假的,我們為每一個人在暑期的過程,他們不是只是在家裡耍廢,不是只是一直打電動, 我們真的是也求神幫助這些﹐可以放暑假的在這過程當中﹐他們能夠更多的被神吸引﹐能夠做事有意義﹐能夠讓他們可以放鬆﹐可以有好的休息﹐但也可以有充實的一個假期。
134.933	139.316	我們同生的來為﹐可以有放暑假﹐有暑期假期的人來禱告。
139.316	141.598	你如果想到誰﹐你也可以為他們來提名祝福。
142.568	149.852	哈雷路亞主,我們要為我們當中的每一個老師,主祂們也可以放暑假的老師們,向祢獻上感謝。
149.852	156.797	還有我們有在學校服事的同工們,員工們,主祂們暑假的假期也比較多。
156.797	161.539	主啊,是的,還有我們的學生們,我們都交託仰望在祢的手裡。
161.539	167.362	主啊,讓他們在這整個暑期的過程, 祝他們每一天的行程在祢手中。
167.362	170.404	祝他們每一天主啊,他們仰望祢。
170.404	177.487	祝他們在這個假期裡面,他們知道怎麼,他們真的經歷在主裡的放鬆,在主裡的安息。
177.487	187.331	主啊,在這過程,主祢也幫助他們,好像眺望他們裡面的興趣,或者是他們想要去做的事情,主就求祢保守。
187.551	198.019	讓他們這整個過程當中,主,他們真的經歷祢,他們的暑假是有安息,是愉快的,他們整個暑假是豐富收穫的。
198.019	208.607	主啊,是的,我們也祈求祢來祝福,有暑期輔導的這一些孩子們跟老師們,求祢保守他們在暑期輔導的過程, 主啊,有祢的恩典。
208.607	215.551	主啊,試著讓他們在暑期輔導的過程,祝他們老師跟學生也都有好的收穫。
215.551	219.954	主啊,我們謝謝祢,我們讚美祢,哈利路亞。
219.954	223.596	接著好不好,我們一起來為我們的校園來禱告。
223.596	236.685	因為暑期其實是很多,接下來特別是八月,有老師們他們要開始學校開始要有學生,現在是有學生他們要開始登記下學年的學校。
237.005	239.487	繁體中文，臺灣國語。
239.487	241.509	繁體中文，臺灣國語。
241.509	242.890	繁體中文，臺灣國語。
252.278	260.202	好像我們也很少想到,就覺得反正老師教這麼久了,開課就好像很厲害就直接講了。
260.202	268.606	但我們常常忘記,其實認真的老師他們幕後花了很多時間在預備,也有很多幕後的同工在幫助他們。
268.606	279.872	好,幫我們同聲的來開口,為這些老師們他們在備課,為這些同工們能夠來成全孩子們在新的學年,有好的學習,我們求神紀念他們。
279.872	281.873	同聲的開口,你想到什麼就祝福他們。
283.200	291.266	主使的,我們為每一個在校園裡面的老師們,或者是這些教授們向你獻上感謝。
291.266	332.951	主要我們當中有許多的老師,主要無論是青榮、宗運、司祺,主要無論是俊樂跟安君, 主啊,是的,還有我們當中有老師的﹐或者是有在補習班當老師的﹐主啊,是的,他們很長﹐花很多的心力在備課﹐求祢幫助他們在備課的過程﹐祝他們是由祢來的創意﹐主啊,在每一次的這樣課程﹐主,雖然好像那個主軸跟內容﹐大致上都一樣﹐但是有許多的一些例證﹐或一些的創意教法﹐一些提問﹐ 怎麼教法讓孩子是更有興趣的。
332.951	335.812	就求你親自來賜福保守這些老師們。
335.812	340.674	主啊,你讓他們在這整個過程,真的經歷他們依靠你。
340.674	343.555	主他們在設計在預備課程的過程。
343.555	346.556	主他們也是越加的被你矯枉,是喜樂的。
346.596	366.110	繁體中文， 繁體中文，臺灣國語。
379.906	384.507	祂們越來越能夠發現祂們自己的興趣。
384.507	388.748	主啊,是的,我們把我們所愛的孩子們﹐交通仰望在祢的手裡。
388.748	397.310	主啊,讓我們的孩子們﹐能夠越來越多找到人生的方向﹐越來越多的真的是知道他們人生的目的﹐或他們為了什麼而活。
397.310	401.870	主啊,是的,我們真的祈求祢﹐在孩子們的生命當中來動工。
401.870	403.211	我們謝謝祢,讚美祢。
405.469	433.857	最後我們要一起來為﹐你所要傳福音﹐你有負擔的﹐你所關懷的人﹐我們現在就為他們提名來禱告﹐或者你們的小組裡面﹐有人還沒有受洗歸入主名﹐還在悟道的﹐或者是你有家人親友﹐還沒認識神的﹐好吧我們就同聲的來開口﹐我們來為這些還不認識神的人﹐或者是悟道友﹐或者是浪子﹐ 他們已經認識神ﷺ但他們遠離了神了。
433.857	435.718	我們現在就提名為他們禱告。
435.718	438.158	同生的來開口。
438.158	439.339	主我們要讚美祢。
439.339	442.040	主孩子要繼續的為我的爸爸媽媽。
442.040	449.442	主要為我的大哥大嫂ﷺ他們兩個孩子都為我二哥二嫂ﷺ還有為爸爸家族媽媽的家族來禱告。
449.442	452.643	主要是的我們還有牧長同工們的家人。
452.643	454.624	主還有我們弟兄姊妹的家人。
454.804	456.525	繁體中文，臺灣國語。
456.525	529.076	繁體中文， 主我們真的呼求祢,我們呼求祢幫助我們,幫助我們不走在祢前面,幫助我們緊緊跟隨祢來服侍這些還不信主的家人,主要來服侍那些浪子,主要是的主讓那些認識祢又遠離祢的, 主啊,是的,我們要讚美敬拜祢, 謝謝祢賜給我們耶穌基督這聖明的全餅。
529.076	535.439	我們可以彼此的祝福,我們可以為祢放在我們裡面有負擔的來禱告。
535.439	537.080	祝我們何等有福。
537.080	543.604	我們把我們一切所禱告的教頭堂皇在祢的手中,奉耶穌基督寶貴的名祈求。
543.604	546.566	阿們。
546.566	551.889	各位兄姊妹,你已經預備好,要用你的全心全忍來敬拜讚美神了嗎?
553.712	565.999	如果您是被邀來的新朋友,你還不認識我們所敬拜的這位神,或許你是第一次來教會,或者你有聽過祂,但對祂不熟。
565.999	575.144	今天呢,邀請您跟我們一起透過詩歌,你可以透過我們所唱的詩歌,來認識我們這位神。
575.144	582.448	你也可以跟我們一起來唱,因為我們這位神,即使你還不認識祂,祂早就認識你了。
582.688	584.849	而且祂早就愛你了。
584.849	588.351	祂在等候,你是否願意接受祂對你的愛。
588.351	605.601	所以今天呢,我們在所有的基督徒神的兒女在這裡敬拜祂,是因為我們知道,我們也經歷,祂是那位施慈愛,有憐憫, 沒有什麼可以隔絕祂對我們愛的那位奇妙的真神。
605.601	608.401	我們要來一同敬拜讚美祂。
608.401	613.283	所以待會呢,你如果身體不舒服,你要坐下來也沒關係。
613.283	622.006	那我們呢,邀請你跟我們一起,一起來唱詩歌,一起來認識敬拜我們這位奇妙的真神。
623.353	642.901	是的,主耶穌基督是我們的救主,因為祂在兩千多年前,沒有經過你我的同意,就為你我的罪孽過犯,被釘在十字架上,為我們擔當了罪的結果,就是死亡。
642.901	647.037	如今,祂 已經復活升天。
647.037	656.264	因為在兩千多年前,祂為我們的罪孽過犯,被釘在十字架上,受死之後,祂被放在墳墓裡。
656.264	658.806	三天後,祂復活了。
658.806	666.391	祂復活之後有四十天,是在這地上,有許多的人都看見祂,也與祂同在。
666.391	672.956	四十天後,祂在眾人的眼前,被天使, 被接到天上去。
672.956	675.537	耶穌基督應許祂會再來。
675.537	687.746	祂再來的時候,就是我們可以屬祂,屬神的百姓,可以一起經歷那個美好的永生,那個美好與祂同在的,就是我們講的天堂。
687.746	693.611	所以呢,我們的主耶穌基督,祂是已經是死而復活的主。
693.611	699.395	我們一起要來稱頌,讚美我們這位復活主耶穌。
699.395	700.296	你預備好了嗎?
702.790	705.671	你現在好像沒有吃早餐。
705.671	707.512	你預備好了嗎?
707.512	709.393	我們感謝主我們一起。
709.393	710.693	我們用這首詩歌。
710.693	713.875	我們向我們的主耶穌來歡唱歌頌餐。
716.800	754.024	復活的主是主耶穌ﷺ世上沒有他的分母ﷺ挪開救助 挪開羞辱ﷺ他已完成偉大救贖復活的主是主耶穌ﷺ世上沒有他的分母ﷺ同來獲福 同來慶祝ﷺ他已完成偉大救贖 是想有那一位神,為世人而生。
754.024	763.009	是想有那一位神,為世人而死。
763.009	767.891	是想有那一位神,為世人復活。
769.172	784.592	世上有哪一位救主﹔情願任我這復活的主﹔ 復活的主是主耶穌。
784.592	787.032	世上沒有祂的本母。
787.032	790.974	諾開宗主 得開羞辱。
790.974	793.455	祂已完成偉大救贖。
793.455	798.297	復活的主是主耶穌。
798.297	799.457	世上沒有祂的本母。
799.457	805.279	同來黃骨 同來青竹。
805.279	807.540	祂已完成偉大救贖。
809.821	816.764	世上有哪一位神﹐為死人而生。
816.764	825.368	世上有哪一位神﹐為死人而死。
825.368	832.231	世上有哪一位神﹐為死人而活。
832.231	837.594	世上有哪一位救主﹐今天人活著。
841.374	844.777	我的主是主耶穌。
844.777	848.680	世上沒有祂的分母。
848.680	851.522	挪開宗族 挪開羞辱。
851.522	855.505	祂已完成偉大救贖。
855.505	858.907	我的主是主耶穌。
858.907	862.430	世上沒有祂的分母。
862.430	866.113	同來歡呼 同來慶祝。
866.113	867.794	祂已完成偉大救贖。
872.978	875.481	弟兄姊妹我們一起要來禱告。
875.481	878.904	是的這世上沒有一位神。
878.904	880.766	祂說我是為你而生。
880.766	883.028	也沒有一位神。
883.028	885.411	祂說我為你的罪孽過犯而死。
885.411	890.496	更沒有任何一位神祂為你而復活。
890.496	892.938	如今我們的神祂已經復活了。
893.439	903.486	祂是那位復活的主,祂現在與我們同在,祂現在是坐在父的右邊,常常為你我禱告。
903.486	918.976	好不好,神的百姓,神的兒女,我們就一起來為這位主耶穌基督,為我們成就的救恩,為祂奇妙的作為,為祂為我們而生而死而復活,我們向祂獻上最大的,感謝我們同生的來開口。
918.976	928.603	主我們讚美祢,主我們讚美祢, 主我們為祢為我們走的道路,我們來到祢的面前來敬拜祢,來讚美祢,來感謝祂。
928.603	947.197	主啊,是的,讓我還沒有認識祢的時候,甚至抵擋祢的時候,主啊,祢都為我而死,為我復活,主啊,祢為我復活,主啊,叫我能夠罪孽過犯, 主那代價被祢主啊被祢承擔了之後。
947.197	949.938	主我們在基督裡就是新造的人。
949.938	952.099	主我們讚美祢我們敬拜祢。
952.099	954.981	主啊是的祢是復活的主。
954.981	956.862	我們要宣告神祢的榮耀。
956.862	960.864	主啊因為祢配得祢配得。
960.864	964.445	主啊用滿有氣息的榮耀來伸送祢。
964.445	965.466	神我們感謝祢。
965.466	967.407	神我們謝謝祢神讚美祢。
967.407	972.610	是的世上有哪一位神為世人而生。
973.490	979.234	我們一起再次的說,世上有哪一位神為世人而生呢?
979.234	981.055	就是只有耶穌基督。
981.055	983.397	是的,主,我們讚美祢,我們敬拜祢。
983.397	987.180	主啊,謝謝祢為我們道成肉身。
987.180	989.421	主,謝謝祢為我們道成了肉身。
990.162	1024.017	在兩千多年前﹐你願意受限於在﹐人小小的子宮裡面﹐被生出來﹐為我們﹐成為我們摸的見﹐看的見﹐有血有肉的﹐那位﹐耶穌基督﹐我們謝謝你﹐我們讚美你﹐主啊我們今天﹐我們要來稱頌你﹐ 願今天受邀的朋友,或者是看直播,或看後續影片的人,主啊,每一個人,他們以前不認識你的,盼望今天他們能夠認識你。
1024.017	1027.420	主啊,是的,我們讚美你,我們敬拜你。
1027.420	1039.568	主,謝謝你,因為你不只拯救我們,你還使我們在危難當中,仍然可以信靠你,緊緊抓住你。
1039.568	1046.571	你是, 樂意二十四小時看顧我們,保護我們的神。
1046.571	1056.217	祢是樂意我們在基督裡,我們可以有新的生命,而且能夠有更豐盛的新生命的神。
1056.217	1059.379	主,我們要讚美祢,謝謝祢。
1059.379	1065.703	是的,主啊,無論環境如何,祢與我們同在,我們就不致懼怕。
1065.703	1069.966	主啊,是的,我們要用這首詩歌,我們要一起來敬拜祢。
1070.947	1075.169	你是我們的牧者,你是我們所倚靠的。
1075.169	1080.431	我們要來信靠你,因為深知你必帶領我們度過。
1080.431	1084.193	因為我有你,是我的神,我的王。
1084.193	1093.977	我們一起來唱,為難領導,我要信靠你,這位真神。
1093.977	1118.832	為難領導,我信靠你, 深知祢已令我渡過,祢心事為我堅持到最後。
1118.832	1139.593	當暴風雨向我靠近, 你與你同在﹐我不知畏懼。
1139.593	1146.135	你是我的捕捉﹐我所依靠。
1158.353	1167.127	祝你永遠在身邊。
1167.127	1169.791	祝你永遠與我同在。
1174.292	1180.054	在祢裡面沒有改變。
1180.054	1189.877	祢的堅定從昨日到今日,一直到永遠。
1189.877	1227.766	靠祢奉上一世佔領, 再次對祂說,為能領導,我要信靠祢。
1227.766	1233.049	為能領導,我信靠祢。
1233.049	1242.066	深知祢必領我度過, 我讀過。
1242.066	1247.913	你心事為我堅持到最後。
1252.807	1255.389	當暴風雨向我靠近。
1255.389	1258.430	有祢同在,我不知畏懼。
1258.430	1260.091	祢是我的牧者,我所依靠。
1283.200	1289.984	每個夜每一天。
1289.984	1297.509	我指你永遠在身邊。
1297.509	1302.632	祝你永遠與我同在。
1302.632	1307.055	在你裡面沒有改變。
1311.578	1319.622	你的前兵從昨日到今日一直到永遠。
1324.770	1331.613	要祢奉聖允許佔領。
1331.613	1338.556	我的未來在祢手中。
1338.556	1345.038	堅固盤石,卻能轉身。
1345.038	1350.401	我敬拜祢,祝祢永遠與我同在。
1352.688	1367.361	是你永遠與我同在,在你裡面沒有改變。
1367.361	1374.988	你的堅定從昨日到今日,一直到永遠。
1381.271	1388.632	靠祢奉神應許佔領。
1388.632	1395.714	我對未來在祢手中。
1395.714	1403.635	堅固盤石,全能爭勝,我敬拜祢。
1409.804	1433.149	是的,弟兄姊妹,新朋友們,這位真神祂是我們的堅固磐石,那堅固磐石是使我們可以不動搖的磐石,祂是我們的依靠,隨時的幫助,只要我們願意呼求祂,只要我們願意說,是的,求祢來介入我的這件事情, 我的這個困難。
1433.149	1434.630	我的這個疼痛。
1434.630	1437.412	我需要祢,求祢幫助我。
1437.412	1440.635	我要依靠祢,祂就必垂聽。
1440.635	1445.218	因為祂說祈求,祂就會聽你的禱告。
1445.218	1448.961	你尋求,祂就被你尋見。
1448.961	1451.123	你尋找,祂就被你尋見。
1451.123	1452.444	你叩門,祂就開門。
1452.444	1455.146	我們這位神是非常非常的溫柔。
1455.486	1458.388	祂是不會強行的。
1458.388	1459.708	祂等你願意。
1459.708	1460.789	你願意嗎?
1460.789	1464.491	好不好,我們自己來對這位神禱告。
1464.491	1465.892	你可以開聲。
1465.892	1468.073	你也可以在心裡禱告。
1468.073	1469.533	你來向祂禱告。
1469.533	1471.094	你有哪一些的困難?
1471.094	1473.055	你有哪一些的挑戰?
1473.055	1475.296	你有哪一些你過不去的坎?
1475.296	1476.997	說,你幫助我。
1476.997	1478.058	求你幫助我。
1478.058	1479.319	我要信靠你。
1479.319	1481.660	好不好,我們同聲的來對這位神來禱告。
1481.920	1489.003	把祢的困難,把祢的挑戰,把祢的難處,把祢的傷心,祢的痛,都交給祂。
1489.003	1490.084	哈利路亞。
1490.084	1493.745	主啊,是的,謝謝祢,我們讚美祢。
1493.745	1504.210	主啊,是的,即使今天外面是狂風暴雨,祝我們仍然不搖動,不害怕,因為我們有祢可以依靠。
1504.210	1509.674	主啊,是的,你就像那一顆磚, 如此的偉大。
1509.674	1517.303	主啊,祢遠超過這世上的一切,但祢卻眷顧如此渺小的我,我們。
1517.303	1522.849	主啊,是的,我們要把我們一切的難過,把我們的痛苦挑戰交給祢。
1523.490	1527.295	主啊,因為在我們不能,但在已沒有難成的事。
1527.295	1530.300	主啊,你知道我們的過去,現在,未來。
1530.300	1533.424	主,祢看得清清楚楚。
1533.424	1538.411	主,求祢幫助我,幫助我,使得我願意求祢來介入。
1538.411	1543.536	祢來這世間當中, 祢在我與人的關係當中做亡掌權。
1543.536	1548.260	祢來我的身體﹐疼痛的身體﹐軟弱的身體當中做亡掌權。
1548.260	1553.985	主啊﹐是的﹐因為都屬於祢﹐幫助我跨得一致。
1553.985	1560.872	幫助我﹐主啊﹐不被疼痛﹐主啊﹐幫助我﹐ 神祢是一位我們得勝一切的神。
1560.872	1562.174	神謝謝祢在美麗。
1562.174	1569.344	神謝謝祢當我們的痛苦在任何的困難面前任何的挑戰面前宣告祢的名的時候。
1569.344	1571.427	神我們相信祢勝過。
1571.427	1573.370	神讓我們相信祢勝過。
1574.411	1576.472	主我們讚美祢,謝謝祢。
1576.472	1580.434	主要是祢有祢的同在,我們就不懼難。
1580.434	1591.639	主我要緊緊的抓住祢,緊緊的抓住祢,好叫我能夠依靠祢來度過一切在我們前面的高山,在我們前面的窟窿。
1591.639	1596.802	主我們要感謝祢,謝謝祢這麼愛我們,謝謝祢,Hallelujah。
1598.660	1606.070	接著我們要一起來為在你的身心有特殊疾病的人來禱告。
1606.070	1628.004	我們要為我們今天的講員廖雅惠老師,她有她特殊的疾病,她特殊的身體的狀況, 還有如果你現在﹐或者是你的家人﹐現在正在癌症或腫瘤﹐或者是有特殊疾病的當中﹐受苦的﹐你可以舉手﹐我們一起﹐我們要一起來為他們來祷告。
1628.004	1641.287	我們求神的恩典托住他們﹐我們求神的醫治領導他們﹐他們還在疼痛發炎的﹐奉耶穌基督的名﹐要命令那癌細胞﹐要命令那些發炎的地方﹐都要止住。
1641.287	1644.689	我們同聲的來開口﹐ 祝愛祢是全能的醫治者。
1644.689	1646.651	祢是全能的醫治者。
1646.651	1647.291	祢是最好的醫生。
1659.121	1691.806	神我們讚美祢,神我們讚美祢,神我求祢更多的來帶領,神啊在他們的生命當中彰顯祢的全能,神在他們的生命當中彰顯祢的公義,彰顯祢的一致,神啊但凡他們得到醫治的,他們都能夠成為神祢福音的見證者,神祢大能的見證者,祢子神我求祢與他們同在,我求祢來醫治他們的生命,醫治他們的身體,醫治他們的病後,任何的發炎都求祢來治癒, 祝我們當中有疾病的求祢來醫治。
1691.806	1694.929	祝求祢的平安充滿他們需要被醫治的地方。
1694.929	1698.351	祝那地方的好細胞都要健壯起來。
1698.351	1703.315	好細胞我們的免疫系統、感染系統都要健壯起來。
1703.315	1704.476	祝我們呼求祢。
1704.476	1706.277	祝我們自己做不到。
1706.277	1708.019	但我們要呼求祢成為全能最好的醫生。
1708.019	1710.020	祝我們求祢憐悯祢的百姓。
1710.020	1711.001	求祢憐悯祢的兒女。
1711.001	1712.942	祝憐悯我們所愛的家人。
1716.425	1726.048	我們讚美祢,是的主啊,祢永遠與我們同在,主啊,是的祢永遠與我們同在,我們還懼怕什麼呢?
1726.048	1737.672	祝我們要再次的用這首詩歌來宣告,祢永遠與我們同在,在祢裡面沒有改變,從今日直到永遠我們要來信靠祢,我們一起來。
1738.712	1744.418	祝你永遠與我同在。
1744.418	1752.547	在你裡面沒有改變。
1752.547	1760.235	你的堅定從昨日到今日一直到永遠。
1766.425	1770.346	讓祢奉聖應許佔領。
1770.346	1780.208	我的未來在祢手中。
1780.208	1785.850	前途半世,全能爭勝。
1785.850	1789.590	我心白意。
1789.590	1791.251	祝祢永遠與我同在。
1793.609	1807.812	祝你永遠與我共在,在你裡面沒有改變。
1807.812	1816.054	你的堅定從昨日到今日,一直到永遠。
1821.237	1828.561	靠祢奉神依序佔領。
1828.561	1835.225	我的未來在祢手中。
1835.225	1844.770	堅固盤石,卻能真身,我敬拜祢。
1844.770	1847.791	堅固盤石,卻能真身,我敬拜祢。
1849.172	1859.079	堅固磐石,全能成神,我敬拜你。
1859.079	1863.622	再次宣告祂是你的堅固磐石。
1863.622	1872.828	堅固磐石,全能成神,我敬拜你。
1878.592	1883.055	主啊,這是我們眾人在祢面前的敬拜跟禱告。
1883.055	1890.400	是的,祢使我們兼顧磐石,我們在祢這磐石上,我們就不致動搖。
1890.400	1897.564	主,是的,祢是我們, 所信靠的全能真神。
1897.564	1902.848	主祢不是只是在聖經白紙黑紙裡面而已。
1902.848	1908.592	祢是從習在、經在、永遠都在的那位全能創造主。
1909.172	1921.326	我們敬拜祢,我們讚美祢,因為祢是我們的神,祢是我們唯一的神,除祢以外,別無他神。
1921.326	1945.233	願祢的寶座就設立在我們當中, 願主祢的靈自由運行在我們當中,兼顧我們的心,兼顧我們的信心,讓我們深深的紮在耶穌基督這磐石上,好叫我們不置動搖,奉耶穌基督寶貴的名祈求。
1945.233	1946.414	阿們。
1946.414	1947.134	哈利路亞。
1947.134	1950.934	我們把一切的掌聲,歸給我們的主上帝。
1950.934	1953.375	弟兄姊妹請坐。
1953.375	1953.895	各位請坐。
1956.493	1962.744	好,弟兄姊妹,知道我們桃園堂過去這一個禮拜我們發生了什麼事嗎?
1965.759	1968.641	下面有人嗎?
1968.641	1973.904	夏令營,我們有我們桃園堂第一個暑假。
1973.904	1979.328	我們也就第一次辦了兒童的情緒管理高手的夏令營。
1979.328	1983.731	我們這次總共有25位國中生來當小隊伍。
1983.731	1990.936	他們呢,他們用了兩天半的時間,被訓練成為可以帶弟弟妹妹們的小隊伍。
1990.936	2006.368	然後呢,兒童們從3、4、5、6 他們有四天的學習,怎麼樣來認別他們的情緒,怎麼樣的管控他們的負面情緒。
2006.368	2013.815	在這過程當中,昨天下午也有一場他們的父母來這裡的親職講座。
2016.237	2056.097	所以呢很感謝先生昨天整個營會非常完滿的落幕那我們就請同學幫我們播放這是他們這一些國中生的小隊伍的攝影組所剪輯的一個短片因為你最好我的利益就是我 小獅子小獅子的第一。
2115.503	2151.465	繁體中文， 好的,我們拍掌將一切的榮耀,歸給我們的神。
2151.465	2164.472	好的,昨天,我們這幾天陸續有聽到家長跟孩子們跟家長反應,孩子有跟家長說,蛤,為什麼只有四天,為什麼不是一個月?
2164.472	2169.295	然後呢,還有孩子們明天要回去,一直說, 你明年會辦吧?
2169.295	2172.136	你們下次什麼時候辦?
2172.136	2209.953	所以好不好我們邀請在這當中有參與服事的老師們還有預備餐食的這一些弟兄姊妹歡迎邀請你們起立好不好趕快老師們還有預備餐食的 還有我們給他們最熱烈的掌聲好不好還有後面的鍾韻還有我們今天在淡水塘的鄭君傳導他們真的很棒請坐各位弟兄姊妹 他們真的是非常的棒,尤其老師們。
2209.953	2219.140	他們本來以為只是一兩堂課,但當他們接了之後,開始開會了發現,原來要全程。
2219.140	2220.100	感謝主。
2220.100	2227.205	他們也都非常愛教會,非常愛大隊長,也非常的愛這些孩子們。
2227.205	2229.927	他們就是, 獲出去了啦!
2229.927	2232.530	整天即使再累也沒關係,對不對?
2232.530	2234.331	看到孩子們這麼可愛。
2234.331	2236.393	所以呢,好不好?
2236.393	2245.700	如果您可以,我邀請您起立,我們一起來為這一些所有參與的兒童,國中生,還有他們的家庭來禱告。
2245.700	2250.344	我們做這一些,其實就是希望把神的愛傳遞給他們。
