start	end	text
6594.296	6600.321	這三一真神與你們眾人同在,從今時直到永遠。
6601.442	6605.305	也願神的愛充滿我們。
6605.305	6625.382	讓我們聚會是為了散會後,帶著神的愛,帶著神所託付給我們的使命,我們就是要去,去到跟隨聖靈,要去傳福音,去向人見證,我們所信的神是如此奇妙,如此真實與信實。
6625.862	6636.991	以至於我們每一個人與主一起同行,成為那福音使者,能夠一直到見主面,奉耶穌基督寶貴的名祈求。
6636.991	6638.252	阿們。
6638.252	6640.855	願神賜福大家。
6640.855	6647.502	如果你有特別需要被禱告的, 我歡迎你可以來到前面。
6647.502	6651.989	我有看到慶維跟嘉惠,你們就是可以來到前面。
6651.989	6655.093	還有秀貞,你們可以來到前面。
6655.093	6658.178	如果有需要被禱告的,你們可以來到前面。
6658.178	6660.101	我可以邀請他們來為大家祝福。
6660.401	6789.926	好 那還有就是新朋友我們就是可以歡迎到這旁邊101教室我們有新人接待可以來接待你們讓你們更認識教會我們也可以更認識你們謝謝大家 謝謝 繁體中文，臺灣國語。