start	end	text
4534.945	4536.947	那病人就沒有自主權了。
4537.227	4541.510	但是上帝為我預備臺大非常優秀的醫療團隊。
4541.510	4549.616	這個林本仁醫師,他在手術前一天來到我的病房跟我說,雅惠我跟你保證,你不用做罩口。
4549.616	4554.640	這件事情對我來講,實在是放下心裡面的一個大石頭。
4556.032	4563.434	所以隔天我進了手術室,醫生就幫我做了切腸手術,切掉60公分的小腸。
4563.434	4567.315	切出來一大盤,大家有吃過大腸麵線嗎?
4567.315	4570.736	今天講完你們是不是不敢吃?
4570.736	4574.437	你知道,切出來一大盤,壞死的、紅腫的、黑掉的。
4574.437	4577.798	我跟你講,我是一個很愛吃腸子的人。
4579.599	4583.402	臺灣人喜歡講什麼吃心補心、吃腦補腦、吃腸補腸。
4583.402	4585.223	我覺得這個都騙人的。
4585.223	4589.626	我吃那麼多腸子,怎麼還得腸子病呢?
4589.626	4591.427	切出來一大盤。
4591.427	4593.889	但是你知道嗎?
4593.889	4603.096	當上帝透過臺大醫療團隊幫我做了這個切腸手術之後,我終於覺得我可以活得像個人。
4605.572	4610.296	什麼叫做活得像個人。
4610.296	4616.962	就是我終於可以吃東西,比較不會肚子痛。
4616.962	4631.135	剛那個影片是在我手術前,本來醫生宣判我是一輩子只能吃流質的,你想想看你一輩子只能喝,用喝的,多噁心啊,所有東西都打成爛爛的,只能用喝的。
4631.135	4638.588	當初醫生是這樣告訴我, 記得我在病床上跟上帝說什麼?
4638.588	4640.769	主,祢如果愛我,祢就怎樣?
4640.769	4642.250	證明給我看。
4642.250	4648.012	結果上帝透過這個手術向我證明了祂愛我。
4648.012	4661.356	我那時候覺得我整個人好像活過來了一樣,因為我終於可以比較有生活的品質,我終於可以吃東西, 比較不會肚子痛。
4661.356	4665.257	大家有沒有覺得這個願望實在是什麼願望啊?
4665.257	4670.338	每天從嘴巴吃進去,下面出來,這不是理所當然的事情嗎?
4670.338	4675.079	大家有沒有發現,這幾年,腸胃道有問題的人也不少。
4675.079	4682.600	有時候嘴巴吃下去,要可以順利出來這件事情,沒有我們想像中的那麼理所當然,是不是?
4682.600	4685.621	你有曾經為了這個事情,跟上帝獻上感恩嗎?
4685.981	4687.943	每天數算上帝恩典。
4687.943	4697.772	你知道這個能夠吃,能夠出來,對我來講,對我的人生來講,它就是一個非常奢侈的事情。
4697.772	4704.198	那個時候,當醫生幫我做了切腸手術,我心裡面,我就默默許下一個心願。
4704.198	4709.643	我就跟主說,主,接下來,臺灣最有名的是什麼?
4711.186	4714.909	除了人以外,就是什麼,臺灣小吃嘛。
4714.909	4721.895	我就想說,我要把那個過去不能吃的啦,什麼臭豆腐,鵝啊,煎啊,我都要吃一片啦。
4721.895	4725.399	就覺得,哎呀,我要好好的來享受我的人生。
4725.399	4730.883	我要好好的來享受上帝所賜的這個世界。
4730.883	4734.106	你知道我以前都開玩笑跟朋友說,你知道什麼叫克隆氏症嗎?
4734.106	4737.029	克隆氏症就是一種想死死不了活著又很辛苦的病。
4738.643	4743.767	所以我覺得我的人生不會再遇到更艱難的事情。
4743.767	4751.694	我就覺得這個病已經夠慘了,要跟它奮鬥一輩子,跟它共處一輩子,應該不會再有更淒慘的事情發生在我身上。
4751.694	4756.558	但是我從來都沒有想過,有一天我會得癌症。
4756.558	4778.210	我在2018年的8月份,醫生跟我說你得了子宮內膜癌, 我記得我那時候坐在那時候還沒有疫情我就坐在醫生的旁邊他跟我說我要馬上幫你排手術把那個淋巴卵巢子宮要全部拿掉那個時候四十幾歲 我沒有結婚,所以也沒有孩子。
4778.210	4781.491	醫生跟我講的當下,我也不知道是腦頓還怎樣。
4781.491	4789.034	我要跟醫生說,不行耶,我下禮拜要跟天運,我就是要跟天運去紐約,我說我要出差,我可不可以一個月以後回來再開。
4789.034	4797.997	他說當然不行,你化驗出來是非常惡性的量細胞,所以我要馬上幫你安排手術,你馬上出去打電話給你的老闆。
4798.865	4866.561	我記得我那個時候在診間我就突然啪就大哭你知道嗎我以前啊大家很喜歡看那個民視的連續劇嘛越灑狗血越愛看有沒有我以前都覺得最好有演那麼誇張啦只要醫生跟那個男女不管是哪個主角說欸你得了不治之症哇就覺得完了完了我完了完了我沒有我沒有我的人生已經變從那個彩色變黑暗沒有未來了 然後就大哭大鬧大叫有沒有我以前都覺得要不是為了收視率幹嘛演成這樣可是當我遇到同樣的事情我就跟那個電視上的人一樣我完全就是沒有辦法克制所以醫生嚇到了當我大哭的時候他就馬上叫個管事幫我帶到另外一個房間因為外面坐滿了通通都是孕婦 我已經不記得我那個時候哭了幾天,但是我知道我非常的難過、生氣,其實我非常憤怒。
4866.561	4870.363	我心裡面覺得,上帝你是覺得我不夠慘嗎?
4870.363	4874.066	你為什麼覺得我有辦法承擔這件事情?
4874.066	4880.190	而且我那時候覺得我找到一個非常充分的理由去結束我自己的生命。
4880.190	4922.166	你知道得癌症你是沒有明天的, 對不起我剛碰到你知道得癌症你是沒有明天可言的而且那時候我問醫生說我是第幾期我之後要不要化療電療他就說不知道我要等開刀進去我才知道我那時候非常的痛苦我也覺得算了我活這麼辛苦幹嘛克隆斯症加上癌症算了 我那個心裏面不好的念頭憂起來,就是覺得時時尊尊所不我這麼痛苦要做什麼,我就覺得算了,我結束生命比較快,因為我自認為我沒有辦法面對後面萬一要做化療、電療這件事情,我的身體根本沒有辦法承擔。
4922.166	4929.427	你知道就在我埋怨上帝,就在我非常痛苦的那幾天, 我不知道流了多少眼淚。
4929.427	4933.030	我不知道哭了幾天。
4933.030	4947.483	就在我一直埋怨上帝,一直問上帝為什麼是我,我就老覺得奇怪,別人都不會生病,那我已經那麼努力地想要,你知道嗎,經過克隆這麼多年的煎熬,我還是想要好好活著,你怎麼讓我得癌症呢?
4947.483	4950.265	這是莫名其妙。
4950.265	4954.429	就在我非常難過的時候,我又開始問上帝為什麼是我。
4955.589	4968.165	上帝一樣沒有給我答案,祂就問我說,雅惠,當你站在懸崖邊,面對死亡的時候,你還願意相信我在你生命當中的心意是好的嗎?
4968.165	4972.631	我想說,我沒有跑到旁邊去,所以得癌症還會很開心,說我得癌症,我得癌症了。
4974.804	4978.305	但是我那個時候我真的沒有,我沒有辦法。
4978.305	4990.089	你有沒有發現當你生病的時候,你的家人在愛你,你的父母親在疼愛你,兒女很孝順,朋友一頭拉骨,沒有一個人可以替你承擔這份痛苦。
4990.089	4991.950	但是上帝可不可以?
4991.950	4995.771	我知道上帝可以,可是我心裡面就怎樣?
4995.771	5000.552	不甘願啊,就是不甘願。
5000.552	5005.436	我那時候抓住了 我覺得是我生命當中﹐最後的一個希望。
5005.436	5007.797	我就跟主說﹐好﹐我再相信你一次。
5007.797	5012.020	我現在講的﹐好像我很順服﹐告訴你我心裡不是這樣想的。
5012.020	5015.021	我就說﹐好﹐我再相信你一次。
5015.021	5018.724	如果你讓我怎樣怎樣﹐我就怎樣怎樣。
5018.724	5022.126	我們很喜歡替自己留後路。
5022.126	5034.279	但是就在我這麼任性的﹐跟上帝禱告之後﹐ 我在2018年9月2號動了這個手術,醫生幫我拿掉所有的腹部的器官,還拿掉四顆淋巴。
5034.279	5038.761	你知道這麼大的手術,你知道我的出血量不到100CC嗎?
5038.761	5041.422	相信嗎?
5041.422	5043.602	活到今天,今天幾月幾號?
5043.602	5080.461	2023年的 大家如果有生過病知道癌症什麼五年就畢業對不對我上個月回診醫生跟我說你沒有復發他說快了快了快了九月份滿五年我就過了關阿門我今天可以站在這裡見證上帝的作為不是因為 我會什麼，或是我唱什麼，而是上帝憐憫我，留我一口氣在，讓我能夠繼續為祂而唱。
5081.954	5114.084	我在前年疫情很嚴重的時候我收到一首歌詞是葉維欣葉姊送我的她說上帝要我揣摩你的生命故事寫了這首歌詞送給你其實也是因為這首歌詞開啟了我製作我自己個人專輯的這個契機因為你要知道製作專輯就是花很多錢然後我已經我從天運退下來我在天運25年退下來之後我就是自己服事所以我並沒有什麼財團也沒有什麼支持的 我是拿我的退休金出來做的。
5114.084	5127.815	但是我跟上帝許下一個心願說,主啊,如果有任何一個人,因為聽到這張專輯的詩歌,因為聽到這裡面的生命故事而認識祢,那就比一切都值得。
5127.815	5133.159	我知道我的時間不夠,我接下來要分享這首歌叫做《有你》。
5133.780	5150.304	是這張專輯的主打歌這首歌去年有入圍金曲的最佳作詞其實他們已經把宗教音樂獎項拿掉了但是這首歌還入圍我相信因為這首歌從頭到尾只有獎 你就是誰?
5150.304	5151.906	上帝。
5151.906	5156.910	但是祂見證了,上帝愛世人這件事情。
5156.910	5170.522	這首歌的歌詞當我收到的時候,我還沒有攜取,我的眼淚就流下來,因為歌詞說,雖然我們的生命當中有風有雨,有高山有低谷,但是上帝的恩典總是在沿途。
5171.783	5181.311	傅哥說,我一生已經無所求,我只希望我可以愛上祢,向上帝愛我這麼多。
5181.311	5190.358	有時候我們生命過得順遂的時候,我們說主啊,我愛祢,我愛祢,這個話真的不難講,嘴巴一脫口就出來了。
5190.358	5200.366	可是當我們的人生甚至面對死亡走到盡頭的時候,你還說得出來,主啊,我愛祢嗎?
5200.366	5220.822	所以我真的是 鼓勵在座的每一位,向上帝認識你,向上帝知道你的需要,讓我們向神的禱告就是,主啊,我能夠愛你像我愛你這麼多,我一生無所求,只希望可以單單為你而活。
5220.822	5223.383	我們一起來聽這首歌,有你。
5223.383	5223.924	謝謝牧師。
5236.630	5240.213	隨有風。
5240.213	5243.035	隨有雨。
5243.035	5248.419	每天清晨有日出。
5248.419	5251.281	隨有山。
5251.281	5256.345	隨有谷。
5256.345	5261.969	恩典總是在沿途。
5261.969	5263.791	隨跌倒。
5265.845	5275.953	雖軟弱﹐你愛無聲在眷顧。
5275.953	5285.602	我眼淚﹐你留住﹐我的日子﹐你都有數。
5291.203	5297.946	有你一粗不夠。
5297.946	5304.709	有你無所求。
5304.709	5311.493	願我愛你如你愛我。
5311.493	5315.755	一生跟隨在左右。
5320.350	5330.558	一足夠有你無所求。
5330.558	5337.483	願我愛你如你愛我。
5337.483	5341.607	獻上一生為你活。
5350.401	5376.792	繁體中文， 沉憂日出。
5376.792	5380.936	雖有山,雖有谷。
5380.936	5382.877	燈點總是在沿途。
5382.877	5386.600	雖跌倒,雖軟弱。
5386.600	5387.921	你愛無聲哀。
5409.377	5417.164	你留住我的意思﹔你都要輸。
5417.164	5446.824	要你一足夠﹔要你無所求﹔ 一生跟隨在左右。
5446.824	5454.248	要你一足不苟。
5454.248	5460.291	要你無所求。
5460.291	5467.054	願我愛你如你愛我。
5467.054	5469.555	獻上一生為。
5470.708	5499.069	繁體中文， 願我愛你,如你愛我,獻上一生為你活。
5499.069	5501.430	好,剩下一分鐘是嗎?
5501.430	5503.951	那我應該來不及唱最後一首歌。
5503.951	5505.591	沒關係嘛,不是沒關係。
5505.591	5515.295	好,在我唱最後一首歌之前,愛不罕見之前,我想要跟大家說就是,我想分享一件事情,就是很多人會覺得生病這件事情很丟臉。
5516.135	5521.379	有時候華人的文化裡面會覺得它是一個咒詛,就是我不想要讓人家知道。
5521.379	5532.006	我也曾經覺得我廖雅惠好像很像別人口中說的那樣,我不知道在做什麼壞事,在丟這個盤子,然後會遭到這種報應。
5532.006	5536.869	有時候不同的人說的話會把我們覺得本來不是的事情都變成好像真的這樣。
5537.790	5542.734	但是我從來沒有想過上帝可以翻轉我的生命,成為祝福別人的管道。
5542.734	5551.540	我在三年前疫情還沒有爆發的時候,我接到美國Johnson & Johnson藥廠的邀請,到美國去開會。
5551.540	5554.782	這件事情,我簡短說它就是持續了一年多。
5554.782	5565.090	原來他從全世界召集了十幾個都是自定靈免疫疾病的人,到紐澤西跟他們開會,從病人的角度研發這個臨床實驗,clinical trial這件事情。
5565.350	5585.052	你知道上帝透過這件事情﹐讓我知道說﹐你的生病不是一件壞事情﹐你的生病是要成為祝福別﹐祝福他人的管道﹐即便雖然我常常覺得﹐我要忍受很多的疼痛跟痛苦﹐我的挑戰一直是現在進行式﹐ 我剛剛說我開了兩個大刀對不對。
5585.052	5589.976	其實我這十幾年來我開刀已經開了十次。
5589.976	5592.238	大大小小的刀夾起來。
5592.238	5594.680	我常常說臺灣臺大應該給我個集點卡。
5594.680	5596.862	大家去那個全年集點有沒有。
5596.862	5598.503	就換獎品啊這樣。
5598.503	5600.084	我就覺得我已經開十次。
5600.084	5601.626	我跟上帝說上帝我不要再開了。
5601.626	5603.027	我真的不要再開了。
5603.027	5605.989	兩張重大傷病卡夠了。
5605.989	5609.692	但是未來的事情生命的事情我們沒有辦法預知。
5609.692	5640.744	但是當我們還有能力當我們還有 生命的時候我們就要成為一個分享愛的人最後我要帶來這首歌叫做愛不罕見這首歌是我為了罕見疾病的朋友寫的當初是為了要鼓勵我們這些罕見疾病的朋友因為你知道我們有時候為了想要活下去其實真的是滿辛苦的 但是我認識這個韓病合唱團的孩子們,我看到他們的狀況,我就覺得我真的沒有什麼好抱怨的。
5640.744	5645.407	他們很多都坐在輪椅上面,但是他們跟著我一起唱這首歌。
5645.407	5656.236	然後在我兩年前那個突然發現腎臟水腫,要裝那個雙栽管的時候,他們就傳了這個歌來鼓勵我,當下眼淚就流下來。
5656.236	5665.183	我就想說他們這麼 辛苦他們也,他們都來鼓勵我,那我能夠為神做什麼,我能夠為這個世界做什麼。
5665.183	5670.188	你知道當我們願意付出愛,付出這份愛,這個世界就會多一份溫暖。
5670.188	5677.615	當我們從上帝領受這份愛,不是自己藏在心裡面,而是要分享出去,讓更多人能夠認識耶穌。
5677.615	5679.296	最後帶來這首歌叫做,愛不罕見。
5680.077	5682.419	希望能夠鼓勵大家。
5682.419	5685.901	讓我們能夠勇敢的為生命喝采。
5685.901	5699.032	為你的人生繼續開心的走下去。
5699.032	5705.737	每一個夢想都可能被命運打敗。
5705.737	5709.620	卻打不到我對生命的熱情。
5712.432	5724.901	每一個希望都可能破滅,卻能在轉角處重新開始。
5724.901	5735.929	每一個疾病都是痛苦的折磨,卻給我勇氣能面對自己。
5739.070	5745.459	每個腳步都可能跌倒。
5745.459	5749.666	卻成為我重新出發的印記。
5751.169	5753.591	愛不罕見。
5753.591	5764.380	因為我們心存盼望。
5764.380	5764.660	愛不罕見。
5764.660	5767.482	因為我們很勇敢。
5767.482	5769.024	愛不罕見。
5769.024	5774.488	因為我們看見未來。
5774.488	5775.069	愛不罕見。
5775.069	5778.932	因為我們擁有生命。
5784.565	5817.458	每一個夢想都可能被命運打敗卻打不到我對生命的熱情每一個希望每一個希望都可能破滅卻能在轉角處重新開始 每一個疾病,都是痛苦的折磨。
5818.848	5824.089	卻給我勇氣能面對自己。
5824.089	5825.849	每一個腳步。
5825.849	5832.110	每一個腳步都可能跌倒。
5832.110	5836.591	卻成為我重新出發的一切。
5836.591	5837.971	愛不罕見。
5837.971	5841.332	愛不罕見。
5841.332	5845.332	因為我們心最盼望。
5845.332	5846.013	愛不罕見。
5848.677	5852.030	因為我們很勇敢,愛不罕見。
5855.418	5860.140	因為我們看見未來,愛不罕見。
5860.140	5868.544	因為我們擁有生命,愛不罕見。
5868.544	5872.106	因為我們心存盼望,愛不罕見。
5872.106	5876.087	因為我們很勇敢,愛不罕見。
5885.401	5913.540	好不好鼓勵你旁邊的人說因為有你讓愛不罕見 謝謝,謝謝你們,把時間交還給牧師,謝謝。
5913.540	5918.463	老師,如果您體力可以,你東西先放著,如果您體力可以,我要先請。
5918.463	5924.087	各位弟兄姊妹,這是一個非常棒的生命見證,阿們。
5924.087	5931.392	好不好,我們再一次的,真的是為廖雅惠老師的生命美好的見證,我們再次拍掌,將榮耀歸給我們神。
5935.503	6011.449	之前我在淡水堂聽到廖雅惠老師的分享其實我非常的感動那好不好我們一同起立廖雅惠老師她是一個勇敢的一個福音使者她是一個勇敢即使知道我們跟主同在一起好的無比 但他仍然願意回應神的呼召堅韌的在這地上為神發光為神作顏作光這是何等美的生命見證我們一起伸出祢的手聖劍的手我們一起來祝福雅惠老師願她一生的年日 不僅在神的手中,而且是在神的手中充滿了恩典,充滿了神的保守,而且無論祂到哪裡,祂在哪裡,神的同在就在那裡,祂常常被神的愛包圍,復主的名,被神帶去的地方,那裡就有福音被傳遍,那裡就有主的名被高舉,那裡就有人願意將祂的生命, 交給耶穌回轉向神,能夠來得著新生命。
6011.449	6015.951	好不好,我們就同聲開口,你想到什麼,就來祝福雅惠老師。
6015.951	6017.892	主,我們要奉耶穌基督的名,要來祝福祂。
6017.892	6024.815	主啊,是的主,連我們自己看,我們都心疼祢的寶貝女兒,她所經歷的這一切。
6025.555	6034.301	主啊,但是主,祢是祂的好牧者,祢的杖,祢的竿都安慰祂,祢引領祂走義路,祂不致害怕。
6034.301	6043.527	主啊,是的,主啊,即使走過死因的幽谷,祢如今仍然幫助祂,帶領祂為祢做光作眼。
6044.087	6047.589	主啊,試著使仇敵羞愧退去。
6047.589	6048.530	我們讚美祢。
6048.530	6052.152	主啊,試著求祢,主啊,來醫治他。
6052.152	6054.814	主啊,試著求祢來保守他。
6054.814	6057.416	主啊,求祢幫助他每一天。
6057.416	6060.918	主祂的腸胃,祂的所有器官都要為他效力。
6060.918	6065.301	主啊,試著願祢的愛,祢的醫治、平安,時時充滿他。
6065.301	6068.963	主,祢屬天的喜樂跟盼望也要充滿他。
6068.963	6070.604	主啊,試著祢保守他的腳踪。
6071.425	6076.473	祝祢讓他躺在床上就有好的睡眠,好的休息。
6076.473	6082.822	祢保守他一生,他的生命氣息都在祢的祝福當中。
6082.822	6086.968	主啊,謝謝祢,謝謝祢,讚美祢,哈利路亞。
6089.394	6096.337	主要我們同心的把祢的寶貝,雅惠老師交在祢的手中。
6096.337	6104.200	謝謝祢,拆派這麼棒的福音使者來到我們當中,向我們見證祢這位又真又活的神。
6104.200	6123.290	是的主,祢沒有應許我們天色常藍,花香常曼,但祢應許我們沒有一個艱難是我們跨不過去的,沒有一個坎是我們跨越不了的, 因為我們有祢依靠,我們還懼怕什麼呢?
6123.290	6135.642	主願今天雅惠老師,祢透過祂的生命,對我們的提醒,對我們訴說那加美的福音,還有祢奇妙的作為,要深深烙在我們每一個人的心裡。
6136.323	6140.346	主啊,是的,我們要想到祂,就要奉主的名來祝福祂。
6140.346	6149.594	主啊,願祂繼續的與你同在,繼續以上,讓祂能夠,主啊,是的,少受苦。
6149.594	6152.996	主,祂的心靈在你裡面有好的安息。
6152.996	6160.462	主,我們也要為祂,物質上、財務上所需的一切,身體所需的一切,交託給你。
6161.203	6161.503	阿們。
6185.964	6189.886	好,弟兄姊妹有提醒,請坐。
6189.886	6203.451	我們有提醒,就是第一個呢,今天姚蕙老師在這裡分享的這些詩歌,請不要任何自己,就是私自PO在網路上。
6203.951	6206.753	請尊重版權。
6206.753	6212.856	我們待會會後,姚蕙老師她有帶她的CD,還有她自己的一些周邊產品。
6212.856	6227.865	我們除了能夠購買她的CD,能夠來分享福音以外,我們也可以,我們這麼棒的助手,你看我們謝謝順心實習傳道,這是她的杯墊,還有她的CD。
6227.865	6238.989	我們可以用這個來送給我們覺得有需要, 想要讓他也能夠被鼓勵,能夠生命有盼望,能夠生命有力量的這些親友們。
6238.989	6253.372	所以我們也,然後,如果你想要支持雅惠老師,你今天可以用奉獻帶,你就特別寫,為其他奉獻,就是雅惠老師,我們就會為您轉給雅惠老師,那我們平常我們就為她來紀念。
6253.372	6258.373	好,那我們接著,我們就把時間交給我們最棒的,順心實習傳道!
6262.142	6268.223	好,淡江家裡人關心家裡事故,弟兄姊妹平安。
6268.223	6276.365	好,那我們來關心,請問今天有沒有第一次來到我們淡江教會桃園堂的弟兄姊妹?
6276.365	6277.605	有的話請跟我們揮手。
6277.605	6281.526	這邊有一位,這邊有,可以請你們站起來嗎?
6281.526	6284.087	我們請我們的招待給那個劉明潘。
6290.128	6291.929	一次歡迎,永遠歡迎。
6291.929	6300.954	待會就請你們到旁邊這間教室,讓我們同工跟您介紹我們淡江教會,讓你們更了解我們教會。
6302.312	6304.333	好,下一張。
6304.333	6309.197	這個是我們上一週的奉獻。
6309.197	6316.842	上一週的一般奉獻有72萬多,那建堂奉獻有27萬多。
6316.842	6321.806	請大家繼續用奉獻跟禱告來紀念教會的需要。
6321.806	6322.006	下一張。
6323.524	6325.324	好,再來就是生命會談。
6325.324	6331.366	對,就是我們桃園堂下一次的生命會談是7月16號。
6331.366	6340.049	我知道很多弟兄姊妹都很喜歡上生命會談這個課,因為這個真的是幫助我們在很多自己的學習上。
6340.049	6343.870	那下一堂課呢,叫做抱怨服務戰。
6343.870	6353.655	對,就是如果你有另外一半的,真的有時候面對像 我面對我老婆的抱怨的時候,我們真是要靠主啊,真的。
6353.655	6358.940	因為有學習這個課程,所以就知道如何把抱怨變成助力。
6358.940	6362.083	對,就可以跟另外一半有很好的溝通。
6362.083	6365.566	那我就是鼓勵大家能夠來參與這個課程。
6365.566	6366.107	好,下一張。
6367.517	6372.340	好,那我們2023年的Sozo要辦祕籍班。
6372.340	6387.650	對,Sozo這一個字其實在新約聖經,像我列的這一個,馬太福音1章21節,祂要生一個兒子,祢要給他起名叫耶穌,因祂要將自己百姓從罪裡救出來。
6387.650	6391.213	那個拯救的救,其實就是Sozo的意思。
6391.213	6395.896	那這個Sozo其實在聖經新約出現二十幾,兩百多次,對不起。
6396.476	6417.666	繁體中文，臺灣國語 報名的時間請參考週報。
6417.666	6423.991	但是他這一次是線上課程,所以就是很方便各位學習。
6423.991	6431.037	上課的時間是8月25號到8月27號,大概兩天半的時間。
6431.037	6436.522	鼓勵大家能夠在這方面有更多的學習。
6436.522	6436.742	下一張。
6438.029	6447.253	我們剛剛所報告的一切相關的沒有講到很仔細的,或是你想要更清楚的都可以參考電子週報。
6447.253	6449.274	好,我們最後請牧師為我們祝福。
6458.285	6499.082	那個SOZO就是我們單張教會有那個內在醫治的事工那其實呢如果你想要自己更健康其實我會鼓勵時間可以你就報名參加因為我在美國Bethel我有上過SOZO但是我雖然沒有我沒有參加這個事工團隊但是對我平常我自己還有對我在跟別人約談的時候他是很有幫助的 所以不是為了別人去上這個課,是為了自己,然後你覺得上了課自己有興趣,也可以,神有呼召你,有負擔,你也可以更多的繼續學習,成為可以服事別人的人。
6499.082	6508.854	好,那我們就是, 待會會後大家可以一起去櫃台那邊來支持廖雅惠老師的產品。
6508.854	6516.985	然後呢,如果你需要,你想要讓他在CD上或你買的產品上簽名,老師可以在那裡幫大家簽名。
6516.985	6517.206	好的。
6517.466	6526.614	今天淡海堂下午一點半,兩點,我們有洗禮,有七位在淡海堂洗禮。
6526.614	6541.828	所以淡桃園堂的弟兄姊妹,如果你還沒受洗的,我鼓勵你可以跟我們報名,那我們可以安排受洗課程,讓你知道為什麼要洗禮,然後我們就可以安排洗禮,讓你可以歸入祖民。
6542.108	6552.717	我們弟兄姊妹也為今天要受洗的﹐七位弟兄姊妹﹐來禱告﹐因為這只是他們跟隨神﹐進入蒙福的道路的﹐開始而已。
6552.717	6555.959	他們很需要我們大家﹐一起用禱告來托助他們。
6555.959	6568.450	好不好﹐如果你可以﹐就鼓勵你﹐邀請你起立﹐一起來領受神的祝福與拆派。
6568.450	6569.691	好﹐我們可以低頭禱告。
6571.578	6594.296	願天父上帝豐盛永不止盡的慈愛,耶穌基督那十字架的大能,以及內住在凡接受耶穌基督進入生命裡的每一個人的心裡,聖靈不斷的與你交通,不斷的引領你、保守你、指教你。
