start	end	text
2166.703	2172.965	但是那時候我還沒有受洗,但是就是讓我感覺到很莫名的平安感跟喜樂感在我內心裡面。
2172.965	2183.568	那我當時我覺得是很奇妙的一件事情,怎麼會讓我一個算是完全不去接受這個信仰,但是我為什麼可以在這個敬拜中這麼的喜樂。
2184.480	2189.944	後來直到教會剛好邀請我去參加另外一個就是精進神儀會。
2189.944	2194.909	在那個精進神儀會當中,我覺得在那個過程當中我真的被神觸摸到了。
2194.909	2201.974	在那個精進神儀會的時候,主要有一堂的課程,主要是講天父的醫治。
2201.974	2207.239	在那個課程的禱告的時候跟敬拜的時候,我就不停地流眼淚。
2207.944	2270.814	那不停流淚那時候在那個狀況下就是淚流不止那看到當時有個服侍我一個弟兄那過來擁抱著我那當時我就是狂哭了那就是整個眼淚整個大大流出來那在那個過程當中哭完之後好像感覺內心很四方那到最後的時候我才知道是神在醫治我醫治我跟我父親的關係因為其實我跟我父親的關係非常的不好 在那過程當中﹐我就很感謝主﹐那我也把這個事情﹐分享給我的小組﹐那我的小組﹐我當時也分享給我的小組﹐我也很渴慕就是成為神的孩子﹐那因為教會跟小組都知道我的狀況﹐那所以他們就一直為我禱告﹐那求神給我智慧跟勇氣﹐來跟我父親講這個基督徒﹐想要受洗成為基督徒的事情﹐那真的感謝主﹐ 經過一段漫長的屬靈徵戰,那最後靠著主得勝,那成為家裡的第一代基督徒,感謝讚美主。
2270.814	2304.317	那再來就是我信仰後的感覺就是, 信主後的我其實生活並沒有一帆風順那也是一樣會遇到任何的困難一樣的挫折但是不同的是我有一位愛我的主祂做我的依靠當我每次遇到失敗的時候那導致跟負面徵戰那會把憂慮交託給祂如聖經上面以賽亞書1章4節上面寫說你不要害怕因為我與你同在不要驚慌因為我是你的神我必兼顧你我必幫助你 我必用我公益的右手扶持你。
2323.456	2363.345	這裡有許許許許許許許許許許許許許許許許許許許許許許許許許許許許許許許許許許許許許許許許許許許許許許許許許許許許許許 在上一次我們淡江教會敬拜主領MD和樂手聚集的一個會議的時候,我們就分享到了桃園堂這邊的工作。
2363.345	2415.089	我們是這樣形容,我現在一直受順心弟兄的眼光注意,因為我們這幾天在討論一件事情就是,我不知道你們有沒有發現我的口頭禪, 陶淵堂陶淵堂 信仰群體是怎麼樣的一個氛圍。
2415.089	2423.856	我是用莊牧師的這種說法,就是,這裡是一個,你無論端什麼菜,他都會炒得非常好吃。
2423.856	2424.617	什麼意思呢?
2424.617	2439.783	就是,如果下面是冷的人,你無論在好的敬拜,在好的信息,你知道台下就是太平間, 有去過嗎?
2439.783	2441.465	就是沒有反應。
2441.465	2458.762	但是在這裡,有一種不一樣的氛圍,就是你無論丟什麼,下面就是哇,我要我要我要,就是這種感覺,什麼樣都炒得起來,什麼樣的菜都炒得起來,大陸美,地瓜葉,炒起來都很好吃。
2460.896	2495.785	這個講的是比較簡單的理由但真正的重點是這裡有聖靈同在的工作然後這裡的弟兄姊妹就是你們就是隨時都是預備好要來大大張口向神要向神要這件事情很重要弟兄姊妹這件事情很重要就是你來到神的殿之後你到底是做好什麼預備還是周而復始的只是來然後再回去因為你需要一個禮拜天的行程來站滿 安排,或來這邊聊天,或...我不曉得那是什麼。
2495.785	2499.509	但我好高興在這裡有這種氛圍。
2499.509	2504.914	我從小就在長老教會長大,也是這種小小的教會。
2504.914	2513.522	所以可以跟人很認識,可以直接叫出一個人的名字,然後知道跟他交集的故事是什麼。
2513.522	2516.564	這裡就有這種氛圍,這裡就有這種溫暖。
2517.125	2535.910	所以盼望待會透過今天這份信息,我們可以在一起求神更新我們的眼光,更新我們的心思意念,然後看我們接下來,這裡可以有這個組合,這個群體,接下來會發生什麼的事情,然後神會怎麼樣打的公主在我們當中。
2535.910	2538.090	我們先一起來禱告。
2538.090	2563.577	親愛的聖靈,我們邀請你充滿在你的殿中, 充滿在這個場域充滿在每一個預備好自己要來渴慕你的做每一個你的寶貝和女 主要在這裡,主要有一個一個,主要裡面是熱切的,不想要再甘於安逸的信仰生活,不想要一成不變的信仰生活。
2563.577	2569.261	主要因為知道你是創造天地萬物,是有創意的那一位神。
2569.261	2572.083	主要你的道是活潑有能力的。
2572.083	2577.647	主要怎麼可能,主要一個, 一個你兒女的生命是這麼樣平淡無奇。
2577.647	2588.816	中文不是說生活的日常平凡平淡不好,而是主要在每一個人身上,主要都有你的計畫,有你的旨意,也有你的美意。
2588.816	2601.007	好像家族離開,主要那原則之前,主要交付一千兩、兩千兩、五千兩,交付一定銀子,主要然後你吩咐僕人,要發揮他生命的影響力。
2601.527	2604.449	主啊,這絕對是豐富的。
2604.449	2607.891	主啊,絕對是要帶出屬天影響力的。
2607.891	2619.158	主啊,這裡就有一個一個,心裡面都有這樣的企圖,有這樣的可想,有這樣的盼望,有這樣的想要,我的生命可以不再一樣。
2619.158	2624.902	我的生命因為有耶穌基督在我裡面活著,就不再一樣。
2624.902	2628.885	主啊,跟過去不一樣,跟昨天不一樣,跟上一刻不一樣。
2629.445	2638.809	主要我們盼望,主要待會,主要在整個信息裡面,無論是服侍的,主要聆聽的,主要你都來觸摸,你都來觸摸。
2638.809	2643.111	主要一字一句要打盡,主要觸摸我們的生命。
2643.111	2646.873	主要打開我們的心,打開我們的耳,使我們有一個受教的靈。
2647.193	2652.034	主要聆聽祢,等候祢,主要來敬拜祢,來跟隨祢。
2652.034	2655.235	謝謝主,禱告是奉靠耶穌基督的名。
2655.235	2656.176	阿們。
2656.176	2659.917	我今天要分享的主題叫做,照明你們心中的眼睛。
2659.917	2664.098	我們先一起來讀,以佛手書一章十五到二十三節。
2664.098	2664.798	因此,預備,請。
2664.798	2670.840	因此,如果心聽見你們心同主耶穌,心愛眾聖母,就為你們們祝福,感謝神。
2678.319	2686.044	祝福我們主耶穌基督神,榮耀祖父,將祂使人知悔都及時的利益。
2686.044	2709.454	賞給你們,使你們真知道祂,並且照明你們心中的眼睛,使你們知道祂的恩昭有何等指望,祂在聖徒中得的基業有何等豐盛的榮耀,並知道祂向我們這信的人所顯的能力, 是何等浩大。
2709.454	2740.485	就是照祂在基督身上所運行的大能大力,使祂從死裡復活,叫祂在天上坐在自己的右邊,遠超過一切執政的、掌權的、有能的、主治的和一切有名的,不但是今世的,連來世的也都超過了,又將萬有福在祂的腳下, 使祂為教會做萬有之首。
2740.485	2747.028	教會是祂的身體,是那充滿萬有者所充滿的。
2747.028	2767.207	我計算過時間,桃園堂是在去年2022年9月25號,就是開始我們在這裡的聚會,到昨天3月25號,剛好滿, 但這樣回首看,我真的覺得這裡是上帝的大能,上帝奇妙的工作。
2767.207	2773.689	這個半年發生改變太多事情,我不曉得你是哪一個階段進來。
2773.689	2778.771	然後你看到自己的什麼改變,你在這裡看到什麼樣的改變。
2779.838	2791.826	我很清楚,9月24號晚上,這裡裡裡外外都是人,忙著打掃,忙著刮地板,忙著擦灰塵。
2791.826	2797.770	但那天我發了一個很大的脾氣,累壞了吧?
2799.838	2821.301	或者是我就是屬於那種在生命會談有講到集滿十張不爽的事情然後再一次爆發出來的如果你剛好是那個第十張恭喜你中獎那天中獎的就是米妮牧師 發了一個很大的表情,哇,好累。
2821.301	2825.022	中餐來不及吃,然後這邊忙得跟什麼一樣。
2825.022	2829.164	哇,為什麼什麼事情都擠到最後一刻。
2829.164	2831.744	然後隔天,真的也要現場。
2831.744	2839.487	你知道那個裡面,跟明天這種上帝的工作,其實完全是不搭嘎的。
2839.487	2843.949	不搭嘎,完全不一樣。
2843.949	2844.589	然後925就開始。
2845.896	2853.202	裡面有很多的直白一點,反正莊牧師不在這裡。
2853.202	2858.747	抱怨明明淡水堂還有一大堆工作,多啊!
2858.747	2860.929	就算沒有桃園堂,我也做不完。
2860.929	2862.950	這裡每一個同工都做不完。
2862.950	2872.178	你剛剛看到那個辛蕾弟兄,在竹林,他厭忙,禮拜六還有青年教會的服事,他自己的這個影音團隊。
2872.178	2874.579	我現在, 有名了。
2874.579	2877.240	這個case很多。
2877.240	2887.483	你可以看到所有當上教會的形象廣告,包括我們一些合作的夥伴、智庫,基本上很多形象廣告都是天使團隊一起幫忙製作的。
2887.483	2889.664	其實他們也非常的忙碌。
2889.664	2896.746	就算沒有桃園堂,我們也時間也夠,事情也夠佔滿我們的生活。
2896.746	2899.605	然後現在還來一個, 桃園堂。
2899.605	2903.626	來到這邊的行程要將近一個小時。
2903.626	2907.167	裡面有很多的不舒服。
2907.167	2908.827	那天我還負責彈琴。
2908.827	2911.768	第一次在這邊彈琴。
2911.768	2914.689	很想拉個簾子,你知道嗎?
2914.689	2916.169	不要看我,不要看到我。
2916.169	2920.390	迷你牧師在那邊帶敬拜。
2920.390	2922.291	多少張力在這邊。
2922.291	2927.052	但是第一首歌下來的時候,你只能說阿們。
2928.831	2929.632	阿們。
2929.632	2931.914	對,阿們,只能說阿們。
2931.914	2942.324	對一個長老教會的背景,年輕人,孩子然後年輕人來說,我的概念是當一個教會要拓展的時候,你必須先有一個全職的傳道人在這邊。
2942.324	2945.467	你有很多東西必須到位,你才能夠做這件事情。
2945.467	2950.351	就算你不是傳道人,你可能做一個企劃,你應該也至少有這樣的sense,對不對?
2951.152	2957.656	但是這裡丹丹教會的做事方法,不是這樣,完全不是這樣。
2957.656	2968.782	我們有一個衝很快的主任牧師,但這只是我的說法,我覺得更好的說法是,他緊緊抓住神給他的計畫跟印象。
2968.782	2977.627	然後他很相信一件事情,就是當你站上去的時候,調度萬有自願的那位上帝,就會工作。
2978.677	2981.959	重點是你要不要站在那上面。
2981.959	2987.363	所以就這樣開始,然後就一件一件事情,人一個一個來,一個一個來。
2987.363	2998.292	你還記得每次我們這邊,邀請新朋友,然後請他們自我介紹的時候,你聽到最多的,他會來到淡江教會桃園堂的理由是什麼,你還記得嗎?
2998.292	2999.332	因為看到扛棒。
3000.913	3003.093	扛棒是哪招。
3003.093	3006.334	福音策略都沒有想過是扛棒這種事情。
3006.334	3008.195	但這裡就。
3008.195	3010.255	這裡就發生這件事情。
3010.255	3011.855	我就覺得。
3011.855	3012.716	天啊。
3012.716	3014.736	招牌也是一個。
3014.736	3016.136	很好的。
3016.136	3017.817	福音策略。
3017.817	3019.177	一件一件然後。
3019.177	3020.217	連續好幾週。
3020.217	3023.638	弟兄姊妹必須自己搬椅子到後面坐。
3023.638	3026.379	我覺得這真的是。
3026.379	3027.439	只有少女的工作。
3027.439	3027.599	不然。
3029.855	3044.542	一個講話一直好來好去的人,傳道人,也沒有多怎麼樣,但這裡就可以吸引那些渴慕上帝話語的人來這裡,發生這麼多的改變。
3044.542	3046.823	弟兄姊妹,那你有發現你自己的生命的改變嗎?
3046.823	3059.314	這半年,你加進丹江教會桃園堂之後,這裡穩定聚會人數大概40到50左右,但是桃園堂第一屆的成全系統, 有將近二十位。
3059.314	3061.176	這是不得了的成績。
3061.176	3062.217	真的不得了。
3062.217	3069.905	單張教會八百到一千,但每一屆可能參與成群系統的人大概五、六十人。
3069.905	3075.511	你就知道這個,就拿比例來看,它是差很大的。
3075.511	3082.756	你們在真理的話語上面的渴慕, 這是我們都看得見的。
3082.756	3089.639	可以看得到,甚至在每一個服侍崗位上面的投入,願意參與。
3089.639	3092.080	這也是我們都看得到的。
3092.080	3094.282	上帝也一同見證。
3094.282	3096.002	這真的都不容易。
3096.002	3102.706	弟兄姊妹,這半年,發生很多事情,有很大生命的改變,就在我們當中。
3102.706	3104.627	你也在這個改變當中。
3104.627	3105.287	這真的很不容易。
3106.578	3122.728	待會透過以弗所書一章十五到二十三節,我們要繼續來看,那接下來,我們到底要怎麼期待神在淡江教會桃園堂,祂要繼續做什麼的工作?
3122.728	3159.834	就像我剛剛分享的,我從藏奧教會背景下來,我裡面這個底蘊其實是很堅固的,也會帶著一種小小的懷疑, 接下來會發生什麼事情,這個會,各位也來自不同的成長背景跟文化,這個或多或少都可能會成為我們的眼鏡跟鏡框,看接下來淡江教會桃園堂到底要做什麼,神要做什麼,你到底拿什麼依據什麼標準來看淡江教會桃園堂的工作。
3160.452	3167.637	盼望透過待會的訊息,我們一起讓聖靈來幫助我們,更新我們。
3167.637	3175.502	第一個,求神照明我們心中眼睛的關鍵,是知道祂。
3175.502	3178.224	我們請念下面這段經文,十七節。
3178.224	3180.526	求我們主,預備,請。
3180.526	3181.106	求我們主。
3181.106	3181.226	求我們主。
3192.398	3205.949	第一個,要知道的是,知道祂,這個祂是創造天地,這個創造主,這個我們的神,全能的神,我們在天上的父。
3205.949	3219.079	第一個關鍵要素,不是介紹接下來單將教會的工作是什麼,而是你要,你跟我都要,更多的認識創造的這位主。
3219.079	3219.420	為什麼?
3220.213	3245.498	因為不認識,不認識你這位創造的主,祂是創造主,祂是維持整個世界運行的維持者,祂是管理這個世界的最高的權柄者,祂是賜下祂愛子耶穌基督,成為我們生命救主,使我們可以恢復與祂溝通,與祂交通,與祂連結關係的主。
3245.498	3261.078	祂也是在主再來那一刻的那個審判官, 我們要來交章,要來面對我們到底這一生我們所拿的那一千兩、兩千兩、五千兩那一定因此我到底怎麼樣 活出那個影響力。
3261.078	3267.701	如果你不認識他﹐你就不曉得﹐他在你生命當中﹐那個工作﹐那個計畫是什麼。
3267.701	3281.128	如果你不認識他﹐你就﹐我們就很容易﹐在現況這個工作﹐可能缺這個﹐哇﹐單將教會桃園堂﹐單將教會明明是﹐視覺性這麼強的﹐但是這個投影機常常當機。
3281.128	3283.189	這是﹐應該是有屬靈徵戰吧。
3283.189	3288.011	你知道你的眼光就會﹐被限制在什麼﹐就是人的問題。
3289.974	3296.138	你就會現在這個事情到底有沒有做好。
3296.138	3304.543	你就是這個招待的為什麼不帶微笑,那個剛剛放字幕的為什麼手抖,多放了好幾張又跳過去。
3304.543	3311.067	宜萱,不是講你,我在講上禮拜的,不是青龍,也不是珍妮,只是舉例而已。
3311.647	3339.758	你知道當你不認識這個,知道我們生命藍圖的這位上帝,知道祂把丹丹教會桃園堂放在這個社區,放在這個城市,這個主的旨意的話,我們很容易迷失在問題裡面,鑽在問題裡面,我們也無法明白,接下來到底要發生什麼事情,不曉得那個事情的真相,不能夠明白真理。
3340.623	3360.049	更重要的是,其實當我們能夠越來在這個信仰的群體裡面,我們的一起的奔跑,越來越認識真理,我們也越來越能夠按著神認識,神按著祂的形象創造的你跟我。
3360.589	3372.354	對神認識越多，你對自己，對你身旁的人，這個信仰的夥伴，信仰的群體，這個教會，你也會認識更多，認識更多。
3375.964	3385.926	回想一下,從你進到淡江教會桃園堂,這半年,你在真理上面,有什麼樣的長進?
3385.926	3399.428	回想一下,整理一下屬真人點,進到淡江教會桃園堂之後,你在這裡設的裝備,也沒有讓你,更委身在上帝的教會,愛他的教會。
3399.428	3412.854	我必須誠實說,淡江教會,跟其他教會, 一樣的是,或者比其他教會更多的是,這裡服事多到爆。
3412.854	3414.335	對不對?
3414.335	3426.482	這裡有一大堆的工作,一樣,其實一樣,沒有什麼,這邊也有人的問題,也有組織的問題,都有。
3426.482	3429.564	那你為什麼留在這裡?
3429.564	3440.946	我記得有一次,中牧師來到這邊,然後呢,在這邊禱告, 然後有弟兄姊妹在後面排隊,要接受禱告。
3440.946	3443.307	我就直接講名字,反正我們群體這麼小。
3443.307	3455.071	然後司祺就講了說,我覺得啊,我的,我們才還來不到幾個月,但是我們的時間都是在教會。
3455.071	3457.472	就都,都站滿了。
3457.472	3466.356	你有沒有這樣的, 感覺過,我很有王,跟別人說,你們都有的話,那我們更是。
3466.356	3472.101	這裡沒有跟其他教會,沒有不一樣,其實是,對不對?
3472.101	3474.863	那你為什麼留在這裡?
3474.863	3477.025	司機我可以問你嗎?
3477.025	3482.350	你都講出來了,對不對?
3482.350	3483.171	那你為什麼留在這裡?
3489.394	3492.084	你說我們這邊有沒有提供簾子嗎?
3492.084	3493.007	要付錢才有。
3495.367	3527.806	弟兄姊妹那我真的問,你知道當你越來越投入,這邊可能跟你遺忘的教會,沒有不同,這裡只會,就是你會看到更多的需要,你甚至,上次你,弟兄姊妹我們去到淡水堂,然後最後那個,鴻門宴,有人用鴻門宴,來形容跟莊牧師一起吃飯,當他講意象的時候,他就在告訴我你要不要來,對不對,有被拆派到花蓮的, 有被拆派到蘭嶼的有嗎?
3527.806	3529.386	沒有。
3529.386	3533.928	你知道在這裡,莊牧師也很明白,你有聽過牧師這樣講的嗎?
3533.928	3539.450	就是職業生講的,我們來這裡不是為你們,這什麼屁話?
3539.450	3542.451	什麼?
3542.451	3548.533	我們來這裡不是為你們,不是為你們,是為了圍牆外的人。
3548.533	3554.476	你聽到這句話,你的感覺,然後你們還留在這裡,是真的身份證被我扣留在這裡嗎?
3554.476	3554.956	還是怎麼樣?
3556.254	3557.755	對,為什麼?
3557.755	3560.556	對,你為什麼會留在這裡?
3560.556	3565.219	這裡跟其他教會沒有太大不同,反而更多,你知道嗎?
3565.219	3571.362	當你越來越投入的時候,你會發現你的肝需要更好好的保護。
3571.362	3581.507	當你越來越投入的時候,你的話題可能都在聊一些健康食品啊,什麼維持性,沒有啦,這是開玩笑的。
3581.507	3582.588	那你為什麼留在這裡?
3584.189	3585.730	你為什麼留在這裡?
3585.730	3590.373	你到底為什麼被,真的是被感動,然後願意留在這裡嗎?
3590.373	3593.895	你到底看到什麼?
3593.895	3598.637	你到底看到什麼?
3598.637	3608.463	我的答案,你真的要回去想想你的答案,不然你接下來可能就要先做一個全身健康檢查,然後你才能確定你要不要留在這裡。
3608.463	3616.096	Sorry,我真的有時候嘴巴, 我的嘴巴比那個腦袋還快。
3616.096	3620.738	所以很多人都會說我是那個被傳到人誤的綜藝主持人。
3620.738	3625.861	所以我必須誠實說,如果我因為那個嘴巴太快,讓你不舒服的話,你一定要來跟我講。
3625.861	3631.204	我是很容易聽的,但也很容易記仇。
3631.204	3632.825	你看,我的嘴巴是不是很快?
3632.825	3633.505	是不是很快?
3633.505	3634.946	好,真的是沒禮貌。
3634.946	3637.328	好,回來回來回來回來。
3637.328	3637.928	這是我的答案。
3639.445	3654.391	因為在這裡我看到有許多人的心是向這個神敞開的,一直願意接受從上帝來看祂的眼光,看自己的眼光,一直願意被調整。
3654.391	3666.917	我有很多這種在悖逆當中, 然後牧師禱告,然後我就又被責備,又被調整,很多這樣的經驗。
3666.917	3678.082	生命會談也好,成全系統也好,看到中英在生命會談分享,她說她流下男兒淚。
3678.082	3685.225	中英,我也是一個愛哭的男人,男人會哭不是罪,懂嗎?
3685.225	3688.006	但是要哭對場合,這個在講什麼?
3688.234	3695.581	這裡有許多願意呈現自己生命其實是不完整。
3695.581	3702.287	這裡有許多的生命是願意承認自己的生命有裂痕。
3702.287	3708.212	你知道當你的面具拆下來的時候,你才有機會真正認識你。
3708.212	3716.246	你知道當你的生命真的撐不住的時候,好像那個蛋殼 有裂痕的時候,生命才能夠誕生。
3716.246	3729.850	你知道當你這個謊言的偽裝,終於撐不下去崩壞的時候,產生裂痕的時候,上帝真理的光才有機會照進來。
3729.850	3737.392	這裡有許多這樣的生命故事,一直都在這個過程當中,一直在過這個過程當中。
3738.660	3747.924	如果沒有這個裂痕，我們真的很難，認識這位創造天地萬物的主，在你我生命當中的記號。
3747.924	3760.190	那更不用說這個群體，我剛說了，這裡跟其他教會一樣，有人的問題，有組織的問題，有各式各樣的問題。
3760.190	3771.332	我剛接淡江教會成全系統的時候，我真的帶著一個，理想跟樂情，我希望可以把這個， 這個教會的門市系統做了很好的規劃。
3771.332	3776.076	我對那個城市的那個設計就很有興趣。
3776.076	3779.779	我就想讓整個客戶的系統把它建立起來。
3779.779	3780.060	哇!
3780.060	3780.720	多有熱情!
3780.720	3782.442	那個叫什麼?
3782.442	3784.844	新官上任三把火。
3784.844	3788.848	我就帶著同工,我說我接下來要做這件事情,這件事情,這件事情。
3790.367	3795.251	但是接下來就是一件一件的崩潰、崩潰、崩潰、不可能、不可能。
3795.251	3796.512	為什麼?
3796.512	3814.046	告訴你,昨天晚上我還跟順琴哥、秀琴姐在辦公室忙到10點、11點,因為淡水的第13屆成全系統,我們常常要忙到這麼晚,我還有一個週四班。
3814.046	3815.728	為什麼剛剛說那個已經崩潰、已經崩潰?
3815.728	3821.700	因為在家裡面, 不是講道理的地方。
3821.700	3823.002	你可以接受這件事情嗎?
3823.002	3825.706	在你的家不是講道理的事情。
3825.706	3827.529	不是說道理的事情。
3827.529	3834.279	所以在這裡系統,不是說不管用,而是它必須有很大的彈性的人性化。
3835.981	3846.973	因為我們都一直在示範一件事情是,表達一件事情,透過,雖然成全系統它的主旨就是,幫助弟兄姊妹在真道上面被建造起來。
3846.973	3857.902	但我覺得我們透過這個客戶系統,一直在呈現一件事情是,示範主耶穌基督也是這樣, 接納我們的錯誤,然後為我們死在世家上。
3857.902	3860.564	我講的有點鼠連,什麼意思?
3860.564	3878.251	你知道這過程當中有許多人會,錯過他登記某一場的主日出席紀錄,或者是最後會錯過一個規則,然後不繳交作業,然後最後找到他的小組長來跟我說,讓我可以通過,可以結業。
3878.251	3884.979	有各式各樣的,你想像不到的, by case 的案例。
3884.979	3887.345	然後是系統沒有辦法解決的。
3887.345	3889.930	必須我這個人站在第一線。
3889.930	3891.534	聽。
3891.534	3893.618	是這樣。
3893.618	3893.819	可以。
3895.384	3899.207	按照你的學者的態度,恭喜你結業了。
3899.207	3923.643	就是,我每每要面對,很多時候我要常常面對這個,系統之外不能夠控制的原因就是,哇,但我感謝上帝,因為有這個機會,這個人意識到,他的態度,或他的學習,或他的錯過,他可以經歷一件事情是,還有挽回的機會,還來得及。
3925.094	3930.296	然後,原來有恩典。
3930.296	3941.602	我從來沒有想過,我可以在承認系統的,客戶的經營裡面,神要我體會的是,這個上帝看我的這個眼光。
3941.602	3943.462	我的生命,你的生命。
3943.462	3949.905	如果上帝真的要跟你我計較的話,你知道這不是一天一夜的事情。
3949.905	3952.967	你生命當中有許多的事情,祂可以攤出來。
3955.367	3960.550	請你縱橫走遍這地,都是你的mistake,都是。
3960.550	3963.752	但在上帝眼中,卻不是這樣。
3963.752	3964.633	卻不是這樣。
3964.633	3975.800	弟兄姊妹,第一個,求神照明我們心中眼睛的眼光,關鍵,要素。
3975.800	3980.963	我不是說你要睜一隻眼閉一隻眼看,淡江教會桃園堂的問題,不。
3980.963	3986.859	你知道,這裡有裂痕, 聚集你禱告的手。
3986.859	3990.202	你知道﹐這裡有缺口。
3990.202	4008.658	那如果上帝感動你﹐你願不願意站在那上面﹐然後﹐領受這個淡江教會﹐神給淡江教會的DNA﹐當那個人﹐站在那個位置上面的時候﹐那個職份﹐工作需要的智慧跟能力﹐神就交關下來。
4008.658	4010.400	這﹐也是我學到的經驗。
4012.244	4013.625	你願意嗎?
4013.625	4020.009	這裡,坑坑洞洞,問題多得很,沒錯。
4020.009	4029.234	但,不一樣的是,可不可以,禱告,可不可以,站在那個缺口上面。
