start	end	text
6048.890	6054.634	好不好,第二個禱告,歌詞裡面講到我們要背起施架跟隨我的主。
6054.634	6061.639	好不好,在我開始分享當中,我們真的要面對我們生命當中那個軟弱,那個害怕,那個不安全感。
6061.639	6071.765	但是就如同寶如說的,我卻要單單誇耀我的軟弱,因為就在那一刻,我要發現,我要看見,我要經歷,基督的能力撫平我。
6071.765	6078.229	弟兄姊妹,無論你的個性,你的脾氣如何, 你的那個不安全感如何?
6078.229	6078.789	好不好?
6078.789	6088.111	現在就把它背起來,因為就要與主耶穌一起同定在十字架上,然後你我也要一起經歷耶穌基督的復活,Amen!
6088.111	6089.191	好不好?
6089.191	6116.510	無論在這個面對自己生命的軟弱,面對自己生命這個困境,有的你這個血氣的脾氣也好,帶人處事不好的帶人處事的方法也好, 當你真的是真誠的來面對祂,然後你說,主啊,我願意背起來,我願意背起來走向祢,走向祢,與祢一同釘死,然後與祢一同復活,有著新生命的得勝的活潑的能力。
6116.510	6147.147	主啊,主啊,幫主啊, 主要幫助我好不好身體如何光照你提醒你你就真誠的來面對因為就在這個面對當中謊言就不能夠再瑕疵你因為就在這個面對當中這個軟肉就不能夠再成為你的軟肋就不能夠再成為你生命的把柄就不能夠再成為你生命的那個坑坑巴巴就不能再成為你那隱藏自己躲避的躲藏自己的那個醜肉 現在在主耶穌的面前。
6147.147	6148.668	在主耶穌的意志裡面。
6148.668	6150.048	都要得到一致。
6150.048	6150.768	阿們。
6150.768	6151.428	好不好。
6151.428	6153.348	主老三我們就一起開口來禱告。
6153.348	6155.189	你說主啊這一件。
6155.189	6156.569	我背起來。
6156.569	6157.549	我來跟隨你。
6157.549	6159.529	主啊這一個我背起來。
6159.529	6162.610	現在我要宣告祂不能夠再瑕疵我。
6162.610	6164.550	主老三就一起開口呼求你的主。
6164.550	6165.851	我們就一起來禱告。
6165.851	6166.411	一。
6166.411	6166.951	二。
6166.951	6167.051	三。
6167.051	6168.611	主啊。
6168.611	6169.751	主啊。
6169.751	6170.831	主啊。
6170.831	6172.092	開口來禱告。
6172.092	6172.792	阿利利亞。
6173.712	6175.452	主啊,我願跟隨祢。
6175.452	6177.513	主啊,但我不願。
6177.513	6181.774	主啊,我在跟隨祢的過程當中常常有許多的慘淚。
6181.774	6183.335	主啊,不是這個傷害。
6183.335	6184.895	主啊,就是那個不安全感。
6184.895	6187.356	主啊,不是這個不滿足。
6187.356	6189.176	主啊,就是那個有問題。
6189.176	6190.277	主啊,那個不可能。
6190.277	6194.058	主啊,但現在我來到祢的面前。
6194.058	6196.938	主啊,主啊,一件一件的杯子來。
6196.938	6198.039	主啊,走上骷髏山。
6199.019	6201.340	做走上十字架。
6201.340	6202.380	做在那裡。
6202.380	6206.601	做做一件一件都要與你同定在十字架上。
6206.601	6211.243	然後我要來盡力在你裡面復活的大能。
6211.243	6212.643	復活的大能。
6212.643	6220.006	因為這一切不能夠再瑕疵、控告、瑕疵捆綁我的生命。
6220.006	6222.006	捆綁你兒女的生命。
6222.006	6222.986	主讚美你。
6222.986	6224.007	主讚美你。
6224.007	6224.447	主是的。
6224.787	6229.893	一件一件的,主要都帶到祢面前來,帶到祢面前來。
6229.893	6236.441	奉耶穌基督的名,一直現在臨到在我們當中,一直釋放的祢在我們當中。
6236.441	6242.548	我的生命,我的生命,獻給祢,背起釋迦跟隨祢。
6244.565	6251.071	求神將祂的夢想,祂的計畫,現在上賜給我們,賜給我。
6269.428	6306.889	再次來說,賜給我, 賜給我屬於你的夢想。
6306.889	6314.052	帶下你過渡路在天上。
6314.052	6318.593	賜給我奔跑不倦的力量。
6319.974	6324.020	如影展翅上彈。
6324.020	6329.128	好想我的生命。
6329.128	6332.553	我的生命獻給你。
6332.553	6335.617	北極士在跟隨你。
6335.998	6342.962	願你的榮耀, 彰顯在我生命。
6342.962	6350.887	我的心不要忘記, 你如何為我申命。
6350.887	6359.451	耶穌我愛你, 喜樂的跟隨我的生命, 我的生命獻給你。
6360.725	6373.077	飛騎士在跟隨祢,願祢的榮耀,呈現在我生命。
6373.077	6381.786	我的心不要忘記,祢如何為我生命。
6381.786	6390.054	耶穌我愛祢, 喜樂的跟隨耶穌我愛你。
6390.054	6393.756	耶穌我愛你。
6393.756	6398.840	喜樂的跟隨耶穌我愛你。
6398.840	6402.383	耶穌我愛你。
6402.383	6408.747	喜樂的跟隨你。
6408.747	6410.429	我們仍然閉上眼睛。
6410.429	6411.950	我請筱語牧師帶我們做一個禱告。
6418.558	6432.383	耶穌,耶穌,我愛祢,因為祢先愛了我,祢先愛了我們。
6432.383	6455.701	主擔在十字架上,祢的寶血混著祢自己的汗水,帶著主的公義和慈愛留下來, 祝我們都在祢保血的遮蓋中,都在祢的一致的大能中,祢調動萬有。
6455.701	6460.564	這是把我們放在祢自己的手掌中,我們是祢的同仁。
6460.564	6463.026	主啊,祢愛我們,我們是祢的兒子。
6464.172	6472.985	真是除掉我們心中孤兒的靈,將兒子的靈穩穩當當地放在我們裡面。
6472.985	6479.073	主,我們是被愛的,我們是你覺得值得的,所以你為我們上身。
6479.073	6480.656	主,謝謝主,謝謝主。
6481.630	6484.373	主啊,真是謝謝主,謝謝主。
6484.373	6488.858	我們今天看到,看到生命一個一個被改變。
6488.858	6492.683	我們自己的生命也要被你改變,更多的改變。
6492.683	6496.687	我們感謝主,我們今天站在你自己的恩典當中。
6496.687	6503.294	我們相信主耶穌基督你自己的恩惠, 一路帶領我們一生一世。
6503.294	6505.356	要帶領你自己的兒女。
6505.356	6506.436	感謝主。
6506.436	6508.578	我們也知道神父的慈愛。
6508.578	6511.221	用你的大愛來遮蓋我們。
6511.221	6513.863	主降在我們裡面充滿我們。
6513.863	6516.425	以至於這樣的愛可以流出去。
6516.425	6518.427	感謝主滿溢出去。
6518.427	6521.650	讓我們周圍的人知道我們可以愛。
6521.650	6523.351	我們也接受神的愛。
6523.351	6524.592	主謝謝你。
6524.592	6525.373	謝謝你。
6525.373	6526.073	因為聖靈。
6526.834	6528.395	在我們心裏。
6528.395	6530.076	你坐在寶座上面。
6530.076	6530.836	主啊!
6530.836	6532.557	帶領我們前行。
6532.557	6532.797	主啊!
6532.797	6534.598	你在我們中間。
6534.598	6536.579	主也引導我們走出去。
6536.579	6538.460	真的是走出去。
6538.460	6541.602	世上有這麼多還沒有認識你的人。
6541.602	6541.842	主啊!
6541.842	6543.123	我們懇求主。
6543.123	6547.185	我們懇求主藉著我們這樣無比二餘的線上。
6547.185	6548.786	我們被你掰開。
6548.786	6553.068	把我們生命當中那些不能見光的地方你自己醫治。
6553.068	6555.489	以至於你的大能從我們身上出去。
6555.489	6556.370	人看見我們。
6556.510	6558.871	好像看見耶穌一樣。
6558.871	6566.772	是的,主,我們帶著這樣的身分,我們走出去,我們不害怕,因為主祢與我們同在。
6566.772	6574.534	謝謝主,我們要這樣的活著在祢面前,直到我們見祢面的那一天。
6574.534	6580.995	如此的感恩,感謝,願一切的榮耀、尊貴、權柄都歸於祢。
6580.995	6588.802	我們一起來說,奉耶穌的名, 阿們,阿們,感謝主,榮耀歸給神。
6588.802	6592.047	弟兄姊妹請坐。
6602.329	6633.638	謝謝今天真的是有神的僕人還有我覺得昆治弟兄的分享我們真的看見神在我們身上的作為然後很感謝神透過祂的僕人透過祂的兒子真的讓我們看見生命的改變我們再一次把掌聲榮耀歸給神 現在想要請問一下有沒有是第一次來到我們當中的新朋友,可以跟我們揮揮手。
6633.638	6640.924	這邊有一位,歡迎你。
6640.924	6648.130	會後也邀請你可以留下來,讓我們的同工跟你介紹,也可以讓你更多的來認識我們的教會,使我們可以更多的認識你。
6650.930	6655.233	這邊跟大家更新一下目前的奉獻的狀況。
6655.233	6659.796	在一般奉獻的部分,上週的累計奉獻是41萬。
6659.796	6662.938	目前3月份的話是151萬。
6662.938	6668.162	在建堂奉獻的部分,今年的總預算是5億元。
6668.162	6673.325	我們目前在上週的累計奉獻是4萬,大概4萬多元。
6673.325	6676.968	大家就是在禱告當中紀念神家裡的需要。
6677.688	6685.433	大家也可以在 禱告上獻上你自己的禱告,或者是你有感動,請大家就是順服你的感動,好嗎?
6685.433	6688.175	大家有看到我們三月份 今天已經是幾號了?
6689.548	6695.532	26號,對,所以如果神給你感動的話,邀請你參與在神家裡的工作當中。
6695.532	6703.397	那另外我們也感謝神在高雄前進站的部分,目前我們的累積奉獻其實已經有結餘了。
6703.397	6705.618	再次把掌聲榮耀歸給神。
6705.618	6714.624	就是每一個神自己感動祂的兒子,自己感動每一個弟兄姊妹,我們獻上我們自己所有的。
6714.624	6717.506	所以非常感謝各位,神也紀念各位的擺上。
6719.002	6722.703	那再來的話提醒大家我們一樣會有禱告會的部分。
6722.703	6727.725	禱告會我想目前其實看到非常多桃園堂的弟兄姊妹都有參與在其中。
6727.725	6731.386	我們可以用線上的方式一起來跟神禱告。
6731.386	6734.627	一起為著教會為著我們的群體線上我們的禱告。
6734.627	6738.288	所以邀請大家可以定時來參加我們的線上禱告會。
6738.848	6759.091	那再來提醒大家下週是,不是下週,下週是四月底,在我們的線上的先知性服飾,上次其實我們有一次,有過一次實體的,那如果接下來你還是有想要參加的,我們可以在線上參加,那記得我們要在前一個禮拜的禮拜五,你要先做線上的預約,這是來提醒。
6760.418	6772.104	今天他會有一個職場的活動,那如果各位有興趣想要參加的話,你可以上他的YouTube,你可以在YouTube上面可以加入。
6772.104	6789.813	另外在我們的50加1的活動,這個之前已經有跟大家公告過了,那目前開放的是55歲以下,所以如果你有興趣的話,你可以參閱我們的週報,或者是我們在外面招待桌上面也有文字的訊息,大家可以帶回去參考,如果你有興趣想要報名的話。
6791.732	6831.246	親民廉價的公告這邊要提醒大家四月份的親民廉價辦公室是有休息的所以如果是四月三號到四月五號這三天辦公室跟教會的場地是不開放的但如果有小組聚會的需要的話請跟小組長這邊的需求小組長會跟教會申請或者是聚會會延期這個部分先提醒大家 好再來這個很重要要跟大家說一下我覺得大家今天有看到就是在前面還有後面我們看到尤其今天宜萱也是還有宗韻其實有非常多桃園堂的弟兄姊妹你已經加入在服飾當中了我這邊可以邀請一下 繁體中文，臺灣國語。
6851.049	6854.814	但是有非常多的弟兄姊妹，已經願意起來回應。
6854.814	6859.059	我們真的是非常感謝神，在這個堂會裡面，祂所做的工作。
6859.059	6869.811	那我們邀請大家，如果你剛看到你的周圍喔，如果你已經穩定在桃園堂聚會，但你還沒有加入到，服事的團隊當中的， 繁體中文，臺灣國語。
6869.811	6871.452	繁體中文，臺灣國語。
6871.452	6873.013	繁體中文，臺灣國語。
6873.013	6874.294	繁體中文，臺灣國語。
6874.294	6875.594	繁體中文，臺灣國語。
6884.019	6903.106	所以如果你已經有加入在服飾團隊的,請你掃描這個QR Code,這個QR Code是線上版本,所以它會一直更新,其實就是同一個連結,你可以把這個連結儲存起來,在你的手機裡面,你隨時可以上去看,基本上我們一季會排一次,所以接下來四月份、五月份、六月份的服飾表已經排出來了。
6903.106	6910.089	非常好,大家有拿起你的手機掃描,因為我剛剛看完全沒有人在動,我很怕你們最後問我說,請問下個月我什麼時候要服飾?
6910.469	6914.992	請大家留意一下,我們時間上面有一個比較不一樣的地方。
6914.992	6918.293	影音的同工的話,請你八點半要集合。
6918.293	6920.935	影音的同工請你八點半要來集合。
6920.935	6929.480	如果是招待服事,招待服事我們考量到,最近其實大家已經越來越進入狀況了,我們的服事也越來越順手了。
6929.480	6934.823	所以我們的集合時間有稍微延後,讓大家可以再有更充裕的時間可以做預備。
6935.043	6942.528	所以我們9點10分,如果你是招待同工的話,請幫我留意,你9點10分要抵達,在我們的大廳集合。
6942.528	6953.476	服飾表上面你會看到當天的總招是誰,當天的總招是誰,所以9點10分請你一定要到大廳集合,那我們就會開始進行會前的準備。
6953.476	6960.782	那會後的話12點,12點的時候我們就會有場地的恢復跟清潔,所以這是在招待同工的部分。
6961.578	6966.081	那這裡要稍微提醒一下,大家要記得,這是家裡的事,對不對?
6966.081	6986.453	我們來家裡神的殿當中服事,請大家要稍微留意一下時間,如果你有被安排到當天的服事,特別是招待服事,之前還是會有一些弟兄姊妹,考量到你可能覺得,我今天就是比較累一點,所以你可能遲到30分鐘,那你要留意你,但是30分鐘過去之後,弟兄姊妹已經都進來了,好不好?
6986.453	6991.996	所以我們提醒大家,請你,一定有代價要付上的, 神做的事情我們必須付上代價。
6991.996	6993.096	請大家留意時間。
6993.096	6997.298	如果你有單排到當天的主日的話,請你要記得準時。
6997.298	7002.520	那另外如果你的服事日期需要稍作更改,基本上我們不會讓大家很平凡的服事。
7002.520	7006.361	所以如果你真的遇到事情想要更改的話,我們就維持之前的狀態。
7006.361	7014.004	請你先找到你想要換的日期,找到弟兄姊妹,先換好之後再用私訊的方式通知我們的小編。
7014.004	7015.245	這樣大家清楚嗎?
7015.245	7018.826	所以這個連結請大家一定要保留喔,我們就不會再一直跟動。
7021.357	7022.238	連不起來嗎?
7022.238	7024.879	我昨天連不起來是不是?
7024.879	7027.762	我居然發生這種失誤,求神赦免我好不好?
7027.762	7032.805	我等一下調整一下,我們會再,會後我再把這個連結再更新一次。
7032.805	7033.746	這邊可以是不是?
7033.746	7034.947	謝謝思綺姊妹。
7034.947	7038.869	請教導一下你後方的順心大哥。
7038.869	7040.090	開玩笑順心哥。
7040.090	7043.673	好好好,我等一下處理好不好?
7045.606	7049.107	搖滾區才可以,所以以後做近一點啊各位。
7049.107	7051.708	你知道這樣總招很難待位的。
7051.708	7056.249	好來最後最後各位趕快讓我結束這一切。
7056.249	7059.670	已經45分了,我回去會被檢討的好嗎。
7059.670	7067.752	電子週報,如果新朋友你還沒有我們的電子週報的請你掃描下來,我們所有詳細的資訊都在這上面好不好。
7068.012	7070.933	除了剛剛服事表,需要我等一下再更新,好不好?
7070.933	7072.553	其他的資訊都在上面了。
7072.553	7074.373	好,那今天的報告就到這邊。
7074.373	7079.074	那接下來的話,我們請鄭君傳到為我們做祝福彩排。
7079.074	7084.875	好,我們一同起立。
7084.875	7085.596	我們一起來禱告。
7085.596	7100.775	親愛的聖靈,我們向祢深感恩,主使的,就如開頭的禱告一樣,主要我認識服事的,被服事的,在什麼樣的生命的季節裡面, 主啊今天你都一一的﹐與我們相遇。
7100.775	7104.217	主啊你的工作都一一的﹐在我們當中。
7104.217	7106.418	主啊成全成就。
7106.418	7110.760	主啊觸摸每一個每一個你寶貝﹐兒子的生命。
7110.760	7111.860	主讚美你。
7111.860	7121.965	願我主耶穌基督的恩惠﹐天父上帝的慈愛﹐以及在聖靈裡的感動﹐常與我們眾人同在﹐直到永永遠遠。
7121.965	7122.625	一起說。
7122.625	7123.205	阿們。
7123.205	7126.367	弟兄姊妹請坐。
7127.722	7131.089	好,又到了我們非常樂情的時刻。
7131.089	7133.074	要歡迎我們當中的新朋友。
7133.074	7137.744	那我知道這邊有一位弟兄弟弟,可不可以請你起立,可以做一個簡單的自我介紹嗎?