start	end	text
4029.234	4033.176	因為你知道,上帝的計畫,絕對不只如此而已。
4033.176	4034.597	阿們。
4034.597	4045.580	第二個,求神照明我們心中,眼睛, 的關鍵要素,眼光是做祂的兒子。
4045.580	4051.322	做祂的兒子。
4051.322	4055.644	我很常講,很常講這個生命的故事。
4055.644	4066.328	我在當天教會之前,在那個教會,我真的是很投入在,賣命在教會的服侍裡面。
4066.328	4067.588	賣命,真的是賣命。
4069.650	4073.174	但沒有莊牧師賣命。
4073.174	4075.557	總是有一些次序,沒有他。
4075.557	4079.000	他真的,哇,我沒辦法。
4079.000	4080.702	好,沒有,開玩笑。
4080.702	4084.767	真的是非常投入。
4084.767	4091.034	但,如果沒有上帝的幫助,幫我釐清這件事情的話,我不曉得我為什麼這麼賣命。
4093.439	4110.825	我感謝上帝依智恢復我成長背景的傷害跟經驗,然後讓我知道我不是奴隸,我不是奴僕,我不是只是個工人一樣,我不是一個一直要被榨乾的人。
4110.825	4130.136	我後來發現,我後來透過上帝的依智跟恢復,我釐清我為什麼這麼愛來到教會,我為什麼這麼喜歡做事情, 第一個可以想到的是,我想要證明自己是可以的,有能力的。
4130.136	4138.904	神繼續問,神繼續醫治,神繼續工作,更更深抵顧在生命裡面的那個不安全感跟缺乏事。
4138.904	4155.497	因為我養子的身份,所以我覺得,除非我可以證明自己是有能力的,值得被愛的人, 我覺得我才算是我養父母的孩子。
4155.497	4164.220	我從國小五年級﹐知道自己養子的身分之後﹐我就停止叫我的養父母爸爸媽媽﹐因為我覺得我不配。
4164.220	4171.342	所以你可以想像﹐基本上講話就是沒有﹐很冷淡﹐基本上我就很少有那個交集。
4171.342	4177.644	很尷尬的時候﹐那個時候發現的時候﹐臺灣正流行這種家庭相圖劇。
4177.644	4188.797	然後一起坐在客廳裡面﹐ 看電視的時候會演一些什麼養子不孝啊,養父母的財產,然後就欺負養父母啊,然後就離開。
4188.797	4200.044	你知道鄉土劇很多這種劇情,所以後來我就不想,也不要再營造那個我們在一起,因為不想讓他浮出檯面談這件事情。
4200.044	4204.066	我養父母也不知道怎麼談,教育我這個問題。
4204.531	4236.429	所以從那時候開始,我沒有不愛他們,我好愛他們,因為在我知道我是楊子之前,他們太愛我了,太愛我,就像我開口,就像我的楊父母都可以答應我,都願意因為愛我的緣故,買給我或滿足我,但是當我知道之後,我就覺得怪怪的,不配,因為我只是你的楊子,我下面還有兩個妹妹, 我覺得只有他們兩個才值得這件事情。
4236.429	4244.073	所以從那個時候,我自己裡面就有這個概念,這個觀念或謊言。
4244.073	4249.977	除非我對你是有幫助的,不然你對我的肯定對我來說是虛假的。
4249.977	4257.701	或漸漸的我不太喜歡別人讚美跟肯定我,因為我覺得那只是我的基本款。
4258.882	4262.344	那是很自然而然、理所當然的事情。
4262.344	4267.086	我可以表現好,這件事情是人都應該要做的事情。
4267.086	4268.567	你知道這影響多大嗎?
4268.567	4270.648	我這樣看我自己,我也看身旁的人。
4270.648	4276.610	天啊,Sky,你剛彈的那個吉他,可以註下那個和弦嗎?
4276.610	4277.691	好不好?
4277.691	4281.653	對,怎麼會往那邊走呢?
4281.653	4283.974	辛蕾,刮一下鬍子好不好?
4287.995	4297.020	你知道當你這樣看自己的時候,你的眼光也會這樣看你身旁的人,懂嗎?
4297.020	4313.129	所以,你不願意肯定自己愛你自己的時候,你也不太能夠愛你身旁的人,因為你覺得都是理所當然的,除非你是對我來說是有幫助的,不然我不會願意花時間在你的身上。
4314.206	4315.489	哇!
4315.489	4359.245	當你意識到這個是個謊言的時候這個是很...太可怕的事情太可怕的事情你知道我的這個狀態 我可以這麼殘忍的﹐對待自己﹐是將近是﹐十年左右﹐或從我的小時候﹐國小五年級﹐然後到出社會工作﹐你知道這個﹐影響多深﹐甚至影響深到什麼地步呢﹐上禮拜生命會談﹐談到我的﹐擇偶條件﹐對不對﹐我提到了就是要有﹐原住民的身分﹐我希望有優良的傳統﹐可以傳承﹐對不對﹐再一次希望可以﹐他唱歌很好聽﹐但﹐ 還有一個更根深蒂固的想法在裡面,是什麼?
4359.245	4366.350	其實這些條件,我應該怎麼說比較好?
4366.350	4370.713	其實說到底,我覺得我是個不值得被愛的人。
4370.713	4380.739	當我非常靠近一個人,我說在關係上面的時候,當我非常靠近一個人的時候,差不多到有一個距離的時候,我就會害怕。
4380.739	4381.499	我怕,欸?
4381.499	4381.679	幹嘛?
4383.660	4387.462	不要這麼容易接梗。
4387.462	4392.846	我就會害怕他再進來會發現真實的我。
4392.846	4394.707	這個很可怕喔。
4394.707	4397.448	無論是同性的朋友,好朋友。
4397.448	4406.774	所以我的好朋友,比如說喝個小酒啊,然後聊天的時候,他會說,欸,我覺得有時候你會不見。
4406.774	4408.595	他講的其實很簡單啦。
4409.206	4413.129	你會突然從我們的生活當中抽離。
4413.129	4419.774	這是好朋友的話,那更不用說那個女朋友。
4419.774	4423.477	你知道,差不多到一個距離的時候,我就會退開。
4423.477	4424.378	為什麼?
4424.378	4434.085	因為害怕,Sorry,我不想成為第一個死在這個,你看我嘴巴很快吧,對,請原諒我。
4434.085	4438.985	我就會怕她會真的發現我,沒有資格, 蛤?
4438.985	4441.406	楊正鈞原來是這樣喔?
4441.406	4450.168	雖然彈琴還可以,或怎麼樣,但我原來真正認識他的時候,也不過是如此。
4450.168	4460.271	我好怕聽到這個話,或我好怕後來我發現這個是事實,我裡面有好害怕。
4460.271	4463.572	對,所以,我不曉得你們會有這樣的感受嗎?
4463.572	4467.393	如果有的話,求神幫助我們恢復這個關係。
4468.660	4479.567	你知道,但,到這個群體,我就必須進來這個群體嘛。
4479.567	4484.750	你知道這要花我許多時間磨這個功課,你知道嗎?
4484.750	4504.180	我剛剛說了,這個壓引,這個對待自己的方法,真的是, 長年累積,它變成一個一個狀態是,因為我不想承認自己這個軟弱,然後,所以我就告訴我自己,我必須訓練自己沒有感覺,不然太痛苦。
4504.180	4517.744	我原本的本質應該是一個就是阿美族的孩子,然後充滿熱情,然後很喜歡跟人接觸,但因為這個謊言,我讓自己必須沒有感覺,不然我會非常痛苦,因為我沒有辦法靠近人,不是他們不行,而是我會跳開。
4518.729	4519.589	所以這會讓我痛苦。
4519.589	4522.990	痛苦到我就告訴我自己,楊振俊,夠囉!
4522.990	4524.910	不要再這麼敏感。
4524.910	4530.311	不要再這麼想得有的沒有的東西。
4530.311	4534.552	接下來所有的事情,所有的關係,不要經過這裡。
4534.552	4536.432	這裡就好了。
4536.432	4538.473	是,錯,呃,是,對。
4538.473	4539.553	錯,對。
4539.553	4540.473	是不是。
4540.473	4541.653	這樣就好了。
4541.653	4544.094	這樣就好了。
4544.094	4546.694	但沒想到還真的訓練成功。
4547.108	4579.484	一次你整個生活可以很順利的正常的進行維持生活的狀態事情進來你不需要看感覺你不需要在乎別人的感覺這樣會簡單一點人情這件事情對我來說就是非常的淡只要處理事對錯對要不要這樣就好了不要有感覺不要有感覺哇 弟兄姊妹,如果你也是這樣的經歷的話,我求神,求神也來幫助你跟醫治你。
4579.484	4589.310	完全撐不住,完全撐不住,因為你完全活出一個跟上帝創造你的那個樣子是不同的,完全不一樣。
4589.310	4594.233	我說我裡面就是有熱情,對人就是有感覺。
4594.233	4606.741	我想要靠近人,我想要更多的認識,我想要親近人,我也喜歡 在人當中的感覺,但我卻長年的拒絕接受這樣的刺激。
4606.741	4617.763	那一天在淡水是颱風夜,外面下著大雨,然後裡面也下著大雨,我就崩潰的大哭,我說哇,倒不如死了算。
4617.763	4624.225	因為這樣活得太辛苦,你就算有再好的成就,你沒有辦法跟人分享。
4625.759	4639.126	你生命就算有再美好的事情,你沒有辦法跟人分享,你也沒有辦法聽到別人分享他們的生命,你沒有辦法參與在別人的生命當中,你沒有辦法感受到,太痛苦了。
4639.126	4644.029	外面下,刮著大風大雨裡面,我只是哭到不行。
4644.029	4651.353	然後那天晚上,那天晚上,是我第一次聽到我所謂的神對我說話。
4652.910	4663.176	對一個在長老教會長大的孩子,我還是第一次,這樣經歷,上帝我的天賦對我說話。
4663.176	4669.060	甚至說,孩子,好,這是我要你做的事情。
4669.060	4673.943	一,去愛那個不能夠感受愛的人。
4673.943	4685.452	你知道當上帝說話的時候,當上帝一致來到的時候,那個全能,那個大能,會讓你, 完全降服,我嘴巴就是阿門,我要。
4685.452	4692.281	但是我心裡面的OS是說,太難了,因為那個人就是我。
4692.281	4699.751	我怎麼能夠愛一個不能夠感受愛的人,那個太難,因為我太了解我自己,那個心太硬了。
4700.947	4704.168	我還沒來得及說完,還沒來得及辯解。
4704.168	4709.309	上帝又說,天父又說,第二,去愛那個不能夠愛的人。
4709.309	4710.350	兩種。
4710.350	4713.371	第一個,不能夠感受愛的人。
4713.371	4716.671	第二,不能夠去愛的人。
4716.671	4721.393	第二個命令下來,我的嘴巴也是因為那個全能太強大。
4721.393	4724.054	我也是阿們,阿們,我願意。
4724.054	4728.335	但是我心裡面一樣在掙扎,太難了。
4728.335	4738.417	因為那種人, 也是我,我同時不能愛,也不能夠感受愛。
4738.417	4747.880	我後來跟幾個朋友分享我這個生命見證的時候,有一個朋友就這樣提醒我,欸,鄭主委你剛剛講什麼?
4747.880	4763.672	你知道,我覺得其實上帝天父在對你說這個話的時候,不是又要你去做事情, 她說的那個人是你。
4763.672	4777.142	政軍去愛你裡面這個一直停留在國小五年級不願意再感受愛的那個政軍。
4777.142	4785.028	政軍去愛那個已經停留在國小五年級但不能夠愛人的政軍。
4786.903	4799.219	你知道我們生命可能好像一個,你知道你有看過那個木桶,然後他是用一條一條的那個木條拼在一起然後綁在一起。
4801.340	4817.145	我覺得我們生命當中可能有一些木條是或長或短的,以至於你那個桶子,你這個生命是無法裝滿從上帝來的心意、能力、計畫。
4817.145	4817.585	為什麼?
4817.585	4823.007	因為有一些就卡在那個傷害裡面,然後它不長大。
4823.007	4856.849	或者換個說法,你知道你生命裡面可能也有我這樣的經歷, 有一個部分在健康上面的安全感在財務上面的安全感在關係上面的安全感還停留在國小五年級以致你這個人他沒有辦法成為一個完全的器皿然後完全來裝滿從上帝來因為 坑坑巴巴有洞。
4856.849	4857.429	裝不起來。
4857.429	4861.070	裝不起來。
4861.070	4881.154	當我總覺得因為這個謊言總覺得我要靠我的我的手我的能力來證明我自己的價值的時候今天第二個眼光你知道你來到這裡你已經得著這個兒子的名分。
4881.154	4891.271	上帝我們的天父看我們 不是憑著我們過去到底是什麼樣子,或不是你現在是什麼樣子。
4891.271	4898.498	祂用的眼光是,祂賜下的那個愛著耶穌基督得勝的樣子來看你跟我。
4898.498	4899.679	什麼意思?
4899.679	4908.727	因為在主再來那一刻,你跟我都要與祂一同得著這個兒子的基業,兒子的產業。
4909.974	4949.499	你跟我都是他用的眼光不是我過去那個沒有辦法做好的木桶或者是我裡面那個沒有長大的政軍不是你生命當中那些坑坑巴巴他總是用他得勝的那個兒子在這裡有他男的兒子有女的兒子我們都是他的兒子所以如果你的生命也還停留在 做什麼事情﹐能夠滿足﹐上帝﹐愛你這件事情﹐或你值得被愛成神情。
4949.499	4963.850	我盼望﹐今天神﹐大大的﹐一次﹐你跟我﹐不然﹐就是坑坑巴巴﹐就是裝不滿﹐就是裝不滿。
4963.850	4993.211	關於兒子﹐ 我也埋怨我為什麼被棄養我可以講得很難聽我甚至有一段時間我恨為什麼偏偏是我我寧願在一個甚至會講出這種話我寧願在一個有問題的家庭我也要正常的喊爸爸媽媽我會想這些東西 就是為什麼是我?
4993.211	4996.412	你為什麼要給我這樣的身分?
4996.412	5004.337	我甚至會不喜歡別人幫我過生日,因為我不確定那個生日是不是我真的生日。
5004.337	5014.162	所以如果有人幫我準備那個生日的驚喜的話,我會很不自在,然後到不舒服,會生氣。
5014.162	5022.359	但不是你們的問題, 我朋友的問題,不是準備的蛋糕不好吃,或者是禮物買的不是我喜歡的,都不是。
5022.359	5036.368	而是因為我對我裡面這個不確定,這個謎,這個問號,我從來不曉得,甚至因為我怕我傷了我養父母的心,我不敢問我到底怎麼來的。
5036.368	5052.802	這就一直困在,我根本不曉得,這個謊言會一直困在我的生命裡面,我不能確定我到底怎麼來到這世上,甚至我不曉得, 我來到這世上到底是不是一個喜悅的事情或祝福的事情。
5052.802	5079.331	所以這根本就加深我裡面那個我根本 沒資格或不夠所以我就會更有距離我就會找到機會就更想要證明自己是有能力的站在臺上站在臺上如果問一下你如果用什麼顏色來代表你的話你會回答什麼顏色這是我的標準答案我會說是灰色 為什麼?
5079.331	5086.957	因為當我在台下的時候,我希望我是低調的,因為我就沒有想要,因為那個謊言,我不想要被人注意到。
5086.957	5093.923	但是當站在臺上,我自己的解讀,或許色彩學不是這樣,待會有機會問一下心蕾。
5093.923	5098.847	當光照到這個灰色的時候,它就是銀色,就是它可以被注意到。
5098.847	5108.474	所以當我站在臺上的時候,我就會想盡辦法要吸引所有人的目光,因為這個是這個位置應該要, 做到的任務。
5108.474	5113.878	但是在我在人群當中的時候,能夠灰色就灰色。
5113.878	5123.406	所以很多時候,很多次來到淡江桃園堂,有很多時候的那個,我跟迷你牧師的那個張力,常常發生在這個事情上。
5123.406	5125.427	什麼事情上呢?
5125.427	5127.929	他一直想要把我推出去。
5128.933	5131.274	接觸你們,接觸弟兄姊妹。
5131.274	5138.518	我常常就是服侍,可能就坐在Keyboard,或在那邊裝忙,這樣。
5138.518	5142.160	如果有人來的話,就拿起電話假裝,欸,欸,怎樣?
5142.160	5145.701	但是沒有。
5145.701	5148.523	他就一直想要把我推出去,對。
5148.523	5150.664	有很多時候那個張力。
5150.664	5156.927	但我,這是我的課題,我得面對,不是你們不可愛,對,你們這麼可愛,對啊。
5157.858	5188.947	我愛你們好不好一直到有一次的醫治的課程那個場合實在太妙你就想我這樣的一個人這麼跟人有距離就更不用說我是不是可以我更不容易表達我自己的情感喜歡不喜歡我不太喜歡表達這件事情你就會想隨便或什麼的 很難表達自己裡面真實的感受。
5188.947	5195.372	但是那一場課程裡面,講醫治的課程裡面,大概現場有二十多人。
5195.372	5199.816	然後講員說,我們現在需要有一個人可以到臺前做一個示範。
5199.816	5203.098	我們要示範這整個醫治的過程。
5203.098	5208.282	但是因為這個示範會讓在場的人所有人都看到你裡面的傷害。
5209.019	5211.101	就是過去的傷害。
5211.101	5213.442	所以,我需要有自願的人。
5213.442	5219.868	你知道當他話語才剛講完,我的手就舉起來。
5219.868	5222.129	誰?
5222.129	5224.611	誰用的?
5224.611	5226.933	因為這對我來說,不合理。
5226.933	5235.380	你知道,對一個跟人有距離的人,對一個不常有,想要表達自己情感,想要隱藏自己的人,這個舉手是很怪的。
5237.432	5240.234	大家就拍掌了。
5240.234	5249.779	二十多人有不認識的,你知道傳道人很怕揭露自己裡面的,因為我不知道你到底怎麼看我這個失敗或這個傷害。
5249.779	5253.421	我就說這二十多個人,然後老師就開始。
5253.421	5258.744	謝謝真經傳道願意做這個示範,真的很勇敢。
5258.744	5259.485	我也很想離開。
5261.118	5267.262	我就帶著大家一起做這個示範。
5267.262	5276.007	各位一起看我怎麼樣引導,讓被扶持的對象自己遇見神。
5276.007	5277.788	就講這麼簡單。
5277.788	5302.688	第一個禱告下來,直接回到那個禪房, 我看到自己從母親的肚腹裡面被伸出來的那一刻,畫面可能不到五秒,但是這解決我好幾十年裡面的疑惑,你知道嗎?
5302.688	5311.355	如果這輩子我沒有看過這個畫面,你知道這個問號,這個驚嘆號,這個疑問,這個衝突,會在我生命有多久嗎?
5311.355	5355.539	那不到五秒的畫面,我從肚子裡面出來, 然後更重要的是我看到我母親笑就是我只是這是一個喜樂的事情不是厭棄不是無奈是笑不到五秒然後呢 我看到一個人,我知道是耶穌,幫我洗乾淨,包起來,然後帶到另外一個家庭。
5355.539	5359.360	我也看到我的生母流眼淚。
5359.360	5367.242	你知道這個不到五秒的畫面,解決我多少的問號,又不捨。
5367.242	5367.682	謝謝主。
5367.682	5373.424	然後把我帶到新的家庭裡面,好像一個禮物一樣。
5375.776	5426.084	這個不到五秒的畫面又解決了我多少的問題就是為什麼是我當我卻像個禮物一樣被帶到新的家庭那個禱告下來可能整個過程根本不到五分鐘你知道嗎但他解決我十多年的生命的困惑、疑惑 弟兄姊妹,你跟我都領受一個恩召,一個護照,是要來做天父上帝的兒子。
5426.084	5426.084	Amen?
5426.084	5437.845	生命當中的 傷害的經驗﹐或地上﹐肉體復清的不完全﹐可能會影響這些。
5437.845	5444.151	但你知道你的上帝是這麼﹐有創意的神。
5444.151	5454.500	你知道尼哥底姆問耶穌說﹐我怎能夠在重生的時候﹐耶穌講﹐若不是靠聖靈﹐什麼都不可能。
5454.500	5528.380	但那一刻我真真實實經歷這件事情﹐ 我不是真的回到母親的肚子裡面而是上帝用祂的創意用祂的工作解決了這個起頭這個問題的起點如果你的生命當中也有這個也有這個問題的起頭這個謊言的起頭但現在還是卡住你的也或許你的父親已不在你的身旁但你真的不用擔心因為在上帝裡面祂就是有這麼奇妙的工作 這麼奇妙的工作，那個不到五分鐘，有許多畫面，不到五秒的場景，他就解決，然後帶你進到這個，做兒子的護照裡面，以致你可以繼承，與耶穌基督一同，繼承這個書店的產業，終於可以不用，幫手幫腳，因為你怕遮遮掩掩，因為你怕別人看到， 所以現在這個政軍呢,他的手不是這種狀態,不是,就是蜷縮著,不,躲在角落。
5528.380	5541.825	這個政軍是可以,張開雙手,有餘力,抓住,從上帝來的祝福,包括身旁當中,美好的關係。
5541.825	5544.606	你跟我都要領受這個做兒子的身份。
5544.606	5544.606	Amen?
5546.988	5554.172	同樣,你身旁這些有問題的人,他也是上帝的兒子。
5554.172	5557.314	這個有問題的人,都有問題。
5557.314	5566.539	但是上帝用他看你的眼光,看愛子耶穌基的眼光看你,也這樣看他。
5566.539	5576.205	第二個,求神,照明我們心中眼睛的這個情況,是看你自己,也看我們身旁的人。
5577.039	5578.540	祝兒子。
5578.540	5580.681	阿們。
5580.681	5587.904	第三。
5587.904	5594.008	幫我按一下醫院。
5594.008	5606.174	在聖靈裏面,我請敬拜團上來,我的時間有限。
5606.174	5613.632	在聖靈裏, 弟兄姊妹,我很快地做一個收尾。
5613.632	5622.195	認識祢的天父,以致祢可以明白像我剛剛明白的那個真相。
5622.195	5632.920	而且我盼望祢早早地,因為認識這位愛祢的天父,以致祢生命當中那些謊言都被拆穿,都被挪去。
5632.920	5635.041	阿們。
5635.041	5635.961	真君祢是值得的。
5639.343	5642.886	天啊,我自己對自己講都覺得不可思議。
5642.886	5646.289	弟兄姊妹你是值得的。
5646.289	5648.791	被上帝愛。
5648.791	5654.015	你跟我都要領受這個做兒子的身份。
5654.015	5665.504	然後我們都在這個以他為首的,以耶穌基督為首的這個群體,這個教會裡面。
5665.504	5667.686	我們一起奔跑這個天路。
5669.872	5678.159	你對上帝的認識有多少你就會更多的知道祂是多麼的有能力多麼的豐富。
5678.159	5684.505	你也會知道祂將祂的豐富澆灌在祂的愛子耶穌基督的生命裡面。
5684.505	5691.951	那你更要曉得我們在一起的這個信仰群體這個教會我們是以耶穌基督為首的。
5691.951	5699.459	這個群體這個身體跟耶穌基督有一個 非常強大、活潑、有能力的聯繫。
5699.459	5704.082	神天賦如何豐富的充滿耶穌基督。
5704.082	5707.745	耶穌基督也這樣充滿祂的教會。
5707.745	5708.786	什麼意思?
5708.786	5714.410	你我都在上帝的那個豐富裡面、大能裡面。
5714.410	5718.993	但我們都要來認識、來知道、來領受。
5718.993	5718.993	Amen?
5721.459	5733.932	好不好,我邀請弟兄姊妹一同在那裡,我們用第三首詩歌,來回應我們的主,說我的生命,因為知道你是誰,而且是要不斷不斷的更多的認識你。
5733.932	5760.923	所以我們可以在這個,是軟弱的,有問題的, 人的組織裡面但我們仍然有盼望因為知道是一個我們一直在一個未來式的不斷調整的過程當中在奔跑在把自己的生命一點一點的更多更多的獻給我的神。
5760.923	5769.189	一起用這個詩歌來敬拜我們的神。
5769.189	5776.696	獻上生命 獻上生命﹐給最愛的耶穌。
5776.696	5785.762	完全勝負﹐完全降服。
5785.762	5792.746	因祢恩典﹐使我能以侍奉祢。
5792.746	5797.569	祢的恩兆﹐沒有懷疑。
5797.569	5799.090	再次獻上生命。
5802.381	5809.684	獻上生命﹐給最愛的耶穌。
5809.684	5816.507	完全順服﹐完全相符。
5816.507	5823.951	以祢恩典﹐使我得以侍奉祢。
5823.951	5828.553	祢的選擇﹐沒有懷疑。
5832.278	5838.243	我的生命獻給祢,被祈使祂跟隨祢。
5838.243	5846.570	願祢的榮耀,彰顯在我生命。
5846.570	5854.437	我的心不要忘記,祢如何為我生命。
5854.437	5860.502	耶穌我愛祢,喜樂的跟候我的生命。
5860.742	5874.473	人民獻給祢,北極世家跟隨祢,願祢的榮耀,彰顯在我捨命。
5874.473	5882.259	我的心不要忘記,祢如何為我捨命。
5882.259	5896.215	耶穌我愛祢,喜樂的跟隨祢, 好不好,神的教會,神的兒女,我們一起開口來禱告,說,主,我在這裡, 我是祢的兒子。
5896.215	5897.877	我是祢的兒子。
5897.877	5911.367	主啊,若在我生命當中,因為成長背景的傷害,因為人的錯誤,在我生命當中留下謊言的,留下傷害的,現在祂不能夠再控告、挾持我的生命。
5911.367	5915.130	我願我的腳、我的手現在得朝釋放。
5915.130	5919.254	我願我的心思、意念、我的靈現在得朝釋放。
5919.514	5921.857	要來緊緊跟隨祢。
5921.857	5928.045	好不好,數到三,先呼求主耶穌的名三次,就呼求主的一致領到我們裡面。
5928.045	5934.433	一、二、三,主耶穌,主耶穌,主耶穌,開口來禱告,Hallelujah!
5935.094	5964.660	主啊,主啊,我在這裡,主啊,我在這裡,主啊,為我生命當中那些控制我的,控告我的,挾持我的,現在我奉耶穌基督的名,祂不能夠再控告我,祂不再能夠挾持我的生命,主啊,這個謊言不能夠再蒙騙我, 主要現在,我要奉耶穌基督的名,我祝福政軍,要得朝一致,得朝釋放。
5964.660	5981.308	我奉耶穌基督的名,祝福在場的每一個你寶貴的兒女,你知道他的名字,你知道他生命的情況,你知道他生命的困境,但我現在奉耶穌基督的名,叫你的兒子, 叫你的兒女得朝釋放。
5981.308	5982.769	得朝釋放。
5982.769	5983.970	得朝釋放。
5983.970	5985.170	主啊我讚美你。
5985.170	5988.973	主啊那些謊言不能夠再瑕疵蒙騙你的兒女。
5988.973	5992.275	現在在過去在小時候的傷害。
5992.275	5995.377	停留的卡住的那個孩童。
5995.377	5997.399	現在都要茁壯起來。
5997.399	5999.100	都要成長起來。
5999.100	6001.221	主啊是一個完整的個體。
6001.221	6002.342	完整的生命。
6002.342	6003.443	要成為一個趣味。
6003.763	6007.546	要來承載,抓從天父上帝來的慈意。
6007.546	6012.430	要來承載從天父上帝來的,屬天的一切的福氣。
6012.430	6019.476	主我讚美你,做我們在這裡禱告呼籌的能力,你的意志現在就領導在我們裡面。
6019.476	6029.201	我主讚美你,我的生命, 我的生命獻給祢,背起釋迦跟隨祢。
6029.201	6035.624	願祢的榮耀,彰顯在我生命。
6035.624	6043.367	我的心不要忘記,祢如何為我赦命。
6043.367	6048.890	耶穌我愛祢, 喜樂的跟隨你。
