start	end	text
18.865	23.767	弟兄姊妹平安，我們按照每日嚴經事義的進度,一起來思想。
23.767	40.232	羅馬書第一章18節到20節,我們之前在17節的時候,有談到一個重要的觀念,就是透過哈巴古書的背景,來了解到上帝的義,或是上帝的公義,如何彰顯出來。
40.232	54.558	有兩個面向,第一個,就是針對不願意悔改的罪人和惡人,上帝的義, 彰顯的方式,就是請到祂的憤怒和審判在他們身上。
54.558	58.039	第二個面向,神的意,怎麼樣來彰顯呢?
58.039	69.364	就是針對那些聽見上帝的話語,聽見上帝的福音救恩,而願意悔改,來信靠神,過一個討神喜歡的生活的人。
69.684	87.625	上帝就赦免他們的罪,算他們為義人,或稱他們為義人,讓他們在這個幕後的審判的時候,他們能夠逃過上帝的審判,賜給他們生命,不僅是今生的生命,還有永遠的生命。
88.046	93.428	因此,神的義,就會用兩種方式來彰顯。
93.428	96.849	一個就是禍因,一個就是福因。
96.849	100.330	對不願意悔改的人來講,他就有禍了。
100.330	104.292	對於願意悔改的人來講,他就有福了,有好消息了。
104.872	117.143	因此呢,我們過去在講羅馬書的時候,很多人會認為羅馬書它的主要的一個這個中心點,就叫因信稱義。
117.143	120.906	我想因信稱義是很重要,但它只是一部分。
121.647	154.107	真正我覺得這個羅馬書的中心的一個主題就是十七節因為神的義正在祂兒子的福音上顯明出來而願意接受祂兒子的福音的人祂就一人必因性得生而不願意接受祂兒子福音的人那神的憤怒就要傾倒在祂身上所以因性稱義只講到好消息那個部分至於神的憤怒 公義的彰顯,這個也是非常重要的。
154.107	159.413	我們就來看一下第18節,保羅開始就來講禍因。
159.413	167.362	18節,原來神的憤怒,從天上顯明在一切不前不易的人身上。
167.362	170.766	原來這個字,其實是因為。
171.800	203.275	從十六節到二十一節每一節的開頭都是因為因為因為六節裡面總共保羅非常急促的而且強烈的用了七次的因為那我們就可以去了解為什麼會這樣因為保羅他在十四十五節的時候他講過他欠全世界人福音的債 所以祂情願盡祂所有的力量,要把福音的債還掉。
203.275	217.687	所以祂接下來就連續用了七次因為、因為、因為,來表達祂極力的要來傳揚福音,要把上帝救人的福音,神兒子的福音,傳揚給世人。
217.687	220.869	就算失去祂的生命,祂也在所不惜。
221.630	254.119	所以18節這邊講到因為神的憤怒從天上顯明這個顯明一樣是那個啟示那個字跟17節一樣17節是說神的公義在神的兒子的福音上啟示出來了顯明出來了可以讓這個義人因信得生18節講的是相反的是講到說那神的憤怒就是祂公義的憤怒 也會從天上一樣會啟示出來。
254.119	255.641	一樣會顯明出來。
255.641	257.063	但這個對象呢。
257.063	258.244	就不是義人了。
258.244	261.248	不是那個願意悔改信靠神的義人。
261.248	263.571	對象是一切不前。
263.571	265.633	就是不敬前。
265.633	267.616	心中眼中沒有神的人。
267.616	268.817	不把神當神的人。
269.258	272.920	這叫不淺，還有不義的人身上。
272.920	276.721	心中無神，目中無神，就可以為所欲為。
276.721	281.864	因此祂所行出來的行為跟人生，就是一個不公義的人生。
281.864	288.247	所以上帝的憤怒，已經從天上顯明，啟示在一切。
289.087	291.648	不敬虔不公義的人身上。
291.648	298.509	代表說這些人他是知道繼續的不敬虔不公義的下場是如何的。
298.509	301.650	就是要面對上帝公義憤怒的審判。
301.650	311.492	經文繼續說這樣不虔不義的人就是那些行為上行不義來阻擋真理的人。
311.492	314.853	阻擋真理他也可以翻譯成壓制真理。
316.169	349.662	所以不論是他內心還是他外在的行為他都知道上帝是會發怒的上帝對於他的不敬虔不公義的生命跟行為上帝是會有反應的但是他一直在他心中壓制他良心給他的提醒他在外面也一直來抵擋別人行真理所以這樣的人就是神的憤怒會傾倒在他身上 十九節,一樣一開始,原文也是加一個因為。
349.662	363.787	因為,這個是在希臘文叫gar,連續每一節都是gar,gar,gar,開頭,代表保羅,他急切的在論述,為什麼迫切的臺灣神的福音,如此的重要。
363.787	368.748	十九節,因為神的事情,人所能知道的。
368.748	418.377	他的原文是顛倒,我們可以顛倒翻譯,因為能被知道的, 上帝的事情是在人心裡是明顯的所以十九節告訴我們說關於人的心裡面在還沒有聽到神兒子的福音之前 人所該知道的關於上帝的事情是非常清楚明白的為什麼人的心裡面對於有關於他能夠知道的上帝的事情是非常清楚明白的十九節下半段說因為上帝已經將這一切都給他們顯明了 這個叫做普遍啟示。
418.377	438.996	就是說,就算你沒有聽過耶穌基督的救恩福音,就算你沒有看過舊約的聖經,不曉得猶太人的律法,但是上帝祂都已經將普遍啟示, 放在每一個人的心裡面。
438.996	442.418	使人知道有上帝的存在。
442.418	444.739	因此19節我們再來讀一次。
444.739	448.401	因為神的是人所能知道的。
448.401	451.883	原顯明在人心裡。
451.883	455.224	是因為神已經給他們顯明。
455.224	460.507	那這件事情或是這個普遍啟示是怎麼做到的呢?
460.507	462.788	保羅就舉了一個例子。
462.768	496.557	20節 二十節呢他的希臘文原文跟中文的這個翻譯的順序有點不一樣請容我用希臘文原文的順序來跟各位解釋二十節他的開頭是因為是眼不能見那什麼叫做因為是眼不能見喔他的原文是這個因為神的不可見性 上帝是看不見的,肉眼看不見的。
496.557	512.127	但是因為神祂的不可見性,已經藉著這個,已經自從造天地以來,藉著所造之物,就可以明明曉得。
512.127	513.668	曉得什麼呢?
513.668	520.092	神的永遠的能力,和神的神聖性,是人明明可知的。
521.084	523.165	教人無可推諉。
523.165	525.345	這是原本希臘文的順序。
525.345	527.906	那我們就稍微來解釋一下。
527.906	529.707	保羅再次強調。
529.707	532.267	上帝雖然是我們看不見的。
532.267	535.028	但是上帝的不可見性。
535.028	539.670	其實可以透過上帝所創造的萬物。
539.670	541.951	就是上帝的創造物。
541.951	542.951	使怎麼樣?
542.951	546.092	使人從上帝創造天地以來。
547.346	569.443	人的心裡面就知道上帝的存在並且可以體認出這個世界和包括你跟我絕對不是自己跑出來的也不是人所創造的所以他們就對於那不可看見的神 上帝就給予他們一些基本認識。
569.443	576.010	包含他們的心中會認識到上帝永遠的能力。
576.010	578.332	以及上帝的神聖性。
578.332	580.554	這些都是人類沒有的。
580.554	582.576	也是這個物質世界不會有的。
583.370	616.712	所以這個世界如何發生人如何被創造出來以及這個世界如何維持他的運作這個世界會往哪裡走人的心中有一個普遍的啟示就是他們會體認到必然有一位造物主他有一種永遠的能力是人沒有的他有一種他的神性跟人完全不一樣 因此呢,保羅就說,我們再來讀一下第20節。
616.712	631.884	自從造天地以來,神的永能和神性是明明可知的,雖是眼不能見,但藉著所造之物,就可以曉得教人無可推諉。
631.884	635.226	無可推諉就是教人沒有藉口。
635.226	667.905	我們透過18節到20節,看見 保羅好像替上帝在控訴這些不錢不義的人因為明明他們心中知道有上帝的存在保羅舉的例子就是透過人觀察這個受造的世界他心中必然能夠明白有一位看不見的造物主祂創造了、管理了、保護了 他運行著這個受造的世界。
667.905	673.447	這些能力是人類和這個世界本身沒有的。
673.447	680.109	這樣的一種神聖性跟人的這種有限性是迥然有別的。
680.862	706.506	這些不論是世界各地什麼樣民族的人他們心中都領受了這種普遍啟示所以保羅說人關於他應該知道上帝的那些事情上帝已經很清楚明白放在他們心裡了 因為這是上帝給世人的普遍啟示。
706.506	713.491	所以人明明知道有神的存在,卻仍然要不把神當神,這叫不前。
713.491	718.575	然後偏偏要去做神所厭惡的事,這叫做不義。
719.155	722.719	那他們就是刻意要阻擋真理。
722.719	725.181	刻意要壓制真理。
725.181	729.926	所以呢當神向他們發出公義憤怒的審判的時候。
729.926	732.089	他們是無可推諉的。
732.089	732.829	我們一起來禱告。
733.916	736.457	親愛的主,求祢赦免我們。
736.457	739.998	我們常常在觀看祢的創造。
739.998	745.119	常常在體會自己的渺小無能的時候。
745.119	748.760	主啊,我們在祢面前就該自卑。
748.760	754.421	我們在祢面前就該承認,祢是創造的主。
754.421	756.042	祢是宇宙萬物的主宰。
756.042	758.602	祢也是我個人生命的主宰。
758.602	760.283	主啊,讓我們在祢面前敬畏祢。
761.323	763.151	不要驕傲自大。
763.151	766.812	主啊,讓我們不要成為那個不淺、不義、 阿們。
795.811	797.372	願神賜福大家。