start	end	text
0.828	19.508	如果你手上沒有聖經,不要客氣,從你的座位上舉一下你的手,然後我們的同工會負責拿給你。然後我們來看《馬太福音》十八章,如果你翻不到《馬太福音》也沒有關係,請旁邊的弟兄姊妹幫你翻,不要客氣。我們都是從找不到《馬太福音》開始這樣子。
20.93	38.996	好,所以請旁邊的弟兄姊妹來幫你翻。我們要一起來讀馬太福音18章。我們要從第15節一直唸到35節,總共有20節。好,我們一起來念,好嗎?一起來念,好,第15節,請。
40.759	62.18	弟兄得罪你,你就去。趁著只有他和你在一處的時候,指出他的錯來。他若聽你,你便得了你的弟兄。他若不聽,你就另外帶一兩個人同去。要憑兩三個人的口座見證,句句都可定準。
62.5	83.381	若是不聽他們,就告訴教會。若是不聽教會，就看他像外邦人和稅吏一樣。十八節我實在告訴你們在天上也要釋放我又
101.442	105.522	21節,那時彼得近前來,對耶穌說,
123.575	131.46	財算的時候有人帶著一個欠一千萬銀子的來,因為他沒有什麼償還之物。
179.155	207.234	就慎憂愁去把這事告訴了主人,於是主人叫了他來,對他說,你這惡奴才,你央求我,我就把你所欠的都免了,你不應當連續你的同伴,像我連續你嗎?主人就大怒,把他交給掌行的,等他還清了所欠的債。你們個人若不從心裡饒恕你的弟兄,
207.654	229.706	我天父也要這樣待你們。我們讀到這裡不要把聖經合起來,我們一起來禱告。主謝謝你,你讓我們一起在今天2015年的第二個主日,我們來思想《馬太福音18章》這一段的信息。讓我們從這一段信息當中去明白你對門徒的教導,去明白為何門徒要發問這樣的問題。
230.026	231.307	繁體中文，臺灣國語。
260.026	265.541	阿們。馬來福音18章下面的這一段信息其實
266.34	290.973	不是一個很容易講的信息。因為通常講這一段信息的時候,很多時候會把那種對立、那種張力,會升得很高。可是沒有辦法,我講到就是我前面講到哪裡,下面我就會接著講。上帝沒有要讓我逃脫這一段經文。今天我們要從這一段經文當中來思想一個很重要的一個問題,就是有關於饒恕。
291.613	297.578	不是隻是饒恕而已。重點的一個很重要的問題是到底要饒恕幾次?
299.65	327.519	問題不在饒不饒恕的問題,對不對?問題是在對我們來講我到底要饒恕幾次。我相信在我們的生命當中有許許多多好像傷害我們的,讓我們不舒服的人。我相信我們因著上帝的恩典,我們都試著想要去做一件事情,那是什麼?饒恕。可是很多時候如果一而再,然後再而三的時候,我們必須要承認我們的生命當中會陷入一個困境。
328.319	347.53	我們生命當中會發問一個很重要的問題。這也是在這一段經文當中21節所開始的彼得進前來問耶穌的問題。也是我今天所要跟各位弟兄姊妹談的這個主題。那到底要我饒恕幾次?
350.265	371.839	我們回到《馬太福音》十八章的從一開始一直到整個十八章。整個十八章其實就圍繞著兩個很重要的主題。如果你還記得我上一次的講道,上一次的主題其實也是用一個問題作為一個開始。那個問題是,到底在天國裡誰是老大?
373.831	387.9	誰才是那個掌權的，或者在天國裡，到底是我比較大，還是另外一個弟兄，或者是姊妹比較大。那是很真實的，在我們的生命當中，或者很真實的，在一個基督徒的群體裡面，會面對的問題。
389.189	413.088	還記得耶穌怎麼回答這些門徒嗎?那個場景跟現在的第15節的場景很像。你看聖經第21節,第二十一節怎麼說?第二十一節,那十門彼得進前來對耶穌說,他問了一個問題,對不對?如果你看你的聖經第十八章的第一節怎麼說?你們一定要跟上喔。
414.07	433.625	來,第一節怎麼說?那當時門徒進前來問耶穌。好,停在這裡。所以其實這兩段,其實你可以說整個十八章就包含了這兩個重要的問題。上一次我們解決了處理了在天國裡到底誰比較大的問題。其實耶穌也回答了。
434.514	460.744	可是門徒能不能明白,我不知道。但是耶穌的確回答了。耶穌回答說,你們若不回轉,若不悔改,若不改變像小孩子的一個樣式,還談的不是那個小孩子的一個謙卑,是你願意被好像小孩子一樣的對待的時候,你都不會有意見。那天國就是你的,你就在天國裡面。
462.108	487.357	這是耶穌所要表達的一個教訓,一個教導。而在這一段當中,耶穌再次的透過彼得的問題。彼得問耶穌什麼?21節說,那時彼得近前來對耶穌說,主啊,我的弟兄怎麼樣?得罪我。我當饒恕他幾次呢?我們投影片下一張。
491.323	519.461	我不曉得對弟兄姊妹來講,你們怎麼樣對待曾經傷害你們的人?有被傷害的舉一下手。感謝主,有人是無敵鐵金剛,完全沒有被傷害到。都有對不對?有沒有被傷害的經驗?有對不對?不論對方是有意的或者是無意的,我們都有那種被傷害,不被理解,不被瞭解,對不對?
520.964	542.235	今心我作情。這好像是吳宗憲的歌,不是江蕙的。我要彈的是什麼?你有沒有被傷害的經驗?有。那種感覺,刻骨銘心,是吧?很不好受。然後你怎麼辦?你會怎麼辦?直接反擊嗎?有些時候是這樣,對不對?
542.978	568.142	很多人就有很多的分析,什麼星座的人會怎麼樣,那都不重要。重要的是,我們的確有一些人會直接什麼?反擊。你不給我好過,我也不給你好過,對不對?我絕對不讓步,直接怎麼樣?反擊他。你得罪我,你傷害我,我現在也要怎麼樣?傷害你。還有另外一種人是怎麼樣?
569.394	596.562	可能沒有那麼直接,對不對?然後呢,善於利用心機。想辦法怎麼樣?回給他。想辦法怎麼樣?報復他。我也要讓他常常被傷害的感覺。好叫他以後不會傷害我。這是我們自己的假設。可是通常不是這樣。我們再來看,我們會怎麼樣?以牙環。在這個過程當中呢,也許怎麼樣?
597.534	615.951	他怎麼樣對待你,你就會想辦法在各種的那種環境,再想辦法設計一個環境,讓他也嘗嘗你所受的那個傷害。第四個呢?甚至更厲害的是怎麼樣?我自己不做這件事情,我讓另外一個人來,怎麼樣做這件事情?
617.022	645.168	我要說這都不是一個好的方法,但是我也必須要說,我們都會這樣做。你說是吧?是,感謝主,你們都很誠實,跟我一樣。我們都會這樣子。好,下面。在這一段聖經當中,我們必須要去面對一個問題,就是一開始的第15節。我剛才講從第一節,它是一個場景進來,有門徒問耶穌,
645.896	673.093	到了第21節的時候,也有一個場景進來,彼得問耶穌,對不對?可是解經不能只是解這兩段,你中間的第15節一直到第20節,這一段經文放在這裡到底是什麼意思?馬太不是這一段經文沒地方放,然後就把它放在這裡,一定有它的意思所要表達的,而是涵蓋在整個《馬太福音》18章裡面。第15節怎麼說?
674.77	703.646	倘若你的弟兄得罪你,這也是耶穌的教導,你就去,你要去做一件事情。很多時候我們在歷代的教會裡,歷代的教導裡面,我們就拿著這一段經文,我們處理了很多弟兄跟弟兄,弟兄跟姊妹,姊妹跟姊妹之間的傷害的問題。以往我們就用這一段的經文來處理,我們再次的讀這一段經文,第15節到第17節,我們一起來念,請。
704.906	732.532	倘若你的弟兄得罪你﹐你就去趁著只有他和你在一處的時候﹐指出他的錯來﹐他若聽你﹐你便得了你的弟兄﹐他若不聽﹐你就另外帶一兩個人同去﹐要憑兩三個人的口座見證﹐句句都可定準﹐若是不聽他們就告訴教會﹐若是不聽教會﹐就看他像外邦人和稅吏一樣﹐
733.012	761.548	各位弟兄姊妹,耶穌在這裡的教導清不清楚?很清楚,對不對?所以很多時候我們就拿這一段經文,我們就直接去了。可是,好像也產生了一些問題。我們今天要來處理,就明明按照耶穌的教導去做了,對不對?怎麼常常會產生很多的問題?這也是今天我們在這段經文當中,我們必須要思想。從上下文來看,
763.285	791.853	其實耶穌在這裡不單單只是要告訴我們或者提醒我們要如何對待那個傷害了自己的人首先我們受了中文的一些誤解或者有一些抄本的解釋的影響在這邊講說倘若你的弟兄得罪你這個在翻譯上其實是有一點點可以有另外一種更好的翻譯其實在這邊原來的意思就是
792.773	816.841	倘若你的弟兄犯罪,這個罪是什麼?沒有那麼清楚。那犯了這個罪呢,而影響到了你,聽得懂我意思嗎?很多時候我們比較在意的是得罪誰?我,你懂我意思嗎?我們對於弟兄犯罪這件事情,他犯什麼罪?有些時候我們
817.978	845.369	不太想要去管他,你知道嗎?但是重點在於,他犯的那個罪對我怎麼樣?有沒有影響?我們比較在意的是,他所做的那件錯誤的事情。在這裡沒有要討論到底他那個是不是犯罪,他就是了,對不對?可是問題我們比較在意的是,他做了這件不好的事情,只要對我沒有影響,請問你們的反應通常是怎麼樣?關我什麼事,對不對?
846.101	873.002	犯罪就犯罪啊,反正到最後有一天上帝會施行審判,對不對?我們很多時候我們的態度是不是這樣?是嗎?你都不跟他說。是嘛!我們在處理很多問題的時候,我們的態度也是這樣。可是在這裡呢,我們必須要承認他在這裡為什麼有些翻譯說得罪了我,得罪了你。他要談的是這個人他的確做了一件錯誤的事情,不討上帝喜悅的事情。
874.65	898.465	可是祂要提醒我們,祂做的這件事情有可能影響到你。為什麼祂要這樣提?其實是有關係,你還記得在這一段經文的前面,祂提到,若有人叫這小子當中的一個跌倒,那個罪是何等的大?祂要談的其實就是這件事情。
899.241	923.949	可能有很多人做了一些不好的事情而使得別人怎麼樣?受到了傷害。他在這裡談的這個有的弟兄得罪我其實指的就是這件事情。不一定他是直接針對你的。可是因著他所做的那些錯誤的事情對你的生命、對你的屬靈、對你的實質、對你的財物、對你的身體都造成了什麼?影響。
925.503	942.817	但是不要忘記,重點不在對你,得罪你。重點在這段經文談論的是那件錯誤的事情。這是我第一個要跟各位談的。他在這裡談的是一個弟兄犯罪。
944.377	972.49	他不只是要強調犯罪導致你被傷害。他要強調的是,犯罪了,他傷害了他自己。他也傷害了你跟他之間的關係。他甚至傷害了整個教會。所以我們這一些稱為他弟兄的,他在這裡說,你的什麼?弟兄。我們有一個責任。這個責任是什麼呢?這段經文怎麼說?你救
974.138	1002.874	去,我們太喜歡這句話了,對不對?他做了錯的事,我們就去嘛。然後呢?後面這句話我們通常就會自動忽略,你知道嗎?很多時候我們去,可是後面這句話我們常常忘記,後面這句話是什麼?趁著只有他和你在一處的時候,指出他的什麼?錯。
1004.121	1032.984	很多時候我們常常忘記這一句話,忘記這件事情。我們對於他的錯,你會去,對不對?但是是去到他的面前只有你和他在一處的時候嗎?不會。你們同意這個話嗎?如果不同意我就不用再講下去了,這樣。同意嘛,對不對?我們一定會去,對不對?但是不見得喜歡直接到他的面前,甚至不會喜歡只有他跟你在一起的時候。
1034.104	1059.008	然後呢,指出祂的錯來。我們很多時候我們對於別人所犯的錯,或者別人得罪神的事情,我們很多時候我們必須要承認,我們不想直接處理這件事情,我們喜歡的是把它怎麼樣,張揚出來。其實我們都是善以心計的人,你懂我的意思嗎?
1060.009	1075.118	在報復這件事情上。在處理犯罪這件事情上。我們常常是這樣的。可是這一段聖經卻告訴我們一件很重要的事情。你必須要什麼?去。請記得這是命令。你必須要去。
1076.323	1104.078	然後呢,趁著,而且這個時間要特別找好,只有他跟你在一處的時候,告訴他,他做了什麼事情,傷害了他自己,傷害了你跟他的關係,甚至傷害了什麼?別人。目的是為了什麼?經文怎麼說?他若聽你,你就什麼?得了你的弟兄。可是很多時候,我們常常忘了這一點。下一張同學影片。
1105.708	1134.771	我們指出祂的錯來,最重要的目的,到底是為了什麼?我們去到祂的面前,趁著只有你跟祂在一處的時候,告訴祂,祂做了什麼事情?我們到底存著什麼樣子的目的?那個目的是什麼呢?再來,是這一段經文所說的最後,要把祂當作外邦人跟什麼?稅吏一樣嗎?
1135.759	1162.589	這是你的目的嗎?不是,我相信也不是這一段聖經的教導,可是我也必須要承認,很多時候我們讀這一段經文的時候,我們常常先陷入這件事情。我們去面對一個人,我們甚至去處理犯罪的問題的時候,我們很多時候,我們沒有想到的是,他是我的弟兄,我去到他的面前,重點是要得他,懂我的意思嗎?
1163.473	1190.774	我們很多時候我們去到祂的面前,沒錯,祂是軟弱的人,祂也犯了罪,祂傷害了自己,傷害了我們的關係,可是我們到了祂的面前,最重要的一個,我們卻不是這一段聖經所說的,要得著祂。我們的目的是為了什麼?告訴別人,因為這段聖經有講,對不對?祂再不聽,我再找兩三個人,對不對?祂再不聽,我就找教會,祂再不聽,我就開個長職會,祂再不聽,我就開個公聽會,祂再不聽,我就找一週刊,對不對?
1191.766	1209.128	我們可能有很多我們的方法,對不對?那請問你做這些的目的是為了要他聽你嗎?不是。你為了要把他當作外邦人跟稅吏一樣。這是我們必須要面對這一段聖經當中,我們常常有的。這是我們的心態,我們看下一個。
1210.23	1238.311	我們的目的只是為了要他聽見嗎?當然不是這樣,我們希望他真實的聽見,悔改,走到正路。得著他才是我們面對這個人最重要的一個目的。繼續。到底當有犯罪的弟兄,甚至得罪你的弟兄,甚至因著犯罪而傷害你們之間關係的弟兄,你去到他面前,你就去,
1239.258	1264.791	的目的是為了什麼?來,下面。我要提醒的是,你必須要承認這一段聖經當中,耶穌給我們一個很重要的教導。目的是什麼?得著。想一下,沉澱一下,這很重要的一件事情。然後我們再繼續講下去。我們來看得了,來,下一個。
1266.664	1293.503	得了你的弟兄這一句話,耶穌用得了的這個字非常有意思。我沒有去想,有時候讀這一段,我們自動會把那個得了,自動消掉,你知道嗎?就忘記了這件事情,我們想到的是找兩三個人去,我們想到的是告訴教會,我們想到的最後反正就是把他趕出教會,因為這個人不配跟我們在一起,看他跟外邦人跟稅吏一樣。
1294.701	1319.695	可是不,耶穌說若他聽了你,最重要的他擺在前面,你便得了你的弟兄。這是到他面前,趁著只有你和他的時候做的最重要的一個目的,是希望得找他。得了是一個什麼?商業用語。什麼叫做商業用語?我不是學商的,莊牧師才是,羅牧師也是比較在商業上。什麼是商業用語?
1321.169	1350.303	商業用語其實用一個比較簡單的方式理解,它得的這個字其實就是賺。它用一個商業的這個用語來提醒你,這是一個賺得。它透過這個商業的這個字眼來企圖喚醒你一點注意力。你便得到了,你知道嗎?在商業的用語,得到可能是一種敬利,你就賺到了。
1351.459	1367.789	我們有時候聽到這種感覺,可能你是跟我一樣臺語掛的,你就會覺得很有感覺。他在這裡得了你的弟兄,就是希望喚起你對於這件事情的重視。
1369.309	1398.204	我們的目的不是要讓這位弟兄離開我們,變成外邦人跟瑞麗一樣那樣子的鄙視他,離開這個團體。我們的目的是要得著我們的弟兄,得的是一個商業用語,是用在一種市場上的一種交易,代表的是一種什麼?一種利潤,代表的是一種恩惠,是一種對你是一種祝福。它是一種很正面的用語。第三個呢?得的是一個累積的一個過程。
1401.715	1431.438	我不曉得耶穌在這裡為什麼要用得了這個字可是我們要去體會耶穌用這個字的那個心意祂企圖讓我們理解很多時候當我們當中的一些人因著得罪神因著犯罪的緣故其實那對耶穌來講其實祂是一種虧損祂是一種失喪所以耶穌說人子來為了要拯救什麼失喪的人
1432.671	1459.902	什麼叫做思想?本來你的,本來是你的,後來怎麼樣?沒了,掉了。可是他在這裡要告訴你,這個弟兄,你把他得回來,其實就是把你當得的怎麼樣?賺回來。你懂我意思嗎?他企圖要告訴你這件事情。繼續。我們必須要問我們為什麼要得著我們的弟兄?來,加下來。
1461.817	1491.318	因為耶穌來的目的,正是要尋找拯救失常的人。在座的每一個,包含我都是,在沒有認識耶穌以前,我們都是什麼?失常的人。我們本來是祂的人,失常,不見了。我們必須要承認這件事情,耶穌希望祂的心我們可以理解,
1492.944	1516.932	耶穌希望我們可以完完全全得著這件事情。我們可以知道他到底心中在想什麼。你要記得得著弟兄的過程不只是為了他的益處而已。得著他也不單單只是為了你的益處而已。得著他更是為了整個教會、整個神國的益處。
1518.558	1543.403	這是很重要的事情。很多時候我們在做那個切的時候很容易,反正他這樣,那是他的事情。如果是這樣,你就很難夠理解耶穌的心。我自己是一個做父母親的,很多時候我們會有一種這種感覺,就我們在教導我們自己的孩子,
1544.411	1567.63	我的孩子我希望他有規矩,我希望他做一些事情有禮貌、負責任、誠實,對不對?他常常在這些地方碰見問題、犯錯的時候,我會怎麼樣?我會什麼?教育他,我會指正他,你懂我的意思嗎?OK,好,那是我的孩子。可是如果是其他人的孩子呢?
1573.183	1596.074	你想想看,如果你是做父母,是其他人的孩子。不單單只是那個全餅的問題,因為他不是我的孩子,所以我這樣講他不好意思。不單單只是那個。我們還有一種味道是,不關我的事。因為他,理由是什麼?我對他沒有責任。聽得懂我的意思嗎?
1597.841	1626.114	我對他沒有責任。他今天他要這樣,那是他的事啊。他惡有惡報,那是他應得的。可是問題是,當是我們的孩子的時候,我們會這樣覺得嗎?不會。當是我們孩子的時候,我們會想要去修正他,我們想要去指正他,甚至我們會想要跟他一起承擔他所犯的錯,而該負的責任。
1630.128	1655.909	可是很多時候,對於那些與你沒有關係的人,我們不會這樣做。可是耶穌在這裡說,你便得了你的什麼?弟兄。記得耶穌稱我們為弟兄也不以為恥。祂把我們的問題也當成了是祂的問題,以至於祂為我們的罪定在十字架上。
1657.671	1685.533	記得祂定在十字架上是為了我們,不是祂需要,懂我的意思嗎?不是祂需要我們的注釋,祂希望我們覺得祂很偉大,所以不跟我們商量自己去定十字架,要我們來,哇,你很厲害,不是這樣,耶穌為什麼要上十字架?為了我們,為什麼?因為我們失上了,因為我們失上了,各位弟兄姊妹,我們需要把這一些
1687.005	1709.501	陷入最終的弟兄或者是姊妹這一些人我們還是一開始那個心態你知道我今天要跟你們講的那個最重要的核心是他是我的什麼弟兄這個要先有你這個沒有先有你看這一段就是完完全全就是想辦法要把他當成外邦人跟水靈OK來繼續下面
1711.886	1739.76	當然我們必須要承認在這樣子的一個過程當中請問他有沒有不聽的可能?有。但是我還是要強調我們最希望的是他怎麼樣?聽嘛。最希望的是你得著你的弟兄。就好像我們教育我們的孩子是為了他可以怎麼樣?聽話嘛。因著聽我們的話他有好的品德有好的怎麼樣?有誠實的品德有愛心。我們希望得著他。
1740.589	1767.307	我們不是希望把它分別出去。他若不聽,我們在這一段聖經,怎麼說?第16節,對不對?你們看聖經,聖經說,他若不聽,你就另外帶一兩個人怎麼樣?同去,要憑什麼?兩三個人的口做見證,就是你,然後再加一兩個人,所以去了就變兩三個,數學還蠻好的。然後去了之後,憑這兩三個人口做見證,
1768.49	1794.533	然後呢,句句都可定準。什麼意思?就是希望透過他們這一些,透過跟他去,不是隻是要作為定罪他的證據。我們有時候讀這個定準,我們想到就是,他們就是見證人,就是你要繼續犯罪。我們心中還是帶著什麼?要把他們當成外邦人。可是你要想說,你帶這一兩個人去是為了怎麼樣?為了要得著他。
1795.35	1819.112	當然,如果他若不聽,據據作為一個定準之後,你還要再做一件事情。這段聖經怎麼說?第17節,若是不聽,就告訴教會。就告訴莊牧師,讓莊牧師去處理。是這樣的意思嗎?莊牧師比較有辦法。
1820.538	1837.492	不一定是這樣。他要談到的,我們有時候讀這一段,然後這個十七節的前半段,他若不聽就告訴教會,若是不聽教會。我們都知道都有這種可能性。可是你要知道在這個過程當中,這邊反覆幾次,他若不聽,他若不聽。
1838.507	1865.283	記得他若不聽,不是為了要把他當作外邦人的推理。他若不聽,是你永遠都抱著一絲的機會。他若聽了你,你就怎麼樣?得著你的弟兄。那是一種投資的感覺,懂我的意思嗎?我三番四次,七番八次,不管幾次,你去的目的是希望。要把他推回來,你懂我的意思嗎?
1866.988	1889.066	去的目的不是為了要切得更清楚,去的目的是希望把它轉回來到上帝的家中。這是這一段經文當中最重要的一個目的。我們繼續看。在這個過程當中,祂要提醒我們一件很重要的事情。因為如果祂繼續犯罪,我們這個群體就會失去祂。
1890.213	1899.882	找去的這一兩個人其實是跟他很要好的人,也是他的弟兄。目的是為了要把他怎麼樣往回來。所以不要找打手去,你知道嗎?
1901.169	1923.556	他不聽,然後去得刺龍刺鳳,就是去要打架的。從你找去的人,我就可以知道你的目的是為了要把他當成外邦人,還是目的要挽回他,你知道嗎?所以你找這幾個人也是蠻重要的,聽得懂嗎?所以如果他不聽,再給他一次機會,就當告訴教會,因為如果他還是不聽,這對教會是有影響的。
1925.572	1950.624	重點,你知道雖然在這一段話我寫的跟聖經好像有一點差,但是我是希望讓你們理解這一段聖經當中耶穌所要表達的那種想要把他挽回的那種信。繼續。如果最後他不聽教會呢?我們有時候覺得很抱歉,對不對?經文說什麼呀?
1952.619	1979.914	把祂當作外邦人跟稅吏一樣。你知道嗎?在這一段聖經當中,雖然把祂當作外邦人跟稅吏一樣,可是耶穌其實也是要讓祂這個人理解祂離開了教會,祂的生活有比較好嗎?犯罪的生活有比較好嗎?沒有。祂還是希望這個人可以回到天父的家中。
1981.408	2008.342	記得在浪子的比喻,那個小兒子跟父親說,把我應得的家業分給我的時候,那個父親有說,你出去,一定會把家業敗光,說我因為愛你的緣故,然後呢,就不分給你。他有這樣說嗎?沒有。他為了愛的緣故,然後呢,就給了。很多時候,我覺得教會在處理教會紀律,教會這些,
2009.735	2031.643	好像一些的傳統的時候,你一定要記得,教會的紀律的彰顯不是要把這個人隔絕,而是透過把這個人隔絕,他一種體會、一種理解,他突然發現其實沒有比較好,而最後目的要怎麼樣?把他挽回過來。這是當前教會的問題。
2034.241	2056.378	我們很多的時候,我們面對這些問題,我們就是恨不得趕快把它怎麼樣,切出去。然後呢,切出去之後,這個人犯了罪呢,又不要他進來。犯了罪之後,他悔改,你要他進來,又不接納他。我們常常是這樣。那不然就是,他有一些問題,犯了罪,你也不想處理。
2057.654	2077.295	我要告訴各位弟兄姊妹當教會有紀律當教會有這樣子的一個權柄處理問題的時候那兩年兩年之後呢他就繼續回到我們當中他仍然是我們的什麼弟兄可是很多時候我們也不處理但是心裡面把他當成外邦人跟稅吏一樣我覺得這是最
2078.797	2102.03	下下策,可是我必須要說我們教會常常會是這樣,我指的不是淡江教會,我指的是所有的這些教會,包含基督徒們,我們常常是會這樣子想。我們繼續下來,祂若是不清教會,我們就當把這件事情帶到哪裡?如果耶穌講說把祂當作外邦人跟稅吏一樣的時候呢?
2102.91	2108.949	在這一段聖經當中,這樣就可以解釋了第18節到第20節。我們來念18到20節。
