start	end	text
0.009	18.701	保羅跟我們分享他的心理路程,怎麼樣他竭力地要來追求基督。下禮拜,應該是菲律賓士第四章,我們再來談怎麼樣我們看到保羅要勉勵我們靠著主,站得穩,能夠洗腦。我們一起來做個禱告。
19.121	33.546	主耶穌,我們恭敬來到禰的面前。在淡江教會,我們真的是看到禰榮耀的彰顯。主,我們來到禰的殿堂,與弟兄姊妹一起在這裡敬拜的時候,主,我們再一次被提醒,十字架,十字架,
34.906	50.764	絕大的榮耀,祝我們今天要用菲律賓書第三章,來跟弟兄姊妹一起來分享,我們來研讀的時候,願祈示的靈在我們當中,真的是讓我們看到,讓我們看到,主禰何等愛我們。
51.084	76.256	讓我們也來經歷主禰自己的榮耀,讓我們每一位來到這裡的,我們一個都不落空,我們能夠完完全全能得到基督。讓我們在這段時間裡頭,我們來默想禰的話語,我們來分享禰話語的時候,主禰自己親自跟我們說話。謝謝主,讓禰的使徒保羅,把這麼寶貴的經文留下來給我們,兩千年以後,
76.596	98.96	我們仍然可以用主你自己的話,成為我們每一天,我們日常生活的腳前的燈,路上的光。今天再一次的,我們要用菲律賓書第三章,來彼此共勉的時候,願祈示靈在我們當中,彰顯主你自己的榮耀,讓我們每一天活在你的裡面。謝謝主,禱告奉耶穌基督的名。
100.52	126.298	好,我們今天的這一章,菲律賓第三章,我定的題目就是《竭力追求得基督》。這是菲律賓第三章,我基本上會照著這個次序來跟弟兄姊妹分享,但是我想我們先選一下菲律賓第三章,第八節到第十六節。我這幾天想來想去,沒有一節我捨得
127.568	156.048	不大家一起念,所以你們大家就陪我一下。菲律賓書第三章,我們從第八節一直唸到第十六節。我們等一下是分享從第一節一直分享到最後。但是這幾節經文我覺得特別寶貴,我們就一起來讀,好嗎?菲律賓書三章第八節,來。不但如此,我也將萬事當作有損的。因我已認識我主基督耶穌為至寶,我為祂已經丟棄萬事,看作糞土。
156.408	185.948	為要得著基督,並且得以在祂裡面,不是有自己因律法而得的義,乃是有信基督的義,就是因信神而來的義,使我認識基督,曉得祂復活的大能,並且曉得和祂一同受苦,效法祂的使。第十一節,或者我也得以從死裡復活,這不是說我已經得著了,已經完全了,
186.408	195.347	我乃是竭力追求,或者可以得著基督耶穌所以得著我的,或做所要我得的。
196.34	218.104	弟兄們,我不是以為自己已經得著了。我只有一件事,就是忘記背後努力面前的,向著標竿直跑,要得神在基督耶穌裡從上面召我來得的獎賞十五節。所以,我們中間,凡是完全人,總要存這樣的心。
218.524	241.748	若在什麼事上存別樣的心﹐神也必以此指示你們。然而,我們到了什麼地步﹐就當照著什麼地步行。所以我剛講到我今天的話,因為我們今天的經文不長了,你看,菲利普書第三章一共只有21節,但是實在太豐富了。
241.988	268.685	我曾經考慮過把它分成兩次來講,但是我想我們就還是按照原來計劃。我們今天從第一節一直,我們一直講到最後一節。我把它分成按照這樣子一個字,我順便提一下,就是在跟大家講過很多次了,聖經上的章節的分的話是在很後面的事情。你原來寫信的話,這封信大家想著菲律賓書可以當作是
269.206	293.997	保羅當時的宣教報告,出去宣教,然後寫給菲律賓教會的宣教報告,當然也是他跟他們特別關係,中間就有很多的教導。很多章節的分都是後來分的,每個人可以分法不一樣。我覺得第三章這邊的話,我這樣分,從我的角度看還蠻合宜的,大家就跟著我一起跑好了。所以前面六節的話,
294.94	320.038	彼得是很清楚很清楚很清楚的。他就是要強調一下,沒什麼好說的。我們就是在基督裡,只靠基督來誇口。在這樣的一個背景下的時候,他提到一些他自己的一些生命中的一些過程。在七節到十一節的時候,他最高興的一件事情是他居然找到基督了。所以他說,我認識耶穌基督的話叫成至寶。
320.879	345.913	當他認識基督以後,或者繼續認識基督的過程當中,他就做了很多的選擇。等一下我們就來看在這段裡頭,他認識主基督為至寶的時候,他做了什麼樣的選擇。12節到16節也是他的心理路程,他就教導我們要按部就班的。他自己不是以為他自己得著了,但是你可以看得到他按部就班不斷地越來越多,
346.613	365.285	越得著基督,越來越像基督。最後的話,因為菲律賓教會當時的一些特殊狀況的時候,他就也不客氣的就跟大家講說,我這樣子來追求基督,你們要效法我。而且有很多外面的一些不對的東西,我們不要效法他們,我們來做一下。
365.845	388.935	天上的國民。所以這個四段還蠻清楚的,我們就試著用這樣子一段一段的方式,我們來學習。第一大段是指在基督耶穌裡誇口,這是第一節到第六節。其實第一節,保羅只說弟兄們,我還有話說,你們要靠主喜樂。
390.111	407.305	有人這樣講,我蠻能同意的。《講菲律賓書》是講喜樂的一本書。有些地方用不同的詞,但是它代表喜樂這個意思的字,有人去數過,有16個字。
408.046	432.674	十一個地方都講到要喜樂,而且是要靠足喜樂。我們下下禮拜第四章的時候,我們特別就從喜樂的角度我們來切入。那這邊的話呢,在第二章最後這邊,他提到同工們之間的一些彼此的配搭。然後他要來講第三章這邊,可以算是蠻重的一些經文,或者是對於
433.114	457.85	我們的真理的認識的時候,一方面他也擔心菲律賓教會當時所碰到的一些內憂有外患。在這樣的過程當中的時候,他不斷地繼續在這裡說,要勉勵到你們要靠主喜樂,然後他開始再往下走。往下走的時候,第一個地方在菲律賓書三章第二節那邊,
458.831	484.55	他用了蠻強烈的字眼。他這邊講到說你們要防備犬類,要防那些狗,然後要防備作惡的,要防備那些妄自行割離的。那這個的話呢,我自己就最近花了蠻多時間去思考。你如果去看菲律賓書前面第一章的時候,他曾經提到過就是說是,他在那邊作奸的時候,
487.244	516.317	很多人因此得到的激勵,就傳福音。但是也有一部分人他傳福音的話,是為了他自己。這種傳福音的一個情形,或者是假意,或者是真心,無論怎樣,基督究竟被傳開了。我就發現使徒保羅其實他心胸蠻寬的。他在一般的狀況下,他能夠的時候,以福音為準的時候,他可以給弟兄姊妹們蠻寬的一些
517.756	545.498	我行事為人的空間,但是一旦碰到真理的時候,一旦碰到真理的時候,保羅是非常不假以辭色的。你看這邊講的是你要那些狗啊,作惡的。然後,那我就在想,其實這個不光只是保羅這樣子。你看福音書裡頭,耶穌要責備起法利賽人的時候也是蠻重的字,對不對?你看,
547.227	567.54	施洗約翰,當他講到法利塞人,施洗約翰講到他們的時候,他說法利塞人跟撒都該人,他們是毒蛇的種類,所以用的字都很重的。對於我來講是一個蠻大的提醒,因為我們每個人個性都不太一樣,我們有些人個性比較溫和的,
568.336	594.867	有些人個性比較強烈的。所以我們的為人處世上﹐可能我們人際關係上﹐會有不一樣的地方。但是這裡給我的教導﹐給我的提醒就是說﹐如果我們碰到了一些狀況﹐就是碰到的是對於福音有攬阻的事情﹐對福音有不正確的地方的時候﹐我們可能很重要的是﹐我們知道要有一個責任﹐我們要來捍衛真理了。
595.759	612.721	今天禮拜天,前天我大學的一位教授,我們都很敬重的,92歲過世,在第二殯儀館葬禮的時候,我們有好些同學去。結果一去以後,平常大家
613.422	633.213	見面的機會不太多,所以難得大家有機會可以見面,因為是幾十年前我們一起進大學的,我們進大學那年到現在已經是51年前的事情了。所以大家很高興,當然不能太高興,因為是老師葬禮,但是因為葬禮的過程,
634.974	659.92	很多人去輪流排隊,排隊的時候有蠻多時間。結果很好玩,我就發現,原來我在我的同學裡頭,現在被封了一個號,我還都不知道,這次我才知道,他們把我叫做傳教的。原來我叫做傳教的,我都不曉得。我們班上有一些基督徒,有一些基督徒是我在唸大學的基督徒,
661.357	684.936	同寢室的一位弟兄的話,他就想盡辦法跟我傳福音,但大學我就沒信。我是念研究所的時候,跟師母我們兩個才信主的。結果在談的過程當中,因為我在準備今天的信息,我就發現有一件事情是蠻特別的,因為有一位同學的話,他是非常優秀的,然後他就跟我講,
686.237	714.457	你們基督教怎麼回事?我就想,我就要很認真地來聽了。結果他提出來的一些東西,其實蠻重要的。他說,你有沒有看到前陣子英國的物理學家證明沒有神的報導?我是有看到這個報導的。然後他就覺得說,因為他是學科學的,他說我覺得他講得很有道理,你們基督教怎麼這麼個樣子?然後就講到說,整個
714.957	743.171	人文的發展應該都往多元化發展。你們基督教為什麼就只有一個神,其他宗教都沒有像你們這樣子的。我剛好因為在準備今天的訊息,所以我跟他,我不是用辯的方式,我就把我的立場來跟他講以後,他說你這樣講倒也有道理,我希望下了一點種在這邊。我要勉勵大家,剛才講到的昨天我們三壘班,
744.241	764.651	真的是很棒,神很恩高,講原本,也很恩待來參加了一百多位弟兄姊妹。那我要來勉勵的就是,你是福音使者的話,好好去思考一下,外面的人怎麼看我們。因為很多不好的東西不用講,不好的東西的話,很容易擋,對不對?你什麼姦殺,
767.312	789.017	犯罪、貪汙這些事情,這個都不用講了。我們最難的部分是什麼?我們最難的部分碰到的是還蠻好的東西。這裡的話,講到割禮派的時候,保羅為什麼這麼嚴厲?因為割禮本身是好事啊。請問是不是上帝要亞伯拉罕做割禮的?請割禮的,是不是?
790.299	817.574	這是上帝要求他做的。割禮派的問題不是出在行割禮,而是認為你非行割禮不可。這個就變成一個很大的問題。保羅講到的真正的割禮,當耶穌基督來的時候,我們剛才唱的詩歌,十字架,十字架,
818.695	847.874	十字架的恩典是真正讓我們進到神的國度裡頭的。所以,我們如果要誇口的話,只能指著耶穌基督誇口。保羅這邊講說是,我們是以神的靈敬拜在基督耶穌裡誇口,不靠著肉體的。所以,如果我們知道這樣子一點的話,我們知道唯一能夠讓我們進到神的國度裡頭的,乃是主耶穌基督在十字架上,
849.189	871.596	他的保血洗盡了我們的罪,讓我們得以進入神的國度。當我們從這樣的角度來看的時候,至少我多少可以體會一點,為什麼保羅要用這麼強的話,因為割禮派的話就說是,你外邦人你信主很好啊,但是你跟我一樣一定要割禮你才能夠算。
872.705	894.612	福音如果能夠有加有減,能夠有增有少的話,那那個就不是真的福音了。就像保羅寫信給哥林多教會的時候特別提出來,你不要是另外一種福音,這個是最危險的,很像真的那種假的,是最危險的,那個叫做異端,異端我們不能讓步的。
895.452	924.967	弟兄姊妹,特別福音使者們,我勉勵你們,真的是這次好好,馬上要開始上課了,你們把課好好上好,下一次我碰到你們的時候,我可能就把人家問我的問題,我來丟給你看,你怎麼回答,好不好?讓我們能夠在真道上,我們能夠學習,讓主耶穌基督的真理,讓我們能夠學會,因為我們目的是要讓人進入神的國度裡頭,
926.22	934.045	我們怎麼樣能夠對真理有更深的認識?保羅這裡給我們教導是,如果我們
935.333	958.823	信主一定要割離的話,這不是真的割離。真正的割離乃是我們進到神的國度以後,耶穌基督自己,自己就像哥羅西書,你們回去以後可以查了,哥羅西書講到的是乃是基督祂自己讓我們能夠脫去我們肉體的情慾,讓我們能夠變成一個新的人。
959.343	966.989	這個是保羅想要跟我們講的。因此在這樣的基礎上的時候,保羅就特別強調了我們靠肉體是沒有用的。
967.705	989.367	我們如果信靠肉體的話,全部是枉然的。如果我們靠肉體的話,保羅把他自己的生命就攤開來給大家看了。如果要靠肉體的話,我保羅是最純種的以色列人,他是很純種的汴陽民人,他是純種的希伯來人,
991.903	1020.252	他對於舊約是非常懂的,而且不跟你懂,是最棒的神學院裡頭的高材生,跟我們莊牧師一樣的,很厲害的。然後律法他都守了,所以他這邊講說是,就熱心說,我是逼迫教會的。他為了上帝的緣故,甚至於願意拿著刀來追殺基督徒的,因為他當時認為,基督教你們亂搞嘛。
1021.391	1039.857	所以如果從這樣來講的話,從律法上的意義來講,如果可以誇口的話,我是沒有什麼可以指責的,我可以誇口。但是,但是,保羅很清楚地告訴我們,就是沒得誇的。因為在往大馬色的路上的時候,
1041.391	1058.213	他遇見了主。所以我們第二段要來看的話,就是保羅來提到說,他怎麼樣子認識我主基督為至寶的時候,他做的一些選擇。我們第二段這邊講到,認識我主基督為至寶。這裡是我們看到的是,
1058.814	1088.413	菲律賓書三章第七節到第十一節這邊,我也是分幾小段來看一下。剛才我們讀的經文,從第八節到第十六節的話,我要花比較更多的時間,就是今天的第二大段,第三大段。第二大段,認識我主基督為至寶裡頭。第七節,第八節,第七節,保羅說,只是先前與我有異的,我現在因基督都張作有損的了。
1089.701	1116.657	我把《使徒行傳》第九章放在這邊是想要勉勵大家如果你經文不很熟的人我真的鼓勵你今天打鐵趁熱吧今天等一下回去你就把《使徒行傳》第九章打開來那個是故事書很好看的故事書那麼就講到保羅拿了個令劍然後就要去追殺基督徒的過程當中碰到了主耶穌基督他這一生就改變了
1116.988	1134.753	一切都改變了。因為他的生命損跟異完全不一樣。他以前他以他自己做希伯來人做以色列人為榮啊。他以他自己有這麼好的聖經知識
1136.135	1141.24	繁體中文，臺灣國語。繁體中文，臺灣國語。
1150.145	1170.662	信靠肉體是枉然的。信靠肉體是枉然的。信靠肉體是枉然的。信靠肉體是枉然的。信靠肉體是枉然的。信靠肉體是枉然的。信靠肉體是枉然的。信靠肉體是枉然的。
1179.053	1191.343	每一季每一年都要有損益表就是賺多少錢收入多少出去多少然後這兩個差別如果是
1192.551	1212.667	多收少用,那你就是賺錢,那個億是多少。如果是少收,多花錢,就損,今年虧掉多少錢。我會勉勵大家的是,因為保羅這邊他講到損益的時候,我就覺得其實我們每個人生命可以有一個我們生命中的損益表的。
1214.667	1233.179	對於保羅要講,在大瑪色之前,在十字架光照他之前,他在大瑪色之前的這段日子,他的損跟他的義,跟他被主耶穌基督摸著了以後,他的損跟義就全部改變了。
1234.309	1255.747	先前以為有益的,我現在呢,都是變成有損的了。換句話說,在他生命當中,他的生命的損益的選擇已經不一樣了。我不曉得有沒有人問過你這樣一個問題,我可能在這邊都分享過都不一定,就是差不多15年前的時候,
1256.408	1281.668	我的一個客戶的太太是美國人,她是紐約的很大教會的一位執事。太太跟她一起到上海來,看我們師母跟我一起吃飯。我在第一次跟她見面,她第一句話,我印象很深,我們在旅館裡頭,一碰到,她馬上問的問題是,Was there a defining moment?我就愣住了。
1282.551	1310.648	你生命中是不是有一個關鍵時刻。那我就覺得很有意思,因為根據那個後來我講了一篇道叫做生命中的關鍵時刻。保羅生命中的關鍵時刻是在大瑪色上遇見了主,這很明顯的。各位弟兄姊妹,我不曉得你在你生命中是不是有一個關鍵時刻。很多人我們當中,我相信我們生命中的關鍵時刻是我們信主的那一剎那。
1311.903	1335.036	但是也有很多人,因為我認為那個defining moment,關鍵時刻,是要加est,moment,其實不止一個。對於我來講,師母跟我們信主當然,我們尤其是在聖誕夜一起受洗的,這個當然是關鍵時刻。但是後面的一些發展的話,當我到西安,
1336.101	1355.347	去出差所帶出來的事情,我把它叫做我生命中的西安事變的時候。That was the defining moment,是我們生命中的關鍵時刻,因為那件事情影響後面到目前為止,我們二十幾年所走的路。我們2009年發生的事情,
1356.971	1385.693	說著說著就跑到淡江教會來。這個事情也不是我們規劃的,也是生命中的關鍵時刻。我們每個人生命中都有關鍵時刻。保羅抓得很緊。保羅在大瑪色,你看,追殺基督徒的這樣子的一個人,但是他就是一個非常熱心的,願意為上帝來服侍的人,只是他方向走錯了。但是當他認識以後,他馬上改過來,他就變成被追殺的對象了。
1386.988	1398.804	這個是生命中的取跟捨,很不容易的一件事情。所以他後面他說,我棄萬事,丟棄萬事,看作糞土。
1401.118	1427.118	這是很不容易去處理的事情,因為你一生中,我們每個人都是為了某些東西,我們為某些目標而活。那保羅,他在加馬列神學院的大牌教授底下,做最好的學生,然後畢業以後,這樣子來服事的話,這樣子一個改變,是完全把他以前所有的各樣的資源,基本上是丟開來的。
1428.387	1455.844	或者原來的正面資源全部變成負面資源了。所以他形容他是丟棄萬事看作奮鬥。我想到的是在《馬太福音》裡頭主耶穌基督講到了天國的時候的比喻的話,我覺得這可以參考的地方,因為耶穌說有一個人,天國的比喻好像有一個人,他看到了一個很珍貴的珠寶,我知道這個就是最棒的,所以他就變賣所有的要來買這個珠寶。
1456.681	1480.118	或者在那一塊地上的發現,所羅門的寶藏在這裡,在這塊地上頭,原來福音就是最棒的,因此變賣所有,把這塊地買下來。我們生命當中的話,求神真是幫助我們,我們信主,每個人原則沒變的,就是十字架的恩典,信而受洗。
1481.834	1509.006	心裡相信,口裡承認,我們就必得救。這是沒有差別的。但是我們一生要怎麼來走法?這是我希望今天的第三章,保羅跟我們的分享的話,是成為弟兄姊妹的一些幫助的。昨天,我們的這麼棒的一個三壘迎會,如果昨天沒有來的弟兄姊妹的話,我不曉得我們昨天有沒有錄像,有沒有?昨天有錄像嗎?
1510.299	1521.076	沒有啊?好。那你們只好找昨天來參加的一百多位弟兄姊妹來問了。那昨天因為講五重執事嘛,所以我想到比方說福音使者盧弟兄,
1523.114	1545.956	大衛音響的這位弟兄,他的分享我就很感動,因為他做了選擇,這裡保羅說,為了得著基督的時候,我把事情通通丟開來了,丟棄萬事,看作糞土,為要得著基督,因為他找到最棒的,他已經找到耶穌基督是最棒的,所以當他
1546.937	1574	做生命中他的一些工作上的選擇,做他的一些事業上的選擇的時候,很不容易啊,很不容易。他這種一個大起大落,他的選擇是,我順便講一下,是我做不到的,因為我不是盧建洲。保羅的很多選擇是我肯定做不到的,
1574.923	1604.279	他是大使徒保羅啊。但更重要的是,我就是不是保羅嘛。我大概三、四十年前聽到一句話,這句話我很平常的一句話,但對我影響其實蠻大的。不曉得你們聽過沒有。有沒有聽過說經驗如牙籤這句話?沒有,有沒有誰聽過?經驗如牙籤,只有幾個人。經驗如牙籤是不能分享的。請問你的牙籤給我,
1605.418	1633.684	經驗如牙籤是不能分享的,因為你的經驗沒辦法套到我的生命當中來,但是你的經驗對我的生命有沒有幫助?肯定是有幫助的,是可以參考的。保羅這邊把他的生命攤開來給我們看,
1634.855	1663.226	像書這樣子攤開來給我們看的話,他的經歷就有很多我們可以學習的地方。奴隸兄,比方說他講的一個故事是他有一段時間,他把家裡打開來做教會,然後週末他是做那個禮車的生意,那很長很長的禮車,只有他一個人能開的,週末的生意他要做選擇了。那時候對他來講那個生意是很重要很重要的,但是他的做的選擇就是,
1664.36	1684.558	聚會比生意重要,因此祂就做了選擇了。上帝怎麼來回答他呢?上帝回答,剛好我們禮拜五晚上小組在查《馬太福音》16章,我就想到了,那邊講到主耶穌說,如果為他丟棄生命的,就得到生命。
1685.179	1707.572	我再強調一次,我們每一個人讀聖經的時候,這些原則都不變的,但是實際上發生的狀況、應用的時候都會不太一樣的。因為有一些人,當他為了主耶穌的緣故放棄很重要的工作的時候,主耶穌基督給他另外一個更好的工作。
1708.831	1729.751	但是這個不能當作套用說是下一次我碰到我認為主耶穌基督要我放棄這個工作為了福音的緣故的話上帝就一定給我一個更好的工作我這樣講大家可不可以理解我想講的但是上帝如果沒有給我一個更好的工作的話祂會給我一個更好的生命
1731.527	1760.381	劉弟兄我們看到真是蹦蹦跳跳。我在想,見到他的人想不信耶穌恐怕都很難。我們很多人,他就是福音使者。昨天來的一位劉弟兄,是我們在上海的很重要的同工。昨天他講的課是職場使者了。你們知道,對羅牧師來講職場使者這個是我生命當中最重要的一塊。所以他昨天有提到他
1762.21	1785.745	到上海去接工作的時候,碰到一個難題。全公司上上下下,包括中方的合資對象都說,這個事情我們非這樣做不可。怎麼做?就是要把一個錢給那個可以決定很重要事情的一個,講得穿一點就是要毀路了。他連錢都帶到了,可是怎麼講就是過不了關呢?
1786.476	1813.147	那所以呢,跟那個人談完以後,再回來以後,錢交還給會計說,這個錢我們不交出去,這種事情是不對的,這樣的事情我是不能做的。他後來沒事,但是他有沒有可能被他老闆革職啊?是有這個風險的。所以,前幾天我們跟我們弟兄姊妹談的時候,我說是,當《馬太福音十六章》這邊講到的就是,
1816.169	1845.494	為了主丟棄生命的,必得著生命的時候,不是很多的人我們真的是可以為主捨命的。兩千年來為主捨命、殉道的人不少,但是如果以兩千年來的基督徒比例來講的話,那其實很小很小的一個比例的。我想,我們在座,包括我在內,沒有一個人是為主殉道的。
1847.995	1866.474	如果你真的是為主信道的,那你就跟保羅一樣嘛,那是好的無比的,你就比我們都還早一點叫到天上去了。但是我們都不一定有這份的,但是那個捨命是我們在生命當中我們做的很多選擇的時候,
1867.722	1881.953	要娶呢?還是要捨呢?這當中做的要想選擇我們的價值觀的話,劉弟兄因為他要在他生命當中見證神的榮耀的時候,他不做的工作上,一般人會做的事情。
1884.121	1907.363	神就祝福他,結果他生意做得很好。他昨天沒講的故事,我希望我現在講的,他今天下午是我們的講員,如果今天下午他講到我現在講的這段,你們下午來的人還是要拍手,不要給他感覺你們已經聽過了。他幾年以後,
1910.401	1938.239	我們從上海出來,他們夫婦毅然決然站起來要來負責我們那一區的弟兄姊妹牧養的時候,他覺得他工作上,如果他原來的工作繼續下去,他沒有辦法讓他的工作,跟他的服事,跟他家庭能夠取得平衡。大家記得我講過一篇道叫做有刃有餘,對不對?我們生命當中的抉擇,取捨他做了什麼選擇?他做了一個選擇就是有機會,
1939.241	1945.928	他還是在行業裡頭,但是他就從公司,已經工作了很長一段時間的公司,退出來,然後就
1946.92	1972.212	投資進到一家本地公司,變成一個合資,他跳進去,這個是風險很大的。再到大陸去跟那個很做物流的一些人,跟他們來做一個合資企業,風險是很大很大的。但他的原因很簡單,他需要那個時間,所以他的第一個要求是什麼呢?跟對方講,你們聽了你們都覺得不可能,他們要他做總經理了,因為他才最懂。
1972.892	2001.135	結果總經理他要求一年要有60天的假。各位,60天除以5就是有12個禮拜的假,因為他需要那個假期。我這一輩子做了這麼長的工作,從來沒有一年有12個禮拜的假。這個不可能的事情。但他要求以後聖地是成全,而且他的生意越做越好。莊牧師請他到我們這邊來,他跟他的妻子,
