start	end	text
0.009	26.798	有很多的恩典,你覺得都好像是很自然,都好像覺得說我今天就這樣子了,也許你也努力過,但是我要告訴你這一切都是出於神的恩典,都不是因為你,若沒有上帝,都不會臨到你的身上,若不是上帝的賞賜,這一切都不會發生,
28.916	41.237	我自己以前我自己覺得我自己在工作的時候看到神很多的祝福我也看到神很多的恩典
42.995	58.39	我們之前為募款,我原來在北商當校友組組長的時候,我從來沒有想過我的人生當中要去募款。我當學校不會鼓勵我去募款,不是一定會要求我去募款。
58.951	81.496	我那時候人生上,上帝很大的祝福,給我一千七百萬,第一次收到的穆德的捐款。這是一個很大的神蹟。也許待會我可以再做,跟大家再分享。還有,我辦過很多很多的活動,我發現都不是因為我,
82.551	108.043	我辦過什麼校友登山活動,校友的聚餐。第一次101桌,已經覺得很不可思議。最後只有三個課,就辦了八十幾桌。我覺得說,哎呀,上帝怎麼可能。不是怎麼可能,我覺得,哎呀,好多好多上帝的恩典。這一切都是出於神。
109.718	126.939	今天我要說我們當中有一些弟兄姊妹受洗也是出於神的恩典。我要帶大家來看這一段聖經是記載在哥林多前書我們要打開聖經哥林多前書第三章
133.643	139.642	我要帶大家來看第五節到第七節。我們就看這三節的聖經。
147.671	159.419	是不是投影片都有,我們可以看,假如有聖經的看聖經,或是看前面的投影幕。我們一起來念第五節到第七節,預備,來。
177.671	203.612	可見栽種的算不得什麼,澆灌的算不得什麼,只在那叫祂生長的神。那個只在祂叫祂生長的神,原文有一個現在式,就是說只在乎那叫祂不斷生長的神。神好像不只是叫祂生長,而是不斷的生長。
205.452	221.482	我們當中一切都是看到神的恩典。我自己覺得自己真的不是出於我們做什麼。我記得我禮拜二帶一個大陸嫁過來姊妹的小組。
222.142	228.867	繁體中文，臺灣國語。繁體中文，臺灣國語。繁體中文，臺灣國語。
239.104	252.328	我自己一直在想,不知道他們的反應是怎麼樣,但好像都看不到什麼結果。我覺得怎麼辦,把這些人帶到上帝的面前。
254.206	283.178	我一直在想,有時候有沮喪,我在那邊禱告,說主啊,主啊,我這邊做了半天,究竟有沒有用啊?是不是都落空啊,空空的。但是真的,真的不是我做。我們當中有一位姊妹,蘭蘭姊妹受洗。她受洗的原因是什麼呢?我發現她們受洗都跟我完全沒有關係。
284.189	295.582	之前有位叫夢夢姊妹受洗。夢夢姊妹為什麼受洗呢?夢夢姊妹是有一年她去了澳洲,從澳洲要回臺灣的時候,
297.534	322.678	他突然搭飛機,他突然非常的緊張。他以前搭過無數的飛機,但那一次他突然變得很緊張。那一次他在上飛機之前跟上帝禱告,說上帝啊,假如你平安的保守我回到臺灣,我就要受洗歸入你的名下。天啊,有這種禱告。現在弟兄姊妹,第一個我的受洗是這樣受洗。
325.981	354.957	我說,主啊,怎麼會是這樣子?但是我們知道神已經在他們身上預備,但是就是好像我完全沒有辦法讓他們能夠真正的感受到主,然後願意接受主,進入主的門內。但是感謝神,神已經預備他,就在那個時刻裡面,他做了這個禱告,上帝用了這個環境。我們這位籃籃姊妹是怎麼受洗?我也覺得說,主啊,
355.998	385.238	他好像也是預備好的一塊土地了。媽媽也是基督徒了,在大陸。我說他也感受到主的恩典,但是他就好像還有一點難處要踏出來。那一天,突然有一天我接到一通電話,他打電話過來,什麼樣呢?他說傳道請你為我禱告。我說什麼事?他說我的哥哥做身體檢查,發現肝有一個
386.732	408.13	他很擔心,醫生說也許可能是腫瘤,但是可能還要到大醫院再去做檢查。他請我為他這事情禱告,他說,假如神把我哥哥醫治好,沒有事情,
409.343	425.944	我就要受洗了,我就決定受洗。主啊,都要發生這種事情才要受洗。我心裡想說,我也不是上帝。我們也期待我們為祂禱告,上帝能醫治。但是,
427.466	449.978	我們知道上帝有祂自己的帶領安排。那我也真的說,主啊,我也不知道會是怎麼樣。所以呢,那我只好為祂禱告。我也不知道結果會是如何。但是,感謝主。我禱告神啊,求禰有恩典在祂的身上。讓祂若是可以,就讓祂化險為夷。
450.538	466.358	結果,過了一段時間,他打電話給我,他說他哥哥在去大的醫院檢查,醫生說沒事。那不是什麼惡性的腫瘤,就是沒有什麼問題。
467.039	496.659	天啊,松子他就說他要受洗。其實不只是這個樣子,你知道嗎?上帝他特別的帶領,十月份,其實他心裡好像覺得應該這樣的,但是我記得十月份的時候,我們有一個外勤講員,就是紅蓉紅的陳詩語,對不對?那天,藍藍姊妹也來參加聚會,
497.039	525.836	先把他的女兒﹐帶到三樓參加兒童主日學。然後就下來﹐我就看到我在復堂那地方﹐服侍。我就看到籃籃姊妹走進來﹐走進復堂。大家知道那時候陳詩語姊妹﹐就聽到她正在分享﹐什麼呢﹐她曾經跟神許一個願﹐結果神的許了願以後她就忘了。結果後來呢﹐上帝就讓她怎麼樣﹐
527.5	538.731	我不知道,我已經忘了是發生什麼。讓他有一些事情。他就讓他想起他曾經跟神許過的願。哎呀,我說他進來正是時候啊。
540.111	569.791	因為萊萊也就是說,若是神讓他的哥哥能夠得到醫治,他就願享受歸入主的名下。我覺得神多年都預備好了。在生命的過程當中,我深深的覺得,我們都是隻是上帝的一個器皿。所有的主權,所有的一切,所有的賞賜,都是出於神。
571.357	595.405	大家你相信嗎?這是關於我們人生的一件很重要的事。我們人生當中必須瞭解兩件事。第一件事情,這是我今天要講的。所有的一切都是神的賞賜。你若是看見這件事情的時候,你的人生會豁達一半。
597.381	621.421	你不會再斤斤計較,你不會再急急盈盈,並非說你不努力。但是你會看清楚,這一切的主權,都是來自那位萬有掌管一切的上帝。若不是祂工作,若不是祂在你的生命裡面行這些的事情,我告訴你,不會發生。
623.968	652.451	我們當時在做的,也許有些人是在企業界裡面做事的。你會覺得,哎呀,我們看到,今天我要歡迎蘭蘭的老公也在這裡。那天看到她,她是經營賣紅酒的,賣酒,不是,賣威士忌的,我們這邊有紅酒,就得到一個很大的獎。覺得很感恩,為她先生在事業上,神這樣的恩待祂,祝福祂,感謝主。
655.23	681.982	可是大家都知道我覺得我們當中有一些人神很恩待他在這樣一個經濟很不景氣的時候我們今天有一位弟兄你知道他正在牽場正在擴場今天主日可能沒來到我們當中大家知道是誰嗎世雄建華他們夫妻很奇妙他說
683.319	712.675	他的同業一個一個縮減,一個一個不斷的業務減量。他說,但是奇怪,神就給他一個很大很大的客戶,一個不要太多,一個就搞定,上帝不需要太多。上帝的手指頭一彎,anything,什麼事情都可能happen,
715.094	739.575	結果就給他那大客戶,一直告訴他,你要擴廠,常常來照顧他。他說,我跟我做的很多都做得很好,為什麼他選上我?我是那麼一個小小的工廠,他為什麼看上我?他不能瞭解。親愛的弟兄姊妹,
742.671	769.171	今天你有一份工作,今天你在那邊工作,你覺得這些事情是很特別的嗎?我告訴你,都是上帝在你身上工作的。結果,他就哭了。我看過很多,我聽到一些例子,就是神怎麼樣,在這樣的一個環境裡面,不可能就讓他跟世雄一樣遇到了這樣的一間客戶。
770.435	795.771	Hallelujah!一切都是出於神。我以前覺得我要靠我自己的努力,我覺得有一半是我的努力,但是越發覺的一件事情,若沒有上帝,這一切事情不會發生。今天上帝把我們擺在不同的位置上,上帝使用我們,
797.005	826.341	我們好像看我們做了一點什麼樣的事情。但是弟兄姊妹,今天這是上帝給你我的恩典。我以前,我在教會裡面帶過青少年跟師母,我覺得,哎呀,上帝啊,我跟師母很愛你。我老大升國一的時候,我們就開始帶國中生。哎呀,我覺得,
828.063	855.052	現在回想一下,那樣能夠帶這些學生是出於神的恩典。都是,親愛的弟兄姊妹,不是我們什麼,但是也是我們什麼。為什麼呢?聖經上說了,我們今天來看這段聖經,一切都是出於神的。他說什麼呢?我們講我們看第五節,
857.619	871.426	亞波羅算什麼?保羅算什麼?無非是直式。那個直式的原文,比較是僕人的意思,就是在主人面前幫忙做事。
873.404	892.533	第二件事情,我們不過是上帝在做,祂是主,祂是一切的主,你我只是擺在旁邊的server,服侍祂的,你不要把你自己看得很偉大,今天你能夠成為一個server,God's grace,
893.558	907.507	神的恩典。你覺得你會站這裡。你要服侍一群人。你要成為他們的祝福。神的恩典。你要永遠記得。就是上帝把你擺在那個地方。為什麼?
911.067	938.619	你有個莫大恩典,你不是那個主啊,你以為你偉大,你不是那個偉大的主,你只是在旁邊的服侍的。所以就第一個要認識我們另外一個我們的身份,我們是僕人。你認識僕人,你心裡會得到很大的釋放。我自己,記得我蒙昭,我蒙昭的經文是什麼呢?
941.493	956.333	有一次我在內湖的時候,我們教會沒有傳道人。我們師母說,哎呀,雲正,你不是50歲,公務人員可以退休嗎?退休來當傳道人。我說,師母,我沒這個感動。
957.483	977.839	我現在工作好好的,都快五十歲還當什麼傳道人?不是要退休了嗎?還當什麼傳道人?我真的沒有這樣想。以前我年輕的時候還跟師母去華生,參加現身研討會。意氣風發,雄心勃勃,說主啊,你有沒有胡找我?
979.002	996.438	我要甚至謝謝地尋求你的旨意。就跟師母去參加三天兩夜的現聖研討會。回來以後,最後一天站在臺上,上來分享說,感謝主,各位弟兄姊妹。我很清楚,神沒有胡找我。
997.944	1024.662	我要回去工作了。然後呢,在我工作,差不多在我四十歲左右,有一天,有個華神,就是我後來有一年到石門靜心會,那個服侍的主任牧師,陳明正陳牧師,那時候他在那邊念神塑班,他有一天打電話給我說,雲正,你要不要來這邊念,
1025.862	1054.277	正書科。你在學校,沒事你就來這邊唸。哎呀,我同學都沒有想,但是他就找我了。他找我,哎呀,可是這些事情就一直放好心,好好去進修,讀讀書也不錯,反正雖然上帝沒有護照你,你就裝備自己嘛。就在那個時候,很短的喔,大概一個禮拜時間,就要截止入學的申請。
1055.486	1078.815	那時候我趕忙到學校辦什麼畢業證書,辦成績單,什麼健康體檢,然後申請。然後我就這樣一考,考上了證書科。我還記得那時候口試的時候,他叫我講一篇道,講教會復興。那時候我對教會復興很有負擔。
1082.841	1086.57	然後呢我就講到我後來
1087.551	1112.84	結果那年,你知道華神的願訓﹐他會刊登一些新生的見證﹐他在﹐很多的新生對不對﹐他選兩三位,然後刊登在願訓。天啊,兄弟我覺得只是一個去﹐就是上帝就這樣帶領我去考﹐結果他就選了我,刊登在願訓﹐我的見證刊登在願訓。結果有一位姊妹跟我講﹐
1116.152	1138.48	那時候我在校園一起服事的,他現在正道當老師的,淩雲,他就跟我講,他說,雲正,你不要覺得你是裝備,有些神可能全世界呼召你,可是我心裡想,不可能吧。現在弟兄姊妹,然後呢,
1140.009	1166.045	我剛才講到我自己去福祉。那時候師母說教會沒有傳導人。那我就說好,那我就可以去。我沒有說好,我就說我現在沒有這個感動。但是好像那些天,神就一直把願意更多參與教會的那個負擔放在我裡面。我們慈士們就開會,就問我,
1167.21	1194.689	說,雲正,你究竟你怎麼樣?上帝有沒有呼召你?講上帝有呼召你,我們就不找傳道人了。你退休,你就來這邊當牧師。我就跟他們講說,神好像有感動我,就一直好像往這個方向去。那天是上帝push我說,你一定要這樣講。
1196.271	1213.615	真的要講嗎?一講出來的話,人家就會認定了。上帝說你一定要講。可是我不講,我就覺得心裡不安。這些石頭放在心上,放不下來。我覺得上帝一直push我往那個方向去。
1217.278	1231.58	他說,那我講完以後,我就立刻心情變得很沉重。回家路上,我說,我看看我教會,將來我真的要管理這間教會嗎?
1233.643	1258.711	好累喔,當童工很好,不要當牧師。我心裡就壓力重但很重。那些天裡面,我在學校服務的時候,我中午的時間都會去我學校附近的中正紀念堂,我在北商,在那邊中午靈修和禱告。那天禱告,突然我就說,神啊,我真的要這樣嗎?
1260.418	1272.604	神就跟我講,這不是你的教會,這是我的教會。當神這樣一說的時候,哎呀,兄弟我,
1273.916	1299.901	所有的重擔全部都脫落。我說主啊,這是你的教會,那我做什麼?你要做什麼我就跟著你做就好了。那這樣簡單,我就怕我不知道要做什麼。既然你說你是老闆,我只是你的僕人,教會是你的,那好了,那我這樣OK了。
1303.916	1333.099	我知道我的角色只是一個僕人。至今我覺得我仍然要學習這功課。我不是主人。我不是主角。我不是站在臺上的人。我不是臺前的主角。真正的主角是那位背後的上帝。祂是一切創始成終的主。是祂開始,是祂成就,是祂預備,是祂安排這一切。親愛的弟兄姊妹,你一定要認識
1334.616	1358.552	今天這一切都是真正的,都是要成就的,都是那位主。神如巴克說的,神不是為了我們,神是為了祂的榮耀。神不是隻是為了我們這些人,神是為了祂自己的榮耀。第二件事情,
1361.578	1374.77	這邊說,不只是我們是神的僕人,而且在哪裡呢?他說第七節,他說第九節,
1375.879	1405.122	第八節他說,栽種的和澆灌都是一樣,但將來要照個人自己的工作,得自己的賞賜。第九節,因為我們是什麼?與神同工的。你們是神所耕種的田地,然後呢,所建造的房屋。第二件事情,你我要認識我們是什麼?與神同工的。親愛的弟兄姊妹,你跟旁邊講,我們是與神同工的。
1408.302	1431.417	你假如知道一切的賞賜都是出於神,都是神的作為,我們不過是祂的一個僕人,你的人生豁達。你如果更是知道你是與神同工的,幫忙上帝,跟上帝一起,一起合一來建造,你的人生就是成功的人生。我記得我第一次募款,
1432.602	1460.232	是怎麼樣的狀況?其實我當校友組的時候,我就一直不想接這個工作,不想應徵這個工作,因為我覺得校友組組長就是公關嘛,對不對?跟校友混在一起。那我覺得大家一定對我有所期待,因為我是第一位,以正式身份,全職的身份當組長的。所以大家說,好,今天校長用你這位全職的組長,你能搞出什麼東西啊?
1461.391	1474.643	花錢,我的腦袋是這樣,花錢我們請一個人,你給我辦什麼事情。所以我就覺得我心裡很有壓力,我本來想要當校長室的秘書去,但那時候秘書,校長沒有找秘書,
1476.032	1494.207	後來結果去了,我就不知道做了什麼。這麼開始,OK,時間快到了。結果呢,校長說,你呢,組長工作不是那麼多,你就兼我校長室的秘書。後來我去了校長室兼秘書,在兩年半校長秘書。開始很奇妙,神就預備一些的工作。
1495.742	1524.245	我們的新校長上任。有一天,他就會去拜訪我第一位募款大客戶,是寶萊集團的前總裁,白文正。白總裁。其實,各位弟兄姊妹,我不是跟他募款,我們那天只是校長就任,去看看他,他是我們的校友。那天我跟研發長、校長,我們去看他。就寒暄一下,
1526.237	1552.339	我們這位白總裁,白校友,據我對他的瞭解,他對學校事務是不太有興趣。過往多小的校友去找他,我們也搬了一個傑出校友給他,但是他對學校任何的捐款都沒有興趣,校友的活動都沒有興趣,所以兄弟我也不帶什麼指望,只是禮貌性的去拜訪他。
1553.473	1569.645	結果就在拜訪閒聊之後,要走之前,這位白總裁就撂了一句話,跟我們校長說,賴校長,學校有什麼需要,不要客氣,你就告訴我。我就把這句話聽進去了。
1570.401	1599.003	我就回到學校的時候,我就做了一件事,立刻與神同工,什麼?我就草泥了一份,我們要蓋一個新建大樓,我們這邊要建堂的,我們要蓋一個新建教學大樓,新建大樓,教學大樓的什麼?捐款,獎勵計畫,募款獎勵計畫,立刻草泥一個計畫書,洋洋灑灑,靈感豐盛,
1600.06	1626.177	寫的洋洋啥,找了一本計畫書,然後就簽給校長。沒有送校務會議,就直接簽校長。校長就批下來,OK了。校長說,這很好,有一個計畫,但是他沒有想到我要跟白文正募款。校長批下來,我立刻再寫一封,又簽一個簽,寫以校長的名義,寫一封文情並茂的信給白文正。
1627.688	1655.526	然後校長明明,當然我要簽給校長,對不對。校長一看到說,他說,王署長,我們只去看人家一次,你就要跟人家要錢。我說,校長你放心啦,你只要把帳蓋下去就好了。我就寄出去,你就等著。就像拿爾明說的,對路德說的,我們看看,我們儘管等候,神要成就什麼事。親愛的弟兄姊妹,我就在那邊等候,我覺得有好事要發生。
1657.995	1686.582	一個禮拜過去,無聲無息。奇怪了,他沒事。就在一個多禮拜的一天,他的秘書打電話給我。王組長,我們總裁說捐一千萬給學校。哇,聽到的時候,全校大大的振奮起來。北商非常沮喪、頹喪很多年,因為我們一直沒有辦法改制大學。
1687.466	1711.609	學校整個狀況風波不斷。學校的老師跟學生都對學校失去信心。就在那個時刻,整個大家的心情鼓逼起來。你知道那一年,結果很奇妙。然後我就規劃一個東西,就一個校友捐一百萬。校長說要做一個歷史走廊,我就出去開一個會,結果我看到那個校友,因為他的爸爸是我們的校友。
1713.251	1728.037	他來了,我說我們要蓋一個歷史走牆,上面有幾張你爸的照片,你要不要捐一下?他說,你來辦公室找我。他又捐了一百萬。很多莫名其妙日本的人,
1729.155	1754.165	哎呀,捐給我們學校一百萬。我都不認識。親愛的弟兄姊妹,就那一年陸陸續續,就捐了一千七百萬。那一年的我們的校慶表揚大會,都是校友的捐款。當天,喜來登的董事長和我們校友,又捐了,因為我們九十週年,又捐了九十萬。
1755.469	1784.665	這一切,親愛的弟兄姊妹,都不是我。我是與神同工的。親愛的弟兄姊妹,我們是與神同工。與神同工,就是上帝在那邊做的時候,祂發動了。我就看到了,我看到就配合上去了,事情就什麼,發生了。親愛的弟兄姊妹,每一天你的人生,就是要這樣來經歷。
1785.674	1814.874	假如你可以知道你的身份,假如你可以知道一切都是神的賞賜,不是在乎你,雖然你也用力,但是都是,若沒有神,也不可能。你也知道你的身份。你這樣的人生,你不要站在舞臺前,你願意站在舞臺的後面。親愛的兄姊妹,
1816.425	1840.654	好不好?你就會是經歷一個豁達人生,豐盛人生,上帝在你生命裡面成就美麗的人生。感謝主,我們一起來禱告。我們一起起立。過去,也許親愛的弟兄姊妹,你曾經用你的方式來努力。
1842.449	1870.201	你曾經用你的方法,你覺得這一切都是我要去賺取。沒有錯,你不是不需要,但是你要認知是神的賞賜。若不是神的賞賜,這一切都不會發生。我兒子去上海工作的時候,他心裡有些壓力。我常跟兒子說,
1871.254	1892.004	兒子,不知道做什麼時候,不要急。把聖經攤開來放在桌上。你看聖經,上帝會對你說話。多少日子來,我見證當我不知道怎麼做的時候,我只是把聖經攤開在我的桌前。
1896.8	1923.2	上帝上很多的事﹐很多的人來找我﹐這回電話鈴響了﹐這回說主長你可以怎麼樣﹐很多的事情發生都不是我人生的規劃。我們必須認識﹐我們必須學習﹐我們人生就是站立在神的面前與神同工。
1924.138	1941.227	好不好,這時候我們一起來禱告,求上帝把那樣恩典,願意在祂的面前,認知祂是那位主權的上帝,認知我們可以就是單純的跟隨我們的主而行,做祂的僕人的信,賜給我們,我們一起來禱告。
1941.647	1966.848	親愛的天父上帝,謝謝禰,這位榮耀的主。我們知道禰是為我們行大事的神,禰是掌管一切,禰是行作萬有的上帝。讚美主,我這一生裡面,都是禰要為我成就的,都是禰為我命定的。我讚美禰,我要在禰的面前,單單的出發,來相信禰,依靠禰。上帝,禰為我開路,感謝主禰在我們當中成就大事。
1967.108	1982.011	謝謝上帝讚美主禰祝福我們每一位祝福在我們的當中讓我們願意學習做神的僕人感謝神讓我們的生命因著有主而得到更大的喜樂豐盛謝謝神
1982.432	2000.667	主啊禰祝福我們即將分散祝福我們帶著禰的恩典帶著禰的信息帶著這樣的心與主同心單單的來仰望神神禰是為我們開路掌管的神我感謝禰祝福我們每一位奉靠我主耶穌基督的聖名禱告阿們