start	end	text
2078.66	2091.155	不過我一天也沒有學到英文,不知道怎麼回事。我也沒有當空姐,那個愛美的夢想人就離我很遠。所以當我在
2093.012	2109.96	我認為從小到大我父母給我的就是,他們是鄉下人,我媽媽是文盲,我爺奶奶也是文盲,因為他們家都生很多孩子,田很多,地很大,沒有誰去讀書還可以活下去呢?
2110.93	2130.878	所以,我的母親就放棄讀書的可能性,她就自願照顧她的兄弟姊妹。她就是非常的勤奮的,請同工幫助我們講臺語,有那種奇怪的聲音。她就是選擇放棄讀書,然後照顧她的兄弟姊妹,使兄弟姊妹可以好好的活下來。這就是我的母親。
2131.578	2151.206	那我的家人他們沒有受太多的教育的前提底下,他希望他的孩子受到最好的教育。所以對我來說就是,我從小知道一件事情,我就是要把書讀好,我就是要上大學。所以在91年的時候,我覺得我一定要為我的父母來負責任,他們那麼辛苦的養我們,我看在眼裡。
2152.227	2173.103	雖然我是那個跑來跑去,看起來很野的小孩,可是我的心裡就是孝順的、知道的、體會的。然後我覺得那就是賺錢、養老,讓父母可以有好的生活,就是我應該做的事情。然後我就是要嫁給有錢人,最好又帥一點,這就是我覺得我人生最大的夢想。你們都沒有聽進去。
2175.111	2203.853	所以在那一年的時候我離開家去到空中語教室雜誌社的時候我覺得我離我的夢想越來越近了。殊不知神就在那一年呼召我當我一腳離開家的時候另外一腳就踏進教會上帝就沒有讓我離開否則我不知道會發生什麼事情。一個非常想要嘗試飛到世界各地的一個野孩子。神知道我可能有
2204.974	2219.785	沙羅的野心勃勃,但是神也同時領導我,把我圈在一個小小的教會裡面。我待的是宣道會,從信耶穌、受裝備、服飾都在宣道會裡面。
2221.067	2249.405	在小小的教會裡面﹐頂多一百人的大教會去實習。小小的神學院裡面﹐都是宣教士在教育的、教導的小學校。一個人跑到臺北來讀書﹐一個人帶著被奉獻的一個皮箱就來臺北。那是1994年的事情。就這樣子開始了服事的生涯。在服事裡面總覺得﹐很多事情我也像亞拿尼亞一樣﹐我覺得這個做不到的不要做。
2250.145	2272.636	我覺得這個不行。我真的是小教會出來的。我真的是小教派出來的。在美國、在印尼、在東南亞,宣道會很大,可是在臺灣都是一百多人。我們二十六、七間堂會都是小教會。所以很多時候,我也很像亞拿尼亞一樣,做很多事情的時候,我都會跟上帝說,我也跟我的同工說,這件事情做不到,不要做。
2273.336	2299.467	但是我剛說,可能很多時候神做的比我們遠,比我們大。上帝呼召一些人就是帶著望遠鏡在看敵軍在哪裡,也看得到遠方的策略應該如何飛才不會撞擊。上帝常常透過祂的教會,不同的人做成了祂要做的事情。比方說,我剛來淡江教會的時候,
2301.152	2327.526	我就想說你們辦那個大聚會,然後就叫天氣一定不可以下雨。這是怎麼一回事?我本來想請朱牧師到臺前來,但他剛好就坐在第一排。上個禮拜我的同工都可以做見證,我的同工他已經在同工面前說這一位同工姊妹非常的包容我,非常的接納我,所以我現在可以講他一下。
2330.367	2347.954	就是在我剛來淡江教會的時候就想說你們辦聚會為什麼叫天不下雨就要不下下來那個不是伊利亞的禱告然後就是不要這樣了這樣太牽強了有些地方需要下雨才能夠有農作物我們是農人背景所以
2349.258	2377.504	所以我就來的時候﹐看到那麼多錢﹐紮在一場戲上面。我就想說﹐哇﹐這個有多少人信耶穌啊﹐這件事情﹐怎麼需要花那麼多力氣﹐那收割在哪裡﹐誰跟進﹐跟進之後發生什麼事。我就在想﹐然後我就想說﹐怎麼會有一個人﹐禱告那麼狂妄﹐這是狂妄的童工﹐怎麼可以一直這樣子﹐要求上帝不可以下雨﹐丹江教會辦的活動﹐不會下雨﹐
2378.524	2395.787	狂妄啊!哇!哇!對,就是我的童工祝牧師,我們為他的信心,一定要的信心!哇!大家教會辦的活動不會下雨!阿們!耶!耶!不要像亞蘭妮亞一樣,我的小信心、小鼻子、小眼睛那時候也是這樣子的。
2397.125	2416.848	那這些年,開始在丹江教會實習、服事。當聖靈的風如何吹,當神的家不同的領袖,承接不同的事工,做不同的事情的時候,我有很多時候也覺得,這種事是不可以的,類似我剛剛提的天氣的感受。
2418.439	2435.099	很多時候我也會覺得不要叫我,這樣事情做不到的。但是我就一次又一次的跟弟兄姊妹一起來經歷,這是神要做的,神做了就做成了。很多時候我們很像聖經裡面的芥菜種,
2435.64	2455.313	然後放下去,牠死了又活過來,長起來之後,牠成為一棵大樹,很多鳥會在上面棲息。這是耶穌的比喻,比喻天國就是這樣子的。我們的信心跟我們能做的就是無比二餘,可是神說,這個就要成就五千人吃飽的一個神蹟跟啟示。
2455.913	2471.328	所以我昨天參加一個婚禮,那個教會我剛剛說六百多人,可是他們小朋友有三百多人。你是新娘的,是是是,那家教會,那是一個很特別的教會。對,就是很特別。
2471.869	2499.312	就是你們常常做一些別人不會做的事情。你們常常會嘗試別人不會嘗試的事情。而神不是,我們不是為了不一樣而不一樣。我們不是為了標新立異而標新不一樣。而是因為我們知道淡水是神第一個使福音進來的北臺灣的第一個據點。而我們如今坐在這邊,南投竹山鄉下的小女生。不過,
2499.872	2524.651	也不是自己跑來的,就不知道為什麼就跑來了。今天我們每一個人在這裡都有神所安排的時間,神安排的永恆的計畫。很多時候我們必須要放下自己,來問說,神啊,我的框架是不是要放下來?神,你透過現在聖靈吹的風,要透過我們所成就的事,是否我要謙卑下來說,主,雖然我覺得萬萬不可,
2524.991	2554.47	雖然我覺得這是不可以這樣子的做,但是神說你只管去,你就說阿門,我只管去,那麼神就成就祂要成就的事,阿門。在剛剛報告裡面講到的這個宣教的展,在150年前沒有各位,更沒有基督教的歷史在臺灣。所以你們來看宣教的展覽的時候,是在看什麼?
2556.749	2580.646	一百五十年前,有一個種子被帶到臺灣來,在南部。中牧師講過無數次,第一個原本要進臺灣的那個宣教士,在他快要登陸的時候,一個大浪來,把他捲走了。第一個種子死在大海裡,對不對?在南部的時候。第二個種子就是瑪雅各。
2581.766	2610.116	在150年前,神把他帶到南部,就是我們3月份要走的那個行程。神透過那個種子,種下去了,他死了,埋葬了,又活過來了。在屬靈的裡面,他成為一棵大樹。如今我們就像那些飛來的飛鳥一樣,在這棵大樹上棲息。在北臺灣是143年前的,
2611.391	2635.52	誰?馬傑。當我們來到這裡,我們在這裡聽神的道,我們都有自己的故事。我們有很多覺得自己不可以的事情,神應該這樣,教會應該這樣子的事情。很多時候我們可能像掃羅一樣,或者我們也可能像亞拿尼亞一樣,這個不可以,這做不到的。
2637.022	2665.598	很多時候神可能說,騷羅,你盡情去,面對你曾經逼迫的人,面對你的失敗錯誤。神也可能向亞拿尼亞說,你只管去,祂是我神所要用的器皿,我對祂的生命計畫透過你成就,你只要做我叫你做的事,起來,只管去,這就是我對你的吩咐跟計畫。弟兄姊妹,你覺得幸福嗎?
2667.09	2694.571	臺灣是幸福的,這是客觀的事實。但是我們說,我不吃不喝都無法買到一個房的時候,我可以覺得我很哀怨。我可以覺得我這一生好可憐。但同時我也可以像志偉一樣,原來我的這一口氣就是祝福。我還可以有一個教會,如此的蒙恩,就是祝福。第一堂來的時候,有一個姊妹從美國剛回來,回來看望其他人。弟兄姊妹,當神
2694.991	2712.683	帶我去不同的國家﹐不同的宣教的場合﹐看的時候﹐我真的會阿門阿門一件事情﹐真的是淡江教會﹐華人的教會﹐臺灣的教會﹐真的是神要使用的航空母艦。很多的歐洲﹐我們即將再回去﹐平安跟新南舉手﹐揮揮手一下﹐
2713.183	2735.668	即將回去紐西蘭,我在紐西蘭實習三個月的時間,我去澳洲實習一個多月的時間,我去美國不同的教會拜訪跟學習的時間,實習的情況裡面,我看到好多的資源是臺灣最豐富。我看到屬靈的成長,屬靈的餵養,常常是最幸福的在臺灣。弟兄姊妹,很多從國外回來的人都會阿門的。
2736.408	2763.38	我們站在一個很重要的核心的神工作的一個很重要的領域裡面。不要小看你自己,因為神可能用你的手為一個人按手禱告,那個人要成為翻天覆地的大使徒。而神只有說,我沒有叫你做別的,只有叫你去為他禱告。按手在他身上,這就是我對你的祈求,我對你的吩咐。
2764.48	2782.771	但很多時候,我們生命不覺得需要轉捩一點,因為我覺得我現在做得很幸福,我這一切都好了,我不覺得我需要改變,因為我覺得這樣就夠了,要改變的是那個人,要改變的是那一件事,要改變的是這個體制,而不是我。你幸福嗎?
2784.036	2799.904	如果我們在永恆裡面要讓更多的生命棲息在我們這一棵樹上不僅是我得到二十年不吃不喝才有的一個房子我能夠在永恆裡面讓很多人跟我一起
2800.384	2830.139	讓我可以跟很多人一同在永恆裡作喜。那麼我就要願意成為破框﹐被神擴展。我就要成為一個面對自己﹐自己的失敗錯誤﹐自己生命需要面對的人事物﹐一個掃羅的轉變成為保羅﹐一個亞拿尼亞的順服造就了使徒保羅的一生。我們一起站起來。我們請基邁團到臺前來。我們一起來禱告。用最後一首歌來回應我們的神。