start	end	text
0.009	27.464	真的非常感動,因為神的愛在孩子的身上就是最明顯的。所以每一次,他們真的是很容易讓我很感動。跟我一樣的阿們。對嗎?不要一個人哭,要大家陪我一起,感動。阿們,給他掌聲給神。需要聖經的舉手一下好不好,我們請同工幫我們。我們來看使徒行傳第九章,一到二十二節。
29.735	50.977	今天莊牧師以及青少年的同工在臺南,他們有一個退休會,也為他們祝福禱告。所以呢,我們一起來紀念神的家,也一起來神話與上面一起來成長。我們一起打開使徒行傳第九章一到二十二節。好,都翻到了嗎?好,我們一起來讀神的話。
52.381	65.531	《使徒行傳》第九章第一節,我讀單數節,請弟兄姊妹讀雙數節,好嗎?第九章第一節,掃羅仍然向主的門徒口吐威嚇兇殺的話,去見大祭司。
77.517	105.937	掃羅行路將到大馬士革﹐忽然從天上發光﹐四面照著他。他說﹐主啊﹐你是誰﹐主說﹐我就是你所逼迫的耶穌。同行的人站在那裡﹐說不出話來﹐聽見聲音﹐卻看不見人。
116.766	139.234	三日不能看見﹐也不吃﹐也不喝。主對他說﹐起來﹐往直街去﹐在猶大的家裡﹐訪問一個叫大樹人﹐名叫掃羅﹐他正禱告。
147.568	171.569	亞拿尼亞回答說,主啊,我聽見許多人說,這人怎樣在耶路撒冷多多苦害你的聖徒。主對亞拿尼亞說,你只管去,他是我所揀選的器皿,要在外邦人和君王並以色列人面前宣揚我的名。
177.449	193.415	亞拿尼亞就去了,進入那家,把手按在掃羅的身上,說:「兄弟,掃羅在你來的路上向你顯現的主,就是耶穌打發我來,叫你能看見,又被聖靈充滿。」
202.449	225.184	吃過飯就見狀了,掃羅和大馬士革的門徒同住了些日子。凡聽見的人都驚奇說,在耶路撒冷殘害求告證明的不是這人嗎?並且他到這裡來特要綑綁他們,帶到祭司長那裡。
233.746	238.728	我們經文讀到這邊,我們一起來禱告。請監聽給我大一點,謝謝。我們一起來禱告。
240.708	267.573	天父謝謝禰在禰的話語面前,我們謙卑自己。再次求主,讓禰自己的話語發出亮光來,讓我們能夠通達走前面的道路。2016年在禰的眼前,在禰的手中,我們的靈魂生命氣息在禰面前謙卑。求禰開通我們心裡的眼睛,心裡的耳朵,好讓我們能夠明白禰的話語的奧秘。感謝耶穌聽我們禱告,奉耶穌基督的名祈求。阿們。
268.473	297.234	前陣子年底的時候,主計處在31日有公佈一個消息,不曉得大家有沒有看新聞、看報導。他做一個國民幸福指示的統計。這個根據的標準是國家的標準,就是各個國家的一個標準,是一個蠻有數據的。然後呢,你知道嗎,他說臺灣是亞洲最幸福的國家。
298.814	308.368	好,你跟你旁邊的說臺灣是亞洲最幸福的國家。你們講這句話的時候表情是不對的。
310.265	338.697	成如那些被採訪的人一樣說,我不同意。他們很多人雖然看到數據有根有據的,說是,是這樣的。他們有那個數據的評比,他說是亞洲當中,37個參與評比的國家,排名第18。那以亞洲來說,是勝過日本與韓國,亞洲第一名。為死之故跟你旁邊的人說,你真的很幸福。
341.357	370.354	你們的表情人就沒有被說服我可以體會到我們果然是存在同一個地圖裡面的你覺得幸福嗎?當這樣的評比出來之後他們就說16年不吃不喝臺北市的人可以買到一棟房子16年不要吃也不要喝剛剛那些孩子讓他餓得乾扁就可以買到一棟房子但是很殘酷的消息人就是亞洲第一名
371.391	400.831	所以,你問問看你自己,你覺得你幸福嗎?幸福嗎?不要騙自己了,真的。他有說到說,過勞跟高房價是我們臺灣人現在幸福的敵人。太累了。工作超過8個小時的弟兄姊妹舉手一下。你們都已經屬於太累的階級。那最累的是莊牧師師母他們全家,他們都超過12個小時可能。
401.391	427.457	在我們的心裡面,這個幸福感是很個人的,對不對?幸福感,比方說剛剛有孩子的,就會因為孩子的這個樣子,我們可能會覺得很幸福。那沒有孩子難道就不幸福了嗎?怎麼辦好?我們2016年才剛開始,才一年才剛開始。
428.097	441.353	我今天要從掃羅跟亞蘭妮亞的故事當中來思想,如果我們的生命希望有幸福,幸福感,希望真實的體會到那個幸福,生命需要一個轉捩點。
443.08	463.653	生命的轉捩點從哪裡開始?我要從掃羅的故事當中,他不是舊約裡面那個掃羅,不是掃羅王。就是我們如果看新約聖經,你會發現有三分之二是保羅的書信。那就是他在成為保羅以前,他與上帝相遇以前,他的生命是怎麼樣的光景。
463.933	485.188	其實他覺得自己很厲害,他覺得自己其實是蠻棒的。可是上帝說,這個不夠好,這個不夠棒,因為這不是我對你生命的計畫。於是上帝親自來靠近這一個人,使他真的幸福指數破錶。他生命的轉捩點是從哪裡開始呢?剛剛你看到的經文,對不對?
486.049	507.489	2016年我們的生命跟掃羅的生命﹐可以有任何的共鳴﹐以至於我可以成為一個﹐心裡面說阿們﹐我真的是一個幸福的人﹐因為我知道我的主是誰。在當時我們剛剛看到了﹐掃羅的生命是一個怎麼樣的生命﹐弟兄姊妹﹐他是一個很厲害的人。
508.66	536.795	因為他的老師很厲害。他是加馬列的名下的一個厲害的學徒。如果你在研究保羅書信,你會發現他的文字是很厲害的。希臘文,新約的讀寫,希臘文,原文,保羅書信是最難懂的。因為他的原文太好了,他的用字潛詞太強了。所以他是一個非常有學問的人。
537.415	550.37	而且他在一個當時最厲害的一個老師的名下受教,他非常厲害。然後呢,他的老師其實就是說他是一個溫和的法律賽人。
551.288	577.023	但是,他不僅是聰明,他不僅是學得好,他更是要贏過他的老師,青出於狼,勝於狼。在當時的狀態裡面,我們知道一件事情,就是老師沒做的,學生替你做。老師,你不會去把基督徒從舊約的立法,從摩西五經看下來,你就知道這些基督徒是來亂的。
578.336	590.246	所以我們必須把他們趕走,這是不應該的。所以老師並沒有去做這個抓基督徒的動作,更沒有把他們下在監裡面。
591.152	617.466	但是我們看見一件事情,就是他不僅是學得很好,在知識上面,從加瑪烈的這個溫和的老師,我們可以從一個說詞叫做音派跟歌派,他的老師就是溫和的歌子,歌派的法利賽人。當時的法利賽人有兩派,就是他不會去起那個革命的法利賽人,他的老師是這樣子的一個老師。
618.166	641.019	可是他在這個老師的授教的底下,他覺得是不夠的,他是要奮起革命的,他是鷹派的法律賽人。因此他要說,老師你沒做的我替你做。他拿到一個合法的權柄,所以他要去拿文書的權柄,他要一個拘捕令,就是凡信奉這道的人都做什麼?把他們架在監裡。
641.817	664.779	而且呢,大馬士革這個地方是管不到的,沒有要管的。他說我來,我來,我來,我來,這個地方交給我就好了。所以他就去求能夠治理,能夠管理大馬士革這個地方合法的居留權,把這些基督徒全部關起來。不僅是這樣,從聖經裡面他有自我的形容。
665.828	681.483	有一個人叫司提反,聖經的門徒,知道嗎?耶穌當時是司提反的門徒。他當時被害的時候,掃羅就是在旁邊,讚讚讚讚讚。他是幫忙管著殺他的人的衣服的。
682.79	701.416	他就開心啊,這些基督徒終於都行之以法,開心得不得了。他做得很好耶,他是很成功的人,以他的標準,很熱心。老師沒做的我來做,老師做不到的我來替老師成就。
702.176	723.881	對一個這樣的人來說,有什麼問題嗎?我覺得我也是幸福的,因為我做我可以做的,我擅長做,我覺得我熱血澎湃,我一定要做的事情,有什麼問題嗎?有一個問題,有一個問題就是造他的那一位生命的主,覺得這一件事是無法繼續下去的。
725.213	751.246	雖然他的熱心過人,他智慧才幹都是過人的,可是他卻用在一個上帝沒有要他用的事情上面。上帝沒有馬上處理,但是有一天當他再一次的跨到前面去,要去做他熱心澎湃想要做的事,他覺得正義使然一定要做的事情的時候,那一天上帝怎麼樣?
752.449	781.935	親自靠近祂,親自的向祂顯現。在那一天,上帝再告訴他一件事。掃羅,掃羅,你為什麼逼迫我?那一天他馬上怎麼樣?眼睛瞎掉。因為上帝的大超能力,他超自然的顯現在他的身上。人與神相遇的時候,從舊約、從新約,你會常常發現,人與神相遇的時候,常常是相當厲害的。
782.295	805.763	祂遇見的大光,那一位光就是神自己。創造祂的生命的主說,你的熱心用錯地方了,你的努力跟才幹跟恩賜跟能力都用錯地方了,對不起,我不要你繼續這樣下去,雖然你覺得你做得非常好,雖然你覺得你這樣做非做不可,可是神說,停損點在這裡,你生命的轉捩點從這裡開始。
806.323	827.595	他根本搞不清楚怎麼回事。他只是正義凜然的繼續拿著文書的權柄,他繼續要做類似斯蒂凡被殺的狀態。你可以想像他是一個很殘暴的人嗎?很殘忍的人,很忍心別人受害的一個人嗎?他就是在做這樣的事情。
829.036	850.116	而上帝對他永恆的計畫裡面,上帝對從創造永恆的裡面,沒有允許掃羅繼續停留在那種狀態。掃羅眼睛瞎了,他不知道是誰在對他說話,所以他問你是誰?他說我就是你一直在逼迫的那個耶穌。
851.237	878.892	然後,現在做一件事。我們一起來讀那一句話。上帝對他吩咐,第九章第五節,他跟神說,你是誰啊?他不知道跟他說話的是誰,他就是眼睛瞎了,搞不清楚狀況,因為他正在做他平常最熟悉的事情。可是當他往前的時候,上帝啪的停止他,跟他說,我就是你所逼迫的耶穌,但是現在要做一件事,第九章第六節,請你們讀,請。
885.009	897.397	進城去,瞎眼了,什麼都不能做,要有人牽著他進到耶路撒冷城去,進到他每天在逼迫基督徒的地方去。
898.865	921.019	上帝要讓這一個很厲害、很熱心、自以為是的這一個掃羅,重新去面對他自以為是的地方,他最熟悉的人群,他所殺害跟逼迫的所有人。這是上帝面對這一個非常的厲害、
922.159	944.14	沒有很大的格局,大到上帝不容許存在,因為祂就是祂的上帝,祂覺得祂認為對的就是對。但是上帝說停在這裡,現在回去面對,進到城去,去面對原本你所傷害的人群,去告訴他們我是誰,去告訴他們我是如何的改變你。
945.947	967.614	掃羅的故事等一下下半段我要跟大家再分享有另外一個人幫助了他但是從掃羅的故事裡面我看到一件事情上帝常常會在我們不知道的時候進到我們生命當中需要被轉類的那個點當中親自的讓我們可以與他相遇
968.626	997.172	很多時候我們的氣質性是不一樣的,就是我們與生俱來的個性是不太一樣的。等一下你會看到另外一個跟我們掃了完全不一樣的人。對他來說,他從小到大被教育的,以及他堅持認為對的事情,就是我剛剛形容的一切。他都覺得是再也不能夠好的。這個斯蒂凡受害,他在旁邊拍手。你要去殺斯蒂凡對不對?你的衣服,重要物品,我幫你管。好,去。
998.49	1013.078	他做的是覺得對的﹐好的﹐無比的事情。可是在神的眼中說﹐不﹐掃羅﹐你完全不認識我是誰﹐你用腳去踢刺是難的。聖經是這樣形容上帝跟保羅的關係的。
1014.206	1034.887	你是用腳來踢我,你怎麼會沒事呢?上帝馬上讓他瞎眼,讓他看不見,只有聽到聲音。接下來就是他重新與神面對面,重新面對自己的錯誤,生命轉了一點的開始,起來進城去。你所當做的事,必有人幫助你。
1035.247	1052.281	連誰、做什麼、等一下我都會講。上帝都說,先不要管,起來,進城去,順服我現在要你做的事。他生命的轉捩點在他瞎眼開始。他生命的轉捩點在他瞎眼的時候,他心裡的眼睛開始被神打開。
1055.282	1073.001	在我思想這段經文的時候,我常常想起一個人。所以我昨天經過他們的允許,想要分享他們的故事。不曉得志偉跟Amy在現場嗎?不在,OK。如果你們看到志偉跟Amy,知道志偉跟Amy的舉手一下,很好,謝謝。
1073.882	1089.837	如果你有看到他們,一定要鼓勵他們。他非常開心我可以分享他的故事,他說是很榮幸。但是我其實要說的是,他大大的感動了我,所以我很想分享他的故事。在年底的時候,我們不是在明潼有一場步道嗎?
1090.418	1113.258	然後在那場步道的時候,我就看著志偉跟他的外勞,就是幫助他復健的那一位,他們在,我們在步道的時候,因為明統就是在大門口,所以來來去去好多人。那我們看到一個人就出著柺杖,然後那旁邊的那個外勞就協助他,就在明統的大範圍的前面,左邊,右邊,一直走來走去。
1113.558	1138.104	她的臉上是笑容,她的身上就是活著腳,一擺一擺,一擺一擺的,很努力的在往前走。在我們在明同步道的那兩個多小時,她就是走過來又走過去,走過來又走過去。你知道她在做什麼嗎?她在行走禱告嗎?可能是,我相信她在為我們守望。但你知道她正在做什麼嗎?她在復健。
1139.684	1168.795	她必須要走路,否則她就會萎縮。這個故事是怎麼發生的呢?在去年有一天,我們的姊妹Amy,她正要去上班。她要去上班,她平常自為是一個不抽煙、不喝酒、沒有不良嗜好的弟兄。這種好弟兄如果還有請介紹給我,謝謝。不是重點來回來,重點在這裡。她是一個非常善良的一個正職工作的人。
1170.196	1189.473	有一天當他的太太Amy要去上班的時候,他準備關上門的那一秒鐘,他關上門啪就走出去了,就門關起來了。說時遲那時快的時候,他準備把門啪起來的時候,他聽到一個砰的聲音。
1190.418	1208.865	發生什麼事?志偉摔倒,而且很大一傷,摔倒。他就在那一秒鐘回頭看,天啊,我剛剛不是跟我先生再見,他怎麼倒下去的。就緊急叫救護車,就把他帶到醫院去。
1210.538	1220.626	就在那一個情況裡面,危機裡面他重新被診斷,他發現一件事,就是志偉的頭腦裡面有一個很大的腦血管瘤。
1221.869	1246.668	就在那一剎那爆開了。所以他就昏倒了。就整個人休克了。他就在這樣的急救裡面被拯救。然後醫生說,像這樣的案子,如果是長成這樣子的腦血管瘤的大小,以及那樣的狀態,不是死就是殘廢。就是很少有比例會救回來的。
1246.988	1268.23	非常微乎其微的,先生就是那個微乎其微的那一位,而且很難會正常的。而你就在那一秒鐘把他救到醫院去,那就是關鍵。就在那一秒鐘,如果那一秒我就把門關起來,我的先生就是永遠再見了。
1269.804	1299.077	在這個故事裡面,當我昨天重新的採訪志偉太太,我就問她說,這個經歷這半年多來,這將近一年的時間,妳知道他們過怎麼樣的生活呢?志偉就是狀況很不好,從死亡的邊緣被救回來,然後他就是不斷的需要住院,然後Amy就看他就是瘋狂的禱告,不斷的禱告,晝夜不住的呼求神救我的先生,讓他再有機會存活。我們看到的就是神把他救回來,
1300.265	1325.237	但是接下來的路就是復健。這個醫院只能復健多久,他們就搬到另外一個醫院去。那裡沒有床位,就搬到另外一個醫院去。他們就是不斷地在過去這一年當中,就是不斷地換醫院,不斷地復健,不斷地換醫院,不斷地復健。所以當我看著他在民同百貨前面走來走去,臉上不是愁苦的。真的,在當天步道的弟兄姊妹可以做見證,他是笑容的。
1325.708	1354.577	Yes!加油!就是這樣。他就是這樣。講不多話,但是他確實臉上帶著很多的盼望跟笑容。當我採訪Amy的時候,我說,你有什麼可以跟我們分享的呢?他說,其實他們很難理解為什麼這樣的事會發生在他們的家。他剛剛說的,就是他告訴我,我先生是好人。他就是一個行為很正直的人。也沒有什麼不良的嗜好就發生了。然後,
1355.367	1379.758	她就說,她重新發現,失去以後,她發現很多事情不是理所當然的。我可以活著呼吸,可以走路,我可以正常地講話,可以正常地笑,都是恩典。所以他們說,重點就是我如何看待生跟死這一件事情。其實在志偉那一天,那一秒昏倒的時候,
1381.152	1397.061	他們自己形容,其實志偉後來告訴他,他的靈魂已經出竅,他已經在半空中。然後,他就說,當天堂那麼真實在他眼前的時候,其實他覺得天堂很好。
1398.746	1419.427	可是在神的恩典跟憐憫當中,拯救了他的靈魂跟信息,再給他活在地上的歲月的時候,他有信息要透過Amy跟志偉來告訴我。他說,其實死不可怕,因為我其實差不多已經死了。可是他說怎麼活才是重點。
1420.845	1439.493	祂就說,神不是要我們白白的受苦,只是活一生而已。神存留我們的生命是要熬煉我們,使我們更新更像祂,使我們有一天可以與神一同作王。現在我的生命就是在學習怎麼樣忍耐,因為祂就是復健。
1440.213	1457.138	就是不斷地忍耐,不斷地去重複很無聊,很沒有成就感,很沒有看起來不會有什麼改變的事情。他說我們不可以把今生當作永恆,我們今生所有的一切都是在為永恆做預備的。
1457.398	1481.204	所以對Amy跟志偉來說,苦難變成至戰至輕的痛苦。他說這個忍耐做成得救的功夫,是有一天我們可以在天上與神一同做王直到永遠。我們為這個生命掌聲歸給他們的神,好嗎?生命幸福嗎?
1482.756	1511.639	我們的氣息﹐我們現在可以自由的講話﹐比許多的人來說﹐已經幸福很多了。生命的轉捩點﹐不是我覺得幸不幸福。生命的轉捩點﹐就是當上帝告訴你﹐你要從這裡開始改變的時候﹐你願意改變。志偉說﹐他不得已﹐沒有選擇的機會。Amy說﹐我就是他太太﹐所以我必須要。
1513.319	1539.729	他被強迫去面對生命最核心的問題。他被強迫就去面對生命當中不感恩,生命當中理所當然,生命當中覺得上帝對我不夠好的狀態,以至於在生跟死的交關的時候,重新站起來的時候,說每一個呼吸都感恩,每一個忍耐都是為有一天永恆與神做王來做預備的。
1540.964	1556.247	這是掃羅的生命曾經有的光景。在他瞎眼之後,上帝臨到了他。上帝跟他說,我對你還有計畫,不是你自以為是,你大氣,你覺得別人能做的,
1556.527	1557.768	繁體中文，臺灣國語。
1576.544	1593.37	歐洲那塊土地翻天覆地,把它翻過來,但是你這個掃羅用腳踢刺,覺得自己很厲害,不會受傷的這位掃羅,我先要把你的生命翻天覆地過來,首先看不見。
1594.07	1619.48	去進到城裡面﹐成為一個無助的人﹐被服侍﹐因為我要用你﹐接下來去服侍你所逼迫的人﹐去面對你的錯誤﹐面對你傷害別人的事實。我們看到在這個故事裡面﹐有一個很重要的人物出現了。我們一起來讀好不好。第二十二節﹐剛剛那個地方第二十二節。請。
1632.705	1662.157	是,亞拿尼亞,另外一個好人,虔誠人,也是受律法的管教的,是有神的人。他知道他學了律法是要順服的。可是呢,那一天,上帝跟他說,亞拿尼亞去,因為這是我所要使用的一個門徒。但是,亞拿尼亞什麼反應呢?他馬上答應嗎?
1663.234	1680.531	祂說什麼?不可以,上帝,不行。為什麼不行?你不知道那個掃羅發生什麼事情嗎?他就是把所有的…那種事情不能發生。上帝,不可以,不可以,抱歉。這種事情我不答應,我不許。
1682.619	1701.182	當他這樣子說的時候,就是在告訴他說,上帝,我覺得我是對的。可是上帝不僅對掃羅這個人有計畫,對亞蘭妮亞這個人也有計畫。如果從剛剛的經文上下文來比,你會發現亞蘭妮亞是另外一個極端的人物,她就是一個框架很強,
1701.903	1716.139	自我意識也很強。他覺得不可以就不可以的人。他是小心謹慎的一個人。難道你不知道嗎?上帝這個人把基督徒做了什麼事情。可是經文非常清楚的是上帝有沒有跟他說話。
1716.92	1737.077	那個聲音是上帝說的,對不對?所以上帝就很鄭重的向亞拿尼亞介紹他對保羅的計畫,說,亞拿尼亞,聽好,我叫你做一件事,就是這一個人,就是你所認識那個到處抓基督徒,逼迫基督徒的那一位掃羅,我鄭重介紹你,他是我所揀選的器皿,
1737.517	1754.216	他要在外邦人﹐跟君王﹐並以色列人面前宣揚我的名﹐並且我會指示這一位小羅﹐他要為我的名受許多的苦難﹐請你去﹐你放膽的去﹐你只管去做我要你做的事情。
1755.384	1772.383	當亞蘭妮婭聽懂上帝所說的,她把她的框架放下來,她的框架被破除。雖然她心裡面覺得很奇怪,她如此的個性以及過去的生活經驗告訴她不可以。
1772.944	1799.023	可是當她很清楚上帝要她做的事情的時候,上帝已經這麼清楚地把祂的僕人以及她透過亞利安尼亞要成就的事告訴她以後,她說你只管去,祂是我所預備的器皿。亞利安尼亞有沒有順服呢?有。你可以想像嗎?亞利安尼亞這個人可能很小心,個性也很緊張,框架比較多,她這一生可能沒有行過神蹟。
1800.606	1819.568	不可能,聖經沒有其他記載亞拿尼亞這個人,我在想像。可是上帝那一天,讓亞拿尼亞去為這個偉大的殺人的,逼迫基督徒的掃羅禱告以後,神蹟有沒有發生?你看到經文說,你要按手在他的什麼?
1819.568	1819.928	身上。
1821.169	1848.947	祂必須要與神同工,而且神是透過誰的手行神蹟啊?亞拿尼亞,就是跟祂說,啊,不可以,不可以,萬萬不可的那一位。上帝說亞拿尼亞去為祂按手禱告。當祂一按手禱告,什麼是發生的?掃羅眼睛的鱗片就怎麼樣?掉下來了。祂開始吃喝,接下來就是起來進城去,告訴別人祂的生命發生了什麼事情。
1850.998	1869.564	他是一個格局小,限制多,常常跟神argue的人。從這些事情上面我們看見,上帝的計畫,上帝的遠見,常常比我們自以為是的或認為不可以的還要大,還要寬,還要偉大。
1871.288	1898.264	在神的家中﹐真的有一些人﹐看得比我們多﹐比我們還要遠﹐他心裡可以承擔的﹐可以承載的﹐可能比我們過去所見的﹐所聞的都還要多﹐那可能是坐在你旁邊的那一位﹐也可能就是神放在神家中﹐你的小組長﹐或者是神放在你家中的那一位﹐屬靈的長輩﹐或者是那個﹐你的頭﹐你的太太﹐
1899.974	1927.654	在1991年的時候,剛剛介紹彭夢慧老師。我是在1991年的時候,我從來沒有信耶穌的,沒有教會背景。在那一個畢業的時候,高中畢業的時候,我覺得我就是要當空姐,我就是要把英文弄好,對,我就是要飛,對,這就是我的人生夢想。艾美一定會覺得很奇怪,為什麼要有人做這種夢想,因為她曾經是華航的空姐。
1928.114	1954.867	在我18歲的時候,我就想說,哇,我一定要來做這個空姐的工作,因為又漂亮,對不對,又可以飛來飛去,這就是我的夢想。那時候覺得英文很好,就很好玩,然後覺得英文這個就是王道,我就要把英文學好。所以我就離開家了,就是想要讀大學,但是又覺得考空姐應該是賺比較多錢,可以見多識光,又可以看到,哇,這個世界長怎麼樣,多麼好啊。
1955.367	1983.536	你知道,我就是一個非常鄉下的背景的小孩。殊不知,芭比娃娃對我來說是陌生的,因為我爸的後方的田園,就是我的 playground,就是我的大操場是哪裡呢?我們家後門出去有小河,前面有山坡,後面有小河,形容我家,我家在竹山,是小女生。
1984.036	2004.529	所以我只是在田裡面跑來跑去。當我看到弟兄姊妹在玩那個手作的東西,瑞田是我的偶像,從來我不會有興趣用手,我從來沒有被發展。所以對我來說,我的雙腳很厲害,就是跑來跑去,跑來跑去,在田裡面跑來跑去,野孩子。在那麼小的鄉下裡面,
2005.708	2020.556	剛剛講到1991年的事情,就是對我來說,出國去,飛來飛去,成為漂亮的空姐,就是人生最棒的祝福了。所以在那一年的時候,我第一次去到臺中,我離開我的家,我想要考大學,我要自立自強。
2020.776	2049.222	所以我要經濟獨立。我要為我自己的未來做努力的時候。我又是大學聯考失敗的人。所以我要為我自己的未來加油。所以我就離開家了。到臺中一中那附近找了一個地方就跟同學租下來。有很多人在補習要再考一次大學的時候。我去到了彭蒙慧老師所開的ORTV空中語教室的雜誌社。我就跟店員開始聊天說我怎麼樣可以又快又好的把我的英文學好。
2049.582	2074.103	於是那一個店員就把一個宣教士的名片交在我手上。他是一個宣道會的宣教士,康達勒康牧師。他說你可以去跟他做朋友,他要教英文,你可以跟他講,就很快。於是我從那一天踏進教會之後,我就成為今天的傳道人。
