start	end	text
3073.208	3077.249	到後來大家要出發了,都上完廁所,我才發現我還沒有上廁所。
3077.249	3082.231	所以常常那個領隊跟店後有說,莊牧師還沒有從廁所出來。
3082.231	3084.332	還是這麼高流的喔?
3084.332	3093.928	不是,是因為,就是我在那個做同伴又做英雄這種角色裡面,不斷的在那邊, 在切換,我不知道我到底是誰。
3093.928	3096.349	一直到最後,神釋放我。
3096.349	3101.212	神說,沒有英雄,只有同伴。
3101.212	3103.893	你就好好做大家的同伴就好了。
3103.893	3106.955	因為只有祂是真正的英雄。
3106.955	3111.997	而且祂做英雄的目的,是要把我們每一個人都變成祂的同伴。
3111.997	3112.237	阿們。
3112.237	3117.180	所以為什麼我喊這個口號,沒有英雄,只有同伴。
3118.217	3121.181	我不是在解構哪一位其他的英雄。
3121.181	3122.663	我在解構我自己。
3122.663	3124.706	也在解構你們大家。
3126.800	3138.426	教會的文化,真的,我們如果期待就是英雄明星來拯救我們,短期有效,拿破崙,長期無效,而且是負面的。
3138.426	3151.252	因為他們剝奪了跟延後了你們成長,你們起來同做王,你們起來同做祭司,你們起來同做先知的機會和空間。
3151.252	3157.710	雖然這位英雄也會賣命,就像拿破崙一樣,但是他只是一個凡人, 他有他的弱點。
3157.710	3164.133	當他的弱點一淋到他的時候,他跟伊利亞一樣,瞬間垮臺。
3164.133	3172.638	法國的結果是15年裡面,用掉了150年的資源和這些榮耀。
3172.638	3175.440	到現在法國都還沒有爬起來。
3175.440	3177.701	基本上整個歐洲還是德國的天下。
3177.701	3180.343	這是給我們很好的一個提醒。
3180.343	3183.825	因此我們要來撥餅,好不好?
3183.825	3224.391	我們不要忘記一件事情, 這塊餅好大啊可是待會到你們手中只有一小塊就是不要忘記什麼我們是拿同一塊餅的我們要與耶穌基督一同做君王我們要與耶穌基督我們都要一起做先知認識神的啟示跟真理我們要與耶穌基督一同做祭司把軟弱憂傷的人帶到父神的面前阿們 這個教會裡面。
3224.391	3225.871	希望祂只有同伴。
3225.871	3229.132	只有天祿客的好同伴。
3229.132	3230.012	彼此扶持。
3230.012	3232.493	我們都是弟兄。
3232.493	3233.894	我們都是姊妹。
3233.894	3236.534	我非常期待。
3236.534	3240.436	我們一起。
3240.436	3241.036	一起起來。
3241.036	3243.016	不要忘記。
3243.016	3245.697	其實我不是你們的牧師。
3245.697	3247.878	我只是你們的弟兄。
3247.878	3251.239	我們請丙輩同工到前面來。
3255.145	3257.446	為了教會長遠的發展。
3257.446	3262.487	為了每一個人生命裡面必須為自己負責和做決定。
3262.487	3267.148	每一個人生命必須為自己從神那邊領受意向跟啟示。
3267.148	3270.369	你們需要興起發光。
3270.369	3273.950	你們需要與耶穌基督一同做王。
3273.950	3275.610	一同做祭司。
3275.610	3278.671	一同做先知。
3278.671	3282.952	我們這些被耶穌基督設立在教會的同工。
3284.258	3302.350	不論是做使徒的﹐做先知的﹐做教師的﹐做牧師的﹐做福音使者的﹐不論我們被設立是做什麼﹐我們都只有一個共同的目標﹐就是要做什麼﹐成全聖徒﹐各盡其職﹐建立基督的身體。
3302.350	3311.076	我非常感謝在這個23天的走路過程中﹐在很多的時刻中﹐我享受著做同伴的喜樂。
3312.927	3314.648	我做同伴的感恩。
3314.648	3318.951	有一天我們在太平靜馬雅各紀念教堂。
3318.951	3319.611	參訪的時候。
3319.611	3323.613	剛好他們聖歌隊在練詩。
3323.613	3325.574	我在那邊看著他的時候。
3325.574	3329.077	我就好懷念。
3329.077	3333.279	好懷念我以前還沒有當傳道人的時候。
3333.279	3337.842	那個時候我就很清楚知道我就是一個同伴。
3337.842	3340.924	師母也常常很懷念以前當還不是師母的時候。
3342.637	3343.538	我們是同伴。
3343.538	3343.878	阿們。
3343.878	3344.559	感謝主。
3344.559	3351.224	因此今天呢,待會我們要一起出來領這個餅,跟這個杯。
3351.224	3355.448	我們待會就是餅杯全部在前面,然後他們出來領。
3355.448	3367.879	然後我要請師母跟我一起,就是你們出來的時候,我們會跟你握手,與你相交,說,你是我的好同伴,好不好。
3367.879	3378.460	願神今天回應你們, 我們當中有需要君王恩膏的,你生命中要勇敢做決定的,懇求主今天吸引你與祂同做王。
3378.460	3378.880	阿們。
3378.880	3388.603	我們當中有想從神那邊得到祂的心意的,明白祂的啟示的,我們為你懇求今天你與主同做先知。
3388.603	3388.963	阿們。
3388.963	3395.832	我們當中有沒有人願意再次把生命獻給耶穌基督,獻給上帝的, 我要奉主耶穌的名祝福你。
3395.832	3399.855	今天你與主耶穌同坐祭司。
3399.855	3402.797	再次把你生命,不完全的生命交給祂。
3402.797	3405.358	不完整的生命交給祂。
3405.358	3408.921	讓舊事已過,一切都變成新的。
3408.921	3410.542	我們請師母出來。
3414.206	3419.836	主耶穌被賣的那一個晚上,祂跟祂所心安的門徒一起吃最後的晚餐。
3419.836	3427.150	祂拿起桌上的餅說,這是我的身體,為你們被剝開,你們每逢吃它的時候,要紀念我。
3446.630	3451.173	我們待會請所有受洗過的弟兄姊妹,都跟我們一起領餅杯。
3451.173	3458.057	當你拿到這塊餅的時候要紀念,你拿的只是一小片,可是不要忘記我們眾人拿的是同一個餅。
3458.057	3460.178	我們一起被主興起吧。
3460.178	3465.701	我們一起來做君王,一起做祭司,一起做賢子吧。
3465.701	3471.645	飯後主耶穌又拿起桌上的杯說,這是我跟你們立約的血,為你們而流。
3472.534	3475.441	主的血要洗盡我們的污穢與罪。
3475.441	3478.288	你們每逢喝的時候,要紀念主耶穌。