start	end	text
0.009	23.616	這篇經文的時候,我有所感。這篇經文非常的長,大概總共有七十二節,但是所以我們沒辦法全部來看,因為看的話時間太長。但是我們會看,我會折幾處來看。在我們看之前,我們一起來做一個禱告。
33.746	43.01	願親愛的天父上帝,祝我們為這一天時刻向禰向上感謝,主要祝福我們,讓我們有一顆願意跟隨、順服
45.282	49.485	今天我要講的題目是從悖逆到順從。
75.759	96.159	那我要看的經文,七十八頁,我想先看我選的幾處經節。第一個是第十七到第十八節。對不起,我還是想把前面的前言先看。我們先看一到八節好不好。先看一到八節,對不起。我的名啊,
96.783	115.781	我們一起來念一道八節,一北來。我的民啊,你們要留心聽我的訓誨,徹耳聽我口中的話。我要開口說比喻,我要說出古時的民語,是我們所聽見所知道的,也是我們的祖宗告訴我們的。
116.101	135.608	我們不將這些事向祂們的子孫隱瞞,要將耶和華的美德和祂的能力,並祂奇妙的作為訴說給後代聽。因為祂在雅各中立法度,在以色列中設立法,
136.237	164.267	是祂吩咐我們的祖宗要傳給子孫的,要將祂生的後代子孫可以曉得。他們也要起來告訴他們的子孫,好叫他們仰望神,不要忘記神的作為,唯要守祂的命令。不要向他們的祖宗是頑耿悖逆,居心不正之輩。
164.667	191.896	向著神心不成死。第一階段經文它是告訴我們作者希望透過這一篇詩篇告訴我們一件事情告訴神告訴這些以色列民就是說他們的子孫曾經發生的一些事情神在他們當中所行的一些事情這事情讓他們經歷一件事什麼呢 就是第四節
192.961	218.337	要將耶華的美德和祂的能力,並祂奇妙的作為,述說給後代的聽。這些的事情經過的,讓大家看後面,都不是一些好的事情,都是一些困難難受的事情。但是,上帝透過這一段經文,透過這些要告訴以色列民,要他們告訴他們的後代,
218.985	248.616	神在這一切的困難當中,神怎麼帶領他們,他們在這些當中怎麼經歷神的美德,神的作為。Hallelujah!親愛的弟兄姊妹,這也是我們人生的寫照。你相信嗎?你在你的人生當中,神也是如此讓你透過一些覺得不太好,覺得是不可能,
249.241	276.143	覺得是困難,覺得讓你要烏乎哀哉嘆息的情況下,你在安好的裡面,上帝要幫助我們經歷神的美德和作為,包括我自己在內。不是信了耶穌,就哈利路亞。我昨天喊了一句哈利路亞是什麼時候呢?是我打死了一隻蚊子。
279.36	304.738	可是之前我真的要說我怎麼搞的來一隻蚊子我晚上的睡眠完蛋了我這打蚊子的技術非常的差可是呢 不得不打一看手 哇塞真的 黑蚊子在我的手中死掉立刻說 哈利路亞 讚美主
306.647	324.495	你看是多麼不一樣的轉變。假如沒有打死的時候,我不知道我是怎麼樣的。主啊,怎麼有一隻蚊子在我面前。第二處聖經,我要帶大家看的是17到18節。因為這段時間,
325.06	339.302	之前就說到以色列人他們,上帝帶領他們走過一些紅海,分裂紅海,然後在曠野用雲柱火柱遮蓋他們,給他們盤石擠出,讓他們有水喝。
339.957	344.459	但是呢,接著第十七十八節,我們來一起來念,預備,來。OK。
359.121	374.325	可是這邊就說到兩個字,說到他們後來卻心裡還是對神會有一些不高興、抱怨。接著我要帶大家再看到三十二節,
375.179	403.279	預備 來 隨時這樣﹐他們仍舊犯罪﹐不信他奇妙的作為。雖然上帝後來打開天上的那個烏雲打開了﹐讓一些的什麼鳥飛到他們當中﹐讓他們安存可以吃﹐他們心裡很希望能夠吃到一些東西﹐肉的食物。他們說在這邊出來曠野﹐什麼東西都沒有。
404.104	424.07	但是上帝也打開來,讓他們吃,讓他們吃得很飽,看到神的作為。但是這邊說,雖是這樣,他們仍舊犯罪,不信祂奇妙的作為。再來我們來看第40節到第42節。
426.101	445.169	他們在荒野背逆祂,在荒地叫祂擔憂。何其多呢?他們在山試探神,惹動以色列的聖者。他們不追念祂的能力,何足他們脫離仇天的日子。我不知道大家,
447.125	468.739	經歷神的恩典以後,是不是跟這個樣一樣?這邊說到祂在曠野悖逆他,在荒地叫他擔憂何其多呢?在什麼?再三試探神惹動以色列的聖者,不追念祂的能力和贖他們脫離敵人的日子。所以是這個樣子。
469.804	498.699	但是看到神的作業﹐他們還是就會忘記﹐他們還繼續﹐還是突然就轉變了。最後我要帶大家看﹐第56﹐57節﹐預備﹐來﹐他們仍舊試探﹐悖逆至高的神﹐不守祂的法度﹐反倒退後行詭詐﹐像他們的祖宗一樣﹐他們改變如同翻背的弓﹐這邊說翻背是很快的轉變﹐
500.316	527.817	一下就轉變了。翻背,前面還覺得是看到神的恩典,感謝讚美主,但是瞬間他們就轉變了。這是不是很值得我們思考的地方。最後一段聖經,我們要從65節唸到72節。那時主向世人說醒,向勇士飲酒呼喊,
528.473	546.318	他就打退了他的敵人,叫他們的勇猛羞辱,並且他棄掉約瑟的帳篷,不揀選以法聯之派,卻揀選猶大之派,使他所喜愛的喜安山蓋造他的聖所,
546.578	575.73	好向高峰,又向他建立永存之地,又揀選他的僕人大位,從羊圈中將他招來,叫他不再跟從那些帶奶的牧羊,為要牧養自己的百姓,雅各和自己的產業,以色列,於是純正牧養他們,用手中的巧妙引導他們。
576.323	604.762	Hallelujah!這就是我的結論。完了。於是,神,祂真正說,使他們,於是祂為要牧養祂自己的百姓,雅各。這些是誰呢?祂的產業,以色列民。當然在那個時候是以色列人,但對著新約來講,就是我們神的子民。哎呀,經過了這一切,
606.152	631.33	上帝要讓我們看見一件事情,祂如何帶領我們,祂要牧養我們,祂要使我們建立一個新的不一樣的光景,是讓祂一步一步帶領我們的人生,讓我們能夠在祂的引導之下,可以不再悖逆,可以充滿神的恩典。
634.65	663.377	這段經文說實在就是以色列的悖逆史。我自己發現我自己的人生就好像這以色列的悖逆史一樣。它裡面有好幾個我們剛才念過的詞。有什麼詞呢?我們看到就是第一個他們再三的悖逆他們仍舊試探至高的上帝。第二個呢?
664.07	686.99	他們在曠野,悖逆他在荒地,叫他擔憂何其多。第三個,就是他們的改變,如同翻背的弓。這是說明以色列的三種在曠野的特質。怎麼樣?他們一而載,載而山。載山就是一遍一遍的來。
687.722	716.685	人就是怎麼樣?是因為他們雖然經驗過,但是他們卻是怎麼樣?立刻忘記了,然後又忘記了,然後又發生了,再一次的發生。第三個,他們在改變。我不知道大家會不會改變很快。在這邊哈利路亞讚美主的時候,突然遇到一些事情不順利的時候,立刻改變。
718.2	743.56	所以我們的生命是改變很快的。今天上帝要透過祂美好的作為,祂讓我們這些人在祂的牧養之下,這些以色列人在祂的牧養之下,可以怎麼樣?不容易,被你能夠順服,能夠怎麼樣?安穩在神的手中。
746.237	764.734	昨天我讀這裡面經文裡面有跟詩篇三卷很接近的一個是詩篇106篇一個詩篇95篇我自己昨天晚上睡覺之前我的靈修就是讀詩篇95篇哎呀
765.879	793.392	他說,這四十年來,他們在曠野四十年來,進不曉得我,他們是糊塗的百姓,進不曉得我的作為,以至於他們不能夠享受安息。我一算,我信主三十五年,跟以色列人在曠野四十年,我已經走了三十五年。那這三十五年,幾乎是起起伏伏,
797.227	826.856	上上下下,是這樣經過這些的歷程。所以在我的生命裡面,我真的覺得是這樣的一個情況。那我要說,我以前我從開始結婚的時候,我就非常的抱怨。抱怨什麼呢?抱怨我的太太。師母呢,那時候我結婚的時候,我跟她講,我心裡希望她能夠留在家裡照顧小孩。
828.422	857.132	我吃什麼喝什麼並不重要。你在家裡幫我照顧家就好了。我呢下了班以後呢我回到家看到你在家然後煮好了一頓晚飯然後說老公你回來了歡迎你在門口歡迎我我就心裡非常的滿意這是我結婚的第一個期待
858.609	885.545	結果呢,完全落空。那時候我常看到要死兒嘛,對不對?說小孩子放學以後,沒人在家照顧小孩。所以我就很捨不得,我覺得萬一我的小孩也是要死兒,回到家裡沒人照顧。上帝看重家庭,比其他都重要。所以我說,太太,
886.408	914.794	我跟他這件事也argue了好久,直到有一天,我才跟我講說,雲哲,我告訴你,我在家帶小孩,比我出去上班所帶出的小孩更糟糕,效率更糟糕。我告訴你,我在我家裡會非常非常的無精打採,然後怎麼樣,沒有精神,毫無效率拉一拉他。
917.039	944.197	從她告訴我這句話以後我就完全放棄。我就知道革命沒辦法成功。這我期待的。第二件事我期待什麼事情呢?我期待我的衣服我每次洗衣服以後太太都幫我燙好。哇塞!回家就每次早上上班的時候都可以有燙好的衣服。結果呢發現完全落空。
948.012	972.035	有一次我一個人燙了三十幾件衣服。從此我從我家燙衣服的高手。連我太太的外甥女婿來臺灣回門請客。結果衣服有點皺。她大嫂就說,雲正,幫她燙一燙。
974.445	1002.604	我那一次燙三幾件,為什麼燙三幾件?我的衣服,師母的衣服,我兩個孩子的衣服。所以一共燙了三十幾件衣服。感謝主,革命完全成功了。在我身邊,第一個是我的家庭的叛逆的過程。在這過程裡面,我非常痛苦,就是覺得我一直有些期待,我一直argue跟師母。第二件事情是我的工作。
1004.65	1034.297	我也非常痛苦。為什麼呢?我曾經有一段時間覺得對我的工作很不滿意。我覺得我的工作沒什麼意義。我覺得我的工作沒什麼價值。我覺得工作毫無前途。你知道男人很喜歡有前途嘛,對不對?那我記得可是在我這份工作的時候我記得我得到這份工作是我在服役的時候。
1035.401	1059.93	那時候我服補充兵役那時候在之前我當兵之前考了公職的考試後來我媽就寫了一封信給我在我部隊裡的時候寫信給我的時候我接到信的時候我就眼淚就流下來我是非常感謝主因為
1060.606	1087.252	我在部隊的時候,我接到那封信的時候,我媽說,Hallelujah,感謝主,你的公子考上了。哇,我覺得不可思議,因為在我那個當下,那個時候我念化工,因為我那一年出來的時候,70年畢業的時候,那時候剛好石化危機,剛好石化廠一家一家的倒閉,
1088.148	1114.734	我同學念化工的目的,就是唯一的目的,就是希望將來找工作容易。結果事與願違。結果沒想到呢,人算不如天算。這時候剛好石油危機,一家家的化工廠倒閉。後來我的同學,很多繫上的同學畢業出來,有的到工廠去,但是很多都是當sales。其實我去工廠實習過,我知道我很不喜歡工廠的環境。
1116.305	1129.726	我說那時候要做什麼呢?去工廠不喜歡。當傳道人上帝沒有護照,那做什麼?不知道要做什麼。當我不知道要做什麼的時候,
1130.64	1158.739	上帝為我預備了這個工作,以後有機會可以跟弟兄姊妹再分享。但是那時候,我覺得非常的感動,我說上帝在我還不知道我人生的道路的時候,你就為我預備了這個道路。因此當我接到這信的時候,我就流下眼淚來,非常感恩。我知道這是上帝為我預備的道路。結果後來我去的時候,我才更知道,在這個工作裡面,它有三個志願,
1160.947	1188.361	其中第一個志願是我是考調查局的考試。第一個是縣市調查處站。第二個是公司的現在叫振豐市。最後一個到大專院校當訓導人員。我就當訓導人員去了。我就把這個填了我的第一志願。因為我非常感謝,因為我在大學信了主。
1188.78	1214.623	我就覺得上帝居然給我這麼好的環境,可以去大學,不敢說還福音的債,但是我可以在那邊傳福音,可以跟同學相處,來做傳福音的工作。我充滿了感恩,上帝你實在是美善美好恩典的上帝。可是,甚至去了學校,工作了幾天以後,立刻跟神抱怨,上帝你給我這是什麼工作?
1219.548	1247.562	無聊透頂,跟這些同學在一起幹什麼?沒有價值。哎喲,主耶穌啊,那時候,我剛也在學校帶團契很好,但是除了這些,其他一切都不好。我曾沮喪了好幾年,有一次我得大學的學弟來看我,
1249.889	1279.518	他說,王哥你怎麼變成這個樣子?一副頹上的臉。這是什麼樣?你以前大學時代的意氣風發的樣子,到哪裡去了?我說,有什麼好意氣風發的?在這裡工作,一點什麼指望都沒有。我在這裡工作,好像真的人生充滿了,沒有光明。
1280.964	1308.653	所以那時候我非常的低潮,結果後來我就在,我每天回到家裡面的時候,非常的鬱悶,不時地滴下幾滴眼淚來。奇怪,不要講這個道日是什麼回事。直到有一天,我這樣鬱悶了大約一年多,
1310.384	1338.386	有一天,我在學校學生活動中心,因為我辦公室在學校活動中心裡面,在活動中心門口,然後我看著一些學生,我還記得那個景象,突然上帝,突然有一個聲音進到我心裡來,祂說,雲正啊,你做這些事情的價值,不比你當校長,你們的校長的價值差。
1339.531	1365.875	突然這句話打開了我心靈的眼睛,才知道在上帝眼中的價值,跟我眼中的價值完全不一樣。我以前曾認為說基督徒居上不居下,作手不作為。我今天落到,王某落到何種田地裡面,作為不作手。
1367.449	1390.628	做手嘛,不是要當校長。可是在那個當下,上帝告訴我說,雲正,你做這件事情的價值,不比你校長的價值差。從此他改變了我的人生。然後開始我就覺得,我跟學生的相處是有意義和價值。
1392.261	1418.008	那我就陪著學生,我做了刻畫活動,陪著學生吃喝玩樂。我公職生涯大概就是吃喝玩樂了。我在工作上其實有很多的掙扎和挑戰,但是這是我開闊生命的第一步,這就是人生走入曠野的開始。
1420.265	1438.031	信主的時候,我發現上帝,我覺得我禱告上帝恩待我,祝福我。當我第一份工作的時候,我以前大學沒有什麼玩,當我第一份工作的時候,上帝祝福我,我到很多地方去玩,因為我當課外活動的組長,
1439.735	1461.674	那時候一天到晚開會嘛,主堂開會。然後就招待你去這裡玩,到那裡玩。以前那個蘭嶼還很少人去的時候,我就坐著小飛機去蘭嶼玩。哎,對,基督徒就應該這麼蒙福啊。我那時候說,就是從那個開始以後掉落,
1462.363	1488.895	另外一個谷底。上帝重新調整生命的價值和意義。這是我工作。後來,跨越了這個難處以後,上帝在不斷的工作裡面,給我一些不一樣的挑戰和試煉。在我們教會,子晨跟我是同一個辦公室,他很瞭解我。在學務長的任內,
1490.555	1518.978	工作很忙,然後我舌下潰瘍,從那個時候開始。那時候,我們的學務長非常,個性非常急迫,在他手下做事的沒有一個人不被他打倒,我也差點要死掉。結果,那一年我非常的辛苦度過,大概有兩三年的時間,
1519.77	1547.061	但是上帝恩待我在忍耐當中、困境當中學習。那年我得了兩個獎,一個是全國優秀公務人員獎,一個是全國最佳學生事務人員獎,學務人員獎。這不是重點,但是我覺得是上帝在我生命裡面開闊的道路。直到現在,
1547.875	1577.599	在我的生命裡仍然會有抱怨。我像那樣的以色列民一樣,常常起起伏伏。我說悖逆是生命當中的一種本質。雖然你已經是成為基督徒,但是當你遭遇到不順,當你遭遇到覺得跟你的期待,跟你的渴望有落差的時候,你心中仍然會產生埋怨、抱怨的心態。
1578.882	1606.358	這是我們沒有辦法完全的順服上帝。這是你我在我們生命裡面潛藏的本質。我們無法認知到上帝的安排是完全最好。因此在我們的生命裡面,我們沒有辦法,我們會悖逆,我們沒有辦法幸福。聖經上說得好,沒有一人,連一個都沒有,
1607.654	1634.334	都是什麼樣 都是什麼樣 嘴巴說什麼哎呀 毒舌毀舌的話以前我看 我說哎喲 主啊 有這麼難過這麼糟糕嗎 我有這麼糟糕嗎哎呀 過了幾年以後 發現完全如此動不動就說什麼抱怨的話動不動就說罵人的話我以前在石門的時候我們的牧師跟我講
1637.551	1664.726	無人不被人講,無人不講人。哎呀,我說這句話說得好啊。我真的是如此啊。他們沒有一個藝人,連一個也沒有,沒有什麼,他們的喉嚨是敞開的墳墓。哎呦喂呀,真難聽啊。他們的舌頭弄詭詐。第三個呢,滿口是咒罵苦毒。
1666.357	1695.897	我們常常做內在醫治的時候,不是說你有苦毒要醫治嗎?親愛的弟兄姊妹,當我們看這一段,也許是苦毒的靈在我們成為一個破口,我們需要被神醫治。但是從罪惡的本質裡面來說,我們動不動就會批評人家,動不動就看一些地方不順眼,動不動就會產生
1697.193	1721.975	苦毒的言語。無怪乎,雅各說,你們信耶穌基督的人,那個毒水、苦水,從你們一個學園裡面出來,是不應該的。哎呀,雅各你說這件事情真困難。為什麼?因為,
1724.019	1746.632	他說的,因為我們的舌頭很難管控我們自己。我們的舌頭,他說所有都被掌控了。這是什麼?只有舌頭沒有被控制。我說雅各,你說這樣對嗎?我看是我們的心沒有被控制。我們裡面有一個悖逆的心啊。我們對什麼事情不滿。
1747.329	1775.195	我們對神這樣安排不滿。以色列人為什麼會抱怨?就是因為他們對神的帶領不滿。當神帶領他們走這個地方的時候,他說上帝啊,有更近的路為什麼不走?你偏要帶我們走遠的路。然後呢,就在那邊開始抱怨。一條路是一個乾燥之地,
1775.981	1805.557	他們覺得很困難的時候,覺得沒有水喝。他們就立刻抱怨上帝。這就是我們的寫照。所以雅各說的一點不錯。他說親愛的弟兄啊,唉,對不起。我翻到哪去了。
1808.217	1837.639	毒水跟苦水從你們裡面出來是不應該的。對不對?他是在那個,雅各書的第三章,對不起。他說,他全員怎麼能夠,他說,你們送戰上帝,又咒詛人。他送戰和咒詛,從一個口裡出來,我的弟兄們,這是不應該的。
1839.497	1868.654	泉源從一個巖裡，能發出填苦兩樣的水嗎?上帝禰真的要救我。我裡面有一個填水了,但是在我的裡面，卻是一個隱藏不住的一個苦水。曾幾何時這蓋子打開的時候,它會在我裡面掀開,讓我同時發出這兩種東西。
1869.906	1898.028	上帝禰一定要救我,在我生命裡面那個苦水,要在我裡面完全拿去。說得容易,談何容易啊?以聖人報恩的原因,作物的期待。但是我要特別說,他們這些對上帝為什麼,就是上帝要用什麼,
1898.66	1926.179	四十年的時間,好像在曠野,不斷不斷地熬煉他們的生命。在我寫這份講義的時候,我剛好讀牧師注釋的一本書,不是,寫序的一本書,喜樂的,忘了,流浪者,什麼,
1926.903	1950.627	流放者 喜樂的流放者那裡面有一段話是James Houston 侯伯仕引用但丁在神曲裡面的一句話但丁在神曲裡面講到說人生他說他看到他好像走過地獄在他生命的深處
1951.374	1980.462	有很多很多,什麼叫地獄?就是我渴望的,我想要達到的,但是我做不到。那就是人生的地獄。他在越走越覺得苦盡,越來越走不到。怎麼辦?他想說他的人生就一直往地的核心裡面走過去。他的結局是完蛋一馬死。結果,
1982.176	2010.662	阿蕾路亞 奇蹟發現了當他走過地的核心的時候他發現一片嶄新的光明之路在他面前打開他突然走上去就發現他站在山頂上腳底下壓制著生命的七頭山嫉妒 驕傲 自私 悖逆 放任 任性
2011.698	2040.221	還有一些誤會,踩在祂的腳底下。Hallelujah!生命經歷真正的什麼?自由跟釋放。上帝也是如此啊。在我們的生命裡面,透過曠野的生命,顯出我們生命的真相。好叫我們能夠真正的過去,而能夠真正的奔喪自由。
2046.152	2074.521	So,這是上帝的作為。以至於,我是在祂裡面講了一段話。祂說,走過地獄,我們才發現問題。我以前,不曉得我有這個問題。我覺得我這麼讚有,我這麼愛這些東西,我以前不覺得。
2076.203	2105.039	真正走到地獄的時刻,我才知道我很在意。現在都說安全感嘛,對不對。一百萬,十萬是不是安全感?當然不是,十萬塊是零花錢。一千萬是不是安全感?兄弟,一億是不是安全感?可能現在十億吧。
2107.108	2135.731	我覺得,哇,曾幾何時,這個東西對我那麼的重要。如果沒有經過,我不曉得,我這麼在意,人家對我的眼光。如果我沒有走過這些,我不知道,原來,別人在我生命裡面,佔有這麼重要的分量。
2138.404	2166.269	所以他說,走過地獄,我們才能發現問題,當我們克服這股灰心,當我們克服這股灰心,擺脫驕傲、野心和任性,就能直達山頂,將神與我們的關係,那片充滿愛、
2167.278	2195.844	喜樂與平安的全景,盡收掩體。親愛的,今天我們很多人受洗,感謝讚美主,我那時候也很興奮。但是,屬靈的道路真的不是一帆風順。上帝要真正讓你得到屬靈真正的自由,不是這個瞬間的喜樂自由。當你信了主有平安、恩典,絕對是有
2196.425	2222.763	就像我得了癌症,要死要死的時候,上帝的恩典托住。不然我就死翹翹了。我就真的受不了了。神若不扶持我們,你一步都走不下去了,你相信嗎?我們中國是比較剛強。所以他說的阿門特別大聲。他說呢?
2224.565	2252.911	鏡收眼,在地獄無法改變。若是神的恩典沒有領導,在地獄無法改變。但在獵魚中,被改變更新,帶來徹底的歸信。Hallelujah!為什麼這個歸信這麼重要?我對上帝的信心這麼的重要。徹底的相信祂。
2254.531	2281.646	我才能夠真正的得到屬天的恩典安息。當詩篇的作者在描述這個以色列人悖逆的時候,他說了兩件事情,為什麼他們會這個樣子?兩件事。第一個,在二十二節那邊說,因為他們不信從神,他們不相信神,對神的信心不夠。
2282.79	2308.202	第二個,他不依賴上帝的救恩。這是一體的兩面。不相信,所以帶來無法的依賴。我沒有辦法接受上帝你為什麼是這樣的代理。這跟我的想法跟我的觀念是不一樣的。
2309.753	2337.408	為什麼?我沒有辦法完完全全的相信神。直到這裡,我仍然沒有辦法完完全全。但是感謝上帝,祂有帶領我。絕境與盼望。在這一段詩篇裡面,最後就說出了他們的絕境。欸,戲啊,怎麼樣?最後是怎麼樣?很糟糕。
2338.507	2360.28	倒閉在曠野。對不對?最後,上帝任憑,棄掉約瑟的帳篷,以法廉之派,被祂錄取。那個帳篷,也有翻譯為慧木。那時候,慧木在寺,我在以法廉之派裡面。但是,
2361.63	2388.099	更是說明一件事情,叫做原來一個行為律法之約,在那個時候徹徹底底的崩盤。因為在剛開始的時候他說,以法聯,怎麼樣,子孫帶著兵器,臨陣之日轉身退後,不遵守,他們不遵守神的約,不肯照他的律法性。
2389.633	2417.707	可是我們繼續查看聖經的時候﹐我們發現在歷史上﹐並沒有以法人之派﹐林鄭被約的事。所以解經家會說﹐他們為這邊作者﹐在這樣講述的時候﹐是什麼原因呢?他說﹐是因為﹐他們什麼﹐不肯遵守神的約﹐在上帝的律法當中跌倒。這是我們的絕景。在我預備的時候﹐我想到一件事﹐
2418.268	2442.946	大家記得上次王倩倩傳到來這邊分享的時候上癮的真相我就是那個真相裡面的一位他談到一件事 心事的戰場他說什麼是一個心事的戰場就是一個事件會引發一件思想
2444.65	2469.97	思想帶出情緒,情緒帶出行為。所以他說,我們所有的關鍵在思想裡面。因為事件的引發,你會可以站在不同的選擇。就像你出了車禍,哎喲,怎麼倒楣啊,今天跟人家擦撞了。我們家最近連續失誤兩次,
2470.691	2498.526	一個我兒子,另外一個私母,倒車的時候,把後車燈給弄破了。哎呀,好難過,要花錢。Anyway,但是他說,講到我們出了車禍的同時,另外一個人說,哎呀,感謝主,我很平安,沒有發生事情。他就說,Hallelujah。他看了東西,他說,感謝讚美主。他發出了感謝的行為。另外一個說,
2499.155	2527.946	啊,怎麼這麼倒楣,今天怎麼老子出門,怎麼搞得這麼不順利。就出了事情,哎呀,開始帶出另外一個情緒,就是抱怨的情緒。因此發出什麼?抱怨的嘴巴出來。啊,心事的戰場。我說主啊,下一章。我說主啊,那真是人生的結局,無言的結局啊。那我常常會這個樣子,會產生負面的思想。
