start	end	text
2529.07	2556.447	但是有盼望的結局在這裡。就是六十五節開始,突然主向世人睡醒。他另外做了一件不一樣的事情。什麼事情呢?他說他打退了他們的敵人,叫他們勇猛西洋。他另外,他棄絕了,他卻捲選了猶大之派。他說喜愛的西安山,
2557.688	2583.66	而且把他的會屬蓋在那裡。然後呢,嚴選大衛,牧養他們。大家知道這個大衛是誰嗎?在今天的大衛就是我們的耶穌基督。什麼是永遠的西安山呢?神祂自己的會屬,不是那個看得見的,那是天上的。
2585.282	2613.113	今天我們有一位愛我們的神,祂把祂棄掉那個行為之冤,重新把我們放在恩典,帶我們像寶貝,像祂寶貝的羊。所以按著祂的純正,最後一章,還有祂的技巧妙,純正是上帝 upright,公義的本質,真理的本質,巧妙,
2614.821	2642.343	也是靈巧的意思。有解釋說,他隱身可以說是還具有同理心的意思。啊,主啊,你同理我,感謝,讚美主啊。他知道我的軟弱。所以,就像希伯來說,我們有一位大基督,他並非不能體恤我們的軟弱。他也跟我們一樣受過試探,只是他沒有犯罪。感謝主,
2643.046	2667.179	這位恩典的神,祂把我們放在這個恩典之約裡面,好像用祂那個巧妙的手,一步一步引導我。講到最後,就說到我自己的生命。人生當中還是有一些不如意,會挫折。前一陣子,我心裡也是,
2668.575	2693.742	在侍奉上或是在,反正在教會裡面,不是跟牧師就跟其他人,就是在侍奉上有一些的沮喪和挫折,自己就是覺得跟自己的渴望不一樣。我大概一天到兩天,我記得那一天我晚上我還去附近家裡的國小運動,
2694.974	2719.799	希望,其實師母有注意到我。她說,雲正,我看你這幾天,這兩天不太高興。當然對她有點不高興。但不敢直接講。師母都是最低限嘛,對不對。我們的怨氣都發在她身上,真是倒楣。她比我剛強,但是好ever。
2721.51	2749.072	可是我心裡就是一種流放者的心態。我覺得不高興。上帝,禰為什麼這樣子?禰在我身邊帶領跟我所想的不一樣。說啊,我渴望怎麼樣,我渴望怎麼樣。就像那時候一個心態,那時候我有感冒,咳嗽,所以跟師母分房而睡。我晚上咳到她都不能睡。
2750.64	2772.769	那我睡前的話,傳到我都有一個習慣,就是,一定是讀聖經。讀完聖經有空,我還會再讀一些書。讀完聖經,讀完,讀讀完了,心情不好,讀聖經,什麼都讀不進去。那我就再拿一本書,那一本書呢,是師母在神學院,聖光神學院院長,陳其中陳院長寫的一本書。
2774.411	2796.717	意向與領導力。我對這都沒什麼興趣。那時刻我想說,一個領袖,我今天是教會的一個領袖,我要怎麼來看很多的事。他說領袖最重要就是一個僕人保守你的心。就在那個時刻,突然我看到一段經文。
2798.558	2828.384	你要保守你的心,勝過保守一切,因為一生的果孝,由心發出。突然有一個聲音到我的心裡,兒子啊,不要放蕩你自己的心,不要任你的心漂流。上帝的聲音是多麼的溫柔,多麼的慈愛,以至於祂能夠引導我,在人生困頓的這些環境裡面,
2829.462	2849.684	抱怨曲折的過程裡,經歷祂慈善哀訴。神要帶領我們走過高山,經過地苦,
2850.469	2873.611	神要用祂的慈深愛所帶領我們。阿利路亞,在美耶穌基督,我們一起來禱告,再次將我們自己獻在上帝的面前。上帝,說上帝你是慈愛的上帝,你是滿有憐憫的上帝。我不知道親愛的弟兄姊妹,曾經這時候你是有抱怨,或是有苦度,對神的帶領,你覺得無法接受,不能明白。
2874.309	2893.509	上帝禰為什麼在我生命裡面這樣子來工作。哈利路亞。但是親愛的弟兄姊妹。我們一直在上帝的面前。主神我願意蒙禰的引導。我願意讓禰來牽引我的手。我們一起開聲禱告。
2894.07	2911.614	阿蕾路亞,謝謝耶穌基督在美主。阿蕾路亞,我是軟弱,我是歐不醒的。歐主啊,我是常常悲痛悲慘。歐主啊,是的,禰要帶領我們。歐主啊,讓我們走在生命的意義和道路。讓我可以走得更寬闊,更直接,更勇敢。
2911.834	2936.761	阿利路亞,是的,禰要恩待我。是的,是的,是的,禰要這樣的除去我生命。喔,耶穌,是的,禰要在我的生命,喔,在我每一個人,喔,主啊,讓我們看見,順服禰是好的無比,跟從禰是好的無比。主啊,是的,禰要讓我徹徹底底的歸信於禰,徹徹底底的相信禰,相信禰的美善,相信禰的作為。阿利路亞,謝謝主。
2938.507	2965.274	有清白的聲音發出。從最高的山到海洋深處。神的耳裡要唱一首新歌。
2966.749	2995.34	我們神要做心事。舊的事,而已經過去。在基督裡一切都要更新。請禰眼前,請禰一向。請禰故事,請禰方向。
3004.241	3010.385	呼喊,榮耀的主,我願禰來。
3016.971	3044.34	恩要傾倒下來。神國獨的榮耀彰顯。全地都要渴望。吾喊,榮耀的主,我願禰來。神明的恩,團結心的音響。
3045.316	3069.717	禰要所信必是在我們中間。感謝主今天藉由祂的僕人引正傳道將美好的信息釋放在我們當中。真的人生很多事情是這麼的真實是讓我們這麼的不順心這麼失望
3072.363	3099.558	通常想娶這種太太的人都會失望。因為你娶的太太剛好都非常有能力。她也有她自己人生想走。師母以前還沒有嫁給我之前說她的願望就是每天在家裡彈鋼琴等我回家。結婚之後沒有一天是這樣。上帝跟我們之間好像我們也對上帝很多期待。我們會再三的抱怨是因為我們對上帝有期待。
3100.828	3124.789	一次期待,兩次期待,三次期待落空。我們就會開始再三的抱怨,再三的悖逆。但是今天這個經文非常好。它提醒我們,我們要追念上帝的能力。我們常常在追念我們的不順。追念我們所負面的感受。但是我們沒有去追念上帝的能力。
3125.589	3153.691	當我們去追念上帝的能力的時候﹐我們就會經歷到﹐祂的確會用心中的純正牧養我們。祂也的確會用巧妙的手帶領我們。親愛的弟兄姊妹﹐不知道這一段時間裡﹐有沒有人經歷到你生命中﹐跟你期待很不一樣的一個落差﹐可能是你的事業﹐
3154.394	3180.409	可能是你的身體,可能是你的情感,可能是你的婚姻,可能是你的服飾,可能是很多很多讓你失望落空的事。你是否不再相信你的神用純正的心牧養你呢?你是否不再相信祂引導你的手不會出錯,祂的手,原文說是skillful hands,
3180.947	3206.66	充滿技巧的手,奇妙的手在你身上牽引你呢?你有多久沒有追念上帝的能力呢?當我們抱怨太太在家裡不燙衣服的時候,我們應該要更進一步去追念當初為什麼要娶她。當我們在服事的路上遇到困難的時候,我們要追念當初我是如何回應她的護照。
3207.346	3233.515	當我們在所創辦的事業﹐所進入的職場和家庭﹐遇到意想不到的變化的時候﹐我們要追念﹐那時候我是如何與神立約﹐進入這個職場﹐進入這個婚姻﹐進入這個家庭。當我覺得我的孩子的表現﹐不如我願的時候﹐你要去追念﹐當初你是怎麼樣禱告﹐懇求主給你一個孩子﹐能夠來榮耀神。
3234.036	3256.642	我們要追念,懇求主恩待我們,追念祂的能力,就能夠使我們不會落入永遠心思戰場的挫敗,不會一直在那邊抱怨神。好不好,我們再次用這首詩歌來敬拜的時候,懇求主讓我們邊敬拜的時候,邊思念祂的良善,邊思念祂是用純正的心目養我們,
3257.022	3282.631	一邊思念祂是用充滿技巧的手,引領我們每一步的道路。我們要敞開心、敞開心,來信靠祂,來敬拜祂。我哈利路亞求聖靈大大來工作,哈利路亞。信靠祂,祂比山還要高,祂比海還要深,
3283.78	3296.009	不要再抱怨,祂過去能做,今日也能做。你我都在基督裡了,求主打開我的眼睛,再一次經歷祂的牧養,
3312.295	3317.917	新的故事 新的方向。全體都要渴望 呼喊 榮耀的主 我願禰來。
3333.404	3337.688	我願禰來牧羊我。我願禰來帶領我。
3356.664	3381.399	因為那天心裡想,你要做新的事,在我們中間。選舉都要渴望,呼喊,榮耀的主,我願意。
3384.684	3412.162	要展開,恩德傾倒下來,是國度的榮耀彰顯。是你動搖渴望,呼喊,榮耀的主,我願你來。神靈的靈,看見心底下,
3413.097	3431.793	禰要做新的事在我們中間。耶和華,我要追念禰在我生命中所做的奇事。耶穌基督,我要追念禰在十字架上為我成就的救恩。
3432.654	3450.094	聖靈保惠師我要追念禰在我每一個人生軟弱時候。禰對我都不離不棄。我要停止抱怨的口。我的靈要向禰敞開。我要領受從天上來的恩膏。禰過去能做,禰今日也能做。
3450.555	3464.971	你以後也會繼續在做。我要宣告。我要向世人宣告。我的神祂乃是以心中的純正牧養我。我的神祂乃是以巧妙的手帶領我。
3465.572	3489.33	是的主給我不一樣的眼光。不用世人的眼光看你的牧羊。不用世人的眼光看你的帶領。我要宣告我的神是奇妙的神。我的神是守約師慈愛的神。我的神是對我不離不棄的神。祂揀選了我。祂已經揀選了我。
3489.991	3511.11	我屬於祂,祂屬於我,我們永遠不會分開,永遠不會分開。奉耶穌基督的名聲歌,阿們!榮耀的主,我願意來。
3513.268	3528.192	天要散開,誠要傾倒下來。神國獨的榮耀上限。神禰都要渴望吐海。榮耀的主,我願禰來。
3535.35	3546.398	聖兵的靈,看見新的像。請要做新的事,在我們中間。