start	end	text
2112.295	2131.243	各位姊妹我們一起同聲來禱告。你可以自己來到神的面前,把自己帶到神的面前來禱告。求聖靈來張冠你,驅走你心裡一切的下塵、誤會。那一切對你而言是攔住你,更可以專注在神的面前的。這樣一切的事物是重擔的。
2133.49	2149.149	是環境的。都帶到神的面前。求神翻倒。求神推倒祂。求神驅逐那一切。攔阻你。來到聖殿。要來敬拜神的那一切的攔阻。我們同聲開口來禱告。
2150.435	2155.057	主啊 主啊 主啊 主啊 主啊 主啊 主啊 主啊 主啊 主啊 主啊
2173.524	2197.294	主啊,我們要挪走我們的生命裡面。主啊,那一切要更深的來認識禰的藍珠。主耶穌主啊,一切的下塵。主啊,那一切。主啊,一切的困擾、困難。主啊,幫助我們挪去我們的眼目。定靜在禰的身上,而不是定靜在環境的身上。主啊,求主禰幫助我們。主啊,讓我們再一次來,來到禰聖人寶座的面前。主啊,是的。主啊。
2197.534	2212.444	主啊,你要建立,你要建造,而且超乎我們所求所想。主啊,那46年,主啊,你三天就要重建起來。主啊,你是死裡復活的大能。主啊,你死裡復活的大能要在我們的生命裡面,
2212.824	2229.223	主啊,謝謝你。主啊,你要親自來帶領我們。主啊,幫助我們經歷我們生命裡面的豐盛。主啊,經歷我們生命當中的雙贏。主啊,我們不只是主啊,我們不只是主啊,我們要屬靈生命的興盛。主啊,我們期待主啊,你從天上各樣的賜福。
2229.804	2231.626	繁體中文，臺灣國語。繁體中文，臺灣國語。
2248.865	2276.407	主啊 主啊 主啊 主啊 主啊 主啊 主啊 主啊 主啊 主啊 主啊 主啊 主啊 主啊 主啊 主啊 主啊 主啊 主啊 主啊 主啊 主啊 主啊 主啊 主啊 主啊 主啊 主啊 主啊 主啊 主啊 主啊 主啊 主啊 主啊 主啊 主啊 主啊 主啊 主啊 主啊 主啊 主啊 主啊 主啊 主啊 主啊 主啊 主啊 主啊 主啊 主啊 主啊 主啊 主啊 主啊 主啊 主啊 主啊 主啊 主啊 主啊 主啊 主啊 主啊 主啊 主啊 主啊 主啊 主啊 主啊 主啊 主啊 主啊 主啊
2280.213	2281.44	我們一起比倍的同胞。