start	end	text
0.009	17.788	今天很多人遇到我講的話不超過兩種事情第一個就是講話慢一點第二個就是叫我不要緊張我不緊張
18.575	37.96	假的吧,怎麼可能不緊張,是嗎?OK,很高興來到這裡,可以跟大家一起來分享,今天我們研經的進度已經到了詩篇,今天要分享詩篇的七十三篇。好不好,在,請招待可以把聖經發下來嗎?我們要一起來誦讀詩篇第七十三篇。
61.834	89.743	好,如果你翻到詩篇記三篇的話,我們就要一起來念。好,神實在恩待,一起來,請。神實在恩待以色列那些清新的人。至於我,我的腳幾乎失閃,我的步伐險些走偏。因為我嫉妒狂傲的人,我看見二人想平安,他們的力氣強壯,他們死的時候也沒有疼痛。
90.503	118.554	他們不像別人受苦﹐也不像別人招災﹐所以驕傲如鏈子﹐戴在他們相上﹐殘暴像衣裳覆蓋在他們身上﹐他們的眼睛因體胖而突出﹐他們的內心放任不羈﹐他們績效人憑惡意說欺壓人的話﹐他們說話自高﹐他們的口褻瀆上天﹐他們的舍毀謗全地﹐
119.172	139.507	所以祂的百姓歸到這裡享受滿杯的水。他們說,神者能曉得,至高者哪會知道呢?看啊,這就是惡人,他們常想安逸,財寶真多。我實在突然竭盡了我的心,突然洗手錶明我的無辜。
140.06	169.783	因為我終日遭災難﹐每日早晨受懲治。我若說我要這樣講﹐就是愧對這世代的眾兒女了。我思索要明白這事﹐眼看實際為難﹐直到我進了神的聖所﹐思想他們的結局﹐你實在把他們安放在滑地﹐使他們跌倒滅亡﹐他們轉眼之間成了何等荒涼﹐他們被驚恐滅盡了。
170.043	193.38	人睡醒了,怎樣看夢?主啊,你醒了,也必照樣親看他們的影像。因此,我心裡苦惱,肺腑被刺。我這樣愚昧無知,在你面前如同畜生。然而,我常與你同在。你攙扶我的右手,你要以你的訓言引導我。以後,你必接我到榮耀裡。
194.121	201.401	除你以外﹐在天上我有誰呢?除你以外﹐在地上我也沒有所愛慕的。
202.125	204.407	好,我們先一起來做個禱告。
232.602	232.902	阿們﹗
262.295	283.653	詩篇七十三篇呢,在它的一開始就提到了就是雅莎的詩。那我這邊要稍微介紹一下雅莎是誰。她是在大魏王國時期呢,她所選派的一個敬拜領袖,來負責所有的崇拜事務,音樂的崇拜事務。其實她就相當於就好像教會的敬拜團,我們的團長琪琪跟Poi夫婦,他們所
283.933	310.855	但他們要負責的是整個以色列人的敬拜。亞撒是一個很重要、很核心的敬拜領袖,在聖殿中從事歌唱的工作,他也做此寫曲。今天我們就要透過詩篇第七三篇,這個敬拜領袖所作的詩歌來一同經歷他的困境,然後看他是怎麼回到神的面前,然後仍然宣告神的信實,然後大大敬拜神。
311.476	334.949	我們看到那個在73篇第一節,祂說,神實在恩待以色列那些清新的人,可是一到第二節的時候,突然話鋒一轉,至於我,我的腳幾乎是山,我的步伐險些走偏。後面從第三節一直到第12節,祂都在描述,那個時代惡人啊,惡人的興盛繁盛,惡人的狂傲,惡人不敬畏。
336.852	366.088	這是詩人正在面對的處境,可是他卻在他第一句,他先這樣宣告,神實在恩待以色列那些清新的人,但至於我,我的腳,因為看見這些惡者的,惡人的所作所為,我的腳幾乎失散,我的步伐也險些走偏。到底是什麼那個處境,作者在寫這篇詩篇。你還記得詩篇第一篇講什麼嗎?
367.261	394.793	我念給大家聽。不從惡人的計謀﹐不站罪人的道路﹐不坐獻慢人的座位﹐維持愛耶和華的律法﹐奏也思想他的律法﹐這人便為有福﹐他要像一棵樹﹐栽在溪水旁﹐按時候結果指﹐葉子也不枯乾﹐凡他所作的盡都順利。可是來到這裡﹐完全不是如此。惡人像一棵樹﹐栽在溪水旁﹐按時候結果指﹐葉子也不枯乾﹐凡他所作的盡都順利。
395.64	414.775	往下講,反而藝人並不是這樣,卻像康比被風吹散。因此當審判的時候,不敢再講下去了。詩篇這個作者所面對的處境,跟詩篇第一篇智慧師所描述的情景,完全不一樣,太痛苦了。
416.766	444.573	可是相較於,詩篇是詩人創作出來,也是成為敬拜詩歌的一種,你知道嗎?可是相較於我們現在常常在敬拜當中唱的流行的福音詩歌,可是很少聽到這樣的歌詞對不對?這麼真實的痛苦的彈針,你看那些惡人的作為啊,你看那些惡人的心腎所作所為啊,真是你難道不做什麼事情嗎?
445.759	468.852	我換一下現代的歌詞好了。如果在敬拜當中我們這樣唱好了。你不好,你不好,真不好。怎麼樣?先來首輕快的好了。耶穌對我不好,耶穌對我不好,耶穌。
470.265	490.941	他對我真的不好。真實表達嘛,對不對?就是那邊哭一團,有沒有?然後這邊,圍玉圈那邊抱怨埋怨。就是崔兄,你知道,真實,十人奪真實的表達。他面對的處境,現在就不是這樣嘛。真不好,太不好了。
492.517	519.982	回到那第一節,神實在恩待以色列那些清新的人,現在聽起來好像是一個大大的問號,神實在恩待以色列那些清新的人嗎?或者,神啊,禰實在記得禰要恩待以色列那些清新的人嗎?你聽出第一節跟第二節的矛盾嗎?
524.292	530.533	有一年暑假,正在籌備暑期短宣。那時候一輪傳道還在我們當中,
531.664	555.509	然後我也正面臨華晨的期末的壓力。可能很多人不認識一輪傳道﹐它的生態特別的健康以及發達。在期末的壓力﹐期末考的壓力﹐以及要籌備暑假的短宣﹐然後他常常坐在我的左邊﹐我常常會覺得我這邊嗡嗡叫﹐你知道嗎﹐就太大聲﹐感謝神的保守﹐一切平安。
556.169	569.33	那天,就有一天晚上,我事情太多,我覺得我必須要繼續留下來把事情弄完,包括我學校的東西。所以我決定出去先吃個晚餐,然後再回來完成我要做的事情。
570.776	597.385	一通電話就從臺中打過來,是我大妹打電話過來。電話中就是哭哭啼啼的,快點禱告,快點禱告。因為爸爸媽媽跟他的小女兒,因為那時候小女兒在爸爸媽媽帶,在臺東車禍了。然後現在什麼事情都不曉得,也視覺都不曉得,可是快點禱告。我也嘗試想要打電話回去,可是結果都是盲線中。電話一完畢,我的飯來了。
598.695	626.172	我面臨一個掙扎,除了我肚子餓,跟這個壞消息,我到底要不要吃下去,你知道?另外一個掙扎是,哇!就算不像詩篇講的,我晝夜思想耶和華的律法好了,我起碼也是晝夜思想你的工作,不是嗎?現在是,要不要聊聊?裡面充滿了很多的掙扎,那個懷疑的種子就,
627.466	639.716	就在裡面,那個華語的笑,就要開始發生,要開始散發出來。沒敢講出來,我沒有詩篇做得這麼有尬詞。
644.821	670.111	詩篇的作者在面對那個世代,詩篇七十三篇的成文日期,大約是在南國滅亡、被辱的時期。所以詩者在面對一個國父家亡的處境,你可以體會。所以他真實的坦承他裡面的痛苦、掙扎,詩篇所講的那個一人必蒙福,現在全然不是如此。
671.169	696.384	而我在這個現在,領受神的呼召,投入學生的工作,努力,可是面對突來這樣的意外,然後產生的懷疑跟掙扎。在我裡面,弟兄姊妹你呢,無論你跟隨神的引導,或領受從聖而來的呼召,在這個階段可能成為父母。
698.183	726.29	可能在職場你領受了一個異象。一個你的參與在教會的服侍當中是一個很和絃的童工。甚至你現在這個階段就是神要好好的要你當好一個學生。無論如何,但是當你盡心擺上付出努力的時候,可是一面對大環境的衝擊改變,比如說最近大環境改變一直對家庭的價值有極大的衝擊,對父母來說也有很多掙扎,不是嗎?
727.022	751.756	各樣的不景氣﹐各樣生命情況的不順遂﹐挫敗感﹐是不是在那個過程當中﹐也讓你像作者一樣﹐也讓你同我一樣﹐也有那種感受﹐好像說﹐神啊﹐是啦﹐你實在恩待﹐以色列那些親信的人﹐但是我出外﹐因為我快跌倒了﹐
753.814	781.431	神,是的確你實在恩待以色列那些親信的人,但是現在這個情況我實在不瞭解,所以除我以外,因為我快要跌倒。耶穌對我不好,真的不好。隨便繼續寫下去,在第一十三節,主子到了一個地步,他說,
782.773	805.807	我實在突然接近了我的心, 突然攜手錶明我的無辜,因為我終日遭災難,每日早晨受懲治。做著面對這樣國不家亡的事實, 面對裡面信仰的衝突,每天日復一日這樣打擊他,我相信沒有什麼災害 比這個懲罰更嚴重,對不對?
806.886	820.591	對我來說也是當那個懷疑的笑在裡面發生的時候我每天這樣投入忙碌的時候那個笑也在打擊我每一天每一天我都要重複的知道我裡面有個笑是懷疑是不信任
823.729	850.781	雖然走到了一個地步﹐他由心深處﹐他這樣發生﹐一切都是突然﹐我的確走到了一個生命的底﹐我完全束手無策﹐我所做的都是突然的。我不曉得你身邊有沒有原住民的朋友﹐常常常常會講到底﹐到底﹐講什麼都可以講到﹐你不要吃飯﹐到底﹐後來有一個破解版﹐你聽到原住民說到底﹐你說轉彎啊﹐
852.551	878.324	你到底就轉彎嘛,你只會撞到啊,到底。弟兄姊妹,但是如果當你一旦浸泡在那個苦毒裡面,那個埋怨裡面的時候,靠自己絕對轉不出去的啦。你就算到底你也轉不出彎啊,轉不出去。
880.06	906.939	我剛剛分享到那個事件,種下的那個華語的種子在我裡面,慢慢的發酵。根據英國研究報告,盲鹿是治療華語的最好解藥。所以,當華語不斷擴散的時候,你就持續的盲鹿。當華語的種子不斷蒙上的時候,你就投入持續的盲鹿。我的性格,maybe也是大部分人類的經驗,不是嗎?
909.087	938.423	金錢的外表,熱心的宗教行為,不能夠把我帶到生命的出口。阿們。裡面的掙扎,浮世當中那個挫折的那個累積,挫敗的那個累積,不斷的讓那個懷疑的聲音,不斷的放大。當,當,當。到最後,你不單單懷疑的是神,更懷疑的是自己。我懷疑這真的是我的護照嗎?
940.623	968.204	我懷疑我到底是不是那個對的人。很可怕。當我不想聽到那個聲音的時候,就是不斷地忙碌。我不想聽到。有一次在學生墓區聚會完,我真的覺得那天的講道真的是爛到爆。不只爛到爆,還爆到爛,你知道?太沮喪了,怎麼可以這麼爛?
969.787	988.893	我就一個人坐在大堂,我就看著十字架,你確定嗎?懷疑,極度的懷疑,我真的是那個對的人,極度懷疑我自己。
990.981	1015.76	那時候在禱告的時候,我已經可以把燈都關掉,只剩下十字架的燈,可是外面就是一直有人在敲門。我在想,我難得呈現這麼熟練的狀態,有個人想要安靜,大概持續了二、三分鐘,我在那邊發呆,他就持續在那邊敲敲敲敲敲敲,我受不了,我就到門口。就是一個年長的會友,他也是學青的家屬。
1016.817	1044.425	一開門,我還沒來的這些話﹖他就開始說了一大堆﹖我認識你﹖講臺語﹖你很高﹖你講話很好笑﹖你講話真的很有趣﹖學生都聽你講話﹖你對學生都很好﹖講話真的很好笑﹖你長得也﹖
1049.94	1077.488	這個我完全沒有辦法接話,特別在一個非常爛到爆爆到爛的一個福祉的經驗之後,我一直在想,現在是怎樣?現在是怎樣?你是要來鼓勵我嗎?那個阿嬤將近講反覆同樣的話,講快三十分鐘。快三十分鐘,我真的就站在那邊。
1080.759	1110.03	可是我裡面是這樣,我這個人其實不需要有人跟我說謝謝,真的。就是,我做事不是為了要,我不會想,你跟我說謝謝,我並不會覺得那不是我的愛的語言,應該這樣說,對,那不是我的愛的語言。所以,我說這個不是我現在需要的啊,神,可是你現在這樣,好,我也是可以接受,可是三十分鐘都反覆,你知道嗎?對嘛,是不是?也是滿痛苦的,你知道?
1115.845	1140.668	這樣的服侍的情況還是會發生。最近我就跟我的童工用玩笑的口語調侃我自己,就是到底還要不要繼續服侍啊?還是我就回臺東種田好了?打電話給臺東的爸媽說,我們回去,我回去種田。跟童工這樣分享,無論是朋友或是童工,他們都不約而同,回答都差不多,你會嗎?
1142.875	1165.622	啊,你是會種田是不是?啊,對,我好像也不是會種田,翻聖經。交朋友要小心啊。裡面是真的很掙扎。可是服事還是照往啊。還是要照場,每個禮拜六還是照場,學生還是很多。
1167.312	1194.112	但是裡面的掙扎,突然還有另外的感覺就是,愧疚啊。我裡面自己懷疑的,我到底怎麼教導我的孩子,我的年輕人。當他們面對相當的情況,情況在同樣的處境的時候,我到底怎麼樣告訴他們,你要信靠你的神,因為神實在恩待那些尋求祂的人。太難了,這怎麼牧養。這是我的處境,弟兄姊妹你呢?
1195.196	1216.545	回到我剛剛提到的,無人賽現在這個階段,身為父母,老師,領袖,在職場,一個領導者,學生,甚至神差派你前往的合場。可是當你面對那個信仰、理念、價值衝突的時候,
1218.456	1243.324	你是不是也陷入到這樣的情況裡面,甚至從懷疑神道懷疑你自己,甚至就跟那些變化妥協了,我到底要不要繼續這樣堅持家庭的價值,或者這樣的價值,那樣的價值,好難啊。十字節說,
1245.759	1271.507	詩篇他說,直到我進了神的聖所,思想他們的結局。後面畫風又變了。你實在把他們安放在滑地,使他們跌倒滅亡。我看到這邊是一個很大的問號。直到詩人進到神的聖所,思想他們的結局,後面就突然好像回到詩篇的那個信號一樣。這個轉變到底是什麼?
1274.411	1283.506	不曉得弟兄姊妹還記不記得當莊牧師在前陣子分享約拿書的時候進到第二章的時候約拿被吞到大魚的肚子裡面
1284.36	1310.958	可是當他在大禹的肚子裡面的時候﹐他博學多文﹐對聖經﹐對詩篇﹐對﹐他信守年來的﹐他就成為他的華麗美麗的導詞。可是在那個導詞當中﹐有一個很重要的議題是聖典。可是如果你再次去看約拿書的時候﹐順著那個脈絡﹐那個時候,約拿真正應該要﹐面對的是悔改,而不是聖典。
1314.241	1342.528	七十三面的詩人,七十三面的作者,即便進到了聖所,他還是在思想那些惡人的結局。會不會連詩人都帶著假議題進到神的聖所裡面。我也這樣思考我的生命,是不是此時此刻,這段時間,我的掙扎,我裡面那個苦讀,那個埋怨,其實也只是個假議題。
1344.582	1370.468	或許我生命當中那個載體﹐是能力不夠﹐資格不符﹐因為我看到的是﹐我在浮世當中﹐累積的挫敗﹐也可能是﹐人的眼光﹐因為我沒有辦法滿足﹐我想要滿足的﹐別人的期待。在學生幕區﹐我有這樣分享﹐我雖然這樣分享﹐可是原來我其實沒有做到﹐有一天我非常愛的年輕人﹐
1372.534	1382.43	他在小組分享的時候,他就說,唉,曾勛旺、曾鈞哥﹗曾勛旺、感納﹗可以像藝卓哥一樣﹗可以帶我們出去打球。
1387.5	1414.018	然後我就回應他。雖然我身為一個原住民,運動不行。但是,我覺得我不需要滿足所有人的期待。你要找打球,找一組歌。聊其他東西,可以找我。可是打球,我雖然沒有辦法滿足你的期待,我一點都不覺得怎麼樣。
1415.538	1443.327	可是實際好像並不是如此。他在意要滿足我沒有辦法滿足的期待。這是我裡面的埋怨。好像身為一個傳道人,你除了要會談感情,除了要會談課業,除了要會談未來,就是你所有都要包的樣子,我好像所有都必須滿足一樣。可是我知道我裡面有一個很深的埋怨,我知道我沒有辦法滿足這一切。所以這一切好像也成為我生命的另外一個假議題。
1445.572	1473.665	我剛說到那個年長者跟我說了謝謝,那對我真的打不到我的心裡面,因為我真的覺得我不需要有人對我說謝謝。可是在有一次我跟一個屬靈的長輩再次跟我跟他聊到我目前的生命的困境的時候,他的孩子也在學生墓區,他就代替他的孩子,跟我道歉,跟我說謝謝。我不曉得你家裡有沒有國高中的孩子,頭疼啊。
1475.708	1501.732	頭疼啊,對。佩服你們,你們可以一個禮拜跟他們相處在一起。我一個人,我只有禮拜六,下午,大概四、五個小時,我就已經覺得,天啊主啊,你快點接我上去吧,快。沒那麼嚴重啦,他們真的很可愛,對。那個長輩這樣,呃,代替他的孩子,跟我說謝謝。
1503.012	1530.575	然後告訴我說,你還是要回到水面前,回到你的護照裡面。其實我也不曉得,同樣在說謝謝,同樣做這樣的場景,可是那當下我,哭了出來。我裡面有OS,你是靠傻的,就是,你在哭什麼啊?有什麼好哭的?哭一回啊,不是。哭,就是同樣說謝謝,各位不懂我為什麼要哭。
1531.561	1556.179	我就帶著那個問號,那個疑問,一直回到家裡面。那個感動到,我回到家吃晚餐的時候都,就是還想要再吐臭氣,你知道嗎?我就想到,怎麼樣?就是為什麼?到底,今天下午到底發生了什麼事情?神光照我。
1558.2	1585.392	就好像那個屬靈長輩給我的提醒,回到那個源頭,回到那個護照的起點,回到神面前,這不是你的生命到底轉彎的技術問題,它是一個向度的問題,在不同的層次思考的問題,不是水平面層次的問題。當你陷入在那個,那個,那個,挫敗,那個,苦讀裡面的時候,你就只有那個眼光,所以不是轉彎的技術問題,而是向度的問題,你必須被神提起來,
1587.108	1598.675	回到神的面前。神光照提升,願意回到祂面前的人。我現在的確可以很肯定的這樣說,
1600.009	1616.736	神對我的呼召,現在仍然﹐帶給我極大的震撼﹐以及我全人全天的降服。因為在那天晚上﹐當他對我說﹐去愛那個不能愛的人﹐去愛那個不能感受愛的人時候﹐那個當下我早就知道﹐這個代價非常的大。
1617.176	1645.34	並不是我遇到那個懷疑的時候,並不是因為我遇到服侍的挫敗的時候,代價才發生。不,那個時候,神清清楚楚就讓我感受到,這個代價非常的大。我甚至那個時候,我回想到這個源頭,我都清清楚楚的記得,我回答神說,主啊,這太不容易,因為這兩種人都是我。要付上很大的代價,去愛那個不能愛的人,去愛那個不能夠感受愛的人,太難了。
1646.135	1674.877	因為我太瞭解我自己,可是我願意,我這樣回答我的事。一切都很清晰,不是因為這個過程,大家才加上來。回到那個起點,回到那個源頭,那個力量從我裡面發生。那個護照,那個意象,不再添加別人的期待。
1677.278	1706.745	那個異象呼召不再掛著挫敗,因為我得勝的君王與我同在,我的能力在乎他,我的能力來自於他。把那些東西都剝掉,把那些東西都拉掉。二十五節,二十六節,除你以外,在天上我有誰呢?除你以外,在地上我也沒有所愛慕的。
1707.824	1727.525	我的肉體和我的心常衰殘,但神是我心裡的力量,又是我的福分直到永遠。我的肉體、我的心腸都會衰殘。同樣我面對的這些困境,神說天地都會廢去,可是祂的信實不改變。
1730.896	1747.511	我們面對的這些困境,在神那根古直到永遠不改變的信使裡面,就如同詩篇二十節裡面,人睡醒了怎樣看夢主啊,你醒了也必照樣親看祂們的影像,過往雲煙啊。
1749.548	1764.999	但是在困境當中,似乎在永恆的短暫在這兩個選擇裡面,人卻常常受困,被那短暫的擄獲。回到
1767.073	1784.265	那個起點回到那個源頭回到那個呼召你的神的所在你會重新得力你會重新得力十篇經三篇
1786.34	1800.122	在神的引導下面﹐從那挫敗裡面﹐抬頭仰望﹐轉換向度﹐思考他神的信實。看見詩篇一篇所講到的那個智慧﹐同樣不改變。
1802.261	1827.503	那個感動現在也在我身上,盼望也在今天所聆聽的,聆聽這篇信息的每一個弟兄姊妹身上。無論你再怎麼樣的負,你正在面對什麼樣的困境,你遇到什麼樣的挫敗,偏離了,腳失閃了,回到神的面前,這是向度的問題。
1828.643	1843.241	不要停留在那個苦讀埋怨的水瓶層次裡面。願神祝福聆聽的每一個人。我們一起來禱告。全聖的神,我們向禰來禱告,向禰來仰望,
1845.043	1867.299	你才是我的神。這短暫,這生命的困頓,窘境,不是我的神。他們也不能夠取代你在呼召我時所賜給我的意向,所給我的命令,所指引的方向。主要甚至沒有任何一件事情可以覆蓋家天在其上。
1868.08	1884.149	主啊﹐我的腳﹐成﹐顯些施展﹐跌倒﹐但是現在﹐我回到你的面前﹐我進到你的同在﹐進入到你的同在裡面﹐盼望你提升我們﹐
1884.889	1910.019	提升我們。提升我。提升我。主讓我再次回到那個源頭。就是那力量的來源裡面。就是你。你就是我的福分。直到永遠。主讚美你。禱告是奉靠耶穌基督的名。阿們。好不好。邀請弟兄姊妹一起起立。站立在神的面前。我們一起用這首詩歌。來回應我們的神。
1911.817	1940.805	耶穌為你而生,為你而死,祂要賜給你新生命。但是當你一旦迷失而入,迷了路,徬徨了,你要回到祂裡面,在祂裡面,那個像度是不一樣的,祂要把你提起來,再次回到那個原點,叫你重新得力,看清楚你的護照,你的意向,你的職份。好不好,我們請我們這位師哥,來回我們的神。
1942.773	1971.955	我們從頭來敬拜我們的神。這世上有誰能夠像禰?禰的愛與肉美無之際。世上無一事無的相比。唯有耶穌禰能滿出我心。
1973.404	1977.326	第三回祝你是我生命的翅膀。
2002.722	2017.875	祝你是我生命的翅膀。我軟弱是你充滿憐憫。從一切錯誤當中拯救我。
2023.285	2035.712	賜給我未來的新生命。禰同在 如天堂。祝禰同在 祝禰同在。禰同在 如天堂。
2050.247	2060.376	我們一起來思想。繁體中文，我們一起來思想。我們一起來思想。
2080.538	2100.614	呼求耶穌的名。哦 耶穌 哦 耶穌。你同在入天堂降臨。哦 耶穌 哦 耶穌。
2108.677	2119.383	你同在如天堂降臨,哦耶穌,哦耶穌。你同在如天堂降臨,哦耶穌。
2129.582	2155.97	喔 耶穌。禰同在入天堂降臨。我願用一生。我願用一生年日等待。直到那日與禰面對面。
2160.52	2175.584	世上無一世無難相比,唯有耶穌禰能滿足我心。世上無一世無難相比,
2180.862	2193.485	唯有耶穌禰能滿足我心。唯有耶穌禰能滿足我心。禰同在如天堂,
2204.565	2233.719	將你 握住同在 握住同在你同在 如天堂將你 握住同在 信任你的同在你同在 如天堂將你
2236.852	2241.155	好不好一起開口來禱告。
2251.288	2271.055	把你自己交給護照你的神,再次回到那護照的起點,回到那護照的源頭。回到那護照的起點,回到那護照的源頭。無論是成為父母,職場的領導,無論是學生,你都得回到神的面前。
2271.937	2293.587	清楚我們的意象。清楚我們的服裝。清楚知道。神在你生命當中的計畫。不加添其他東西。不加添憂慮。不加添憂慮。不加添囚犯。不加添懷疑。不加添懷疑。主唯有你。主唯有你。主唯有你。唯有你。回到你面前。回到你面前。主在每一天。
2303.336	2312.905	Oh 耶穌。Oh 耶穌。Oh 耶穌。禰同在入天堂降臨。Oh 耶穌。Oh 耶穌。
2331.664	2336.027	你同在入天堂降臨。你同在入天堂降臨。
2349.275	2363.491	噢 耶穌 噢 耶穌 禰同在入天堂降臨。
2367.79	2383.399	全天使我們向禰呼求﹐再一次吸引我們的心﹐我們的腳步﹐進入到禰的同在﹐主啊﹐禰的同在﹐就如天堂降臨﹐再一次在我的生命當中復興我﹐在我生命當中彰全﹐
2383.899	2406.931	主啊,唯有回到禰。主啊,那意象,那護照,那職份才清晰。不加一切憂慮,懷疑,擔憂。主啊,唯有禰,唯有禰,關乎。主啊,一切都只是關乎禰。主啊,我生命的議題不要再讓其他假議題來取代。叫我擔憂,叫我分心分勞。主啊,一切的真議題都關乎禰。
2407.551	2431.433	以禰為中心。禰就是我生命的課題。尋求禰,尋求禰走在禰的道路上面。主讚美禰,主讚美禰。這是我們的敬拜,我們的禱告。願禰祝福,願禰加添。主要在場每一個弟兄姊妹,再次回到祂的職份裡面,回到合唱裡面的時候,試著帶著肯定,帶著信心,回答神實在,
2431.613	2434.475	給我們前面請坐。