start	end	text
2596.135	2623.546	最後耶穌復活不見的時候,他們說,啊,祂跟我們講道的時候,我們心裡豈不是火熱的嗎?所以門徒遇見了復活的主。每每我看到這個事,我心裡就想,主啊,我再怎麼低潮,你就是那位向一馬五師顯現的門徒的主,也向我顯現。耶穌主動的彰顯。
2625.623	2649.072	耶穌哭了。現在弟兄姊妹,我們覺得我們受苦,我們很難過。其實耶穌完全瞭解,人的軟弱,瑪利亞的痛苦,馬大的絕望、失望。耶穌都難過,心裡又哀嘆。這是真實的光景。
2651.049	2680.761	我們走這條復活的路是這位主與我們同走。你不要以為你一個人在受苦。其實這位主就在你的旁邊。祂跟你一樣在忍耐著那復活的榮耀在我們當中沖洗。到了時機,這位復活的主就說話,來到拉撒勒門口說,把石頭滾開,
2682.892	2691.737	這是耶穌整個事奉的最高潮。
2704.206	2730.323	然後我們繼續看小禮章就知道,因此很多的人就來到這邊,要來求見耶穌。信心的人要來求見耶穌。哇,門徒這回拽了。我們老師現在被尊榮。耶穌說了什麼?一粒麥子若不在地裡死了,人就死了。人子得榮耀的時刻到了。耶穌被洗了,洗盡膏。所以讓我們看見,
2733.268	2761.965	看見這位主這樣的復活,祂為了帶下更深的意義。但我今天要說一件事情,是我們最大的難處。你的難處不在復活,復活就沒事了。你的難處在什麼?掙扎裡面。
2765.503	2789.424	因為耶穌的思維跟你我的思維怎麼樣?Totally different,完全的不同。我們的眼光跟耶穌的眼光差太多。我們活在現在,怎麼可能照我看祂必死無疑,怎麼可能活過來?這是你我的視野,你我的視線。
2790.691	2815.624	但是耶穌的眼光,他是看見上帝的作為和旨意、心意。他就是活在眼光裡。白日十二小時,這不是真的在白日,白日人家打你還容易。白日行走有光,不會跌倒,那不是因為太陽照,所以不會跌倒。
2816.971	2843.885	乃是說,耶穌是行在什麼?日光,行在光中,就不擔心不害怕。你我可能行在黑夜裡面,就會跌倒。怎麼能夠看到復活的掙扎呢?這是馬達跟瑪利亞跟耶穌的對話。顯出他們之間,他們心裡的矛盾和痛苦。
2844.582	2872.391	知道復活,知道怎麼樣,耶穌你落在,你也可以醒。親愛的弟兄姊妹,這正是我們的寫照。當你碰到一個難處的時候,你裡面一定有兩種不同的聲音在向你回首。一種,現實的聲音。另外一種,上帝的
2873.626	2901.532	對你的一個護照跟缺取。上帝曾經對你說,孩子,我要在你身上,這是我對你的護照要成就的。你說上帝照我的眼睛看來,哎呀,搞了半天搞不出名目,難處非常的多,不可能越過。
2904.138	2928.668	不可能,會噴笑,死了。但是另外一個聲音又再告訴你說,孩子,你若信,孩子,你要相信,孩子,我真的會幫助你,這就是你的生命。假如你不是活在那個真傻的裡面,
2931.732	2961.017	你並不能夠瞭解真正一個生命普遍的過程。耶穌在我們的生命裡面就是復活的掙扎。耶穌的對話跟你的對話。如何經歷復活我不講。時間的關係。也許你會說
2962.534	2988.683	復活我如何經歷。但是親愛的弟兄姊妹復活是上帝主動上帝的恩典你我實在是一個承受恩典之人但是中間有一個關鍵什麼關鍵呢?耶穌對馬達說的話
2991.971	3019.707	你要持續的,怎麼樣?你若信,就必看見神的榮耀。關鍵,你能信嗎?你持續的信嗎?你真正深深的信嗎?你還要再一次的求神幫助你信嗎?這是信心的道路。
3023.029	3051.311	在我們的生命當中,我們一直在操練這樣的信心的功課。但是親愛的弟兄姊妹,信是臺灣。當我們信了以後,我們願意說,主,每一天你是復活的主。我需要你復活的恩典在我身上彰顯。
3053.643	3080.716	禱告,願意親近上帝。你一到了神的面前,神就會按著祂的時間,分賜祂的糧食給你,讓你能夠走上這條道路。要盡到我的結論,復活是你我一生的功課,
3082.483	3109.416	我們一生都要學這樣的事情。親愛的弟兄姊妹,請你一起來。我們在神的面前,你對神失望嗎?
3111.527	3137.218	這位復活的主,在你的生命裡面,你不對祂抱著期待嗎?不是你正在 struggle 掙扎的理念。但這位主,祂要鼓勵我們,我們在生命的道路裡面,說,神啊,我要一起與你一同復活。
3138.814	3167.78	我仍然在沒有信心的時候,因信仍然有信心。就像亞伯拉罕一樣,雖然在環境,因信仍然有指望。這就是我們的生命。我們跟神禱告。今天求神把復活的信心,釋在我們當中。
3169.565	3184.482	我們同聲來禱告。謝謝耶穌。知道我們是軟弱的。知道主啊是你。主啊是的在今天造成你提升我們。提拔我們。
3185.964	3202.191	主耶穌謝謝禰。今天主要奉耶穌基督的名。主啊是的每一個人都要像枯骨從死裡復活一樣。都要活過來。聖靈的風要吹在我們的生命裡面。讓我們每一個人都真正知道。
3202.671	3230.379	真正知道。主啊,主啊,主啊,有信心。不是沒有信心,有信承受禰的允許。把那個恩典,對你信靠的信心,加在我們每一個人當中。主,謝謝你。今天主,復活信心的能力,信心要催在我們當中。奉耶穌基督的名,大大地在我們當中彰顯。謝謝耶穌,你把你的恩典環繞,叫我們裡面的
3232.039	3242.63	牙齒在我們裡面能夠活出來。我們的信心的恩典能夠活出來。謝謝主。我們來唱這首詩歌。