start	end	text
0.418	3.559	OK,好,我們一起來翻開聖經。
3.559	4.999	我們一起來翻開聖經。
4.999	10.240	我們同樣進到,我們來一起來看馬可福音。
10.240	20.262	我們一同來翻開馬可福音的第十二章。
20.262	23.283	OK,好,我們一起來翻開馬可福音的第十二章。
23.283	25.543	如果你沒有聖經的,你可以舉一下你的手。
25.543	28.224	我們請招待拿給你,馬可福音的第十二章。
28.814	65.733	我們今天已經進到馬可福音,我們來念馬可福音,第十二章十三到十七節,十三到十七節,馬可福音十二章十三到十七節,感謝主,我的時間已經快到了,來,來,好,我們一起來念十三到十七節,翻到了一起來念,大聲的來念,預備,來,他們打發幾個法利賽人和幾個希律黨的人到耶穌那裡, 夫子,我們知道你是誠實的。
65.733	74.795	什麼人你都不尋情面,因為你不看人的外貌,乃是誠誠實實傳神的道。
74.795	78.296	納稅給凱撒,可以不可以?
78.296	80.357	我們該不該納?
80.357	84.498	耶穌知道他們的假意。
84.498	88.619	你們為什麼試探我,拿一個銀錢來給我看?
95.026	97.407	他們說是凱撒的。
97.407	103.751	耶穌說凱撒的物當歸給凱撒,神的物當歸給神。
103.751	105.992	他們就很稀奇祂。
105.992	107.233	我們一起來禱告。
107.233	119.260	主我們一起來到祢面前來敬拜祢,求祢使用今天的這段經文,馬可福音第12章,祢來對我們說話,讓我們領受了祢的道,我們的心裡好像好土一樣。
119.633	119.733	阿們!
149.087	153.190	好,為了讓你們醒過來,我講一件,講一個笑話。
153.190	158.714	我記得我剛到教會去的時候啊,剛到教會去的時候,有一件事情滿困擾我的。
158.714	169.665	就是我那個教會其實非常的傳統,那個教會就是,一定有一個左邊的門, 跟一個右邊的門,進去之後男生只能坐左邊,女生只能坐右邊。
169.665	171.526	沒有規定,可是大部分都這樣。
171.526	176.588	這個我都不會覺得太訝異,因為想說教會是蠻傳統的地方。
176.588	181.730	可是有一件事情我忍了很久,我才問教會的牧師。
181.730	188.093	就是那個教會,左邊的門跟右邊的門出去,中間有一個箱子。
188.093	191.194	那個時候我不曉得那個箱子要做什麼的。
191.194	196.170	那個箱子上面寫了幾個字, 寫了哪幾個字呢?
196.170	200.040	叫做當歸給耶和華。
200.040	200.982	OK,我就想了很久。
201.578	204.080	這跟當歸有什麼關係呢?
204.080	206.782	為什麼當歸要給耶和華呢?
206.782	210.124	我連當歸是什麼我都不知道,為什麼要給耶和華呢?
210.124	214.487	教會不是要奉獻金錢,怎麼會奉獻當歸呢?
214.487	215.969	醒過來沒有?
215.969	219.051	醒過來了,一點小插曲。
219.051	223.794	我們一起來進到馬可福音的這段經文,這段經文跟當歸有關。
224.821	228.642	我們來看馬可福音第十二章十三到十七節。
228.642	257.406	這裡很特別,前面發生了一些事情我們會再交代,可是這裡第十三節一開始拿兩個字,後來,所以前面一定有前言,前言我待會再說,你們先記得前面一定發生了一些事,讀經一定要讀到這種很關鍵的字眼,後來他們打發幾個法律賽人和幾個希律黨的人到耶穌那裡,念到這裡你們有沒有覺得怪怪的, 有覺得怪怪的舉一下手?
257.406	258.306	沒有對不對?
258.306	259.707	也有人覺得怪怪的。
259.707	262.469	怪在哪裡?
262.469	266.552	西綠黨的人跟法律賽人基本上這是什麼?
266.552	270.695	兩種你可以說有一點敵對,完全不相干的人。
270.695	272.316	他們所期望的是什麼?
272.316	273.157	不一樣的。
273.157	276.499	基本上西綠黨的人是什麼?
276.499	278.100	公開簡單的就是油煎啊。
279.718	283.080	猶太人,漢奸,猶奸,聽到沒有?
283.080	283.960	就是怎麼樣?
283.960	284.881	他們怎麼樣?
284.881	287.442	代替羅馬政府來管理什麼?
287.442	289.723	以色列人管理猶太人。
289.723	291.004	基本上是這樣子。
291.004	295.346	而法律賽人是一個很重視宗教的傳統。
295.346	303.970	你不要看法律賽人常被耶穌罵,其實法律賽人跟我們一樣很重視聖經,很重視傳統,他們認為信仰是最重要的事情。
303.970	307.932	怎麼可以跟外邦這一些政治的勢力聯合?
307.932	313.977	可是這兩種人, 今天後來怎麼樣,連在一起。
313.977	319.042	就是原來有一群人,他們打發了這中間的法律賽人和幾個西律黨人。
319.042	323.506	這原來的一群人,如果你往前面看,其實是在第十一章的後面。
323.506	329.651	這一群人包括本來不太相合的一些人,到這個時候全部聚集在一起。
329.651	338.202	這中間有祭司長,有文士,有長老,有法律賽人,有西律黨人, 甚至在後面你看到有殺渡該人。
338.202	345.725	就是那個時候,所有的各黨各派在那個時候,當耶穌祈禮進耶路撒冷之後,所有各黨各派的人都開始怎麼樣?
345.725	347.745	往中間來聚集。
347.745	348.506	發生了什麼事?
348.506	350.807	我們繼續看這段經文。
350.807	351.827	經文說什麼?
351.827	355.008	要救著祂的話怎麼樣?
355.008	357.109	看聖經,陷害祂。
357.109	359.790	所以很清楚這一群人來,要陷害耶穌。
359.790	361.651	陷害耶穌什麼呢?
361.651	368.587	因為他們問耶穌,前面還給耶穌勾銭, 該報一下,你是誠實的夫子。
368.587	371.448	你都不尋情面,你該怎麼講你就講。
371.448	372.909	其實根本就是要怎麼樣?
372.909	373.510	害耶穌。
373.510	375.631	他叫耶穌怎麼樣?
375.631	379.313	你是誠誠實實的,你就實話實說。
379.313	381.034	他是真的要聽耶穌的話嗎?
381.034	384.656	不是,要救他的把柄,陷害他。
384.656	389.279	所以他在那個時候告訴耶穌說,那你就誠誠實實的告訴我們。
389.279	390.020	怎麼呢?
390.020	392.321	納稅給凱撒可以不可以?
392.978	395.839	後面還說我們該納不該納。
395.839	401.481	他們其實在這裡有一個軌跡要獻耶穌於不義。
401.481	402.082	怎麼說呢?
402.082	406.263	我為什麼前面說西律黨人跟法律賽人是不太合的?
406.263	411.345	就在這件事情上,這兩群人有不同的看法。
411.345	419.789	如果耶穌說應該要納稅給凱撒,這個時候就會有一群人,法律賽人,甚至結合什麼樣?
419.789	422.670	祭司長、長老跟文士起來怎麼樣?
423.166	427.989	反耶穌,這個是油煎,對不對?
427.989	431.410	就是結合外面的勢力來怎麼樣?
431.410	434.592	來統治我們,所以耶穌你這下死,對不對?
434.592	438.214	你在耶路撒冷城,你在猶太人的圈子,你就怎麼樣?
438.214	440.495	混不下去。
440.495	447.279	基本上是這樣,可是請問,如果耶穌說不可以呢?
447.279	449.220	會產生什麼事情?
449.220	451.461	另外一群人,希律黨人會做什麼事情?
453.305	488.240	他用什麼﹖就可以用羅馬的勢力﹖﹖來定耶穌怎麼樣﹖罪﹖因為你不納稅﹖你公然的反對什麼﹖羅馬政府﹖我就可以怎麼樣﹖用任何的罪名怎麼樣﹖把你關起來﹖定罪﹖當然耶穌後來是因為﹖他被定罪是因為﹖他是猶太人的王﹖他們這樣子誣陷他﹖當然他也是﹖可是在這當中﹖我們產生了一個問題﹖耶穌在這裡﹖ 後面的第15節說, 耶穌知道他們的假意。
488.240	491.002	要看聖經,不但聽我講,要看聖經。
491.002	496.826	耶穌知道他們的假意, 就是他們其實是要試探祂,就對他們說什麼?
496.826	498.307	你們為什麼試探我?
498.307	499.568	拿一個什麼?
499.568	500.609	銀錢。
500.609	501.790	拿一個什麼錢來?
501.790	502.991	他們拿了什麼錢來?
502.991	508.635	拿了一個上稅的錢, 就是那個錢是專門用來繳稅的。
509.343	512.526	那個錢是專門用來繳稅的。
512.526	514.688	然後那個錢長得怎麼樣呢?
514.688	518.151	一面就是他們羅馬皇帝的像。
518.151	521.053	另外一面是羅馬皇帝的媽媽。
521.053	523.656	他們叫做和平的女神。
523.656	527.419	然後連媽媽都要敬拜這位羅馬的皇帝。
527.419	532.743	其實用這個銀錢來繳稅。
532.743	535.506	他們上稅一定要用這個錢來繳稅。
535.981	540.883	那其實當你繳稅的時候,你等於間接的承認一件事情。
540.883	542.863	承認凱撒就是什麼?
542.863	543.964	是神。
543.964	549.706	不但只是君王而已,祂告訴你一件事情,凱撒是神。
549.706	555.008	好,耶穌就叫他們拿了這個銀錢來,對不對?
555.008	556.188	然後耶穌怎麼說?
556.188	559.149	你們看一下聖經,耶穌怎麼說?
559.149	561.930	耶穌就問他一個問題,說什麼?
561.930	568.323	這個像跟這個號,就他上面寫了一些 這個象跟這個號是誰的?
568.323	570.084	他們說什麼?
570.084	571.084	是誰的?
571.084	572.044	凱撒的。
572.044	575.146	耶穌就講了一段千古的名言。
575.146	575.946	你們跟我一起說。
575.946	577.366	耶穌說什麼?
577.366	580.848	凱撒的物當歸給凱撒。
580.848	581.848	然後呢?
581.848	584.329	神的物當歸給神。
584.329	590.071	我們都可以理解耶穌在這裡說凱撒的物應當要怎麼樣?
590.071	591.452	給凱撒。
591.452	594.673	然後上帝的物都應當要給上帝。
595.742	602.166	很多千古以來就因著這一句話,其實就各家各派都有不同的看法。
602.166	604.607	最普遍的一個看法是認為什麼?
604.607	610.631	它是一個平行的用法,其實在這兩句的中間有一個連接詞。
610.631	614.514	那個連接詞就是end的意思,一個kai。
614.514	621.438	凱撒的物當歸給凱撒,然後呢end,或者上帝的物也當什麼?
622.125	623.886	歸給上帝。
623.886	626.607	傳統上大部分都是用這個解釋。
626.607	629.108	就是一個平行的句子。
629.108	636.151	一方面只要這一件這個東西,你認為屬於凱撒的,你就怎麼樣?
636.151	637.992	你就給凱撒。
637.992	642.313	這一件東西你認為給上帝的,就是給上帝。
642.313	644.234	這兩個東西是完全怎麼樣?
644.234	646.115	不相干的。
646.115	649.096	一開始傳統的解釋大部分都是怎麼樣?
649.096	651.137	用這個平行的一個用法。
651.732	661.119	所以整個其實歷史歷代,凱撒跟上帝其實一直在那邊做一個爭論。
661.119	665.121	政教一直在那邊做一個好像掙扎。
665.121	673.087	包含耶穌的時代,其實在那個時候,政治跟那個時候的宗教,基督教,其實政治跟基督教是怎麼樣?
673.087	678.371	是對立的,你可以說彼此不相容的。
678.371	680.252	還記得保羅被怎麼稱為?
682.073	684.554	那攪亂天下。
684.554	689.995	所以其實保羅也是一個不為當時的政治勢力所容忍。
689.995	696.576	其實這樣子的政治跟宗教的關係一直是一個對抗的。
696.576	707.438	一直到君士坦丁大帝313年他信了耶穌之後,到了381年他定基督教為國教,這個時候整個政治才怎麼樣?
707.438	710.239	跟宗教跟基督教才怎麼樣?
710.239	710.679	連結在一起。
711.237	715.258	可是你說,那教會就因此發展了嗎?
715.258	717.659	從某些角度是。
717.659	722.580	教會因著國家的勢力,在文化上有很好的發展。
722.580	726.741	在音樂上,在建築上有很好的發展。
726.741	734.363	可是從某個角度來看,教會因著政治,其實教會也一直在墮落。
734.363	739.865	教會可以用政治的勢力除去它,教會當中的敵人。
740.794	744.717	以前教會的異端很可怕的。
744.717	747.799	現在的異端可能沒有問題,就是被趕出去而已。
747.799	752.522	到了哪一個教會,別人只知道這個人怪怪的而已。
752.522	753.383	哪裡都還可以去。
753.383	756.645	那個時候的異端是怎樣?
756.645	759.467	直接綁起來燒死。
759.467	765.392	用國家的刑法可以做這樣的事情。
765.392	769.775	連加爾文在日內瓦都沒有辦法避免這樣的事情發生。
770.828	776.829	因為這兩件事情其實對他們來講常常在一個掙扎裡面。
776.829	789.393	很多時候我們碰這樣的事情的時候,我們其實就會覺得那這樣子好了,我們就是反正一些事情我們就把它很簡單的歸類。
789.393	790.573	這一類是屬於什麼?
790.573	791.913	世界的。
791.913	793.754	這一類是屬於什麼?
793.754	794.814	信仰的。
794.814	797.355	我們就把一件事情把它怎麼樣?
797.355	798.995	很簡單的做一個劃分。
799.701	805.245	然後呢,於是呢,宗教的歸宗教,政治的怎麼樣?
805.245	807.087	歸政治。
807.087	811.771	我舉個例子,好像不是這樣的。
811.771	821.799	當他們要納稅的時候,以色列人要納稅的時候,他們是不是需要去兌換成納稅的這個銀子?
821.799	823.340	銀錢。
823.340	837.310	還記得耶穌在前面,就是在前一章,當他們到聖殿去的時候,他們要奉獻, 他們奉獻的時候,奉獻難道就不需要用猶太的貨幣嗎?
837.310	843.795	他們敢把這個凱撒的這個銀錢投在那個時候的奉獻箱嗎?
843.795	844.416	不敢。
844.416	846.277	他們也需要怎麼樣?
846.277	846.838	兌換銀錢。
846.838	848.799	所以才有兌換銀錢人的桌子。
848.799	849.960	耶穌把他怎麼樣?
849.960	852.202	推倒。
852.202	856.545	你就說一隻羊本來就是一樣的啊,對不對?
856.545	858.367	我這隻羊可以把它換成什麼?
860.418	863.320	納稅的錢給了凱撒。
863.320	866.502	我這隻羊也可以把它換成什麼?
866.502	870.184	奉獻給上帝的錢。
870.184	873.866	那到底這隻羊請問是凱撒的還是上帝的?
873.866	877.608	今天我就要一直問你們這個問題。
877.608	884.252	是當你決定要換成凱撒的時候,換成凱撒的貨幣的時候,它屬於凱撒。
884.252	888.074	當你要把它換成奉獻的銀錢的時候,它是屬於神的嗎?
888.541	894.106	到底這個東西的所有權是這樣決定的嗎?
894.106	900.592	我們就要回來到這一段,當耶穌說,凱撒的物當歸給凱撒。
900.592	906.817	我想這個連接詞and,不只是只是那個也這樣做而已。
906.817	911.021	我認為它其實是有一個超越性,這個就回來到這個字的用法。
911.459	919.542	這個字呢,其實它有一種但,有一種然而,有一種卻要,你們知道嗎?
919.542	923.443	這就是,它其實要強調的是前者還是後者?
923.443	935.047	後者,前面只是先告訴你這件事情,凱撒的物,沒錯,這個是凱撒的物嘛,因為你們既然問我睡的問題,我就告訴你,凱撒的物當歸給什麼?
935.047	938.888	凱撒,可是耶穌的重點在哪裡?
938.888	948.494	後面,然而, 重要的是,因為你們凱撒這個東西已經是凱撒,你們很清楚,你們就給凱撒嘛。
948.494	953.297	然而你要知道,上帝的物要歸給什麼?
953.297	953.737	上帝。
953.737	964.603	可是回來一個問題,其實凱撒的物在那個時候很明顯什麼叫做屬凱撒的,很清楚嘛,因為那個銀錢,大家就知道這個是凱撒的。
964.603	966.384	可是到底什麼才是上帝的?
970.964	973.346	到底什麼才是上帝的?
973.346	983.053	是當我決定要把這個東西做一個對換的時候,做一個轉換的時候,這個東西才屬於上帝的?
983.053	990.539	還是這個東西一直是上帝的?
990.539	995.023	我們一起回來看前面第十一章。
995.023	999.146	為什麼會有十二章的這段經文,其實是根據第十一章後面的發展。
999.531	1010.155	整個場景我們回到一開始的最前面,11章的第27節。
1010.155	1016.738	我剛才講到,耶穌在這裡,祂不是要否認前面的那個凱撒的物當歸給凱撒。
1016.738	1020.759	這個上稅的銀錢本來就是凱撒的,給凱撒就對了。
1020.759	1022.420	可是耶穌要強調的是後面。
1023.933	1060.015	在你納稅的同時﹐在你法律賽人﹐在你這些西律黨人﹐在你這些文士﹐這些長老﹐這些祭司﹐你納稅的同時﹐你已經把凱撒的物給了凱撒﹐可是他要﹐耶穌要問他們一個問題﹐那你上帝的物﹐你給了上帝嗎﹐耶穌其實是要問這個超越的問題﹐我們回來看這一段經文﹐來﹐第11章的第27節﹐我們念27到33好不好﹐27到33﹐我要請我右手邊這邊﹐ 右手邊的弟兄姊妹唸,大聲的來唸,這邊來聽,這邊大聲的來唸,預備,請。
1060.015	1061.096	他們又來到。
1087.483	1094.365	是從人間來的呢?
1094.365	1096.326	你們可以回答我。
1096.326	1104.868	他們彼此商議說,我們若說從天上來,他必說,這樣,你們為什麼不信他呢?
1104.868	1112.770	若說這人從人間來,卻又怕百姓,真以為約翰是先知。
1112.770	1122.897	於是回答耶穌說, 耶穌說,我也不告訴你們,我仗著什麼權柄做這件事情。
1122.897	1132.462	當耶穌在耶路撒冷在那邊,然後在那裡五花果枯乾了之後,這一群人就聚集在那裡,他們又來到耶路撒冷。
1132.462	1141.707	耶穌在殿裡行走的時候,他們問耶穌一個問題,你仗什麼權柄做這些事情?
1141.707	1144.669	其實這一群人難道不知道耶穌有著什麼樣子的權柄?
1146.203	1151.227	耶穌行神蹟,代表神的權柄怎麼樣?
1151.227	1152.828	在祂的手中。
1152.828	1159.273	當耶穌醫治,當耶穌趕鬼,都很清楚知道神把權柄給了耶穌。
1159.273	1165.558	可是這一群人卻要問耶穌,你憑著什麼權柄做這些事情?
1165.558	1168.540	給你這個權柄的是誰?
1168.540	1173.164	請問耶穌回答了他們嗎?
1173.164	1173.304	沒有。
1173.763	1176.705	耶穌就反問了他們一個問題。
1176.705	1179.227	反問他們誰?
1179.227	1179.887	施洗約翰。
1179.887	1186.712	因為他知道施洗約翰，被這一群人甚至被所有的這些猶太人所接受。
1186.712	1191.435	那他就先問那到底施洗約翰從哪裡來?
1191.435	1197.259	其實同樣的他們的問題,他們問耶穌的問題,耶穌用反問來回答他們的問題。
1197.259	1200.821	他們就在裡面自己反覆思量。
1200.821	1205.671	如果他們是說施洗約翰是從 天上來。
1205.671	1212.636	那施洗約翰ﷺ所介紹的這位耶穌ﷺ施洗約翰ﷺ所傳的信息,他們應不應該信?
1212.636	1214.898	應該信,對不對?
1214.898	1217.079	可是他們信不信?
1217.079	1218.781	不信。
1218.781	1223.264	可是他敢不敢說施洗約翰ﷺ不是一個先知?
1223.264	1225.245	也不敢,為什麼?
1225.245	1227.367	因為事實就證明怎麼樣?
1227.367	1228.508	他是。
1228.508	1231.390	這一群人看施洗約翰ﷺ跟看耶穌是不是一樣?
1232.756	1234.497	也差不多,對不對?
1234.497	1236.499	有一樣也不一樣,對不對?
1236.499	1237.540	一樣啊!
1237.540	1246.227	當耶穌做了這些事情的時候,當祂顯出是神的時候,神的兒子的時候,他們為什麼不信呢?
1246.227	1250.030	所以同樣的一個問題,所以耶穌問他們的時候,他們就說怎麼樣?
1250.030	1251.771	我不知道。
1251.771	1258.016	耶穌說,那既然你不知道,其實他們不是不知道,是他們不知道怎麼回答。
1258.016	1261.939	因為怎麼回答都有問題,而耶穌說,那我也不告訴你。
1264.701	1266.801	可是這些人難道不知道嗎?
1266.801	1269.522	他們知不知道耶穌的權柄從何而來?
1269.522	1269.782	知道。
1269.782	1277.544	他們是在質問,可是我有給你這個權柄嗎?
1277.544	1285.405	請記得這一群人,其實是祭司長,是文士,是長老。
1285.405	1291.126	他們問的不是那個權柄從神來,耶穌說從神來他們就接受嗎?
1291.126	1291.546	不是的。
1291.546	1297.478	他們是認為耶穌的 的權柄是因為他們沒有給耶穌這個權柄。
1297.478	1300.040	所以你們不能做這件事情。
1300.040	1303.821	這個是這一群人的一個問題。
1303.821	1306.223	耶穌在回答他們權柄的這個問題。
1306.223	1308.304	耶穌要告訴他們。
1308.304	1310.104	權柄不是從你們來。
1310.104	1312.426	權柄是從哪裡來。
1312.426	1313.506	從神而來。
1313.506	1316.708	我不曉得你們怎麼認識權柄這件事情。
1316.708	1319.989	其實包含這些文士法律賽人祭司長。
1319.989	1321.430	他們都有同一個問題。
1321.430	1322.911	我以前有一個體會。
1322.911	1323.551	我在念。
1324.104	1336.548	高中的時候,那個時候我們班上轉來一個同學,就跟我們一樣,只是他不會講我們福建話,這樣子而已。
1336.548	1353.054	反正在念書的過程當中也沒有什麼差別,只是我們只知道他家住在軍營裡面,我們就覺得很奇怪,為什麼有一個人家裡住在軍營裡面,然後我們就同學了一段時間,我們就什麼,到他們家裡去玩。
1354.309	1357.932	那一次到他們家裡去玩, 我終於知道什麼叫全餅。
1357.932	1361.135	他在我們班上是個很普通的人, 長得又瘦又小。
1361.135	1366.039	然後我們都喜歡開他玩笑, 因為我們只要講福建話,他就聽不懂這樣子。
1366.039	1368.782	然後我們就常常跟他玩這樣子。
1368.782	1370.083	我們也都是很好的朋友。
1370.083	1373.726	然後有一次他就邀我們去他住的地方。
1373.726	1378.670	他就說我們約在哪裡見面, 然後我們就在那裡見面。
1378.670	1385.870	然後我們就想說他會帶我們去, 因為我們所有人都騎什麼, 騎破爛的腳踏車,對不對,停在那裡。
1385.870	1389.433	停在那裡,我們就想說他會騎一輛腳踏車來,對不對。
1389.433	1393.576	然後結果沒有,是一輛車子,軍車開過來。
1393.576	1397.300	那個車子上面還有三顆星星。
1397.300	1401.924	你們不太清楚那個什麼,一輛那種吉普車,前面要三顆星星。
1401.924	1407.949	我們以前被教導,看到那個吉普車前面有三顆星星,又兩個國旗,只要停在前面就趕快怎麼樣。
1409.206	1418.889	這是我們的基本訓練,因為不然很麻煩,他會怎麼樣,把你學號記下來,去跟那個,你就完蛋了,這個會大過的。
1418.889	1443.286	所以我就看到一輛車,我們幾個人在那邊,反正就是這樣,穿著拖鞋這樣子,然後一輛車過來,三個星星,所有人這樣子,然後就有一個兵下來,因為那個吉普車只有一個門,先下來,對不對,然後把那個椅子折,然後把後面,那不是我們的同學, 然後呢,我們幾個人上不了那個吉普車。
1443.286	1445.107	他說沒關係,待會還有一輛車會來。
1445.107	1446.748	然後我們就怎麼樣?
1446.748	1448.388	上了那個車去。
1448.388	1451.290	上了那個車去,就進到那個最有名的什麼?
1451.290	1452.510	泰武山裡面去。
1452.510	1458.352	開玩笑,坐那個車,我們坐在後面那個感覺很不一樣。
1458.352	1467.076	因為你每到一個地方啊,所有的人就……每過一個彎,所有人就是這樣,然後那個槍就是這樣。
1467.076	1469.357	我就覺得,啊,這是什麼景形啊?
1470.640	1472.681	我終於知道什麼叫做權柄。
1472.681	1474.842	什麼叫做狐假虎威。
1474.842	1477.763	這個同學我們平常巴他巴好玩的。
1477.763	1479.384	那天突然怎麼樣?
1479.384	1481.045	尊敬起他來。
1481.045	1483.866	沒什麼,只是因為他老爸是司令官而已。
1483.866	1487.267	我們後來才知道,他也沒有跟我們講。
1487.267	1488.628	我要談的是什麼?
1488.628	1490.909	不是只是那個我的過去很好笑。
1490.909	1495.231	我要談的是我那天才稍微了解到什麼叫做權柄。
1495.231	1497.752	而且那個權柄是因為我這個同學有什麼權柄嗎?
1499.121	1501.183	沒有嘛,誰理他,對不對。
1501.183	1510.670	他來到我們這邊,然後穿的衣服也紮得這樣子,亂七八糟的這樣,鞋子也是爛爛的這樣子,然後跟我們一樣在那邊玩這樣子,也是髒髒的這樣。
1510.670	1514.533	可是,那一天他不一樣喔,對不對。
1514.533	1524.401	那一天他當他在那個車上,或者我們自己也是這樣髒髒亂亂穿個拖鞋,當我們在那個車上的時候,我們發現,好像有一個全餅不是屬於我們的。
1524.401	1526.303	可是呢,那個全餅怎麼樣?
1526.303	1526.583	很大。
1529.138	1530.259	我要談的是什麼?
1530.259	1534.281	其實很多時候,神有祂的權柄。
1534.281	1539.824	這些以色列人,這些文士跟法律善人,他不曉得他那個權柄從哪裡來。
1539.824	1541.264	他已經習慣了。
1541.264	1548.708	我在想說,我如果在那個車子坐久了,有一天我騎腳踏車,如果沒有人跟我敬禮,我也會覺得很怪。
1548.708	1552.010	搞了半天,他不是跟我敬禮,他是跟誰敬禮?
1552.010	1555.031	跟那個權柄,跟那個車子敬禮啊。
1555.031	1555.852	你懂我的意思嗎?
1556.544	1590.529	所以其實在那個時候你看到﹖他們在討論權柄的這件事情﹖可是權柄到底從哪裡來﹖這一群法律賽人﹖這一群祭司長﹖這一群文士﹖這一群長老﹖他們其實都忘記了﹖他們以為耶穌的權柄要他們給﹖可是其實權柄是誰的﹖是上帝的﹖他們所擁有的那一切的權柄其實是上帝的﹖ 這一群人,他們難道真的不知道這件事情嗎?
1590.529	1594.955	不是,他們是不願意接受這件事情。
1594.955	1601.803	他們不願意接受耶穌這麼有權柄,而且耶穌的權柄是從神那裡來。
1601.803	1605.868	他們不願意接受,以至於他們連回答都不想回答。
1606.869	1616.096	他不接受這個權柄是從神而來,因為權柄只能從我們文士給,只能從我們祭司長給,怎麼可以從神來?
1616.096	1623.221	當然這句話他們不敢講,可是他們的生命底子裡就是這樣。
1623.221	1627.645	這一群人嚴重到一個程度,什麼程度呢?
1627.645	1629.926	第12章,我們接下來來看。
