start	end	text
1973.882	2000.208	我們來到主的桌子前的時候我們懇求主恩待我們因為我們每個人都帶著以前世界的想法進到教會來所以我們信了主之後總是還在想我信了主之前那個還沒有賣掉的房子那個還沒有還掉的債務我信主之前我沒有念過大學我信主之前長得比別人矮你以為你信主之後你就身高會長高10公分嗎
2000.708	2016.241	那是不可能的事情。因為主根本不看重你身高几公分的事情。主看重的是說,耶穌基督要跟你團契。我們被父神呼召,從世界呼召出來,要跟耶穌基督一起團契。什麼叫團契?
2017.995	2020.877	所以我們要真的是很感謝主。謝謝主。
2048.575	2075.851	我們這個人生命裡面本來沒有聖節,沒有公義,沒有慈愛,沒有智慧,沒有良善。我們是一群什麼都沒有的人,爬進教會。但上帝讓我們進了教會之後,上帝要把祂,耶穌基督要把祂自己的生命的豐盛跟我們分享。這是我們待會兒來領受這個餅的意義。
2155.742	2163.885	弟兄姊妹我們安靜在神的面前。我們用感謝我的救主這首歌,獻上我們對神的感謝。
2184.104	2204.572	繁體中文，臺灣國語。
2218.66	2238.649	我們一起來思想。繁體中文，我們一起來思想。繁體中文，我們一起來思想。繁體中文，
2240.811	2252.88	我的救助,我要永遠跟隨禰。感謝我的救助,謝謝禰救贖我。
2265.265	2290.779	Hallelujah 阿們,Hallelujah 阿們,愛我的救助,我要永遠跟隨禰。若不是禰的愛,淋到我裡面,
2291.971	2319.634	我深知我還活在罪惡中。依著禰的愛﹐改變我的心﹐我重新得著生命力量。若不是禰的愛﹐淋到我裡面﹐
2320.401	2347.587	我深知我還活在罪惡中。因著禰的愛,改變我的心。我重新得著生命力量。繼續傳遞稟悲的時候,我是繼續來宣讀今天的經文應用在我們身上。
2349.343	2374.655	你在做妻子的,怎麼知道不能救你的丈夫呢?你在做丈夫的,怎麼知道不能救你的妻子呢?你在做父母的,怎麼知道不能救你的兒女呢?你在做兒女的,怎麼知道不能救你的父母?
2377.193	2397.667	你這侍奉的人怎麼知道不能拯救更多的靈魂呢?臺灣的基督徒怎麼知道透過禱告、透過傳福音、透過做光做圓的生命見證不能拯救我們的國家呢?
2399.411	2414.931	親愛的弟兄姊妹。不要太快放棄。不要太快的放棄。你是否想要放棄呢?我們是不是一起來禱告?懇求主。你怎麼知道不能救呢?
2416.527	2435.741	剛剛第二堂我差點遲到,因為我在為一個癌症的病患禱告。他被他身上很多的腫瘤嚇到整個生命都枯萎了。但是我帶領他禱告完之後,他決定他要信耶穌了。你怎麼知道不能救呢?
2436.442	2465.743	不要太快的放棄。阿們。有沒有人今天願意跟主同工的?主啊,對不起。我本來想放棄了。我覺得我公司不能救了。我本來覺得我的健康不能救了。主啊,我受不了我自己的。我本來覺得我的人格不能救了。我的信用破產了。主啊,我對我的兒女束手無策。我對我的婚姻非常的無奈。我很多狀況我覺得不能救了。但是主禰鼓勵我們不要放棄。
2466.323	2484.231	若不是禰的愛,我們早就滅亡了。禰願意救我們,我們就相信禰願意救我們到底。好不好,我們是不是一起起立,我們來禱告。為了你原本認為不能救的人事物,可不可以再一次跟主一起來,說主啊,求禰出手救。
2484.531	2507.078	求禰出手來拯救。我們開口為自己來禱告。我們開口為自己來禱告。哈利路亞。謝謝耶穌。謝謝主。主啊。求禰出手來拯救。先改變我的心思意義。主啊。先改變我的想法。主在主凡事都能。在神凡事都能。主啊。
2507.978	2522.532	你沒有放棄之前,我不要放棄。主你沒有放棄之前,我要繼續繼續的在主的面前,祂的主給我的力量,主我要宣告,會改變的。
2523.012	2543.951	我要宣告在神沒有難成的事。我要宣告我願意為了主的緣故。陪伴我失敗的健康。陪伴我失敗的事業。陪伴我失敗的婚姻關係。陪伴我失敗的親子關係。陪伴我軟弱。
2544.872	2562.075	受傷害的心靈。主啊我要堅持下去。主啊給我力量。謝謝耶穌。謝謝禰不放棄我。禰的愛始終沒有放棄我。因此主我也沒有資格在禰面前軟弱的放棄。我們請師母帶我們來禱告。
2564.991	2592.365	阿爸父,我們來到禰的面前,主,我們坦誠,我們是個罪人。主,我們生命裡面的破碎,我們生命裡面那些的驕傲自大,主啊,我們靈裡面生病,主,致使我們的肉體也生病,主啊,我們在禰面前說,主啊,只有禰是救主,主啊,只有禰是我們生命裡面每一個部分的救主,
2592.705	2614.778	主啊,沒有一個部分是禰不能夠拯救的。主啊,禰的拯救是一個全然完全的拯救。主啊,我們說我們要把我們生命裡面過去的破碎,主啊,現在的破碎,現在在家庭裡面遇到的困難,我要特別為家庭來禱告,主啊,為夫妻的關係來禱告。
2615.879	2632.442	耶穌是的讓我們真的是看見﹖主我們沒有比我們的配偶還要好﹖主我們看見﹖主我們都一樣的爛﹖主我們是的﹖主我們就是罪人﹖主我們都需要禰的拯救﹖主只有我們意識到﹖主我們是一個不完全的人﹖
2632.722	2649.026	不完美人的時候,我們這個婚姻才有救。我們才不會一直在指責對方,一直在論斷他的過去,論斷他過去做了多少的錯事,沒有辦法彌補的錯事。主啊,我們說,是的,主耶穌,禰來原諒我們,
2649.206	2674.495	主要讓我們也有一個原諒別人的心,主要來原諒我們的配偶,原諒他們過去對我們生命裡面的虧欠,對這個家庭裡面的虧欠。主要我們說,不管是什麼原因造成現在夫妻關係的那個破裂,沒有辦法修復,可是主我們說,我們把這些都帶到耶穌基督禰的臺前,我們相信主,我們看到我們生命裡面,主真的需要禰的拯救,
2674.735	2698.28	主啊,我們的婚姻真的需要禰的拯救。主啊,我要特別為我們的弟兄姊妹。主啊,不管你現在年紀有多大。不管你們的婚姻現在是處在一個什麼狀態。主啊,在你沒有難成的事。主耶穌,禰的恩典、禰的恩惠已經超越這些的破碎。主啊,已經超越那些他們所犯的錯事。主耶穌,因為禰是樂意饒恕人的神。
2698.78	2723.799	主要當我們願意老說的時候,我們看見有奇妙的事情會發生在我們的家庭的當中。主要那個恢復,主要從夫妻的關係開始,主要會一直的流露出來,流到我們兒女的中間,流到我們跟我們父子父女之間的關係,主要母女跟母子之間的關係,主要會往回頭流,會流到我們跟我們父親母親的關係。
2724.019	2724.479	阿們﹗
2754.633	2770.849	我們存感恩的心來領受主的餅跟主的杯。我們請坐。
2775.043	2795.019	最後牧師對大家祝福。感謝神。弟兄姊妹,杯子待會再收。等一下再收。等一下再收。半分鐘。弟兄姊妹,建造教堂是為了什麼?建造人心。
2796.715	2819.492	我們如果自己都沒有渴望我的婚姻可以突破我的家庭問題可以突破我個人的生命可以突破如果我們自己對自己都沒有這樣的一個盼望我們怎麼可能去支持蓋一個教堂然後這個教堂以後幫助別人的婚姻幫助別人的家庭幫助別人生命的翻轉
2820.213	2846.943	除非我們自己先有一個渴慕、渴望神在我生命中各樣的醫治、修復跟突破。沒有自己先經歷神真的能夠改變人的生命、改變人的家庭、改變人的婚姻、改變人的健康、職場各方面的。你沒有自己先經歷過,你就不會對於那個心堂能夠發揮什麼功能,你會有任何的期待。因為不會有期待,所以你不會
2847.483	2871.488	支持和投入這個建造裡面。你懂意思嗎?這個是為什麼常常有啦牧師你上次有講過我有奉獻以後都不關我的事我已經給你面子了已經奉獻過了不要這個我要是說如果這個新堂以後要成就這一些帶給這麼多人生命翻轉改變醫治的大能的一個管道那是不是先在我們裡面先經歷過
2871.988	2891.524	我們才會說,對,上帝真的可以。以至於我們才會投入和奉獻、禱告。希望這個堂趕快蓋起來,祝福更多人。阿們。願神祝福大家。願神恩待我們。盼望的心不要死。盼望的心不要消滅。我們一起來領受神的祝福。
2893.114	2907.28	願天父上帝的慈愛,主耶穌基督十字架的救恩,聖靈的感動與鼓勵,常與我們弟兄姊妹同在,從今時同在,一直到永永遠遠。