start	end	text
1.596	20.567	小太陽已經十一年了,從幾個小朋友開始,到現在每一學期一百多個國小的孩子,還有幾十個國中的孩子,真的非常的感恩,非常的感恩。
21.067	50.829	我前兩天請客人去吃飯,到餐廳。要結帳的時候,那個老闆很不好意思問我說,老闆啊,我感覺你們很特別,你是做哪一門生意的?我說我是教會的牧師。他說哇,教會的牧師,就是那個學府路那個嗎?我說對啊。他就好興奮,把裡面有一個在幫忙送餐點的一個年輕的小姐叫過來。
51.049	77.479	他們說,這個就是那個小太陽那個教會的。然後那個年輕的小姐很興奮,她說,我的孩子今年要上小一,我可以讓我的孩子去你們小太陽嗎?因為我是單親的媽媽,我需要上班。我說我們非常歡迎。然後後來她就很不好意思問我說,那是多少錢?我說不用錢。
78.78	96.577	弟兄姊妹,真的是非常的感謝主,非常的感恩。我們從來沒有因為建堂,我們就停下我們所有的工作。我們反而是因為建堂,我們知道堂蓋好了,裡面的人跟軟體要跟得上,
96.817	112.009	所以反而因為建堂,讓我們在各樣的事工、事奉裡面,更是積極,更是努力。丹江教會每一年有三分之一的年度預算,都是放在社區工作,還有整個淡水的福音工作上面。
112.449	134.834	其實每年都有很多人來參訪我們的社區工作,其他教會,大專院校,或是一些公家單位。你大概很難想像,因為我們現在是所有做這個有需要的家庭的學童、課後輔導班裡面,來到教會裡面的人數最多的一個教會就是我們。
135.094	159.92	我們要繼續做下去。所以建堂不是隻是為了滿足我們的虛榮心。我有一個堂長得好漂亮。那個神根本就不看重。看重的是說,一個新的教會建立起來,祂到底能夠為這個城市和這個國家的復興,上帝的國度的建立,能夠帶來多少的貢獻跟熱心。阿們。
160.52	177.225	我們繼續加油。我們繼續為所有的這些社區工作來感恩。我們也繼續為建堂來禱告。其實我們在建堂以後所要發揮的,我一直跟這些志工們,跟雅惠也講一件事情。我們要真的是拋磚引玉。
177.585	192.021	神恩待我們可以做小太陽、中太陽各種的社區工作。其實臺灣很多教會,他們也有責任說,其實在他的城市裡面,他也應該來做這樣的工作。因為教會本來就要走出圍牆。阿們。
192.602	218.287	讓耶穌基督道成肉身的精神也讓我們的百姓知道神跟他們很靠近神的愛沒有離他們很遠所以其實我們就是要在這方面要迎頭趕上繼續加油好不好真的是要以教會為榮因為我們真的是想要去滿足耶穌基督道成肉身的心意讓我們百姓知道我們來打開今天的經文
221.101	241.083	在哥林多前書第四章。哥林多前書第四章。你羨慕不羨慕這些小朋友背這些經句?羨慕嗎?羨慕。我跟你講,現在也不遲。現在也不遲。那你說從什麼時候開始呢?從每一天讀神的話十分鐘。聽神的話十分鐘開始。
241.544	255.42	如果有一個孩子他說,爸,我快要聯考了,可是我好後悔,過去的三年都沒有好好認真讀書,我該怎麼辦?我要從什麼時候開始認真?做父母的會怎麼說?一春,從現在。
256.561	274.316	也是一樣,你在神的話裡面不用功已經很久了,所以就從現在。小時候所背的都會記得,所以今天所開始讀神的話的,總會比明年才開始讀,記得清楚,而且受用更多。阿們。
275.077	301.943	我記得我小時候也是一樣小時候我爸媽為了愛我的緣故把我送到一個私立小學我真的是非常的痛苦我非常羨慕我的弟弟我弟弟每一天都可以睡到那個快要八點才去上學我六點就要出門瞭然後呢可是五點就要起床小學一年級也不認識然後每天早上起來要背三字經還有什麼東西因為學校會抽考
302.483	323.81	然後你也不知道什麼意思。可是那時候所背的怎麼樣?現在都記起來。你有背過三字經嗎?我們來看看誰背比較多好不好?人之初,信本善,信相敬,習相遠。果不教,信乃謙,教之道,貴以尊,習夢,子令處。子不學,斷雞柱,鬥伊山,有義方,教無子,名俱揚。養不教,夫之過,教不言,師之鬥。
324.07	342.937	我跟你講我以前小一的時候我根本不知道我在背什麼東西你知道嗎但是我就會記起來你知道嗎所以其實我們要常常為我們的兒童的事工青少年學生的事工還有我們每一個人渴慕主我們其實現在就是最好的時刻來跟各位講現在就是最好的時刻來
345.418	360.665	現在不學習,再過一陣子你的學習能力就會下降。你的吸收能力也會下降。所以我們就是要好好來操練。然後我們來讀第四章的第一節到第七節。第四章的第一節到第七節,我們翻到一起來讀。
360.725	379.607	預備,來。人應當以我們為基督的指示,為神奧秘事做管家。所求於管家的是要他有忠心。我被你們論斷或被別人論斷,我都以為極小的事,連我自己也不論斷自己。
380.128	394.635	我雖不覺得自己有錯﹐卻也不能因此得以稱義﹐但判斷我的乃是主﹐所以時候未到﹐什麼都不能論斷﹐他要造出害。
395.725	417.954	引起顯明人心的意念﹐那時﹐個人要從神那裡得著稱讚。弟兄們﹐我為你們的緣故﹐拿這些事轉筆至己和亞波羅﹐叫你們效法我們﹐不可過於聖經屬際﹐免得你們自高自大﹐貴重這個親看那個﹐
418.234	420.178	好,我們今天先讀到這裡。
431.084	459.845	在所有保羅的書信裡面最容易被人家誤解的就是哥林多前書因為哥林多前後書裡面保羅跟哥林多教會有很多的誤會存在所以甚至有一些不愉快存在所以在他們在寫信溝通的過程裡面基本上有些措辭都會比較激烈比較激烈的時候甚至有時候他也沒有交代為什麼他們要吵架
460.265	472.23	或是爭執什麼。所以,我們對事情的來龍去脈就不瞭解。講白一點,講快一點,就是我們常常都是隨便亂引用哥林多前書,
473.183	497.159	例如第四章,第一節到第四節,我們就常常聽到有人說,我只要對神負責,你們其他人不可以論斷我。有沒有聽過這種言論?或是說,牧師就是他對神負責就好了,他每天在家裡打擾我婆,我們也不要理他。反正神會管教他,有天他打擾我婆打到一半的時候,他手就會斷掉。
499.957	519.623	不是這樣子。保羅不是這個意思。我們看第四章第一節。人應當以我們為基督的執事。執事這個意思不是現在的長老執事的執事,是另外一個字。聖經翻做差役。就是執行公權力的人。所以人應當以我們為基督耶穌十字架拯救福音的道理的
519.923	547.246	公務人,執行公務的人。我們有這樣的公權力。以神奧秘式,就是耶穌基督十字架救人的道理的管家。管家就是家裡面所有僕人的頭。所以第四章的第一節,保羅在提到說,保羅對於自己要好好來教導,好好來勸勉,分析,鼓勵,耶穌基督十字架的道理在每一個人身上,
547.466	564.945	成為每一個基督徒生命的總原則這件事情上他好像是在行使公權力因此他看自己的身份是堅定不移的所以我被你們論斷不是論斷說保羅這個其他一些其他的事情
565.145	580.619	是說保羅因為非常的堅持基督徒生命的唯一的最重要的標準就是耶穌基督實在的道理至於你是不是當醫生你是不是當教授你家有錢或沒錢甚至你是單身還是有結婚的
580.879	603.364	這些都不是真正的重點。這些都是次要的事情。弟兄姊妹，不要像哥林多教會人一樣，把以前還沒有信主的時候，在世界上的觀念跟價值，全部帶進教會。以至於進了教會之後就說﹖感謝主﹖以前沒有人幫助三天﹖今天好運都在主耶穌﹖以前沒有人幫忙我﹖今天我算我幸運﹖我遇到主耶穌﹖遇到貴人了。
605.094	617.837	主你就要幫我我現在世界上被人家欺負喔被人家瞧不起喔我在世界上怎麼樣怎麼樣怎麼樣喔沒有人幫我現在你要幫我喔你不幫我我就不信你喔
619.292	637.829	我就不來教會了。弟兄姊妹其實哥林多教會一直在被保羅糾正的就是這個問題所以這邊講說我被你們論斷保羅被他們論斷是說因為保羅怎麼講都是在講十字架的道理至於保羅他到底是哪一個大學畢業保羅說這根本不重要
638.49	663.299	至於保羅有沒有像亞波羅一樣那麼熟悉希臘人的腦袋以及希臘人談論事情的方式保羅說那個一點都不重要或是被別人論斷別人這邊指的是人間的法院這個世界其他人認為我們傳講實價道理他們不認同甚至我都以為極小的事因為連我自己也不論斷自己
664.019	687.362	什麼叫做我自己也不亂論自己那這個人不是沒有羞恥心嗎?連反省能力都沒有嗎?弟兄姊妹第四章所講的論斷都是講論斷有關於為什麼人生一定要以耶穌基督的十字架作為我生命的總原則以耶穌基督的十字架到底作為我生命的總原則真的有這麼的絕對嗎?
688.456	714.467	保羅說,連我自己也不用你們所看重那些事情論斷我自己。因為我只看我有沒有忠心來傳講十字架的原則。弟兄姊妹,你想說,牧師你在說什麼?你什麼叫做我沒有?什麼叫做我用不是十字架的道理來論斷我自己的生命?有沒有人曾經埋怨過說,服侍神有什麼用?
717.619	739.547	什麼好處都沒有。有沒有這種抱怨過?有嗎?不要舉手。單身的姊妹們也不要亂談。奉獻有什麼用?服侍神有什麼用?專心愛主有什麼用?老公現在也沒有。老公現在沒有又怎麼樣?保羅也沒有結婚了。
741.561	747.48	你懂意思嗎?我順便講一下這個事情。弟兄姊妹,就是很多東西觀念不是十字架道理的觀念。
748.217	776.842	為什麼只要有人他現在還沒有結婚還未婚你就一直在想說他這個一定怎麼樣你懂意思嗎?這是什麼觀念?人家這個覺得沒有遇到合適的現在還不想結婚不行嗎?你懂意思嗎?很多觀念都不是怎麼樣都不是十字架道理的觀念都是這個世界怎麼樣夾帶進來的觀念師母我們有沒有因為這個
777.722	803.878	這個遵行十字架道理而論斷自己其實都有 神都會提醒那現在重點是什麼重點是第六節所以保羅就跟他們說我因為你們的緣故所以我就拿我自己跟亞波羅來做一個比喻叫你們效法我不可怎麼樣過於聖經所記免得你們自高自大弟兄姊妹
804.138	809.2	懂意思嗎?你好好想一想,你們為什麼夫妻會有緊張?
827.927	847.036	為什麼你跟孩子之間關係會有緊張?為什麼你跟同事或親戚朋友、教會的人之間關係會有緊張甚至衝突?有沒有可能是因為什麼?因為你們之間那個衝突的點根本就跟十字架的救恩無關的事情。那這個就是我們生活中最常遇到的事情。
854.548	869.959	今天我就舉一個例子來講我們來看第七章我特別來談一下有關婚姻的問題因為我們以後是婚禮福音教堂一定會有很多跟我們對婚姻看法不同的人
871.374	895.215	會對我們有意見因為要在我們婚禮福音教堂裡面所舉行婚禮的人我們是熱烈歡迎還沒有信主的人來報名可是我們要讓他們先參加我們的婚前輔導班我們要讓他們知道為什麼你要結婚第二個你們兩個到底合不合適結婚我們兩個合不合適結婚關你什麼事
896.852	920.055	其實我們會透過在婚前輔導的過程裡面,讓他們正視一些問題,他們彼此的原生家庭,他們彼此的成長過程,他們對婚姻的期待跟看法,是不是能夠在我們的幫助裡面,
920.435	941.803	做進一步的釐清跟被建造,以至於他們這個婚結得好,他們不會很快就決定要離婚。我們其實做了很多社區的工作,這個都是我們後來做了十多年會發現,為什麼有很多的社區工作,老人跟小孩,老人沒有人管,小孩沒有人養。
942.483	964.695	我們發現其實都是因為家庭這塊出問題。婚姻出問題。所以心有餘力不足照顧老人和照顧小孩。所以只好教會出手。這個叫做整個工作裡面屬於下游的。那上游的源頭是什麼?就是婚姻家庭出問題。所以以至於老人小孩沒有人可以來好好照顧他們。照顧也照顧得很吃力。
965.435	988.155	所以未來我們在婚禮福音教堂的時候,我們希望成為臺灣的祝福。我們應該是第一個公開、開放給非基督徒可以來報名在淡江教會頂樓新堂舉行基督教婚禮的人。你說那很奇怪啊,不是基督徒怎麼可以在教會結婚呢?
989.036	1009.424	那所以我們叫婚禮什麼?福音教堂。所以我們相信,我們有信心,可以透過我們的婚前輔導,來幫助人認識婚姻,更認識生命,更認識上帝。好啦,那既然要這樣做,其實我們就先來用一個例子來看一下,其實我們常常在教會裡面當牧師也蠻可憐的,就是
1010.725	1038.056	你們要結婚喔?通常牧師是最後一個被通知的。牧師就是告訴說,你就幾年幾月幾號來幫我們證婚就對了。新娘是誰?我也不認識。不是,我不認識,她認識。你們怎麼交往?這不重要,沒關係,反正就來證婚就好了。婚前也沒有好好陪伴他們,沒有好好關心他們,他們就這樣結了婚。婚後之後怎麼樣?就要來找牧師協調說,要離婚了怎麼辦?這樣子。
1039.036	1065.166	那教會有時候也是很糟糕。婚前也不好好去輔導人家。不去關心人家的交往。然後婚後就任憑他們結婚。然後婚後他們真的活不下去了。又用律法要他們說基督徒不準離婚。你懂意思嗎?所以我才想說今天我們用第七章稍微來瞭解一下。其實我們很多時候是誤用了哥林多前書在一些原則上面。第七章的第一節。
1067.756	1074.129	第七章第九我們就直接從第八節開始講好不好第八節到第十六節預備來
1079.36	1108.351	不說﹐若他們常向我就好﹐倘若自己禁止不住﹐就可以娶﹐與其慾火攻心﹐倒不如嫁娶為妙﹐至於那已經嫁娶的﹐我吩咐他們﹐其實不是我所吩咐﹐乃是主吩咐說﹐妻子不可離開丈夫﹐若是離開了﹐不可再嫁﹐或是人同丈夫和好﹐丈夫也不可離棄妻子﹐
1108.951	1127.939	我對其餘的人說,不是主說,倘若一生有不幸的妻子,妻子也情願和她同住,她就不要離棄妻子。妻子有不幸的丈夫,丈夫也情願和她同住,她就不要離棄丈夫。
1128.439	1156.099	因為不幸的丈夫就因著妻子成了聖結,並且不幸的妻子就因著丈夫成了聖結。不然,你們的兒女就不潔淨,但如今他們是聖結的了。倘若那不幸的人要離去,就由他離去吧。無論是弟兄是姊妹,遇著這樣的事都不必拘束。神找我們,原是要我們和睦。
1156.459	1178.611	當我們沒有以耶穌基督的十字架的道理做我們生命的總原則,我們就會使用我們還沒有信主時候的一些觀念,繼續來雕塑我們聖徒的生命。
1178.951	1202.243	甚至成為我們衡量自己,是不是一個幸福或成功的基督徒的一個標準。這樣衡量自己,也衡量別人。這個在主的面前,主都不承認的。但是這一種動作,會造成給自己的傷害,跟給別人的傷害。阿們。明寬,誰規定成功的基督徒,頭髮就一定要像我這麼多?
1203.063	1207.248	我對著沒有嫁娶的和寡婦說,若他們常向我就好。
1221.203	1242.61	倘若自己禁止不住﹐就可以嫁娶﹐與其慾火攻心﹐不如嫁娶為妙。保羅是跟哥林多人的信件往來很多次所以有些前情沒有交代第七章其實是有人寫信來說那如果有人是已經結婚了可是因為先生是不信主的人太太是不信主的人
1242.79	1271.468	或是太太很火熱﹐她很想專心禱告﹐然後到處服侍﹐可是先生雖然也有信主﹐卻不太能夠配合。那這樣的情形之下﹐為了屬靈的緣故﹐為了專心服侍緣故﹐可不可以跟先生離婚。那保羅一開始是說﹐我同意就是說為了這個服侍﹐或是為了要專心禱告﹐有時候我們可以就是夫妻暫時分房。
1271.988	1287.531	然後可是不能一直是這樣,這樣會有虧欠,而且魔鬼怎麼樣?會趁虛而入,會讓那些忍不住有這些身心靈需要的一方,就讓魔鬼有那個破口可以來使他犯罪。
1288.012	1290.333	繁體中文，臺灣國語。繁體中文，臺灣國語。
1308.763	1327.272	有這樣的需要,那就可以去尋求在婚姻上的預備跟帶領。第十節,保羅說至於已經嫁娶,就是說現在在婚姻狀態裡面的人,不可以因為任何屬靈,所謂屬靈的理由,然後提出要離婚。
1327.892	1343.114	這邊是前提要搞清楚不是說只要你叫基督徒就不能離婚了你懂意思嗎?而是說保羅說是因為哥林多教會有人在提說我覺得我的先生太不屬靈了
1344.241	1370.49	我實在看不下去了為什麼我的先生不能像牧師這麼屬靈你不能因為你的先生沒有牧師屬靈就要跟你先生離婚這個是很荒謬的事情所以保羅是在回答說你已經在婚姻狀態裡面你不可以為了這一些所謂屬靈的理由而要提出跟你先生分開因為其實就是代表哥林多教會裡面的人有一些在討論自由的時候是非常的自私而且非常的極端
1371.578	1393.804	那11節說如果我叫你不可以因為這些所謂屬靈的理由去離婚而你也不聽你也真的把你的丈夫修了跟他離婚了那你不可以再去嫁別人因為你當初你講不聽你要跟你丈夫離婚是因為你覺得你的丈夫不夠屬靈所以我要跟他離婚然後我跟他離婚之後我就立刻去嫁了另外一個弟兄
1394.804	1404.756	那別人就會覺得你之所以要離婚的原因應該很可能是你只是覺得你的丈夫比不上別的弟兄。你的丈夫沒有別人
1405.845	1430.8	別的男人有六塊肌。你的丈夫沒有比別的男人帥或是有錢。你懂意思嗎?那所以如果你是為了所謂屬靈的理由而堅持在跟你丈夫離婚。然後也離婚了之後你又去嫁別人。那我們很難接受說你真的是為了屬靈的理由要離婚。是這種情形之下保羅說不可以離婚。聽懂我的意思嗎?
1431.561	1459.64	再來,第十二節,祂就說,所以我對其餘的人說,不是主說,倘若某弟兄有不幸的妻子,妻子也情願和他同住,他就不要離棄妻子。那妻子有不幸的丈夫,丈夫也情願和他繼續在婚姻裡面,對不對?那他就不應該離開他的丈夫,因為不幸的丈夫,就因著妻子而成了聖結,並且不幸的妻子,就因著丈夫成了聖結。什麼意思?
1460.401	1489.55	假設我的太太她不信主可是她依然繼續跟我很珍惜跟我的婚姻關係我不可以因為她沒有信主我就吵著要跟她離婚保羅說因為你不信主的丈夫他看你們的婚約是神聖的因著這樣的一個看法你的先生雖然現在還沒有信主可是他非常尊重上帝所設立的這個婚約那他就是聖潔的
1491.135	1506.096	而你卻為了屬靈的理由堅持要跟他離婚那你不勝解。因為你沒有守約。保羅就進一步講一件事情說那如果你因為你丈夫沒有信主不屬靈你堅持要跟他離婚那請問你的小孩如果沒有信主你要跟他斷絕父子關係嗎?
1507.278	1533.241	這個是保羅所提的。來,15節我們就開始講到,那什麼情形之下,教會是可以來同意離婚的。15節,倘若那不信的人要離去,就由他離去吧。無論是教會裡面的弟兄,或是教會裡面的姊妹,遇到這種,他的配偶因為不信的緣故,堅持要跟他離婚的。遇到這樣的事都怎麼樣?都什麼?經文怎麼說?不必拘束。
1533.951	1537.327	拘束這個字的原文是一個被動式的動詞叫做被當作奴隸
1539.121	1563.578	所以如果不信主的丈夫或不信主的妻子執意一定要跟你離婚,那保羅說有弟兄或姊妹遇到這樣的事情,覺得這樣很為難很痛苦,那就不必拘束。甚至教會也不可以強壓人不準離婚。那你說什麼叫不信的人?我就用一些淡江教會現在的一些原則,
1564.633	1589.691	不信的人基本上我們比較常遇到就是說如果遇到家暴的言語暴力的、精神虐待的各種他已經自己先背叛了這個婚約而且在這個過程中教會介入、輔導、規勸用真理要挽回他們要挽回他,他都不願意那就沒有辦法
1589.991	1606.383	那教會這個時候就不可以為難那個受害的弟兄或受害的姊妹,壓著他說你不準離婚。第二種情形是什麼?第二種情形是,有些人他不是,你說他不是不信的,他不是也是我們教會的弟兄嗎?他不是也受洗是基督徒嗎?
1606.903	1623.233	可是如果他也幹了一樣的事情家暴言語傷害各種精神折磨然後教會也介入了按照《馬太福音》第18章的講法對不對先兩個人去跟他講再不行長老去跟他講再不行牧師出動都講不聽就把他當外邦人
1624.65	1653.938	那他就變成什麼人?不信的人。所以請問不要再用一個東西壓著別人說你很可憐我知道你先生對你很不好然後欺負你打你可是因為你是基督徒基督徒裡面有一個聖徒叫王寶川因為他苦手寒藥18年了你就學習他吧請不要讓我聽到有這樣的言論因為這不符合聖經的教導在哥林多前書裡面愛與自由是非常正確的被使用的
1654.582	1677.234	所以保羅要用正確的愛跟正確的自由來教導那些誤用愛與自由的人。這是教會的一個立場。所以我們其實今天從這個裡面學到兩件事情,然後我們要來撥餅。第一個,你不可以因為在婚姻裡面或是家庭裡面,你自己的配偶或是你自己的子女目前軟弱。
1678.746	1685.942	只要祂沒有執意要離開你,而你也沒有要離開祂,我們都應該繼續的來幫助祂。
1687.449	1713.549	因為保羅說,這個第16節,你這做妻子的,怎麼知道不能救你的丈夫呢?你這做丈夫的,怎麼知道不能救你的妻子呢?那你這做父母的,怎能不知道你可以救你的兒女呢?你這做兒女的,你怎麼會認為上帝一定救不了、挽不回你的父母?所以保羅第一個珍惜我們,
1714.155	1731.913	要在這種家庭的關係裡面,要有一種守約的態度。除非是對方他真的執意要離開,他又大大傷害你。第二個,基督徒不要主動去勸別人離婚。你看他真的很可憐,一直被欺負。
1734.053	1760.981	你只能為他禱告,然後跟他講就是說,其實教會並沒有說人不準離婚。在某一種被傷害情形之下,教會是可以支持他的。但是你不要禱告為主,天天照三餐傳簡訊給他說,趕快離,趕快離,趕快離。我跟你講,你出於好意叫他趕快離,有一天他們哪一天夫妻感情好了,你就死定了。
1762.705	1775.343	他就會跟他先生說,其實你知道嗎?你應該感謝我的。當初教會每個人都叫我跟你離婚,但是我給你機會。我跟你講,他先生一方面感謝他的妻子,二方面恨死了其他的姊妹們。
1776.51	1799.356	所以這是我們一個有智慧的做法,可以嗎?可以。最後其實保羅在第七章講很多事情,他說單身的人不要因為覺得自己是單身,就覺得自己好像是次等的,那個不是正確的觀念。因為保羅講一句話,他說單身是一種恩賜,結婚也是一種恩賜。
1800.196	1824.385	既然是恩賜,都是靠主恩典。也就是靠主恩典才有婚可以結。靠主恩典才有辦法守獨生。但是不論是守獨生還是在婚姻裡都要怎麼樣?要守約、施慈愛、要聖結。我們就一起來播丙。我們請丙輩同工到前面來。
1834.445	1861.45	希望今天的信息可以服侍到我們當中在家庭裡面、在婚姻裡面正在危機或是正在很辛苦裡面。燈幫我調整一下,謝謝。讓我們一起來珍惜關係吧。
1862.927	1892.394	不要太早放棄。我記得,我們小太陽做11年了。前兩年我發現,第一屆的小太陽有一個小朋友,竟然已經念大學了。我看著他,我抓著他的手,我真的很激動,跟他說,某某某啊。你知道嗎,你小學的時候,第一天來教會的時候,那時候牧師一直就開始問你迫切禱告。牧師那時候禱告是說,主啊,讓這個人小學可以畢業就好。
1894.889	1919.072	因為他常常不去上課。我說,現在你已經念大學了。保羅不是講嗎?為什麼你會認為你的努力會沒有用呢?為什麼你不認為說你的堅持跟努力和禱告,一定可以讓這個人被神找回來?兄姊妹不要太快放棄。有沒有人本來要放棄的?
1920.623	1939.653	放棄你身旁的人,不要放棄,好嗎?有時候他都還沒有放棄你,你就放棄他了。第二個,我們也要正確的使用自由。每個人都在神的眼中都是尊貴的。沒有一個人可以被人家隨便對待的。
1940.708	1962.194	因此當我們發現有人隨便對待一個人的時候。我們不可以姑息。我們更不可以成為這種暴力的幫兇。跟他說你就是人。反正基督徒不能離婚。反正你嫁這種就是上輩子欠他的。不要有這種想法。
1963.183	1972.337	主耶穌是上帝是為人申冤的主。上帝的公義、自由與愛,要很正確的被教會來行使。阿們。
