start	end	text
1.22	30.472	好,感謝神。我們一起來打開今天的經文。監聽可以大聲一點。哥林多後書第五章第十一節到二十一節。哥林多後書第五章第十一節到第二十一節。我們翻到了,一起來讀神的話語。
32.159	47.512	我們既知道主是可畏的,所以勸人,但我們在神面前是顯明的,盼望在你們也是顯明的。
48.575	73.918	我們不是向你們再舉賤自己,乃是叫你們因我們有可誇之處,好對那憑外貌不憑內心誇口的人有言可達。我們若果癲狂是為神,若果謹守是為你們。
75.691	96.091	原來基督的愛激勵我們,因我們想一人既替眾人死,眾人就都死了。並且祂替眾人死,是叫那些活著的人不再為自己活,乃為替他們死而復活的主活。
96.852	116.837	所以,我們從今以後,不憑著外貌認人了。雖然憑著外貌認過基督,如今卻不再這樣認祂了。若有人在基督裡,他就是新造的人,就是已過,都變成新的了。
117.517	142.909	一切都是出於神,祂藉著基督使我們與祂和好,又將勸人與祂和好的職分賜給我們。這就是神在基督裡叫世人與自己和好,不將他們的過犯歸到他們身上,並且將這和好的道理託付了我們。
143.609	163.673	所以,我們做基督的使者,就好像神借我們勸你們一般,我們替基督求你們與神和好。損死那無罪的,替我們成為罪,好叫我們在祂裡面成為神的義。
165.196	184.688	感謝主,主耶穌是叫我們從死裡復活的。這對於昨天從槍林彈雨裡面回來的弟兄們特別有感受,非常感恩。我們一起來讀神的話語。第11節,保羅說,我們既知道主是可畏的。什麼是可畏的?
185.589	191.893	繁體中文，臺灣國語。繁體中文，臺灣國語。
214.787	222.77	哇,基督教也講報應啊,是的。只是我們的報應不是因果報應,
242.056	266.39	我們要面對的是一位公義的上帝。我們到耶穌基督第二次再來的時候,所有的人,就算我們已經死掉的人,都要從死裡復活,被叫到基督的審判臺前。我們這一生裡面,所有說過的每一句話,
267.722	292.038	所有做過的每一件事情,所有心裡面的每一個念頭、意念,不論是你那個念頭、意念有沒有實現,有沒有真的去做過,所有這一切都會顯明出來。弟兄姊妹,如果真的有地獄的話,
293.37	319.639	那在基督臺前很可能是最可怕的地獄但是感謝讚美神因著耶穌基督為罪人死在十字架上讓那些願意領受祂的救恩的人祂就赦免我們的罪以至於我們在基督的審判臺前可以站立得住因此弟兄姊妹我們要敬畏神
320.879	331.173	為什麼要敬畏神?因為如果我們不敬畏神,我們就不稀罕祂的救恩。我們就不覺得需要祂的赦免之恩。
332.312	351.31	那將來在基督臺前的時候,我們面對的是全宇宙的,全世界的人類。然後要把我們這一生所有裡面一切不為人知的一切,全部要顯露出來。到那日,你們就說,原來莊育民是這種人。
355.964	356.664	以至於呢,
384.616	406.181	都不敢看上帝的榮耀。但是哥林多後書告訴我們說,新約來到。耶穌基督來不是要定我們的罪。耶穌基督來是要怎麼樣?赦免我們的罪。這就是舊約跟新約的差別。因此耶穌基督來所要告訴我們的是祂的赦罪之恩。
407.466	422.918	讓我們知道祂願意替我們擔當我們的罪惡、醜陋、假冒為善、汙穢以及我們當受的咒詛跟審判。祂替我們在哪裡承擔呢?十字架上承擔了。
423.643	441.868	好叫我們在基督臺前的時候,可以因為耶穌基督的寶血洗盡我們的汙穢,而可以站立得住。因此保羅說,神是怎麼樣?可畏的。我們要敬畏神。請告訴你,隔壁的說,我們要敬畏神。
444.77	466.231	因此十一節保羅說,我們既知道主是可畏的,所以才來勸勉大家。我們要常常勸勉大家,我們的主是可畏的神。但我們在神面前是顯明的。什麼叫做我們在神面前是顯明的?就是我們在神面前是沒有辦法遮掩的。
469.667	492.478	我們跟神之間是沒有任何一種天花板可以讓神看不到我們的。就算我們的很多的想法、念頭、言語是躲在我們的腦袋裡面、躲在我們的心裡面,神也都聽得一清二楚、看得一清二楚。甚至我們是躲在背後講人家壞話、閒話的。
492.858	519.689	神也都看見。因此,我們在神面前是顯明的。弟兄姊妹,我們越早能夠看透這件事情,就是我們每一個人在上帝面前是顯明的,我們就越是一個蒙恩的人。因為你知道在神面前沒辦法狡辯,也無法遮掩,你只好選擇來面對自己,面對神。
520.691	541.583	你的生命就不會一直活在一種自欺欺神裡面。因此,你的生命就開始敢面對自己,面對神。因為神告訴我們說,祂派耶穌基督來是要擔當我們的罪,以至於你敢看神。你敢看神的榮光是因為你敢面對你自己。
542.363	570.736	因為你以前不敢面對你自己,所以你害怕遇見神。因此,常常提醒我們在神面前是怎麼樣?是顯明的。對我們生命是一件非常好的事情。因此,我們不要活在自欺欺神的生命裡面。但保羅下一句說,我在神的面前是顯明的,但我更盼望在你們的良心裡面也是顯明的。
571.476	582.473	什麼意思呢?保羅說,既然我在神的面前是顯明的,無法隱藏的。可是弟兄姊妹,請容許我很冒犯的問一件事情。
583.439	608.705	你覺得你敢在別人的良心面前顯明你自己的真相嗎?我們其實都不太敢。我們也都很害怕。但是我想,如果沒有耶穌基督赦罪的救恩,沒有人敢在別人面前顯明自己生命的真相。阿們。誰敢啊?大概只有羅牧師敢。
610.623	613.425	這些事情會傳送到您見主面為止。誰敢?
624.087	653.639	如果沒有耶穌基督赦罪之恩沒有人敢在別人的良心面前真正的顯明自己真正裡面生命的軟弱恐懼害怕曾經做過的過犯以及對你的這些不好的意念那如果沒有耶穌基督的赦罪之恩就代表明寬你一輩子都會跟你太太假來假去益春
656.527	686.379	我們蒙大恩了。你懂嗎?如果沒有耶穌基督赦罪之身,誰敢?大家一輩子假來假去,跟配偶假來假去,跟兒女假來假去,跟父母假來假去,跟弟兄姊妹,跟牧師假來假去,那個就不叫信仰,那個叫宗教。你懂意思嗎?這個世界怎麼樣?都是假的,然後什麼時候揭曉那個謎底?基督的審判臺前,大家都不會看你。
688.2	711.414	那你就變成人間煉獄,你懂意思嗎?但是感謝神,讓大家有出路,有活路可以走。因此神派祂的兒子耶穌基督來,怎麼樣?擔當我們所有人的汙穢,過犯軟弱。祂鼓勵我們怎麼樣?願意麵對上帝。一個敢面對上帝的人,就是開始敢面對自己的生命。
711.834	737.902	一個願意開始學習面對自己生命的人,就開始敢面對他身旁的人。這為什麼有很多教會裡面有很多感動人的見證。如同我們下禮拜,這個臺神的教授,從麻將A咖到神學教授,他以前真的很混,我問過他,說真的是,我就想說,這種人也會變成愛丁堡大學的博士,
739.514	762.795	這是太誇張了。因為他以前雖然是麻將A咖,但其實是人生訓咖。但是後來上帝做了好奇妙的工作,把他挽回。教會鼓勵弟兄姊妹,我們要熱烈傳福音。其實數字是會說話的。你看一下我們週報,我們上半年受洗的人數只有18人。
763.592	782.744	這是淡江教會成立以來最糟糕的一個半年。代表什麼?我們在傳福音的事情上,我們虧欠神,也虧欠那些需要福音的人。阿們。因此,這個十萬面君,不是,十萬面子,
784.565	801.845	昨天被打到腦袋,抱歉。十萬面子怎麼樣?十萬軍,大家一起來傳福音。不然我們在基督臺前都交不了戰。然後教會在下半年總共邀請了六位福音講員。
802.824	820.096	都要來說說生命被神大能翻轉改變的故事。都會做酷卡。請你不要讓莊牧師把這些都帶回家。這個無法熬成莊雞骨頭的那種的。很硬。所以招待桌那邊都有很多都拿回去。
820.776	844.995	這下禮拜祂就來了。我們可不可以把握這六次。牧師這次邀這六個都非常的棒。都是非常感動人的。我們就好好去傳福音,可以嗎?記得有一天我們都到哪裡?基督的臺前。那天到基督臺前的時候,鄭惠美,鄭惠美就站上來。結果上帝就拿了一堆酷卡。你一張都沒有傳。
847.346	868.264	臉紙十萬包都給你,你一包都沒發。也就是說,感謝神,如果不是耶穌基督,世人都活在虛假裡面,最後是滅亡,因為沒有人敢在別人的良心面前顯明、明顯。
870.486	888.983	因此保羅就是說十二節我們一起讀好不好十二節預備 來我們不是向你們再舉薦自己乃是叫你們因我們有可誇之處好對那憑外貌不憑內心誇口的人有言可黨
889.991	900.912	格林多教會是保羅創立的教會。裡面的弟兄姊妹以前都不信耶穌的。是保羅帶領他們信了耶穌成為神的兒女。
901.664	928.494	但是後來保羅就又到其他地方去傳福音了。結果就來了一些假教師、假使徒,就開始怎麼樣?煽風點火,就開始批評保羅的不是,然後就說保羅是假使徒。這就很像怎麼樣?我跟師母出國去服事,然後就有一男一女進了我家的門,跟我三個兒子說,其實我們才是你的父母。
929.394	945.485	姓莊的跟姓鄭的是騙人的。然後我那三個兒子立刻接受。然後到戶政事務所改身分證。差不多就是這樣。怎麼有這麼蠢的?有點多消息在幹什麼?怎麼這麼容易?這麼容易?
947.176	964.267	就走開了。就懷疑保羅。因此保羅就講一件事情說我不是再次向你們推薦自己。我只是把我怎麼樣在耶穌基督面前在你們的良心面前的行事為人再次跟你們分享提醒你們我們的為人是如何你是知道的。
965.128	983.934	保羅說,好讓你們去回答那一些人,那些人是憑外貌誇口,不憑內心誇口的人。什麼叫憑外貌?外貌原本是臉。什麼叫憑外貌誇口?其實整個哥林多前書跟哥林多後書,保羅一直講,你們哥林多人現在會遇到這麼多
985.043	1007.46	奇奇怪怪的狀況只有一個問題的根源是什麼就是你們信了主之後仍然把你們信主以前世界給你們的價值觀或是你們對人生的夢想或是你們對人生什麼叫做成功的人生令人羨慕的人生的那一些標準通通夾帶進教會
1008.609	1034.108	在你們成為聖徒之後你們竟然還用世界上的一些標準世界上的一些東西來決定什麼叫做成功的基督徒什麼叫做令人羨慕的基督徒這就是問題所在的因此大家進了教會之後還拼命的用口袋裡面偷偷藏的這個世界上的標籤彼此貼來貼去
1035.742	1053.235	不是用真理來做判斷而是用世界上的標籤彼此傷害分門別類爸爸貼兒子媽媽貼爸爸然後呢兒子貼牧師互相貼來貼去你懂意思嗎結果呢沒有因為這樣
1054.104	1080.662	而在基督裡面享受到真正的自由反而因為這樣教會怎麼樣亂七八糟彼此傷害分門別類這個是哥林多教會他的問題保羅說不要憑外貌誇口外貌指的就是這些世界上的東西這些東西不是不好家裡有錢不好嗎誰希望家裡不要有錢的請把錢給我
1083.063	1112.033	很會念書不好嗎?沒有啊。我跟你講我自己之前這個從開始服事到現在在校園裡面擔任這個他們所邀請的這一些學園傳道會也好校園團結也好擔任他們所舉辦的各式各樣的營會擔任培靈講員超過一百場。我跟各位講我其實非常瞭解一件事情我如果不是因為臺大畢業
1113.695	1122.059	我如果不是因為人生充滿了戲劇性的故事,我也不會有這麼多的機會,有機會去跟學生傳福音。
1123.968	1144.291	但是我要講的是什麼?不是說念臺大不好。不是說家裡有錢不好。不是說人長得漂亮不好。而是保羅在《哥林多前後書》一直在跟我們講一個觀念,就是說人生要去分辨優先次序。什麼是人生中最主要的事情?什麼是人生裡面次要的事情?
1144.872	1165.964	治療的事情包含說,神讓你長得漂亮,讓你頭腦聰明會念書,有音樂的天分,有藝術的天分,然後家裡有錢富有,腦筋動得快。昨天經過這個七彈就知道,真的是百無一用是書生。我們這種人就是怎麼樣?讓指揮官指揮去當炮灰就可以了。
1167.415	1191.725	我發現弟兄們好多頭腦好好的。基本上昨天的七彈對抗賽,就是有一對姓蔡的兄弟,互相在揣摩他的哥哥跟他弟弟在想什麼。就是這樣子互相,後來怎樣,各贏一場。真的,我們其他人都是聽他們兄弟在那邊互相算計對方。我哥哥以前都怎麼對待我,我弟弟都在想什麼這樣子。
1192.585	1217.769	非常的精彩。我們這種書生只能說,遵命遵命,然後就去當被當炮灰。這個真的是很有趣。怎麼講這個來?主要跟次要。弟兄姊妹,不是那些神給我們的祝福不好,而是那個叫次要的。主要的是什麼?耶穌基督十字架救人的福音。沒有這一個,沒有一個人能夠在耶穌基督的臺前站立得住。
1219.019	1238.867	那些次要的都沒有用,但是如果主要的我們得著了,我們就能夠把次要的轉換成為主要的事情效力,為生命中有價值有意義的事情效力的資源。保羅所強調的不是非此即彼,either or,保羅所強調的是優先次序。
1241.118	1269.291	這才是保羅要講的重點。我們基督徒最常遇到的問題就是把次要的變成主要的,然後把主要的變成不要的。聽懂我的意思嗎?我們把那些次要的、神要來給我們做祝福的、做資源的、做工具的、做管道的東西,把它變成最主要的,然後把那些最要命、最根本的主要的耶穌基督十字架救人的道理變成不要的。
1271.425	1293.254	這就是哥林多教會的問題。第13節,我們一起來讀。預備,來。我們果若癲狂是為神,若果謹守是為你。保羅說,那些別人看我們是一群怎麼樣?癲狂的人,不要命的人,瘋子。昨天我就看見我們弟兄真的是癲狂的人。
1294.787	1317.355	你知道我們昨天打那個對抗賽,師對抗,最後一場是怎麼樣?有分成攻擊方跟防守方。然後攻擊方就是要去想辦法搶那個防守方陣地的那個兩面大旗。但是規定去搶旗的只能是隊長,其他人搶不算。所以防守方最後就決定,
1318.268	1345.461	採用黃花崗72烈士的這種趕死隊的精神。就是一堆人當趕死隊幫隊長擋子彈。你懂意思嗎?我們就看見了我們弱國癲狂四位隊長。回去師母就幫我驗傷。其實我大部分的傷都是在背後,不是在正面。
1346.647	1364.347	不是我隊友打的。因為本人一開始也被隊長選為趕死隊議員。結果他一聲號令,我們就衝出去。本人一衝出去到點面前,卡彈。哇!主啊!立刻準備逃跑。我所有的傷都是逃跑的時候被射的。
1369.565	1398.383	但是我們有幾個敢死隊,真是不怕死。有人中了三十槍。皮開肉綻,真的是想說,這個教會是什麼團體?參加一個什麼弟兄會回來傷痕累累、家暴。這些弟兄們為了完成這個任務,不怕死、癲狂。其實我們人生在世也為了很多次要的事情,不怕死。甚至付我們一生的代價出去。
1399.787	1419.627	但是那些次要的事情,如果沒有主要的事情做根基的話,那些次要的事情,我們一個都帶不走。沒有一個能夠到永恆裡面去,到永生裡面去。你比我有錢,我比你窮,這是次要的事情。為什麼?因為我們死的時候都一樣。
1422.022	1448.357	我們什麼都帶不走。你別以為我多念三個博士,感謝主,這叫次要的事。但如果你這一生沒有用,你多念這三個博士,好好的效力在最主要的事情上,就是用神給你的智慧、影響力、機會,好好的去用這樣的資源去傳揚,去做見證,去說明耶穌基督十字架救人的福音的話,你是浪費這些次要的事情。
1448.797	1472.511	沒有為主要的事情效力而你跟我一樣去見主面的時候你的那些次要的事情那些祝福管道機會通通一點用處都沒有什麼都沒有帶走因此弟兄姊妹我們要懂得過日子因此保羅說我們若果癲狂是為神若果謹守是為你們什麼叫謹守做人做事循規蹈矩不要胡來
1473.558	1497.244	我們為神是瘋狂的,因為怎麼樣?我們這個是義無反顧,就是知道人生該這樣活,因此是沒有保留。但是我們對人的時候,要中規中矩,循規蹈矩,不要讓人家對我們有一些把柄,一些說話的一些,對我們行事為人有一些批評、論斷,以至於怎麼樣?用這個當藉口。
1498.097	1527.464	拒絕我們所見證或我們所傳的福音。阿們。保羅說,我們是為神瘋狂的一群瘋子,但是我們為了不讓你們跌倒,我們對你們很多事情上,保羅這邊哥倫多前後書講,很多事情上,金錢的事情,說話的事情,承諾的事情,保羅一一解釋,保羅說不要用這些東西誤會我們,以至於拒絕我們跟你們傳的耶穌基督救人道理,免得你們到基督臺前的時候,你們站在一邊站立不住,
1528.49	1542.7	因此,向神癲狂,向人謹守。這句話重不重要?太重要了。我們一起來講一次。向神癲狂,向人謹守。向神怎麼樣?癲狂,向人呢?謹守。來,說給你各位聽一次。預備,來。
1546.988	1552.071	弟兄姊妹,我們很誠心誠意的問,我牧師問大家,
1576.988	1585.149	到基督臺前的時候你最擔心的是什麼?請容我這麼說
1586.817	1615.538	可能很多基督徒擔心的是到底耶穌基督再來的時候到基督的審判臺前祂到底是判我上天堂還是判我下地獄我不確定因為我看我這一生我跟上天的關係若即若離名義上是基督徒實際上所做的跟基督徒應該做的差很多因此到基督臺前是一種恐懼不知道是被判生還是被判死
1616.937	1631.376	但是弟兄姊妹如果照保羅他所做的見證跟他給我們的勸勉每一個基督徒都應該熱烈的盼望來到基督的審判臺前因為在那邊神要稱我們為義
1632.91	1660.005	保羅最擔心的還不是他是被判上天堂還是下地獄,保羅最掛慮的事情是,我有一天到基督的臺前的時候,神是否會稱讚我為一個忠心良善的好僕人,不負所託,因為神把一個救人的道理,喜事給我們,而我們忠心去傳揚,就救了許多的人怎麼樣?一起不致滅亡,反得永生。
1661.869	1688.298	我想很多時候我們要常常提醒自己到底面對基督一定再來而且在神的面前一切怎麼樣都是顯明的他要照個人所行的或善或惡報應個人面對這件事情的時候我們的焦點在哪裡我們的焦點是到底那時候我是上天堂還是下地獄如果你永遠只停留在這個層次真的是不及格
1689.77	1717.554	我覺得我們這一生保羅太提醒我們因為一個人既然替眾人死了眾人就都怎麼樣死了弟兄姊妹面對我們本應該永遠滅亡會面臨第二次的死什麼叫第二次的死第一次就是你這個你今生今世的死可是不要忘記基督再來你會復活復活是叫你去哪裡環遊世界不是先叫你來基督臺前審判你
1719.326	1728.865	你懂意思嗎?所以我們應該在主的面前保羅說基督既然已經替我們眾人死了我們就都怎麼樣?死了
1730.367	1756.805	我們就不會再死。也就是說我們不用再去擔心到基督臺前到底是被判生還是被判死。保羅說每一個蒙恩得救的神的兒女最該掛慮擔心的不是我到底會被判生還是被判死而是應該去掛慮的是我今生今世蒙了這麼大恩我該怎麼活?我該為誰而活?我該活成什麼樣子?
1758.114	1766.437	因此保羅說弟兄姊妹一個基督徒不應該繼續擔憂的是他到基督臺前是上去還是下去
1783.114	1800.106	他應該要去思考的是,我到那個時候,我可以跟主交賬嗎?我對得起我的主嗎?我對得起那替我而死的主嗎?我這一生是在活耶穌的命。耶穌用祂的命換我的命。
1800.606	1820.362	那我有沒有好好活出耶穌基督給我的新生命?剛剛經文有講到若有人在基督裡他就是新造的人舊事已過都變成新的。為什麼若有人在基督裡他就可以是新造的人得人因為沒有他就是新的創造等於是你人生重來一次
1821.783	1841.622	在基督裡的人,他人生就是用耶穌的命重來一次。那你怎麼活?你為誰活?你如何活?活成什麼方向?今天教會,今天基督徒,最大的問題還不是不知道該怎麼面對死亡,而是不知道該怎麼面對如何活。
1842.705	1866.286	面對自己的人生到底該怎麼走?如何活出有意義的?如何將神給我們這些次要的這些祝福、這些機會、這些資源跟才能,把它用在最主要的事情上,產生永生的果效。阿們。我想這是我們最需要去面對的。我覺得這個保羅今天真的講得非常的好。
1867.824	1894.665	好 我們就把經文讀一下來 16節 預備 來所以從今以後不憑著外貌認人了雖然憑著外貌認過基督如今卻不再這樣認祂了若有人在基督裡他就是新造的人舊事已過都變成新的了一切都是出於神祂藉著基督使我們與祂和好
1896.186	1913.798	又將勸人與祂和好的職分賜給誰?我們。這就是神在基督裡叫世人與自己和好,不將他們的過犯歸到他們身上,並且將這和好的道理託付了我們。
1914.258	1923.585	我想這個不用再解釋大家一讀就懂但是需要做一個說明是保羅是有欠這些人嗎以至於保羅不僅要勸他們還要怎麼樣
1944.189	1967.621	弟兄姊妹,我們現在就是少了保羅這一份心。保羅說,我可不可以替基督求你們,接受祂替你們死的這個福音。
1969.258	1987.67	藉著這個福音,你們可以跟神和好,不致滅亡,反得永生。不僅是有永生,連今生都知道該怎麼活,連今生都知道該為誰活。保羅說,我可不可以替基督求你們,
1988.814	2013.617	接受基督赦罪之恩。我們今天其實就是少了這一份。因為我們常常還在為自己活。弟兄姊妹,我們要來播餅。親愛的弟兄姊妹,其實我們可以做很多的事情。把神給我們這些優先次序裡面是好的。包含我們的時間、金錢、
2014.718	2042.53	才能、熱情、公正的性格、憐憫人的心腸,把它用在主要的事情上,就是向世人傳揚耶穌基督救人福音的道理。這才是最聰明的人,這才是有意義的人。我們剛剛讀了5章17節,我們再讀一次好不好?因為這句話改變了我的一生。5章17節,我們一起來讀,預備,來。
2053.865	2073.478	弟兄姊妹我大學二年級的時候第一次到教會這故事有的人聽過了那天不是主日聚會是剝餅聚會就是今天我們待會要做的事情
2075.555	2086.307	我為什麼會在高中的時候認真的念書?我一定要念臺大。我不是為了要出人頭地,
2087.244	2115.671	是因為我從小很想知道一件事情人活著到底有沒有特定的意義如果人活著沒有特定的目標沒有特定的價值跟意義那人這樣活也可以人那樣活也可以當好人也可以當壞人也可以反正人死如燈滅就都沒了
2116.869	2145.722	我從小就非常想要知道到底人活著有沒有特定的價值意義,人生的意義是什麼。因此我的老師鼓勵我說,如果你能夠考上臺北有一間椰子樹很多的大學,那邊的教授告訴你的人生的意義,保證是最正確的意義。我是因為這個理由,因為我想要知道人到底該怎麼活。所以我非常認真的念書。
2146.92	2174.798	我非常感恩神在賜藥的一些事情上有一些祂有給我恩典當然並不是所有的賜藥的事情上我都有恩典例如說有弟兄就一直勸我跟他們去潛水我說主啊此事萬萬不可有弟兄一直勸我吃魚我說此事萬萬不可有很多事情我很軟弱打漆彈我只能被打不能打人但是神有給我一些賜藥的恩典有沒有 有
2176.288	2198.553	祂讓我會念書是一個恩典。我高中畢業那年考大學,我是桃園縣的榜首,考進臺大。這個是神給我一個恩典。因為我想要用這一個恩典,想要用這個優勢或是這個機會,讓我可以往上再爬一步,找到或是看到人生的意義,人為什麼要活,該如何活。
2199.753	2221.935	我只記得我進大學的新生訓練第一天,我的系主任果然沒有讓我失望。他就在第一堂課就開宗明義告訴我們,人生的意義就是如何賺大錢。因為本人非常不幸的讀了一個系叫臺大財務金融系。這個系的目標就是如何賺大錢。
2223.456	2240.55	所以第一堂課下課大家去上廁所我就背著書包回桃園我跟我的父親說這個戲不能讀會出人命的我父親說什麼戲這麼可怕我說因為戲主任說人生的目的是為了賺大錢我爸爸說這是一個非常好的人生定義
2242.824	2257.614	所以我沒辦法轉系。我爸又逼我回去念財經系。我念得很痛苦,所以我自己找出路。我自己去找哲學。我自己去找宗教信仰。我到大二的時候,我覺得我非常痛苦。因為我找不到人生的意義。
