start	end	text
2258.234	2285.966	所以我就拜託我班上一個基督徒同學。他的成績也沒有比我好到哪裡去,也是跟我差不多混。其實我們的標準叫混,但是人家都是北運女的,你懂意思嗎?那我就說,你怎麼每天看起來很快樂的樣子?他說不知道,可能是因為我信耶穌吧。我說信耶穌可以使人快樂。他說對呀,因為信耶穌可以讓你找到人生的什麼?
2287.841	2300.047	聽懂信耶穌給我找人生意義我就說那你可不可以帶我去教會他說今天教會沒有營業
2303.575	2327.738	我說教會只有禮拜天早上有營業。他說也不是這樣,就是說你什麼都不懂,有一些聚會你去也沒有用。我說我不管,那邊給我人生意義,你帶我去。他說好啦,今天晚上有一個剝餅聚會。我講過這個故事,我自以為聰明,我跟你講臺大人都自以為聰明。我想說剝餅聽不懂,我以為剝餅。
2329.497	2357.67	我也說耶穌有十二使徒,有彼得,有約翰,第十二個叫做聖波比。後來王採華抄襲我這個,就弄一首歌。所以我就去了這個波比聚會。我就在那邊聽牧師講,我一直在想說他什麼時候要講波比的故事。他在講什麼耶穌、保羅、彼得什麼那些,我什麼都沒有講到波比。
2358.729	2383.92	那個聚會讓我太失望,他講一堆我都聽不懂。所以聚會結束之後,我就很失望離開教會。當我要走出那個門口的時候,我回頭一看,柱子上面有一行精神標語,若有人在基督裡,他就是新造的人,舊事已過,都變成新的。這是我第一次看到聖經的話。我第一個念頭是說,耶穌就是狂。
2386.869	2407.796	他的意思就是說你哪一天人生混不下去走不下去的回來找我我可以讓你重新來過我說我接觸這麼多宗教信仰這麼多的哲學沒有人敢做這種保證要嘛就是開空頭支票要嘛就是真的很神因此我在跨出教會門檻的那一剎那
2408.968	2432.575	我就跟耶穌說,我如果哪一天走不下去了,我一定會回來找禰。但是當我兩隻腳都跨出去的時候,我告訴我自己,我莊育民不會有那一天的。最後的故事大家都知道,人生真的走投無路,經歷自殺,經歷要離婚的事情,就讓我想起那一句話,但那已經是很多年以後了。
2434.326	2463.691	因為我想要讓人生可以從頭來過。我因為那一句寫在牆壁上的話。我重新回到教會。我的人生開始怎麼樣?成為新造的人。後來故事就一路發展到如今。弟兄姊妹我要講的是什麼?不要小看隨便寫在牆上的一句話。不要小看你去發面子上面的一句話。十萬包面子我就不相信不會打動一千個人的靈魂。
2465.213	2484.882	就夠本。我想就是這麼簡單。請大家可不可以一起來參與這樣的事情。出錢、出力、出時間。發面子太容易。我們懇求主讓那個面子有N高好不好。讓祂不用你講話,發面子就可以感動人。
2485.981	2510.315	可以嗎?這是真的,因為我的父親我爸爸莊伯伯,我這個當牧師的兒子,我口才還算不錯的人,我跟他講了一百萬句以上傳福音,他從來不理我。但是後來他什麼信耶穌的?他是透過一座不會說話的山,上帝透過那一座不會說話的山向他傳福音。
2512.585	2532.603	祂就決定要受洗。弟兄姊妹,上帝做事好奇妙。不要小看你所做的每一件事。我們待會要來剝餅,但是牧師開始鼓勵。第一個,素智會說話。我們欠福音的債,欠的很兇。我們要加油好不好。我們都來認領這個傳福音面子。
2533.524	2561.433	經費我們今天就把它搞定好不好十萬塊而已我們湊不出來我不相信一包一塊錢都是一個機會第二個我們可不可以為這個平安長者福音參會來禱告並且奉獻這個我們可不可以目標一百個有需要的老人你自己邀請你的親朋好友就自己付但是我們這次主要是想說針對我們做小太陽做十一年
2563.558	2592.575	你知道嗎?即使常常來接送小太陽的小朋友,不是他的爸爸媽媽,是他們的誰?阿公阿嬤。你知道嗎?有一年,我送一個一年級小朋友,小學一年級小朋友,送他回家,因為他剛來參加小太陽,因此我開福音車送他回家,我按電鈴,過了很久才有一個老人來開門,我說請問他的爸爸媽媽在嗎?離婚了。他的阿公阿嬤呢?離婚了。我說抱歉,那你是誰?
2593.131	2619.618	我還在那裡坐。我說,阿祖你幾歲?快90了。平常就我們兩個。我可以想我那時候,我眼淚就滴下來。阿祖90歲,小學一年級,教會不出手怎麼辦?11年,我們走過去11年,我們陪伴將近1000個家庭。
2621.067	2642.643	但是我是覺得我們現在對小朋友都很好對不對。可是我覺得其實還有一群更需要福音的就是他們的阿公阿嬤。因為他們阿公阿嬤怎麼樣?隔代教養好辛苦。經濟各方面健康都出問題。是不是更需要福音?孩子人生路還很長還有機會聽福音。阿公阿嬤不知道還有多少機會。
2643.746	2665.998	好不好。我們就認領好不好。一個阿公阿嬤一個餐費五百塊。那天有我們的弟兄姊妹。我們有這個歌曲做見證。也有戲劇。都是這些年長的在服侍年長的。我們就一起來做這樣的事。好不好。我們就一起來到主的桌子前好不好。我們一起來剝餅。我們請剝餅同工出來。
2671.561	2693.828	弟兄姊妹，我們今天還有恩典，能夠住在這個地方，領受主的秉主的卑世莫大的恩典。但牧師要鼓勵你們以後來到基督臺前的時候不要把焦點只放在到底上天堂下地獄那個層次太低了那個代表你今生從來沒有好好活過
2695.213	2718.734	而是來到主的臺前的時候說主啊我這一生用禰的命在活的時候我這樣子擺上我這樣子跟隨禰我這樣子做福音的工作主啊請問禰滿意嗎?主禰喜悅我這樣做嗎?主我這樣做可以嗎?
2720.964	2741.697	因為只有那一些事情才帶得到永生裡面去。其他的都帶不走。你房子一棟都帶不走。我跟你保證。一棟都帶不走。你的存款一毛錢都帶不走。我們要懂得怎麼過人生。保羅告訴我們不要再去想死的事情。要去想什麼?活的事情。感謝讚美神。
2743.524	2761.287	主耶穌被賣的那一個晚上,跟祂的學生吃飯,最後的晚餐,祂知道祂的學生待會兒通通要背叛祂了,只有學生自己不知道。祂拿起桌上的餅說,這是我的身體,為你們被剝開。
2784.667	2801.046	耶穌說,你們每逢吃祂的時候,要紀念我。紀念我,身體為你們被剝開。紀念我,擔當了你們的痛苦跟你們的罪。用祂的命換我們的命。
2802.551	2830.371	保羅說,不再為自己活,要為那替我們死裡復活的耶穌而活。阿們。我們待會一起領受丙杯的時候,我們請所有受過喜的弟兄姊妹,跟我們一起來領受,並且思念主的愛。我要再一次的邀請,目前還沒有受洗的弟兄姊妹,請趕快把握機會,報名下個禮拜的受洗。敬拜團,我們一起用這首詩歌來敬拜主。我們一起起立好不好?
2861.374	2876.625	有罪是我的身旁我。主耶穌的保血洗淨我。主耶穌的保血為我。
2885.879	2894.455	你為我赦命,付上代價,主保險。
2906.015	2931.609	臣兒子。聖結主ﷺ犧牲為我死。正聖綱要ﷺ榮耀君化ﷺ國舉國中尊嚴。
2934.548	2955.023	主耶穌的寶血洗淨我。主耶穌的寶血為我流。禰為我設立復生的一家。主寶血是我的生力量。
2963.797	2993.176	主耶穌的冒險洗盡我。主耶穌的冒險為我療。禰為我舍禮,補償代價。主冒險是我的神力量。我們輕輕的坐下。
2997.09	3021.831	好不好,有一段時間我們開口向神的謝恩。謝謝主。特別是如果你是一個,你覺得你其實不太知道怎麼為主活的人。好不好,你可以向聖靈來禱告。懇求聖靈指教你。懇求主指教你,帶領你。這一生可以為那替你而死的主而活。
3023.387	3052.423	把神給你各樣的這些祝福、資源、生命的熱情,這些所謂次要的事情,把它投入在主要的事情上。就是這一生為傳揚,為做見證,為活出,耶穌基督十字架救人福音而活,而做見證,而生活,而工作,而建立家庭,
3053.183	3080.003	而養兒育女，而奉獻，而服侍。願聖靈幫助我們。我們非常需要主,非常需要聖靈的帶領。好不好,我們有一段時間,我們就一起來為自己禱告。我們有兩分鐘的時間,好不好,我們就好好在位子上為自己禱告。燈可以幫我調整一下。我們兩分鐘為自己來禱告,為自己好好禱告。
3095.043	3095.52	中文字幕提供
3140.998	3141.374	繁體中文
3145.128	3172.562	是的,弟兄姊妹,我們待會一定也會為我們生活上各種困難來禱告,因為神也顧念我們的生活。因此,不論我們要為身體的健康,病得醫治,經濟的破產,工作的困難,家庭關係的緊張破碎,或是其他任何的事情來禱告的時候,我們也要問自己一句話,
3174.087	3202.192	如果神醫治了你的身體,如果神拯救了你的事業,如果神醫治了你的家庭,如果神在各方面恢復了你的能力,信心,熱情,尊貴,那之後你要怎麼活呢?那之後你的人生要為誰而活呢?
3203.831	3231.185	那之後你的人生要如何活呢?活成什麼樣子呢?親愛的弟兄姊妹。神很樂意施恩憐憫給我們。但我們在祂的面前要問自己一句話。主如果恢復我的一切。恢復我的一切。那我該接下來如何的活呢?
3232.585	3256.447	我們生命中太多時候只是在為自己的死、痛苦、焦慮、憤怒、傷痛而掙扎。卻很少從另外一個角度去思考生命如何活出公義、聖潔、智慧、尊貴、有能力、有愛心、有盼望。
3259.394	3283.339	我們生命太多時候是關注死,而不是關注如何活。求主憐憫我們,求主幫助我們。隨書在飯後的時候,拿起桌上的杯說,這是我為你們所留的寶血,是與你們立約的血。你們每逢喝它的時候,要紀念我。
3284.753	3311.908	主啊,我們願意來紀念禰。謝謝禰為我們所做的一切。請禰幫助我們不要糊裡糊塗的過一輩子。讓我們不浪費、不糟蹋禰跟我們交換的生命。謝謝主幫助我們。聽我們同心合一的禱告。奉主耶穌基督的名。阿們。我們存著一個恭敬、感恩、謙卑的心領受主的秉主的悲。
3326.817	3349.937	我們待會也要來收這些杯子。收完之後我們要來奉獻。我們就一起來吧。我先感謝大家,過去兩個月,我們推動好多愛心的奉獻有沒有。不論是幫助別的教會,還是幫助我們自己教會裡面有需要的。我跟各位報告,每一次都當天就完成。
3351.408	3367.249	我們在眾教會裡面得到很好的名聲。有很多教會事後寫信來感謝我們,為他們所做的一切。也有很多弟兄姊妹得到了幫助,可以去面對住院的問題,開刀的問題。我覺得非常以你們為榮。
3368.456	3392.41	弟兄姊妹,我們在傳福音的事情上,我們也不要落人後,阿們。因為這是非常有價值的事情。然後也邀請各位,繞城禱告的事,大家不要害怕,不要說我不會禱告,我們會想辦法,就是有簡單的手冊,或是簡單的訓練,就跟發麵子一樣,就是它不難,
3393.285	3411.457	祂只是沒有人去做。透過兩屆的臺灣接棒易走的行動,我們連結了70幾個全臺灣的教會,他們常常都在問我,我們該如何行走禱告,為城市祝福,但這樣教會可不可以教我們,我實在很心虛。
3412.739	3442.039	因此我想說透過我們在整個農曆七月我們好好把淡水發面子行走禱告好好的掃過去我們累積很多真實的經驗我們可以在明年的臺灣接棒從北到南有很多教會等著聽我們的分享而且帶他們一起去做去在他們城市裡面行走祝福禱告我們可不可以先來做這樣的事我們就可以成為臺灣教會的祝福阿們
3442.739	3460.686	這個共性是非常的大。你說走路我不太會。在丹江教會沒有人不會走路。為什麼?因為連莊牧師都會走。你一定可以的。只是說走長走短。我講個笑話大家比較有信心。兩個禮拜前松牧師憂心忡忡的打電話給我。
3461.186	3478.957	他說,莊牧師,為我們帶導。我說,怎麼了?他說,我們有一個走路傳福音的事情,難度很高,很怕沒有人要參加,一定要為我們禱告。我說,難度多高?他說,走很遠。我說,走多遠?他說,走4公里。
3482.244	3511.466	真想掛電話,沒有,開玩笑。人家走4公里,覺得好難。淡江教教,蛤,才4公里。開玩笑,羅師母隨便走都40公里,對。你知道嗎,其實羅牧師、羅師母,他們每天早上從他們家,就是走,走到捷運站,淡水捷運站,再走回去,來回8千1萬步,但是蛋糕一小塊而已,真的是沒有什麼困難的。我想神給淡江很多,
3511.886	3531.567	恩典。可以成為眾教會的祝福。阿們。我們就好好一起來做好不好。我們開始收杯子好不好。然後我們開始來預備奉獻。然後我要帶大家做一個奉獻的禱告。你就指名為中元節奉獻這樣就好了。為中元奉獻我們就知道了。
3534.036	3563.19	希望可以把這個用在年長者的福音餐會跟這個面子大軍有需要筆的可以揮個手請童工預備好嗎 總召預備筆如果有人需要填寫信封的就把筆給他可以開燈 謝謝現在可以開燈我們有一分鐘時間來禱告然後預備奉獻預備奉獻然後我們來禱告一起來做我們今天就把這事情解決掉好不好
3572.995	3574.142	繁體中文，