start	end	text
1847.482	1874.678	我說你要不要傳在這上頭,他說對喔,他說Bob,我都沒有想到我可以用這招,然後他好高興,趕快就上傳,然後他在上海的小組,他也傳回去,然後不到兩個小時打電話給我,他說有神蹟發生了, 我只能很簡單講,他馬上就要回上海去麵談、面試一個新的工作,而他是做投資的。
1874.678	1886.682	結果他傳出去以後,沒有幾分鐘,上海小組的一位弟兄就跟他談話,他說我也在臺北,你什麼時候要回去?
1888.063	1892.986	明天,那你就今天到我這邊來,我有東西要麻煩你,幫我帶回去。
1892.986	1897.428	我覺得他去以後,那個地方跟他很熟的,所以一大箱一大箱,他說沒有問題,我可以帶回去。
1897.428	1902.511	然後最後他說,你要去麵談,你要靠什麼?
1902.511	1904.112	他說我靠主啊。
1904.112	1915.958	他說那主感動我做一件事情,我的公司正要做一個滿把的一個投資的項目,你就帶著我給你的意向書,然後還有當payment叫什麼?
1917.739	1922.022	我今天就付給你20萬人民幣頭期款。
1922.022	1924.644	你就去麵談的時候就帶槍投靠。
1924.644	1939.454	而且他真的就帶著這個意向書,帶著這個頭期款去的話呢,因為這家公司是新開的,還沒有開業啊,所以他變成還沒有進去的人就帶槍投靠,帶一個訂單進去。
1939.454	1941.536	你說他拿到訂單沒有?
1941.536	1942.096	拿到嘛。
1942.096	1943.437	你說他拿到工作沒有?
1944.104	1949.068	明天918是他的大日子,回上海上班去了。
1949.068	1951.770	上帝厲害不厲害?
1951.770	1955.452	我如果818繼續講下去的話,就講不完了。
1955.452	1956.793	反正很多了。
1956.793	1958.815	我們感恩榮耀先講到這裡好不好?
1958.815	1960.616	我們把掌聲給我們的上帝。
1960.616	1962.278	好厲害,好厲害。
1962.278	1963.198	好,往往下跑。
1963.198	1967.321	第二個,第一個感恩榮耀,第二個是什麼?
1967.321	1969.263	基督生平。
1969.263	1971.705	剛才818現在有多少?
1971.705	1972.505	819了嘛。
1972.505	1977.010	基督生平, 我要很快講。
1977.010	1996.686	基督生平是一個課程,是很多年前英國的一批神學家、神學教授跟宣教士到中南美洲去宣教的時候就發現中南美洲那個山裡頭有很多蠻優秀的領導人才,可是他們不可能上神學的課。
1996.686	2033.339	根據他們的需要的話,就編了 一系列的這種神學延伸制的課程但第一本就叫做《基督生平》用馬太福音作為架構把基督傳教的三年半的時間把它分成五個期然後配合其他福音書新約其他的經文舊約其他的很多經文以及把 人文﹐歷史﹐地理﹐很多背景把它湊在一起。
2033.339	2039.401	這樣子一個課程在中國人裡面是一位理牧師夫婦他們在帶的。
2039.401	2044.683	我的師母四五年前就開始有機會來學這個課程。
2044.683	2048.064	這個課程是六冊,每一冊都這麼厚的。
2048.575	2058.917	所以上課要上,如果一次,像我們教會的話,是去年一月開,那個時候師母已經畢業了,所以師母可以教了。
2058.917	2066.619	所以師母在這邊教的時候,從去年一月教,然後昨天幾月幾號?
2066.619	2076.134	916,經過602天以後, 昨天我們淡江第一期的基督生平的同學們畢業了。
2076.134	2079.016	他們謝師宴,我做施工。
2079.016	2085.019	所以我也被陪到去在大腳印大吃一通。
2085.019	2086.080	重要的是什麼?
2086.080	2089.882	我剛剛講的是八一九,禮拜六。
2089.882	2102.861	那一天是基督生平第六測,在淡江市每一測分兩整天,所以六上,昨天六下, 這邊有好幾位,我剛剛掃過去,有好幾位都畢業生。
2102.861	2108.165	這樣一個課程,我自己是在師母到上海去開課的時候,我做學生。
2108.165	2115.030	那我也畢業,我現在也可以陪到她一起來做。
2115.030	2119.373	這個照片因為是我的恩師,所以我要把它顯出來給你們看一下。
2119.373	2122.075	我的恩師真的是很棒的老師。
2123.217	2148.446	我們覺得這個課程很好是因為他剛講到了就是把很多的背景把它連貫在一起的時候你讀聖經的時候你就活了比較可惜對我們來講是師母跟我因為我們三年多以前去過以色列 我最遺憾的就是,如果我念完《基督生評》再去以色列的話,那會是很美的一件事情。
2148.446	2154.588	所以可能給我們自己一個藉口,說不定我們就再跑一趟以色列,因為讀完《基督生評》了。
2154.588	2161.150	好,我講《基督生評》講這麼多,最主要我們就發現,透過《基督生評》的課程的話,帶出的恩膏是不得了的。
2161.150	2171.276	昨天晚上,我剛剛講我們教會的第一期《基督生評》的弟兄姊妹畢業,然後他們每個人都要分享, 只有我是白吃白喝的,昨天。
2171.276	2176.838	然後他們都要分享,有一位弟兄他分享就很好,他用酸甜苦辣來形容。
2176.838	2178.038	他說為什麼酸呢?
2178.038	2189.883	因為那每一冊他是自學的課程,每一課那麼厚,25課,你要寫好多的習題,然後每一課完了以後,你翻到後面有考試,你還要考這樣子。
2189.883	2194.825	他說寫到手很酸,然後坐到屁股都很酸,這是酸。
2194.825	2203.161	甜,他說在課堂上老師的教導, 同學們的一個分享實在是太甜美了,太甜美了,苦。
2203.161	2207.942	他說那個熬煉實在太辛苦了,特別趕功課的時候,太辛苦了。
2207.942	2209.502	可是辣是什麼呢?
2209.502	2222.845	他說被辣到了,因為那裡頭很多的教導,有一些是自己原來知道的,可是不完整,有一些甚至於不一定知道的,被電到了,被辣到了,然後心就火熱起來了。
2222.845	2224.105	哇,我覺得這講得很棒啊。
2225.845	2252.458	他們的恩師,我是你們學長,也是我的恩師,我今天看他在Facebook上寫的,我覺得很棒,他說很珍惜在這過程當中,這樣子生命的分享,主裡面的聖徒的友誼,在地如在天,這樣子的友愛帶進永恆的國度裡頭,讓我們能夠彼此共勉,同奔天路。
2252.458	2253.679	你覺得這個課程這樣棒不棒?
2254.480	2261.365	我們去大陸十二天,中間大概有十天都是跟基督聖平相關的。
2261.365	2266.550	因為上海有六班同時開,本人也舔為小老師一個。
2266.550	2274.396	然後我們到內地,離這邊一千七百公里的地方,也是去開兩班的基督聖平的課。
2275.077	2298.701	那我就看,哇,這個基督生平,如果用我的第三講的方法來,那這完全是有基督肢體的一個群體的恩膏,有聖靈帶領的群體的恩膏,有可以榮,因為大家學了以後,就被激勵起來,因為出去更願意傳福音,出去能夠做教導,為榮耀真神的群體恩膏,棒不棒?
2298.701	2307.923	很棒啊,大概你們已經太晚了,不過9月30號淡江要開第二班了, 我會勉勵你們有機會的話就學習一下。
2307.923	2310.170	我講不是重點,不是要講。
2312.551	2348.122	這個課程多了不起也真的很棒但是我要想用這個來做例證就是說你會發現當我們真的很認真的在神的國度裡頭渴慕神的話我們一起就是有共同恩昭嘛對不對你就發現神的恩高降下來我剛才聽說說我不在課程昨天聽說臨時有幾位同學就當場就演起這個 巴拿巴跟保羅跟馬可之間的一種錯綜複雜的一些關係,聽說演得活靈活現。
2348.122	2350.123	有這樣的事情,對不對?
2350.123	2351.524	是有。
2351.524	2358.207	那我就覺得說,你這種同學之間我們學習的技術都火花不得了的。
2358.207	2367.951	那我要勉勵已經畢業的弟兄姊妹、同學們,就是你得到了,神一定不是只是我們自己受益的,要怎麼樣?
2370.162	2416.447	一致得救8月20號我在這邊講 請問那一天第二堂在這邊的,記不記得最後牧師做了一件事情,後來很多人說你怎麼那麼勇敢,敢做呼召?
2416.447	2419.069	有沒有正弟兄夫婦,有沒有信主?
2420.230	2453.225	8月20號這8月20號那個是不是我呼召所以他們出來是也不是我只是感動那天太強了但是請問我在呼召的時候你們有沒有一起禱告不要怕講嘛對不對你們真的跟我一起禱告嘛誰有沒有聽我們禱告先是弟兄出來對不對我們有沒有繼續禱告姊妹有沒有跟著出來 我今天早上一直在想,我今天還敢不敢再來呼召一下。
2453.225	2454.766	好,我們回到這個。
2454.766	2465.454	然後這個就是,我們每一個人都是,我是44年前就被徐華醫師在那邊呼召,我就跑出來的嘛。
2465.454	2469.257	那我們每個人大概經過的大同小異了。
2469.257	2487.721	就是因為神引領我們當中每一個人從黑暗進入 光明的國度,從悖逆、不信,進到神的國度。
2487.721	2491.564	你知道神用多少的資源嗎?
2491.564	2519.339	因為我現在,我會從旁邊看,你會嚇到的,因為我上個禮拜天在上海的信息裡頭,講到成先啟後,我就去登記地寫一下,我真的很認真地寫一下,我發現我信主,我知道的, 我知道的,為我的信主擺上,各種方式擺上的,我就可以數出幾十個人出來。
2519.339	2522.421	我們當中每一個人我相信都很類似的。
2522.421	2524.682	求神幫助我們。
2524.682	2528.645	我們在傳福音的事情上,我們要能夠加油。
2528.645	2532.207	8月21號,8月21號發生了一件事情。
2532.207	2534.649	我們上海有個姊妹乳癌,回來開刀。
2535.708	2554.550	那天本來師母,因為8月22號有一對牧師夫婦我們很久沒見了,非常重要的事情要談的,他們要出國,然後再過來我們就要出國了,所以約好8月21號吃午飯,但是因為有這件事情,我只好臨時打電話給那位牧師跟他講說沒辦法,他說這個比較重要。
2555.145	2570.736	我們那天去為他開刀禱告,可是那個的前幾天,他的醫生是一位,我現在就用這樣的形容好了,他就是一位醫療傳道的一位醫生。
2570.736	2581.743	過去二十年,他每年平均為兩百五十個人乳癌開刀,了不起吧。
2581.743	2618.271	我要紀念他在神面前擺上, 以及我們教會也有蠻多的醫生醫護人員各樣子的你們的擺上我們可不可以大家就為這些醫護人員他們共同的恩昭我們為他們帶導因為我看到的是這位醫生他做什麼事情呢他說要跟病家就是我們的姊妹解釋他的狀況然後決定開刀的事情那他的 家人,然後師母跟我,還有另外兩三位上海回來的聽學姐妹們,我們就一起去,我們十個人去聽課。
2619.531	2625.013	真的聽課,他在那邊就講,就畫他的一個病況什麼東西。
2625.013	2628.655	可是他之前他知道做一件很重要的事情,你知道什麼?
2628.655	2630.315	你不知道你見過這種醫生沒有?
2630.315	2643.441	很認真的帶領我們做一個很長的禱告,然後他來開課,開課完以後很認真的邀請我來跟師母來為我們的姊妹禱告。
2643.441	2646.862	然後發生一件事情,我為什麼把醫治得救把它放在一起?
2648.200	2655.162	我們這位姊妹的妹妹是信佛教信得非常深的,她也在場。
2655.162	2660.724	我們禱告,我們就很認真地禱告,我們真的可以感覺到神的同在。
2660.724	2677.524	然後到樓下去的時候,要分別的時候,姊妹跟我們講說,她妹妹剛剛跟她講,我們在禱告的時候, 這佛教的人,佛在禱告的時候,他感覺你們的真神真的就在那邊。
2677.524	2679.784	他就一直哭,一直哭,一直哭,一直哭。
2679.784	2682.845	我不曉得後面會帶出什麼,我還不知道。
2682.845	2685.966	但是我就知道這上帝在做。
2685.966	2687.826	上帝是不是做大事的?
2687.826	2693.328	因為我們一起來服事,群體的恩膏,上帝就做。
2693.328	2700.656	光一致地得救我, 從那天到今天的話,我可以講好多好多好多好多好多,所以必須要把它切掉了。
2700.656	2704.900	但是你就知道,上帝是不停止做工的。
2704.900	2708.023	我們的責任是按照祂教導我們的。
2708.023	2715.049	因為我想群體恩高嘛,我們就跟有同樣看見的人,我們在他的事工上來做。
2715.049	2732.971	這位醫生,我剛剛講到,我們教會好多的醫護都是擺上的, 我們就要記得為祂們共同的恩高、恩昭向上帝來求,神可以帶出來的一些大事就會在我們當中發生。
2732.971	2734.072	會不會?
2734.072	2734.612	好不好?
2734.612	2735.652	感謝主。
2735.652	2744.278	我剛剛講的,我們小組的話,同時我已經被舉牌了,但是我才講到第三點,所以我要超快的來講了。
2744.278	2751.560	我們很多的弟兄姊妹都有狀況, 但是,神的恩典是夠我們用的。
2751.560	2789.977	阿門,好不好,往下,往下,第四個,校園論壇我很快講一下,我1969年出國的時候,以為我是要出去念了博士學位以後,然後在大學裡頭學習教書兩年,就回臺灣做教授,這是我的心願,後來發生都不是這個樣子,但是1993年, 剛講到的師母跟我們奉招,表面上是公司派我們去負責大中華區的公司的一些業務,底下我們是帶著宣教的心態去的。
2789.977	2805.747	但是我就發現,去兩年以後, 因為那時候進去的人不多,就發現神就為我開路,我在上海的最好的幾個大學都有機會來做見證,用我的方法,他們能夠聽得懂,能接受的方法。
2805.747	2816.972	回臺灣以後,這些年臺灣上帝也開路,在這過程當中,我就發現有蠻多志同道合的一些弟兄姊妹在做臺灣的事情。
2817.432	2846.387	前一次去一個大學的時候,我最高興,因為我們四個人一個論壇,後來我就跟負責人說,我們改成四五六七好了,因為有一個70歲,剛剛前幾天才過生日的一個人,主持人是六十幾歲的,有一位四十幾歲是我們教會的東偉弟兄我帶去的,五十幾歲一位上海回來的弟兄,迪士尼的總經理是我帶去的,四五六七小組。
2846.647	2851.071	你就發現神在做這些,我們有同樣的恩昭。
2851.071	2853.813	神要我們去做,我們去做啊。
2853.813	2856.235	我真的不知道這會帶出什麼事情來。
2856.235	2866.945	昨天如果參加營會的人,你知道徐博士,他現在就是在北大、清華、臺大,都最棒的學校,他就在那邊教啊。
2867.602	2873.707	他就在那邊,他用生命的見證來見證神的榮耀。
2873.707	2876.068	這樣子的群體恩膏會不會出來?
2876.068	2877.229	我認為會出來的。
2877.229	2879.391	好不好,繼續往下。
2879.391	2882.313	快,神奇驛站,我們把照片打出來,很快。
2882.313	2884.635	這個我要很快帶過去。
2884.635	2918.803	簡單講這樣子,我們臺灣有幾位,先是一位,然後慢慢有好幾位傳道人有意向的話,就要順著思路, 回歸耶路撒冷跟現在的一帶一路配合的話呢就現在在山西的氣口就成立了一個驛站他們就是把最棒的一些腳踏車 帶到那邊去租來,然後鼓勵很多弟兄姊妹到那邊,最偏遠的地方,四千人人口的一個古城,你看很古嘛,這是我拍的,真的是照片。
2918.803	2932.854	然後他們就在那邊走島,我們就去,我們服事完以後,離這邊一千七百公里的地方,服事完以後,他們開車,我們開了差不多四個小時的車到這個地方去,我們參加走島。
2932.854	2953.627	然後高雄教會有一批年輕人,那天剛好在那邊, 然後我們去之前一兩個禮拜,上海華藏團記者有一區的人也到那邊去,有越來越多的人認同這樣的事情,我就覺得,哎喲,那這個是我們要去思考的事情,我不太可能再去,但是我一定要在禱告上來支持這件事情。
2953.627	2972.431	我們宣教的事情是人道、錢道、禱告道,我們所有的人在不同的宣教施工場都可以參與,這個我把它叫做 一個共同的,聖靈引導的,基督肢體的,這樣的群體恩膏。
2972.431	2980.778	每一個人,我把它當作例子,你們會碰到其他的一些宣教項目的話,大家可以來認同,我們來參與,好不好。
2980.778	2984.100	往下跑。
2984.100	2986.142	第六,就地重遊。
2986.142	2987.302	這個很麻煩。
2987.302	2988.884	我們照片先打出來好了。
2988.884	2997.890	我們這次,因為剛才我講那位弟兄明天要回去的, 前面兩年都住他家,每次去。
2997.890	3003.476	但是因為他最近他在這裡啊,所以我們這次去呢,就回去,結果他們安排我們住哪裡呢?
3003.476	3010.822	就是以前跟我們住,我們出來之前,我們的鄰居,一牆之隔的鄰居,我們就住在那邊。
3010.822	3012.724	所以很高興回到那邊。
3012.724	3025.491	但是我為什麼把這個當作一個很重要的恩膏來講,因為是在那個地方, 一個兩百四十,因為昨天晚上我臨時想到了,給這個弟兄,我說明早我不提名字,但是我要提我們在那邊的事情。
3025.491	3034.514	然後兩百四十戶的一個社區,我們團企最多的時候曾經有二十幾家人住在那個地方。
3034.514	3038.735	我們團企最高的時候曾經有五六個小組開在那個地方。
3038.735	3051.689	我們團企在那邊,華神的講員, 外面的牧師,在那邊的行政樓,我們都做過主日崇拜,等等等等等等,是個很厲害的地方。
3051.689	3054.433	師母跟我出去宣教,就從那邊出去了。
3055.759	3065.189	恩膏很強的,因為師母跟我是93年以前,神已經為我們預備了,我們自己發展了一套信仰於家庭的一系列的,就好像神要用的。
3065.189	3069.714	果然後來到大陸去的話,神就用我們用了16年。
3069.714	3074.699	那中間在這過程當中的話,我們就發現神做的工不得了。
3074.699	3083.029	左上角這一位的話,是我們93年一去, 當地教會很受尊重的一位姊妹,年齡比我們還大幾歲。
3083.029	3089.470	我們終於這次,09年出來以後,第一次跟她見面,相談甚歡。
3089.470	3127.659	然後她勉勵我們,告訴我們說,你們以前講的信仰於家庭,你們以前講的職場的東西,在我們那時候陪她帶著 那個時候的中年跟青年,現在開始進入比較大年紀,然後他們的下一代有出來的,他說已經中間有神學博士,有神學教授,有牧師,有師母,然後在職場上做光做顏,在職場上抗拒一些不該做的一些事情等等等等等等,我們講的很多事情都在那邊發生了,我們很得安慰。
3127.659	3134.187	他說你們講的夫妻, 共同信仰,共同服侍,成為這件事情很大的祝福。
3134.187	3140.371	那我們就突然想起來,我們到一千七百公里外的那個地方是去教基督生平的。
3140.371	3145.994	可是,基督生平他們真的很喜歡,可是我們臨走的時候,他們跟我們講的話把我們嚇住了。
3145.994	3146.615	為什麼呢?
3146.615	3153.689	因為是我們夫婦帶著 跟另外一對,上海的一對夫婦,我們兩對夫婦一起去服侍的。
3153.689	3158.474	他們從來沒有被夫,因為開兩班嘛,我們就這樣子交錯的。
3158.474	3162.797	從來沒有被夫妻黨來跟他們教課服侍過的。
3162.797	3166.401	那他們覺得沒有比這更甜美的事情了。
3166.401	3171.485	這是神給我們的那份恩膏,我們敢用傳出去,對他們有幫助。
3171.485	3173.107	這樣講大家可以接受嗎?
3173.951	3198.701	好不好所以本來我們可能是去一次起了頭後面五次我們就不去了現在他們特別要求我們一定要每一次都要去教我們也很高興我們就會去服侍了感謝主好 往下跑已經被舉牌兩次了 好,職場使者,這個三十天,沒有一天我沒有跟職場使者事工相關的人碰頭。
3198.701	3212.786	我昨天特地數了一下,過去一個多禮拜,上海跟這裡,我碰個頭,跟我談職場服事相關的人有二十幾歲、三十幾歲、四十幾歲、五十幾歲、六十幾歲,所以這個叫二、三、四、五、六,剛剛那個是四、五、六、七嘛。
3212.786	3214.927	那我就知道這是神給我的那份,我要繼續。
3215.247	3220.530	我也呼籲更多弟兄姊妹跟我一起,我們一起來學習。
3220.530	3225.752	好,下一個,建堂施工,這個非講不可。
3225.752	3237.498	因為我們臨出門的時候在上海,臨出門的時候招待我們的弟兄姊妹,他們經濟情況我們很清楚。
3238.422	3244.625	我們很清楚,結果他給我們兩疊厚厚的人民幣,讓我們帶回來。
3244.625	3247.166	對他們來講,我知道是蠻大的數字的。
3247.166	3257.351	那個之前差不多十天,我還在內地的時候,我就很有感動,因為這個本子是我的小聖經嘛,我都在用的。
3259.735	3264.117	我們建堂整個經費是四億五千萬,大家知道,對不對?
3264.117	3269.940	去年九月的時候,我們地交清一億五千萬,還差多少?
3269.940	3270.821	三億嘛。
3270.821	3280.806	那所以我們決定的是說,三億裡面我們有一半,一億五千萬,分三年,今年,明年,後年,我們希望弟兄姊妹能夠奉獻。
3280.806	3285.729	然後我們最後我們就借貸款一億五千萬,大概數字是這樣情形的。
3286.510	3323.309	我自己因為各自事情當然是很有關係的所以我就很小心每個禮拜我都一定來跟的我的跟的方法蠻粗但是也蠻精準的就是每到五百萬的時候我就寫下來所以我這裡面前面有一頁的話就是哪一年哪一月哪日就變成一億五千五百萬然後哪一天變成一億六千萬我出發前的時候我看了一下我說 大概沒希望了,可是我十幾天前我在禱告,我就說,上帝啊,祢有沒有可能讓我再好玩一次嘛,對不對?
3323.309	3332.558	讓我九一七站在這講堂上的時候,我們可以再一次感謝主宣告一億八千萬到了嘛。
3332.558	3337.063	請問你的那個週報上現在寫多少錢?
3337.063	3337.644	念出來,念出來。
3343.046	3359.980	但是各位,你們手頭那份資料是因為幾天前要復印的時候交出來的。
3359.980	3362.222	本人手裡頭有一份是你們沒有的資料。
3364.718	3372.884	本人這份資料是前天禮拜五下午的時候,秋燕姊妹告訴我的。
3372.884	3383.611	這裡寫的是180-073-878。
3383.611	3386.613	上帝聽不聽禱告?
3386.613	3387.414	聽啊!
3387.414	3399.635	我前天他傳給我, 太感動了,上帝這種小事情,你都要讓我這樣經歷,我太感動了。
3399.635	3411.083	本來我就不想講了,我要求的是一億八千萬向上出來,沒有啊,差了一點點,上帝太有恩典了。
3411.083	3412.904	我們感謝神嗎?
3412.904	3414.865	我們一起站起來,我們感謝神。
3414.865	3419.829	我想請雲正牧師帶領我們一起來禱告,我們向上感謝。
3420.862	3428.265	好不好,弟兄姊妹,我們是一個群體,這個建堂這一切,教會的發展,是靠著我們每一個人。
3428.265	3437.148	透過羅牧師今天再一次的分享,讓我們知道,一百二十人在馬可樓上同心合一的禱告,神的靈就降臨在那裡。
3437.568	3463.915	現在弟兄姊妹好不好我們一起同聲,來為我們這個教會禱告,為建堂,我們一起獻上感謝,神要使用我們,使用我們每一位,在祂的教會,在祂的建造裡面,我們要同門神的恩惠,同門神的恩典,好,我們一起開聲來禱告,哈利路亞,謝謝耶穌基督,祢向我們敞開天上的窗戶, 主耶穌是的,祢是那位又真又活。
3463.915	3473.526	謝謝主,我們要在這裡一起經歷祢,祢的神蹟騎士,祢的神蹟,祢的大能,要在這個地方,叫我們每一個人來彰顯。
3473.526	3482.475	主耶穌在馬可龍這個地方,叫在每門,叫那個犬子起來行走的恩典, 也要在淡江教會來彰獻。
3482.475	3484.277	阿哩路亞神機啟事。
3484.277	3486.018	要在我們當中隨著我們。
3486.018	3487.599	我們要看見人改變。
3487.599	3489.300	我們要看到生命改變。
3489.300	3491.082	我們要看到祝福領導。
3491.082	3492.663	我們要看到很多的恩典。
3492.663	3493.384	喔!
3493.384	3494.865	主啊在這我們當中。
3494.865	3495.785	我們要數算祢。
3495.785	3497.987	榮耀豐盛的恩典。
3497.987	3501.129	我們要看著這一層一層的。
3501.129	3501.630	喔!
3501.630	3502.611	主啊我們的心堂。
3502.611	3503.611	我們的好像。
3503.611	3504.872	我們的生命。
3504.872	3505.253	喔!
3505.253	3507.815	神在淡江的建造的工作。
3507.815	3509.416	就像那一層一層的。
3509.616	3513.378	從B2、B1、1、2、3、4,一直到9樓。
3513.378	3524.944	喔,耶穌基督,祢要向我們彰顯,不是因為我們配得,是要為我們外民來做見證,成為一個宣教的教會。
3524.944	3532.047	主啊,我們讚美祢,祢施恩在我們當中,祢要恩告我們,我們不過是一個不配的親民。
3532.047	3535.529	主啊,祢使用我們, 站在這個臺上。
3535.529	3537.530	主啊,成為眾人的祝福。
3537.530	3539.932	要宣講祢榮耀的恩典。
3539.932	3546.015	你要向雅倫從頭流到呼吸。
3546.015	3547.876	流到衣襟。
3547.876	3551.338	主啊,這樣的教官在祢的教會裡面。
3551.338	3552.379	主啊,我們讚美祢。
3552.739	3558.565	親愛的弟兄姊妹,上帝要施恩給我們,要領受從神來的恩膏。
3558.565	3562.709	哈利路亞主,現在要把那數天的恩膏,我們要來領受。
3562.709	3569.536	哈利路亞主,但將每一個字體,我們要在神的面前,我們要領受這個群體的恩典。
3569.536	3573.200	哈利路亞主,成為一個流露出去,為外民做見證的。
3574.121	3593.116	哈利路亞 親愛的弟兄姊妹神把那極大的恩典你就領受 憑信心領受憑信心領受我們要這樣來禱告哈利路亞 我為你禱告親愛的天父上帝 我們這時候事立在祢的面前。
