start	end	text
0.503	10.308	弟兄姊妹平安，很高興又回到這邊跟弟兄姊妹我們能夠有一些分享。
10.308	30.489	你們知道牧師站講臺的時候最高興的事情就是站在這裡的時候想到40分鐘以後就講完的時候那種興奮我等一下一定要記得要講講完了講完了好我們今天繼續要講 群體恩膏。
30.489	36.152	如果大家記得的話,我最早是在四、五個月前開始講群體的恩膏。
36.152	51.501	第一講群體恩膏的時候,我就用聖經上蠻多的一些,特別是新約的一些話語來勉勵弟兄姊妹,因為群體的恩膏這個詞大家用的不是很多,雖然實際上一直在發生。
51.501	68.589	簡單地講,我們在主裡頭,我們一家人,如果按照主耶穌的教導, 彼此相愛,我們彼此合一,我們一起來尋求在神國度裡頭,神給我們的那一份,我們叫做恩昭,或者我們的使命。
68.589	88.157	那我們聚在一起的時候,在這個基督的肢體裡頭,神就會降下恩膏,祂就把能力賜給我們,讓我們在神國的道路上一起走的時候,走得高高興興,然後看到神跡其事,我們看到神做的很多的作為, 每一個人們分開來,通通做不到的事情。
88.157	89.938	這個是群體的能夠。
89.938	97.680	所以這一講完以後的話,第二講我就請了職場團企的弟兄姊妹來幫我忙。
97.680	98.881	第二講打開來好嗎?
98.881	101.702	謝謝。
101.702	121.112	職場團企我請了四位弟兄姊妹,他們來幫我, 用他們自己的經歷,包括他們自己信主的過程當中,在小組裡頭,在他們的公司,做光做眼,在職場團企裡頭,從他們的角度來詮釋什麼叫做群體的恩膏。
121.493	143.568	我收到的回饋滿棒的因為他們四位都把他們的生命的一些他們的感受他們的歷練能夠拿出來神用他們然後跟弟兄姊妹的分享的話我覺得就幫助很大所以就激起了我再講群體恩膏的第三群體恩膏第三我們打出來好嗎?
143.568	156.551	謝謝群體恩膏第三的時候一些弟兄姊妹給我的回饋就是說還是希望我把群體恩膏 用白話文,這是真的我收到的信息,用白話文把它講得更清楚一點。
156.551	162.675	那我就試著一下,把群體N高用白話文把它講清楚一點,到底群體N高是什麼。
162.675	169.279	所以如果要講的話,第一講可以算是群體N高的簡介,第二講可以算是群體N高的一個展示。
169.599	174.484	第三講我們可以算是群體恩膏的特質。
174.484	176.506	到底什麼是群體恩膏?
176.506	181.791	講了老半天,牧師講了老半天,講不清楚。
181.791	186.576	我希望群體恩膏的第三的時候能夠帶出來,我們回到第三。
186.576	202.015	第三這邊的話,大家能夠有一些概念,就是說, 特別,我講特質,我講特點的話,就是跟外面的很多,包括外面的很多群體,不是我們教會裡頭,不是信基督的人群體,有很多很棒的,對不對?
202.015	206.819	有些詞彙的事工,我個人都非常非常佩服的。
206.819	209.120	但是我們就是不太一樣,為什麼?
209.120	219.308	因為我們這是,詩篇跟我們講,等一下,詩篇133篇,我會引用一下,就是說是, 我們是有永遠生命的這樣子的一個群體。
219.308	225.412	我們這個群體是加在一起,我們是基督身體的一部分。
225.412	230.976	神給我們每一個人有不同的恩昭,但是祂把我們這批人放在淡江教會。
232.517	259.330	淡江教會到底要怎麼做是很新意的這就變成我們共同的恩昭那只要我在淡江教會裡面這一塊神要賜給淡江教會的特別的一種從上面賜下來的恩膏的話我們就有份了我們就可以跟上帝很認真的我們就可以跟我們的主很認真的跟祂求我們的恩膏 怎麼得到的話呢?
259.330	265.036	根據聖經上的講法蠻清楚的,就是透過聖靈降下來引領我們。
265.036	281.089	降下來以後,你就發現當神在一個群體裡頭,當我們這個群體,淡江教會,我們的不同的群體, 在主裡頭的群體有共同的目的往前走的時候,神的榮耀就彰顯出來。
281.089	282.890	這個是講的群體恩膏。
282.890	286.952	今天我還是要講群體恩膏,因為兩個原因。
286.952	290.133	有好幾位弟兄姊妹說,你還是要再講一下子。
290.133	298.643	另外的話,我很感謝神,今天是幾月幾號, 九月十七,對不對?
298.643	304.627	那我是四個禮拜前講群體恩膏三,就是八月二十號,對不對?
304.627	309.731	所以從八月二十號到昨天九月十六號有幾天?
309.731	313.074	這考植樹問題,你們要把它想清楚。
313.074	319.678	從八月二十號到昨天是幾天?
319.678	325.382	從八月二十號到昨天是二十八天啦,因為從禮拜天到禮拜六嘛,對不對?
325.382	325.943	一個禮拜幾天?
326.715	330.818	我們做算數,7天幾個禮拜?
330.818	332.359	7乘40多少?
332.359	334.381	所以從820到911,昨天多少?
334.381	339.465	6,就是多少天?
339.465	340.145	28天嘛。
340.145	345.549	那麼820是28天,倒數回去的話,819是多少天?
345.549	348.231	就是第29天倒數回去的話。
348.231	348.912	那818是第幾天?
352.329	359.538	從昨天數回820是28天,所以從昨天數回819是多少天?
359.538	362.642	所以數回818是多少天?
362.642	363.583	是!
363.583	371.112	那各位呢?
371.112	371.813	這本叫做什麼?
373.336	374.696	你們叫什麼?
374.696	376.977	我的記事本啊,我的記事本。
376.977	387.079	我很多年前跟松牧師,然後我們一起去看這個老人家,其實有好幾個牧師啦,然後我們在電梯裡頭,坐電梯的時候他就看到我這個。
387.079	390.780	他就說,羅哥,你手上拿什麼東西啊?
390.780	395.781	然後他就從口袋裡頭一掏,他說,知道這個叫做什麼東西嗎?
395.781	398.462	我們現在都沒有人用你那種東西啦。
398.462	410.358	那結果後來,後來我就被他影響到了,然後就脫, 郭倫牧師就去買了我第一個iPhone。
410.358	414.781	但是,對不起,我重要的事情還是寫上這本。
414.781	422.346	iPhone我也有學習了,但是,剛剛講幾天?
422.346	424.248	三十天。
424.248	428.871	給你們看一下,牧師的記事本是這個樣子的,我的行事曆是這個樣子的。
431.357	435.259	這記的都是很重要的事情我才記下來的啊。
435.259	436.199	那你知道我什麼嗎?
436.199	441.102	我因為要講君子恩膏四呢,我就一直在禱告,一直禱告。
441.102	449.586	結果兩三個禮拜前,其實走前我有一點概念了,然後在大陸的時候我就蠻確定我要怎麼做了。
449.586	454.008	今天呢,我們還是要講神的話,但是我不解經。
454.008	456.389	解經的事情比較困難,我留給莊牧師來解。
457.261	459.322	繁體中文，臺灣國語。
459.322	461.784	繁體中文，臺灣國語。
461.784	463.025	繁體中文，臺灣國語。
481.118	490.103	老摩西講的一些話,神透過他講的這些話做一個基礎,然後我們看看新約,然後看他們發生什麼事情。
490.103	501.388	然後,這三十天我剛剛給你看到的,本人記事本上那個密密麻麻的三十天,我從那邊我按順序,然後一個一個一個把它抽出來。
501.388	509.307	有些事情就是有延續性的,我說第一天是幾月幾號, 八一八啦。
509.307	511.348	第一天我從八月十八號講起。
511.348	516.030	我上次在這邊講信息是八月二十號嘛。
516.030	520.752	就那個之前的兩天,從那邊開始,然後我就一個一個一個來講。
520.752	523.153	好,我們現在先從舊約開始。
523.153	529.476	舊約這邊的話呢,我們先來看一下,我們往下看信息好嗎?
529.476	542.939	舊約我想就是用大家很熟悉的, 請問,如果我講詩篇一百三十三篇,你覺得你有一點點印象,模糊也好,知道是大概什麼的,請舉手。
542.939	549.263	你們不要嚇我,你們不要嚇我,這邊兩三百人,只有兩個人舉手啊。
549.263	556.467	詩篇一百三十三篇,我在這邊問你們有沒有印象,然後只有兩三個人舉手啊。
556.467	560.090	我先念一句話,然後你們告訴我,有沒有聽過,看啊。
561.101	566.202	弟兄和睦同居,是何等的善,何等的美。
566.202	574.945	好,現在請問你好像感覺你好像聽過,好像知道詩篇133篇的,請舉手。
574.945	578.146	好,好。
579.224	581.706	這樣就比較像了,對不對?
581.706	583.947	這是大衛寫的詩。
583.947	593.774	那我覺得《詩命》有33篇大衛寫的詩的話,非常傳神,因為他形容,這一般講恩膏的時候,就用這個來做比喻。
593.774	599.197	他這邊講到,好像貴重牛在怎麼,在雅倫,從雅倫的什麼地方開始?
599.197	601.539	頭上,然後流到哪裡?
601.539	604.861	胡須,胡須比較短一點,胡須,對不對?
604.861	608.670	然後流到他的, 在那裡有耶和華命定的福就是什麼?
619.531	652.179	永遠生命我上一講特別第一個講出來的我們的特質剛才我點到的就是永遠的生命所以這個詩篇你們很清楚了《出埃及記》第三章這個故事你們很清楚很清楚很清楚的但是我還是把它打出來《出埃及記》我們打出來下一頁記不記得以色列人進了埃及430年以後老摩西那個時候已經80歲了 跟他後來比算是很年輕了。
652.179	659.245	但是他八十歲的時候,他上河獵山牧羊,然後就看到荊棘火焰,有沒有這個印象?
659.245	662.028	請問這個故事知道的,請舉手。
662.028	669.134	有了,如果你信主都比較晚,也沒有關係,你那個十屆看過電影都知道,對不對?
669.134	676.320	這個老瘋犀,老頑童,八十歲了,居然說,誒,這個很稀奇,我要去看那個大逸像,我很佩服。
677.739	686.303	這個是我將來到天上去的時候,跟摩西聊天的時候問他的,我問你怎麼八十歲的時候還可以有這個老頑童的心態。
686.303	692.286	那牧師一直在學,所以牧師不是講我的人生哲學是什麼?
692.286	693.927	have fun,就是要老頑童心態。
693.927	697.691	所以碰到這種事情的時候, 怎麼是這樣子呢?
697.691	704.555	荊棘的火也不燒起來,他就去探險去了,然後神就跟他講話。
704.555	718.925	神在那個地方的時候跟他講說,我要把你們救出來,把以色列人430年以後救出來,然後脫離埃及人的手,然後要進到流奶餘蜜的地方。
718.925	722.267	但是你會面對很多很多國家的人。
722.267	725.249	下一個經文的話,往下走。
726.425	732.208	下一個經文是第40年出海。
732.208	737.991	剛才那個講完以後,摩西是不是接受神的呼召就回埃及去?
737.991	746.635	後來發生事情,請問,摩西帶領以色列人怎麼樣離開埃及?
746.635	752.638	過黑海,第一,我來學莊牧師好了,第二,過太平洋,過什麼?
752.638	754.339	過紅海吧,這故事都知道對不對?
755.060	758.201	郭鴻海知道了請說,先舉手。
758.201	762.383	我今天要讓你們多一點運動。
762.383	767.065	郭鴻海以後,他們是不是一下就走到應徐地區了?
767.065	768.765	在哪裡?
768.765	770.486	曠野繞了多少年?
770.486	772.527	四十年。
772.527	778.749	生命記第一章第一節一開始就講到摩西跟以色列人在那邊對話。
778.749	785.209	這裡第七章的時候, 老摩西,這個是我見到他的時候,我要安慰他一下。
785.209	799.444	因為那個時候,你看看他帶著以色列人,這麼多人出鴻海,然後四十年,然後神就跟他講說是,你看,過河就是運許地,但是你是過不去的。
800.862	835.043	哇 我很難想像我如果放在那樣的位置上頭我會怎麼樣來過但是他還是很認真你去看生命記的話呢神教導他一個一個一絲不苟的來講這裡就是接著剛剛講到的40年前見到神的時候講說是要把他們救出來要到流奶餘命的地方然後要跟很多國家的人要面對這裡特別講到有七個國家都比你什麼 強大,但是也要把牠們交給你,給你怎麼樣?
835.043	835.784	擊殺。
835.784	842.249	給以色列人講,要透過摩西跟他們講說是,不要怕,我會幫你們。
842.249	844.030	這個是神的允許。
844.030	855.560	然後我們再往下跑的話,這裡講的故事就是,摩西沒有過約旦河,誰帶以色列人過約旦河?
855.560	856.881	約蘇亞,對不對?
856.881	860.124	約蘇亞那一本書,《聖經頭》叫做什麼?
861.391	868.317	有時候我考的一些問題還蠻簡單的。
868.317	881.888	約蘇亞記的話,他們走走走就跑到了耶利哥附近的時候,聖經記載告訴我們說,他就碰到了神的使者。
881.888	883.250	神的使者怎麼跟他講?
883.250	885.772	神的使者教的方法是很特別的。
885.772	892.327	你們所有的士兵, 繁體中文，臺灣國語。
912.381	918.623	他現,百姓便上去進城,個人往前直上,將城奪取。
918.623	919.723	這裡告訴我們什麼?
919.723	925.505	這裡告訴我們,神給以色列人應許。
925.505	933.708	神說,我剛剛講,我今天不解經了,那如果時間對,說不定哪一天,我們請莊牧師跟大家解經。
933.708	938.450	這邊七個國家,七個國家都比以色列人要強大。
938.450	953.665	那這七個國家,如果你去讀解經的一些解釋的話呢, 代表的都是某一種堅固的引領, 我們馬上就有一些搜走的兄姊妹就可以幫你忙。
953.665	971.974	講到這七個名字的話,後面都有一些屬靈的意義,代表的比方說是悖逆神,代表不服從神,代表驕傲,代表不聽命令等等,不同的一些屬靈上的一些人。
971.974	980.328	這些屬於 堅固的、引壘的,這些要攻破怎麼攻呢?
980.328	983.769	有一些不是我們一個人打仗打得過去的,就要怎麼樣?
983.769	986.170	我們一群人一起。
986.170	995.313	耶利哥這個城那麼堅強,但是神不是要他們拿著槍拿著砲去攻的,是要他們繞城,對不對?
995.313	999.514	那百姓是很乖的,今天說要我繞我就繞。
999.974	1007.779	明天要我繞,繞了兩天以後,第三天會不會開始有一點點...我們到底在玩什麼?
1007.779	1012.302	四天、五天,可是七天的時候說今天要繞幾次?
1012.302	1013.103	七次!
1013.103	1014.924	他們就聽話了。
1014.924	1020.107	那這個城塌下來是靠的什麼?
1020.107	1022.949	靠的什麼?
1022.949	1027.252	你可以保險一點當然說是上帝的大能嘛,對不對?
1027.252	1034.820	但是靠的是 我認為是百姓很聽,大家都很願意聽神的教導。
1034.820	1045.568	使者跟他們講,他們同心合意,一起呼喊,跟我們剛才領敬拜的時候,我們有沒有很高興在那邊?
1045.568	1047.149	我們有沒有在那邊敬拜?
1047.149	1048.070	有沒有讚美?
1048.070	1052.673	我們有沒有我們很棒的團隊帶領我們領敬拜?
1052.673	1057.857	他們那時候還不太會,只會吹角,是不是讚美?
1058.712	1060.634	是不是呼喊?
1060.634	1063.956	是不是向神來呼求?
1063.956	1075.946	請問剛才你覺得我們剛敬拜的時候,你真的覺得我真的有那種在地如在天的感覺,神與我們同在,你真的很誠實的,你有那種感覺的有沒有?
1075.946	1077.907	滿多人的,感謝主。
1077.907	1089.693	你如果沒有這樣感覺的,下個禮拜天你就跟神說是我要有那種感覺,我要知道你的同在,然後你看看上帝做什麼事情, 好不好?
1089.693	1092.575	這邊我用這個故事來跟大家講,主要是什麼呢?
1092.575	1103.722	你看《舊約》裡頭的話,沒有用群體的恩高這個字,剛才講的詩篇133篇,那邊跟我們講得很清楚的,從哪裡開始?
1103.722	1106.063	從頭開始,然後就流到身子。
1106.063	1147.260	我們都是基督的身體,然後你就會發現,你如果有一定的敏感度的話,因為牧師已經講了那麼多次了,我就是要刺激你們,要刺激你們的敏感度, 你就發現聖靈真的在做工,聖靈真的在我們小組做工,聖靈真的,我很認真的在我的職場那邊,我要學著做光做顏的時候,聖靈真的就讓我看到這個東西,因為我們很多事情,其實聖靈在做,我們敏感度不夠,我要捅你們,捅,不夠的時候,那牧師就要用踢的,那就把你踢一踢,踢出那個敏感度,然後看看上帝怎麼做為我們能不能看到,可以嗎?
1147.944	1150.927	好不好,我們往下跑。
1150.927	1159.275	剛剛講到舊約的話,我主要是用這個故事以及當時神的話後面怎麼印證的方式。
1159.275	1221.816	新約因為大家都很熟悉,你記得我從一開始我就用約翰福音13章到17章來講, 因為十三章到十七章是主耶穌基督離世之前苦口婆心,真的是苦口婆心,就很希望很希望祂的門徒能夠真正理解他們是跟世界是分開來的,真的是讓他們知道 三位一體的神是愛他們的,然後要勉勵他們,就是你們彼此要相愛,彼此相愛,特別是約翰福十七章的話,真的是我一讀再讀,一直在讀的,就是勉勵我們,當我們對我們的恩昭清楚的時候,我們可以向神求,然後耶穌替我們求的,就是說是,你讓他們彼此合一向我們,耶穌講的我們,祂跟 天父在禱告是指了誰?
1221.816	1229.161	今天第一堂我們雲正牧師為四位弟兄姊妹為他們施洗。
1229.161	1233.865	奉、父、聖子、聖靈明。
1233.865	1235.506	耶穌講的這個是他們三位。
1235.506	1238.788	那這三位請問跟你有沒有關係?
1238.788	1240.109	請問聖父跟你有沒有關係?
1241.135	1243.716	是聖父檢選你的,對不對?
1243.716	1246.237	請問聖子跟你有沒有關係?
1246.237	1249.177	是他上十字架救我們的。
1249.177	1251.458	請問聖靈跟你有沒有關係?
1251.458	1253.499	他住在哪裡?
1253.499	1256.260	是我們心裡來幫助我們,對不對?
1256.260	1259.461	所以聖父、聖子、聖靈跟我們都有關係的。
1259.461	1276.748	整個我講群體恩膏,我就希望大家能夠抓到的話,這些是個人層次上是真的,但是在群體的層次上,我要跟大家提醒的就是, 有一些群體的恩膏的話呢是要我們群體湊在一起的時候才出來的。
1276.748	1304.874	《使徒行傳》第一章最前面那邊講到的你如果看《馬太福音》最後馬太福音主耶穌被釘十字架然後三十日復活以後在使命山有沒有使命山是跟門徒就頒布了大使命然後《使徒行傳》第一章一開始的時候有沒有講到耶穌 跟門徒一起多少天?
1304.874	1308.841	有把握,對,我們姊妹很勇敢。
1308.841	1317.593	跟門徒一起四十天,那這個你們回去, 哎,剛才那麼多沒有回答的人,請你回去讀一下,十字星傳第一章第二章好不好?
1317.593	1353.018	因為第一章那邊講到,耶穌就跟他們說了,請問十字星傳第一章第八節,能跟我一起背的人來背,但震靈降臨在 但聖靈降臨在你們身上﹐你們就必得著能力﹐並要在耶路撒冷﹐猶太全地﹐撒馬利亞﹐直到地極做我的見證。
1353.018	1362.304	好,下一次你們誰被我認出來是淡江教會的弟兄姊妹的時候,我就會跟你說,但你就要跟我一起背。
1363.473	1367.635	所以你最好今天回去你就好好跟我啃一下書。
1367.635	1368.495	再來一次。
1368.495	1385.082	但聖靈降臨在你們身上,你們就必得著能力,並要在耶路撒冷、猶太全地和撒馬利亞直到立即作見證。
1385.082	1387.483	好,都會了。
1387.483	1391.425	你不要等一下,我等一下出去我就會碰到的,我就會點你,就但。
1393.660	1408.865	耶穌講完這個沒有多久的時候,然後門徒們根據《使徒行傳》的記載的話,第一章的後面那邊,第十節,十一、十二、十三、十四那邊,就講到他們一起禱告,在一個樓裡頭一起禱告,有沒有?
1408.865	1412.146	你們不要跟我講這些故事,你們都不知道。
1412.146	1417.067	沒有的話,小祖跟我回去,把我《使徒行傳》第一章第二節好好查一下。
1417.067	1419.848	然後五行絕絕到了,五行絕絕到了,發生什麼事情?
1421.869	1424.029	聖靈有沒有降下來?
1424.029	1426.010	大家被聖靈充滿,有沒有?
1426.010	1428.771	彼得一傳福音,有多少人信主?
1428.771	1432.271	三千人就信主,你們很棒,我得到安慰了現在。
1432.271	1451.241	然後你就看,這個不是一次性的事情,不是一次性的事情,你後面,你看,我這邊我用印證的時候,我說是以十一章第一章十四節,我剛剛講,他們就同心合一禱告,然後第二章就是我剛剛講到的, 聖靈降下來,聖靈充滿的。
1451.241	1453.643	然後第四章那個,我們打出來看一下好了。
1453.643	1457.746	第四章那個大家不一定那麼清楚,但是我講這故事你們應該就知道。
1457.746	1466.333	記不記得再過幾天以後,彼得跟約翰就跑到殿裡的美門那邊,醫治一個瘸腿的,有沒有印象?
1466.333	1467.914	有沒有?
1467.914	1473.739	那個歌我很想唱,不過沒有時間,講瘸腿的就好。
1473.739	1479.530	然後, 然後彼得講到多少人信主這一次?
1479.530	1481.371	五千人信主,你們很棒。
1481.371	1484.193	然後發生什麼事情?
1484.193	1495.815	彼得約翰就被抓到關裡頭去了,然後第二天公會就審他,可是因為百姓那個時候,你現在一下他一講五千個人信,你說這個, 他們要把它定罪也很難。
1495.815	1497.556	後來就把它們釋放了。
1497.556	1502.758	釋放以後,他們回到弟兄姊妹,回到丹安教會的時候,發現丹安教會的弟兄姊妹都在為他禱告。
1502.758	1505.379	然後他們一起做一件事情,怎麼樣?
1505.379	1509.600	他們就一起在那邊,讚美主,一起禱告。
1509.600	1512.822	這邊我們來念一下,禱告完了。
1512.822	1520.125	聚會的地方震動,他們就都被聖靈充滿,放膽講論神的道。
1520.125	1531.277	弟兄姊妹, 我是1984年在美國的時候就被派到大陸去談合資企業的。
1531.277	1535.479	所以每次去回來的時候就有弟兄姊妹問我,大陸情況怎麼樣?
1535.479	1538.580	大家很好奇,特別是教會弟兄姊妹。
1538.580	1567.248	但是因為只是這樣跑來跑去比較難,但是93年師母我們 繁體中文， 那個時候師母跟我很明顯很明顯很明顯的,要講什麼呢?
1567.248	1574.195	他們說到底大陸的教會,指的是家庭教會,大陸的教會像什麼呢?
1574.195	1578.279	我們的直覺反應很簡單,始圖先傳,下集。
1579.735	1591.104	你去看《使徒行傳》,最前面跟最後面的話,耶穌跟他們四十天在一起講的是講到神國的事。
1591.104	1595.587	然後你到二十八章最後面的時候,講到保羅的話,他在幹嘛?
1595.587	1599.030	他講神的道。
1599.030	1604.194	然後那些發生的事情其實這兩千多年來一直在發生。
1605.879	1612.965	越被逼迫利害的地方,這些事情發生得越彰顯,因為你不能靠自己,要靠神。
1612.965	1623.313	所以我們這三十天的話,我要跟大家分享三十天,因為這三十天我們中間有十二天是在國內的,十八天在臺灣的。
1623.313	1628.237	那我們就來看一下,我們自己這些經歷的時候,神做的什麼,往往往下跑。
1629.172	1654.504	經歷群體恩膏三十天,那我真的,我很認真的,因為我剛講我是在大陸過了幾天以後,就很確定我要用這個方法,所以我就根據這本書隨身的,然後我就很多紙頭寫,照著日期跑,第一天是八月幾號, 我們一起來思想。
1654.504	1656.506	繁體中文，臺灣國語。
1668.643	1669.604	繁體中文，臺灣國語。
1669.604	1670.925	繁體中文，臺灣國語。
1670.925	1672.046	繁體中文，臺灣國語。
1672.046	1673.868	繁體中文，臺灣國語。
1685.947	1706.197	我上次講道前兩天的話,因為師母的弟弟他們從國外回來,我們就到五指山,我岳父在國軍公墓裡面,師母他們一家在那邊一起禱告的時候,我為他們拍照,拍照的時候我就感動得哭了。
1708.677	1739.763	因為兩天以後我要跟大家分享群體的恩膏那時候我想到的就是永遠的生命因為我的岳父是75歲高齡才信主的但是我想到他在天上已經在那邊是得救的人在那邊等到我們的時候我知道我的岳母心裡頭想到他的時候都是這樣去想的這樣一個永遠的生命是不一樣的我們帶著盼望 所以我們一大早出門的。
1739.763	1742.086	所以我的8月18號是從這樣開始的。
1742.086	1750.957	但是8月18號我用感恩榮耀來形容,因為不知道什麼時候開始,我們禮拜五晚上在我們家的小組就叫做榮耀小組。
1750.957	1752.399	我已經不記得誰取的名字了。
1752.739	1756.862	那非常感恩,帶著感恩,我就把感恩、榮耀加在一起。
1756.862	1763.907	從那個時候到現在的三十天,我從818,我就只講818好了,因為否則你們今天午飯、晚飯都不要吃了。
1763.907	1779.462	因為818當天,除了我剛剛講五指山的這樣一個神的特別的恩典,祂的榮耀,我們經歷以外,我們家的一位從上海回來的弟兄臨時, 繁體中文，臺灣國語。
1779.462	1782.864	繁體中文，臺灣國語。
1806.032	1847.482	iPhone裡頭,他說我終於昨天有機會帶領我同事信主,然後第二天他跟我打電話,那我就說你先,因為他一直想要回大陸,他很清楚這個是被調回來不是神的旨意,結果我就說,然後他回來的時候就在我們家聚會,禮拜五晚上,我說今天晚上聚會啊,我說你的事情怎麼樣,他說很有眉目了, 那我說,你知道我們有LINE,你如果去看我們禮拜五晚上榮耀小組的LINE的話,都是很多的禱告,我們很多喜歡禱告的弟兄姊妹在同組裡頭。
