start	end	text
0.009	28.464	我們從第一節,如果你沒有聖經的話,我們同工可以把聖經傳給你,把手舉起來。那我們翻到的時候,我們一起來讀神的話。那時,天國好比十個童女,拿著燈出去迎接新郎。其中有五個是愚拙的,五個是聰明的。愚拙的拿著燈,卻不預備油。聰明的拿著燈,又預備油在器皿裡。新郎遲延的時候,他們都打盹,睡著了。
28.797	57.056	半夜有人喊著說,新郎來了,你們出來迎接他。那些童女就都起來收拾燈。愚拙的對聰明的說,請分點油給我們,因為我們的燈要滅了。聰明的回答說,恐怕不夠你我用的,不如你們自己到賣油的那裡去買吧。他們去的時候,新郎到了,那預備好了的,
57.517	68.264	我們再來翻到前面馬太福音第二十二章馬太福音的第二十二章一樣的我們從第一節來讀
87.654	116.108	我們一起來讀神的話。請。 耶穌又用比喻對他們說,天國好比一個王,為他兒子擺設他的筵席,就打發僕人去,請那些被召的人來復席。他們卻不肯來,王又打發別的僕人說,你們告訴那被召的人,我的筵席已經預備好了,牛和肥醋已經宰了,個人都齊備。
116.817	146.341	請你們來復習。那些人不理就走了,一個到自己田裡去,一個去做買賣,其餘的拿住僕人,淋漓他們,把他們殺了。王就大怒,發兵除滅那些兇手,燒毀他們的城。於是對僕人說,喜宴已經齊備,只是所召的人,所以你們凡遇見的都召來,
147.602	174.734	那些僕人就出去,到大陸上。凡遇見的,不論善惡,都招聚了來。聯席上就坐滿了客,王進來觀看賓客,見那裡有一個沒有穿禮服的,就對他說:「朋友,你到這裡來。」那人無言可答,於是王對使喚的人說:「捆起他的手腳來,
175.316	184.869	把它丟在外邊的黑暗裡,在那裡必要哀哭竊齒了,因為被罩的人多,選上的人少。我們一起低頭禱告。
185.247	210.764	主我們感謝禰,為今天,主我們可以敬拜禰,可以享受在禰的同在裡面,我們讚美禰,我們奉耶穌名命令所有黑暗的勢力,要讓我們聽不見,看不見,我們無法感受,無法知道,無法享受的都離開我們,我們要知道,我們要明白,我們要享受,謝謝主,我們要享受禰的同在,我們要明白禰的話,我們要知道禰的帶領,耶穌謝謝禰為我們同在,將禱告奉靠主耶穌的聖名,阿們。
211.323	225.295	今天我們要分享一個題目叫做高揚的婚宴199吃到飽跟你旁邊的人講高揚的婚宴199吃到飽我剛用兩段經文一個在馬太福音25章一個在馬太福音22章
226.288	249.817	二十五章這邊講到他們在等一個喜宴,然後二十二章這邊在講有另外一個喜宴,有不同的敘述,我等一下會開始來用這些的經文來幫助我們。我要講一個題目就是,我們這群人都是可以來享受喜宴的人。你知道嗎?前陣子有一個很重大的一個喜宴,全世界都在關注的一個喜宴,就是英國的一個王子叫做什麼?
250.64	278.457	威廉王子,他娶一個人,然後全世界都在觀看這個,然後最近有另外一個叫摩洛哥王國,我根本不知道摩洛哥在哪裡,就是好像這個王國也是蠻厲害的,好像是做賭博,然後很多人去那邊玩,我不大清楚。這種的很大的一個盛世,你知道嗎?我知道,我那時候看報紙,很多人希望可以進到那個英國王子的這個婚宴裡面,但是要進去,容易不容易?
279.104	302.11	彈劾容易,你若不是個咖,你若不是個咖,至少連C咖都不是,你根本進不去的,你懂我意思嗎?所以你只要今天如果,你突然接到一封信,是威廉王子親自寫給你說,你被邀請進入到一個婚宴裡面去,我告訴你,你一定會很不容易的,
302.568	324.92	不是,不是很容易,你會非常驕傲的,你可能把它裱起來,框起來,或者把它戴在身上像立牌一樣,我被邀請了,你知道嗎?因為這是一個很不容易的一件事情,對不對?我記得上上個月有一個很有名的家族的媽媽過世,我也收到那個請帖,我才知道說,
325.367	353.023	有多少人想要擠進去那個喪禮裡面。我去到那個喪禮,真的是不得了的一個喪禮。我看過最可怕、最陣仗最大的一個喪禮。但是也是一個非常榮耀的喪禮。因為他們非常非常的榮耀,對不對?所以你想要跟他沾上一點邊,你就覺得你是somebody,對不對?感謝神,我們有一個更大、更榮耀的一個喜宴的邀請。就是今天我要講的。所以請你跟旁邊的人講,
353.626	372.789	天上的君王的喜宴,你已經擁有了。天上君王的喜宴,你已經擁有了。感謝主。但是這個喜宴你要怎麼拿到呢?我剛剛從馬太福音22章這邊,我從這裡來講。這邊有在22章第12節這邊呢,提到一件事情,他說,就對他說,朋友,
373.2	394.942	你到這麼來怎麼不穿禮服呢?那個王不是去呼召人家進來嗎?結果人家不來,他就找更多的人來。結果有人就參加在這個喜宴裡面,這個王就很高興,就來看一看,喔,有誰來,有誰來。結果看到一個人,他說朋友,你來這裡為什麼不穿禮服呢?那個人無言可答,於是王就就使喚的人說,把他丟出去。弟兄姊妹,
395.691	404.447	我們基督徒有一個概念,就是說,你以為你信耶穌之後,一切都安啊啦。沒有錯,恩典的這一面,你絕對是安的啦。
405.06	427.855	但是呢,我也知道另外一個經節告訴我們,天國是奴隸的人進去的,不是嗎?但是我們基督教常常不講這一塊,我們只講那個。所以我們每一個人基督徒在教會裡面的基督徒,或者是說我們這群成長在基督教範圍裡面太習慣了,我們認為任何事情都是恩典,所以我們就擺爛。
428.933	453.992	我們沒有預備好我們自己,然後你就以為你可以進到那個喜宴,沒有錯,你也許可以進得去,但是呢,這邊很重要一個點,我在讀這段經文的時候,神給我一個開啟,就是,基督徒一定要在一個狀態裡面,這個禮服我們很多人都知道,祂講的是耶穌基督聖結的白袍,耶穌基督那個白袍的意思是講祂的公義成為我們的義,
454.548	481.839	沒有錯的,連那個也是恩典。但是,我要講另外一個角度。我在讀禮服的時候,我感覺它是什麼?它是一種狀態。什麼意思呢?你今天去參加一個喜宴,你會不會預備好你自己?你不會穿一個人字拖,然後穿一個吊嘎,恭喜喔,恭喜喔,我來吃你的,在凱悅裡面,在凱悅穿一個吊嘎,穿一個人字拖,然後就看見你在那邊吃,你會覺得你格格不入啊,你懂我意思嗎?但是,
482.415	499.371	如果你今天穿著最正式的Casito,然後你出現在墾丁的海邊,我們來衝浪,你很怪好不好?你聽到我的意思嗎?那個狀態是我們必須在很清楚,現在這個狀態我們要預備好成為那個狀態。
499.77	527.462	所以我不是在講公義不公義這個事情,我在講基督徒心裡面要呈現一種狀態,就是禮服的狀態。而那個禮服的狀態會讓你可以進到那個羔羊的喜宴,而且可以享受在羔羊的喜宴裡面去。而這個禮服怎麼來?199你就買得到,跟你旁邊的人講,199你就買得到。什麼叫199呢?第一個一,注意聽喔,叫做
527.978	556.751	一定要警醒,跟你旁邊的人講,一定要警醒。很多的基督徒不大警醒的,他以為說每天奉行,那就可以去天堂。這要禱告,不會禱告,讀經,沒看過。要翻馬太福音,還翻到詩歌本。已經信主二十年,不知道,主導文背不起來。使徒行經,什麼叫使徒行經,沒聽過。你都不知道,奉行,你以為這樣子就可以過基督徒生活,這是一個很
557.585	585.713	我覺得是一個很荒謬的想法。基督徒被要求,就是要警醒。基督徒被要求,就是要警醒。我們看到馬太福音剛剛二十六章的時候,那邊有兩組人,十個童女,兩組人,一個叫實驗組,叫對照組。一組叫做笨蛋組,還有愚拙的嘛,傻的。一組叫做聰明組。這兩組人,
587.841	617.437	最大的差別,其中之一,就是一組警醒,一組不警醒。而這個經文,我們也很清楚知道,它講的是末日的事情。我先插播講一下,很多人在講末日五一一什麼,有的沒有的。我記得五一一的時候,我們就是去這個學校辦步道會。我們在過程中有人說,我們會不會辦步道會,辦到一半地就開了,我們就下去了。感謝神啊,照去不誤。弟兄姊妹,基督徒面對末日的這些的說法,我們要什麼態度?
619.07	643.182	勇敢面對它,對不對?如果你知道,就算你知道明天是末日,我的老師教我的,就是做你每天該做的事,這就是服侍神。你不用特別改變你的行程,你不用辦步道會,你不用到處開著車說,快啊,野獸來了,快生野獸,不用,你就好好地做你該做的事情,你就在服侍神。
643.677	662.345	所以不要被那些的﹐而且沒有人知道真正末日的時間﹐不要被那些說知道的人欺騙。這個事情﹐連耶穌都不知道﹐祂會知道就整個笑耶﹐幫幫忙。這是不可能的事情。所以誰說他知道日期﹐不要相信。回來這邊。這一整段的經文﹐這兩段經文都在講福音﹐
662.705	691.436	在講末日,但是我今天不是在講末日,因為我們基督徒常常有一個心態,我們信主之後就拿到門票,我們在末日那天,或者說有一天我們就可以到天堂,所以從這點到那點,我們全部都擺爛,不好好的照顧家,不好好的讀經,不好好的工作,反正就隨便了,這是錯誤的。199的第一個一就是一定要警醒,那個愚笨主跟聰明主最大的不同就是,
691.988	718.028	他們很警醒。這邊告訴我們,在二十五章這邊,我來讀,他說,十三節,所以,你們要警醒,因為那日子,那時辰,你們不知道,基督徒一個天生的一種警覺性,就是我們必須培養的。因為你不知道,是不是等一下宋牧師講到,啊,沒了。你知道,我們會被提,對不對?我很怕有天,我講到講到,啊,你們全部不見,
718.319	745.807	原來我才是不會被提的那個。你有沒有想過這個事情?或者說被提了,一打開,那些人都有腳,嘿嘿嘿,你被提到另外一個地方去了。弟兄姊妹,我們基督徒有一個天生的狀態,叫做警醒的狀態。你在克西馬尼園,你看到主耶穌跟祂的門徒的時候,主耶穌要去為我們受定十字架的時候,祂非常的恐慌,
746.203	774.069	非常的擔憂,因為祂沒有死過。很多人認為耶穌是用演的,祂是最佳那個一歌演氣一歌。啊,主啊,若是禰肯把這杯苦杯拿去。很多人認為耶穌是演的,因為人家認為耶穌根本就不會死,也不怕痛,因為祂是神。這是錯誤的。我們的神是真實的神,我們的耶穌是真實的人,所以祂真的不知道死亡長什麼樣子。那祂的門徒在那邊,祂有一個丟石頭的距離,祂在這邊禱告的時候,祂的門徒傻的睡在那邊,
775.282	798.269	他來罵他們說,難道你們不可以警醒騙食嗎?弟兄姊妹,警醒是一個非常重要的特質在基督徒的裡面。但是我就在想,那警醒到底是什麼?每天緊張兮兮嗎?有些人在操練屬靈恩賜、屬靈徵戰。我知道,因為這一科是我的專門。
799.002	828.142	然後有的人就是每天在那邊,這個人好貴啊,那個人的眼神不對,他可能有邪靈附身,每天很警醒,這樣警醒的下場,最後我會在馬街醫院的精神科看見你。太超過了,什麼都是鬼,什麼都是鬼,但是有另外一種也是,這些都,他完全是理智,那些都non sense,不要管他,我們有聖經教有神的話,不是的,我們應該警醒的,什麼叫警醒,它是一種狀態,
828.626	854.228	好像走鋼索的人,主啊,這個是這樣子嗎?還是這樣嗎?基督徒是走在鋼索上面的人。什麼時候你不警醒,就掉下去了。而什麼叫做警醒呢?我在禱告的時候,神對我說,警醒就是一種,你的心跟上帝的心同步的狀態。跟你旁邊講,警醒就是你跟神的心跳同步。你跟神的心跳同步。
855.026	878.865	很多人信耶穌之後,我講那個心跳一次,他的心思、意念各方面還是他的救我。我喜歡這個,我不喜歡那個,我覺得這個怎麼樣。他讀聖經的時候,都是用他的喜好來評斷。比如說,我覺得我喜歡這段,我就高舉這段。我覺得這段不合理,我就把它拿掉。我在我的信仰裡面根本不承認這一段,這是不對的。
879.275	902.408	因為在神的原則裡面,我們要常常思念天上的事。我們要把天上的模式變成我們地上的模式。那是一種警醒的狀態。主啊,在這件事上面,禰的話怎麼看?主啊,禰在聖靈裡面帶領我。主,我裡面有平安,我該如此行嗎?你裡面要有一個警醒,你不可以裡面常常是那樣慌慌。然後呢,你經歷很多的事情,
903.302	931.163	遇見各樣的困難、好事、壞事,你完全不知道你在這個世上,神有什麼定見。你不知道神要叫你學什麼。你不知道你做了這件事之後,神要叫你在哪裡成長,你都不知道。這種人是不警醒的人。你也許不會露體睡著,但是當你的靈沒有常常與神連結,常常敏銳的體會祂的心跳的時候,你也像一個在靈裡睡著的人。
931.783	960.42	主耶穌會來問你說,欸,Keyton啊。什麼時候我們的靈是最醒的時候?聚會的那兩個小時啊。當然有時候你可能覺得宋牧師講得很無聊,你會想睡覺,對不對?我奉耶穌的名祝福你,安心的睡吧。安心上路。在夢中與你相會。在教會裡面睡著也是一個很好的service啊。因為你可能在家裡睡不著。如果你在家裡可以睡得很好,奉耶穌的名祝福你。這是教會提供的另外一個服務。
961.271	987.236	可以抑制你睡眠的問題。我們常常只有在聚會的時候﹐我們的靈是很警醒的。牧師在講什麼?平常的時候﹐你不大在意屬靈的事情。你不大把神的原則成為你的原則。我們還有另外一個時間是警醒的。就是我們出狀況的時候。哎呀,沒錢,快去賭,快點,快點,快點,快點,快點,快點,快點,快點,快點。
988.797	1018.37	只有那個時候你會很警醒。其他時候都幫我扛扛。神不要我們這樣過生活。一個基督徒他一個天生的特質,或者神有一個基本的要求,要警醒。所以,如果你想要在喜宴裡面享受,而且不會被丟出去,199的第一個1跟你旁邊講,一定要警醒。基督徒必須要有警醒的態度跟狀態。那199的第一個9是什麼?
1018.712	1038.066	跟你旁邊的人講說,不要讓主人等太久。這是什麼東西呢?我們剛剛在讀到馬太福音22章的時候,我們知道有一個記載,一個王他請客,流水席,沒人要來。路加福音的14章有類似的記載,我來讀。路加福音的第14章,15節。
1040.745	1063.562	同席的有一人聽見這話﹐就對耶穌說﹐在神國裡吃飯的有福了。阿們。耶穌對他說﹐有一人擺設大研席﹐請了許多客﹐到了坐席的時候﹐打發僕人去對所請的人說﹐請來吧,樣樣都齊備了。是不是很像馬太福音第二十二章﹐很像。十八節﹐眾人一口同音的推辭﹐不得了,一口同音。
1064.684	1092.704	他們可能有合音了,三個人。頭一個人說,我買了一塊地,必須去看看,請你準我馳了。又一個說,我買了五對牛,要去試一試,請你準我馳了。又一個人說,我才娶了妻,所以不能去。那僕人回來,把這事都告訴了主人。家主就動怒對僕人說,出去,到城裡大街小巷,領那貧窮的、殘廢的、瞎眼的、瘸腿的來。僕人說,主啊,你所分佈的已經辦了,還有空位。
1092.944	1118.471	主人對僕人說,你出去到路上的籬笆那裡,勉強人進來,坐滿我的屋子。我告訴你們,先前所請的人,沒有一個得償我的筵席。這段經文講的是福音的廣度。一開始神本來要找的是猶太人,猶太人不來,結果神就把外邦人,我們這些人就是外邦人,所以請你跟旁邊的人講說,你就是那個殘疾的。我們就是,
1119.087	1146.694	你不要想太多,我們是野橄欖,很清楚的,那個原本神的真橄欖,或者是神所欲變的橄欖是猶太人,他們犯罪得罪神,他們不要跟隨神,我們這個野橄欖才被插在那個橄欖樹上。所以你不要太高估你自己,哇,基督徒,他們就是基督徒。在聖經的裡面,我們是瞎眼的,殘疾的,就是我們。但是我不是要講這個,我要講另外一個東西就是,
1147.688	1170.674	不要讓主人等太久是什麼意思呢?在這個裡面,有一個呼召,對不對?來喔!來喔!來吃飯喔!結果他們不來,這三個人,一個人說怎麼樣?我買地,這個應該是比較年長,比較有錢。我已經存了30年的錢,我要去買地,自產,不得了。我買房子,我最近在哪裡買房子,在哪裡買房子。
1171.135	1198.947	第二個,可能是中年人,或者是事業有成的人,或者他正在工作努力中,他買了五對牛,不得了,牛是幹嘛的?如果在臺灣可能是做牛肉麵,他不是,他是來耕作的,對不對?是一個生財器具,他可能還在努力當中,你知道嗎?我最近公司才要去這個上海開分部,我買了一些新的機器,我要在那邊設廠,哇,聽起來是不是非常好?很好,非常冠冕堂皇的一個
1199.292	1228.213	理由。第三個,我想應該是年輕人。我大嫂沒娘啦,拜託。舅爺跟我們講說,娶親的第一年不能打仗,要讓妻子快樂。對不對?是不是很合乎道理?這三個人,年長的,或者中年的,或者年輕的,他們都有非常合乎情理的一個理由說,我不要去啊。但是這個家族無理取鬧,不可以!你不要來!
1228.695	1258.077	哇!你就要來?神氣耶!其實我們的主是一個無理取鬧的主,你知道嗎?祂其實不大跟你講道理,你不要誤會上帝跟你講道理,上帝幹嘛跟你講道理啊?對不對?如果祂真的是上帝,祂幹嘛跟你講道理啊?我們常常齁,我們有一些人遇一些困難,或是一些麻煩,我們就把神拉下來,你,現在下來,你給我跪下,你憑什麼叫我去做那個?蛤?你是什麼?你也好花,我告訴你,我不會送,我不會走。我們常常這樣對待神,我告訴你,
1258.677	1280.947	這是有問題的。如果神真的是神,祂就有絕對的主權。你說祂很霸道,沒錯,祂就霸道啊。是祂讓心體運作,是祂給你空氣,是祂讓你身體的細胞可以運作。我們竟然常常把祂拉下來說,來,我們來談判一下。你讓我得這個,我就做這個。你不給我這個,我就不要那個。你真的是想太多了。
1281.425	1306.274	不要讓主人等太久。聽眾姊妹,我不是在講未來那個末日,我們在每一天我們就要常常警醒以外,我們不可以讓主人等太久。我想到一個,一個講無慮取鬧最高境界的一個經文,有一次主耶穌行走在一個地方,然後呢,肚子餓,祂看見一個無花果樹,記不記得?結果無花果樹不結果子,
1306.988	1336.307	無理取鬧的耶穌啊!竟然說,你不接果子,我咒詛你去死啊!結果怎麼樣?真的死了!第二天,真的死了!聖經是這樣寫的嘛!我們有時候把聖經讀得太文雅了一點,其實聖經就這樣寫,祂咒詛祂,為什麼咒詛你去死啊?對不對?就真的死掉了。你不覺得這個很無理取鬧嗎?有沒有?超級無理取鬧,所有的人都知道,那個時節,無花果樹就長不出果子嘛!
1337.568	1366.049	就像你如果在冬天要吃西瓜,你笑耶,冬天哪有西瓜?西瓜都是夏天才長得出來的嘛。當然現在因為科技的關係,你可以去調世界的貨之類的,但是在那個時候不可能嘛。耶穌非常無理取鬧,就咒詛那個無花果樹死掉。我在這邊學一個道理,有時候主啊,臨到你的時候,是我們最忙的時候,
1367.005	1394.014	兄弟你也幫幫忙,我孩子剛剛開學。拜託,我那個票都掛不過去了。拜託,我最近很軟弱,我生病。上帝,你有沒有看見,我有這麼多事情要忙。這三個人就講這句話。我有五對新的牛,要去試一下性能。我有新的房子,我有新的老婆。老婆不能是新的,老婆只能有一個。
1395.387	1423.122	他們那個時代可能有啦。他們那個時代可以取竊。弟兄姊妹。弟兄姊妹。我們常常,像那顆無花果樹一樣。但是喔,我告訴你。主耶穌領導你的時候,你是真的很忙,對不對?你是真的沒有辦法像無花果樹,就是沒辦法啊。弟兄姊妹,在這個無花果樹的這個的過程中,我相信,
1423.882	1449.934	我相信耶穌要對你跟我說﹖有一天祂領到你的時候﹖也許你是結不出果子的時候﹖你願不願意把你自己給祂﹖祂會讓你結出果子﹖我們不是喔﹖我就沒辦法﹖你走開啦﹖耶穌你找別人啦﹖我真的沒有辦法﹖有太多的人可以告訴你﹖有一個人我那時候﹖我上次有提到就是有一個叫布永康﹖布永康厲不厲害﹖
1450.623	1480.147	很厲害喔,他跟四千萬個人傳福音。是當代最有名的一個佈道家。很多人就問他說,神為什麼會揀選你?結果布永康講什麼,你知道嗎?他說,他並不是第一個神呼召他做這件事情的人。什麼意思呢?前面可能有十個、二十個。每一個耶穌臨到他的時候,喔,主啊,最近我的事工剛剛開始。喔,主啊,主啊,主啊,主啊。一個一個,主都離開了,都離開。一直到這個,這個傭人,就叫布永康。他說,
1480.486	1500.678	Yes, I do, 神就使用他。什麼意思呢?不要在神的面前讓他等太久,因為我們裡面有屬靈的小山,很多東西我們被吸引,
1501.544	1524.171	被那強烈的好像被帶領,我就要做這個,我有房子啊,我有器具啊,我有牛啊,我剛剛結婚,我很累啊,我很多事情,我一大堆事情在忙,你不知道嗎?我們裡面其實有些藉口,那些的藉口往往是我們生命中屬靈的小三。我們大概不會在教會裡面遇見真正的小三。
1525.213	1554.126	因為大概不會你等一下來跟我介紹,宋牧師跟你介紹一下,我太今天沒來,這是我新的女朋友,這個叫莉莉。來,莉莉跟這個宋牧師say hello,我們不會這樣做的。但是我們裡面有很多小三是隱性的。而這些小三讓我們在一個關鍵時刻的時候,我們會離棄神的呼召,我們會去就近小三。不要讓神等太久。
1554.48	1579.375	不要讓主人等太久。你以為說還有下次機會嗎?我告訴你,往往不會。機會常常曇花一現。如果你把機會換成呼召,呼召常常也是這樣子。神真的認真呼召一群人的時候,祂叫你做一件事情的時候,祂給你一個非常榮耀的使命的時候,
1580.111	1608.872	往往也許是你最沒有辦法﹐壓力最大的時候﹐但是當你願意踏上去的時候﹐你就進到神的命定裡面。你在那邊拉扯﹐我常常聽一些人講說﹐我最近在拉扯﹐神叫我去做那個﹐但是我沒有帶領﹐你帶領多久?這樣子的過程﹐已經兩年整孝了﹐你已經不知道跟誰拉扯﹐神早就走了。神很忙,哪有時間跟你拉扯﹐你不要嗎?下一位﹐
1611.288	1638.748	丹江教會之所以在這裡,不是因為我們幾個牧師很厲害,是因為我們在那個時刻,我們跟上神的呼召,我們來做。那個時候大家都很忙,那個時候大家都很窮,那個時候大家都有一大堆事在做,那個時候每個人家庭都在面對各式各樣的挑戰,但是我們在那個時候,第一時間我們踏出來說,主我們在這裡使用我們。
1641.118	1668.688	你不要以為說,還會有現在,沒有了啦!我還很怕神告訴你說,沒有以外說,祂還告訴你說,其實啦!那就很可怕啦!弟兄姊妹,如果你真的覺得你很忙,你真的已經沒有辦法相信神,祂會讓你結束果子。不要讓神等太久。再次跟你媽媽講,不要讓神等太久。我就看到多少的人,他們失去神的呼召,他們真的像無花果死了一樣。
1669.65	1698.122	生命沒有亮度﹐沒有能力﹐沒有喜樂﹐每天過著﹐就是一直在反覆那些﹐他覺得沒有意義價值的事情。常常我們心裡面被那些東西吸引﹐有太多的人可以告訴你﹐他們之所以現在在他的事業會成功﹐在他的家庭會成功﹐在他的服事會成功﹐在他的身體各方面成功﹐是因為他們在第一時刻回應神的呼召。
1700.026	1729.527	神在呼召很多的人,你如果想要在喜宴裡面享受,不被丟出去,一定要警醒。第二個,立刻的回應神在你的每一天給你的呼召。神告訴你不可以做,你要立刻說是的。神告訴你說做,你要立刻說是的。沒有那個,我們把神當作太可愛的神了,我認識的神是一個很兇猛的神。
1732.142	1758.418	祂很兇猛啊。祂自己在馬太福音,主耶穌形容那個家族,祂可以把人家全部幹掉。在舊約祂實在幹過這樣的事情。我們太習以為常的講慈愛,但是弟兄姊妹,我們的神也是公義的神。公義有嚴厲的那一面。我們需要很認真的面對這一面。不要讓你的主人等太久。第三個,一定要警醒。
1759.087	1787.841	第二個酒,一、酒,不要讓主人等太久。第二個酒是,每天都要喝新酒。跟你旁邊講,每天都要喝新酒。太好了,這是聰牧師最喜歡的一個題目。喝酒不可以過量,不要喝酒醉,這是不逃生喜悅的事情。一個人,他要成為基督徒,他要成為一個
