start	end	text
1.766	3.768	好,弟兄姊妹平安。
3.768	9.172	感謝主來介紹我們今天的講員,很不容易從海外而來的講員。
9.172	18.701	感謝主,去年因為神的恩典,在美國新澤西州的若哥教會,詹弘牧師到我們當中來講道服事。
18.701	34.937	我們在,很特別,因為去年剛好是紀念馬丁路德宗教改革五百年, 結果呢,我們這個國際讀經會,這個王茂采王姐,真的是神給她一個靈感。
34.937	39.202	我們就在這個淡水河上怎麼樣,把她變成這個嘉麗麗海。
39.202	43.307	所以我們就一起在這邊,在船上來禱告。
44.019	56.506	後來就是也很感恩,就有機會換我到這個若哥教會去來拜訪,跟弟兄姊妹有很美好的交通。
56.506	64.790	那今天很感恩,我們今天就邀請到若哥教會的張宗培牧師,來到我們當中,要來宣講神的話語。
64.790	68.135	我想我們 待會用最熱烈的掌聲來歡迎他。
68.135	72.586	讓他知道淡水是臺灣這個裡面非常有熱情的一個地方。
72.586	73.267	阿們。
73.267	74.129	感謝主。
74.129	76.294	我們用最熱情的掌聲歡迎張牧師。
87.090	101.585	謝謝各位弟兄姊妹那麼熱情,你們的熱情是從淡水這兩個字顯出來,因為我進來以後有三個人到四個人給我淡水喝,手上有好幾瓶的水,你們的招待同工實在很棒。
102.346	112.468	代表我所服侍在新澤西州的若哥教會,相信你們也碰過詹宏牧師,我們的主任牧師,向你們問安。
112.468	123.391	今年是我在教會裡面的安息年,我拿六個月的時間,所以回來我的神學院的母校華神在教課,那快要結束了,然後六月底就回去。
123.951	128.293	難得的機會來到你們中間,也很高興看到你們。
128.293	133.035	我上一次來臺灣在住的時候,就是二十年前讀神學院的時候。
133.035	139.398	這二十年,臺灣教會的變化實在是很驚人,也很感恩,可是挑戰也很大。
139.398	143.100	所以今天我特別用一段的經文跟各位分享。
143.100	163.514	所以若是你有聖經的話,我請你打開在舊約撒母耳機上, 第四章,《旧約撒母耳機上》,第四章,我看到招待同工有聖經在那邊,所以若是你需要的話,可以舉個手讓他們給你們。
168.916	172.697	今天的經文其實涵蓋第四到第五章。
172.697	178.439	那若是你讀經很熟的話,你應該記得這個故事,這個記載。
178.439	183.301	那不熟的話也沒有關係,我挑幾段經文跟各位讀。
183.301	189.803	這是《撒末爾記》上第四章第三節,十到十一節,十七到十八節。
189.803	195.185	然後第五章呢,我們會看第五章的第一到第五,跟第九到第十二。
195.845	203.710	這幾段經文其實就涵蓋把整個在以色列人中間遠古時候發生的事情記載在裡面了。
203.710	205.871	所以這次請各位聽這次神的話。
205.871	209.293	《撒末爾記》上第四章第三節。
211.271	219.096	百姓回到營裡,以色列的長老說,耶和華今日為何使我們敗在非利斯人面前呢?
219.096	226.401	我們不如將耶和華的月桂從士羅抬到我們這裡來,好在我們中間救我們脫離敵人的手。
227.142	229.983	第十到第十一節。
229.983	250.111	菲律斯人和以色列人打仗,以色列人敗了,各鄉各家奔逃,被殺的人甚多,以色列的步兵撲倒三萬,神的月貴被擄去,以色列的兩個兒子,和弗尼,菲尼哈,也都被殺了。
250.111	252.052	第十七到十八節。
253.831	266.299	報信的回答說,以色列人在非利斯人面前逃跑,民眾被殺得甚多,你的兩個兒子和弗尼菲尼哈也都死了,並且神的月桂被擄去。
266.299	277.046	他一提神的月桂以利,就從他的位上往後跌倒,在門旁折斷景象而死,因為他年紀老邁,身體沉重。
277.046	280.749	以利做以色列的士師四十年。
280.749	282.570	跳到第五章第一到第五節。
284.445	289.007	菲律師人將神的月桂從已變已洩,抬到亞瑟吐。
289.007	295.590	菲律師人將神的月桂抬進大滾廟,放在大滾的旁邊。
295.590	306.635	次日清晨,亞時突然起來,見大滾撲倒在耶和華的月桂前,臉浮於地,就把大滾仍立在原處。
306.635	354.843	又次日清晨起來,見大滾撲倒在耶和華的月桂前, 9到12節 臺灣國語 他們將以色列神的月貴運到我們這裡,要害我們和我們的民眾。
354.843	364.124	於是打發人去請菲律斯的眾首領來說,願你們將以色列神的月貴送回原處,免得害了我們和我們的眾民。
364.124	375.647	原來神的壽重重攻擊那城,城中的人有因饑荒而死的,未曾死的人都傷了智昌,合成呼號,聲音上達於天。
376.647	379.748	這是神的話。
379.748	385.771	我先稍微簡單地把這個記載,這個第四到第五章跟各位講一遍。
385.771	394.235	以色列人當年他們在那個時候還沒有亡, 那個時候他們整個國家裡面的領袖就是撒末爾。
394.235	406.847	在前一章我們看到撒末爾年幼的時候領受了神來的呼召,他就成為借序以利,一方面做祭司的工作,另外一方面也是以色列的一個士師。
406.847	412.132	士師就是他們中間做判斷、做審判、領袖,也用神的話來教導他們。
413.097	422.786	我們知道撒母爾一生裡面他是垮在兩個時代中間,他從世事時代進入到王的時代。
422.786	433.976	神也藉著他在以色列裡面立了兩個王,一個是掃羅,另外一個就是我們後面會讀到在撒母爾第二章開始,大衛做這個以色列的王。
433.976	439.301	所以他是一個關鍵性的人物,他是以色列歷史發展裡面一個非常關鍵的人物。
439.821	446.084	在這裡是以色列在面對一個外族的壓力。
446.084	457.409	這裡講到的費利斯人在舊約,我們看見從撒末爾基一直到大魏做王的時候,到大魏做王以後,費利斯人才被壓制下來。
457.409	463.872	他們一直在舊約裡面,對以色列人是一個非常頭痛、非常麻煩的敵人。
464.172	465.832	為什麼呢?
465.832	470.914	原來這個菲律斯人啊,他們遠古的時候是一個航海的民族。
470.914	473.715	他們是在地中海一帶航海的。
473.715	479.356	後來他們到了巴勒斯坦沿岸一個地方,一帶地方,他們就開始上岸。
479.356	482.417	上岸以後他們就希望能夠建立起他們的城市。
483.097	487.181	他們也跟埃及打過仗,跟周圍的民族打過仗。
487.181	491.805	他們大概只輸在埃及人手裡面,沒有輸過在別的。
491.805	493.066	原因是這樣子。
493.066	501.563	第一,航海的人他們性格強悍, 各位你們淡水這邊,你們看到有漁人碼頭,今天是觀光的地方。
501.563	512.953	可是你知道,淘海的人,他們的性格是很強韌的,因為他們要跟大自然、跟風浪搏鬥,所以費利斯人也帶著這種強悍的民族性。
512.953	519.799	第二,他們有技術性的優勢,因為在那個時候,只有費利斯人知道怎麼鑄鐵。
521.630	525.011	他們從銅器時代進入到鐵器時代。
525.011	535.456	鐵的鑄煉不是那麼簡單的事情,所以他們知道這個優點,所以他們一直很小心保護他們這個技術。
535.456	541.238	所以你們看到在《撒末爾紀》上後面二十幾章裡頭,他們管制這個事情。
541.238	547.961	以色列人他們有刀有劍什麼的,要磨這種鐵的工具,他們不給他們,你拿來我們這邊我幫你做。
548.541	550.882	他們不把這個技術留出去。
550.882	557.346	所以在打仗的時候,鐵器碰到銅器的武器的時候,優劣利盼。
557.346	560.227	所以為什麼以色列一直在他們手上敗?
560.227	568.292	所以我們就看到第四章這裡,他們打仗的時候,第一場仗敗得很慘,有四千人被殺,四千個勇士被殺。
569.565	582.417	所以在這裡我們看見這四千個勇士被殺,假如我們轉到我們今天的頭影片裡面,我跟各位分享今天的題目是《雖敗猶勝》。
582.417	593.867	在這段經文裡面,勝跟敗是一個撒姆爾基上作者要讀者深深去思考的問題,到底什麼是真正的失敗,什麼是真正的得勝。
595.759	602.904	在這裡第四章第三節裡面,以色列的長老問了一個問題,他問什麼問題呢?
602.904	607.868	耶和華今日為何使我們敗在非利士人面前呢?
607.868	629.371	各位這個是個好問題喔,他們沒有問說今天我們為什麼技不如人,他們沒有問為什麼我們的這個國防研究所, 為什麼沒有多研究一點的技術,讓我們在武器上面比較優勝?
629.371	634.353	他們沒有問為什麼我們打仗的策略,軍事策略為什麼不如人?
634.353	641.095	他們問一個問題,耶和華今日為何使我們敗在非歷史人面前?
641.095	642.116	為什麼這是對的問題?
642.116	648.198	因為他們知道第一,他們是屬神,屬耶和華的子民,神掌管他們的命運。
649.275	666.339	第二,他們跟周圍民族有一個不一樣,就是有耶和華,以致後面我們看見他們能立王的呼求,雖然沙姆爾很不喜歡,可是神說你姑且答應他們。
666.339	676.282	他們所立的王跟周圍的王不一樣,周圍的王是自我中心的,周圍的王是我要這子民來畏懼我,他是一個獨裁者。
677.398	691.921	可是以色列的王不一樣,以色列的王是服在神話語前面的,他第一個任務是先操守神的話語,然後先知是他的監督。
691.921	704.184	所以以色列的王不能任意而行,所以他們知道他們本身這個整個民族在所有列國列民中間,他們的位分,他們的身份是什麼。
704.184	712.823	所以這群長老問對問題了, 基督徒耶和華為什麼使我們敗在費利斯人面前?
712.823	716.405	這是問對問題,他們的神學很對。
716.405	720.568	可是我們看他們這句話沒有講完,後面還有。
720.568	731.816	我們不如將耶和華的月桂從四羅抬到我們這裡來,好在我們中間救我們脫離敵人的手。
731.816	735.199	問題問對,解決辦法出問題。
736.544	741.346	問題問對,心有問題。
741.346	743.087	他們為什麼這樣講呢?
743.087	752.232	第一,他們一定想到,假如我們往前看,看到約蘇亞紀,什麼時候越貴被抬出來得大勝?
752.232	759.195	就是一些人過了約旦河,去面對第一個堅固的城,耶利哥。
759.195	777.570	那個時候耶和華啟示他們說,那個啟示很特別,完全沒有軍事策略, 就一群祭司,臺著夜花的月桂,繞城七日,到第七日大喊,城牆就倒下來。
777.570	792.937	所以這群長老他們覺得,我們過去有這個輝煌的歷史,今天我們同樣地把它抄過來,把這公式抄過來,印在這個地方,好讓我們能夠得勝。
792.937	795.818	可是各位弟兄姊妹,問題就在這裡了。
796.869	806.376	他們以為可以藉著把月桂臺出來,就可以重演耶利哥時候發生的事情。
806.376	825.952	可是我們知道這個有一個大問題,因為後面跟著我們講說,因為第四節,於是百姓打發人從士羅,從那裡將坐在二基路伯上萬鈞之夜娃的月桂臺來,以利的兩個兒子和弗尼哈與神的月桂同來。
828.387	835.831	以利的兩個兒子和弗尼哈在前面兩章我們看見他們惡勢作勁。
835.831	842.435	他們不是普通的人,他們是以利的兒子,藉以利要做大祭司的。
842.435	856.282	神已經透過撒母耳,也清清楚楚在第二章第三章都有預言,那個預言非常的清楚,祂會審判他家,而且他們會在同一天滅亡。
858.200	877.551	所以在這裡我帶出來的第一點,在這個記載裡面,我們在神面前可以深深學到一個功課,我們可以神學對,可是我們心出問題的時候,那這不是討神喜悅的,它就會使得上帝的榮耀遠離我們。
879.684	885.266	所以在這裡我們看見,他第一次,以色列人第一個拜葬是四千人死。
885.266	889.007	再來,在打抬月櫃出來的時候,怎麼拜法?
889.007	896.108	三萬人滅亡,而且連月櫃都被人家拿走。
896.108	902.030	神學對,心不對,使得上帝的榮耀遠離我們。
902.030	906.851	各位弟兄姊妹,今天這樣一個教訓可以用在我們的身上。
906.851	943.016	我們很多時候以為熟讀聖經, 累積很多聖經的知識,參加很多的特惠訓練各方面的,我們累積很多的知識在裡面,可是這個知識有沒有影響我們的生命,使得我們成為一個更敬畏神的人,有沒有影響我們的生命,進到我們生命裡面影響我們的夫妻關係,影響我們跟同工的關係,影響我們的親子關係,影響我們在教會在外面,當衝突來到我們面前的時候,我們如何去面對, 還是我們跟我們的老我一樣。
943.016	948.879	我們所學的屬靈的知識﹐跟我們的生命是不上乘的。
948.879	951.861	這是我們要思考的。
951.861	960.826	我知道在單張教會裡面﹐你們很多的弟兄姊妹﹐在用讀經會裡面的每日嚴經詩意來靈修。
960.826	963.767	嚴經詩意的靈修裡面,他非常棒。
963.767	968.910	我要特別提醒各位要注意﹐在你們那本嚴經詩意裡面﹐每一天有個框框。
970.026	976.832	那個框框裡面是如何應用這個經文,如何把它帶到禱告裡面去。
976.832	982.136	你不要小看那個框框,只看其他東西,框框就丟掉了。
982.136	989.602	也不要以為我每天有半個鐘頭、一個鐘頭靈修,懂得這段經文裡面很清楚,就夠了。
989.602	997.909	一定要帶到我們個人的禱告生活,帶到我們自己的反省裡面,以至神的道能夠改變我這個人。
999.957	1005.640	這樣子我們的神學﹐跟我們的心才能夠一致。
1005.640	1023.951	在我所服侍的教會裡面﹐其中有一個現象﹐我們一直很頭痛﹐也一直想要幫助弟兄姊妹成長的是﹐有沒有這種經驗﹐在一個小組裡面一起查經﹐通常神學知識最豐富﹐聖經知識最豐富那個﹐是最難搞的人。
1023.951	1026.533	我想你們都會有會心的微笑。
1026.533	1041.032	我不是否認神學跟聖經的知識﹐ 可是很多時候我們以為我們懂多了,背景的東西懂多了,神學觀念搞清楚了,我們就好像是稍微比別人成熟一點。
1041.032	1065.025	其實成熟不是這回事,成熟是當我們得到神的話語,被神的話語改變、降服, 在祂面前願意做一個跟隨祂跟前輩的人,往往就在我們跟弟兄姊妹,跟家人,夫妻關係,親子關係裡面表達出來。
1065.025	1075.767	神隨對,信不對,有時會使我們跟神的榮耀隔開,就像一些人這裡一樣,這個對我們來講是一個很深的提醒。
1078.114	1097.380	我也常常問我自己,受了神學的訓練,我這個人的性格,我這個人跟同工的關係,我這個人跟我家人的關係,是否因此會變得更柔和謙卑,更像基督?
1097.380	1102.482	各位兄弟姊妹,這應該是我們在讀經、在屬靈成長裡面要追求的一個目標。
1103.422	1119.569	不單止停在知識,不單止停在更多的資訊,而是追求更深的生命被基督的愛得著,以致我們能夠成為一個越來越能夠反照基督榮美的一個人。
1119.569	1139.031	所以在這裡我們看見,以色列長老問對問題,他們心不對,所以他們帶出來解決的辦法也不對,因此使他們 不能夠看見神的榮耀,神的榮耀因此受到虧損,因此遠離他們。
1139.031	1144.935	接下來我們看見,這個沙漫的故事好像是上帝失敗,對不對?
1144.935	1150.519	月桂代表神的同在,在這裡講,坐在二基魯伯之間的。
1150.519	1159.806	帶出來,這是以色列人最引以為豪的事情,也是他們整個民族裡面最寶貴的一樣物件。
1161.476	1165.900	竟然在這個徵章裡面,被敵人拿去了。
1165.900	1172.126	而且不但被敵人拿去了,還拿到他們廟裡面去,變成戰利品。
1172.126	1178.051	你能夠想像今天我們的石家給人拆過來,放到媽祖廟裡面,放在旁邊嗎?
1178.051	1181.334	這個嚴重性就有點像這樣子了。
1181.334	1182.875	所以對他們來講是一個很大的危機。
1184.104	1201.288	拜了,可是我們看見,剛才我們第四章讀的十一節,十七到十八節,當以色列人拜了這個消息,經過人傳回去的時候,這個戰拜裡面他們死了四萬人,而且以利的兩個兒子被殺。
1201.288	1220.650	而且更奇特的是,當這個人回去報信的時候,以利聽到了,年紀老邁,身體沉重,他大概已經非常的胖了, 他根本站都站不起來,椅子往後一倒,脖子打在門檻上,就這樣斷氣了。
1220.650	1236.856	當我們最後去看第二、第三章關於他家族的預言,我們不得不看到一個事情,似乎神在失敗中,竟然祂的預言應驗了。
1236.856	1248.501	在神看起來是一個失敗的光景裡面, 他對以利家審判的預言完全應驗,一點都不落空,一句話都不差。
1248.501	1257.948	同樣的,當天他們家這三個人就滅亡,在同一天的滅亡。
1257.948	1267.155	在這裡我們就開始,因為作者這樣描述,我們就開始想到,陰影裡面有一個印象,這到底是失敗還是成功?
1269.053	1277.375	看起來好像上帝失敗了,祂最重要的那個月櫃都給人家拿去,祂的子民拜得一塌糊塗。
1277.375	1281.436	可是在這個失敗中,祂審判了以利的家族。
1281.436	1286.878	在失敗中,祂竟然審判了罪。
1286.878	1292.339	各位,這個我用我自己個人的一個經驗跟各位分享。
1292.339	1294.340	我在若哥教會服侍今年第十八年。
1294.340	1297.441	神主神畢業以後,一直在同一個教會服侍。
1298.831	1306.417	可是我蒙神護照的那個過程是一個滿坎坷的一個過程,曲曲折折。
1306.417	1319.028	我在臺灣讀大學,我是香港僑生,在臺灣讀大學,在臺灣認識主,在臺灣的教會聚會,被栽培,被造就,成長,都在大學那幾年裡面。
1319.028	1327.755	也在那邊碰到我的太太,在那邊結婚,就成為臺灣女婿,然後就出國念書了。
1328.865	1363.334	在出國念書的過程裡面,有幾年我就深深掉到我屬靈的地谷裡面去,因為我去讀,本來想要讀一個博士回來在中研研究院繼續做的,結果我讀的是社會科學,我去的學校很不幸是左派學校,在美國的左派學校,所以我在博士班頭兩年把馬克思恩格斯的東西全讀完,所以我比那時候大陸出來的更懂馬克思恩格斯更懂辯證唯物論, 可是在這個讀的過程中間,我信仰完全動搖。
1363.334	1367.656	到一個地步,我幾乎要不去教會了。
1367.656	1372.517	那我太太是讀音樂的,她到哪裡就給抓去當師班指揮。
1372.517	1377.699	所以我那時候就跟她有一個約定,你去服侍沒問題,我在車裡等你。
1377.699	1381.080	你去服侍沒問題,我在車子裡面等。
1381.080	1385.641	十億風險沒問題,只要不來搞我。
1385.641	1399.486	所以我們是這樣子有一個 說不出來一個約定,因為我知道在教會待久了,只知道你假如這種東西不讓步的話,一定家裡吵了,沒完沒了。
1399.486	1402.947	我只想不要有人來搞我。
1402.947	1408.530	結果那個時候我們從紐約市搬到現在我們正在服侍的洛哥教會。
1408.530	1411.711	我一到這個教會,我就發覺這個教會不對勁。
1411.711	1412.411	為什麼呢?
1412.411	1415.713	他們盯我的靈命,他們不放過。
1417.329	1419.951	所以我就覺得該躲,該躲。
1419.951	1421.872	這個神很恩待。
1421.872	1424.594	這個很長的故事,我很簡單的。
1424.594	1438.064	神的愛,基督的愛再一次淋到我心裡面,因為弟兄姊妹的關心,因為他們的緊迫敵人,神的愛再淋到我心裡面,從此更新我這個人。
1438.064	1444.109	在更新的過程中間,我有兩個禮拜,有兩個禮拜不斷地認罪。
1445.060	1457.688	而這個更新的過程裡面剛好跟我人生很大的挫折有關係,因為在那個時候我讀研究所到寫論文的時候,我的指導教授突然間在一個聖誕節中風死了。
1457.688	1463.271	這是很少碰到的,我就覺得我是全世界最倒楣的人。
1463.271	1490.539	而且我讀的是社會科學,那個時候是80年代末,接近90年代的時候,中國大陸開始改革開放,社會科學院廣邀 海外這些美國的中國研究學者會去訪問,所以我一下根本找不到人替,所以我沒有辦法讀我的博士學位,所以我就只好心灰意冷的把我剩下的時間、長學金就轉到教育學院。
1490.539	1535.718	我也無心教育,我就去讀了一個藝術教育,因為我喜歡藝術,就讀了一個藝術教育,可是那個時候是我人生最後一地潮的時候,也是那個時候, 神藉著若哥教我們一些同工開始關心我這個人的靈命開始被翻轉過來的時候就在我最低潮的時候我覺得那個時候我的人生是最低沉的一個想要做研究做這個研究員的夢好像不能達成書讀不成 太太懷孕,需要錢,需要健康保險,所以就成為紐約市公立學校初中老師。
1535.718	1540.280	這個一成為,就成了十個學年,在那邊做了十年。
1540.280	1544.002	在做的時候,越做越不喜歡那個工作。
1544.002	1551.026	假如各位你有在,若是你教過青少年你就知道。
1551.026	1553.648	所以越做越不喜歡,越做越抱怨。
1554.189	1557.932	我就覺得,神啊,你開我玩笑。
1557.932	1561.874	我這輩子好像就這樣毀了。
1561.874	1568.599	可是也在那個最低潮的時候,我重新遇到基督。
1568.599	1574.463	當我讀這種禁聞的時候,我想到,神在以色列身上做的是一樣的。
1574.463	1579.187	看起來好像神的恩典在我身上被打敗了。
1579.187	1581.989	這個人嘗過主恩之位,竟然還跑離開。
1584.002	1601.636	可是正在我最失敗的時候,我覺得我已經不要了,好像神的恩典在我身上失敗的時候,也是神審判了我的罪,使得我在基督的愛裡面重新回到祂的面前,再認罪,再悔改。
1601.636	1630.765	這個認罪悔改,我的生命又開始活過來,以前在大學團聚裡面被裝備的一點都沒有浪費, 當寧命被翻轉的時候,這些又回來了,對神話語的渴慕,對侍奉的覺得被驅動想要去服侍,以致全職的護照,在那一兩年之間慢慢地回來。
1630.765	1653.045	上帝看起來的失敗,在我這個人身上審判了我的罪, 各位弟兄姊妹,在這段經文裡面,在我自己個人生命的經歷裡面,這個成跟敗,似乎是倒過來的。
1653.045	1674.412	這樣就帶我們更深認識到在義部,因為在第五章裡面我們看見,這個神看起來的失敗,月桂被帶到 這個大館的廟裡面去,他們把他抓回來了,哇,好高興喔,打贏了,慶功宴,因為之前他們很惶恐啊。
1674.412	1687.243	我們只要細看這個經文,我們知道當一些人把月桂來出來的時候,他們很怕,他們那個時候的恐懼反而變成他們凝聚他們軍心的一個很大的力量。
1688.166	1697.428	他說,假如今天我們不奮力去征戰,有一天我們跟以色列人從出鴻海以後過來的其他民族一樣,我們變成他們的奴隸。
1697.428	1703.349	反而這個時候他們打贏了,所以你能夠想像非利斯人多興奮。
1703.349	1706.569	今天我們一鼓作氣,竟然贏了。
1706.569	1715.531	過去那麼大的民生的神跟他們,今天連他最神聖的給我們抓回來,所以放到廟裡面去,他們一定去開慶貢宴。
1717.927	1729.096	辦流水席,然後在那邊吃喝,搞不好一大群人高興得不得了,喝醉了,倒在那邊就睡覺了。
1729.096	1735.221	第二天早晨,其中一個可能酒醒了,跑出來,要去上廁所。
1735.221	1744.448	經過那個廟裡面看看,看看我們的輝煌的戰果,那個月桂在那邊,一看不得了,我們的大滾神像竟然倒在這個月桂前面。
1745.865	1768.311	他不肯講話,趕快找幾個人起來,起來大事,把這個神像扶起來放回去,因為好像沒有事情發生一樣,以為這樣可以,第二天同樣的,起來又看到又倒,而且這次更不得了,倒下來不止,還在門檻上頭跟手折斷。
1768.311	1771.172	為什麼作者記得那麼清楚?
1771.172	1783.060	你看看前面以利是怎麼死的, 脖子打在門檻上,現在是大滾倒在門檻上,頭斷,手斷。
1783.060	1793.969	手斷是他們那個時候,當時征戰的時候,抓到對方最強的勇士,他們做,把你手筋砍斷,廢你武功。
1793.969	1801.936	而這個大滾,跟以利一樣,原來神在他失敗中,偶像跟仇敵也被他傷過。
1802.995	1804.456	也被他審判了。
1804.456	1811.802	這是一個審判的記號,倒在門檻上,頭折斷,手斷掉了。
1811.802	1821.329	而且各位弟兄姊妹,我們注意到一點,在整個這個過程中間,耶和華在敗中竟然還審判了仇敵。
1821.329	1838.406	他不假手於任何一個人,不是經過撒摩爾,不是經過他們裡面其中一個長老,不是經過他們中間的敬虔人, 而是神完全獨立完成。
1838.406	1848.172	在聖經裡面,我們一而再再而三看見,神不跟別人分享祂的榮耀,只有在一個情形上面,祂跟人分享榮耀。
1848.172	1854.317	就是有一天,我們在復活中與基督相遇,那時候我們跟祂的榮耀有份。
1855.606	1860.810	其他你沒有看見,都是神祂獨立完成的。
1860.810	1864.852	各位兄姊妹,這個對我們來講是一個好消息,是一個安慰的消息。
1864.852	1866.013	為什麼呢?
1866.013	1874.239	今天我們在教會裡面做很多步道,傳福音,關懷社區的工作。
1874.239	1891.058	有的時候我們覺得很順利,有的時候我們會患上困難跟挫折,有的時候我們傳這個福音,像我跟我父母傳福音, 我為我媽媽爸爸禱告十五年,我媽媽才開始信主,我爸爸到現在還不肯。
1891.058	1892.738	你怎麼看這個呢?
