start	end	text
1892.738	1904.422	假如你不認識榮耀是完全歸於神,神獨立完成,祂不跟別人分享榮耀的話,我們很可能把這個攬在我身上。
1904.422	1908.064	我做一個傳道人,我爸爸還不信主,我會不會羞愧?
1908.064	1909.384	會不會是我的責任?
1909.384	1911.865	各位弟兄姊妹,這個是我們砍而起的嗎?
1912.674	1922.539	不是,我們就好像哥林多前述第三章保羅所說的,保羅栽種了,亞波羅澆灌了,可是叫人生長的是上帝。
1922.539	1935.365	所以各位弟兄姊妹繼續努力去關懷社區,繼續努力去傳福音,可是我們中間可以有很大的自由跟很大的喜樂,因為榮耀單單歸於上帝。
1935.365	1942.248	所以不是我的努力,不是我的技巧,乃是神的恩典在信主的身上彰顯。
1943.166	1950.827	我的責任就是把合適他們來到主面前的條件帶到他們中間。
1950.827	1953.608	如此服事,我們就沒有壓力。
1953.608	1955.548	如此服事,我們就有欣賞。
1955.548	1959.249	如此服事,我們就會有喜樂。
1959.249	1975.882	神在祂似乎看為是失敗的光景中,審判了以利的家族,審判了聖徒中間的罪, 也審判了偶像跟敵人。
1975.882	1982.208	各位,這個不是提醒我們在新約也是一樣嗎?
1982.208	1990.916	耶穌基督來到我們中間的時候,是卑微的人子。
1990.916	1993.699	祂選了十二個門徒,其中竟然有一個是叛徒。
1997.619	2006.244	我想那時候一定有人心裡面這樣想的,假如沒有講出一定想的,你不是說你是全能上帝的兒子嗎?
2006.244	2019.432	你怎麼在你的最清淨的學上中間選了個敗類,到最後自死在他的計謀裡面,你如何說你是全能的主?
2019.432	2029.226	這個就是《使徒行傳》第一章彼得站起來, 他把眾人的心再拉回去神的話語裡面說,不是很早就有預言嗎?
2029.226	2033.629	在旧約裡面已經有預言了,關於猶大。
2033.629	2042.055	原來今天,我們有時候看見在報章上,在新聞裡面看見,美國很多教會領袖的失敗。
2045.811	2070.533	再退一步,我們也可以看,今天臺灣社會,你打開報紙,打開網路看,政治的光景,社會道德的光景,似乎是排山倒海,一個浪潮一個浪潮來,我們這些好像站在那邊,死命頂著那個浪,一個個衝過來,能夠站穩位置,希望對社會產生影響。
2070.533	2081.990	在美國的基督徒也是一樣, 我們就覺得很多時候在這個社會文化價值觀的洪流中,我們能夠站得穩已經不錯了。
2081.990	2092.152	就好像我們去海邊那個大浪,你站在那邊,你覺得整個人都要飄起來,浪衝過來也不其然,不其然就會動來動去,想辦法站穩。
2092.152	2099.534	我們光是看環境,我們就覺得這些力量,這些影響,這些勢力好像是頂不住的。
2099.534	2112.367	可是在聖經裡面,神一再 一而再再而三提醒我們,往往在我們覺得神失敗的時候,很可能就是神在祂子民身上得勝的時候。
2112.367	2134.637	所以當我們一夫一妻,一男一女,一生一世,來想辦法站穩這個婚姻的立場,我們一定會被攻擊,我們一定會被誤解,我們一定會被誣蔑,我們一定會被扭曲, 各位弟兄姊妹不要灰心,站穩。
2134.637	2144.061	因為神在歷史上一而再再而上佔領,在人看起來是失敗,可是卻是神得勝的時候。
2144.061	2171.443	我們的主耶穌基督就在人看為最失敗的情況裡面,祂是施工的失敗,祂選人的失敗,卻因為祂的失敗,神在祂的失敗在十加上審判了 人罪的問題,就為我們開了一條又信又活的路,他反而成為最終得勝榮耀的主。
2171.443	2184.930	各位弟兄姊妹,我們所信靠的,所跟隨的這位基督,這位全能的上帝,是在敗中仍然能夠得勝的主。
2184.930	2204.394	因此我們今天,無論我們面對的什麼困難, 社區裡面的情形,政治的情形,社會整個風氣的情形,我們仍然能夠堅定跟隨它,因為我們知道它掌權,它知道它在做什麼。
2204.394	2212.078	它常常在人看為失敗的光景裡面,去彰顯它的大能。
2212.078	2217.521	所以今天,因為這種禁聞,我們有三個問題,我們自己可以反省。
2217.521	2224.832	第一, 你跟我在我們的生活中有沒有哪些方面使得上帝的榮耀被攔阻?
2224.832	2230.057	這是我們個人的罪,我們需要在神面前承認、悔改的。
2230.057	2240.285	第二,我們會不會像以色列的長老一樣,想要把月桂抬出來,就以為我們可以勝過?
2240.285	2254.044	在我們今天生活的應用裡面,我們沒有月桂了,可是我們很多時候是利用神, 用神來達成我想要達的目標。
2254.044	2265.827	這個其實隱隱就指向今天,很多時候我們有成功神學的傾向,以為我們對神怎麼樣怎麼樣,我們就一定會得什麼樣什麼樣的回報。
2265.827	2275.390	每個人都要福,可是有時候,釋迦的福是超乎我們想像的管道進來的。
2275.390	2295.805	所以當我們來到神面前的時候, 我們是否尊祂為主而把我們自己的主權放在祂的面前,讓祂有充分的自由在我的生命,在我的家庭,在我的小組,在我的教會,在我的社區做祂要做的。
2295.805	2326.825	第三,你跟我的人生裡面有沒有一些地方,一些經驗,一些過去你覺得是一場失敗, 可今天因為這個經文,我們也許看見一點點的曙光,那個失敗很可能善用來把你追求祂、尊祂為大的攬主排除在你生命以外。
2326.825	2327.946	雖敗猶勝。
2330.077	2343.020	神當年在以色列人這個戰敗的經驗裡面,審判了祂子民中間的罪,也勝過了仇敵跟偶像。
2343.020	2367.378	今天,神在我們身上藉著基督雖敗猶勝,很可能可以在我們生命裡面打倒一切的偶像,把我們的心重新奪回,歸於基督,愛祂, 作為求祂,以祂為我們的主,我們一同低頭禱告。
2367.378	2378.742	主,我們在祢面前致信,願這三個問題在我們腦中不容易被抹去。
2378.742	2385.444	我的生命裡面是否有隱藏的罪攔阻祢的榮耀?
2385.444	2407.417	我有沒有有任何地方用祢的名, 表面看起來是敬虔,卻是自我中心,以為如此這樣做,我就可以在你手上得什麼,卻忘了誰是主,誰是僕。
2407.417	2433.200	我們也求聖靈光照,看我們的生命裡面是否有一些看為是失敗的事情,是傷痛的事情,卻是可以因基督的緣故, 成為打敗我們生命裡面偶像,使得我們的心能夠更追尋、更渴慕基督。
2433.200	2444.348	主上靈,求祢在我們心中動工,不要讓我們聽聽就過去,讓祢的話語深深地進到我們生命裡面,改變我們這個人。
2444.348	2447.790	祢配得,願一切榮耀歸給祢。
2447.790	2449.712	奉耶穌基督名祷告,阿們。