start	end	text
2085.538	2110.574	如果世界上有一種鏡子,世界上有一面鏡子,這個鏡子有一種功能,就是所有人到這個鏡子的面前的時候,他所有內心的醜陋,內心的憂愁,內心的傷害,內心的恐懼,內心的憤怒,內心的汙穢,都會在這個鏡子上一覽無遺。姊姊,如果有這種鏡子,請問你這個沒有犯罪的人,你敢去照嗎?
2113.899	2131.945	姐姐想了很久說,我不敢去。因為我知道我的內心其實是怎麼樣。弟兄姊妹,我們在這位公正、公平、公義的神的面前,祂就像一個鏡子,會把我們生命的真相照出來。
2133.439	2161.321	所以這位公正公義的神,這位神的義,對我們這些奴隸來講,對我們這些生命中不完全有殘缺的,甚至裡面充滿了很多見不得人的一些想法的,不想被人家知道的一些想法的人,神的義,神的義如果顯明出來,就代表怎麼樣?我們被鏡子照到了。所以我們沒有人想要讓神的義彰顯出來,因為一彰顯的時候,就代表我原形畢露,
2161.715	2187.743	就代表我難逃神的審判了。那神的義還有第二個意思,什麼意思?就是神的義,是神是一個有情有義的神。因為我們都相信神很愛我們,神不忍心我們這些人沉淪,神不忍心我們這些人沒在活。因此神是一個有情有義的人,聖經說祂不願意一人沉淪,祂願萬人都得救。
2189.599	2212.61	那問題就來了,神又是一個公正公義的神。神又是一個有情有義的人,說不要死,不要死,不要死。那神怎麼辦?好像神現在很慘,不知道該怎麼辦?對,又要公正嚴明,神的義公正嚴明,又要對我們有情有義。
2214.326	2238.443	所以神的意怎麼樣?讓人看不懂是怎麼一回事。17節講得真好,因為神的意如今在這個福音上面就彰顯出來了。神的意如何透過這個福音彰顯出來?這個意是本於信,以至於信。17節講到現在你一定還聽不懂。我們來讀3章22節你就懂。
2244.889	2257.274	三章二十二節,我們翻到一起來讀。再讀一次。有沒有注意到有三個字,第一個是神的義,有沒有?
2272.415	2296.377	第二個是因信耶穌基督有沒有。第三個是加給一切相信的人並沒有分別有沒有。信、義、信、信有沒有。我們回來看1章17節。17節說因為神的義在這福音上顯明出來。這義是本於信以至於信。
2297.483	2300.626	這跟3章22節一樣。3章22節講到神的義。
2303.49	2329.082	一個不義的人,一個被神打出原形的人,他在這位公正嚴明公義的神的面前,他就是不義的人。他不義,他沒有義。他在神的面前,他是一個不好的,是一個殘缺的生命,是一個敗壞的生命。而如今呢,神因為他是有情有義的神,他要救一個這樣可憐的奴隸,他就用一個方法,就是神把他自己的義,
2330.401	2358.681	送給這個不義的人。所以山地在這一章十七寫說,所以神的義正在這個福音上顯明出來。怎麼顯明?這個義是從信耶穌基督的福音開始,以至於怎麼樣?就加給一切相信的人。這邊中文文會讓我們比較困惑,其實它的希臘文都是差不多的,
2359.531	2386.863	它希臘文原文是因為神的義正在其中顯明出來是從信到信From faith to faith從我們相信耶穌基督的福音開始這個義就加給一切怎麼樣一切信的人這是一個福音 什麼福音
2388.507	2413.659	你只要願意相信, 耶穌基督已經用祂的生命,為你付了所有的債。你有沒有欠過債?人情債有沒有?感情債有沒有?我看很多姊妹都點頭,你們也是少男殺手。我們生命中欠了很多的債,良心債,有沒有?
2415.06	2444.353	這些債,耶穌基督都已經用祂的命替我們還了這個債。因為耶穌基督已經替我們還了這個債。我們身上的鐵鍊跟腳鐐就都掉了。我們就被釋放了。我們在神的眼中是一個債務已經清償的人。這就是神把祂的義,透過我們相信耶穌基督已經幫我們還債了。透過相信耶穌基督已經赦免我們了。
2445.811	2472.633	我們罪在清掉了。我們不再是一個不義的人了。我們生命可以重新開始了。這個神的義,因著我們相信耶穌基督的福音的大能,這個義就加給了我們這一切相信的人,從信到信。弟兄姊妹,我們請敬拜團上來。燈光幫我調整一下。
2490.879	2520.505	1章16節17節,我們再讀一次。預備,來。我不以福音為詞。這福音本是神的大能,要救一切相信的,先是猶太人,後是希臘人。因為神的義,正在這福音上顯明出來。這義是本於信,以至於信,如經上所記,義人必因信得生。
2523.712	2552.755	我們一起低頭來禱告。主,我們從來沒有想過,禰面對我們這些不義的人,面對我們這些在奴隸市場,絕望,面對我們這些在奴隸市場,沒在活的人,禰是如此的愛我們,
2554.292	2583.791	禰本是一位公義的神。我們在禰面前,是這樣的不配。我們甚至在禰面前,很多時候也不敢有盼望。但是神禰又是一位有情有義的神。禰憐憫我們,禰想要拯救我們。
2589.019	2617.451	因此你拆拍了你自己的獨生愛子,耶穌基督,來到這個世界上,尋找我這個奴隸,尋找我這個生命中曾經沒在活的人。你為我這個人,付上了生命的代價,一命換一命,用你的復活,換我的沒在活。
2618.524	2643.844	用禰的聖節,換我的汙穢。用禰的盼望,換我的絕望。用禰的得勝,換我們的失敗。用禰的榮耀,換我們生命中種種的控告。禰用的方法實在奇妙。禰讓禰的義,
2644.872	2672.667	用第三種方式在這個偉大的福音上向我們顯明你竟然把你自己的義賞賜給我們這些不義的人因為你用你的兒子耶穌基督代替我這個人成為不義而讓我承受了耶穌基督的義主這個福音實在奇妙
2674.121	2701.452	這個福音實在是偉大的。謝謝主。我們都願意做禰的使者。我們都承認,我們與禰第一次的相遇,是在奴隸市場上。是禰用重價,就是禰自己的生命,把我買贖回來的。以至於我永遠都要說,我是耶穌基督的奴隸。
2703.49	2732.105	禰是好主人,禰並沒有虧待我們,禰反而呼召我們出來,做禰的使者,做禰的代表。禰把我們的口袋,把我們的生命,塞滿了禰的福音,叫我們去傳揚給那些需要福音的人。我們的生命不再一樣,從此我們是一個有使命的人生,傳揚大能福音的人生,
2733.08	2749.088	我們手所做的﹐口所說的﹐我們生命所擺上的﹐都是願萬人得救。都是願更多的人﹐也被你的福音親自來釋放。我們感謝讚美你。奉主耶穌