start	end	text
1926.773	1943.239	這位榮耀的神竟然願意自己屈身在這一個小小的地方垂聽每一個被聖靈感動願意為了自己願意為了他整個國家的罪回到神的面前來屈膝禱告。
1943.239	1958.270	神在那個地方聽禱告然後透過那些悔改的禱告使用這些禱告者讓他成為黑暗中的光 讓其他百姓看見,光還在。
1958.270	1961.592	神的榮耀同在,還願意在。
1961.592	1967.115	大家趕快回轉歸向神。
1967.115	1968.956	這就是神的偉大。
1968.956	1978.702	神的偉大不在於祂很有力,可以打人,可以把仇敵,可以把其他國家民族踩在腳底下,證明我很愛你大衛。
1978.702	1983.024	為什麼神不讓大衛開聖殿呢?
1983.024	1983.745	很多原因啊。
1984.428	1985.989	他一直在打仗,很忙。
1985.989	1988.670	第二個,他殺了很多人,留了很多血打仗。
1988.670	1994.673	殺了很多人,留了很多血,就不能蓋聖殿,到底是什麼意思?
1994.673	1996.714	我的理解是什麼?
1996.714	2008.199	我的理解是,如果神讓大衛蓋聖殿,那對於外邦人來講,你蓋聖殿很簡單,因為你的神幫助你,功無不克,戰無不勝。
2008.199	2011.100	所以你蓋一個殿,怎麼樣來紀念你的神很厲害。
2011.100	2012.281	那跟我們其實是一樣。
2015.265	2033.042	今天這個時代所需要的信息,不是哪一個政黨上台,不是哪一個政黨下台,不是哪一個候選人當選或落選。
2033.042	2123.508	請容我這麼說,今天這個時代所需要的信息,它甚至也不是公投的結果會怎麼樣, 就算是你們心中所期待的或是我們心中所期待的公投過關了可是廣大的百姓心中仍然看不到盼望廣大的百姓心中仍然看不到所謂的基督徒他的婚姻家庭有令人驚訝令人羨慕的溫暖愛聖節與公義我請問你公投過了又怎麼樣呢 我不是說公投不要過拜託不要出去亂講害我被罵死你們知道我講什麼嗎你們知道我講什麼投票當然要去投啊要善盡我們公民的責任以基督徒的聖經給我們的價值標準去投票不論是選選贏還是公投你們都知道我在講什麼但這個時代需要的信息是什麼這個時代需要的信息都不是那一些這個時代需要的信息在你我的身上 如果連那個命在旦夕的所羅門,連那個被眾人所藐視,不管他死活的妓女,神都在意他們,而讓他們成為彰顯神公義信實良善智慧救贖的器皿。
2123.508	2133.770	何況你跟我呢?
2133.770	2136.410	今天這個時代需要的信息在你我的身上。
2137.995	2161.261	你我這些本來是犯罪該死的罪人,如何因為神祂的慈愛,耶穌基督十字架救恩的大能,聖靈每一天在我們裡面的感動跟鼓勵,讓我們每一天回轉歸向神,在主的面前,用實際的生命、生活、言語、行動作為見證。
2161.261	2168.559	耶穌基督已經從死裡復活了,戰勝了罪惡、死亡、魔鬼, 在我身上掌權。
2168.559	2171.500	祂改變我這樣的人。
2171.500	2173.140	祂引導我這樣的人。
2173.140	2174.701	祂教導我這樣的人。
2174.701	2179.281	在這個世界上,行出容神一人的生活。
2179.281	2182.642	信息在你我的身上。
2182.642	2196.145	如同那個信息,如同那個帶來以色列的所羅門王朝,歷史最高峰的信息的第一個起點,竟然是妓女要申冤。
2200.964	2211.652	我們生命中有太多這種不起眼的人,他們的小故事,向我們傳達了神對這個時代所要說的信息。
2211.652	2220.718	當我們羨慕約翰·魏斯里,帶來了整個英國地區的大復興,大覺醒。
2220.718	2226.142	魏斯里他整個人還沒有翻過來之前,他已經當牧師一陣子。
2226.142	2232.586	他有一次受邀坐船到美國去, 要向美國那邊的人傳福音。
2232.586	2239.929	他自己覺得自己都預備好了,自己的生命,自己的各種的見識都夠了。
2239.929	2245.452	結果在英國坐船到美國的途中,遇到狂風暴雨。
2245.452	2257.619	約翰·威斯理嚇到雙腳發抖,竟然看見有一群弟兄姊妹們在那邊唱詩歌,完全沒有懼怕。
2259.087	2264.069	他這個牧師就很好奇去問那幾個弟兄姊妹說,為什麼你們不會怕呢?
2264.069	2270.152	那幾個人也不知道約翰·衛斯里是牧師。
2270.152	2283.118	那幾個人就很客氣的也很平和的問約翰·衛斯里牧師一句話說,你相信主耶穌基督嗎?
2283.118	2285.780	他們不知道約翰·衛斯里是一個牧師。
2285.780	2288.461	這句話大大的震撼了約翰·衛斯里。
2290.213	2297.219	是透過那些毫不起眼沒有任何頭銜的摩拉維亞弟兄們。
2297.219	2309.549	我們生命中有太多神透過看起來不起眼的人看起來不怎麼樣的人在向我們傳遞這個時代所需要的信息。
2309.549	2336.307	這個信息就是神在祂的身上在祂這樣的不配軟弱的人身上施行救恩帶來轉變給我們看見盼望 剛剛我們為雲林大皮教會的禱告,牧師是韓國人,名字有夠好,黃金滿。
2336.307	2348.154	不得了,他爸爸當初幫他取這個名字不知道是什麼用意,黃金滿。
2348.154	2359.050	這個黃金滿, 在他們韓國裏面,受神大大感動,效法其他的前輩們成為宣教士。
2359.050	2363.453	我們都知道韓國差別到世界各地宣教士很多,對不對?
2363.453	2369.837	他也羨慕那些可歌可泣的故事,帶領很多人信主。
2369.837	2374.720	結果他被派到臺灣來,他到了雲林大皮。
2374.720	2386.809	雲林大皮,我們要紀念我們當中有一位雲林縣的好人好事代表, 羅牧師的。
2386.809	2390.572	雲林大痞是酸菜的故鄉。
2390.572	2397.898	以後我們吃牛肉麵,吃酸菜的時候,請記得這位,不是韓國泡菜,臺灣酸菜。
2397.898	2404.603	韓國泡菜牧師到了臺灣酸菜的故鄉,建立這個大痞教會。
2404.603	2408.106	拜託,所以以後請每一次吃酸菜的時候,紀念這個教會。
2409.684	2471.280	我們今天在上回我拜託各位到後面招待桌有我們為這些臺灣接棒行走禱告過程中所接觸的教會為他們製作的明信片請帶回去填寫為他們祝福鼓勵的話下週帶回來投入奉獻箱我們要親自拿給他們阿門因為這時代所需要的信息也在你們身上等著透過我們對大皮的人說話對花壇的人說話對新港的人說話阿門 我第一次遇到黃牧師,他跟我分享他的見證,大大感動我這一個那時候因為在走臺灣街棒,基督教媒體不斷在報導我的行程,看起來比他有名一百倍的莊育民,但神透過他對我宣講一個這時代所需要的信息,再一次感動我。
2472.022	2528.393	繼續回到主的面前做神要給我的這個時代信息的傳揚者黃牧師跟我說他剛來那幾年很痛苦因為鄉民沒有人要理他過了很多年沒有半個人要信耶穌 然後他天天聽見他那些其他同工在非洲啊在哪裡啊隨便傳福音一票人信主去非洲隨便傳一百人兩百人三百人信主他在大批做什麼一個人都沒有他有一天受不了了他就跟神說主啊請你不要浪費我的生命好嗎你可以調我離開這個什麼臺灣酸菜我是韓國泡菜水土不服 讓我去非洲吧!
2528.393	2531.836	讓我去哪裡吧!
2531.836	2533.157	他就一直禱告,神都不理他。
2533.157	2538.300	他為了這個事情,禱告了好多天好多天好多天,終於有一天,神終於回答他了。
2538.300	2547.207	他說,黃金滿,你從來只在意怎麼為我活,你從來不在意怎麼為我死。
2547.207	2556.799	你從來只在意怎麼樣 可以為我活得很精彩只為票價。
2556.799	2561.383	你卻從來不在意也不去求問我要你怎麼死。
2561.383	2565.166	我要你怎麼樣埋在這個地方。
2565.166	2566.967	看起來好像是死的。
2566.967	2570.770	看起來好像是毫不起眼的浮世。
2570.770	2581.338	但是卻可以透過這樣的浮世讓人看見神愛臺灣。
2581.338	2588.618	從那天開始 黃金滿目石灘的禱告,臺詞完全改變。
2588.618	2603.205	他一起來禱告說,主啊,拆派我往遠處去,從耶路撒冷,猶太全地,薩瑪利亞,直到地極,能離開臺灣有多遠,就離開有多遠,拆派我去吧。
2603.205	2628.136	從那天之後,他禱告說,主啊,讓臺灣的復興,從大皮, 到雲林,到臺灣中部,到全臺灣,透過我,學習如何死在這裡。
2628.136	2639.042	親愛的弟兄姊妹,這個時代所需要的信息,正在你我的身上,正在你我這些不起眼的人身上。
2639.042	2656.658	如果當比我們更優秀, 更有條件的人發現,神的榮耀,神的憐憫,神的同在,在你我這些不怎麼樣的人身上的時候,弟兄姊妹,會吸引和鼓勵更多的人來尋找這個盼望。
2656.658	2671.626	所羅門剛上臺的時候,他從來沒有想過,因為他一個人,從他一個人開始,最後竟然真的可以把全國都帶入敬畏神的行列。
2672.910	2674.851	讓神翻轉每一個人。
2674.851	2678.954	甚至影響周邊的國家都來尋求神。
2678.954	2685.078	弟兄姊妹我從來不認為神放棄臺灣。
2685.078	2690.281	我從來不認為臺灣的前途是悲哀的。
2690.281	2691.922	很可能是因為我在淡水。
2699.497	2711.300	很可能是因為神呼召我到這個臺灣北部的福音登陸地,臺灣北部的福音發源地淡水,建立教會。
2711.300	2725.923	祂總是有一個莫名的支持的力量使我相信,信息在你我的身上,神眷顧臺灣,神愛臺灣,神要復興臺灣。
2725.923	2726.563	我們一起來禱告。
2733.319	2782.435	至高至大的神,我們敬拜祢,祢這位創造天地宇宙萬物的主宰,賞賜人生命氣息的上帝,竟然願意屈身在教會裡面垂聽每一個願意回轉到祢面前來的人的禱告,並且應許我們,因此我們當中只要有一個人,只要有一個人, 為祂自己,為祂的家庭,為祂的教會,為祂的公司,祂的學校,為祂的國家,在主的面前回轉禱告,生命被主更新。
2782.435	2798.253	神要因為這樣一個義人的禱告,讓上帝給時代的信息,就透過這個義人,在祂實際的生命 生活裡面彰顯出上帝的榮耀。
2798.253	2800.575	謝謝主。
2800.575	2803.297	臺灣需要這樣一個信息。
2803.297	2809.361	而這個信息,就在我們在座的每一位弟兄姊妹的生命裡面。
2809.361	2812.204	主啊,讓我們今天都回轉歸向祢。
2812.204	2819.269	讓我們帶著這個,帶來改變和復興的盼望。
2819.269	2822.491	從教會回到我們生命的崗位上。
2823.831	2835.913	回到我們所在的環境裡面,帶我們一件事情一件事情的去調整,一件事情一件事情的去為神做見證。
2835.913	2851.677	謝謝主,帶領我們到淡水來建立教會,帶領我們產生一種使命感,不僅對淡水的居民有一個責任,甚至對臺灣的復興也有一個責任。
2851.677	2856.879	謝謝主,願將祢的信息 深深的放在我們生命的裡面。
2856.879	2859.841	永遠不要離開我們。
2859.841	2861.282	謝謝主。
2861.282	2863.164	奉主耶穌的名祷告。
2863.164	2863.584	阿們。
2863.584	2866.567	我們一起來撥餅。
2866.567	2875.774	我們請餅杯同工到前面來。
2875.774	2877.716	對不起,有時候牧師講到比較激動。
2877.716	2881.098	所以有時候比較大聲,希望不要嚇到你。
2881.098	2881.979	感謝主。
2882.944	2890.228	其實很多人說,聽你講到不會睡著,不是因為講得好,是因為比較吵。
2890.228	2899.473	老臟。
2899.473	2903.955	主耶穌要被賣的那個晚上,跟祂的門徒吃最後的晚餐。
2903.955	2921.654	我真的不知道主耶穌哪來的信心,敢把接下來祂的國度交給這些學生, 我感謝主,主有這樣的信心。
2921.654	2927.919	所以我相信今天主對我們在祂桌子面前的這些門徒們,也有一樣的信心。
2927.919	2928.360	阿們。
2928.360	2929.741	感謝燦美神。
2929.741	2937.167	在最後晚餐的時候,主耶穌拿起桌上的餅來說,這是我的身體,為你們被剝開。
2937.167	2953.982	代表主原本是一個完整的生命,但卻為了我們這些破碎的人,為了我們這些破碎人的家, 破碎人的學校、教會,甚至為我們破碎的國家而被剝開。
2953.982	2964.132	祂用祂的完整交換我們的破碎,使我們因為祂的破碎而能夠再一次進到完整裡面,進到完滿裡面。
2964.132	2965.414	感謝上帝。
2965.414	2969.618	耶穌說你們每逢吃這個餅的時候,要紀念我。
3005.367	3013.369	主耶穌也拿起桌上的杯說,這是我與你們立約的血,你們每逢喝它的時候,要紀念我。
3013.369	3019.231	並且主特別還說,從此之後,我不跟你們喝新的杯。
3019.231	3022.832	我已經講過逾越節晚餐好幾次了。
3022.832	3024.392	現在喝的是第幾杯?
3024.392	3025.553	第三杯。
3025.553	3028.073	總共要喝四杯,逾越節晚餐。
3028.073	3031.975	喝完第四杯,逾越節晚餐才算結束。
3031.975	3036.372	紀念逾越節, 救贖的晚會才結束。
3036.372	3038.392	耶穌說第四杯我不跟你們喝。
3038.392	3041.513	因為我要去上十字架。
3041.513	3043.714	除非我上了十字架。
3043.714	3047.755	救贖的大功才會完成。
3047.755	3051.696	而需要透過你們向所有的人傳揚這個福音。
3051.696	3054.317	等到有一天你們努力去傳福音。
3054.317	3055.418	我再來的時候。
3055.418	3057.118	你們福音傳好了。
3057.118	3057.598	我會再來。
3057.598	3060.279	我們在一起喝第四杯。
3060.279	3062.980	真的來慶祝救贖人類的工作。
3063.814	3065.635	完成了。
3065.635	3067.356	好偉大的交代。
3067.356	3072.519	弟兄姊妹來教會不要只是自己救自己就好了。
3072.519	3074.940	來教會我們是主的門徒。
3074.940	3079.502	因為這個時代所需要的信息在你我的身上。
3079.502	3084.525	當紀念主沒有跟我們喝第四杯,直到祂再來的日子。
3084.525	3087.467	等候我們去傳揚這個信息。
3087.467	3087.667	阿們。
3098.558	3120.785	以及用這首詩歌來回應我們的神,回應祂榮耀的護照。
3120.785	3134.377	將自己獻上當作火雞, 做出聖結歸宗的情。
3134.377	3141.102	你豐富能迴避重駐教官我。
3141.102	3148.107	使我挖起雷,充滿我的能力。
3148.107	3152.350	將自己寫上當作活跡。
3154.735	3160.836	做主神﹐皆歸宗敵情。
3160.836	3163.457	逼奉夫人﹐迴避。
3163.457	3172.758	從主教觀光﹐使我化氣﹐充滿莫瑟能量。
3172.758	3181.860	我要將自己獻上﹐將自己獻上當作火炬。
3181.860	3192.161	做主神﹐ 繁體中文，臺灣國語。
3209.531	3216.856	全心全忍都給你耶穌。
3216.856	3224.722	一生一過出榮耀的枯草。
3224.722	3230.025	勇敢地向著高竿直跑。
3230.025	3234.769	高舉雙手,讚美你我主。
3236.988	3265.431	弟兄姊妹,什麼是這個時代所需要的信息,就在你的手中。
3266.459	3271.981	你的手中是耶穌基督為你被犧牲的身體。
3271.981	3278.604	是耶穌基督為你我這個罪人所流出的救贖保險。
3278.604	3284.607	在你我手中所拿著的,就是這個時代最需要的信息。
3284.607	3298.085	如果耶穌基督可以改變、拯救、醫治、更新、恢復我們這樣的人, 就可以成為其他人他們心中的盼望。
3298.085	3300.826	因為連我們這樣的人都可以被改變。
3300.826	3302.506	那他們也會有希望。
3302.506	3304.147	弟兄姊妹。
3304.147	3307.748	我們一起來到主的桌子前。
3307.748	3312.729	再一次知道主看重我們。
3312.729	3316.770	祂把這救人的福音托付給我們。
3316.770	3319.790	盼望我們知道這一份恩昭的寶貴。
3319.790	3321.751	這一份呼昭的重要性。
3322.739	3344.563	我相信當我們越發去感受到主對我這樣的人竟然願意這樣呼召我來向這個世界傳揚這個時代所需要的最最重要的信息的時候你就不再會小看自己或是讓自己隨隨便便過生活 甚至牧師也不用再一直督促你們。
3344.563	3345.643	主日要準時。
3345.643	3346.603	讀經要按時。
3346.603	3348.043	禱告要隨時。
3348.043	3349.504	奉獻要誠實。
3349.504	3352.644	其實我們如果每一個人知道自己的身份。
3352.644	3355.465	被呼召的身份是這麼的寶貴。
3355.465	3358.425	其實這些根本牧師不用再提醒。
3358.425	3362.066	因為聖靈其實每一天都在提醒我們。
3362.066	3364.267	我們生活中要有見證。
3364.267	3366.047	有錯了。
3366.047	3368.887	聖靈提醒趕快悔改。
3368.887	3371.328	有跟人不解怨的趕快去和解。
3372.278	3379.583	看到不公不義的事,神如果給你感動,就可以去用公理真義來勸勉。
3379.583	3387.308	但如果沒有這樣勸勉的機會,就放在禱告裡面,為這個世代大大來祈求。
3387.308	3395.574	讓我們在各處都能夠顯明,上帝在臺灣,上帝的救贖在臺灣。
3395.574	3436.528	我覺得我們格外的幸運,因為我們在淡水建立教會, 始終提醒我們不要只顧自己的教會人數多或少蓋的堂漂不漂亮因為我們在淡水我們永遠紀念在淡水的教會都有一個獨特性我們希望看見臺灣鬼主希望看見臺灣的百姓有更多的人透過我們的見證找到生命的價值跟意義阿們你我任重道遠你我任重道遠 因此我們更要自愛,我們更要在神的面前持受聖節。
3436.528	3447.692	我們都有軟弱會跌倒,但是聖靈天天鼓勵我們再爬起來,再爬起來,跟隨主,做主的見證,做主榮耀的見證人。
3447.692	3451.913	我們一起存在感恩的心,來領受主的餅跟主的杯。
3460.657	3479.328	親愛的主感謝祢,我們一起在祢的桌子前,恭敬、感恩、領受祢為我們被剝開的身體,為我們所留的保險。
3479.328	3486.612	當我們把這個餅、把這個杯喝進去、吃進去的時候,我們就知道信息在我們裡面了。
3487.449	3551.172	我們就是上帝給這個時代的信息蒙恩的罪人生命被改變新造的人舊事已過都變成新的人不僅被耶穌基督救贖並且要活出上帝創造我的偉大奇妙計畫並且傳揚福音 成為眾人盼望的信息等候主耶穌基督的再來親自以耶穌基督的公義聖潔智慧能力治理這地的千年國快快來到謝謝主願祢的榮耀願祢的恩惠被臺灣的百姓看見願祢的同在不離開臺灣 願祢的同在透過我們顯明給我們的同胞看見。
3551.172	3553.974	奉主耶穌基督的名祷告。
3553.974	3554.914	阿們。
3554.914	3555.875	感謝主我們請坐。