start	end	text
1.135	3.096	好,弟兄姊妹平安。
3.096	5.478	好,幫我把監聽調一下。
5.478	9.781	我們請一起來打開以西結書第十一章。
9.781	14.244	我們一起來讀第十六節到第二十五節。
14.244	16.726	有需要聖經的可以把手舉一下。
16.726	18.767	請同工把聖經給他。
18.767	26.373	以西結書第十一章的第十六節到第二十五節。
26.373	26.393	好。
28.080	34.930	我們翻到一起來讀,然後有一個同工幫我把那個颱風關掉一下,謝謝。
34.930	36.212	好,我們一起來讀神的話語。
43.029	57.601	我雖將以色列全家遠遠遷移到列國中,將他們分散在列邦內。
57.601	62.806	我還要在他們所到的列邦,站作他們的聖所。
63.166	77.438	你當說,主耶和華如此說,我必從萬民中召聚你們,從分散的列國內聚集你們,又要將以色列地賜給你們。
77.438	103.250	他們必到那裡,也必從其中除掉一切可憎可厭的物, 我要使他們有合一的心, 也要將心靈放在他們裡面,又從他們肉體中除掉食心, 賜給他們肉心,使他們順從我的律例, 謹守遵行我的典章。
103.250	120.678	他們要做我的子民, 我要做他們的神, 至於那些心中隨從可憎可厭之物的,我必照他們所行的報應在他們頭上,這是主耶和華說的。
120.678	130.103	於是基魯伯展開翅膀,輪子都在他們旁邊,在他們以上有以色列神的榮耀。
130.503	138.007	耶和華的榮耀從城中上升,停在城東的那座山上。
138.007	147.792	靈將我舉起,在異象中藉著神的靈將我帶進迦勒底地,到貝魯的人那裡。
147.792	152.174	我所見的異象就離我上升去了。
152.174	158.317	我便將耶和華所指示我的一切事,都說給貝魯的人聽。
163.456	228.352	今天跟大家分享的一個信息是這時代所需要的信息這個時代所需要的信息最近在觀察臺灣的這個選舉覺得一個非常詭異的現象就是現在基本上大家整個選舉已經只剩下一個焦點就是到底韓國瑜會當選還是不會當選根本沒有人在乎其他的事情 這是一個非常奇怪的現象但這也在表達整個臺灣社會的現況大家對於政治的期待或是對於政治的情緒完全被簡化到一個單一的人會不會當選與否它裡面表達了臺灣前面道路的迷惘表達了人心對於現況的不滿跟無奈 這個世代到底需要什麼樣的信息?
228.352	241.022	透過今天的經文,我們要來思想,這個世代的信息,乃是到底神祂同在的榮耀,會不會繼續在臺灣停留?
241.022	249.568	到底神同在的榮耀,要怎麼樣在臺灣,讓臺灣的社會可以看見?
249.568	266.320	以至於在黑暗當中的人,因為看見有光, 就算那個光只是一個螢火蟲的光,或是一個小小蠟燭的光,對於在黑暗中的人來講,就已經足夠了。
266.320	274.064	今天的信息,我們的經文讓我們看見,耶和華的榮耀要離開祂的聖殿。
274.064	291.096	聖殿從所羅門王建造奉獻給神的那一年,應該是在祖前958年, 一直到祂被毀於巴比伦人之手,足前586年,總共經歷了372年。
291.096	295.960	為什麼上帝的榮耀要離開耶路撒冷?
295.960	316.508	今天的經文也讓我們看見,當上帝祂的榮耀離開了有形有體的耶路撒冷聖殿之後,上帝卻願意讓祂的榮耀以一種無形的方式, 跟被擄到巴比倫那個地方的以色列人俘虜同在,願意暫時做他們的聖所。
316.508	329.711	剛剛我們所讀的經文第16節,它就說,在你們所被俘虜到的外邦人之地,我本人,也就是我本人,要做你們的聖所,要做你們的聖殿。
329.711	335.552	聖殿不再是看得到摸得到的建築物,而是上帝的同在。
335.552	338.273	我們待會兒會來回想,為什麼要蓋聖殿?
338.916	342.739	其實就是要讓上帝的同在回來。
342.739	345.901	讓上帝的同在回到百姓當中。
345.901	355.629	剛剛讀的17節經文也告訴我們,上帝允許祂的百姓被俘虜,目的不是要毀滅他們,目的是什麼?
355.629	356.229	管教他們。
356.229	359.592	目的是要希望他們有一定可以悔改。
359.592	365.236	悔改之後,神要把他們復興,帶回到以色列之地。
365.236	401.511	18節告訴我們,上帝要在這一段 熬煉我們的過程使我們悔改的過程當中上帝要使我們有一個新的靈跟新的心以前的靈是死掉的靈沒有辦法順服聖靈的感動去遵行神給我們的話語所以上帝要給我們一個新的靈來引導我們上帝也要給我們一個新的心以前的心很硬像石頭心 神的話我們都聽不進去,但是神要給我們一個怎麼樣?
401.511	402.491	什麼心?
402.491	406.993	肉心是柔軟的,是好像一個好的泥土。
406.993	414.455	耶穌所撒的這些天國福音的種子,可以進到我們的肉心裡面來。
414.455	426.119	23節之後告訴我們,上帝的榮耀同在,就暫時的離開了耶路撒冷的聖殿,從此離開他們。
426.119	440.763	25節讓我們看見, 這個以西捷就把他所看見的異象告訴他的同胞,他的同胞就是跟他一起被俘虜到外邦人之地的同胞。
440.763	446.904	親愛的弟兄姊妹,我們要來回想一件事情,就是當初為什麼會有聖殿?
446.904	450.665	聖殿的意義跟目的何在?
450.665	459.782	聖殿,以色列人的聖殿,跟當時在附近的百姓他們的神廟, 又有什麼不一樣?
459.782	476.928	這關乎到我們今天了解什麼叫做神的同在,也明白什麼叫神的榮耀,並且知道神的同在和榮耀要怎麼樣透過我們如何的彰顯出來,給還不認識上帝榮耀的人可以認識。
477.619	481.361	這個關乎到整個以色列的聖殿神學。
481.361	484.483	其實我們之前在講《獵王記》的時候都講過了。
484.483	488.006	但是以我多年來對各位的認識,應該已經忘記了。
488.006	496.231	所以我今天也沒有任何的懷疑的可以繼續再重講一次。
496.231	497.972	為什麼會有聖殿?
497.972	503.415	聖殿最主要的目的是要把約櫃放進去聖殿裡面。
503.415	504.376	約櫃本來在哪裡?
505.060	509.162	約貴本來放在一個帳篷裡面,叫做什麼?
509.162	510.322	會墓。
510.322	526.869	但是呢,在這個祖前一千多年的時候,以色列百姓因為悖逆上帝,所以上帝呢,對他們屢勸不聽之後,神就任憑這個外邦人來攻打他們,讓他們被管教。
526.869	527.950	可是這些人怎麼樣?
527.950	529.690	心硬得很。
529.690	533.192	他們死不悔改,所以他們就決定綁架上帝。
533.677	539.461	他們就從會幕裡面把神的聖殿扛出來,帶著去打仗。
539.461	540.842	他想說怎麼樣?
540.842	547.828	神就算不管我們,不愛我們,神也會顧祂自己的約櫃。
547.828	549.629	因為約櫃代表怎麼樣?
549.629	551.350	神的同在。
551.350	553.492	結果這個綁架神的招數有沒有用?
554.138	555.278	沒有用。
555.278	557.399	神就任憑祂的約櫃怎麼樣?
557.399	559.379	被擄走,被羞辱。
559.379	565.301	弟兄姊妹,基督徒今天要面臨的第一個功課,就是你千萬不要綁架上帝的同在。
565.301	568.602	神不會讓你輕易綁架的。
568.602	571.182	我們現在都怎麼樣綁架上帝呢?
571.182	575.803	就說,主啊,我有受洗喔。
575.803	577.864	你就一定保證我得上天堂喔。
578.677	582.460	誰叫你一時不察糊塗,就讓我。
582.460	590.526	就這樣,你自己要負責,你自己說話算話,所以我怎麼搞都是你自己看著辦吧。
590.526	593.148	那等級高一點會怎麼樣?
593.148	606.639	主啊,我不僅有壽喜,我認真有服事,我有來主日聚會,我還有奉獻,我常常做很多服事、聖功,這個很好。
607.534	620.981	但是如果生命裡面﹐很多神不斷提醒的問題﹐沒有去改變﹐仍然活在罪當中的話﹐神也不會顧念所謂你的服事﹐你的受洗﹐甚至是你的奉獻。
620.981	627.564	神連祂的約會都可以不顧﹐何況是你的這些功勞。
627.564	636.188	因為上帝最重要的一個﹐祂認為最重要的是什麼﹐就是祂跟我們的關係﹐是一個正常、健康﹐並且聖潔的關係。
637.193	640.035	長話短說,約櫃就被掳走了。
640.035	658.246	從此約櫃流落民間,一直到146年之後,所羅門把聖殿蓋好了,把約櫃放進去聖殿裡面,從此約櫃才跟聖殿或是會幕合體。
658.246	665.711	其實整個聖殿的構造,跟它要表達的神學意義,跟摩西的會幕基本上是一樣的。
666.493	682.357	只是從一個會移動的會幕,變成不會再移動的,固定的,用大石頭,跟好的木頭,以及黃金的金箔,建造起來的,不會移動的一個新的會幕,這就是聖殿。
682.357	683.597	代表什麼?
683.597	695.460	代表大衛,還有他的兒子所羅門,他們希望神的同在,能夠永遠不要離開他們,能夠在這個固定的聖殿裡面,就永遠住下來。
696.749	708.675	但是索羅門他也知道一件事情,我們就算蓋了一個固定不會動的帳篷,然後把約櫃放進來,神就會被這個固定的房子綁架嗎?
708.675	710.996	不會嘛,索羅門的腦袋也沒那麼差嘛。
710.996	713.017	索羅門是怎麼樣?
713.017	714.878	聖經裡面告訴我們怎麼樣?
714.878	723.002	依靠神最有智慧的人,可能在本教會大家之後羅牧師可以稍微跟他匹敵一下而已。
726.954	730.076	你覺得所羅門有這麼愚蠢嗎?
730.076	733.018	所羅門什麼時候開始建造聖殿?
733.018	736.300	他是在他做王第四年開始建造聖殿。
736.300	739.543	那在他做王的前三年,到底發生了什麼事?
739.543	754.573	以至於讓他有把握在他第四年開始建造聖殿,然後花了七年半的時間,在他做王第十二年的時候,把聖殿蓋好,把約櫃放進去,然後神的同在果然大大彰顯。
755.196	760.919	在那一天,我們如果結合《列王記》跟《歷代誌》,你會非常的訝異。
760.919	775.647	當所羅門帶領百姓在聖殿的銅祭壇面前獻祭的時候,神大大的彰顯祂的同在,從天上用火降下來,直接把祭壇上所有的祭物全部都燒光了。
775.647	788.200	所有百姓伏伏在地,如同當年出埃及的時候,會幕之大起來的時候, 神的榮耀充滿了會幕裡面,摩西進不去。
788.200	799.364	在所羅門獻殿那天,神的榮耀充滿了,祂的榮耀同在充滿了聖殿,所以祭司也進不去聖殿裡面,能夠來服侍神。
799.364	802.205	神的榮耀為什麼會願意回來?
802.205	806.866	不是因為大家幫祂蓋了一個好房子,祂榮幸大悅。
806.866	807.806	神沒有這麼膚淺。
807.806	822.401	神的榮耀願意回來,是因為在蓋聖殿之前的這前三年, 所羅門做王的前三年,在以色列的國家裡面,產生了一個奇妙的變化。
822.401	838.074	所羅門剛做王之前,他其實本來命在旦夕,因為他的哥哥亞多尼亞準備要篡位,他的爸爸大衛老到不行,老到連頭刀都沒辦法剝。
838.074	851.199	聖經說怎麼樣,他的臣僕們怕大衛 血氣循環不佳,特別找了一個美女來幫助他恢復青春活力,大衛根本無福消受。
851.199	864.224	聖經常常很有意思,聖經講說那個美女,她的名字的意思,但聖經沒有講她的意思,但那個美女的名字的希伯來文意思叫做,我的爸爸是個流浪漢。
864.224	865.144	代表怎麼樣?
865.144	869.986	大衛已經老到已經是在地上漂流,快要拜拜了。
872.346	875.228	大衛年老,好像不重用。
875.228	878.611	亞多尼亞這個兒子,好像要起來篡位。
878.611	883.935	而原本真正應該的繼承人,所羅門,看起來怎麼樣?
883.935	888.799	非常的危險,可能隨時都會被殺掉。
888.799	896.985	所羅門在那個時候,聖經告訴我們所羅門坐亡四十年。
896.985	905.420	所羅門死了之後,他的兒子上臺, 的時候,四十一歲。
905.420	916.869	代表羅伯安,所羅門的兒子羅伯安,他是在所羅門當王之前還是當王之後生的?
916.869	919.271	當王之前一年生的。
919.271	923.955	也就是所羅門人生最最最死因憂苦的時候。
923.955	929.920	所羅門他連自己明天可不可以活都不知道。
929.920	939.787	所羅門他覺得自己 巴不得自己不是一個王子,因為他連一個平民老百姓都不如。
939.787	952.696	所羅門雖然貴為王子,所羅門身上雖然有他的父親大衛對他的母親拔世巴所發的誓,說我一定把王位傳給你的兒子。
952.696	959.061	因為拔世巴的意思就是誓言的女兒,誓約的女兒。
959.061	960.042	代表怎麼樣?
960.042	964.284	大衛向拔世巴的發誓, 一定會奏效。
964.284	970.207	甚至連先知拿丹都見證神喜悅所羅門。
970.207	982.634	但是彷彿在所羅門這個面對他的哥哥好像要篡位的時候,爸爸說什麼都不管的時候,大家都靠攏他哥哥的時候,他覺得一切都沒有意義了。
982.634	990.298	一切神的保證,爸爸的保證,先知的保證,媽媽的保護,一切都沒有意義了。
991.203	994.205	他連一個平凡老百姓都不如。
994.205	1000.009	他在這個時候又生了一個兒子,他給他取名叫羅伯安。
1000.009	1002.771	什麼叫做羅伯安?
1002.771	1007.034	羅伯安的意思,它是有兩個字組合在一起的。
1007.034	1012.958	第一個字是人民,就是老百姓。
1012.958	1082.932	那個時候的索羅門,他非常可以體會一個基層的老百姓,無權無勢的老百姓, 找不到上帝的公義找不到上帝的拯救找不到上帝的信實找不到上帝的慈愛在這個社會裡面是非顛倒這個世界裡面比誰的拳頭大比誰的詭計狠那個人就可以橫行霸道無權無勢手無寸鐵老百姓任人宰割 因此他在那個時候所生的兒子取名羅伯安的意思第一個是人民第二個字組合起來那個字叫做使他變大就是使人民變大使卑微任人見他找不到上帝在人間找不到上帝在我們這些渺小卑微的無權無勢的人的身上我們很渺小 但希望有一天我們可以變大。
1082.932	1090.497	這個不是選舉語言,不是現在說人民萬歲,當家作主,沒有,舊約沒有這個概念。
1090.497	1098.423	所羅門在表達給他兒子取這個名字是說,如果哪一天有幸我們活下來了,我做王了。
1098.423	1111.578	兒子你要記得一件事情,如何讓上帝的公義慈愛,信實救贖,能夠落實在 民間讓人人都找得到上帝。
1111.578	1115.399	讓每一個人生命都可以經歷到神真的就是我的公義。
1115.399	1117.240	神真的就是我的救贖。
1117.240	1119.641	神真的就是我的智慧。
1119.641	1126.423	神真的就是我的慈愛。
1126.423	1129.104	《列王記》上第一章讓我們看見後來怎麼樣?
1129.104	1132.304	風雲變色。
1132.304	1134.605	上帝施行奇妙的作為。
1134.605	1136.366	最後所羅門上臺。
1136.366	1142.555	所羅門上臺的 非常出他自己的意料之外。
1142.555	1156.778	《列王記》上讓我們繼續看見,所羅門上臺之後,他就帶領他所有的臣僕,所有民間的領袖,十二支派領袖,一起去向耶和華獻祭。
1156.778	1163.680	所羅門很認真,他在外交上面,他跟埃及的法老結親,他娶了法老的女兒。
1164.582	1168.384	弟兄姊妹,我們中國以前跟匈奴和親對不對?
1168.384	1175.649	請問是比較強盛的國家嫁女兒出去,還是比較衰弱的國家嫁女兒出去?
1175.649	1183.434	所羅門娶了當時候世界上最大的帝國埃及法老的女兒,代表怎麼樣?
1183.434	1187.897	那時候埃及是衰弱的,連他都需要嫁女兒給所羅門。
1187.897	1198.573	所羅門在外交上非常的努力成功, 所羅門剛上臺的時候在內政上他急於要向全體國民宣告一件事情。
1198.573	1202.755	我要帶領你們認識耶和華,侍奉耶和華。
1202.755	1212.620	所以他上臺的時候他帶著他所有的滿朝文武,民間的領袖,各地的領袖,十二支派領袖到雞便那邊去獻祭。
1212.620	1216.021	那時候還沒有聖殿。
1216.021	1219.303	那一天晚上他做了一個夢。
1219.303	1221.004	在夢中耶和華對他說話。
1222.125	1231.612	葉法問他說,你既然花這麼大的功夫來這邊尋求我,你要我給你什麼?
1231.612	1232.453	這個是大哉問。
1232.453	1236.936	我們常常敬拜主半天,神忽然向你顯現說,你要我給你什麼?
1236.936	1240.839	我不知道。
1240.839	1250.786	如果是一個中國歷代的英明君主,漢武帝、唐太宗這些,我們大概會想說他要求的是什麼?
1250.786	1251.487	國富民強。
1252.022	1259.465	有沒有,然後版圖擴大,敵人都被他打敗,人民都很有錢,安居樂業。
1259.465	1263.046	想不到所羅門他回答上帝的是什麼?
1263.046	1265.287	人家說日有所思,怎麼樣?
1265.287	1267.028	夜有所夢。
1267.028	1278.413	所羅門就把他日有所思,他從他上臺,他這樣子忽然的從一個隨時會被殺的可憐的王子,忽然變成了國王之後。
1278.413	1300.753	他日有所思,夜有所夢,他就在夢中回答耶和華說, 請你讓我有智慧,能夠知道如何按著你的話語,你的真理,來審判,來斷案民間老百姓的司法案件。
1300.753	1331.387	從來沒有一個偉大的君王,他不求本土強盛,軍事強大,功成名就, 或是非常有財富﹐從來沒有一個偉大的君王﹐竟然他只要求﹐只能求一件事的話﹐而且是在這位說得到﹐就做得到的上帝面前﹐只能求一件事情﹐他竟然求的是做包青天的恩賜。
1331.387	1338.209	為什麼一個國王﹐他在神的面前﹐他竟然要求的是一個包青天的恩賜?
1338.209	1338.969	什麼叫包青天?
1340.486	1404.294	任何人有委屈找不到公理正義來找誰就對了包青天當受害者去找包青天當受害者的鄰舍親朋好友知道他去找包青天了包含受害者跟他的親朋好友就知道怎麼樣公義一定彰顯索羅門求的是什麼索羅門只希望一件事情 所諾門因著他自己在上臺之前那一段戚風殘雨的歲月那一段體會到當他被剝奪了所有王子的權力甚至是比一個一般老百姓還不如的這一種手無寸鐵卑微的小民叫天天不應叫地地不靈只在乎上帝的公義真理慈愛信實能力可不可以彰顯在我的身上他跟上帝說我要包清天的智慧因為我想要讓我所有的百姓 都在他們生命的各種高山低谷裡面都找得到上帝。
1404.294	1410.117	在民間各種狀況裡面都可以看見神在人間。
1410.117	1414.160	道在人間。
1414.160	1415.740	上帝高不高興?
1415.740	1418.002	超級喜悅。
1418.002	1420.223	上帝說好,這個智慧給你。
1420.223	1424.126	And你所沒有求的通通給你。
1424.126	1426.427	你們要先求神的國跟神的義。
1427.568	1431.150	其他的神怎麼樣,都要加給你們。
1431.150	1433.811	好啦,很有意思喔。
1433.811	1439.053	開始呢,上帝就開始給所羅門出考題。
1439.053	1442.075	有兩個妓女。
1442.075	1448.738	妓女是社會在那個以色列時代社會最下下下下層的人。
1448.738	1453.520	有人會去在意妓女的公義的問題嗎?
1454.428	1460.089	妓女被欺負,活該啊,罪有應得啊,去死好了。
1460.089	1463.090	沒有人會在乎的。
1463.090	1467.431	兩個妓女都生了孩子,睡在同一個床上。
1467.431	1478.434	半夜的時候,其中一個妓女翻身,把她自己的孩子壓死,就偷偷換了孩子,把自己的死孩子換在另外一個人的懷中,然後把活孩子偷抱過來。
1478.434	1486.373	天亮了,另外一個媽媽起來的時候,發現死在自己懷中的孩子不是自己的孩子, 結果兩個人就爭執,要爭這個孩子。
1486.373	1488.414	在民間,這個案子處理不來。
1488.414	1490.195	清官難斷家務事。
1490.195	1492.797	這個,從來也沒有人會去關心妓女。
1492.797	1497.721	所以從來也沒有人會去看這兩個妓女他們的孩子各自長什麼樣子。
1497.721	1502.764	誰在乎啊?
1502.764	1504.646	這個案子沒有人可以處理。
1504.646	1507.067	這個案子最後到誰的手上?
1507.067	1510.970	索羅門啊。
1510.970	1512.051	上帝給索羅門智慧。
1512.051	1516.951	索羅門說,來啊, 把這個孩子用刀怎麼樣?
1516.951	1518.572	切成兩半。
1518.572	1520.573	兩個媽媽一人一半。
1520.573	1522.254	真媽媽一聽怎麼樣?
1522.254	1525.356	王啊拜託不要殺這個孩子。
1525.356	1527.257	這個孩子給他好了。
1527.257	1529.418	壞媽媽說怎麼樣?
1529.418	1530.578	普通一半。
1530.578	1534.280	一人一半。
1534.280	1536.742	就判斷出孩子是誰的?
1536.742	1538.643	真媽媽的。
1538.643	1577.071	聖經告訴我們說這件事情大大的震撼整個 以色列因為他們發現他們的國王因為敬畏神的緣故竟然能夠使上帝的公義救贖慈愛落實在最卑賤最低微的妓女的身上如果連這樣的最卑微最低賤的妓女神都在乎 神的公義、救贖、慈愛都願意彰顯在祂身上,何況是我們呢?
1577.071	1589.521	我們如果也來渴慕,也來渴慕神,祂自己在我生命中彰顯,一定不是難事。
1589.521	1633.740	聖經接著告訴我們說,因此所羅門祂的所有的部署開始效法所羅門,每一個人都起來敬畏耶和華, 希望像他們的國王一樣可以用上帝的智慧來治理這個國家在下一章告訴我們這個國家整個翻過來了短短幾年之內整個翻過來因為這個國家從上到下每一個人都敬畏神各行各業的人都敬畏神都渴望自己在生命當中能夠怎麼樣活出上帝各種屬性的這些大能 活出上帝各種的公義、聖潔、慈愛、智慧、救贖的能力。
1633.740	1644.666	經文告訴我們,所羅門的國家裡面,內政、外交、經濟、文學、自然科學,各種東西,各種領域怎麼樣,都全然的昌盛。
1644.666	1650.149	因此在那個時候,聖經說了一句話,所羅門的智慧,超過全天下人的智慧。
1650.149	1653.411	我以前不懂的時候讀這一節,覺得有夠麻痹。
1656.288	1691.047	這節簡直是跟摩西的經文成最大的反差因為摩西人那邊說怎麼樣摩西是世上怎麼樣最謙和的人然後這邊說所羅門是世上最有智慧的人多如海邊的沙我以前都很想吐口水你知道嗎可是當我自己讀懂了這段故事之後我明白一件事情所羅門為什麼這麼有智慧不在於所羅門一個人因敬畏神而有智慧因為所羅門敬畏神而有智慧 祂影響了其他的人也都來尋求神。
1691.047	1697.911	連最低賤的妓女,她的生命中都能夠經歷到上帝是公義的。
1697.911	1701.533	上帝是有智慧解決我的問題的。
1701.533	1707.056	上帝是慈愛的。
1707.056	1730.564	當全國人民都渴望上帝的大能的同在彰顯在我的生活難題裡面, 彰顯在我的工作領域裡面,彰顯在我面對的外交,經濟,貿易,文學,自然科學,醫學,各方面的領域的時候,這個國家整個翻過來了。
1730.564	1739.709	因為這個國家的每一個人身上,不論你是士農工商,男女老少,都彰顯著神與你同在的榮耀。
1741.834	1756.683	所以聖經說所羅門的智慧超過全天下人的智慧是因為他讓他的全體國民都因為敬畏神而有神同在的智慧而有神同在的榮耀。
1756.683	1775.833	這就是為什麼所羅門時代他能夠稱霸整個地中海地區的原因這也是為什麼以色列復興的原因這也是為什麼 當所羅門他慢慢的發現神的同在已經在我們國家的百姓的各個生活層面、領域裡面已經都彰顯出來。
1775.833	1777.875	他就發現一件事情,什麼事情?
1777.875	1779.676	神的同在怎麼樣?
1779.676	1783.339	回來了。
1783.339	1785.280	神的同在回來了。
1785.280	1789.724	因為祂的榮耀在各個地方都彰顯了。
1789.724	1790.965	是時候了。
1790.965	1792.446	可以怎麼樣?
1792.446	1795.048	建聖殿。
1795.048	1796.689	可以把神的月櫃請回去了。
1798.609	1806.372	弟兄姊妹,不是因為聖殿蓋好了,與神很爽,彰顯榮耀。
1806.372	1810.093	不是的。
1810.093	1815.595	聖殿的整個最大的功能就是代表神願意與我們同在。
1815.595	1823.078	你知道聖殿它的主體建築有多大嗎?
1823.078	1824.799	比我們在座有些人的家還要小。
1824.799	1841.153	聖殿的主體建築 按照聖經告訴我們的尺寸換算,大概和臺灣人的坪數75坪到90坪,連小豪宅都算不上。
1841.153	1844.315	怎麼這麼小?
1844.315	1849.259	我們新唐都比他大。
1849.259	1849.559	為什麼?
1851.152	1859.898	因為聖殿所要彰顯的,跟整個中東地區的外邦人的神廟所要彰顯的神學,完全不一樣。
1859.898	1864.681	外邦人的神廟就盡量給它蓋得有夠誇張,有夠大,代表怎麼樣?
1864.681	1872.306	我的神很猛,所以幫助我這個王,功無不克,戰無不勝,代表君權神授的證據。
1872.306	1877.269	所以盡量神廟蓋得誇張一點,大一點,嚇死人。
1877.269	1879.331	這是外邦神廟的神學。
1879.331	1881.052	但是以色列聖殿的神學是什麼?
1882.125	1884.246	感謝神。
1884.246	1887.408	神願意與我們同在。
1887.408	1890.750	這個殿只是一個來禱告的殿。
1891.510	1896.994	創造天地萬物的主宰,他其實這麼小的地方他根本住不下。
1896.994	1900.237	就算給他蓋十倍大,也住不下。
1900.237	1904.260	因此呢,所論們在獻殿禱告的時候,非常明白一件事情。
1904.260	1918.732	這位偉大、榮耀、創造、充滿慈愛、憐憫、信實、救贖的神,竟然願意謙卑委屈自己在一個這個小小的空間,聽我們這些罪人向祂悔改的禱告。
1923.592	1925.313	這是聖殿偉大的地方。
1925.313	1926.773	偉大在哪裡?
