start	end	text
2266.715	2285.698	主啊 帶領我們。主啊 使得我們的心是開的。主啊 讓我們眼睛是開的。主啊 在我們周圍所擺的這一切。主啊 我應該如何的來生。
2285.998	2313.199	是的,我應該來打開我的心﹖我應該來關懷﹖我應該對祂們﹖主啊,這些懸弱者﹖這些失常者﹖這些在困境者﹖我如何對祂們呢﹖上帝啊,求禰打開我的心﹖讓我們自己先被關﹖讓我們看見那些身處在困境﹖身處在那個環境﹖背後那些全身的壓力﹖
2313.319	2338.602	主啊 我們這些輸給的兒女﹖我們如何站在這個地方﹖主啊 禰是把我們擺在這個環境﹖擺在社會裡面的一個支持﹖一個一分子﹖主啊 我們求禰 我不能 主啊
2338.882	2358.369	看到我們自己,不能只關心我們自己。主啊,我們求禰,主啊,讓我們有一個屬天的熱忱。今天求耶穌基督,真的展開我們屬靈的視野,讓我們的眼睛,不獨單單的看在我們自己。
2358.729	2385.96	我們的生活。我們有限的狹窄的眼光。求主提升我們。讓我們的心是向這個時代。向這個社會是打開的。以至於我們真的關愛。真的願意舉起聖結的手。為他們禱告。願意參與在他們當中。求主幫助我們。同樣的心連心手連手。一起來成就上帝美好的作為。我們這樣禱告。
2386.34	2414.792	靠耶穌基督寶貴的聖名。阿們。哈利路亞。我們再唱副歌好不好。阿新星的旅途。哈利路亞。阿新星的旅途。前山越嶺也不輕易。調轉腳步。阿新星的歲月。
2415.725	2427.797	千山萬水總是訴說。天父在看護。啊 星星的水月。
2429.019	2445.402	千山萬水總是訴說。天父在看護。上帝的恩典與我們同在阿們 大家請坐接著請我們的一左傳道來報告