start	end	text
2347.643	2350.924	但是耶穌把祂的信心分享給我了。
2350.924	2354.265	耶穌把祂的信心分享給我了。
2354.265	2358.807	弟兄姊妹今天早上,耶穌也要把祂的信心分享給你。
2359.565	2361.906	什麼是耶穌的信心呢?
2361.906	2368.287	耶穌的信心就是祂對天父的認識。
2368.287	2372.488	祂知道祂的天父是一位善良的天父。
2372.488	2376.389	祂知道祂的天父是一位有能力的天父。
2376.389	2379.870	祂知道祂的天父是一位公義的天父。
2380.384	2387.087	弟兄姊妹一切的信心來自於我們對上帝的看法。
2400.452	2404.338	一切的信心不是來自於你對環境的看法。
2404.338	2407.683	信心來自於你對上帝的看法是什麼。
2407.683	2411.248	你知道你所信靠的那位神是一位什麼樣的神。
2411.248	2414.533	弟兄姊妹你信靠的神是一位什麼樣的神呢?
2414.533	2415.995	祂決定你今天信心的大小。
2416.596	2419.098	我們開口向神禱告。
2419.098	2422.100	我們懇求主再次讓我們認識上帝。
2422.100	2424.601	認識上帝是一位怎麼樣的上帝。
2424.601	2427.103	我們同聲開口來禱告。
2427.103	2430.025	打開我的眼睛。
2430.025	2434.048	打開我對天父上帝的認識。
2434.048	2435.068	父啊!
2435.068	2435.629	親愛的父啊!
2436.049	2438.331	讓我認識祢的良善。
2438.331	2441.894	讓我相信祢對我是一位良善的父親。
2441.894	2445.157	讓我相信祢是一位公義的父親。
2445.157	2450.943	親愛的父神啊,讓我相信祢是一位滿有能力的父親。
2450.943	2460.592	親愛的父神,求祢讓我,幫助我,指教我,讓我心裡面真心的相信,祢是掌管萬有,統管一切的主。
2461.032	2463.794	親愛的父神,我要敬拜祢。
2463.794	2468.076	天屬祢,地也屬祢,全地都是祢的。
2468.076	2470.658	親愛的父神,我要敬拜祢。
2470.658	2476.502	祢是使無變為有,使無變為有,教人從死裡復活的上帝。
2476.502	2478.043	親愛的父神,我要敬拜祢。
2478.763	2482.524	你創造了一切,你救贖了一切。
2482.524	2485.005	我要相信,我屬於你。
2485.005	2487.425	親愛的父神,我要敬拜你。
2487.425	2490.566	我相信我的受造奇妙可畏。
2490.566	2495.847	親愛的父神,我不是孤兒。
2495.847	2499.988	我在天上,我在地下,我都不是孤兒。
2499.988	2502.789	你創造了我,我屬於你。
2502.789	2506.750	你讓你的兒子耶穌基督拯救我,讓我不致滅亡。
2507.090	2509.972	還成為你自己尊貴的兒女。
2509.972	2511.833	父神我要敬拜祢。
2511.833	2514.734	聖靈求祢更多的開啟我的信心。
2514.734	2517.516	開啟我對天父上帝的認識。
2517.516	2520.477	我信我所認識的這位神。
2520.477	2523.619	我信我所認識的這位神。
2523.619	2527.101	祂要成為我裡面強大的信心。
2527.101	2528.622	耶穌啊祢在十字架上。
2529.002	2537.305	耶穌啊,你在各種困難挑戰裡面,你如何細心的相信,你所信的天賦是一位怎麼樣的天賦。
2537.305	2546.129	今天恳求聖女就把耶穌的信心賞賜給我,把耶穌對上帝認識的眼光賞賜給我,就是今天。
2546.129	2554.272	現在我需要主啊,我需要你信心的眼光,我要用你信心的眼光,再次抬頭仰望我的父神。
2554.872	2590.215	抬頭仰望我的天父，我要用天父看我的眼光，來看我自己，我要用天父看我的眼光，來看周遭的人，因為我是尊貴的兒女，我不是奴仆，我不是奴仆，我是上帝尊貴的兒女，感謝讚美神，奉耶穌基督的名祷告，讓我們說阿們 敬拜祂 聖靈觸摸我的心,很高,小管我一路。
2590.215	2594.738	我的聖靈更加貼近祢,主在祢國在內。
2609.343	2617.813	親愛主聖靈,觸摸我的心,恩康,消化我靈。
2623.968	2629.672	祝我剋上祢,甘加鐵騎的命,屬在祢同在祢。
2629.672	2640.339	請愛主神,主保我的心,恩剛教官我靈。
2652.807	2667.831	主我可想祢,更加貼近祢,主在祢同在裏。
2667.831	2679.433	主我可想祢,更加貼近祢,主在祢同在裏。
2684.445	2695.254	弟兄姊妹,愿圣灵帮助你跟我都成为属灵的人,因为属灵的人可以参透万事,可以看得懂一切的事情。
2695.254	2701.780	愿圣灵今天让我们看懂这一段经文。
2701.780	2717.983	如果犹太人相信这位天父上帝竟然能够带领他们重新从被俘虏的地方回到巴比伦,回到耶路撒冷, 他們就會相信這位天父是不離不棄的神。
2719.531	2722.852	很多事情就是重新對焦就對了。
2722.852	2726.792	重新對焦是屬靈信心重新長大的秘訣。
2726.792	2733.313	重新來宣告來確認你我所信的是一位怎麼樣的上帝。
2733.313	2737.094	是一位怎麼樣的父親。
2737.094	2745.076	再一次對焦確認確信這位天父是什麼樣的上帝。
2745.076	2747.416	那一切你都能夠看透了。
2748.183	2754.107	你就真的會相信,萬國的珍寶都在天父的手中。
2754.107	2770.604	你就真的會相信,是耶和華激動了賽魯士王的心,祂才會在十七年前, 順服上帝的感動,把我們放回到耶路撒冷。
2770.604	2775.467	你就知道是上帝創始,上帝也必成終。
2775.467	2789.134	弟兄姊妹,一切的關鍵都在於,你是否是一個屬靈的人,能夠明白天父對你的心,能夠明白天父對你的眼光。
2789.134	2799.001	如果你能夠看明白這一切, 一切都不重要了,困難也不大了。
2799.001	2803.763	因為天父怎麼看你,天父說你是誰,那才是重點。
2803.763	2806.764	Hallelujah,感謝、讚美神。
2806.764	2810.185	親愛的父神,我們敬拜祢。
2810.185	2813.967	祢的兒女們在祢的寶座前敬拜祢。
2813.967	2825.248	今天早晨,恳求耶穌基督,把我們抱起來, 把我們扛起來放在耶穌基督的肩膀上。
2825.248	2843.997	好讓我們這個屬靈的小孩子能夠坐在耶穌的肩膀上使我們的眼睛跟耶穌的眼睛可以在一個水平線上面在一個同樣的高度上面 然後抬頭觀看天父。
2843.997	2845.317	耶穌啊!
2845.317	2847.558	親愛的耶穌啊!
2847.558	2850.919	求祢常常帶領我、指教我。
2850.919	2855.721	把祢所看到的天父是一位怎麼樣的天父來告訴我。
2856.988	2868.515	把祢所感受到的那位天父的心,那位天父對祢的旨意,那位天父的良善,祢是怎麼樣的看見,請祢也跟我分享。
2868.515	2876.300	主啊,祢兩千年前在登山保訓裡面,祢也是這樣教導祢的門徒。
2876.300	2879.762	今天主,我也求祢這樣教導我。
2879.762	2882.684	我要重新來認識我的天父。
2883.473	2892.717	我只要能夠重新用耶穌的眼光認識我的天父,我就能夠有跟耶穌一樣的信心了。
2892.717	2903.062	環境再也不能使我害怕,甚至我裡面自己的軟弱也不能使我害怕跌倒,因為祢的恩典大過我的失敗。
2903.865	2909.211	因為祢是用恩典的眼光看我,我讚美祢,我敬拜祢。
2909.211	2916.578	謝謝耶穌,真的,天屬於祢,地屬於祢,全地都是祢的。
2916.578	2921.163	千山的牛,萬山的羊,也都是祢的。
2921.163	2924.207	從亘古直到永遠,全都是祢的。
2925.213	2927.416	父親啊,感謝祢。
2927.416	2929.338	父神啊,我敬拜祢。
2929.338	2940.270	謝謝祢今天早上用耶穌基督的保血,再一次洗乾淨了我信心的眼睛,再一次洗乾淨了我對祢的看法,我敬拜祢。
2940.270	2950.304	謝謝聖靈早上扶持了我,使我重新站起來, 我要跟著耶穌的步伐,继续来信靠我的天父。
2950.304	2955.848	我要跟随耶穌的脚踪,来完成天父在我生命中的呼召与托付。
2955.848	2964.775	谢谢祢,我完全的要信靠祢,我要完全的相信我这位良善的父神,谢谢祢。
2964.775	2975.772	听我们同心合一的敬拜和祷告,奉主耶稣基督的名, 阿妹,我們拍掌吧,感謝歸給我們的神,Hallelujah,讚美耶穌,讚美耶穌,Hallelujah。
2975.772	2979.453	哇,感謝主。
2979.453	2985.735	欸,眼睛動一動,好,眨一眨,唉,有沒有覺得眼睛明亮很多?
2985.735	2986.435	你不相信嗎?
2986.435	2989.376	你看你隔壁的人,臉上有沒有神的榮光?
2989.376	2990.316	有嗎?
2990.316	2992.677	有齁,有沒有比較可愛?
2992.677	2993.897	有齁?
2993.897	2995.798	雪凌,你覺得你隔壁的人有沒有比較可愛一點?
2996.766	3000.176	感謝主,因為耶穌基督保血,洗盡你的眼睛,感謝主。
3000.176	3003.244	好,我們再次拍掌,感謝歸根我們的神,Hallelujah!
3003.244	3005.069	好,弟兄姊妹請坐。