start	end	text
2.637	43.294	弟兄姊妹平安，感謝主我們能夠一起來敬拜神並且享受在主裡面的恩典平安跟喜樂感謝主讓我們可以成為主裡面的家人今天我要跟各位分享的信息是不失敗的呼召成為信心的得勝者不失敗的呼召成為信心的得勝者作為一個耶穌基督的跟隨者我們是一個背負十字架的門徒 在我們服事的歲月中,基督徒我們必然需要去學習如何去面對我們事奉上以及生活上各樣的挑戰以及攻擊。
44.292	61.198	今天我要跟大家,我們要一起來從以色拉記,記載以色列人如何從他們歸回與重建聖殿的故事中,他們怎麼樣學習信靠主,並且靠著主的恩典,來打贏這場他們生命中的戰役。
61.198	65.879	開始分享前,我們先一起低頭,我們來做一個禱告。
65.879	71.181	主啊,是的,是你姦選了我們,而不是我們姦選了你。
71.181	81.400	是你將我們從艱難中, 失敗中,僵停關係的破裂中,經濟窘迫的壓力中,拯救出來。
81.400	89.788	靠著祢為我們流出來的寶血,我們一切的過去被祢潔淨了,並且使我們得著新的生命。
89.788	97.895	感謝祢指派我們來服侍祢以及祢的教會, 主啊,我們是屬於祢的,教會也是屬於祢的。
97.895	105.659	求祢打開祢的話語,使祢的教會可以因著祢的溫柔的安慰,得著提醒與兼顧。
105.659	110.322	我們跟隨祢到底,奉靠耶穌基督的名求。
110.322	116.385	阿們。
116.385	119.026	基督徒如何在挑戰中做信心的得勝者?
119.548	129.732	我們常說願上帝賜福給你,也願上帝保守我們的生活與侍奉上,可以順順利利,豐盛榮耀與成功。
129.732	135.154	我們盼望神祝福我們,特別是我們的服事。
135.154	146.379	這些我們在教會所投入的事情,我們認為應該要大大的成功榮耀主,才有好的見證,可以討主的喜悅。
146.379	166.391	我們 喜歡分享教會的成功,但是有的時候我們真的不太知道怎麼樣來面對以及探討我們在服侍在我們的生命當中所遇到的挫折,甚至是探討我們屬靈生命危急的時候,我們應該要如何的來求助。
166.391	182.384	其實如果我們只能跟我們的上帝報告成功,我們無法向我們的神分享我們的困難的時候, 其實我們所相信的上帝,並不是一位真正愛我們的父,而是一位老闆。
182.384	191.770	但是聖經卻告訴我們,壓傷的爐尾,祂不折斷,江禪的燈火,祂不吹滅。
191.770	198.454	我們天上的父神,祂實實在在,真的是一位愛我們的天父。
198.454	206.691	但是在苦難當中,甚至在挑戰當中,我們有的時候我們的信心, 會被這些的艱難給搖旱。
206.691	210.675	我們會問,主祢真的愛我們嗎?
210.675	219.362	那如果神祢真的願意憐憫我們,那我要怎麼樣才能領受到這真正的愛呢?
219.362	226.467	今天我要從兩個角度來跟各位分享,我們要怎麼樣才能成為一個信心的得勝者。
226.467	239.721	首先, 它的第一個要訣就是要一心一意專注在神的話語以及應許上,而非它有沒有可能會實現。
239.721	246.866	我們需要一心一意專注在神的話語跟應許上,而非它有沒有可能會實現。
246.866	249.569	讓我們一起來看一段經文,我們一起來讀。
249.569	255.974	經文在上面的PPT裡面,我們要從以色列記的第四章的最後一節讀到第五章的第三節。
259.104	260.185	這樣子看得到嗎?
260.185	263.747	好,那我們預備,我們一起來。
263.747	296.126	於是在耶路撒冷聖殿的工程就停止了,直停到波斯王大流士第二年,那時先知哈蓋和易多的孫子撒加利亞,奉以色列神的名向猶大和耶路撒冷猶太人說勸勉的話, 於是撒拉鐵的兒子索羅巴伯和約薩達的兒子耶穌亞都起來動手建造耶路撒冷神的殿。
296.126	299.849	有神的先知在那裡幫助他們。
299.849	312.899	當時河西的總督達乃和士他波斯乃並他們的同黨來問說,誰這樣子讓你們建造這殿、修造這牆的呢?
314.531	320.335	我們今天的故事來到大流士王的第二年,也就是祖前的520年左右。
320.335	330.743	聖經告訴我們先知哈蓋與撒加利亞起來勉勵索羅巴伯與約蘇亞,起來繼續聖殿建造的工程。
330.743	332.544	為什麼會說繼續呢?
332.544	343.733	原來在大約17年前,索羅巴伯他們早就因為波斯王、塞魯士王的命令,他們已經帶領以色列人回到耶路撒冷,並開始重新建造聖殿。
344.377	365.253	當時他們非常順利地立了聖殿的根基,但接下來,他們卻因為一些原先住在那地的人,這些人他們可能是一些原先的雅蘭人,或是居住在河東之地的人,他們被亞述或巴比倫帝國遷移到了現在,也就是以前猶太人居住的地方。
365.253	381.727	他們不願意,因為,不好意思,因為他們, 因為回歸的猶太人不願意與他們一起同工,一起來建造聖殿,於是他們就用詭計來強迫猶太人停工。
381.727	386.872	而這一停工呢,就是停了十年之久。
386.872	395.741	你可以想像,如果今天淡江教會,我們突然間宣布,弟兄姊妹,淡江教會新唐建化即刻即日暫停。
398.319	415.603	哇,我們想像,可以想像,這樣子的一個訊息,這樣子的一個困難,對整個教會,對整個群體,甚至是歸回的群體,它所造成的那樣的衝擊以及影響是多麼樣的巨大。
415.603	420.765	人們可能會開始懷疑,重新見諜是不是神的心意呢?
420.765	420.785	是!
421.732	438.723	是,因為若不是神的靈感動波斯王,又感動索羅巴伯眾人的心,他們怎麼可能願意放棄他們在巴比倫那樣穩定的生活,來到一個殘破不堪的耶路撒冷。
438.723	447.749	王,波斯王他又怎麼可能願意同意,並且提供資源來幫助以色列人,就是猶太人,他們立下根基呢?
448.916	459.663	但是,好了,如果是神的心意,那神,你為什麼任憑我們遭受到這樣的苦難?
459.663	466.987	你為什麼任憑我們遭受到這樣的打擊?
466.987	476.273	親愛的弟兄姊妹,讓我們千萬不要因為服事上的困難跟打擊,我們失去了我們對神的信心。
477.363	495.695	其實就像是一隻蝴蝶,如果牠沒有先在牠的背上打開一條又傷又深又長的口子,牠就不可能掙脫繭的保護與束縛,蛻變成為一隻真正的蝴蝶。
495.695	520.721	同樣的,許多時候,神也透過打擊、困難以及挫折來磨練我們的生命, 提醒我們,修簡我們,讓我們學會謙卑,也讓我們學習不再依靠自己,而是學會跟隨主,依靠主,並且順服主的帶領。
520.721	528.027	間諜遇到的挫折,不是因為神改變了心意,不再幫助以色列人。
528.027	551.906	同樣的,當我們的生活,家庭,工作,甚至是服事,遭遇了極大的挑戰以及打擊的時候, 我們需要先明白這一切的打擊與挑戰並不是因為你的神遠離了你 不是因為你的神不再愛你。
551.906	556.348	相反的,神祂其實一直都在。
556.348	559.449	神其實一直都在你我的身旁。
559.449	574.677	即使在那些黑暗的時刻,即使在那些孤單的時刻,即使在那個挫折的時刻,我們的神也一直與我們同在。
574.657	583.523	神 從來沒有放棄祢,神從來也沒有放棄我。
583.523	599.553	甚至到連我們自己都要放棄自己的時候,神卻沒有放棄我們,祂甚至拆派祂的使者,要來重新來兼顧你。
599.553	610.792	聖經告訴我們,就在貝魯歸回的人停下間店的工作將近十年之久後,有兩個神的仆人出現了, 他們分別是哈蓋以及撒加利亞。
610.792	625.084	這兩個先知,他們分別在上帝的感動之下,開始對索羅巴伯以及他們這些被辱歸回的人,傳講上帝的話、上帝的應許,並且鼓勵他們重新開始建造聖殿的工作。
625.725	628.306	那我們一起來讀上面的經文。
628.306	632.807	我們一起來讀哈該書的第二章,第一節到第七節。
632.807	634.648	預備,請。
634.648	657.647	七月二十一日,耶和華的話臨到先知哈該說,你要小喻猶大神長薩拉鐵的兒子索羅巴伯和約薩達的兒子大祭司約蘇亞, 並聖下的百姓說,你們中間存留的,有誰見過這殿從前的榮耀呢?
657.647	660.231	現在你們看著如何?
660.231	662.975	豈不在眼中看如無有嗎?
664.036	670.159	耶華說,索羅巴伯啊,雖然如此,你當鋼牆。
670.159	675.703	約薩達的兒子大祭司約蘇亞啊,你也當鋼牆。
675.703	682.566	這地的百姓,你們都當鋼牆做工,因為我與你們同在。
682.566	690.391	這是萬君之耶華說的,這是照著你們出埃及,我與你們立約的話。
690.691	695.836	那時我的靈住在你們中間,你們不要懼怕。
696.920	703.046	我們再把第六、第七節我們一起來讀一遍。
703.046	704.247	預備,請。
722.944	753.930	這兩節經文, 可能是我們對哈蓋書最熟悉也最喜歡跟人來分享的兩段經文了。
753.930	756.131	但是各位知道嗎?
756.131	769.835	其實在當時索羅巴伯的光景裡面哈蓋這個先知的預言是要附上極大的信心才有辦法向百姓來傳講的。
769.835	770.695	那這要怎麼說呢?
771.459	773.701	首先有兩個層面。
773.701	777.645	第一個層面是內在條件的限制。
777.645	784.772	我們不要忘記在哈該發育園的時候,聖殿重建的工程已經停了十年之久。
784.772	795.883	我們可以想像在這十年裡面,被辱歸回的人,他們可能嘗試過許多的方法想要來繼續重建聖殿的工作,但可能都失敗了。
796.852	803.634	我們會想到,我們也聽過一句俗語,老狗變不出心法戲。
803.634	812.516	如果索羅巴伯真的有能力帶領百姓建造聖殿,那為什麼他之前都做不到,現在卻可以做得到呢?
812.516	825.180	況且雖然索羅巴伯他被選派做猶大的省長,但他既沒有索羅門的超凡智慧,也沒有西西加王的雄才大力,整個河西地區也都在波斯帝國的統治之下。
826.408	847.378	波斯國王雖然採取了宗教寬容的政策,他讓猶太人回到耶路撒冷重建聖殿,但是在過去的經驗裡面,在這十年漫長的歲月當中,猶太人沒有得到波斯王真正的幫助。
847.378	853.941	他只是一個看得到、聽得到,但是卻感受不到的好聽的話而已。
857.108	874.413	那到底哈蓋書中哈蓋先知所預言的萬國的珍寶都要運來使這殿充滿了榮耀是擺在平台上嗎?
874.413	886.156	以色列人的心裡面可能充滿了極多極大的疑惑而且除了內在的限制之外還有外在的限制什麼是外在的限制呢?
887.363	914.801	因為在剛剛的經文我們讀到當時哈蓋先知所預言的時間是大流士王第二年也就是說這個新的王他其實才剛剛登基不久而且他登基之後他並沒有得到當時整個波斯帝國的支持各地的貴族部落 不願意臣服在他的統治之下,紛紛起來叛亂。
914.801	925.305	大劉氏王他為了要鞏固權力在哈蓋先知出來服侍的這一年,他其實還必須四處征討、平息、叛亂。
925.305	936.149	討伐這些反對的勢力,而且要直到隔一年,也就是大約519年才完全平定了這些叛亂的勢力。
936.149	939.870	征戰、平定、叛亂,必然需要什麼?
939.870	940.070	資金。
943.370	951.415	那如此看來,貝魯歸回的人,想要依靠波斯王的可能性,其實就變得更加的不可能了。
951.415	961.622	哈蓋先知雖然慷慨激昂,可是對這些聽的人來講,其實真的是會有芒刺在背的感受。
961.622	969.627	其實他們的心裡面,是一種可能是既期待又怕受傷害的感受。
969.627	997.971	但是, 即便有這些內在與外在的先知哈蓋先知他卻不用這些事情來衡量他的工作他也絲毫不被這些不利的因素給影響他用堅定的信心仰望那位啟示他的神 並且忠心的就按著神的啟示來傳講神的話,一字一句的傳講出來。
997.971	1007.498	這樣對神忠貞的信靠跟服侍,就成了後來翻轉整個聖殿工作命運的重要的推手。
1007.498	1010.541	那後來建殿工作又如何進展呢?
1010.541	1017.927	我們趕快一起來看以色列記的五章十七節到六章八節,我們一起來念,預備,請。
1018.507	1031.118	現在王若以為美,請查巴比倫王的府庫,看塞魯士王降旨允准在耶路撒冷建造神的殿,沒有。
1031.118	1034.962	王的心意如何,請降旨小喻我們。
1035.282	1092.943	發現賽魯士王原有的照令,於是大劉士王降旨,要巡查典籍庫內,就是巴比倫藏寶物之處,在彌底亞省亞馬他城的宮內,尋得一卷,其中記者說, 賽魯氏王元年,他這樣子論到耶路撒冷神的殿,要建造這殿為獻祭之處,建立殿的根基,殿高六十軸,寬六十軸,用三層大石頭, 一層新木頭,經費要出於王庫,並且神殿的金銀器皿,就是尼布賈尼薩從耶路撒冷的殿中擄到巴比倫的,要歸還帶到耶路撒冷的殿中,各按緣處放在神的殿裡。
1093.882	1104.371	現在河西的總督拿乃和士達波斯乃並你們的同黨就是駐河西的亞法薩迦人。
1104.371	1109.475	你們當遠離他們,不要攔阻神殿的工作。
1109.475	1118.182	任憑猶太人的神長和猶太人的長老在原處建造神的這殿,我又降旨。
1118.422	1143.818	吩咐你們向猶大人的長老為建造神的殿當怎樣行,就是從核心的款項中急速撥取供應,做他們的經費,免得耽誤工作。
1143.818	1146.660	這殿就修成了。
1149.241	1153.805	不可思議的事情發生了。
1153.805	1165.434	雖然經過了十年漫長的熬煉以及等待,但神的話確實就一句一句的實現了。
1165.434	1183.973	雖然內在有我們看到我們自己的軟弱,外在有環境這麼艱難的因素,但神的話語卻突破了一切的限制, 打破了一切我們覺得的不可能。
1183.973	1188.676	神的話是極為貴重的。
1188.676	1193.079	我們相信神怎樣說,事情也要怎麼樣成就。
1194.445	1224.866	接下來我們就要用從另外一個角度也就是從索羅巴伯的角度我們要來看成為信心的得勝者的第二個秘訣也就是相信神仆人所說的話而非是自己的能力相信神仆人所說的話而非是我們自己的能力正如同撒加利亞書四章六節先知給索羅巴伯的應許我們一起來讀這段經文 預備,來!
1224.866	1240.159	這是耶和華指示所羅巴伯的,萬君知耶和華說,不是依靠勢力,不是依靠才能,乃是依靠我的靈方能成事。
1240.159	1240.559	阿們嗎?
1243.251	1257.541	哈開作為一個神的使者,他的信心的關鍵是忠心的照著他所聆聽到的話語來宣講,不管他所領受到的事情可不可能成就。
1257.541	1271.691	但索羅巴伯他作為一個執行者,他信心的關鍵則在於要專心的朝著神對他所說要他完成的方向來前進。
1272.466	1285.734	不論他覺得他自己做不做得到,他都必須要緊緊的依靠主,靠著主的能力,朝著主所指示的方向來邁進。
1285.734	1312.707	親愛的弟兄姊妹,不知道你是不是也可能,曾經在你過往的經驗,衝突,失敗,甚至是打擊當中, 是你對你的生活﹐工作﹐甚至是教會中的一些人事物﹐如同停工的聖殿一樣呢?
1312.707	1321.729	在這個停工的聖殿當中﹐我們似乎早已失去了盼望﹐我們甚至不再期待改變。
1321.729	1343.623	但在這裡﹐一左傳道﹐想要問你一句話﹐ 如果神對你說,祂從來都沒有放棄,那你還願不願意再試一次呢?
1343.623	1348.847	索羅巴伯,他在短暫的成功之後,他摔了非常大的一跤。
1348.847	1356.714	他的工作遇到了困難,問題無法解決,甚至許多的問題的原因根本就不在他身上。
1357.551	1371.980	形式上的困境使他的動力一天一天的削弱,甚至到一個程度,他可能決定把一切都暫時拋到腦後,不要再去思想這些事情。
1371.980	1401.314	但是就在他都已經似乎放棄了的時候, 神的話卻像是天外飛來的一筆,透過先知的宣講,又突然闖進了他的生命裡面,要他重新把那個他早已放到書架上,滿布灰塵的那個夢想,再重新拿出來。
1401.314	1410.315	我們可以想像得到,這對於一個 曾經成功又失敗的人來說,這是多麼的艱難。
1410.315	1413.297	他的心裡面會有多少的掙扎。
1413.297	1417.600	他會說,主啊,我真的可以嗎?
1417.600	1420.702	主,你確定真的是我嗎?
1420.702	1423.944	主啊,我真的可以完成嗎?
1423.944	1427.467	天父,你確定,你知道我過去的紀錄其實不太好。
1428.609	1437.657	甚至我們會問,主啊,真的非我不可嗎?
1437.657	1445.444	這許多的問題可能會像蚊子一樣,不停的在我們的耳邊,不停的細語。
1445.444	1451.750	它搖旱我們的選擇,甚至可能會搖旱我們的信心。
1451.750	1468.161	但是親愛的弟兄姊妹, 當你也像是索羅巴伯一樣,面對著敵人的挑戰與質疑的時候,請記得撒加利亞給索羅巴伯的鼓勵。
1468.161	1472.788	我們在一起來讀一次這一節經文,預備,來。
1473.490	1488.374	這是耶華指示所羅巴伯的,萬君知耶華說,不是倚靠勢力,不是倚靠才能,乃是倚靠我的靈,方能成事。
1488.374	1498.076	不是倚靠勢力,不是倚靠才能,乃是倚靠我的靈,方能成事。
1498.076	1549.216	神,我們所信靠的這位神, 各位在這邊所聆聽的信息的來源是創造天地的主上帝是真正的大君王萬有都在祂的同管之下因此我們相信不論我們覺得神的應許不論我們覺得我們所背負的重擔不論我們所背負 那樣的傷害或艱難是多麼的大,多麼的真實,以至於我們似乎沒有辦法再把我們那下沉的手、發端的腿再抬起來的時候。
1549.216	1563.879	我們要記得一件事情,就是要記得你的神仍然掌權, 你的神仍然坐著為王。
1563.879	1581.944	沒錯,或許我們過去的信用記錄可能真的不怎麼樣,但是我們也要因著那愛我們的主的緣故,我們要大聲的說,靠著那加給我力量的,我凡事都能做。
1583.695	1602.907	面對失敗的過去,佐羅巴伯靠著神的仆人的鼓勵與幫助,他掙脫了過去的束縛,並勇敢地再一次獻出了他的生命,完成了神的託付。
1602.907	1619.788	擁抱神的護照做信心的得勝者, 許許多多我們在生命當中遇到的困難其實最大的戰場反而還不是我們外在的形式或者是條件。
1619.788	1626.093	其實有的時候我們最大的戰場乃是在我們的心裡面。
1626.093	1628.515	你的心如何?
1628.515	1631.458	你知道嗎?
1631.458	1639.147	你的心是否 已經拒絕耶穌的安慰很久了呢?
1639.147	1648.590	你的心是否因為缺乏上帝溫柔話語的滋潤而枯乾很久了呢?
1648.590	1653.231	讓我們再一次把我們的信心舉起來吧。
1653.231	1660.013	像哈蓋,他不顧這些內在外在環境的條件。
1660.013	1672.034	他靠著對神的信心將他所領受的話語 傳達給了一個在困難跟失常中、軟弱中的弟兄。
1672.034	1674.875	可以像是索羅巴伯。
1674.875	1681.797	他縱然經歷過這樣的挫折、失敗甚至是沮喪。
1681.797	1686.679	但他卻因著上帝的話語而兼顧起來。
1686.679	1692.041	他不再看他自己心裡面的那些問題。
1693.183	1705.469	他也不再看他的過去,他緊緊地擁抱這個他看似艱難,又似乎不可能的任務。
1705.469	1714.413	我想請敬拜團上來,那我們可以有一段時間,我們要一起來禱告。
1716.067	1733.418	各位弟兄姊妹,今天的信息其實非常的單純,正如同我們在剛剛的敬拜當中,我們所經歷的,我們唱親愛主聖名。
1733.418	1759.638	一組傳道在這邊,我要來邀請各位弟兄姊妹,在我們當中,很多人你可能是有曾經服事過的經驗,或是你沒有服事過的經驗,但是無論如何, 在人生的一路上走過來,許多時候我們因為很多事物的壓力,我們不太知道怎麼來面對我們心裡面的那些微小的聲音, 我們覺得那只是一個疑惑。
1759.638	1765.302	我們覺得那只是一個一時的情趣而已。
1765.302	1767.964	但是一種傳道邀請你。
1767.964	1773.308	在我們待會讓敬拜團來服事我們的過程當中。
1773.308	1776.030	一種傳道要再一次的邀請你。
1776.030	1778.392	哈開的神也是你的神。
1779.241	1782.282	索羅巴伯的神也是你的神。
1782.282	1793.886	你現在在禱告的對象不是其他人,就是這一位把波斯王的列國的寶物都帶到索羅巴伯面前的神。
1793.886	1850.449	在這一個可能被以色列人拒絕的領袖的面前, 我在這裡要再次誠摯的邀請各位我們好不好我們在待會的過程當中在敬拜團服侍我們的過程當中我們再一次把我們的心交給我們的主吧我們再一次把我們的心交給那位愛我們的主吧把你的憂傷把你的受傷把你的難過再一次的交給祂 好讓祂可以把那顆溫暖的心,把那顆愛的心,重新放到你的裡面,使你成為祂尊貴的兒女,成為祂祝福流通的關道。
1850.449	1857.793	弟兄姊妹,讓我們一起來領受聖靈的帶領。
1866.067	1874.229	我祝耶穌一杯高舉。
1874.229	1879.070	祢配的榮耀,高升在天上。
1879.070	1892.593	祂的慈祥,祂的勝利,加添我力量是隨時的幫助。
1894.531	1908.767	我何等何莫,每一生與祢同行,到永遠。
1908.767	1926.037	請愛主聖靈,觸摸我的心, 我們從頭唱這聖靈更多的工作。
1926.037	1930.038	一杯高舉,一杯高舉。
1945.964	1951.789	你賠的榮耀,高升在天上。
1951.789	1954.112	來,科目祂。
1954.112	1959.737	祂已賜下祂的勝利,祂的勝利。
1959.737	1969.326	家庭我力量是,隨時的幫助,我何等科目。
1970.759	1975.504	每一生與祢同行到永遠。
1975.504	1977.866	弟兄姊妹讓我們來高舉神。
1981.305	1995.069	親愛主聖靈,觸摸我的心,恩膏照光我臨。
1995.069	2005.932	主我可想祢,更加貼近祢,主在祢同在。
2005.932	2024.058	親愛主聖靈, 親愛主神明,觸摸我的心,恩膏照光我臨。
2024.058	2033.406	主我可想祢,更加貼近祢,主在祢同在祢。
2039.411	2059.044	弟兄姊妹,我們今天現場有誰在主的面前記錄是很良好的,有誰在主的面前真的記錄很好,無可指責,誰在主的面前每一次主托付給你的使命, 責任跟角色你都使命必達。
2059.044	2060.484	你都沒有失敗。
2060.484	2062.466	你都剛強壯膽。
2062.466	2063.546	你都無往不利。
2063.546	2066.588	弟兄姊妹這樣的人只有在天上。
2066.588	2068.209	地上沒有這樣的人。
2068.209	2071.911	今天的信息再一次鼓勵我們。
2071.911	2073.552	曾經風光一時。
2073.552	2076.914	帶著五萬人回到耶路撒冷的索羅巴伯。
2076.914	2080.136	十多年來真的遇到很多困難。
2080.136	2082.578	以至於就是沒有辦法完工。
2083.746	2086.727	人最大的困難就是起了頭卻不能完工。
2086.727	2091.149	弟兄姊妹但是神從來沒有放棄過索羅巴伯。
2091.149	2098.011	索羅巴伯也可能沒有想要放棄自己但不知道怎麼樣重新再開始。
2098.011	2108.235	我們感謝上帝祂透過先知祂透過波斯的國王祂透過聖靈強大的感動再一次的鼓勵了索羅巴伯。
2108.235	2110.056	今天早上神也是一樣。
2110.056	2116.242	弟兄姊妹不要再紀念你我 常常在神的面前記錄很不好。
2116.242	2119.763	主都知道,主比我們都知道我們是誰。
2119.763	2121.664	我們有幾斤幾兩重。
2121.664	2125.805	但是我們不知道的一件事情是,主沒有要放棄我們。
2125.805	2133.588	弟兄姊妹,其實信仰之旅,人生的道路,就是不斷的跌倒爬起來,跌倒爬起來,跌倒爬起來。
2133.588	2144.333	因為每一次,我們的神都非常溫柔的,非常慈愛的,把我們扶起來,說孩子起來, 我要帶領你一同建造。
2144.333	2146.476	我要帶領你一同建造。
2146.476	2152.005	我們再次用這首詩歌來敬拜的時候,我們恳求聖靈這時候就來動工。
2152.005	2196.448	動工,求聖靈讓我們看見一件事情, 就是主耶穌基督現在正在我們的現場祂親自用祂所流出來的保血來塗抹我們一切那不良的紀錄我們一切失敗的紀錄神要用祂的保血塗抹潔淨我們今天聖靈要扶持我們站起來再一次的與祂同心與祂同行好不好我們再一次用這首詩歌來敬拜我們的主恳求聖靈就來供奏我們從頭來敬拜祂來 我祝耶穌一杯高舉,一杯的榮耀,高升在天上。
2196.448	2212.953	祂一直想祂的勝利,將給我的力量是隨時的幫助。
2214.531	2227.157	親愛的聖靈,求祢這時候就來動工,哈利路亞,觸摸我的心,讚美聖靈,哈利路亞。
2235.401	2236.243	天高將光臨。
2236.243	2320.743	祝我看向祢, 親愛的主聖靈ﷺ求祢來觸摸我ﷺ帶著耶穌基督的保血ﷺ塗抹徹銷ﷺ我在祢面前ﷺ一次又一次不良的紀錄ﷺ一次又一次的失敗跟軟弱ﷺ 道空我的器皿,竭盡我的生命,讓我抬頭仰望祢,讓我抬頭仰望祢,把我扶持起來,親愛的聖靈,哦,主聖靈我讚美祢,主聖靈我讚美祢,哈利路亞,觸摸我,我的心甘渴,我的心需要祢,重新來鼓勵我,向我吹氣,向我吹氣,哈利路亞, 今天早上神要讓我們裡面的信心再一次長大。
2320.743	2324.484	我們的信心需要再一次長大。
2324.484	2331.265	剛剛早上的信音裡,我們的信心有時候很渺小,很像那個嬰孩一樣。
2331.265	2333.406	但是神要讓我們的信心可以長大。
2334.019	2335.479	可以長大。
2335.479	2343.362	感謝主幾年前要開始要談建堂的時候,真的那時候我的信心非常的小。
2343.362	2347.643	我現在回過頭來,那時候自己的信心真的很小。
