start	end	text
2290.811	2310.568	所以各位弟兄姊妹,當我們真的是允許聖靈對我們教導,允許聖靈來做工的時候,是可以吸引人,裡面開始被神觸動,經歷神,然後呢,會被眺望起來,那我可以做什麼?我可以怎麼回應?
2313.985	2339.506	然後彼得就跟他們講,你們個人應當要悔改,而且你們每一個人應當要奉耶穌基督的名受洗,是為了你們的罪能夠得赦,而且就必領受所賜的聖靈。那這個應許是給所有的屬神的兒女,給所有在場的那些人,還有他們的兒女,
2340.503	2370.093	還有所有在遠方遙遠的地區,所有耶穌基督主所招來的人。彼得還用許多的話來見證、來勸勉、來教導在場的人,說你們當就自己脫離這邪惡、彎曲邪惡的世代。於是他們領受了他們的話,受洗的人那一天就約了多少人受洗?
2371.323	2398.951	三千人耶,各位弟兄姊妹,這是不是神蹟啊?你能想像淡江教會一天湧進三千人來嗎?這是聖靈的工作,聖靈可以讓神蹟馬上在我們眼前出現,讓人知道這真有一位神,而且是奇妙的神的靈在動工。但是不要忘記我們剛剛講的,
2399.923	2423.131	聖靈祂內住在我們裡面,只是看我們現在,自從把祂邀進來,你是請祂做客房,祂有些時候來告訴你,勸勉你說,正君這個零食吃太多對身體不好喔,飲料喝太多對身體不好,要少喝喔,然後你就把祂嘴巴塞住,不要講話,然後繼續做。
2428.558	2455.047	如果你覺得﹐你所認識的神﹐是一個只會告訴你﹐什麼該做﹐什麼不該做﹐嚴嚴在監督你的法官﹐審判官﹐那真的太可惜了。還記不記得我們剛剛講﹐耶穌基督說﹐祂要請求父才派保惠師來﹐我剛剛講忠保﹐聖靈祂還做什麼﹐
2457.193	2485.466	當我們犯了罪﹐當我們有了罪孽過犯的時候,是聖靈來勸勉我們要轉向耶穌基督。當我們願意按著聖靈所加添的力量剛強起來的時候,然後來到施恩座前說,神,我錯了,求禰赦免我。聖靈跟耶穌所做的是一樣的是什麼?
2487.892	2517.018	就是我們已經在神的審判,在法庭裡了。我們來法庭說法官我有錯,我犯罪我錯了。結果聖靈說,對,法官他錯了,他犯罪,他做錯事情了。他是讓訴訟案成立的,說對,印證說對,我這個人他犯錯了。
2518.234	2544.711	但他沒有停在這裡。他說,法官,但是他做錯這件事情,他錯了,他應該要得到的懲罰,看一下耶穌基督,耶穌已經為他擔當了。一個錯不能有兩次同等的懲罰,對不對?對同一個錯。
2549.07	2573.625	聖靈站在法庭為我們說,主啊,神你看,耶穌基督已經為祂擔當了祂的罪孽了,所以祂應該要被赦免。而當我們在犯罪,我們在那過程當中,可能我們在法庭上或我們自己的時候,我們犯罪了,我們沒有辦法去面對神的時候,
2575.026	2601.597	聖靈不斷地透過耶穌基督的教導,在告訴我們,祂不斷地安慰我們,提醒我們說,孩子,耶穌基督已經為你成就十字架了。你的罪、你的過犯,祂已經幫你承擔了。勇敢地來面對神,勇敢地到施恩做前,知取赦免。你是屬神的,沒有人可以隔絕神對你的愛。聖靈不斷地在提醒我們,告訴我們說,
2603.012	2628.306	耶穌基督為我們成就了救恩,而且祂已經得勝了,所以不要害怕,不要害怕去轉向耶穌,不要害怕來到神的面前說,主啊,我錯了,求禰赦免我。這就是那個中保,就是那個保惠師。聖靈祂在地上,祂不斷地在提醒我們,安慰我們,勸勉我們,祂也為我們代求,當我們往
2629.07	2656.549	神的反方向在走的時候偏行幾路的時候聖靈祂不斷的提醒我們呼喚我們說回來回到神的正道回來回來你回來無論你什麼罪無論什麼都可以被解決的因為耶穌已經為你在十字架上擔當了你要不要領受你要不要來接受懇求耶穌基督的赦免
2657.688	2684.144	你來,可以的。你是神寶貝的兒子,你是神寶貝的孩子。所以聖靈在這地上也為我們代求。耶穌祂現在坐在父的右邊也在為我們代求。所以各位弟兄姊妹,我們的聖靈也是甜蜜甜美的靈。
2686.271	2713.46	祂不斷用甜蜜的方式來呼喚我們,有些時候我們真的是迷途了,祂真的是擔憂了,或許有些時候聖靈會用怎樣,比較嚴厲的或比較嚴肅的方式來告訴我們,不可以再這樣做了。但無論如何,祂總知道在當下什麼樣的語氣,什麼樣的話語是最能夠合適幫助我們的。
2714.258	2741.977	好幫我們回轉向我們的神。或許我們期待聖靈充滿,就是馬上有神跡奇事發生。但是,能夠像這些人,三千多人,他們,之後大家回去有空可以回去看,在二章後面那邊,這些三千多人,他們,
2744.206	2767.755	他們就是當門徒跟他們講說,你們當怎麼行?然後彼得也告訴他們應該要悔改,然後要來領受聖靈之後。2章42節那裡開始說,這些人就怎樣?他們就開始恆心遵守,他們就是持續專心這些使徒的教訓。是使徒的教訓從哪裡來?從耶穌基督來的教訓。
2768.695	2790.203	然後這一群人他們就怎樣彼此交接彼此團契彼此有份彼此有關係彼此相愛彼此的支持扶持而且他們彼此的剝餅一起享用神所賜的食物紀念耶穌然後他們怎樣一起禱告所以各位弟兄姊妹
2794.531	2820.021	那個是一個屬神有聖靈同在教會的一個景象好不好我們請敬拜團上來我們有一段時間我們要來安靜一下你自己的光景現在
2823.148	2847.203	你的生命的光景,現在,是想到神,想到神,你就喜笑,你就有感恩的心,你就覺得,啊,神,我真的好蒙福喔。還是想到神,想到你看到的事,你有的,你沒有的,你看到的人事物,你會向神獻上感謝跟讚美嗎?
2850.555	2880.423	還是大部分的時間是比較多是抱怨。大部分時間比較看到自己所想要、所需求的。大部分時間是看到,主啊,我好軟弱,我就是做不到,我沒有辦法。若是在這樣的光景好不好,禰願意今天跟聖靈回應說,聖靈,我想要更認識禰,我想要更敏銳禰,我需要禰幫助我,
2883.114	2894.718	繁體中文，臺灣國語。繁體中文，臺灣國語。繁體中文，臺灣國語。
2918.063	2946.974	那對我們剛剛講的聖靈充滿的一個教會,有聖靈同在的教會,是一個彼此相愛,願意彼此相愛,彼此一起撥餅,一起團契,甚至於房屋共用,初代教會那樣子的一個美麗,一個榮耀的景況。跟你現在所看到的一樣嗎?
2947.927	2972.519	跟你現在所想要的一樣嗎?落差有多少?你願意把這個交給神嗎?你願意回應聖靈說,聖靈求禰幫助我。一想到語人,就覺得好睏難喔。保持距離而且遠遠的,比較好。
2977.705	3004.809	若只是禰,禰願不願回應聖靈,聖靈禰幫助我,幫助我,讓我有能力而且更多的渴望,可以跟弟兄姊妹們一起彼此分享,彼此扶持,彼此相愛。在這個教會有的,在這個肢體有的,我也要有份,我要參與在當中,
3015.759	3032.957	好幫我們一同起立。
3044.326	3052.182	我們一同用這首詩歌來回應。我們來渴慕聖靈。我們來呼求聖靈。願聖靈
3052.927	3080.723	更多在我們當中運行、動工、澆灌、攪動,好叫我們更多被聖靈光照,拿一些是不屬神的,而且因著聖靈所賜的力量,我們勇敢的來到施恩座前說,主啊,求禰赦免我,禰幫助我,好叫我有越來越多能夠有耶穌基督的樣式,無論是一次、兩次、三次、十次、一百次,做不到仍然能夠依靠著聖靈繼續的,
3082.466	3105.998	繼續的在主裡說,主啊,我要學習,我要學習,我就是要有耶穌的樣式,我想要有耶穌的樣式,我想要有耶穌的心香,願聖靈禰幫助我,因為祂也用全然的愛來愛你我了。我們用這首詩歌,我們來回憶。
3107.483	3126.039	最真實的我﹐你全然接納我。激活我軟弱﹐生命中的每一步﹐有你奉上恩典。
3129.582	3156.5	是我更靠近你。你全然的愛我。緊緊擁抱我。你全然接納我。永不離開我。生命中的每一步。有你風聲冷點。
3160.555	3187.99	是我更靠近你。我只想要藏在你翅膀底下。我只想要藏在你翅膀底下。可就能更多,停留在你同在。生命最大的盼望,就在你的天之中。
3190.776	3202.93	禰就站在我的身旁。我只想要藏在禰翅膀底下。祂想讓更多人跟斷,停留在禰同在。
3212.449	3233.643	生命最大的盼望,就在禰恩典之中。禰就站立在我的身旁。我只想要藏在禰卻怕影響。我求能更多停留在禰中藏。
3244.172	3267.813	最大的盼望。就在禰恩典之中。禰就站立在我的身旁。我只想要藏在禰翅膀底下。渴求的更多。
3275.674	3297.117	好不好,我們用一小段時間,我們自己來默想,你現在對聖靈,你有更多一點點的認識,
3297.773	3320.142	祂是讓你想到你過去對聖靈的經歷,但你已經忘了,好一段時間沒再去想到,沒再去為這個來感恩了。好不好,我們就一起用禰的方式,來對聖靈說,禰的需要,禰的渴慕,禰需要祂什麼,禰來告訴祂。禰需要渴慕,祂更多充滿在禰身邊,禰就來告訴祂。
3382.398	3409.032	神的親愛的聖靈,當我們越向禰敞開,越對禰毫無保留,越渴慕禰來作王掌權,越渴慕禰來充滿我們的時候,就越少有我們自己,我們就越能夠自在,真實的來面對禰,真實的來面對禰,更多的被禰引領,被禰教導,好叫我們更認識耶穌基督,更認識我們的神,
3409.616	3436.148	主啊,是的好,叫我們也更敏銳聖靈禰的話語。我們生命更多的渣仔,被禰來接近。主啊,我們也能夠有知取禰來的能力,能夠來完成主禰所託付的使命,傳福音,到各地,到我們所到之地,來為禰做見證。
3437.858	3465.741	我們也能夠成為神的旨意成就的器皿。抓這是我們的渴求。聖靈這是我們的呼求。求禰更多更多的讓我們經歷禰。更多更多的在我們裡面。我們每天的生活都需要有禰。讓我們對禰更有感。抓式的抓。我們在這裡。願聖靈禰繼續的充滿澆光我們。
3466.698	3488.042	無論我們有沒有感受,身體、五官有沒有感受得到,讓我們對禰的信靠是越多加添的。謝謝禰,讚美禰,願一切的榮耀歸於禰。感謝禱告奉耶穌基督寶貴的名祈求。阿們,哈利路亞,我們為聖靈感謝。