start	end	text
2063.473	2087.146	神真的在。神就真的在我們的面前。可是我跟神之間充滿了很多雲霧。那個雲霧叫做什麼?負面思想。所以重點是那個負面思想。讓你看不到神。你才會說出什麼樣?妄語。我印象中我這一輩子說過最愚昧的一句妄語是什麼?
2087.824	2115.104	我記得,這個想要順心。不是你說妄語,你有一次坐了一張什麼,很大的什麼,臺北到新疆的來回機票,就是那個事件。很多人有聽過,就是多年前,還在老教會的時候,有一次禱告,神就給我一個感動說,你這些年都有參與回教的宣教事工,那你要不要去新疆一趟,我有事情吩咐你去那邊,你就去。
2115.384	2134.243	我說主啊,我才剛出院,那時候我那個脊椎受傷才剛出院。然後說主要命只有半條,要錢一個子兒都沒有。然後隔天早上我這個靈修的時候,神就把經文給我。就是說,馬太福音第十章,祂拆派門徒兩個兩個去傳福音有沒有。
2134.957	2148.233	口袋裡面也不要怎麼樣,帶銀錢。因為做工的怎麼樣,得飲食是當得的。那我就想說怎麼樣,哇,主給我畫。跟我講不要擔憂,去就對了。我就立刻答應對方說,好,我要去。
2149.036	2169.393	結果就在我出國的前兩天,果然烏鴉,知道為什麼叫烏鴉嗎?烏鴉不是來唱衰你的,烏鴉是典故的,就是那個以利亞先知在那個基利西旁等烏鴉怎麼樣,雕餅跟雕肉要給他吃。我們就是都長期都有靠神派烏鴉當快遞來。
2170.555	2193.192	就在出國前兩天,果然烏鴉就叼了一個信封來。好高興,因為神好準時。神總是在出發前兩天才把信封給我。我跟我太太都非常習慣,已經很多年了。果然非常準時,烏鴉把信封叼來了。打開一看,最高境界。那個錢只夠去的機票錢,不夠回來的機票錢。
2194.002	2206.026	那我想說,哇,因為這可能這筆錢神很看重,所以派兩隻烏鴉雕來。所以呢,就一直等,等到怎麼樣?要出國了。那天早上,烏鴉有沒有來?第二號烏鴉有沒有來?沒有來喔。
2206.391	2223.581	半路不知道去哪裡了。結果呢,我跟我太太就跪在客廳禱告。就問說,那還要去嗎?還要去嗎?禱告完之後,太太說,對,還要去。我也說,對,神叫我要去。所以呢,我就怎麼樣?跟她揮揮手,臨絕名,意義清清如物。
2224.121	2250.173	與其怎麼樣?絕別書。那個是很早期,所以那時候在轉機都還要機場稅的時代,現在就沒有了。然後我就算一下,我從這邊轉香港轉廣州,一直到烏魯木齊,總共轉這幾次需要多少錢?我就帶了家裡所有的存款,還有所有的鋪滿,統統挖出來,感謝讚美組,總共我們家財產非常的豐富,有1700元。
2252.039	2277.165	我就帶走了一千五百元做機場稅。沒有,真的沒有旅費,就一千七百塊的機場稅,五百塊的機場稅的錢。另外那筆錢是機票錢,然後留了兩百塊給我太太。我說,意義清清啊,拜拜,神必恩待你,養活你們一家四口,靠這兩百塊。那我一定回得來的,他就說你一定回得來,我說對,我一定回得來。
2279.206	2307.971	到了那個廣州白雲機場,哇,肚子餓到要死。每個人都說,欸,玉敏啊,其他幾個教會的傳道人,玉敏啊,來吃中飯。我就說,不餓,基督徒講謊話還真容易。我說不餓,主啊,赦免。然後呢,他們說不餓,我說你們去吃吧,我為你們行刑禱告。然後他們就去吃飯,我就在機場那邊禱告,走來走去。等到覺得差不多,怎麼吃這麼久,回去,哇,每個人都好高興。玉敏啊,你今天沒來吃飯,太可惜,因為今天有人請客。
2308.831	2309.482	去西南。
2312.756	2339.477	我想說,對,主啊,你不是跟我說工人得飲食,怎麼樣?是應得的啊,我怎麼這麼小信啊?我怎麼不相信你的話?主啊,赦免我,主啊。可是吃光了,來不及,只好飛機上等那個麵包。好啦,所以我們因為被主眺望了,對不對?所以到那個地方怎麼樣?就開始大大服侍在新疆那邊,哇,很火熱啊。這故事有人聽過,就後來有一天,中間有空檔,同工帶我們到天山上面的天池啊。
2339.957	2368.012	哇,風景真的是有夠美的。哇,這個韓國那個算什麼?阿爾卑斯那個算什麼?那邊真的有夠漂亮。你有看過天山的天池結冰嗎?你有看過莊牧師在那個冰壺上面溜冰的樣子嗎?沒有去溜啦,就是很漂亮。就打電話回來給師母說,太太啊,很抱歉,嫁給我是你一生中最大的幸福,也沒有帶過你去蜜月旅行。如果有幸,有一天神恩待我們,我帶你來這邊蜜月旅行。
2369.582	2398.236	有啦,後來有一次我太太說去埔滅旅行,叫我帶她去韓國禱告洞。好了,結果太太都不講話,我就說你怎麼了?她跟我說,從你走了之後,我們家那個老二,心臟胸口在痛。我說心臟胸口痛?看醫生啊,對面就三種啊,還不會去看嗎?她說親愛的,你只留兩百塊給我,兩百塊,我說兩百塊,掛號一百五啊。
2400.145	2425.096	他說你走了第二天,我們隔壁有一個師母,她癌症剛化療回來,所以我們這幾個師母,每個人就提供一餐有營養的魚給她吃。我就去菜市場買一條很好的魚,花了一百塊,兩百塊只剩下多少?一百塊。結果呢?可不可以掛號?不能掛號。我說就這樣子,他說對,就這樣,所以我們兒子胸口痛到今天。我跟你講,
2426.237	2430.549	頓時怎麼樣?詩篇73篇的靈怎麼樣?降臨在我身上。
2432.432	2456.31	喔,氣乾你知道嗎?我說主啊,你在幹什麼啊?機票只給我一半,回程也不給我,我憑著信心跟隨你到新疆,不是去新竹欸,去新疆欸,都搞到天山的天池了,你在搞什麼?我怎麼對你這樣有信任?我的兒子生病了,你還不給他錢看醫生,你這什麼神啊?我不要服侍你了。
2457.705	2483.816	心裡面的OS怎麼樣?超大聲的。十篇七十三篇的靈在我身上大大的充滿我。我那時候站在冰壺上面跟我太太講電話。夠浪漫吧?一個冰天雪地一個男人站在冰壺上面跟太太講電話。當我聽到他講的時候,我覺得我的心已經沉到冰壺底下去了。好冷喔!冷什麼?對這個神好心寒喔!
2486.118	2510.217	忽然,就在那個冰湖底的時候,神就對我說一句話,祂說,玉民啊,你真的不要信我了嗎?我每次講到這段,我都真的很想哭。我就想到那個被鬼附的那個爸爸,他講那句話,他說,主啊,
2511.852	2526.109	我信,但是我信不主。求主幫助啊。主啊,我願意信你啊,可是我信信就是不夠啊。我看環境,我就看不到你在哪裡啊。求你幫助。
2527.483	2532.449	就在那一剎那,聖靈就充滿我。一個男人,在這種湖底,噔噔噔噔噔噔噔噔噔噔噔噔噔噔噔噔噔噔噔噔噔噔噔噔噔噔噔噔噔噔噔噔噔噔噔噔噔噔噔噔噔噔噔噔噔噔噔噔噔噔噔噔噔噔噔噔噔噔噔噔噔噔噔噔噔噔噔噔噔噔噔噔噔噔噔噔噔噔噔噔噔噔噔噔噔噔噔噔噔噔噔噔噔噔噔噔噔噔
2544.804	2573.453	所以跟我太太說不要害怕我們怎麼處理ABC。然後我就回去服事。還有一個故事就不講,就是後來神怎麼樣讓我沒有回程的機票,又讓我很神奇可以回到臺灣。所以有空再講。弟兄姊妹要講的怎麼樣?為什麼會有妄語?因為充滿了負面思想,因為充滿了環境。環境給我們就是負面的時候。神還是在,神沒有走,神真的沒有走,但中間隔了什麼?
2574.206	2593.904	負面思想,隔了懷疑,隔了苦讀的悟。如果你覺得,你生命中曾經講過的一些妄語,特別是跟神有關的,待會我們禱告的時候也求主,用寶血把它塗抹掉好不好。
2594.753	2623.611	因為你不把它吞抹掉,它會對你的人生產生影響。因為我就是那一次事件,之前有一次也是這樣。就是我的老大要開刀,主也跟我說沒問題,大丈夫,抱在我身上。結果呢,隔了一個月之後,跟醫生約好了,隔了一個月之後呢,明天要開刀了,當天晚上醫藥費,開刀費沒有著落,我說主啊,你大丈夫,帶到哪裡去?
2625.759	2655.305	當然後來神在那天晚上最後一刻祂又奇蹟式的讓醫藥費全部又出現在我的手裡。我當又是很慚愧跟主說主我對不起可是我就是沒有去處理那次我的妄言所以那次的那個我兒子沒有開刀費的事件在我生命中有一個很深的烙印以至於我在天山的天池的時候我就想起我就說主啊我三個兒子你已經糟蹋了我兩個兒子那你還要怎麼樣
2656.254	2673.032	上次那個開刀不給開,這次心臟痛不給開,那你現在怎麼樣?你發現我在講什麼嗎?你上次的妄言沒有處理,它就是一個怎麼樣?一個陰影在那個地方。等你下一次環境又出現的時候怎麼樣?它就勾引你說,你看把這個什麼神不要信了,每一次都這樣。
2674.718	2702.165	我太太以前最常跟我講,你每次都這樣。其實我們最喜歡跟神講什麼?你每次都這樣。神要說,我才沒有每次都那樣。是你誤會我。來,講快一點。好,言詞知道了。妄語知道了。跟隔壁講說,不要講妄語。好,來。第三個是什麼樣?細笑的話。細笑的話就是什麼樣?就是粗俗的笑話。
2703.336	2725.626	挖苦人的笑話,諷刺人的笑話,糟蹋人的低級幽默。這個在臺灣的媒體最常出現。我們剛剛講說一個人會講淫詞,或是心裡面會有淫念,是因為他忘記了自己的尊貴身份是什麼?神的兒女。一個人他會講出妄語,
2726.578	2752.857	會說神你沒長眼睛,神你在哪裡?神你不存在,神你不愛我,神你都不幫我,只幫別人。妄語是因為你看不到神。為什麼看不到神?因為你只想看負面思想,因為你被環境所充滿。第三個是一個人會講出細笑的話是怎麼樣?因為他不知道別人是神的兒女。
2753.899	2778.026	以至於他認為他可以隨便講話糟蹋人,挖苦人,諷刺人。聖經裡面有一個很有,很令人印象深刻的一個例子,提醒我們不要隨便講這種細笑的話,傷害其他神的兒女,傷害其他的人。就是有一個先知叫做以利沙,
2779.275	2796.658	他有一次呢,他到了一個城市,叫做耶利哥。那個城市呢,之前被咒詛。然後呢,15年前,雅哈王不顧神的咒詛,他就是要重建那個城。
2798.063	2823.542	但是重建那個城之後,耶利哥的意思就是怎麼樣?就是它那邊有很多棕櫚樹,所以那邊是個綠洲,它的水是最甜的。可是雅哈王不顧神之前的審判,他硬是要重建耶利哥城的時候,結果怎麼樣?城建起來了,可是裡面的泉水都是怎麼樣?都是苦的。所以城建起來了,沒水喝。15年來都沒有好的水可以喝。
2825.725	2852.897	以至於耶利哥城的居民就出來見這個先知以利沙說請你幫幫我們好吧救救我們好嗎以利沙說好啊他說拿一些鹽巴來我問你們禱告就把鹽巴丟到水裡水就變甜的了居民就很感謝他當以利沙施行完這個神蹟要離開耶利哥城要去伯特利的時候
2853.814	2881.436	突然呢,就出現了一群年輕人,他們不僅沒有心存感恩,他們不僅沒有看見神人先知他行神蹟,好叫他們要知道要敬畏神,敬畏神的僕人敬畏神,這些人竟然怎麼樣,不斷地在以利沙的背後嘲笑說,禿頭禿頭,禿頭禿頭,禿頭禿頭,以利沙禿頭,
2884.309	2911.407	結果伊莉莎怎麼樣?轉過頭來怎麼樣?咒詛他們。結果呢?從山上跑出兩隻怎麼樣?母熊。當場就咬死了42個人。中文的翻譯說他們叫童子,42個童子。你要看希伯來文,你不要想說,哇,動物園的熊跑出來咬死42個小朋友,不是啦。那些是怎麼樣?年輕的啦。
2912.568	2940.18	還記得那個創世紀的時候﹐那個亞伯拉罕﹐帶領318個勇士﹐有沒有﹐去救他的這個﹐那個羅德﹐有沒有﹐318個勇士﹐那個勇士就是﹐被母熊咬死的那42個童子﹐那個童子都同一個字﹐他指的就是還沒有結婚的人﹐可能是﹐小孩﹐但更多時候指的是什麼樣﹐社親﹐注意一下﹐社親﹐不要講戲笑的話﹐
2942.056	2962.373	你看,神做這個事情怎麼就是這樣,當你不懂得尊重神的兒女的時候,神是會生氣的。再一次跟隔壁講說,哎呦,我不敢講細笑的話了。你對誰最敢講細笑的話?很熟的人,所以很多很熟的人被你傷害你就不知道。
2963.336	2986.354	這禮拜有誰想到你對很熟人講細笑話,這禮拜趕快去悔改。請對方原諒你,並且為你禱告,免得你有母熊出現。敬拜團上來,我們來禱告。神今天給我們一個提醒,
2988.114	3014.766	貪心沒有機會講了。貪心下一堂再講。我下一堂不講以弗所,下一堂講別的。所以有興趣的可以留下來。神今天教導我們,要我們做光明的兒女。
3016.237	3042.854	神說的這一切的話不是要定罪我們。因為定罪的事情已經在十字架上執行了。耶穌基督替我們被定罪了。耶穌基督為我們過去在不聖節的事情上。我們所想的所做的一切的事情上。這些我們現在想起來會後悔。會羞愧。
3044.633	3070.166	會悔恨的事情。耶穌基督已經在十字架上。都替我們承擔了。祂替你和我承擔了。為的是還給我們一個聖節。還給我們一個健康的有自信的。性別自我形象。不論你是男人還是女人都一樣。神都要恢復你。
3071.459	3098.986	健康的有自信的聖潔的性別自我形象以至於你不需要再活在這個軟弱的扭曲的有缺陷的膽怯的一個性別自我形象裡面繼續過著不自然又變扭又勉強自己的一種
3100.572	3124.757	性別自我形象裡跟別人建立關係。不論你已經結婚了沒有,都一樣。很多時候,不健康的性別自我形象,會影響我們的婚姻,影響我們跟兒女的關係,也影響我們在職場上對自己的看法,影響我們對別的男人、別的女人對我們的看法。
3126.305	3150.267	今天主要告訴我們,祂已經替我們成為挽回祭了。祂已經釋放我們了。因此待會我們在敬拜之後,我們就來到主的面前禱告。我們今天就要領受一切在不聖節的淫亂的事情上,神的保血遮蓋我們每一個人。讓祂真的被主砍斷那個魂結,離開我們的生命。
3151.135	3174.418	讓我們用一個健康的自我性別形象看自己,不再委屈自己亂七八糟,也不再讓自己扭曲的與人建立關係。第二,有沒有一些負面的思想,負面的妄語,曾經深深的影響你的心靈?你願意相信耶穌基督的愛永不改變嗎?
3175.162	3195.082	你願意相信說,主啊,我信不足,但求主幫助。這句話是實實在在的話。主會聽這句話的。主會讓你就算在迷霧之間,仍然可以看見祂始終沒有離開你。不要讓你的生命中許多的妄語,不斷的瑕疵,影響你跟神的關係。
3196.578	3220.41	第三,神教導我們要尊重其他的人,因為他們也是上帝的心肝寶貝。不要隨隨便便在嬉笑的話上面侮辱別人,取笑別人,諷刺別人,因為天父會傷心。你要知道你自己是神的兒女,你就要尊重你自己。你要知道別人是神的兒女,你也要尊重他。
3221.186	3241.934	你要知道神永遠與你同在,你就不會抱怨說,神啊,你跑到哪裡去了。今天早上是一個神,要再次用祂的愛,來服侍我們的時間。弟兄姊妹都把自己敞開,交給神吧。因為祂的光今天就要照亮你,使你不再繼續躲在黑暗裡面。我們用這首詩歌來敬禱。