start	end	text
0.009	24.531	師班他們下個禮拜要去退休會,願神恩待他們。他們有大軍70個人要出去,我們先一起來為他們禱告。主讚美你,謝謝你讓師班的弟兄姊妹們,主他們就像約蘇亞一樣,主他們所到之處,他們每一次聚集敬拜你的時候,主仇敵的城牆就要倒塌,
25.452	51.018	主讓他們不小看自己的呼召與職份。主讓他們每一次都在禰面前同心合一的來服侍禰、敬拜禰。主禰用他們的師哥的服侍。主打開許多人的心中的城門。將人心帶回到上帝的師恩寶座前。謝謝主,願主恩高他們,與他們同在。奉主耶穌的名禱告。阿們。
52.483	74.561	好,我們一起來打開聖經好不好。我們今天來看的是以弗所書第五章。我們請有需要聖經的人,把手揮一下,同工可以把聖經給你。
88.08	92.546	好的,翻到了嗎?以佛所書第五章。PPT也幫助我們一下。
100.64	118.448	好,我們一起來讀從第一節,我們先來讀到第七節。預備,來。所以你們該效法神,好像蒙慈愛的兒女一樣,也要憑愛心行事,正如基督愛我們,
118.848	136.583	為我們捨了自己,當作心香的貢物和祭物獻予神,至於淫亂並一切汙穢或是貪婪,在你們中間連提都不可,方和聖徒的體統。
137.244	165.154	因此,妄語、細笑的話都不相宜,總要說感謝的話。因為你們確實地知道,無論是淫亂的、是汙穢的、是有貪心的,在基督和神的國裡都是無分的。有貪心的就與拜偶像一樣,不要被人虛浮的話欺哄,
165.776	182.285	因這些事,神的憤怒必臨到那悖逆之子,所以你們不要與他們同夥。從前你們是暗媚的,但如今在主裡是光明的。
182.705	202.585	行事為人,就當像光明的子女。光明所結的果子,就是一切良善、公義、誠實。總要察驗何為足所喜悅的事,那曖昧無益的事。不要與人同行,倒要責備行這事的人。
203.166	226.403	因為他們暗中所行的,就是提起來也是可恥的。凡是受了責備,就被光明顯明出來。因為一切能顯明的,就是光。所以主說,你這睡著的人,當醒過來,從死裡復活,基督就要光照你了。
226.783	245.366	你們要謹慎行事,不要像愚昧人,當像什麼?智慧人。為什麼呢?要愛惜光陰,因為現今的世代邪惡。不要做糊塗人,要明白主的旨意如何,不要醉酒。
246.067	270.796	久能使人放蕩,乃要被聖靈充滿。當用詩章、頌詞、靈歌彼此對說,口唱心和的讚美主。凡是要奉我們主耶穌基督的名,常常感謝父神,又當存敬畏基督的心,彼此順服。
271.613	300.063	我想今天的,OK,我們就讀到這裡。我想今天的經文,它的意思每個人都讀得明白,並沒有任何的深奧的地方。我常跟童工分享,講到最難講的就是這種經文,就是他已經講得很清楚,那你幹嘛再講一次。我兒子常常說,奇怪,你們這些牧師很奇怪,明明聖經就有寫,你還要一直講。對,聖經明明就有寫,我們也看都看得懂,問題在哪裡,就是做不到。
300.947	321.198	所以如何把那個最簡單的沒有什麼深奧神學的經文那些特別是生活應用的那些在生活裡面的一些主的一些帶領怎麼樣實際的把它能夠活出來我想這才是關鍵所在因此我們今天非常需要神的恩膏
321.578	348.758	來幫助我們,能夠來在聖靈的引領之下,使我們能夠把神的心意能夠滿足出來。第五章的第一節他說,所以你們要怎麼樣?效法誰?效法神啊!好像是怎麼樣?蒙慈愛的兒女一樣,也要憑愛心行事,正如基督愛我們。基督多愛我們呢?基督為我們捨了自己啊!
349.258	364.819	當作新香的貢物和祭物,獻給神。這邊寫得很唯美啊。但是如果你把畫面回到舊約的時候,在會墓獻祭,有一隻無罪的羔羊。妹嘿嘿嘿。
366.052	381.685	他代替你。這隻無罪的羔羊是特別被挑選出來的。身上沒有斑點。沒有瑕疵。皮膚上也沒有任何的皮膚病。他代表怎麼樣?完美。這個沒有犯罪、完美的羔羊在會幕的面前
382.125	403.224	為了你跟我的軟弱和罪,怎麼樣?被殺。祂流出的血,代表我們的血流乾了。一個人的血流乾了,怎麼樣?就死了。所以這個血呢,代表就是祂裡面有生命,就是說生命流乾了。在新約的時候,我們就明白,這隻戴罪羔羊指的是誰?
404.189	421.466	就是耶穌基督。耶穌基督在十字架上替我們成了怎麼樣?贖罪祭。替我們成了挽回祭。替我們流出了祂生命的每一滴血。替我們付出了一個極重大的代價。目的是透過怎麼樣?祂替我們死。
421.766	445.812	好叫我們可以怎麼樣?活過來。好叫我們可以不再做一個活死人。好叫我們可以得著新的人生。因此當這邊的第二節在講的時候,你必須回到十字架前去想像這邊講什麼?他說,正如基督愛我們,為我們捨了祂自己的生命,當作一個新鑲的祭物,來怎麼樣?獻給上帝。
446.032	475.724	既然神付這麼大的代價,就像牧師剛所說的,神祂用祂的生命來代替我們的生命,使我們重新有機會能夠活出神要賜給我們的那寶貴的生命。所以在第三節的時候,保羅在這邊就特別來提醒在以弗所的弟兄姊妹們,第三節他說,至於淫亂並一切的汙穢或是貪婪,在你們中間連提都不可,連說都不可。
475.964	489.381	繁和什麼?繁和什麼?聖徒的體統。弟兄姊妹們,聖徒原來有怎麼樣?有體統的。什麼意思?有樣子的。我們常講什麼?不成怎麼樣?不成體統,就不像樣。
490.06	508.413	特別保羅在那邊提醒我們在一切的誤會或是貪心或是淫亂在我們當中不僅是怎麼樣不僅是連去做都不可以甚至連你嘴巴都不要去講因為講了怎麼樣都覺得很羞恥
509.394	537.675	祂說這樣方何怎麼樣?聖徒的體統。第四節祂說,吟詞、妄語和細笑的話都不怎麼樣,不相宜、不合適,總要說感謝的話。因為你們確實的知道,無論是淫亂的,是汙穢的,是有貪心的,在基督和神的國裡都是怎麼樣?無分的,有貪心的就與拜偶像的一樣。講得好重喔!
537.995	543.686	貪心跟敗偶像是一樣。待會牧師會講為什麼貪心跟敗偶像是一樣。
544.599	568.77	當你貪心的時候呢,第六節,你就很容易被人用虛浮的話,虛空的話,很容易被人用虛空的承諾,就把你騙到手,你就傻傻的跟著他,然後呢,浪費你的生命,浪費你的金錢,浪費你的安全,在他的身上,結果一無所得。這些事,神的憤怒要淋到那些悖逆之子,所以你們不要與他怎麼樣,同夥。
570.111	591.401	這段經文其實大家都懂意思,因此牧師想在幾個關鍵的事情上再多進一步來跟大家分享。今天你只要明白第四節,吟詞、妄語、細消的話跟貪心。你今天第一堂就是得到神的一個教導。
592.722	619.181	第四節講了什麼樣,影詞,什麼叫影詞。為什麼影詞在我們當中,不可以連提都不要提。什麼叫影詞,就是黃色笑話,有性暗示的言語,這些這個有顏色的話,有顏色的暗示,這些怎麼樣,都是神所非常不喜悅的事情。這在我們當中怎麼樣,連提怎麼樣,都不要提。一個人為什麼,
620.179	638.713	他會講出吟詞,是因為他不知道他自己是神的兒女。一個人如果真的知道他的身份是神的兒女,他連講都不想講,因為他覺得會怎麼樣?會汙辱自己的口,會汙辱自己的嘴巴。
640.606	659.922	禮拜五和一些弟兄姊妹，我們一起到IM去服事,因為剛好宗牧師到美國去了,黃牧師跟羅牧師,他們在舉辦101的夫妻營,所以我跟偉南牧師還有一些同工,我們就負責那天的IM的聚會。那天主要也是在處理
660.282	680.879	在男女的關係上有一些不健康的不正確的有一些淫亂的混結所謂的混結呢就是過去有一些在性在情感上的不聖節一直沒有處理的以至於你雖然跟他分開了但是
682.056	711.576	他的某一塊還在你身上,你還帶著他,然後你又進入下一段的感情跟關係裡面,又沒有處理好,又走了,所以你身上怎麼樣?已經綁了兩個結了,然後又往前走,又背了一個結,第四個結可能是你感情受傷,第五個結可能是你死別人受傷,第六個結,第七個結,第八個結,一直結到一起,甚至到你建立了婚姻之後,建立了家庭的時候,那些婚結還在你身上,一直都沒有解決,以至於影響後來你自己所建立的家庭,
712.056	712.432	繁體中文，
712.619	741.629	那天提到一些事情,我想現在在教會裡面,我們應該不太有人會敢講這個影詞,那甚至我想大部分弟兄姊妹在家裡面應該也不太敢講,因為你一講別人怎麼樣,你不是基督徒嗎,你還講這個,你不是基督徒嗎,你怎麼還好意思講這個,我們大概怎麼樣,大概都不太會去講,那但是呢,這邊牧師想要提的就是說,因為耶穌一直告訴我們一件事情,
742.329	753.075	不是你嘴巴說出來才算有講。他說不是你真的去跟別人有淫亂的事情,你才叫做行淫亂。你心裡面有想怎麼樣?耶穌說就是。
754.206	774.947	也就是說,你不是說嘴巴有沒有開黃腔,才叫有沒有講淫詞。在你心裡面,對於性,對於男女的關係,是不是一個被主醫治的,被主赦免的,被主調整過的一個健康狀態,那個是怎麼樣?是今天我們要談的一個重點。
775.776	793.269	禮拜五那天我跟IAM的弟兄姊妹分享,特別是我想提一件事情,就是婚前的性行為。那我為什麼要提這個,因為我們看我們在座大部分都結婚,還談什麼婚前性行為。但是呢,有沒有機會在你對你自己的子女,
794.224	823.796	或是對你的朋友、同事、親戚。你還是有機會跟他們講一個正確的、一個兩性的關係。那我覺得這個是我想從飲詞這個部分來做發揮的。為什麼我們要拒絕婚前的性行為?我覺得有幾個原因,大家把它記一下。第一個,我覺得很多的,因為我是一個男人,我從男人的角度談這個事情。很多的男人,他為了要證明他已經是個男人。
825.589	854.255	他其實他覺得自己還不成熟。他覺得他其實一直被人家小看。他想證明我已經不是男孩了。我是怎麼樣?男人了。我不是boy。我是怎麼樣?男人了。所以呢,他們想要透過婚前的性行為或不正確的婚姻以外的性的行為或性的想像來建立自己一個男性的安全感。這個聽得懂嗎?
854.991	878.359	我想很多弟兄一定聽懂我在講什麼,因為這個是仇敵最想試探我們的地方。不論你結婚了沒有,仇敵總是想要透過不正確的、不蒙神所喜悅的性關係跟性幻想跟性想像,來讓我們在裡面找到一種男人的安全感。
879.309	899.516	宋牧師是原住民,他常跟我說他是祖裡面偉大的獵人。有一次他不小心縮溜走才知道,原來他一輩子沒有打過獵,他只是跟他表哥去打獵。表哥打到獵,他負責去撿獵物,因為他說他從小就住在都市,根本沒有機會住在山上。
900.196	924.991	你知道嗎,對一個原住民來講,男人自我形象是很重要,男性的性別自我形象是很重要。因此他們從一個男孩要變成男人,他們要做一件事情,來成為他們的成年禮,就是你要去打獵,你要去打到一隻獵物,一隻猛獸,或是一隻很厲害的獵物,代表怎麼樣?你比這隻獵物還要強,
925.691	952.021	代表你已經是個男人。所以一個男孩如果能夠在成年禮的時候打到一個獵物,就證明怎麼樣?我當大人了。證明怎麼樣?我已經是個男人了。所以當他把這個成年禮的這個祭物帶回來的時候,其他男人就說,你是男人了。那親愛的弟兄姊妹,特別是親愛的弟兄妹,姊妹也很重要聽這一點。千萬我們不需要
952.995	976.405	透過神所不喜悅的任何實質的性行為跟想像的性幻想、性想像來證明我們是男人。我們不需要把別人當作我們成年裡的記物。親愛的姊妹們也是一樣。任何一個女人每一個人都是神造的。
977.261	1002.851	他都是很尊貴的。沒有任何一個女性需要被犧牲,成為一個男人,一個男孩,一個大男孩,一個老男孩,來證明說他真的是個男人。你不需要因為這樣而成為他成年禮的祭物。聽得懂嗎?聽得懂齁?所以第一個,我們可以提醒自己,也教導別人,
1003.746	1029.057	就是第一,女性不需要成為男性成年禮的一個祭品。第二個,也是很重要的是怎麼樣,當牧師這十多年來常常會輔導一些婚姻,甚至常常會跟一些弟兄有比較多的一個深談。我問大家一件事情,你知道一個男人,男人注意了,你看看是不是這樣,
1030.162	1051.87	什麼畫面是你這一輩子不想去看的,甚至你這一輩子拿槍抵著你頭,你連一秒鐘都不想多看那一眼的畫面。這麼多年來,我陪很多弟兄走過這個婚姻的問題,還有男性自我形象的塑造和被主醫治的這個過程,
1052.944	1076.151	一個男人他一輩子最不想看他的畫面,就算你拿一億元給他,就算你拿槍抵他的頭,他也不想看見,就是他的妻子在跟他結婚之前,跟別人如果有發生過親密關係的畫面,他死都不想看。所以,親愛的姊妹們,
1077.261	1104.053	你若知道這一點是男人的罩門,你就該保護自己,也保護別的女生。所以你們懂嗎?今天的分享其實對大家是很重要的。男人就是這麼自私。真的,真的。他可以成為上一段影片的男主角,但絕對不可以成為這一段影片的觀眾。就是這樣子。因為為什麼?這個就回到神的創造裡面。
1104.906	1115.098	因為兩個人結合在一起,是容不下第三者,完全容不下。不管是過去、現在、未來,容都容不下。那如果已經發生了怎麼辦,待會我們要來禱告。
1115.845	1142.401	因為神能夠把這個魂結斷開,讓我們都得自由。不論我們以前曾經怎麼樣,神都可以使我們得自由,得醫治,得釋放。所以呢,剛剛講怎麼樣?第一點怎麼樣?不要輕易成為男性,男孩變成男人的這個成年禮的祭品。第二個,男人最不想看的畫面是什麼?這個大家都要記起來。第三個,提醒各位男性,己所不欲怎麼樣?
1142.961	1171.13	勿施於人。上帝是怎麼樣?公平的。你不想成為某一種畫面的觀眾,那你就不要成為那個畫面的男主角。己所不欲怎麼樣?勿施於人。第四個,也是常常這個男性的朋友們,到了結婚之後很多年才會赫然發現的一個問題,通常都是在婚姻已經出問題之後,才會發現到多年前,多年前他的婚前性行為,
1171.51	1194.282	還有他這個多年前他的婚前性行為在他結婚之後多年所產生的一個影響,他才赫然發現是什麼。就是說在婚前產生性行為的時候,一個男人他會覺得說,我已經得到了。我就得到了,你要怎麼樣?很像阿扁,我就好運來,你是怎麼樣?
1195.862	1214.475	你懂意思嗎?所以當你已經,女人已經給了,男人已經得到了,他也沒有說不娶你啊,我也會娶你啊,當然有的最後沒有娶啊,對不對?沒有娶,虧更大。就算有娶,我會娶你,你放心。但是他裡面就是有一個念頭說,我已經得到了,你要怎麼樣?什麼意思呢?
1215.725	1244.999	很多男性在還沒有得到之前千方百計想要怎麼樣討好對方配合對方的演出想要去改變自己去fit in那個女生可是當他得到之後他認為已經結案了結案了不用再改你懂意思嗎男生都聽得懂會心一笑對不對還沒有追到手之前怎麼樣怎麼配合在他面前當狗爬都無所謂
1246.408	1265.379	對不對,可是得到之後,我已經得到了,會娶你,會,不會拋棄你,會跟你在一起,可是呢,你會開始很明顯的缺乏改變你自我的一個動力。開始怎麼樣,這個東西會帶到你的婚姻以後,你會發現,你明明知道,
1266.357	1293.026	別人講或是聖經講或是牧師講說一個好丈夫一個好爸爸該是一個怎麼樣的形象可是你就會發現長期以來你已經缺乏那個動力了從什麼時候開始從你開始第一次發生婚前性行為那時候那一天就開始因為你就認為說不用改了我已經得到了我就這樣反正就這樣那還要怎麼樣對不對就這樣
1293.899	1320.631	聽得懂嗎?講這麼抽象的聽得懂,你們真有慧根。真的,所以你不要輕忽這些,我們待會兒都要來做這個禱告,把這些都該砍的都砍掉。有些弟兄就開始聽得懂我講什麼,真的,這麼多年來為什麼你老婆很希望你某些地方改一改,你改不了,就是因為你認為就已經這樣了,還有什麼好改的。如果時光倒轉,時光倒轉,你還在熱烈追求祂,
1322.295	1344.423	他叫你改,你一定會改,對不對?但是你現在為什麼不改了?因為就已經這樣了,還改什麼?薪水也給你,你還要怎麼樣?我也啤酒肚也都出了,你還要怎麼樣?所以親愛的弟兄姊妹,第四點怎麼樣?婚前的性行為﹐得手了之後,會讓一個男人﹐他失去了往後﹐改善
1345.776	1374.046	提升作為一個真正的男人的性別自我形象的一個動力。這個是虧很大的,這個男人們虧很大。以後你只能常常聽你老婆在跟別的姊妹抱怨,跟她的小豬長抱怨說,我們家那個實在是無夠嗨。你就永遠聽不完這些事情。第五點呢,很重要,弟兄們,你們不可以糟蹋神的女兒。
1376.032	1403.307	如果你看到這個女人,你知道她是神的女兒。你知道她老爸是,我問你,她老爸如果是天道蒙的會長,你敢隨便亂來嗎?你敢嗎?竹聯邦的老大的女兒,你敢隨便亂來嗎?你有幾根手指頭,我不知道。但如果你知道她是神的女兒呢?你就會敬重她,回去教我們的孩子,
1404.923	1430.446	或是跟自己分享,或是跟朋友分享。如果你能夠把每一個女人都看作她是上帝的女兒,你心裡面就會敬重她。你不敢隨便碰她的,因為她老爸是誰?是耶和華,你懂意思嗎?你不敢隨便碰她的。第六點呢,很重要是怎麼樣?因為我們的身體是聖靈的殿,
1433.148	1462.225	你有沒有去過一個旅館張嘻嘻的,你想去住嗎?你不想,送你都不要。我就想起來那個黃牧師跟我說有一次他受邀去馬來西亞去演講,結果那個接待單位不知道怎麼樣,安排了一個旅館,最高境界,那個旅館隔壁前後左右都是流鶯,然後他又帶著師母跟小孩,旅館張嘻嘻的,然後又擠又小又臭,然後到處旁邊都是一些有的沒有的聲音,他說實在是受不了,
1463.114	1491.606	他說送的錢都不要去住。所以他半夜就check out,天還沒有亮,他自己就check out,甘願自己去付錢,去住別的旅館,他也不要,免費他也不要住。也是一樣啊,保羅曾經講過一句很重要的話,他說沒有一種罪惡跟沒有一種汙穢,比身體所犯的罪惡跟汙穢更嚴重,因為我們的身體是誰要住的聖殿?聖靈要住的聖殿。
1493.046	1510.994	所以我們待會今天,我們要一起來禱告。不是現在,還沒講完,講營詞而已。神,我們要去思想,為什麼剛剛第一、二節好重要。我們再讀一次好不好。都是因為神的愛。第一跟第二節,所以你們該效法神。
1512.892	1530.325	好像蒙了什麼?慈愛的什麼?兒女一樣。也要憑愛來行事,正如基督怎麼樣?愛我們,為我們捨了自己,當作新香的貢物和祭物獻給神。神都知道我們以前怎麼樣,
1531.357	1551.805	神如果不知道我們以前怎麼樣,祂何必上十字架呢?神既然在我們都還不認識基督的時候,祂就已經先替我們上了十字架,代表祂早就知道我們的過去和我們的光景,以至於怎麼樣?祂知道最實際的辦法就是祂替我們死,好讓祂的新生命
1553.319	1577.729	來代替我們的救生命。因此,我們可以把我們的過去的所有和現在的軟弱都攤開在上帝的面前,都帶到十字架的面前,因為祂要把過去的一切都定在十字架上面,使我們怎麼樣?得到真正的自由,醫治跟釋放。好,所以請你跟隔壁的弟兄姊妹很誠懇的跟他講說,聖結非常的重要,來。
1585.009	1607.069	光一個吟詞,我們都可以講這麼多,妄語呢?第四節,吟詞、妄語、細笑的話都不相宜。什麼是妄語?妄語的原文就是愚昧的話,愚蠢的話。什麼是愚昧的話呢?詩篇裡面一直告訴我們有一種人,叫做什麼人?愚蠻人。
1609.377	1632.105	愚昧的愚,愚昧就算了。愚昧一直愚昧,講都講不聽就很頑固。簡稱什麼?愚丸人。跟隔壁講說千萬不要做愚丸人。要做鐵蛋人。不要做愚丸人。愚丸人是什麼意思呢?愚丸人就是他心裡面一直認為說沒有神。
1636.766	1664.311	我還不認識主。我還沒有經歷過救恩。因此我可以說沒有神。我們還可以理解。但是為什麼一個是神的兒女。基督已經替我們死了。基督的生命也在我們身上。我們為什麼還會說出慾望的話。為什麼我們還會說沒有神。妄語。慾望的話。這是基督徒生命裡面一個很大很大的困擾。
1666.783	1693.685	我們一起來看一下詩篇73篇好不好。你如果想了解為什麼基督徒,神的兒女心裡面會忍不住把那個妄語爆發出來,你就知道為什麼了。詩篇73篇。PPT幫助一下。詩篇就中間,聖經中間切一半,就是詩篇。不要把它切破就好。
1695.486	1720.698	好,詩篇73篇,很有意思,73跟37都是講這個魚丸人的事情。詩篇73篇第一節開始我們來讀,預備來,神實在恩待以色列那些清新的人。至於我呢?我的腳怎麼樣?幾乎失散,我的腳險些滑跌,為什麼?因為我見惡人,
1720.998	1743.479	和狂傲人想平安就心懷不平。他們死的時候也沒有疼痛,他們的力氣卻也壯實。他們不像別人受苦,也不像別人遭災。所以,驕傲如鏈子戴在他們的景象上,強抱像衣裳遮住他們的身體。
1743.899	1766.809	他們的眼睛因體胖而突出。這是最高境界。他們所得的,過於心裡所想的。怎麼這麼好?他們績效人,憑惡意說欺壓人的話,他們說話自高。他們的口褻瀆上天,他們的舌毀謗全地。這樣還沒問題,還可以享福。受不了。第十節說,所以,
1767.449	1791.899	神的名歸到這裡,喝盡了滿杯的苦毒之水。以至於神的百姓十一節說,神怎能曉得呢?至高者豈有知識呢?看啊,這就是惡人,他們既是常享安逸,財寶便加增。十三節,哇,越講越深去。
1792.739	1820.767	我實在突然竭盡了我的心,突然洗手錶明無辜,因為我終日遭災難,每一早曾受懲治。當一個人真的是氣到一個地步的時候怎麼樣?慾望的話就出來。這邊講了什麼慾望的話?上帝你有沒有長眼睛?
1822.551	1848.107	至高者,豈有知識呢?神啊,你在幹什麼?神啊,你是瞎了眼嗎?他講的就是講白眼,就是這樣子。然後呢?我幹嘛潔淨我的心啊?我幹嘛潔淨我的手?我跟他一樣就好了啊。我幹嘛當基督徒?臺語簡稱瞭然,什麼意思?瞭然。做神的女子,瞭然。
1849.94	1872.711	啊,十五節,他心裡面最奸詐的就是這一個十五節。我若說,我要這樣講,這就是以奸詐待你的眾子。就是說,他心裡面真的認為是這樣很生氣,他真的認為神不公平,不張眼。可是他真的要這樣講的時候,他覺得其他的神的兒女聽到的時候,人家會認為說,你講的不是事實。可是我的感受就是這樣。
1873.37	1892.123	所以第16節,他說,我思索只能明白這個事情,我眼看真的是非常的為難。17節,一直等到我進了神的聖所,思想到他們的結局,哇,你實在把他們都安在滑地。
1892.363	1892.703	所以,
1909.172	1931.617	因而我就心裡發酸,肺腑背刺。我這樣愚昧無知,在你面前如畜類一般。然而,我常與你同在,你摻著我的右手。我要以你的訓言引導我,以後必接我到榮耀。25節、26節,大家很熟的。
1931.937	1935.098	我們回到以弗所書。這個是妄語。
1962.176	1987.052	愚昧的話。我們剛講到一個人會講淫詞,或是心裡面會有神不喜悅的淫念,是因為他不知道,他忘記了他自己是誰,他是神的兒女,以至於他玷汙了自己,玷汙自己的心思意念,玷汙了自己的身分,玷汙了自己身體,是聖靈的玷。
1989.002	2014.042	一個人不認識自己﹐不珍惜自己是神的兒女的時候﹐他就會有言辭的問題﹐而一個人看不見神的時候﹐他就會有妄語的問題。可是神在﹐祂知道﹐對不對﹐剛剛詩篇七一三篇說我好為難﹐就是我心裡面真的覺得神沒有長眼﹐可是我又不敢跟弟兄姊妹講﹐因為弟兄姊妹一定會反對我﹐說神真的有長眼﹐
2015.265	2038.851	你懂意思嗎?所以妄語怎麼樣?常常是在心裡面積壓很久,積壓很久,積壓很久。有一天忍不住說出來的時候,大家說你不要亂講,就更生氣,跟大家辯論,然後就不來小組,就不來教會了。我看很多離開教會的人都是這樣子,因為他裡面對神的一個不滿,積壓很久,好不容易講出來,大家又
2039.616	2062.579	無感,你知道嗎?大家又不能體會他的煎熬,然後又叫他不要再講,他又很生氣,覺得你們基督徒都沒有愛心,假冒為善,我不要當基督徒了,就離開神了,這真的很可惜。親愛的弟兄姊妹們,妄語,妄語是因為一個人被負面的思想充滿了,以至於他看不到神真的在那裡。
