start	end	text
2064.082	2078.449	我們當中也許大部分人都不是像他們當時在60年代的原鄉,經歷那麼大的痛苦,整個族群被撕裂的痛苦,土地不見的痛苦,然後所有的尊嚴都不見的痛苦。
2078.449	2080.130	我們要不要求上帝給我們痛苦?
2081.305	2085.526	讓我們的禱告真實。
2085.526	2086.466	大概不會吧?
2086.466	2087.647	怎麼辦?
2087.647	2089.047	我發現有一個關鍵。
2089.047	2093.568	剛剛達夫斯牧師有介紹吉瓦斯阿婆。
2093.568	2097.629	他跟這位阿婆有長年的相處。
2097.629	2103.091	我們上山的時候,達夫斯牧師都是當他的翻譯。
2103.091	2112.711	吉瓦斯他在 那一場大復興當中沒有特別的角色,但是很快就被呼召成為代導的器皿。
2112.711	2156.990	他禱告了說他的身體、他的精神、他的靈性狀態,常常經歷到很大的內在的衝突,有上帝的話語在充滿,他又感受到許多邪惡的攪擾,是一場激烈的戰爭,有時候會很痛苦, 痛 真正的痛因為善惡的掙扎是很大的痛而且他每次在經過這種痛苦的時候他真的感受到教會軟弱的痛感受到教會軟弱的痛所以他的禱告無法停下來白天禱告 晚上禱告醒著禱告 睡著禱告禱告的時候不斷的流淚 因為他承受教會軟弱的痛苦。
2156.990	2179.981	弟兄姊妹,或許我們不應該去求其他痛苦,但是只要我們認真的求上帝的國度,願你的國降臨,只要我們認真的為教會禱告,只要我們認真的站在上帝的心裡這邊的時候,我相信我們自然會進入一種痛苦,這個痛苦是上帝要人悔改的痛苦。
2179.981	2190.896	提瓦斯阿婆沒有受過正式教育, 但是我們看到他47年來的禱告,他像一個非常成熟老練的牧師。
2190.896	2193.677	他講出的話,很多都是合乎聖經的。
2193.677	2204.002	我自己是神仙老師,我看得很清楚,神用特殊的方式在帶領他成為另外一種禱告的傳道人。
2204.002	2216.617	他發預言的時候,他的身上充滿了力量,那個不是他在說話,他成為一個管道, 上帝在使用她。
2216.617	2219.398	但是她也年老了。
2219.398	2221.099	她身上有許多的病痛。
2221.099	2227.241	她現在已經沒有辦法一個人出門。
2227.241	2231.922	我們去找她的時候,漸漸地發現這二十年的變化太大了。
2231.922	2239.325	她從一個屬靈的巨人,好像又變成原來一個軟弱的年長的夫人。
2241.886	2276.506	他長臉的病痛已經有時候他講話講不完整不是很確定他的意思他身上的劇痛他還是說他反映今天教會的痛苦在他的身上他的痛包括這些病痛都是教會的光景瘦弱體虛太少敬畏也太少感恩他的禱告是出於自身痛苦的呼求當我們看到他的時候他總是 會比較緩和一些痛苦,似乎未來有一些盼望。
2276.506	2282.909	謝謝你們來,謝謝我的弟兄姊妹,謝謝上帝參與你們來。
2282.909	2287.570	我們高興有機會去參加天母教會的70週年的感恩禮拜。
2287.570	2290.051	這些是臺灣神學院的學生。
2290.051	2293.753	我們也希望懇求上帝一代一代的興起。
2295.009	2302.556	我覺得我們的燈江教會﹐我們有很好的傳道人﹐我們也開始看到﹐我們需要有世代的預備。
2302.556	2316.648	如果我們有50歲這一代的﹐有沒有40歲這一代的﹐有沒有30歲這一代的﹐是不是我們需要代代的接棒﹐成為基督的精兵。
2316.648	2335.588	我還要特別提到這一位長老﹐石磊教會的長老﹐ 這位長老天生他沒有耳道,他從小因為聽不到聲音也不會講話,因為不知道聲音是什麼。
2335.588	2353.162	差不多16歲那一年,聖領復興運動來到十壘教會,他被拉著到禮拜堂裡面,被人群擠到前面,他說他在那一剎那,跟著大家在那裡禱告的時候,他看到光從天上打到他自己。
2354.309	2362.531	他突然聽到一個聲音,他也大叫出來,因為那是他人生第一次聽到聲音。
2362.531	2366.232	結果他是從這裡聽到,額頭。
2366.232	2375.254	上帝用他的額頭成為耳朵,具有耳朵的功能,從那天開始他就漸漸的學會講話。
2375.254	2387.773	上帝用他做了很多奇妙的工作,他也最喜歡參加各種步道傳聞的工作,甚至到海外宣教, 他今年已經離開世界。
2387.773	2396.478	我們真的沒有想到,六月我們這本書快要出版的時候,我們再去把那些重要的見證者再採訪一遍,看看我們所說的有沒有錯誤。
2396.478	2403.843	我們的同工跟他拍了一張相片,六月照了這張相片,不知道這是最後一張了。
2403.843	2405.924	七月,他離開世界了。
2406.903	2410.986	我們真的感受到時代越來越緊湊,時代越來越緊湊。
2410.986	2417.211	親愛的弟兄姊妹,我想我們要把握上帝給我們的恩典。
2417.211	2430.923	我在山上所聽到的一言最短,而且在我的心中經常被紀念的就是這樣一句話,不論你怎麼壞,我總是愛你的。
2430.923	2433.425	我們需要敬畏,需要感恩。
2436.049	2440.993	也提醒大家,我們即將進入20年代,明年就是2020。
2440.993	2449.179	再兩個禮拜,我們就逐漸的要跨年,就進到21世紀的20年代,20年代非常重要的十年,2020到2029。
2449.179	2453.282	弟兄姊妹,我們預備好了嗎?
2453.282	2462.109	我們淡江教會預備好了,要在20年代,讓我們的人生,當我們教會集體的一起發揮上帝國的力量。
2467.329	2470.851	智庫繼續地在推動教育。
2470.851	2484.697	下個學期我們有兩班,一班是大巴西流的聖靈論,這是教會歷史上第一本聖靈論,最早的一本聖靈論,由我來負責導讀。
2484.697	2492.621	另外是奧古斯丁有一本小書叫《論基督教教義》,由我們臺灣神學院的老師孫寶林教授來導讀。
2495.845	2512.777	我們還有兩個很特別的企劃,你在網路上很容易可以找到,莫特曼的生平已經在10月底上網,這是智庫跟一群同工合作的,叫做生命之路。
2512.777	2522.642	你只要打莫爾特曼就會跳出來,最好是加紀錄片,在YouTube打莫爾特曼紀錄片, 有正片跟花絮。
2522.642	2528.926	如果你看了花絮就了解為什麼會拍這個片子。
2528.926	2531.047	我們也希望繼續的推這本書。
2531.047	2534.510	今天我們有請同工帶一些書過來。
2534.510	2537.972	用比在市面上你能夠找到更低的價錢。
2537.972	2539.853	算是一種服務。
2539.853	2543.856	如果你需要書可以在門口跟我們同工來接洽。
2543.856	2546.477	更重要智庫想推動這個信息。
2546.477	2547.058	我們一起來念。
2547.790	2555.877	熱切期盼教會復興,準備迎接聖靈做工。
2555.877	2567.286	再次我們把這個經文再念一次,來。
2567.286	2573.090	我們要最後來唱一首回應詩,也在回應詩當中我們來禱告。
2573.090	2583.755	祂本來富足,卻為我們成了貧窮, 叫我們因他的貧窮﹐可以成為富足。
2606.254	2610.358	好不好,邀請弟兄姊妹從座位上站起來。
2610.358	2616.065	讓這個道令我們足以強大到我們也來回應。
2616.065	2619.028	這個時間是祢跟聖靈很重要的時間。
2619.028	2625.115	我們今晚團帶領大家的同時,大家把心打開,讓耶穌的榮光充滿在我們的當中。
2649.753	2653.916	你是我永遠的福分。
2653.916	2661.160	只想日夜在你殿中,獻上金棒。
2661.160	2667.864	盯緊在你的容美,試想一切變暗淡。
2667.864	2671.567	除你以外,我還能有誰。
2677.892	2688.701	祢是我永遠的福分,只想日夜在祢天中獻上敬拜。
2688.701	2699.289	定靜在祢的榮美,世上一切變黯淡,除祢以外,我還能有誰?
2702.705	2709.951	能不能﹐就讓我留在你的同在裏。
2709.951	2716.996	能不能﹐賜我力量﹐讓我更多愛你。
2716.996	2723.081	我哪都不想去﹐只想預言在你殿中。
2723.081	2728.665	獻上金牌﹐全心全意來愛你。
2733.080	2734.180	能不能。
2734.180	2734.680	能不能。
2761.288	2794.934	能不能﹐ 能不能﹐就讓我留在你的同在裏。
2794.934	2802.321	能不能﹐賜我力量﹐讓我更多愛你。
2802.321	2815.112	我哪兒都不想去﹐只想日夜在你天中﹐攜手敬拜﹐全心全意來愛你。
2815.896	2817.957	阿爸天父,我們來到祢的面前。
2817.957	2829.104	主,當我們遇到神聖的時候,主,我們真是想屈膝敬拜。
2829.104	2837.508	主,我們是何等的軟弱,何等的無愧。
2837.508	2843.952	願祢憐憫我們,我們經常是活在罪惡裡面的人。
2843.952	2869.890	主,我們感謝祢, 祢不以我們這樣的污穢、罪人為外人,祢願意接納我們,讓我們經歷到祢放棄祢的護足,為我們成為貧窮,讓我們活在貧窮裡面的人也可以護足。
2869.890	2883.326	主我們獻上滿心的感謝,主願祢讓這個敬畏, 這個感恩經常在我們的心中。
2883.326	2890.210	讓淡江教會成為敬畏的教會,也是感恩的教會。
2890.210	2895.173	主,我們不敢忘掉我們是有罪的人。
2895.173	2902.297	每次祢神聖的臨到,我們就知道我們仍然是有罪的人。
2902.297	2907.860	主,我們特別在我們的敬畏當中有很深的感謝。
2908.882	2914.767	像我們這樣子,這麼軟弱的人,主祢願意來找我們。
2914.767	2919.451	祢放下祢的富足,為我們成為貧窮。
2919.451	2926.937	我們真是滿心的感謝,因為祢叫我們的貧窮變成富足。
2926.937	2934.304	主賞賜我們教會,能夠成為一個悔改的教會。
2934.304	2942.134	我們在不斷的敬畏, 不斷的感恩,不斷的感恩,不斷的敬畏中。
2942.134	2944.016	我們真的是居住在你的家。
2944.016	2950.720	我們不只被你改變,我們的生命是有定向的。
2950.720	2953.842	阿爸天父,我們要回家。
2953.842	2957.625	願你帶領我們弟兄姊妹一起來回家。
2957.625	2960.027	我們再次唱副歌兩次,能不能?