start	end	text
1656.383	1667.213	我就想到我在我第二個教會那時候當傳道人的時候,我每次都要負責接待一位從國外來的所謂的先知性恩賜的一個牧師。
1667.213	1671.717	我每次都被排到接待他,可是我很不喜歡他。
1673.097	1674.818	我非常不喜歡他。
1674.818	1681.060	每次全教會,全教會人都被他發過預言之後,他就一直問說,還有誰沒有?
1681.060	1682.040	還有誰沒有?
1682.040	1682.500	就是誰?
1682.500	1684.401	就是我。
1684.401	1687.021	就是不去,就是不去,你懂意思嗎?
1687.021	1690.563	可是因為我接待他緣故,所以我就一直要在他旁邊。
1690.563	1694.864	所以他對每一個人怎麼樣的服事,我都看在眼裡。
1694.864	1706.526	我只是很好奇,說世界上有這種事情,世界上有這種事情可以講這麼準的, 我就非常的驚訝,我打開了我對聖靈的恩賜的一個眼界。
1706.526	1714.269	我就回家自己練習,我雖然不給他服侍,可是我回家偷偷自己練習,真的是有夠糟糕,你看。
1714.269	1731.717	我就發現怎麼樣,雖然我不是很喜歡這位牧師,雖然我覺得他的個性跟我天南地北,可是神就很奇妙的,讓我透過服侍他的過程裡面, 讓祂把祂的恩賜也停留在我的身上,也傳承給我。
1732.244	1750.753	弟兄姊妹,我跟你講,真的是神要把恩賜給人,都用一些很,常常會用一些特別的,像在Good TV那時候我很渴慕對不對,我渴慕這些怎麼樣,對神話語的認識,但是靈恩的這部分呢,我都不是很渴慕,可是神就偏偏怎麼樣,就透過人把祂給我。
1750.753	1764.739	我再舉個例子,有一次呢,我去被一個牧師服侍,那個牧師也是為我就是發預言,發預完之後,他就按手要讓我倒, 我就鞭不倒啊。
1764.739	1767.300	就他在那邊。
1767.300	1772.181	我就一直。
1772.181	1773.902	我就想說你這個人很奇怪。
1773.902	1779.424	我就想到這個總統夫人對總統說的,很奇怪耶。
1779.424	1781.564	我就沒有要倒啊,你為什麼要推我呢?
1781.564	1784.485	難道你把我推倒之後,你會比較有信心嗎?
1784.485	1788.206	所以我對他的服飾非常的不喜悅,在推人。
1788.206	1789.287	我最討厭被人家推。
1792.278	1802.921	可是呢﹐他雖然推我不高興﹐可是呢﹐他對我所發的預言﹐後來都實現了。
1802.921	1807.722	那時候我還在臺中募會﹐那個教會很小﹐只有30個人。
1807.722	1814.604	他為我發預言的時候﹐我太太可以作證﹐她說﹐將來你要管理一間很大的教會﹐你不要小看你自己。
1814.604	1818.005	我那時候想說﹐不用了﹐我在逢甲吃夜市就好了。
1818.005	1826.884	弟兄姊妹﹐ 有什麼人他的恩賜傳承在你的身上呢?
1826.884	1840.261	教導的恩賜、輔導的恩賜、治理的恩賜、話語的恩賜、禱告的恩賜、信心的恩賜、醫病的恩賜、趕鬼的恩賜、敬拜的恩賜。
1842.961	1854.486	這禮拜一樣,你去回想﹐有哪一些人﹐神透過他們﹐把恩賜﹐把他們﹐神給他們的恩賜﹐也停留在你的身上。
1854.486	1856.807	第三個是什麼﹐產業的傳承。
1856.807	1859.748	產業講到怎麼樣﹐事奉的果效。
1859.748	1885.456	我第一個想到是誰﹐我第一個想到就是國倫牧師﹐我有沒有從他那邊領受產業的傳承﹐有啊﹐產業我講是事奉的成果﹐ 我非常感謝他,我非常感謝他,因為是他非常的接納我,讓我從很年輕的時候,我就有服事的空間。
1885.456	1889.518	我記得說在老街的時候,我就常常站講臺。
1889.518	1894.942	那對於一個新來的人來講,是非常不太可能的機會。
1896.374	1929.677	那我還記得那時候就是他有一次很嚴肅的問我就是說他覺得神他覺得他很想去臺中發展他就跟我說那如果淡江教會交給你然後我去臺中可以嗎我說我回去禱告禱告回來之後我跟他說不可以結果最後變成是我去臺中你知道嗎他留淡江教會那你可以看見說其實後來到後來我從臺中又回來了 然後慢慢的就是接教會這樣。
1929.677	1937.301	我就覺得說,其實我如今的一個很重要的產業的傳承,就是從國倫牧師來的。
1937.301	1948.246	雖然我們只差一歲,雖然我們像朋友一樣,但是我沒辦法否認的就是,也是非常感恩的就是,產業的傳承,它有一份。
1948.246	1951.448	它在我生命裡面有一個非常這樣的重要的一個角色。
1952.329	1959.132	有誰是你產業的傳承的上游呢?
1959.132	1968.196	你現在的一個服事的成果、服事的空間、服事的機會是上帝透過誰把你帶進這個領域呢?
1968.196	1970.958	這個非常的重要。
1970.958	1974.820	另外一個是看不見的一個產業的傳承。
1974.820	1978.441	我剛剛講到這個產業指的是怎麼樣?
1978.441	1979.622	是事奉的成果。
1980.538	1983.502	有看得見的,也有看不見的。
1983.502	1985.625	看不見的部分我要講一個。
1985.625	1991.593	有一群人,又是一群人,我姑且稱他為存在主義神學家。
1991.593	1997.380	這些人在我的生命裡面,他們的產業有停留在我身上。
1998.404	2001.608	什麼叫存在主義神學家呢?
2001.608	2010.559	我用最簡單的例子,我最喜歡講的一個,就是雅各在雅伯河渡口跟神摔跤,那段經文我跟各位講過。
2011.937	2014.798	雅各的意思是什麼?
2014.798	2017.019	是抓取,大家都知道。
2017.019	2018.780	那雅伯的意思怎麼樣?
2018.780	2019.841	就是放空。
2019.841	2021.662	一個是抓,一個是放。
2021.662	2027.504	然後在那邊跟神摔跤,那個摔跤那個字就是怎麼樣?
2027.504	2032.247	就是這邊拔河,在那邊天人交戰。
2032.247	2038.410	那這三個字,它在希伯來的這個字裡面,它的字根長得非常的像。
2039.497	2043.260	所以呢,就是一個線索。
2043.260	2046.022	這三個字在玩文字遊戲。
2046.022	2047.924	它是三個重要的線索。
2047.924	2049.825	好啦,講重點了。
2049.825	2062.800	重點就是, 一生只要拼命要抓,拼命要抓,拼命要抓的雅各,今天終於到亞伯渡口了,神都把這個渡口給他取名叫亞伯了,就是要叫你放手,還有什麼聽不懂的嗎?
2062.800	2064.000	還有什麼看不懂嗎?
2064.000	2083.770	就放手啊,就放手啊,就乖乖享福啊,就像你的祖父亞伯拉罕的那麼的享福,就像你的父親以撒那麼的享福就好,你這個雅各為什麼偏偏不聽話,一生就要抓,還要抓,講不聽,特立獨行,搞自我, 你就享福就好了,還敢跟神摔跤。
2083.770	2085.495	你看嘛,最後摔得鼻青臉腫。
2088.131	2096.475	我們在看雅各在亞伯渡口跟神摔跤那段經文的時候,我們最理所當然認為該看到的結局是什麼?
2096.475	2112.903	就是這個雅各被神狠狠地摔在地上,痛得爬不起來,雙手一放說,神啊,我再也不敢了,主啊,我就乖乖做亞伯拉罕,我就乖乖做以撒,我不要做我自己,主,你要我怎麼樣就怎麼樣,我放手,我全都放。
2112.903	2114.404	故事的結局根本不是這樣。
2117.244	2120.747	故事的結局是天要亮了。
2120.747	2123.169	神要走了。
2123.169	2127.893	雅各緊緊抓住神的大腿,不讓他走。
2127.893	2133.778	他已經被摔得這麼慘,他還是抓。
2133.778	2135.339	神說你叫什麼名字?
2135.339	2139.102	我叫雅各,抓抓抓。
2139.102	2140.804	神說不要再叫雅各,要叫以色列。
2142.312	2150.009	因為你與人與神struggle,你與神摔角,你也得勝了。
2150.009	2151.092	這故事告訴我們什麼?
2153.063	2164.152	告訴我們,第一,雅各非常清楚地意識到他的生命特質,他自己真實的人生跟亞伯拉罕不一樣,跟以撒不一樣。
2164.152	2177.102	他很認真在面對自己生命的問題,這是屬於雅各自己最真實的對自己生命光景的認識,是別人的故事不能取代的,那是他的人生,他的人生走到一個困境。
2177.722	2181.985	他想要在這個困境裡面,真的找出一條答案來。
2181.985	2185.608	他想要在他的生命裡面,真的找出一條出路來。
2185.608	2188.350	以至於他跟神那麼認真的在那邊周旋。
2188.350	2190.712	他跟神摔角,不是為了要得勝。
2190.712	2195.496	他跟神摔角,也不是為了要彰顯他自己有多強、有多驕傲。
2195.496	2201.281	他跟神摔角,是因為他想要抓住神,讓神帶領他走出他生命的渡口。
2203.746	2215.334	這一種對生命﹐對自己光景黑暗﹐對自己生命是破碎的﹐對自己生命是軟弱的這一種承認。
2215.334	2219.577	雖然承認﹐但是又不放棄。
2219.577	2226.862	說主是我生命就是軟弱﹐主我生命過去很多破口﹐是﹐是的。
2226.862	2232.266	承認﹐但是主我就是要抓死你﹐因為只有你可以帶我走出去。
2233.609	2237.130	神說不要叫雅各,要叫以色列。
2237.130	2242.212	你愛抓,是你愛抓,因為我創造你,讓你愛抓。
2242.212	2244.233	這是你的特質。
2244.233	2246.654	所以你叫雅各,不是嗎?
2246.654	2256.238	可是你只是沒有人帶領你,沒有神帶領你,所以你常常抓錯東西,你要抓就來抓神吧。
2256.238	2257.178	這是一個標準的。
2258.456	2262.883	非常標準的存在主義神學家的解經方式。
2262.883	2267.429	吳老師在現場,可能我的畢業證書要被收回去了。
2267.429	2298.523	但是因為我的人生是如此, 我的人生所遇到的光景,經歷過各種的軟弱,經歷過曾經去自殺,經歷過看見自己曾經是如何的黑暗,軟弱,弱魄,潦倒,非常知道自己就是坐在亞伯渡口,那個最軟弱,最害怕,最孤獨的雅各,發現自己是這樣,承認自己是這樣,當神來的時候,就緊緊抓住神說,主啊,我既是這樣,那你要怎麼救我出去呢?
2301.135	2305.798	這是存在主義神學家他們一生最關切的事情。
2305.798	2307.559	承認自己在黑暗裡。
2307.559	2309.119	承認自己在軟弱裡。
2309.119	2311.501	但是又要緊緊抓住神。
2311.501	2313.882	因為這是我最真實的人生。
2313.882	2319.425	所以存在主義神學家最看重的、最強調的就是自己真實的生命經歷。
2319.425	2325.889	自己真實的與主相遇的經歷。
2325.889	2328.350	這一份產業我也領受了。
2329.858	2332.599	它不斷地表現在我的講臺裡面。
2332.599	2335.060	不斷地表現在我的牧羊裡面。
2335.060	2342.242	不斷地表現在我對教會的看法﹐對國度的看法裡面。
2342.242	2343.582	今天講這麼多呢?
2343.582	2345.063	請金麥團上來好嗎?
2345.063	2355.486	弟兄姊妹來教會到底你得到什麼?
2355.486	2356.566	我們可以回想一下嗎?
2358.439	2369.603	有誰的生命,到如今仍然停留在你的生命裡面。
2369.603	2374.365	有誰的生命,傳承在你的生命裡面。
2374.365	2384.288	當你默然回首的時候,你發現,原來,原來我的生命,一直被一個人生命的榜樣影響。
2384.288	2386.569	那個人不完美,你知道的。
2387.602	2405.178	可是你無可否認的是,祂那一份生命的認真,祂那一份信仰生命的真實,祂那一方面信仰生命的一個執著,深深的停留在你的生命裡面。
2405.178	2412.365	這禮拜回去之後,你要為這個感恩,並且為影響你的人來禱告。
2414.957	2421.581	願神繼續使用祂,影響更多的人,像你一樣。
2421.581	2427.485	但話說回來,那你的生命要傳承給誰呢?
2427.485	2441.494	你的生命裡面的哪一份,你的根基,哪一份在你的生命裡面,你信仰裡面最寶貴的那一份根基,是什麼呢?
2441.494	2442.775	你又要傳承給誰呢?
2444.360	2446.941	我們今天談到恩賜。
2446.941	2449.521	恩賜是侍奉的能力。
2449.521	2452.802	你可以去思考去回想。
2452.802	2453.122	有誰?
2453.122	2455.522	神曾經透過誰?
2455.522	2461.044	神曾經透過哪一些人?
2461.044	2464.364	讓這個恩賜被你領受。
2464.364	2467.505	讓這個恩賜傳承到你的裡面。
2469.155	2475.177	你有沒有善盡管家的責任,操練這個恩賜,使用這個恩賜來服侍神呢?
2475.177	2479.239	還是你一直荒廢那個恩賜,還是你把它閒置在那裡?
2479.239	2481.560	我跟各位講,八月我要搬家,我的鄰居是誰?
2481.560	2485.682	馬街啊,我打開窗戶看到就是馬街的墳墓。
2485.682	2489.483	我說主啊,你要提醒我,也提醒到最高境界了。
2489.483	2496.546	神在提醒我們一件事情,寧可燒盡,不願朽壞。
2496.546	2502.487	神如果已經透過有些人, 把祂的恩賜傳承給你了。
2502.487	2506.150	你為什麼要放著讓祂生鏽呢?
2506.150	2534.757	保羅對提摩太說不要輕忽以前長老還有我為你按手的時候為你所說的預言所傳承給你的恩賜你如今要如火的眺望起來因為我們所領受的不是膽怯的心乃是剛強仁愛謹守的心 神透過哪些人﹐把侍奉的產業也傳承給你呢?
2534.757	2536.938	你要感恩。
2536.938	2548.960	但是你是否願意在主的面前束緊腰帶﹐戰戰兢兢的說﹐主,祢的僕人在這裡﹐求祢使用我。
2548.960	2554.661	讓祢的產業﹐可以生養眾多﹐遍滿地面﹐治理這地。
2558.763	2569.996	弟兄姊妹,這禮拜如果你不好好去思考這三個問題,去回想這三個問題,你的信仰會變成一個只是每個禮拜來教會消費而已。
2571.766	2575.729	你的信仰是一個個人的信仰,消費的信仰。
2575.729	2580.652	所謂個人信仰就是說,我只管我,其他我都不管。
2580.652	2587.417	什麼縱向的傳承,橫向的什麼分享,我不管,我只管我自己,我只在乎我自己。
2587.417	2588.617	什麼叫消費?
2588.617	2593.320	消費就是說,我有付代價,我有奉獻,我有食衣,我有花時間來崇拜。
2594.667	2597.749	我就一定要得到值回票價的享受。
2597.749	2600.230	看臺上那個人,又唱又跳又叫的。
2600.230	2602.071	哇,今天嗯,算是有值得票價。
2602.071	2604.172	好,可以了,回去了。
2604.172	2606.713	哇,今天牧師講得讓我好感動喔!
2606.713	2609.494	流淚,流淚完,嗯,好,回去了。
2609.494	2612.156	啊,今天送牧師來喔,好好笑啊,想說肚子好痛喔。
2612.156	2613.817	啊,回去了。
2613.817	2615.798	這叫消費。
2615.798	2619.459	我們的信仰不是個人,也不是消費形態的。
2619.459	2630.363	我們的信仰總是要去思想到,在我生命裡面, 有誰的生命如今仍然停留在我的生命裏。
2630.363	2635.405	有誰的恩賜如今仍然停留在我的恩賜裏。
2635.405	2640.027	有誰的產業如今仍然停留在我的產業裏。
2640.027	2642.908	所以呢我該做什麼辦呢?
2642.908	2646.690	我該如何繼續傳承下去呢?
2646.690	2651.092	我們一起來唱這首歌好不好?
2651.092	2656.801	一生愛你這位寶貴的耶穌 祂值得你用一生來愛祂。
2656.801	2667.369	祂值得你一生繼續的讓生命恩賜產業。
2667.369	2669.171	你要不斷的領受。
2669.171	2671.873	而且不斷的要把它流傳出去。
2671.873	2674.415	不要成為一個個人式的信仰。
2674.415	2678.078	也不要成為一個消費型態的聚會生活。
2678.078	2680.159	那不是神要給你的。
2680.159	2682.781	那個是非常的淺薄的。
2682.781	2683.922	非常的有限制的。
2684.633	2685.846	我們用這首詩給我們來回應