start	end	text
0.009	3.832	我們去採接的時候,我們這個鼓隊也會一起出去。
3.832	4.712	非常感謝神。
4.712	7.414	還有我們那個跳舞隊也會出去。
7.414	9.515	很多人說,教會幹嘛打鼓跳舞呢?
9.515	12.117	你一定是沒有讀聖經才問這個問題。
12.117	14.599	從舊約的時候就不斷地告訴我們怎麼樣?
14.599	16.740	要擠鼓跳舞來讚美神。
16.740	21.984	很多人想說鼓都是那個陣頭在用的,就是因為這樣才要把它奪回來。
21.984	23.505	跳舞也是一樣。
23.505	29.769	以前的人都是大衛,黃牧師最喜歡,那個我記得黃牧師最喜歡講那一段,就是大衛有沒有,去贏那個約貴有沒有。
30.009	33.392	怎麼樣跳舞跳到那個內褲都被人家看到有沒有。
33.392	34.914	他最喜歡講這一段,為什麼?
34.914	39.017	因為一個人他在神的面前,他忘我的敬拜的神。
39.017	66.049	他用各樣的方式,擊鼓跳舞還有揮舞得勝的驚奇,用各樣的失足的樂器,用早上敬拜團的 這樣的一個敬拜,用我們禱告的服事,用我們去發面子的服事,用我們去採接行軍,用我們有這個平安久久,福氣大神,用歌仔戲,用圓遊會,用這個愛心的便當,用各樣的方式,消災解厄,用各樣的圓遊會,就是要怎麼樣?
66.049	71.690	來尊榮我們的神,來代表耶穌基督,把祂的平安,真實的帶到這個地上來。
71.690	80.997	弟兄姊妹,整個中元節需要我們的參與, 弟兄姊妹跟你隔壁講說一起去跳舞。
80.997	83.800	以前都是中元節都是怎麼樣?
83.800	86.483	燒金紙、燒金鑽。
86.483	87.163	但是我們怎麼樣?
88.012	90.214	我們要發面子啦。
90.214	91.975	燒金子大家是怎麼樣?
91.975	93.857	避之唯恐不及。
93.857	95.078	但是發面子怎麼樣?
95.078	95.999	大家怎麼樣?
95.999	97.560	都會非常的喜歡。
97.560	101.404	這次我們要發行就甘心面子的第二版。
101.404	102.985	大家敬請期待。
102.985	106.108	感謝主,我們一起來打開我們的聖經。
106.108	110.592	我們請同工,有需要聖經的人可以揮揮手。
110.592	111.813	請同工可以把聖經給你。
126.903	160.340	我們一起來讀一段經文是在提摩太前書4章11到16節提摩太前書第4章11到16節今天要分享的一個主題是見證與傳承見證與傳承提摩太前書第4章第11節到第16節 好,我們翻到了,我們一起來讀,預備,來。
160.340	164.842	這些事,你要吩咐人,也要教導人。
164.842	175.928	不可叫人小看你年輕,總要在言語、行為、愛心、信心、清潔上,都做信徒的榜樣。
175.928	181.931	你要以宣讀、勸勉、教導為念,只等到我來。
182.671	193.398	你不要輕忽所得的恩賜,就是從前藉著預言,在眾長老按手的時候賜給你的。
193.398	201.704	這些事,你要因情去做,並要在此專心,使眾人看出你的長進來。
201.704	214.107	你要謹慎自己和 因為這樣行,救自己,又能救聽你的人。
214.107	219.030	今天牧師要分享的主題是見證與傳承。
219.030	229.116	主要是講到說,我們看到有許多各樣方面的見證,而這樣的見證是需要延續下去的,是要傳承下去的。
229.616	234.239	今天牧師主要要跟各位來分享有三個方面的見證與傳承。
234.239	237.622	第一個是生命的見證與傳承。
237.622	240.684	第二個是恩賜的見證與傳承。
240.684	244.266	第三個是產業的見證與傳承。
244.266	252.673	所謂的生命的見證與傳承講到就是讓我們羨慕的生命,生命的榜樣。
253.985	270.111	生命是事奉的根基,沒有一個生命的榜樣,沒有一個屬靈的生命,那所有的事奉,它就是沒有根基,它就是建造在沙土上的,風一來,水一來,就垮了。
271.425	274.908	生命的見證,生命的傳承。
274.908	281.774	我們剛剛所讀的這個經文,第一小段所談的就是生命的傳承,生命的見證。
281.774	285.578	他說,這些事你要吩咐人,也要教導人。
285.578	289.261	不可叫人小看你年輕,總要在怎麼樣?
289.261	296.107	言語,行為,愛心,信心,清潔上,都做信徒的什麼?
296.107	296.487	榜樣。
297.108	301.210	你要以宣讀、勸勉、教導怎麼樣?
301.210	304.031	為念,只等到我來。
304.031	316.877	榜樣,我想我們很多人,你身上都停留了,也領受了,也擁有了,有一些人給你的生命的榜樣。
316.877	321.358	有一些人生命的榜樣已經停留在你身上了。
321.358	336.531	有一些人生命的見證,他的榜樣, 他整個信仰生命的根基,無形之中,你也從他那邊領受了,這樣的一種生命信仰的元素在裡面。
336.531	340.956	這個是大本牧師所第一要談的,生命的傳承。
340.956	345.280	生命非常的重要,生命是我們侍奉的根基。
345.280	348.082	跟隔壁講說,生命是侍奉的根基。
351.749	354.414	剛剛談到了生命的傳承。
354.414	355.837	第二個是怎麼樣?
355.837	357.921	是恩賜的傳承。
357.921	362.209	第二段經文他說,你不要輕忽所得的什麼?
362.209	362.229	恩賜。
363.780	388.424	就是從前藉著預言在眾長老按手的時候所賜給你的恩賜也是非常重要的恩賜也是需要不斷的一代一代的傳承下去恩賜指的是侍奉的能力我們剛講到生命是我們這個人侍奉的根基 生命也要從一個人傳承,一直往下傳承。
388.424	390.566	當然我們知道生命的源頭是誰?
390.566	391.506	是上帝。
391.506	398.572	但是上帝把祂榮耀的生命,基督把祂榮耀的生命,透過一些人傳承給你。
398.572	402.354	透過一些人成為管道,流到你的生命裡面。
402.354	404.976	更重要的是要停留在你身上。
404.976	413.783	為什麼這些生命的傳承,恩賜的傳承, 要透過人傳遞給你,並且停留在你身上。
413.783	414.783	為什麼呢?
414.783	418.666	因為要繼續透過你,再往下傳承下去。
438.439	441.802	這邊講到一個產業的傳承。
441.802	443.603	產業的傳承所提的是怎麼樣?
443.603	445.285	是侍奉的成果。
445.285	448.067	這個產業是侍奉的成果。
448.067	451.830	這個侍奉的成果不能只在那個人身上就停止的。
451.830	453.932	必須要傳承給其他人。
453.932	458.116	叫其他人領受之後,讓這個產業繼續怎麼樣?
458.116	458.997	擴張。
458.997	461.599	讓這個侍奉的成果繼續怎麼樣?
461.599	462.720	延續。
462.720	463.761	這個就非常的重要。
464.241	468.467	因此,又能救自己,又能救聽你的人。
468.467	471.391	弟兄姊妹,原來服事是什麼?
471.391	476.739	你認為一個人投入服事,誰得到最大的幫助?
477.671	482.214	自己,非常好,你們都真的是有牧師平常講有聽進去。
482.214	485.997	我們講到生命是侍奉的根基。
485.997	488.579	恩賜是侍奉的能力。
488.579	491.561	產業是侍奉的成果。
491.561	494.523	再講一次,生命是什麼?
494.523	495.683	侍奉的什麼?
495.683	496.724	根基。
496.724	498.826	恩賜是什麼?
498.826	500.327	侍奉的能力。
500.327	503.369	然後產業呢?
503.369	504.850	跟隔壁複習一下,預備,來。
512.022	516.588	快聽不下去了。
516.588	518.750	振作一下。
518.750	520.552	來,生命是什麼?
520.552	522.455	侍奉的根基。
522.455	525.058	恩賜呢?
525.058	525.619	產業呢?
527.637	531.579	很好,大家都講得很好,小朋友都背起來了,感謝主。
531.579	554.333	那今天牧師就要用自己的生命的見證和我的經歷來講我從哪一些人身上領受了生命的傳承,領受了恩賜的傳承,領受了產業的傳承,它對我的生命造成何等的影響,以至於我想要 把什麼樣的生命傳承出去。
554.333	557.637	我想要把什麼樣的恩賜再傳承出去。
557.637	560.721	想要把什麼樣的產業傳承出去。
560.721	563.325	所以今天的主題叫做見證與傳承。
564.548	572.970	我在回想,昨天在回想,到底在我生命裡面,有誰曾經用他的生命影響過我的生命?
572.970	577.091	有誰曾經用他的生命澆灌了我的生命?
577.091	582.172	我的生命裡面,到底有誰的生命停留在我的生命裡面?
582.172	587.793	我昨天就在回想,就想到以前幾個影響我非常重要的這些牧者。
589.292	594.397	我覺得第一個我想到的就是我跟我太太結婚的那個教會。
594.397	596.458	那個牧師叫做曾牧師。
596.458	598.861	他的印象讓我非常的深刻。
598.861	606.207	因為他常常用《撒摩爾記》上22章第二節來跟我們分享勉勵。
607.108	610.951	沙漠爾記22章第二節講到有一個人叫做大衛。
610.951	615.634	大衛他因為被掃羅嫉妒,他就開始怎麼樣?
615.634	616.195	去逃難。
616.195	619.677	他逃難的時候,有400個人怎麼樣?
619.677	621.379	來跟隨他。
621.379	623.160	這400個人怎麼樣?
623.160	625.562	他的聖經說他都是怎麼樣?
625.562	631.406	心裡窘迫的、欠債的,還有心生不滿的。
631.406	634.128	原文就是有三種人來追隨大衛。
634.128	635.189	第一種就是沮喪的。
636.425	638.767	他對他自己的生命失望。
638.767	641.730	他對他自己的生命很沮喪。
641.730	645.934	不僅是外面沮喪,裡面可能也憂鬱了,也沮喪了。
645.934	648.277	這種沮喪的人來跟隨大衛。
648.831	656.913	第二種是欠債的,他可能真的是欠人家很多錢的,他也可能欠虧負的很多人,這叫欠債的。
656.913	666.016	這個欠人家錢的也好,或是在感情上虧負人,在承諾上虧負人,他欠了很多人,看得見,看不見的債的。
666.016	669.477	這種人也來跟隨大衛,投靠大衛。
669.477	670.577	第三種怎麼樣?
670.577	671.778	是心裡不滿的人。
672.398	675.340	心裡不滿的人,憤世嫉俗。
675.340	678.123	覺得他今天會變成這樣,就是全世界大家都害他。
678.123	679.724	他覺得怎麼樣?
679.724	682.647	他很生不逢時。
682.647	686.890	他覺得他裡面很多的傷害,憤怒,沒有辦法宣洩。
686.890	688.972	這三種人來投靠大衛。
688.972	689.993	弟兄姊妹你知道嗎?
689.993	692.575	後來大衛終於做了王,對不對?
692.575	694.296	他就是靠這400個人起家的。
694.957	696.699	大衛的本事是什麼?
696.699	699.282	他就把這400個土匪,怎麼樣?
699.282	701.264	變成精兵勇士。
701.264	704.508	以前我們常講說,來教會都是什麼人?
704.508	705.709	罪人,對不對?
705.709	711.216	但是我那個第一個牧師跟我講說,其實玉民啊,來教會的不只是罪人,來教會都是怪人。
713.237	714.097	都是怎麼樣?
714.097	715.278	沮喪的。
715.278	716.078	都是怎麼樣?
716.078	717.059	欠債的。
717.059	717.959	都是怎麼樣?
717.959	719.500	心懷不滿的。
719.500	726.783	真的以前在我那個第一個教會,這個牧師他的生命有一個特質深深的影響我。
726.783	730.825	他專門去收集、召聚這些怎麼樣?
730.825	732.025	沮喪的。
732.025	736.687	專門去接待、去帶領這些怎麼樣?
736.687	737.548	欠債的。
737.548	738.568	還有怎麼樣?
738.568	740.129	還有這些心裡不滿的。
740.828	745.292	我真的是被他的生命深深的影響。
745.292	756.644	他常常教導我一個觀念,他說你不要看他現在這個人是這樣,他以後如果被神恢復了,被神復興了,不得了啊,是人才。
756.644	761.761	他常常跟我講說這個是人才,我想這個人叫人才, 不得了。
761.761	762.342	你知道嗎?
762.342	768.689	在祂的帶領之下,有很多的人,他真的被神恢復了,被神復興了。
768.689	778.440	我看見有一個童工,後來成為很大能的一個童工,他原本是雙性戀, 他有很嚴重的雙性戀的困擾。
778.440	782.444	但是他被這個教會接納,被這個牧師接納了。
782.444	784.686	他成為400個怪人其中一個。
784.686	785.267	後來怎麼樣?
785.267	786.849	他被主復興了。
786.849	789.431	成為一個非常有恩高的一個同工。
789.431	790.933	我看見有人怎麼樣?
790.933	792.495	他是真的是欠債的。
792.875	820.026	卡奴,好多這個銀行欠債的,破產的,全家都破產的也有,還有這什麼樣,家庭破產的,婚姻破產的,什麼破產的人都有,還有開車撞死人的,被抓去關的,各種困難,各種問題,什麼人都有,包含了有兩個,也是怪咖,一個叫莊育民,一個叫鄭惠美。
820.026	823.836	這位牧師的生命, 傳承到我的生命裡面。
823.836	834.480	他不斷地告訴我,這些人都是神的兒女,這些人只要被恢復了,他有一天就不是這樣了,包含我這個人。
834.480	851.720	我那個時候在那邊的時候,真的是窮途潦倒,光景非常的差,但是這個牧師,他就不斷地鼓勵我, 你們還記得牧師曾經跟你們分享過,我被安立為牧師之後,我第二天就求問神,主啊,你要我當一個什麼樣的牧師。
851.720	858.542	神就說成全聖徒,各盡其職,叫基督的身體怎麼樣,可以長成。
858.542	863.883	我覺得這個我就是深受那位曾牧師的影響。
863.883	868.505	曾牧師非常有勇氣,他敢於給同工服事的機會。
869.411	872.993	很多人就憂心,我們組長現在一下子變那麼多人。
872.993	881.818	一年多前只有十幾個組長,現在組長,現在小組五十幾個,加夫婦的組長加起來,組長將近八十個人。
881.818	884.940	這樣子品質可以嗎?
884.940	885.921	跟得上進度嗎?
885.921	888.282	弟兄姊妹,不要這樣想。
888.282	893.746	人只要運作的心,有可慕的心,神就復興你,神就使用你。
893.746	902.730	我記得那時候,我 那個牧師在呼召服侍的時候,我跟各位開過玩笑,我生平第一個服侍是什麼?
902.730	904.851	就是陪人家睡覺。
904.851	913.955	就是我們教會有一個大學生,他有躁鬱症,怎麼晚上都不睡覺,哇,就弄得昏天暗地的,家長很痛苦。
913.955	923.106	那牧師就徵召說,有沒有現在剛好沒工作的, 然後又是男生,然後又可以這個人要跑出去的時候,把他押住,不要讓他跑出去。
923.106	924.386	有沒有這樣的人?
924.386	926.748	看來看去全校會只有莊玉敏。
926.748	927.829	因為那時候怎麼樣?
927.829	929.730	沒有工作,在找工作。
929.730	933.352	然後時間多的事,然後身高又可以押住他。
933.352	937.615	我就說主啊,我願意,我第一個福祉就是陪人睡覺。
937.615	940.117	感謝主陪人睡覺也可以栽培人才。
941.715	945.919	因為我一直陪他睡覺,晚上不讓他出門,然後後來怎麼樣?
945.919	950.443	神就醫治了他,感謝主,後來又成為一個人才。
950.443	955.828	這個是讓我再次驚豔,這個400個怪人,都是怎麼樣?
955.828	956.669	有希望的。
956.669	962.895	跟哥比講說,怪人也有春天,對嗎?
962.895	965.057	怪人也有春天,感謝主,感謝神。
966.288	971.030	我就記得這位牧師,他真的是成全聖徒,各盡其職。
971.030	974.052	他做了很多很大膽的嘗試。
974.052	978.474	有一天他跟我說,玉明,你跟惠美,從今天開始就帶一個小組。
978.474	981.955	我說,我們才剛回來這個教會沒有多久,就要帶小組。
981.955	987.718	他說,對,叫你帶就帶,順服就帶著祝福,相信就好,認真預備。
987.718	995.182	結果他就把教會的童工全部叫到我那組來,跟他們說,從今天開始,這個人就是你們的組長。
995.182	995.462	天啊!
995.862	1001.185	我才剛回到教會,他就把所有的童工帶到我這組來,成為我的小組員。
1001.185	1003.647	那但是呢,這個就激發我怎麼樣?
1003.647	1006.209	激發我跟師母,我們就非常的認真。
1006.209	1013.213	我跟你講,牧師的主日的講道,我們沒有聽過三遍,我們不敢帶小組。
1013.213	1017.396	因為那時候主日的小組呢,就是用牧師講道的題材。
1017.396	1021.959	我們一聚完會,就立刻摳那個錄音帶,回家沒有聽三遍。
1022.619	1024.441	沒有聽三遍。
1024.441	1026.303	沒有禱告超過一個小時。
1026.303	1027.544	不敢帶小組。
1027.544	1029.446	那種認真,你懂意思嗎?
1029.446	1032.889	組長們。
1032.889	1034.110	組長們。
1034.110	1036.092	你們要悔改。
1036.092	1036.673	你們要悔改。
1038.268	1044.574	很多人很驚訝說,為什麼莊玉明在這麼短的時間之內,就好像可以被神使用,因為我付很大的代價。
1044.574	1046.236	真的,真的是這樣子。
1046.236	1054.564	弟兄姊妹,我覺得第一個有那個把他的生命的典範,生命的榜樣,停留在我身上的,就是這位鄭牧師。
1055.265	1075.925	沒有一個人是完美的人﹐他也是一樣﹐他也是有他的不完美的地方﹐可是光那一份生命﹐就有傳承給我﹐就有停留在我身上﹐很多人﹐你就可以慢慢去瞭解﹐為什麼淡江教會拚了命﹐還是在做慈惠事工﹐ 為什麼常常很多人說,齊博莊牧師為什麼你要樂意給很多人服事的機會?
1075.925	1080.630	因為我就是從陪人睡覺開始服事的,都有搞頭。
1080.630	1084.675	怪人也有春天,何況你們這麼不怪呢?
1084.675	1088.659	你們也都跟我差不多怪。
1088.659	1092.103	這個生命的傳承我領受了,我非常的感恩。
1093.251	1098.713	那我就回想到我第二個教會的牧師,他的生命也有停留在我身上。
1098.713	1100.513	他所給我的是什麼?
1100.513	1102.014	我剛剛講第一個牧師怎麼樣?
1102.014	1108.236	他讓我知道,做牧師的責任,就是要呼叫出每一個人生命中的偉大。
1108.236	1113.918	做牧師的職責,就是要成全聖徒,各盡其職,讓基督的身體可以長大。
1114.258	1119.000	做牧師的職責,就是要去挖掘每一個人生命中的保障。
1119.000	1125.623	做牧師的職責,就是要把人帶回到上帝的面前,因為基督已經讓我們與神和好了。
1125.623	1130.565	我們要以神為樂,我們要讓我們的生命被神打開。
1130.565	1135.607	這是第一個牧師對我的影響,那個生命的那一份有留在我裡面。
1135.607	1139.889	第二個牧師對我的影響,也是我第二個教會的牧師。
1139.889	1143.150	這個牧師也是不得了,他全年無休。
1144.667	1179.804	那時候我剛成為傳道人的時候在這個教會非常的辛苦每天都是拚了命在服事然後這個牧師連禮拜一都是來上班他連大年初一都在教會真的是不知道在幹什麼我們都勸他不要這樣子那他真的是很拚命他非常的愛他的教會他有一次跟我分享說為什麼他這麼拚命他為什麼要把教會當作是他的兒子一樣 弟兄姊妹,你把你的教會當作是你的兒子一樣嗎?
1179.804	1188.030	我常常跟同工講,我把教會當作是我的兒子一樣,一樣的看待。
1188.030	1206.829	你的兒子如果怎麼樣,我跟你講,前兩天我回家的時候,看到我的兒子去游泳,結果臉被那個游泳池的磁磚刮傷了,一條長長的疤,我跟你講,我都快要哭出來了, 你想想那個黃牧師每次講到眼淚一直流是什麼?
1206.829	1209.111	就是他的兒子在門口被車撞有沒有?
1209.111	1211.193	他就說他一直想要打那個司機有沒有?
1211.193	1213.956	你們只記得這一段實在是。
1213.956	1222.464	就是當你的兒子受虧損的時候,你的兒子受損害的時候,你的心是很痛的,你巴不得用你的命來換他的命。
1222.464	1230.506	這位牧師跟我說,他看他的教會像他的兒子一樣, 他說因為這個教會是用兒子的命換來的。
1230.506	1231.786	我說什麼意思?
1231.786	1233.587	他說我以前是木繪啊。
1233.587	1235.988	木繪就木繪啊。
1235.988	1239.109	也沒有特別認真到哪裡。
1239.109	1242.630	但是後來他有一個兒子五歲。
1242.630	1244.971	這個五歲的兒子長得非常的可愛。
1244.971	1248.912	他從小栽培他的兒子上才藝班,讓他學各種的才藝。
1248.912	1251.353	五歲以前就學了很多的才藝。
1251.353	1253.674	這個五歲的時候就發現他的兒子得到腦瘤。
1257.995	1267.777	他記得說,他最後一次,送他兒子進開刀房的時候,跟他兒子說,兒子啊,你知道爸爸很愛你對不對?
1267.777	1271.297	他兒子說,對,我知道爸爸很愛我。
1271.297	1291.869	這個牧師跟他兒子說,兒子啊,如果待會呢,你進去這個房間,手術完,醒來的時候,你眼睛打開的時候,你看見在病床旁邊的,不是爸爸,而是主耶穌的時候, 你不要害怕。
1291.869	1295.732	因為主耶穌比爸爸更愛你。
1295.732	1298.134	你聽得懂嗎?
1298.134	1303.879	孩子說,爸爸我不怕,你講的我知道。
1303.879	1306.521	他的孩子就這樣沒有出來了。
1306.521	1312.787	他一直跟我說,玉敏啊, 我兒子的死給我極大的震撼。
1312.787	1317.131	我給他補各樣的才藝,讓他考上臺大又怎麼樣呢?
1317.131	1320.755	都搶不過我的兒子知道他有永生。
1320.755	1327.222	都搶不過我的兒子知道,不管什麼事情,就算是他死了,他都知道主耶穌愛他。
1329.360	1331.564	他說他兒子的死給他極大的震撼。
1331.564	1339.537	他決定要投入他一生的生命來愛教會,來建造教會,好叫教會可以叫萬民都得救。
1341.783	1344.844	以至於祂這麼平,我終於明白為什麼祂這麼平。
1344.844	1350.567	我終於明白為什麼祂常跟我說,玉民啊,我看教會就像看我兒子的命一樣。
1350.567	1353.889	神在聖經裡面告訴我們不是也是如此嗎?
1353.889	1360.432	教會是神的兒子用重價,用祂的命,用祂的寶血所買贖回來的。
1360.432	1364.254	沒有人可以輕忽神的教會的,特別是我們這些蒙恩的兒女。
1369.104	1376.488	這位牧師,祂的生命有傳承給我,有停留在我身上。
1376.488	1385.092	常常一大早,常常夜深,我自己會在教會上面走來走去,都沒有人了。
1385.092	1386.873	昨天晚上也是,我也是最後一個走。
1388.268	1396.332	我會到處尋每一個窗戶有沒有關,尋冷氣有沒有關,看看有沒有什麼東西貼歪了,椅子歪了,在那邊排一排。
1396.332	1409.417	牧師神經病,三更半夜不回家,還在那邊排椅子,還在那邊檢查冷氣有沒有關,還在想說這個佈告欄的這個DM張貼的有沒有方方正正。
1409.417	1417.601	我有時候會坐在教會椅子上說,主啊,你怎麼敢把教會託付給我呢,我的能力這麼的有限。
1419.019	1423.841	弟兄姊妹,這是我領受的一個生命。
1423.841	1427.302	這是我被傳承到的一個生命。
1427.302	1430.703	它成為我生命中很寶貴的一部分。
1430.703	1436.044	它也使我相信神的教會是榮耀的教會,是寶貴的教會。
1436.044	1440.646	曾經有誰的生命停留在你身上呢?
1440.646	1441.106	有誰呢?
1442.534	1485.246	如果你察覺到你去回想真的有一些人祂的生命停留在你身上了你要感謝主祂不一定是完美的人可是你要感恩祂的那一份生命停留在你的身上而成為你事奉的根基感謝主感謝讚美主跟你隔壁講說生命就是事奉的根基 希望這禮拜的小組,每一個弟兄姊妹都思考,討論有誰的生命停留在你的生命裡好不好。
1485.246	1487.368	這個太寶貴了,太寶貴。
1487.368	1490.411	第二個我們講到怎麼樣,恩賜。
1490.411	1492.313	恩賜,恩賜是侍奉的能力。
1492.313	1496.217	我就回想說有誰的恩賜停留在我的身上。
1496.217	1506.525	我第一個想到的是GoodTV, 我記得,包括我還在GoodTV服事的時候,那時候就常錄吳老師的電視。
1506.525	1508.386	吳老師人真的很好。
1508.386	1512.667	我們那個時候只是個小弟而已,GoodTV的小弟而已。
1512.667	1521.549	吳老師每次來都噓寒問暖,不得了,好像看到神的精兵猛將一樣,我們想說我們是小弟一個神,吳老師幹嘛那麼關心。
1521.549	1532.189	我真的很感謝我在GoodTV的那段時間,在我還沒有去讀華神之前,我就覺得我讀了一個神叫好神, 好消息電視臺的神學院,簡稱好神。
1532.189	1546.058	我想起我在那邊做教稿的那些日子,做電視講道節目,神學節目的字幕教稿那段日子,我非常的感恩。
1546.058	1555.584	我覺得神拆派了全世界許多優秀的講員,成為我這個不才的人的家庭老師。
1555.584	1559.097	祂幫助我, 好像每一天幫我排滿了課。
1559.097	1560.678	你可以想像嗎?
1560.678	1564.100	有一個人他每天去上班,就只是為了聽講道。
1564.100	1566.282	你覺得這種工作好不好?
1566.282	1572.966	有人搖頭什麼態度,真是。
1572.966	1574.107	我覺得非常的好。
1574.107	1575.648	我覺得主啊,我是什麼人?
1576.578	1578.260	我不配啊。
1578.260	1579.822	我不配啊。
1579.822	1581.704	可是神就這麼恩待我。
1581.704	1586.089	我回想起那段,我得到這樣一個恩賜的傳承。
1586.089	1604.805	我的生命,我的學藝裡面,有各種不同的牧師, 祂對聖經﹐祂對神學﹐對信仰的那些真實的經歷﹐那些用生命所去揣摩來的那些解答深深的放在我的裡面。
1604.805	1609.547	我非常的感恩﹐我也非常的感謝。
1609.547	1612.509	所以呢﹐你們要留意一件事情啊。
1612.509	1622.954	就是呢﹐其實每一次你們在聽信息的時候,都是神要把這個人 他的生命與恩賜停留在你身上的一個機會。
1622.954	1630.576	但是我知道很多時候只有周公在那時候把他的恩膏給你,打瞌睡。
1630.576	1646.222	我也想到呢,也有其他的人,其實當初我並不羨慕,甚至也不喜歡這個人,可是這個人最後他的恩賜竟然也傳承給我,他的恩賜也停留在我身上。
1647.875	1652.139	我就想起我的先知性預言的恩賜是怎麼來的。
1652.139	1656.383	這段時間帶中階門訓的弟兄姊妹操練這個先知性的預言恩賜。
