start	end	text
1843.114	1856.914	所以我慢慢有一點點自信,慢慢有一點覺得說,感謝讚美主,人家手是用揮的,我們是彼此相愛的,也不錯,感謝讚美主,生一樣的工作。所以我們慢慢地學會一件事情,弟兄姊妹們,
1857.602	1882.277	你要找到你的勝利方程式。你要找到你最熟悉的武器。你要找到你只有在那個武器裡面,在那個環境裡面,你覺得神的恩高與你同在。每個人是不一樣的,每個傳道人是不一樣的,我們的戰場可能不見得是一樣的,但是你知道那就是你最熟悉你恩高運行的模式了,讚美主的名字。所以告訴你旁邊的人,你不要穿我的衣服,
1886.92	1910.342	哈利路亞!每個人有每個人得勝的方程式,你要花時間去找,在你服事,在你成長的歷程裡面,真的是需要一點時間的,所以對自己要有信心,你要相信每個基督徒,神如果呼召你,神一定有使用你的地方,神一定有給你得勝的方程式。阿們!讚美主的名字。第五個,要為神的名而贈。
1911.442	1931.745	大衛從一開始,他就不是為了自己而戰。他覺得很好奇,覺得很納悶。為什麼掃羅要躲起來?為什麼那些亞尼爾那些大將軍們要躲起來?為什麼掃羅的三個哥哥看起來這麼懼怕?懼怕是會傳染的,恐懼的淋是會感染的。
1932.346	1947.021	所以他們不能夠理解,大衛覺得說,他這樣辱罵神的名,絕對不可能勝過神的名的,他要為神挺身而出。我覺得很多時候很重要的原因是,大衛一開始就知道,他不是為自己而戰,
1947.381	1963.492	祂是為神的名而戰。撒羅為什麼懼怕?撒羅那時候已經擁有王位。你知道當年一無所有的時候,反而有一種勇敢,反正沒有什麼好損失的,我就拼了,反正最多就是沒有嘛,本來也是沒有,你知道嗎?現在有了,反而懼怕。
1964.172	1985.155	所以撒羅他關心的是,如果我上去跟他拚了,萬一輸了,在眾人面前這樣丟臉,那王位可能就怎麼樣?沒了。所以撒羅關心的是自己的王位,他覺得是為自己的王位而在那裡奮鬥的。所以當一個人,你是為自己在那裡奮鬥的時候,你心裡充滿懼怕,你害怕失去什麼?
1985.555	2011.982	可是大衛不一樣。大衛他是一無所有。他真的就是為神的名而戰。他心裡面的恩高。他心裡面對神的信心。他心裡面關心神的榮耀。他心裡面關心神的名。他恩高在他裡面沸騰。這個費利士人怎麼可以去怒罵耶和華的名呢?這個費利士人怎麼可以羞辱神的百姓呢?怎麼可以?怎麼可以?怎麼可以?他裡頭在那裡沸騰的。他沒有懼怕的。
2012.602	2037.898	所以弟兄姊妹們，神正在尋找願意為祂的名而戰的人。神在尋找。我相信當大衛割下那個哥利亞的頭的時候,舉著那個頭大勝的時候,所有掃羅身邊,包括掃羅自己,所有的將軍都會覺得很氣,怎麼這麼容易,你知道?只用一顆石頭,
2039.343	2055.122	打中他的額頭,怎麼這麼容易,早知道我就去了。掃羅的軍營中間,比大衛要專業的,受過訓練戰士,不知道有多少,大家也覺得,早知道我就去了,這麼簡單,一顆石頭就搞定了。
2056.34	2077.93	但是他們忘記了,因為他們面對戈利亞的時候,想的就是如果我輸了,我可能將軍的位子不保,連命都沒了。我家裡有老婆,有小孩怎麼辦?可能我一上去,哇,你看他這麼高大,怎麼可能打得過他?可能還沒靠近就被他射死了。
2078.37	2097.799	當一個人開始為自己的生命在那裡計算,為自己的得失在那裡計算,懼怕的靈就會控制在他的裡面。當一個人是為神的名而戰的時候,你會看到他就有無比的勇氣跟恩膏去面對他生命中的隔離。你看到馬街,
2098.712	2113.72	馬傑博士,他做多少事情。我常常很感觸,馬傑在福士才30年,總共在臺灣福士從頭到尾差不多30年。他又建了學校,他蓋這麼多的教會,上百間的教會,而且那時候還沒有高鐵用走路的。
2114.36	2128.195	他能跑到宜蘭去,還用走路走到宜蘭,還是騎馬騎驢子。那時候交通這麼不發達,他30年在臺灣做這麼多的事情。我想我服飾錢快滿20年的。
2130.998	2154.22	這個還有高鐵,你看,還有汽車,跟馬街做多少的事情。在淡水這個地方,被人家潑糞,丟石頭,甚至有生命的危險。但你看到,當一個人願意為神而戰的時候,他裡頭是沒有懼怕的。所以你看到南北戰爭也是一樣,林肯也是一樣,當他為神的名而戰的時候,他其實就心裡就沒有懼怕。
2155.964	2175.407	馬丁路德金恩一樣，他為了黑人的自由，民權而戰的時候，他願意站出來，即使知道會被暗殺，他心裡面還是以無比的勇氣，因為他知道他不是為自己，他乃是為神的名而戰的時候。阿們。所以親愛的弟兄姊妹們，戈利亞其實在我們的心裡
2176.527	2203.743	那些讓你懼怕﹐那些讓你想要逃避﹐那些讓你不想要面對的﹐那割離就是出現在我們人生的戰場上面﹐在我們裡面﹐除非你能夠先戰勝我們裡頭的割離﹐那個讓你懼怕﹐讓你害怕﹐讓你想要逃避在你心裡面的割離﹐否則你就不能夠戰勝外在環境的割離﹐如果你能夠戰勝你自己心中的割離﹐你就能夠打敗在外在環境戰場上的割離﹐
2204.343	2225.173	哥利亞隨時出現在我們人生的戰場上,可能是經濟的不景氣,現在有很多人很多的憂慮,很多的惶恐,可能是你服侍中的挑戰,服侍到只剩下兩個人了,可能有很多的壓力,服侍中的挑戰,也有可能是你家庭的風暴,也有可能是你情慾的試探,
2226.049	2253.764	或者你忽然而來的苦難。哥利亞讓人懼怕,想要逃避,想要躲藏。但真正的哥利亞就是我們心中的恐懼。當我們能夠戰勝我們心中的哥利亞的時候,其實我們就可以讓危機成為我們生命的轉機。我們可以憑著信心說來得好,那就是正是我們可以驚豔神大能的時刻。阿們!所以你要先戰勝你自己。第一個,你要勝過人們對你的看法。
2254.616	2262.303	人們可能對你有很多的看法﹐很多的評價﹐但最重要的是神的看法。神是看內心的,神不是看外貌﹐
2262.858	2292.278	如果那裡頭有一個沸騰的恩膏,那裡頭有一個為神而戰的信心,如果你裡頭擁抱的是神的使命跟神的夢想,你會看到,不介意別人怎麼看法,我要擁抱的是神在我們生命中的夢想。我們要學習順服屬靈的次序,在小事上中心。特別是那些人們可能認為是很小很小的事情,但是因為我們願意順服的緣故,往往就是因為順服這屬靈次序的緣故,給我們帶來極大的機會跟恩典。阿們。
2292.858	2320.155	所以我們平常就要去操練,在生活中開始去操練培養我們對神的信息。不要這麼容易被打敗,不要禮拜天早上就是一個YAMAHA的一個音樂發表會而已,我們的孩子就不來聚會的,這是我親身碰到的。我當時非常的驚訝,覺得說怎麼這麼容易,那可能不是獅子和熊,那只是個小老鼠而已,就不守主日了,怎麼會這麼容易呢?
2320.879	2344.529	讓我們看到我們生活中﹐很多的挑戰﹐很多信仰的挑戰﹐在我們生命中的時候﹐其實我們有一個信心﹐我們要相信一件事情﹐只要我行走在神的旨意當中﹐我們絕對可以打死獅子跟熊。以至於當哥利亞出現的時候﹐我們可以說你來得好﹐讓我們面對我們的挑戰﹐你要找到自己勝利的方程式﹐
2345.35	2371.955	你要留意你的服飾,你要留意你恩高的範圍,你要留意你最熟悉的武器,不一定是刀槍同級的,可能是那五顆圓滑的小獅子的,不一定是每個人的模式的,你可以穿看看,不要勉強穿,穿看看不合適就換一套,那麼你在你服飾的過程裡面,你慢慢可以找到你習慣的模式,你恩高運行的模式,阿們。我覺得最後一點是最重要的,為神的名而戰。
2373.66	2398.805	當你願意為神的名而戰﹐你會看到無比的勇氣在這裡。每當以後恐懼來臨﹐每當哥利亞出現﹐讓我們捫心自問﹐我到底是為誰而戰﹐如果你是為你自己的名而戰﹐你就充滿了恐懼﹐如果你知道﹐不管你在職場上﹐不管你在服事上﹐不管你在人生很多的抉擇上﹐你知道你所關心的是﹐如果神在我們中間﹐神的名會得到榮耀嗎﹐
2398.985	2424.333	如果我這樣做﹐別人怎麼看我呢﹐我的同事如何看我呢﹐那麼如何看待我所相信的神呢﹐還是我們計較的是我們的得根師呢﹐如果我們真正關心的是神的名﹐是神的榮耀﹐恩膏在你裡面會沸騰的﹐阿們﹐因為有無比的勇氣﹐去挑戰在你生命中的割離﹐那別人開始震驚﹐你身上帶著超自然的恩膏﹐阿們﹐因為那是神同在的恩膏﹐
2425.213	2452.916	所以親愛的弟兄姊妹們,讓我們來到神的面前。今天是一個充滿挑戰的時代,不管是幕會,不管是職場,不管是我們的家庭,在今天的社會裡面充滿了挑戰。但是每一個挑戰對我們來講,都是讓我們相信神要彰顯祂榮耀的時刻。生命中每一個危機,每一個挑戰,我們都可以把它當作是你生命中再上一個臺階的轉機,是你人生中最棒的轉捩點。
2453.456	2463.893	所以特別是很多人開始驚慌懼怕的時候,人們要很好奇地問你說,你為什麼不怕?你說,我已經習慣這樣的生活了,感謝在美主。阿們。我們一同低頭禱告。
2466.186	2493.366	天父讓我們為神的名而戰。主啊,我們想到大衛怎麼樣戰勝哥利亞。主,在我們一生中哥利亞不斷地會出現。但是我們願意把我們生命中每一個挑戰跟危機都當作主啊,是我們人生中間的轉捩點。主,我們願意說來得好。主啊,正是讓我們可以見證神大能的時刻。主,讓我們為禰的榮耀而戰,為禰的名而戰。禱告奉耶穌基督的聖名祈求。阿們。