start	end	text
0.009	25.016	四十五到四十七節。我要講的題目叫做戰勝自己危機與轉機。薩默爾記上第十七章第四十五到四十七節。其實是十六章十七章我大概一起看的。請聽我來讀薩默爾記上十七章四十五到四十七節。我要分享的題目是戰勝自己危機與轉機。請聽我來讀。
26.084	41.35	大衛對非利斯人說:「你來攻擊我,是靠著刀槍和銅棘。我來攻擊你,是靠著萬軍之耶和華的名,就是你所怒罵帶領以色列軍隊的神。今日耶和華必將你交在我手裡,
41.63	61.485	我必殺你、斬你的頭﹔又將菲律斯軍兵的屍首﹔給空中的飛鳥﹔地上的野獸吃﹔使普天下的人都知道﹔以色列中有神﹔又使這眾人知道﹔耶和華使人得勝﹔不是用刀、用槍﹔因為徵戰的勝敗﹔全在乎耶和華﹔祂必將你們交在我們手裡。
62.125	82.177	哥利亞是一個危機,它也是一個轉機。所以當這個巨人哥利亞走上戰場,向以色列來罵陣的時候,對撒羅來講是一個危機,所以他躲起來。對以色列士兵也是個危機,所以他們驚慌,他們恐懼,他們躲起來。但是同時間,對大衛卻是一個生命中的轉機。
82.517	97.586	因為大衛就是因為有這樣一個機會,他的人生可以從此有一個翻轉,開始站上整個以色列歷史的舞臺。那麼在我們人生中心裡面,其實也隨時都有可能有哥利亞這個巨人,站上我們人生的舞臺。
98.046	121.937	我們的人生其實是一場徵戰,一場又一場的徵戰。那麼當危機來臨的時候,其實我們可能像掃羅一樣,被懼怕所控制,被恐懼所控制。我們不想面對,我們不想去回應,我們只想要躲起來。但是我們也可以像大衛一樣,把這一個危機當作我們生命中的轉機,那是我們人生中的轉捩點。那麼我們怎麼樣可以
122.637	148.794	讓危機可以成為我們生命中的轉機呢?我覺得好像大衛一樣在大衛要戰勝哥利亞之前我覺得他必須要先戰勝自己在五方面的挑戰所以我覺得如果你要面對危機你首先你要戰勝的是你自己如果你能夠戰勝你自己你就有一個能力你可以讓生命中的危機變成你人生中的轉機大衛要戰勝自己五方面
149.394	177.347	我想第一個方面﹐大衛必須要先勝過﹐勝過人們對你的看法。有看到大衛其實從小﹐他是一個被忽略的人﹐所以當薩默領受一個使命﹐他來到耶穌的家裡﹐他要高以色列新的王﹐神已經離棄了掃羅﹐要揀選一個新的王﹐他來到耶穌的家裡﹐一二三四五六七﹐耶穌有七個孩子通通都出來了﹐他第一個看到的是以利亞﹐他覺得這個人﹐
177.807	194.782	是這樣的英俊,是這樣的高大,所以撒末爾認為必定是他了。撒末爾也喜歡他,但神怎麼對他說呢?不要看他的外貌和他身材高大,我不揀選他,因為耶和華不像人看人,人是看外貌,耶和華是看內心的。
195.333	209.532	問了半天,一、二、三、四、五、六、七都沒有。撒末爾開始覺得說,那到底是誰呢?所以他問耶穌說,耶穌,你們家還沒有孩子。耶穌這時候才講說,還有一個老爸,剛好在外面放羊,但是
210.333	234.19	但是薩默爾就覺得很氣,就問他說,如果這個人不出現在我的面前,那麼今天這個事就沒辦法了結了,所以趕快匆忙把大衛叫過來。可是你想,如果你是大衛,你今天在外面放羊,你沒有回家,家裡有這麼重大的一個事情,這麼重大的一個會議,薩默爾來到他們中間,今天如果行政院院長來到你們家,
234.77	235.551	很不舒服。
250.282	278.849	你可能覺得說,這麼重要一個聚會,不是大家聚在一起吃火鍋,是薩默爾來到我們的家庭裡面,他是完全被忽略的。也就是說,他的父親是不看好他的,他的兄長們是不看好他的。所以讓我們人生中裡面,其實別人對我們的看法,其實往往會影響到我們的一生。那麼我覺得薩默爾,大衛第一個要戰勝的是什麼?
279.189	300.305	就是別人對自己的看法。弟兄姊妹們,我們不要因為人的看法,失去了我們對上帝的信心。阿們!特別是我們的父母,我們的家人,有的時候他們有對我們的看法,可能是因為你的排行,可能是因為你的外貌,可能是因為你從小的表現,人們對你有很多很多不同的看法。
300.845	327.41	在我信主以前﹐我的父母一樣﹐對我的看法就是﹐能夠生存就不錯了。在我從小到大的裡面﹐不管是因為外貌﹐或者很多的原因﹐其實整個我們家鄉裡面﹐其實就認為說﹐從小不看好我的﹐就是說考試能夠考上就好了﹐緊緊的就就好了﹐偶爾能夠活得下去﹐能夠娶到老婆已經很不錯了。但是我信主了﹐感謝在美主﹐阿們!
328.37	353.126	但是我這28歲的時候我信主了。他們認為說那你信主又如何。但是我覺得我信主了。我擁抱神的夢想。我覺得不再是人們對我的看法是重要的。重要的是神是看內心的神。阿們。神對我們有一個新的看法。神對每一個基督徒在你的人生有一個新的看法跟新的夢想。如果你是基督徒的話。哈利路亞。所以我們要戰勝別人對我們一些的看法。
353.626	381.759	我們也需要戰勝一些權柄對我們的看法。你看到大衛他很興奮,他說,怎麼沒有人敢去跟這個哥利亞對決呢?大家都怕得要命。大衛覺得很納悶,他就一直問說,誰如果殺了這個哥利亞,會有什麼獎賞呢?大家就跟他講說,王的女兒要嫁給你,你當年可以免稅,諸如此類的。他到處問,到處問,到處問,少羅聽見了。
382.159	402.876	就把這個年輕人找來,一看這個年輕人,他說,哎呀,大衛,你太年輕,你是沒有受過訓練的,哥利亞是從小作戰士的。其實,撒羅辛也是輕視他的。那麼,很多時候我們的權柄也是一樣,我們成長的過程裡中間,有時候我們的權柄對我們的看法,也會限制我們對神的夢想。
403.456	429.575	我剛剛開始服事的時候,其實我對這個不被看好的感覺,我的印象是非常深刻,從小到大。包括我開始幕會的時候也是一樣。他們說,哎呀,你看,振華什麼都好,就是太瘦了一點。君子不重則不威,所以呢,不夠重,所以講臺信服力可能也不太夠。你看,如果你剛剛純選一畢業,大家對你的評語就是這個樣子。
429.855	456.53	那麼,其實這些都是有一些學者專家對你的看法,但是在我裡面,我相信一件事情,不管你是高矮胖瘦,是黑是白,神的話語是有分量的,阿們!我們的信心不要建立在別人對我們的看法上面,我們的信心要建立在神話語本身的大能的上面,所以我覺得說那是你們的看法,我相信我只要忠實的傳講神的話,神的話語,福音本是神的大能,阿們!
457.841	481.156	那麼撒旦對我們有很多的看法。你看到戈利亞,戈利亞看到那個大會的時候,就覺得很好笑,你知道嗎?戴著一根棍子,攤著牧人的一個裝扮,既沒有打綁腿,也沒有S腰帶,也沒有全副武裝,也沒有戴鋼盔,就這樣來到戰場咚咚咚,當時是郊遊嗎?是這邊?是打狗嗎?
481.476	510.316	所以他對他嘲笑,說我要把你的肉給天上的鳥吃,給地上的野獸吃。你知道,對很多的嘲笑,哎呀,你是不可能的啦,哎呀,你沒有受過訓練啦,哎呀,你看你什麼學校畢業的,哎呀,你看你長的這個樣子,哎呀,你看你根本都沒有肌肉。總而言之,撒旦很多的嘲笑,你不會成功的,你會死得很慘的,你會完蛋的,你會被吞噬的。但是我們都可以拒絕這些看法,
510.776	516.498	我們每一個人都有一個偉大的使命。我們要使萬民做主的門徒。
538.848	566.828	神使用每一個基督徒。所以你要擁抱神的夢想。你要相信神可以藉著你祝福萬國跟萬民。你要相信福音本是神的大能。你要相信我們雖然是瓦器﹐但有寶貝在我們的裡面﹐可以顯出那莫大的能力。阿們。所以拒絕那些人對我們的看法。所以你要擊敗哥利亞。你之前你要先擊敗﹐不要因著人的看法﹐讓我們失去了我們對上帝的信心。我想這是第一個。第二個﹐
568.08	589.653	我們要學習順服屬靈的秩序。大衛這個月遇到哥利亞,是因為他幫哥哥們送食物去。所以有一天,聖經說有一天,耶穌就突然想念他三個孩子,就說大衛大衛,你來送一些食物,送一些烘好的穗子,送到燕裡面去,問哥哥們安。
590.828	609.639	大衛是很順服的孩子。他說,把爸爸家告訴我這樣,他就真的順服,乖乖地送了食物來到戰場去。是因為他送了食物去,因為他順服他的父親,所以他才會遇見格力。你知道,大衛是一個非常尊重屬靈全秉的人。
610.299	638.7	而且即使他來到戰場﹐他看到大家好像縮頭烏龜一樣﹐怕怕怕怕怕﹐他不知道怕什麼怕﹐他覺得說﹐這個傢伙竟然可以怒罵以色列的神﹐把大家罵成這樣﹐我們的神難道輸給哥利亞嗎﹐所以他心裡面﹐他心裡面的恩膏是在沸騰的﹐他心裡面覺得﹐覺得為什麼沒有人為神挺身而出呢﹐所以他想要去戰﹐他有沒有直接衝到戰場上去﹐哥利亞你給我出來﹐
639.36	666.764	沒有,他等到掃羅聽見這些風聲之後,掃羅說,把大衛找來,聽說你到處問說打敗戈利亞會怎麼樣。他問他,然後他們有一個很棒的對話,大衛說,哎呀,雖然我從沒有受過訓練,但我從小放羊,那個獅子跟熊來偷吃我的羊的時候,一看看我就抓住獅子的鬍鬚,打死那個獅子,打死那個熊,我還追趕獅子和熊,所以我相信一件事情,
667.244	692.174	上帝必拯救我,在哥利亞人的手中。掃羅聽完之後,既然你那麼堅持想去送死,平平安安的去死吧。他說你平平安安的去。掃羅才,那個大衛才去,他沒有說我超有恩膏的,他沒有說我是超厲害的,他沒有說我有領受神的夢想,他就直接衝到戰場上去,沒有。他等到掃羅說你平平安安的什麼,去吧。
692.654	692.874	阿們﹗
722.585	742.378	其實大衛就是送一個食物、送個便當、送個外帶來到了戰場而已。他就遇見了戈利亞。機會是從這裡開始的。大衛的英勇的故事是因為順服父親的吩咐而開始的。我相信一件事情,順服的人不會錯過任何神的祝福和機會。
742.978	763.429	因為當我們如果願意順服的時候,你看到機會的門就一扇一扇的為我們敞開,特別是我們順服那些可能是我們認為很微小的事情,可能只是送個食物而已,可是這樣子的順服往往帶來我們意想不到的機會跟祝福。阿們。我也相信一個悖逆的人,
764.189	787.506	他往往失去神原本給他的祝福。你知道,如果我們是一個悖逆的人,如果我們是一個很難搞的人,那麼我們的遮蓋,我們的權柄,告訴你往東你就要往西,抱你往南你就要往北,那麼你就是偏偏不想要順服,有很多的意見,你會看到你機會的門因此就被關閉了,你會失去很多的機會。
788.046	815.751	如果你在職場上面,你永遠都是跟你的長官在那邊唱反調的,而且你是有名的,不管你叫你往東,你鐵定往西的,大家都可以知道的,其實你的機會的門是越來越窄的,即使原本上帝要賜福給你的機會,也可能因著賜福給你的機會,慢慢的就消失了,也就沒有了,那是非常可惜的事情。這是我自己學到很深的功課,我剛開始服事的時候,剛剛信主,
816.391	843.223	其實都覺得傳道人很笨,因為我們在職場這個久了,知道嗎?職場的很多招數都會,覺得傳道人怎麼那麼誠實,傳道人怎麼都是這麼,覺得很笨,那時候剛剛開始,有這種感覺。所以我就覺得,他們叫我做什麼,我都不做,叫我做音控,我要做招待,叫我做招待,我就要做音控,那你說為什麼叫你做招待,你要做音控呢?我就耍嘴皮子,難道招待不是服侍神,只有音控是服侍神嗎?
843.865	870.461	就很麻煩,後來大家就不太敢找我服侍,因為不管你找我做什麼服侍,我就要做另外一個服侍,那我嘴巴又很利,所以大家就覺得很累,找你服侍,爭論完就脫一層皮了,算了,你知道嗎?所以機會就越來越渺茫,你知道嗎?所以求神幫助我們,其實我們要學習我們順服神所設立的屬靈的秩序,我們的父母,我們的輔導,
871.459	888.255	我們的牧者﹑我們的老師﹑我們的喪師,因為這是我們要從小就要操練的。當我們成為這樣的人的時候,你會看到,當大家就認定你是一個很順服屬靈次序的時候,你會看到機會的門就是為我們敞開。
888.575	889.015	阿們。
907.619	907.659	阿們﹗
931.578	939.826	他很重視這個屬靈的權柄的次序的。所以我想他要戰勝自己的就是要學習屬靈的次序。第三個,
941.135	963.166	要在生活中培養對神的信心。大衛對撒羅說:「你僕人為父親放羊,有食他的獅子,有食他的熊。從群中嫌一隻羊羔去,我就追趕它,擊打它,將羊羔從它口中救出來。」大衛又說:「耶和華救我脫離獅子和熊的爪,也必救我脫離這非利斯人的手。」
964.48	992.882	大衛看到菲利亞,那個戈利亞,他完全沒有懼怕。他覺得很納悶一件事情是,為什麼這些人充滿了懼怕?大衛為什麼不懼怕呢?這是一個巨人,這是一個戰士,那個掃羅的正宗有多少的猛將在那裡,每一個人都懼怕,為什麼大衛沒有懼怕呢?因為大衛早在他的生活,他的工作,他的職場中間,他已經培養了一種對神的信心。
993.643	1019.264	如果大衛在當牧羊人的日子裡﹐如果有一隻熊來偷牠的羊﹐他說反正我有一百隻羊﹐死了一隻算什麼﹐你知道嗎﹐他就消極的對付﹐看到獅子來﹐獅子需要為一隻羊去搏命嗎﹐算了﹐你知道嗎﹐死一兩隻沒關係的﹐回去爸爸問說怎麼給你一百隻﹐找了兩隻﹐一隻被獅子咬走了﹐一隻被熊拿走了﹐但是我還有九十八隻﹐而且我很安全的回來了﹐
1020.145	1039.055	如果我們用消極的態度去逃避我們生命中的獅子和熊的時候,其實你的信心會不會增長?不會。大衛就是在職場的裡面,在他生活的小細節裡面,他是一個忠心的人。你敢偷我的羊看看,今天只要我負責牧羊,
1040.094	1063.219	哪一隻獅子,哪一隻熊,敢來吃我的羊看看,我就抓住他的虎膝,把他打死,你知道嗎?好像我們是小組長一樣,誰敢偷我的羊,你知道嗎?偷我的羊,我跟你拼了,你知道嗎?如果你說,哎呀,反正淡江教會很大,少一兩隻有什麼關係,被拐走了,或者不見了,不見就算了嘛,反正還有很多隻,你知道嗎?
1063.439	1091.444	但是,大衛不是這樣。大衛在生活,在職場上,他就是一個非常忠心,而且依靠神的恩膏在服侍的一個人。所以以致,他跟獅子跟熊徵戰的過程裡,他的信心不斷不斷不斷不斷的增長。至於當哥利亞出現的時候,他覺得來得好,感謝讚美主。信心是沒有辦法在一夜之間成長的。什麼是你生活中的熊和獅子呢?
1094.189	1113.196	我講這是我們要去思考的,不是任憑獅子和熊偷吃掉我們的羊,用消極的態度去面對,可能是中元節拜拜的時候,在你公司裡面,全公司的人都在拜,那麼只有你一個人沒有拜,噢,極大的壓力,那可能是你獅子和熊來臨的時刻,阿們。
1114.224	1130.674	可能是你在服事的時候,主日的服事,你的老闆就是說在主日的時候,你又有服事,那麼又不能夠離開,那麼你又發現有一個case要談,就是一定要談在這個主日早晨,你敢不敢跟他講說,老闆,改到下午好不好?
1131.374	1148.645	你有沒有這種勇氣去跟他說﹖今天早上我要守主日﹖可不可以改到下午﹖可能是你的孩子﹖你的孩子在禮拜天的早上﹖剛好就有一個音樂會在那裡﹖你到底讓孩子參加兒童主日學呢﹖還是讓孩子去參加音樂會呢﹖在你心裡面會不會這樣想﹖
1148.985	1171.241	主日學每個禮拜都有。這個音樂的發表會,禮拜天早上一年才一次,就不要讓孩子去什麼?主日學,送他去音樂發表會。有沒有可能是這個樣子呢?我們家孩子也是碰到這樣相同的情形。我一定跟我的孩子講說,禮拜天早上,不管是什麼樣的活動,
1172.671	1189.948	因為對我來講 他說媽媽 這個我們所有同學都去耶那就是親情的公事學校老師打電話 不行喔他不來的話怎樣怎樣這樣那就是我生命中的獅子和熊來了
1190.964	1218.162	我已經習慣了,我們孩子說主日學。主日學的詩情的服事是最重要的。主日學的早上的服事是最重要的。我要教導所有的家長,打死那些獅子和熊。他說,牧師,那以後評比會怎樣怎樣怎樣?你到底要相信你的神,還是要相信亞馬哈德鋼琴老師?你的未來到底是掌管在那位萬王之王的手中,還是掌管在音樂老師給你的ABC的分數上面?
1221.766	1250.327	你的獅子和熊來了,感謝讚美主。現在,在我們的生活中裡面,可能我們要談到要建堂,談到要一些,我們也一樣,我們也獅子和熊的問題出現了,現在已經很緊了,現在已經壓力很大,可能很多人都不景氣,但我有感動,我敢不敢奉獻,其實奉獻其實就是少吃一頓buffet,或者少出去出國旅遊一次,也不會死翹翹的,你敢不敢,是如果神感動你,對不對?
1250.947	1279.113	有的時候﹐其實我們在這些抉擇上﹐都不是生和死的抉擇﹐就像小孩要不要上主日學﹐還是去啞巴哈的鋼琴演奏會﹐沒有到生和死的抉擇﹐可是連這一點你都被打敗了﹐將來哥利亞出現的時候﹐你一定恐懼﹐但是對我們來講﹐如果我們從生活中間﹐我們就培養這樣的信心﹐當你人生的危機來到的時候﹐你說來得好﹐大家都開始抱頭鼠竄的時候﹐你說來得好﹐
1279.889	1286.952	阿們我在出信主的時候在我的生命中有幾件事情影響我的信心非常大
1288.387	1312.764	我剛剛信主受洗沒多久,我就考進了證券公司,那是二十年前的事了,頂康證券。我的學歷不是很好,操信也不是很好,沒有信主以前,四科六十分,兩個大過,總而言之,但是那時候蠻老實想要發財,就是跑到證券公司去,那時候才十八家專業經紀商的時刻。
1313.404	1336.822	我不講那個過程,很奇妙,就過關斬將,打敗很多人,我進入了證券公司。那都是什麼臺大,什麼氣管,什麼金融,政大,銀行,美國的什麼MBA,一大堆人。200人考,最後入選了15個人,可是試用的時候一個月要再刷掉5個人,那時候要交成績單,要交一大堆,那時候我剛剛受洗。
1337.483	1353.948	剛剛受洗,我想說,我的成績單在金融機構裡面,有兩個大過,超信60分,四顆60分,這個一個月後刷掉肯定是我的嘛,對不對?不可能是那些什麼政大、臺大那些人,不可能。但一路走來都是神的恩典。
1354.428	1375.491	我就記得我要交成績單的時候,我說我應該被禿禿改改,改得漂亮一點,偽造一下,沒有信主以前也不是太困難的事。那時候我剛剛才受洗,我的小組長就恐嚇我,我的小組長真的對我影響很大,他說鄭華你想想看,你連面試的機會都沒有,那一路這樣考,
1376.152	1400.221	都是神給你的恩典,你也不斷地禱告。你如果在這件事情上,如果你還是土改,像以前這樣做的話,你怎麼樣能夠榮耀神?我說我怎麼榮耀神,我工作都沒了還榮耀神。那時候剛剛才受洗,他說你要禱告,你回去想一想。我回去想一想,我真的覺得他講得有道理,因為從一開始到我能夠進公司,完全是神的恩典。
1400.981	1423.935	不可能靠我的學歷,也不可能靠我的經歷,我知道那是神的恩典,可是最後一關來臨了,我要不要誠實呢?後來我就有一種豪氣,哎,豁出去了啦,算了,反正都是神的恩典,我就把那個很爛的成績交出去吧。我就真的就憑信心,真的憑著信心就交出去了。一個月以後,刷掉的都是臺大跟政大的,很習慣。
1425.009	1449.005	我覺得很驚訝,我覺得很驚訝,我是抱著必死的決心,這是很奇妙的。過了兩年以後,跟同事都熟了。我就問他說,當年你們怎麼會錄取我呢?我這個這麼差,功課這麼差,成績單這麼差。他就說,我們也搞不懂,就覺得你這個人很真實,就這樣而已。他其實搞不懂生長權。
1449.445	1477.824	我在出信主的時候﹐有很多這種為上帝而冒險﹐要說誠實話的這些事情﹐一旦我說了誠實話﹐我想應該就完蛋﹐但是每次都沒有完蛋﹐每次都經驗神的祝福﹐久了以後你知道嗎﹐就很想為上帝冒險﹐感謝主﹐而且為上帝冒險完之後﹐我都會充滿期待神要怎樣祝福我﹐阿們﹐我們必須要在生活裡面﹐開始去操練那些的獅子跟熊的信心﹐
1478.592	1504.96	等到你慢慢的操練的時候,其實有一天,神要給你大的夢想,神要給你大的使命的時候,看到戈利亞出現的時候,別人都在躲,別人都很害怕,但是對你而言,你會覺得說戈利亞來得好,那是我的機會來了,神啊彰顯你的大能,像打死獅子跟熊一樣,這次我要打死戈利亞,阿們!所以信心沒有辦法在一夜之間成長,你必須在你的生活中開始操練你的信心,
1505.64	1529.218	第四個,你要找到你自己勝利的方程式。撒羅很有趣,撒羅聽完以後就說,來,把自己的戰衣給大衛穿上,把這個銅盔給他戴上,又給他穿上鎧甲。你想,我想,撒羅多少有一點故意要羞辱他,因為撒羅就在以色列人中高一個頭,對不對?大衛是個青少年,
1529.718	1559.178	怎麼可能穿他的戰衣呢?但是少羅不是怎麼搞的,就說來來來,穿上我的戰衣。所以大衛一穿,劍就拖在地上,不夠高,袖子可能也太長,乾坤衣太清爽可能會掉出來,腰帶也沒辦法繫,你知道嗎?所以大衛穿著覺得很好笑啊。大衛有一個勇氣,他跟少羅說,不,我不穿你的戰衣。大衛脫掉那些東西,他找到他自己最熟悉的方式,他來到了西邊。他做什麼?砸五顆石頭。
1559.718	1588.223	圓圓的石頭,把五顆石頭撿起來,這是他最熟悉的武器,放在囊袋裡,拿著他的那個弓弦,那個機弦,你知道嗎?那個是甩石頭用的,拿著他的杖,他就奔向了戰場。所以,其實他有勇氣向少羅的戰役說不。弟兄姊妹們,你知道每一個人成功的模式,每一個人得勝的模式,其實是不一樣的。
1589.087	1604.002	少羅的戰衣大衛不能穿。很多時候其實我們要了解到,別人得勝的方程式不一定是合適你的。你要找到你習慣的方程式,你要找到你最熟悉的武器,你要找到你人生的戰場。
1604.462	1604.662	阿們﹗
1621.135	1642.691	所以我們要花點時間,我們要誠實的面對自己,要像掃羅的戰衣說不。你要明白,沒有一個人是完美的,沒有一個人是十八般武藝都很厲害的,真正厲害的人兩三招就夠了,你知道嗎?像大聯盟的投手,只要有曲球,什麼變速球,快速直球,三招夠了,如果你控球控得很好的話。
1643.251	1643.411	阿們﹗
1664.974	1679.619	我開始服事的時候,這一點對我來講也是很大的學習,因為從小都不被人家看好,所以就很羨慕那些很厲害的人。所以我看到很多人服事的時候,哇,手一揮,哇,就倒了,有的要彈到牆壁上,哇。
1680.759	1703.289	我們手一揮也沒事,一禱告也沒有事發生。我們也不敢向人說,起來起來,輪椅的會站起來,柺杖丟一堆。覺得我們真的是不行,覺得剛開始服侍好羨慕。
1704.292	1719.849	但是有人就能夠把場子搞得很熱騰騰的,你知道嗎?他一站上來,哇,整個場子就著火了。我們一站上來,講的笑話也不好笑,然後就不知道該怎麼辦,只能乖乖地講道。就是覺得說,我們真羨慕他們。
1720.35	1748.591	但是慢慢的我也發現一件事情,就是說,其實在這挫折裡面,開始尋找自己得勝的方程式。這是需要一點點的時間的。剛剛很熟悉你們那種,就是說,聚會前,弟兄姊妹問好,前後左右去祝福他,我們教會也是這樣。聚會結束之後,走之前還要抱一抱,我們就是彼此的擁抱,祝福一下。其實很多年以來,這是我最熟悉的模式。
1749.292	1753.922	這就是我的模式。雖然不像所謂會彈在牆壁上,
1755.794	1784.973	但是我們覺得那就是我們的模式,我們是溫暖的,我們像一個家一樣。所以在我們將會有經濟神營會,每次聚會的時候常常講,耶穌愛你,我也愛你。我們都覺得說往往在這過程裡面看到很多人心靈得醫治,但是倒也很少看到說什麼肉體上立刻疼痛得醫治這種見證不太多。但是上個禮拜我們剛做完這個聚會,我發現一件事情,有人在這個過程裡,就抱來抱去的過程裡,突然覺得,
1785.794	1788.216	每個人有每個人熟悉的方程式。
1806.357	1823.507	他們有的時候問我說,鄭華你是講到最不像張茂松牧師的。我從清天起到外服侍十年,張哥一上來就好像著火一樣,然後輪椅啊什麼就這樣,哇,很激烈的。可是我就是跟他完全不一樣。他說為什麼你不像他?所以我很早就發現我不可能像他。
1824.087	1824.407	阿們﹗
