start	end	text
0.009	14.566	新傳道書第三章。好,請盡快坐下,謝謝。你們都已經知道,蔚藍傳道是一個熱情的單身美女傳道。所以,一定要很...哦嗚!
15.623	29.853	一輪傳到昨天在這裡訂婚很多人都知道他的宣告是因為他為什麼嫁得掉呢?因為他生日願望說他如果明年這時候還是單身他要切腹自殺
30.998	48.607	這不是重點,重點快點往前走,我是在殺時間。但是我的重點就是,過年前三個牧師已經為我祝福可以嫁掉了,感謝耶穌。你們坐好了嗎?我們打開聖經。我們來看傳道書第三章。
49.872	66.144	是美好的神,愛我們的神在這個新的年度開始的時候我們要一起來思想上帝的美好跟信使我今天要給大家一起思想這一段經文是不太容易瞭解的經文但是卻是我很喜歡的經文然後
67.125	83.705	我給他的題目叫為永恆而活。我們活在今生可是我們是為永恆而活的。我們一起來讀聖經。我們一起來看傳道書第三章11到14節。我們一起用美好的聲音來齊聲送讀神的話。11節請。
89.206	114.589	又將永生安置在世人心裡,然而神從始至終的作為,人不能參透。我知道世人莫強如終生喜樂行善,並且人人吃喝,在他一切勞碌中享福,這也是神的恩賜。我知道神一切所做的都必永存,
115.009	125.229	無所增添,無所減少。神這樣行,是要人在祂面前存敬畏的心。我們一起低頭,我們來禱告。
129.94	145.543	上帝我們謝謝你愛我們。你創造每一個生命,你也創造了萬物。你是創造的神,愛我們的神。如今我們私立在你的話語面前,我們恭敬的願意領受你自己對我們的教導。
145.964	172.629	願禰的真理一解開,就使愚人通達。願禰的真理一解開,就使我們的心靈得自由與釋放。讓我們在今年要往前跨越的時候,主禰自己的話語成為兩刃的利劍,四入剖開我們的心靈,使我們在禰裡面再一次的堅固、堅立在禰自己的國度裡面。謝謝禰,聽我們禱告,奉耶穌基督的聖名,阿們。
174.241	186.29	我是南投竹山人,大家有去過那個地方的人舉手揮手一下,謝謝。西投很多人去過嘛,就是西投很有名,就是我們家在那附近。
187.466	211.763	今天的經文第一節十一節就告訴我們神是造萬物而且神是使每一件事情包括今天很多人被大雨困住了因為神下大雨連這個下大雨這麼冷都是神覺得是美好的因為必須要有下雨的時候必須要有乾旱的時候神造萬物個案其實
212.483	241.165	成為美好又將一個東西放在一個很難形容的一個東西就是永生安置在哪裡人的心裡面但是有一位神這麼奧秘所以詩人給他下了一個註解叫做但是他做得很奧秘所以很難參透他在做什麼那我剛剛提到我的一點背景就是我是南投的人
241.886	268.815	在我的小時候的成長裡面,我常常一個人,我是四個兄弟姊妹的老二,我們家在前面有大的賽古場,後面有小河。我的遊樂場就是這些東西,我沒有什麼小朋友的芭比娃娃可以玩,我也沒有什麼畫書可以看,我的所有大自然就是我的玩伴。
269.735	289.658	所以在我小時候,我最常做的事情就是跑到大自然裡面,坐在我家後院有一棵芭樂樹,非常亮闡,很多很多的芭樂的芭樂樹上。我會看著天,我會看著天空,然後會想,人生是什麼呢?有神嗎?因為我們家的拜拜是非常傳統的道教的信仰。
290.179	309.982	那所以在我的心裡面好像那應該是我的神那我的家人口很多我的爺爺有六個孩子他們還沒有陸續嫁陸續娶那所以呢當我們還是大家族住在一起的時候後來我們就住在一起所以沒有空間讓我可以讀書跟寫字
311.152	333.349	在我的小時候﹐我的印象裡面﹐我的書桌是什麼﹐你們知道嗎?這不是﹐那個神明﹐不是有觀世音菩薩﹐然後有祖先牌位﹐不是要放貢品﹐一個很大的方形桌﹐對不對?那我就住在這個﹐這個神明廳的後面的小房間﹐然後貢桌就是我寫作業的書桌﹐酷吧?
334.07	342.375	我就看著這一些神這一些我的祖先牌位寫作業這是我小時候的最好的書桌
343.507	372.897	所以當我的爺爺他一個人他這麼辛苦的養活他六個兒女為什麼我說他很辛苦呢因為他的爸爸在他五歲的時候為了去佐水溪的對岸工作他涉水而過的時候被大水沖走了你們不要覺得這是很容易的事情因為我小時候也涉水到對面去幫助爸爸媽媽一起種田過我們的家是這樣過生活的
373.217	399.465	所以爺爺從小,他的田地在濁水溪的對岸,他知道一件事情,就是凡事都要靠自己。你不要跟我講什麼兄弟,人不要害人,我們都看他大,看他大,他的房子是他自己蓋的,徒手蓋的。聽過嗎?有沒有住過徒手房子?我小時候的房子就是徒手房子。
399.565	420.119	那,爺爺一直告訴我的人生的哲學,活著的方式跟意義就是不要害人。但,人生害害,要怎麼做?我爺爺已經九十幾歲,還健在感謝神,過年有見到他。人生害害,我們不要人害得好,吃到不能吃。
421.015	438.181	做到賣人走,是大家的風水較好的地方。死了,就埋在一個風水好一點的地方。做到不能做,吃到不能吃,就人生是這樣子。我們只要不要害人就好。我們只要努力勤奮。我的爺爺是一個很勤奮的人。
439.275	458.425	所以當我看著我的祖先牌位,從小在這樣一個環境長大的時候,我的神是我一直寫作業的那一個祖先牌位跟萬世音菩薩。我看著天在我的芭樂樹後面乘涼,吃著芭樂,吹著風,聽著鳥叫的時候,我會問天說有神嗎?祂是誰呢?
461.852	484.751	我的家族,我想很多人跟我的家族很像,我們不過就是很想要傳宗接代,所以為什麼生了六個孩子呢?因為他有四個都是女兒,男生不夠啊,所以拼命生還是女生,啊,怎麼還是生女生,連這個孫女也是女生,所以我的奶奶生到這一個,老大是女生,我爸爸生的老大是女生,生到這個老二還是女生,
485.452	487.557	繁體中文，臺灣國語。繁體中文，
496.903	525.618	對,就是這樣子的長大,他們想要的就是希望在看得見的,因為他們苦,所以想要快樂,想要豐盛,想要有盼望的人生。那,我看到了家族當中,不管是父親這邊,母親這邊,他們非常的重男輕女,從小我見到的到現在人就是如此。那因此我認為只有讀書有出路,所以我在祖先排位前是拼命讀書的。
526.749	538.721	那我看到的男孩男人的狀況不就是菸不就是賭不就是性不就是各樣的綑綁在他們的環境跟生活當中
540.009	563.402	所以我常常在質疑的就是這一些我傳統以來所認為的神跟平安所在乎的生命跟盼望真的就像我爺爺說的是這樣子嗎?人生是這樣子嗎?人生的意義跟價值是這樣子嗎?同時我也在想這一些表哥自殺的兩個
564.65	578.506	因為酒,從小年輕,因為賭。然後今年我看到他們的時候,看到他處著柺杖,已經是廢了的一個人,好瘦。因為他已經把酒,把整個身體喝壞了。
580.623	605.797	我一直認為這應該是蠻好的,就是我爺爺是很勤奮的人,我的家族所帶給我的就是勤儉至佳,這是一個美好的榜樣,但似乎在我裡面覺得還是不夠。當我18歲的時候第一次跨進教會,有人告訴我剛剛所讀的經文,神是創造的神,祂是一位美好的神。
607.039	621.349	並且祂不僅創造,祂不僅美好,祂把永生安置在每一個世人的心裡面。那這一位神我毫不認識,我對祂陌生至極,
622.398	647.99	但是當我聽到這一個消息的時候我第一次回到我自己住處的地方一個人我就跪下來像天主教徒一樣因為那時候我很少看電視我很少看什麼什麼什麼所以我看到的都是電影裡面的情節我就跪下來像天主教徒這樣子跟上帝畫十字架我跟他做了生平第一次的禱告
648.49	668.983	我剛才說上帝我不認識你,可是有人告訴我你是好的神,你是創造的神,你是復活的神。那我現在誠誠實實的跟你禱告,我要經歷你。我的神是我剛講的那一切,但是我要經歷你,因為你是活著的神。
670.247	697.397	從那一天開始我開始認真的來讀聖經裡面所說的那一位創造那一位次永生的神如何的要使人活著有盼望活著有意義並且活在地上的每一天知道是為永恆而活在當下的每一個時刻我活在南投直到18歲離開南投以後就是臺中跟臺北
699.019	722.382	然後今年我每一次過年再回到家庭當中的時候都會有相當大的信仰的衝突。那我過年的時候回去拜訪我的親人,大家都知道指南公對不對?大家知道發財經對不對?如果有一些人看到消息報導,就是今年有六十幾國的貨幣,他給指南公一些錢。
722.722	748.145	紫南宮就借給他去做生意的財務,那他如果賺了回來之後,他就會還更多這樣子。所以每一年很多人就是去借發財金,所以每一年南投大塞車都是紫南宮的錯。就是每一年都是這樣子,都塞住都不能動。今年的發財金的這樣子的借大概有上億元,而且六十幾國的貨幣。
749.326	778.292	那我有機會在蠻靠近那個地方幾個大廟的出入口我去看我的親人我跟著他們因為我妹妹有一個雙胞一對雙胞胎我照顧孩子的時候我就看著來來往往的就是去借發財金或者去拜拜點燈的人潮來來往往來來往往我沒有事做所以我就很會觀察我就一直觀察所有來來往往的人的眼神
779.104	799.881	我如果像靜怡姐可以拍片,我很想拿著camera把這些人的表情全部拍下來。比方說有一個人像楊振鈞那種高度,拿著烤魷魚,一面咬一面吃這樣子。那有人拿著糖葫蘆,就一面吃一面咬,拿著烤玉米。
800.742	830.115	拜拜完了,走回來,走過去的時候,如果我可以下一個標題在這個廣告詞的話,就是我給你一些香油錢,你給我平安一整年。在傳統我所見到,我所成長,我所經歷到的許多的信仰裡面,我發現是交換式的信仰。那樣的神,是什麼樣的神呢?
832.637	854.066	我的上帝,我所敬拜的耶穌,跟這樣的神有什麼不同嗎?上帝也願意賜福,但是上帝對我生命的計畫,要求我的是什麼呢?是不是上帝我給你十一奉獻,你也要給我平安一整年,其他都不準?
856.101	880.035	我的心裡面的空缺,的渴望,在神創造人,創造這個萬物的時候,在我裡面放下的那個永恆是怎麼一回事?我是為什麼活著呢?這些問題常常衝擊我的思想,衝擊我的生活,也衝擊我的感受。
882.551	895.594	2007年跟2008年,上帝帶我在華省的訓練休息的時間,有機會去澳洲跟紐西蘭做一些海外留學生的短宣工作。
897.142	925.904	有一次,2007年,我帶了一群各個國家來,大概十幾個孩子,大學生。我跟著他們一起到澳洲的墳墓去。你們知道墳墓在臺灣跟國外是兩碼子事嗎?有一些體驗教育在臺灣比較難做,有風水問題,有摔到、衝到,就是都不敢,但是有一些事情是需要那種場合才學得到的。
926.544	940.815	所以我就帶了十幾個年輕的孩子去到澳洲的墳墓,在布里斯本。非常乾淨,各個宗教都有。那個墓園非常乾淨漂亮,很大很大的一片墓園,是澳洲布里斯本最大的一片墓園。
942.261	965.303	我就請孩子們,就像你們這些BEST的學生一樣,我請他們在去這個墳墓之前先做一點功課。就是你要思想你這一生要做什麼,你的人生的計畫是什麼,你的夢想是什麼,短期、中期跟長期你要完成什麼。然後我要請他兩個兩個一組,去觀察墳墓上面所刻的文字。
966.084	995.616	他大概是什麼信仰的人,他大概幾歲,他上面寫了什麼,是關於這個人一生的墓誌名,可能是一句話。當我們在全部的體驗教育結束之後,我們坐在墳墓邊的空地開始分享的時候,我記得許多的年輕人掉下眼淚來,即使還沒有講一句話。這一些已經過世的人,似乎親自在對這一群孩子說話。
997.056	1023.443	那他們說,死不是老人的權利,每個人都會死,有小朋友就過世了。他說他們好衝擊,因為很多的故事是他們很想了解,很多人花園,像花園般的墳墓,他相信這個媽媽一定是給孩子很大的愛跟安慰,所以他們非常想用一個大的墓園來表達多米欽的懷念。
1024.974	1043.607	那我記得在離開那一個墳墓的時候我跟這群孩子有一個很好的約定我們要認真過生活那我就回臺灣來了我們要為上帝而活所以因此有一些孩子他就開始去教會他就開始追求這個永恆在他的心裡面
1044.889	1071.358	2008年的時候,我在紐西蘭短宣。在短宣的時候,我收到一封短訊,就是一封email。一封email裡面,就是這一群孩子的輔導,發了一封信給我。他說啊,慧蘭傳道,你還記得那一次你們去Brisbane的墳墓做了什麼什麼事?我說當然,就看看看。然後就說其中有一個人,是大陸的女孩,叫Christine。
1072.995	1097.838	那,她在你離開之後來教會一小段時間,後來交了一個沒有姓左男朋友後,就再也不來教會了。有一天在一個放假的週末,她跟她男朋友去一個沒有救生員的海邊。大浪來了,把他們兩個人都捲走了。男生救活了,女生當場死亡。
1099.087	1126.306	最後一句話說他現在就葬在你帶他們去的墳墓那裡。如果他那一天不是去海邊玩,而是來教會敬拜神,他的人生將會有多大的不同呢?即使你不想面對,即使你認為他不會發生,死亡是毫不客氣的。
1127.381	1152.283	即使你覺得眼見的一切,你覺得可能已經是很好了,可是有時候不得不讓我們去思想,永恆在我們的心裡面的份量到底有多重。神造萬物,各岸其實成為美好,又將永生安置在世人的心裡。你有永生嗎?
1154.548	1166.417	你瞭解這位造你的神在你生命當中的定義、計畫跟美好嗎?你的24小時,你的每一天在為什麼努力呢?
1168.49	1189.807	我們如何來把握每天的生活。在2014年開展的時候,這是舊歷年回來之後的第一個主日。當我們形理如儀的、習慣的,坐在這個會堂裡面,來到教會做一切習慣的事情的時候,我願意每一位我所親愛的弟兄姊妹得著生命的智慧,
1191.049	1211.334	詩人接著來思考,他說,我知道,他是一個觀察家,傳道書你如果,我十八歲就很喜歡傳道書,不曉得為什麼,就很喜歡讀它,就讀不懂,到現在還是讀不懂,可是很喜歡讀。詩人他非常非常的好奇,一直在觀察,他是一個很有聰明跟智慧的人。
1211.834	1231.826	他說,因此我觀察了許多的事情,虛空的是虛空,虛空的是虛空,許多是會再重複的,但是他說我知道一件事。十二節,我知道世人莫強如終身喜樂行善,也就是沒有什麼比這個更了不起的囉。
1232.927	1243.398	他講世人莫強辱幾件事,他在經文裡面出現好多個這樣的說辭。其中這一段提醒我們,世人莫強辱終生喜樂行善。
1244.582	1262.873	在活著的每一天在為永恆而跨每一步的每一天他發現一件智慧的事因為傳道書叫做詩歌智慧書也就是它當中有許多精煉的智慧跟詞語如果你抓到重點了你的人生也因此有智慧了
1263.473	1274.1	他發現有一個很智慧的事情,就是終生的喜樂跟行善。我相信在我們當中的喜樂不是騙人的。
1275.145	1293.008	在敬拜的時候,神的同在所賜下來的豐盛也不是騙人的。我相信這是每一位已經經歷過神同在、被神醫治、被神恩高過的百姓都會說阿們的。阿們。我們的喜樂是因為我們知道永活的神在裡面。
1293.848	1311.142	因此我們會問我做得對嗎?我正在走的方向是神喜悅的嗎?把握今生你可以終生的來喜樂而且終生的來為神來行祂所為我們每一位預備要去行的善
1312.619	1339.598	我在看一些文章,有一天突然發現一個讓我滿感動的文章。大家都知道馬介院長,現任的馬介院長叫楊玉正院長,大家知道嗎?他是一個婦科癌症醫師,他幫助過無數個癌症病人。婦科是全臺最缺醫生的一個科,你知道為什麼嗎?
1340.299	1341.42	繁體中文，臺灣國語
1360.623	1389.449	婦科的癌症那他有一個很好的醫療的心他是一個很好的醫生所以他就很想他的馬街的所有單位主管們深深能夠感受感同身受癌症病患末期的人的感受你不要隔岸觀火你要有同理心所以他做了一個計畫跟活動他請所有的主管就是在安寧病房一日的體驗活動
1389.889	1394.922	太酷了吧怎麼個酷法呢他說你們所有的主管要每一個人插一管
1395.845	1421.244	你自己選你是要鼻胃管還是尿道管。就是要學習去感受那個病人的痛苦。所以他做了,有人眼睛睜很大,對,他就做這種事。然後他就做一個體驗,他說邀請所有的主管每個人安息安寧病房一日體驗,然後每個人至少查一管。所以他就開始,他要那一天要執行的時候,他同時收到一個報告。
1422.534	1441.304	他前陣子做了一些的檢查,就是在當天他被宣告他得了淋巴腺癌。在那一天,他原本是體驗的,我去體驗一下插一管的感覺,當下被迫插管,因為他要接受癌症的治療。
1443.916	1456.621	為了這個癌症,他跟死亡擦身而過兩次,差一點死掉兩次。他接受癌症的治療,一共瘦了11公斤。但他生命有很大的震撼,
1458.49	1479.569	他說有一個人叫Martin Heidegger,他說人只有跟自己的死亡相遇,真實的自我才會顯現。以前他都是幫助別人,那時候還沒有那麼深的感受。於是他在這整個的治療到現在活下來之後,他非常的認真的過生活。
1480.23	1500.069	他被另外一個癌症病患大大的鼓勵因此他做了一個很大革命性的在他的人生當中做了很革命性的一個計畫就是如果人生這麼短這麼急促死亡不知道什麼時候來拜訪那麼若面對這麼有限的生命把握當下還不夠好
1501.186	1521.923	那最好的事將你所有的人生夢想往前推你所有的代辦的事你想要完成的夢想要往前移現在就要開始因此他現在已經為馬街醫院做好了十年他的整個醫院十年的計畫他已經做好了
1522.483	1537.2	他的每一天都當成最後一天火十年的財務計畫十年的願務計畫都已經安排好了所以他說我的人生是我已經將自己所有的人生目標往前移了
1538.524	1559.807	他沒有害怕面對死亡。如果有一天他必須要死亡的時候,他對他孩子只有四個字的提醒,叫做誠實正直。他可以安穩的回到天父的懷裡,他一點也不懼怕。這一個我不認識的院長,我被他的故事很大的鼓勵。
1561.084	1580.223	他跟我所認識的男人們在我從小長大看到這一些覺得今生的享樂今生的滿足是一切因此要抓住所有看得見的去吃想吃的做想做的的這一些生命有極大的不同
1580.964	1608.229	我看到了一個把握他短暫的生命,雖然苦難來,死亡衝擊了他的靈魂,他沒有用酒跟信,他沒有在失望灰心裡面跌倒,就再也一蹶不振,他也沒有拿力氣來罵上帝,討厭上帝,他把他的力氣拿在把他僅有現有的生命用在對的事情,他知道他的一生的職質就是做一個好的醫生,
1608.609	1634.741	祂就用祂的才幹,用祂的努力奉獻在對的人,對的事情上面,何等美好。祂是一個懂得智慧的人。世人說,我知道世人莫強如終生喜樂行善。你找到了你喜樂的秘訣嗎?你正在做神放在你裡面,要你去完成的善嗎?
1637.176	1660.202	聖人接著說,十三節,並且,人人吃喝,在他一切勞碌中享福,這也是神的恩賜。短暫的生命,我們喜樂行善,同時短暫的生命,可以好好的吃辣,也可以好好的喝,好好的享福,可以好好的have fun!阿們!阿們!
1662.637	1670.744	對,我們已經找到我的知己的好朋友,我們跨了好多年。就是我跟羅牧師是很交心的,因為我們的邏輯很像。Have fun!
1673.968	1700.152	這個不只是我們兩位,這個我可以當他女兒都過得去的年齡。但是呢,詩人也告訴我們是這樣子的。他說,你可以有東西吃,你可以享福,這是神的恩賜耶。人如果懂得這個就是最幸福的事情,那就是智慧人了。你就正在把握你的每一天。因為你當你卸飯的時候,那真的是卸飯。
1700.572	1726.528	因為你竟然今天還可以好好的吃一頓這麼好吃的東西,那就是福了。那就是福了。當然,我們不是隻有這樣夠了,因為人如果覺得這樣夠了,這個世界大概也很爛,都不用努力,反正有飯吃就好了,有東西吃就好了。可是詩人反過來,好像在提醒我們忽略的重點。很多時候我覺得說,
1726.988	1742.819	我衣櫥裡面比較漂亮的衣服,等哪一天我要出去才穿。某一種什麼東西,我等哪一天我才要這樣。我們不會把握當下,不覺得今天有什麼價值,除非某個什麼,我才要怎麼樣。
1743.439	1766.93	可是詩人告訴我們,每一天你可以吃,可以喝,可以在當下的勞碌當中享福,這就是人生的智慧了,因為每一天都是永恆的一步,每一天都非常的尊貴跟有價值。有一位跟我一起長大的好朋友,我們在同一個團企成長,我看著他,
1768.148	1792.197	跟男朋友交往﹐結婚﹐生小孩﹐教會牧會﹐我們一起都是傳道人。然後我也看著他﹐跟他的先生﹐努力尋求上帝在他們生命中的護照。他們一直覺得神護照他們是做宣教士的,可是神一直沒有開路。他們經歷了十幾﹐將近二十年的人耐,沒有跨出國門,因為好像路一直沒有開。
1793.592	1809.225	後來在多年的跟教會的溝通之後他們終於做了一個決定他們要用很特別的方式去宣教就是他們要去養雞然後讓雞順利下蛋
1810.026	1837.177	然後把蛋送給非常貧苦的小朋友,跟沒有東西吃的一些人群。他們是回教徒,他們不信耶穌。你跟他說耶穌愛你,對他們沒有意義。他會用一把刀把你殺死,因為他們是一手拿可蘭經,一手拿刀的人。他對基督教教的信仰是非常反彈的。所以他們的策略就是養雞,
1838.217	1864.368	把生活物資送給他們,然後送水,把水,乾淨的水,喝了不會得瘧疾的水,送給他們。我就看著他們,白白靜靜的三個,包括他們家兒子,去到很熱,很太陽很大,很窮,很髒的地方,喧叫。我看著他們傳回來的訊息,前陣子得了瘧疾,三個輪流得,前陣子又得了
1865.128	1888.334	就是腳撞到差一點被蜂窩性組織炎差一點截肢。他的先生在整個的宣教的里程當中很辛苦啊。然後兒子他們的小朋友看到這麼特別的亞洲小孩太特別了。然後他們就會躲在旁邊。突然他兒子走過去說跑出來嚇他吧。那個兒子嚇翻了這樣子。
1888.814	1908.562	所以他們在面臨這個宣教的時候,並不簡單。但是,我看到每一次他們傳來的訊息,看著他們自己養雞場下的蛋,他們說下蛋率百分之八、九十。他們的代導心就請為我們的雞能夠九十以上的下蛋率禱告。
1910.094	1939.347	看著他們怎麼樣送水跟那些不信耶穌的人做朋友。看著他們怎麼樣經歷這個瘧疾。經歷這個蜂窩性組織炎。我看到的是他們滿足的。他們吃那個農產。農產產出來的青菜。他說看。他給我看他們的農場的照片。看這是神賜給我們的迦南美地。弟兄姊妹
1940.998	1969.535	這樣有很好嗎?這樣有什麼好開心的?雞蛋,臺灣不是很多嗎?幹嘛跑去那麼落後貧窮的地方,送水、送雞蛋?可是這三個人,我認識這三個人很瘋耶。他們覺得不去那裡,他的人生沒有價值跟意義耶。他們活在臺灣的每一天,都是想要出去那個地方,去吃那種苦,去受那種煎熬,是瘋子嗎?他們一點也不瘋。
1970.538	1994.846	因為在他們裡面有一個永恆,他們知道他已經得著了,他願意把他裡面的豐盛分出去,他終生的喜樂行善,並且享福他們自己農場所下的蛋,自己農場所出產的青菜水果,覺得何等的滿足,這是他生命的意義。
1997.449	2009.78	在我們的當中,我們都是在臺灣非常幸福,非常容易過生活的基督徒。在這一群我剛剛提到的人當中,
2011.357	2027.814	可能就是我們當中還有好多類似的故事正在發生看到許多的不放棄的生命但同時我們跨離開教會的門就像我在過年的時候觀察了這一群來來去去拜拜的人潮的時候
2028.575	2046.538	你知道你有一個使命,你知道我們有一個使命,就是我們要活在人群當中,將那個永恆活給他們看,也將這個喜樂,這個滿足,這個善,形在這一群還不認識,甚至是抵擋神的人群。
2047.739	2064.496	詩人繼續講下去,最後14節,他說,我知道神一切所做的都必永存,無所增添,無所減少。神這樣行,需要人在祂面前存敬畏的心。
2066.237	2090.018	他很多事不知道,但他知道的就真的是知道了,是人生很重要的真理。我知道神所做的一切都必永存,無所增添,無所減少。神這樣行,是要人在祂面前存敬畏的心。多年來我到處去服事,
