start	end	text
2091.493	2116.838	從我18歲信耶穌,21歲現身讀神學院之後,我就來臺北。我會來臺北的原因是有一位很重要的長輩。那時候我在尋找人生的意義、價值跟方向,我這一生要做什麼。後來,我的傳道人的傳道人,就是師公,就是上一輩,我的傳道的傳道,
2118.319	2134.633	告訴我說,惠蘭,如果你真的要接受神學院的裝備,想要服侍神,那麼現在在臺北,有一位非常影響我的長輩,你如果可以跟他一起學習,那麼是你人生很幸福的事情。
2136.101	2152.126	所以那時候我有考慮往南部的神學院去讀,同時也考慮不同的神學院。很清楚知道,願意一生獻給上帝被神使用,那時候是我很清楚的事情。因此我就在那一個考完之後,
2153.473	2172.906	被錄取了,就一個人拿著小小的皮箱上來臺北,到現在。那是1994年的事情。從那時候開始,一直在教會服事。是大教會,是小教會,是開拓教會,是跟宣教師合作,是國內,是國外的服事。神給了我很多的經驗跟人在一起。
2174.701	2201.5	我記得我的神學院的院長,他的名字叫做蕭保羅牧師,有人聽過他的名字嗎?他是香港人,他是加拿大維珍神學院任教過,同時也在NIA美國宣道會的神學院任教,他是系統神學的教授。我非常榮幸在大學的神學院的時候就跟這個老師在一起學習兩年的時間。
2202.927	2230.894	那這一位老師他非常的熱情。如果莊牧師在臺上跳來跳去激動這是年輕版的莊牧師那蕭牧師就是非常的他只要講到他的手都是流汗他就拿起他的手巾一直擦一直擦一直擦因為他非常的激動他可以為這個信仰而死他為這個信仰非常激烈的辯論因為他知道他裡面的神是何等的偉大有智慧
2231.254	2253.142	所以我年輕才大學生,就被這個老師大大的震撼,這個人是誰啊,這個信仰是怎麼一回事,我那時候才信主不久。所以我對他所講的神,對他所開啟的信仰,我非常的好奇。多年來,他在臺灣,然後後來神又帶他回美國,又回加拿大,然後在加拿大納亞神學院教系統神學好些年。
2254.923	2284.459	那有一次2007、2008年左右他有機會回來華神任教就那個時候我在神學院再碰到我的老師非常開心的我記得我第一次見到他的時候他就非常熱情的握著我的手跟我說惠蘭惠蘭我從前風雲有你我現在終於親眼見到你了我為你禱告我真的為你迫切禱告讓你可以順利的來臺北讀書
2284.599	2288.115	這就是我的蕭院長,他一直是這麼熱情的。
2291.22	2315.669	在華神那一次,最後一次跟蕭院長見面,他看著我說,慧蘭,I'm so proud of you,我為你感到非常的驕傲。在宣神的時候訓練你們,就是要你們成為一個傳道人,而你現在還是傳道人,願意繼續跟隨耶穌走信仰的路,這就是我覺得很滿意,很滿足的地方。
2316.766	2342.714	Good job!因為這樣子的長輩對我說的話,在我生命中很有份量。多年後,我收到一封短訊,訊息,一樣是email,一個同學,一個朋友告訴我,你知道小牧師過世了嗎?他以為沒什麼,我當下差一點就shock,不能走路,因為我們正在走路。他說,
2344.189	2373.529	蕭牧師在一個主日早上講到下午開會在開會的時候心臟病發緊急送醫就在路上過世了不到六十歲他走完了神在他生命中的恩兆而他一生所留給我們的就是敬畏就是行善就是持守真理就是為永恆走每一步
2378.473	2398.266	保羅在哥林多前書15章19節說我們若靠基督只在今生有指望就算比眾人更可憐在座的每一位
2399.445	2422.88	如果我們靠著耶穌,因著這一位神,我們活著只為今生,我的存款裡面還有多少錢?我要的,看得見,抓得住,數得出來的有多少?跟世人一樣,跟我在指南宮看到的那些來來人往往的交換式信仰的人群一樣,那我何等可憐?
2425.094	2446.065	耶穌的信仰,基督的豐盛,不是隻讓我今生有指望。耶穌的同在,神所賜的永生,讓我的每一天都要為永恆而活。阿們。我們是天路客,我們是走永恆的人。
2447.858	2473.979	我們的每一步都為永恆在做預備。我是小基督,你也是小基督。因為有一天,我們要與這一位萬世的大君王一同做王,直到永永遠遠。神今天量給我們的時間、才幹、能力、金錢,都是為永恆,讓你管更大、更難、更多的事情而預備的。
2474.855	2500.066	所以神讓我們學怎麼樣做一個忠心又良善的管家。神讓我們學怎麼樣不只是自己覺得很滿足而已,而滿溢出來的恩典就是讓所有在我身邊的每一個人,認識我不認識我的人,因著基督在我裡面的豐盛,祂也要跟我一樣豐盛,因為上帝是為永恆造了我這個人。
2501.22	2527.349	上帝為永恆造了今天在座的任何一個人,沒有一個人是突然被創造,沒有一個人是錯誤的作品,也沒有一個人存在沒有價值沒有意義。神造萬物,各安其始,成為美好,你是美好的。
2529.07	2557.355	祂將永生安置在世人的心裡。你今天已經有永生了嗎?生命的重點不在於你擁有更多,在於你知道你今天可以吃、喝、享福,就是神的恩賜。在於你知道你活著的每一天可以喜樂、可以行善,因為我敬畏神,你敬畏神的心,就是送給祂最棒的禮物。
2559.121	2565.412	我未用恆而活,你為什麼而活呢?我們一起站起來。我們請靜脈團到臺前來。
2568.626	2592.591	今天的經文﹐今天的十個智慧書﹐可以讓我們接下來的每一天﹐2014年往前跨越的每一天﹐好好的為永恆而活。如果你還沒有接受這個信仰﹐不是信仰而已﹐是你跟上帝的關係。如果你跟耶穌的關係從來沒有﹐
2593.251	2608.52	好好的,認真的思考過,我今天要邀請你,耶穌的愛在我裡面,透過我的生命,透過我的經歷,要邀請你,讓永恆的神進到你裡面去,因為祂要與你一同作息,直到永永遠遠。
2609.36	2630.473	我們請敬拜團帶我們來唱這首詩歌。祂是我們永遠的依靠。無論你現在什麼樣的風浪。我知道上帝要安慰你。因為祂是美好的神。祂是活著的神。祂將我們活著今生有指望。我們來世有盼望。我們用這首詩歌來回應我們的神。祂是我們永遠的依靠。
2637.005	2665.207	每當我面對風浪﹔禰種在我身旁。生命福分與我分享﹔耕生的渴望。每當有困境阻擋﹔禰遲一步搖晃。使我心中滿有平安﹔充滿無限希望。
2669.053	2691.905	禰是我永遠的依靠,接受信息來宣告,我正是經歷禰全能的力量。唯有禰是我永遠的依靠,接受信息來宣告,
2692.585	2699.937	帶我來全心敬拜,神基就在永遠前排。
2703.063	2725.839	禰是我永遠的依靠, 堅守信心來宣告,我真實經歷禰全能的力量。唯有禰是我永遠的依靠, 堅守信心來宣告,
2726.459	2733.604	等我來全心敬拜。神基就在不遠的前方。
2738.131	2765.48	是我永遠的依靠。接受星星來宣告。我誠實經歷。你全能的力量。唯有你。是我永遠的依靠。接受星星來宣告。等我來全心敬拜。神經就在我身上。
2767.312	2792.432	現在弟兄姊妹我邀請你,好不好,閉起你的眼睛來。我要特別邀請今天在我們當中,你跟耶穌的關係是遠的。你還沒有真真實實的邀請過耶穌進到你心裡面。你知道你裡面有空缺,你也有各種的努力,但是你知道心裡面還有一個空處還沒有填滿。
2793.012	2812.307	因為耶穌今天邀請你說,孩子,我正在你的心門外叩門,打開你的門,讓我進來,讓我跟你一同來作息,每一天你都知道你是有依靠的,並且我為永恆造了你,跟我一起往永恆邁進吧。
2812.807	2835.019	神的孩子,你如果還沒有打開過心門給耶穌,我現在邀請你跟我一起做這個禱告。你要跟耶穌說,我要你。我要邀請你進到我這個人的裡面。那麼耶穌就照你所邀請的,會進到你裡面來。祂曾經這樣幫助過我,祂也要幫助你。
2835.299	2851.254	如果你從來沒做過這個禱告的,現在跟我一起開口,我禱告一句,請禰禱告一句。親愛的主耶穌,我願意打開我的心門,邀請禰進到我的心裡面去。
2853.916	2871.277	我願意為永恆而活。我邀請耶穌基督做我個人的救主和生命的主。求禰引導我的一生每一步路
2872.449	2899.194	都為永恆而活。我誠誠實實的禱告。是奉耶穌基督的聖名。阿們。我們掌聲歸給耶穌。不管你在哪一個角落。我相信上帝在你的裡面有奇妙的工作。我第二個邀請是為我們當中的基督徒。
2900.947	2921.835	新的一年,你一定向上帝有所求。我們是為永恆而活,君尊的祭司,聖潔的國度,屬神的子民。不要叫我們行出神所預備,我們每一個人所要的,透過我們而行的善。在我們的當中,有哪一個人,
2922.858	2938.819	你真的痛苦,因為你知道你失去了一些人,也失去了一些盼望。你心裡面的痛苦,不需要從這一些罪惡當中去滿足,因為永恆的神在我們裡面,就是最大的安慰。
2939.48	2966.357	祂要滿足我們,醫治我們,讓我們重新可以站起來,為永恆跨前面的每一步路。你需要神的同在,你需要神的醫治,你需要迴轉歸向耶穌。好不好,我們就來跟上帝說,耶穌,禰是我的倚靠,我要禰自己成為我的滿足,我不要在最終與你來打架,與自己來打架,我要迴轉歸向禰,
2966.817	2980.967	好不好,我給大家一個禱告的時間。我們一起開聲,來禱告,為你自己的需要,新的年度的盼望,跟上領要吧!祂是我們的盼望,開口向祂要吧!因為祂是我們的依靠。
2992.381	2997.13	我真是敬畏禰全能的力量。
3003.626	3026.475	神的兒女們,我邀請你們跟我一起來禱告。我來為你們禱告。
3034.07	3059.384	今天在敬拜在預備的時候,我深深的感受到聖靈的安慰跟醫治在我們當中。在我們當中有失去親人的。在我們當中有親人正在最終打轉,轉不出來的。在我們當中有許多人渴望愛情,渴望婚姻,卻是越離越遠的感覺。
3060.776	3083.114	在我們當中,有一些人在財務上希望突破,在工作上希望有新的開展。這一切上帝都知道。上帝仍舊給我們新的一年。我們的新的一年,新的一天,不是隻有現在感受到祂的同在而已。
3084.94	3103.227	祂一直是同在的神,一直是能夠的神,一直也是一位願意幫助我們的神。我們活在地上,但我們不屬這個世界。
3105.367	3129.04	我們有今生的盼望,我們也有來生的盼望。神的孩子昂首闊步抬起胸膛,看著你的神,你是有依靠的。阿爸天父是你的靠山。即使環境看起來人就跟你相敵對,但是阿爸天父今天
3130.776	3148.989	告訴每一個他的孩子說,我在這裡。你的人生是有依靠的。你是為永恆被造,並且為永恆活在今天。阿爸天父謝謝你。阿爸天父,
3151.613	3181.237	如果我們,引著耶穌的名,進到教會,每個禮拜,看聖經,禱告,敬拜,我們只在今生有指望,那我們真的比不信的人可憐太多了。耶穌,我祈求禰,讓我們抬起頭來仰望我們的阿爸父的時候,我知道禰真用笑臉看著每一位,禰真用笑臉幫助我們每一個人,
3183.968	3207.468	我現在邀請每一個兒女,把你最深的難處,放在你的手上,交出來,交給耶穌。把你最愛的,最難的,最無助的需要,現在交出來給耶穌。阿爸天父,現在請你看看每一個你的孩子。
3209.923	3231.094	我們的無助是真的,但是我們的倚靠也是真的。我們現在教出來,教我們在每一天如何靠這一位愛我們的阿爸天父。你定睛看每一個人現在教出來的一切。
3232.91	3245.838	你也照顧每一個心裡面的需要。謝謝你。謝謝阿爸天父。奉耶穌基督的名禱告。阿們。我們給上帝一個榮耀的掌聲。