start	end	text
0.009	23.453	弟兄姊妹大家平安。好,非常的榮幸可以來到淡江這個這麼有活力的教會來一起敬拜神,真的是我很大的恩典跟祝福。好,我要來再多一點介紹一下我自己。玉民牧師他是我的學長,然後韋南牧師也是我的學長。
23.933	46.974	OK,然後我跟偉南牧師在華城的時候,我們還是同一個輔導小組的學生。所以我跟偉南牧師跟秉韻師母嘛,對不對。OK,好。好,就是已經很久沒有跟他們見面了。然後跟玉鳴牧師,對,我們都是在華城的時候有同時間過。好,所以就是很感恩,就是有這樣的機會可以
47.995	51.4	繁體中文，臺灣國語。繁體中文，臺灣國語。
62.995	83.877	好那我今天有帶一個我們青年牧區過去是在青年牧區成長追求受裝備的學生那他畢業之後在我們教會培訓一年那現在也進到華神正在就讀華神一年級好那我們今天要來分享的信息是跟每一個人每一個人都非常相關的而且不論你是
84.718	105.422	一個baby或是你是一個七八十歲的長輩我要說的是這個信息在這個世代對我們而言都非常的重要不論你是在哪一個年紀階段我們都會重新的被神提醒這個信息的重要性我們是誰我們屬誰
106.715	135.824	如果我們在我們一生的基督徒生活當中弄清楚這兩件事情,我們是誰?我們屬誰?我們就已經贏得了我們在地上屬靈徵戰一半了。所以好吧,我們在今天信息的一開始,我們再來做一個短短的禱告,好嗎?我邀請大家閉上雙眼。我們再次邀請聖靈,祂是真理啟示的靈,祂運行在我們的中間。讓我們今天在這裡領受神的話,不只是一篇知識性的教導在我們的腦袋裡,
136.698	160.891	讓神的話成為一股挑望我們靈裡的動力,挑望我們更深的渴慕,與這位我們稱為天父的神,有一個更親密、更穩固、更緊密的關係。聖女我們來到禰的面前,我們同心合一的禱告,現在請禰打開我們的心門,不論今天在這裡是新朋友,是基督徒,
162.705	191.313	不論今天在我們這裡有人是從健全的家庭裡面成長有人是從破碎的家庭裡面成長過來我們禱告天父求禰現在藉著聖靈澆灌父神的愛在我們的聚會當中我們深信今天在這裡有一些弟兄姊妹有一些朋友們他們的生命過去因著原生家庭成長的過程有許多的破洞有許多的受傷跟扭曲
192.227	212.273	但是天父謝謝你,你愛我們愛到底,你救我們救到底。我們深信今天這個聚會中,你要釋放你為父的愛,來補滿我們生命中一切的破洞。你要挑問我們起來看見,雖然我們在地上有不完全的父親,但是我們在天上有完美的天父。
213.251	238.458	你永遠是我們的依靠,你永遠是我們所需要的滿足、價值和獎賞。天父我們邀請你,充滿你的同在在這個地方。聽我們同心合意的禱告,奉主耶穌基督的名求。我們一起說阿們。好不好,我們下面我們就把時間交給多嘉姊妹來跟我們分享她的生命故事。我們一起拍手歡迎她。各位弟兄姊妹平安。
239.855	253.994	大家好,我叫多佳。那我要來跟你們分享我的生命故事的見證。我叫做多佳,然後每個人聽到我的名字都會分不清楚我是男生或者是女生。那鄰居看到我,其實我個性是比較
254.855	262.942	繁體中文，臺灣國語。繁體中文，臺灣國語。繁體中文，臺灣國語。繁體中文，臺灣國語。繁體中文，臺灣國語。
280.316	287.932	雖然有一陣子我剛長胸部的時候,我有一陣子每一天都會纏胸去上學,因為我不想接受我是女生的事實,為什麼?
289.206	312.62	因為從我有記憶開始﹐我在﹐我的家裡就只有我﹐我跟我媽媽。我從來沒有有過爸爸的經歷﹐因為我們家是單親家庭。那媽媽在我還是小baby的時候﹐就已經跟我的生父離婚。每一次當我問到我爸爸的時候﹐我媽就會跟我說﹐你爸是一個混帳東西﹐然後說謊嫖妓,樣樣都來﹐然後花言巧語鬼話連篇。
313.2	330.741	然後我就問說那為什麼你們會離婚?他就說因為你爸太好色,跟一個摸摸茶的小姐跑了。然後決心放下一切對婚姻的承諾跟忠貞。那我傷心的媽媽就帶著我,我那時候我的小baby應該還不到一歲吧,我媽就帶著我上來臺北打拼。
330.981	357.283	然後用她的美髮的手藝,辛苦把我拉拔長大。那大家都知道做美髮其實很辛苦。我常常握住我媽媽的手的時候,我發覺我感受到的是她的手粗糙得很像八十歲阿嬤的手。因為每天都要泡在那個化學藥劑當中。然後她是一個設計師,所以每天都要幫客人剪頭髮。可是剪頭髮的時候,往往有時候一擠就會剪到手。所以她的手上面其實有很多的破洞,然後又很粗糙。
357.944	384.975	特別是你們都知道做美髮很辛苦每一天都要站超過十個鐘頭所以我媽媽的腳是充滿著靜脈曲張就是藍色的這樣子那她為了要把我養大她白天開美容院晚上還要出去跑保險看她這麼辛苦我就越發的恨我的爸爸從我七歲開始我就立志不要相信任何的男人對我來說真的是不好意思對現場的弟兄
386.015	412.349	對我來說﹐對當時的我來說﹐男人就只是﹐會用下半身思考的動物﹐用花言巧語把女人騙到手﹐成了他的玉﹐卻可以拍拍屁股走人﹐留下女人辛苦的撫養孩子。我的媽媽呢﹐她用心的﹐用她雙份的愛來愛我﹐也嚴厲的管教我﹐為什麼﹐因為她說﹐我不要我的孩子﹐因為是單親﹐而被人家說家教不好。
413.558	442.125	所以我媽媽總是在管教我的同時這樣子跟我說,小小年紀的我,我沒有辦法選擇我自己的家庭。所以我常常在我的心裡告訴我自己說,我也不想成為單親家庭的小孩啊。我多想跟我同學一樣出生在有一個爸爸有一個媽媽的家。為什麼別人認為理所當然的事情我卻永遠得不到。我卻要因為我是單親家庭的身份而要去承受一些我被迫要去長大要去面對的一些東西。
443.063	465.718	那我知道媽媽的辛苦,所以在體會母愛偉大的同時,我同樣更加厭惡男人的不負責任。我將我的一切不幸福都歸咎於我那個不負責任的爸爸。我立志,一輩子都不相信男人的話,也不愛任何的男人,因為男人都是混帳東西。七歲的我,當時在日記上這麼寫著。
467.108	483.065	國中的時候呢,我的學校有髮禁,就是說女生要剪頭髮在肩膀以上。那我就索性,我就剪了很帥氣的刺蝟頭,就大概是三分再長一點點而已。那我會穿著垮褲,我討厭穿裙子,我很喜歡脫人家,我很喜歡卸人家裙子。
484.087	502.896	然後,那時候在補習班的人都覺得我長得很帥,我也很樂於被人家稱讚,反正我就不是一個淑女嘛,本來天生個性就比較大啦啦一點。然後,其實在青春期的時候,我的生理期一直都很不順。我就去看醫生,醫生就說我天生是男性荷爾蒙比較旺盛,
503.456	522.586	所以我那時候就覺得說,那就索性,那我就乾脆當個男生好了,這樣可以保護我媽媽,不被可惡的男人欺負,然後也不要被這些混帳,不要再相信這些混帳男人,我自己就可以做我自己的主這樣。那我的好朋友呢,大多數都是T,所謂的T就是女童心念當中扮男生的那個角色。
523.746	550.564	那時候我覺得當帥帥的T很酷。大概是因為成長的環境的關係,我從小就很沒有安全感。我對朋友的佔有慾是非常非常強的。恰巧,我當時有一個非常要好的女性朋友。我看到她跟別人講話的時候,我就會吃醋。然後她不找我去上廁所,然後我就會莫名的不爽。然後分組她沒有來找我,我也會很不爽。當下呢,我就把這樣的感覺命名為,曖昧。
551.988	575.163	我認為我跟一個女生有了曖昧,所以我會有這麼樣強烈的反應。但後來長大之後我才知道,原來這個不是所謂的曖昧感情,而是在青春期成長中會出現的同性密友階段。當時的我不曉得,只覺得我好像出現這種跟周遭我那些同性戀朋友那些T他們一樣的情感反應,所以我就應該是個同性戀。
575.623	583.574	這是我們這個世代常常告訴我們的,會忽略我們成長的過程,就直接要我們去相信,直接去命名為之幾世同性戀。
584.65	605.661	那當時的我有一個理論,大家都還記得我在七歲的時候,寫下男人都是混帳東西嘛。所以我有一個理論,在我國中的時候,這個理論更加完整。他說,就是我那時候告訴我自己說,我幹嘛要跟男生在一起,男生跟女生根本就不一樣,男生幼稚又噁心,只會用下半身思考。然後,國中的時候,大家都知道國中男生有時候比較,
606.561	632.073	比較喜歡去碰觸彼此的身體。然後我看到男生那樣子做,我又覺得更噁心。那我會覺得說,男生不懂女生的細膩心思,然後身為女生的我懂。然後男生無法體會生理期的痛,身為女生的我也懂。所以呢,女人何苦為了男人而心傷,我們女人可以互相為伴侶啊。為什麼要去聽那些混帳男人的話?
633.114	656.577	但所謂的這些理論﹐非但不能讓我感到快樂﹐反而讓我更加憤世嫉俗﹐將一切的不幸全部都歸咎於別人的身上。我覺得好像全世界的人都對不起我﹐我那個不負責任的爸爸更對不起我﹐我那個情緒化的媽媽也對不起我﹐我身邊那些好朋友不能隨時隨地陪我﹐也對不起我。
657.756	678.332	我不知道自己是誰,也不知道誰會愛我。內心就好像有一個無底洞,不斷吸走我所有的快樂。所謂我剛剛所講的男人混帳理論,只能片刻地擋住黑洞。卻在每逢我一個人在房間的時候,那個黑洞就會出現,每一次都提醒我,你是一個不被愛的人。
680.555	705.564	那我常常會告訴這個聲音說,你騙人,我有媽媽愛,我愛我自己就夠了,我一點都不缺什麼愛。可是那個聲音會告訴我,但你心中那一份對男人的恨,卻吸走了所有你所得到的愛。你以為朋友的愛、同性的愛就可以補足一切嗎?你心中那份黑洞不去處理,只會越來越貪婪,甚至連你自己都會失去。
706.732	727.192	那樣的聲音似乎懂我的一切,他知道其實我不想恨,因為恨一個人真的好累,特別是當你看身邊的每一個人都想恨的時候。但是我十五年來都是靠著這樣對男人的恨來支持我交朋友,過生活的理論。曾幾何時,我一點也沒有我想像中那麼快樂呢?
728.473	740.801	於是,我就在我15歲那一年,我決定要把我心中的恨放手,交給這個聲音,交給這個很懂我的聲音,然後讓它帶著我走過、放下,並且醫治我。
742.056	763.372	18歲那一年,我媽媽要跟一個叔叔結婚,我緊張到不行,因為我從來沒有跟男人生活過,然後我又很害怕,因為我很害怕這又是另外一個混帳男人。可是那時候我每一天都禱告,我跟神說,神,求禰賜給我一個愛這個叔叔的心,雖然我從來沒有過爸爸,可是我願意把他當作是我的爸爸。
765.64	792.005	為什麼會向神求呢?因為我相信神祂說祂是愛的源頭。那現在我二十四歲了,這六年的時間其實,我覺得神透過我跟這位繼父的關係,不斷不斷修復我裡面很多的東西。在我小的時候,音樂課的時候,每次老師要帶大家唱我的家庭真可愛,就是我的家庭真可愛,我就會大哭的跑出去。
792.705	810.034	小學的時候,然後一個人會把自己鎖在廁所裡面,或者是躲到一個學校沒有人知道的角落。我每次聽到那首歌的時候我就會一直哭,然後我會一直告訴我自己說,我沒有爸爸沒關係,我有媽媽就夠了,我有媽媽就夠了。
810.691	834.512	我有媽媽就夠了。那當每一次心情平復的時候我回到班上我同學都會來關心我就說哎呀你不要難過啦我有爸爸也沒有多好啊我爸爸整天只知道賺錢都不理我然後我越聽到越心酸就是我真的很渴望有個爸爸其實這個爸爸可能再不完美可是我很渴望我能夠生命當中有一份爸爸的愛嗯
835.947	855.813	有一個爸爸有一個媽媽的可愛家庭是我一直很渴望的那我18年來心中的空虛父親形象的缺乏使我不斷不斷穿梭在一段又一段的友誼當中來尋求安慰而且我每天都會埋首於言情小說漫畫裡面希望可以找到填補心中空洞的滿足
856.613	882.971	那我現在擁有完整的家庭﹐到現在已經六年了。在這六年當中﹐神很奇妙的使用我跟爸爸之間的親密關係﹐來幫助我恢復神造我的榮美。我的爸爸其實沒有特別做什麼﹐但是他的陪伴﹐他的肯定﹐再加上媽媽本來就已經給我的豐盛的愛﹐漸漸的填補我心中的空洞﹐更使我在這當中體會到﹐神的愛的大能與一致的奇妙。
884.275	913.009	我先來唸一段經文,是我在回首我過去的年歲當中,包括我非常男性化的過程,包括我迷失在所謂的男人混帳理論的時候,神給我的一段經文。在哥林多前書十五章第十節,他說,然而我今日成了何等人,是蒙神的恩才成的。我再唸一次,然而我今日成了何等人,是蒙神的恩才成的。
913.729	941.184	過去我覺得是咒詛,因為坦白說我們家族的每一段感情都不是很好。過去我覺得是咒詛,過去我覺得是神對我不公平,祂一定特別不愛我,為什麼給我這樣一個家庭,要讓我被迫去面對這麼多的傷痛。但是當我回首,並且我相信這段經文的時候,我知道過去所發生的一切,如今都要成為我的祝福,也要透過我成為別人的祝福。以上是我的見證,謝謝大家。
949.94	978.082	好我們活在一個被社會學家稱為無父的世代你知道嗎有沒有在教會界裡面聽過這個名詞無父的世代你知道這個名詞不是教會界發明出來的名字嗎這個名詞是社會學家形容我們今天這個世代所給的一個新的發明詞
980.418	1007.006	原來連在基督之外在教會之外的人還在救恩之外的人都已經深切的感受到我們今天所活的這個世代是一個看起來有爸爸可是爸爸一直缺席的世代人心裡面最深的一個吶喊聲音跟渴求就是我們需要有爸爸在我們的生命當中
1008.2	1033.493	即便這個社會許多的現實讓我們看到有許多的孩子有許多人的成長過程是極度厭惡他的父親的可是人被造不能抹煞這個神創造我們時候賦予我們的一個事實就是一個人被造需要活在父親和他之間的親密關係中才能夠正常的成長
1034.377	1061.839	如果缺乏父親的同在或是從小缺乏父親的親密關係而留下的那些動跟傷會隨著他的成長過程不時不時的隱隱作痛的影響他影響他的自我形象認知影響他的價值觀影響他判斷的能力影響他的心情和他性格的塑造
1063.985	1085.338	弟兄姊妹你同意嗎?不論你的地上父親的經驗是美好的,是普通的,或是極度惡劣的。我們心裡面都不能夠迴避一個事實,就是我們需要父親。我們需要一個健全的爸爸媽媽的家,而讓我們能夠成長。
1086.783	1116.116	這就是為什麼上帝設立教會這就是為什麼弟兄姊妹你進到淡江這個充滿陽光熱情充滿愛的一個地方阿們好不好告訴你旁邊的弟兄姊妹說我好感恩你成為我的家人告訴你旁邊的弟兄姊妹我們真的充滿感恩我們在地上都有不完全的家庭跟父親但是這位完美的天父他把我們從黑暗裡面拯救出來
1117.227	1139.129	而讓我們今天在這裡,甚至超越血緣的關係親密度,我們成為屬靈的家人。因為這個家,這位父親,我們彼此的兄弟姊妹的關係是存到永恆的。阿們。剛剛我們聽到多加他生命的故事,我相信今天在座當中的每一個弟兄姊妹,多多少少,
1140.009	1166.566	你會感同身受當他在分享他過去成長原生家庭的過程的時候我相信那個故事有觸摸到我們當中的一些人的心我要跟你分享我自己的故事那個我剛剛看週報上面寫說那個鳳林傳道那個愛家愛妻子愛兒孩子的父親我要讓你知道我自己是怎麼樣成長過來的
1167.637	1194.044	我出生在一個既破碎又複雜的家庭裡面。我出生在一個破碎的家庭是因為我的父親母親也是在我還沒有意識的時候他們就離婚了,大概在我兩歲的時候。我出生在一個又複雜的家庭是因為我的父親他的一生當中有十次的婚姻。我是我的父親第六任的妻子生下來的孩子。
1200.162	1229.301	我被生下來之後一直到我29歲那一年將近30年的時間我從來不認識我的母親是誰我在我父親跟我親母離婚之後我又經歷過了不同的保母跟後母我後面還經歷過四任後母還有這四任後母當中之間不同的保母我從小活在一個巨變的狀態裡面不斷的被丟來丟去我的父親
1230.469	1256.353	對我來說他是一個神秘的人物。因為我不知道他是在建立什麼婚姻。我也想不透等我比較大之後,我也想不透怎麼會有女人願意跟他結婚之後然後容許他的先生長期在外面都不回家。然後留下不是他所生的孩子給他養。我完全無法理解。這是我比較大之後我才慢慢疑惑的事情。
1257.637	1283.807	我從小就不認識就不知道我的親生母親在哪裡直到我29歲那一年上帝在一個非常奇妙的預備之下讓我跟我的親母相遇那一年對我的生命雖然那個時候我已經是一個傳道人好幾年可是那一年對我的生命來說是一個極大的醫治跟恢復我跟我母親在我29歲那年我從零開始認識她
1286.118	1304.14	我再回過來說,所以我從小成長在一個非常複雜的環境裡。我的爸爸在世的時候,他是在做色情行業的。所以我小時候依稀有點印象,我爸爸偶然的,他會帶我去他工作的地方。我看到的,
1305.247	1329.976	男女的關係我從小看到的男女的關係我從小看到那個夫妻的關係父母的關係我從小看到家的家庭的印象全部都是負面跟扭曲的弟兄姊妹請問像我這樣子一個成長過程的人在今天的臺灣社會裡面這樣的孩子是不是會重到他父母親的覆轍是不是
1331.954	1360.681	而且我自己在還沒有信主以前,我爸爸意外死亡的那一年,我心裡面發了一個內在誓言說,我要青出於藍,更勝於藍,真的。那一年我才15歲,可是就有一個很偏激扭曲的想法在我裡面,我一方面非常的傷痛,非常的悔恨,一個15歲國三的孩子,可是我那時候可以很深的感受到什麼叫做悔恨,就是我再也沒有機會跟我父親建立關係了,
1361.647	1383.921	我是何等的渴望我可以好好的認識我的父親,因為他長年都不回家的。然後把我丟給不同的後母。我其中一任後母,帶我六年,從我還沒有上幼稚園,一直到我小二。我一直以為她是我的親生母親,但是那六年的當中,她嚴重的虐待我。甚至有一次,
1385.674	1413.341	她突然發了一個大脾氣,我坐在書桌前,她把我的頭,砰,一壓,壓在桌子上面,然後隨手拿起一支圓紙筆,就用力地往我的後腦一插,我當場見血,然後流了一身的衣服的,全部都是流血,然後她把我送到醫院去。這只是其中一個我印象深刻的虐待,我在那六年當中,經歷過非常多的虐待,我的身上都有很多的傷,可是我一直以為她是我的親生母親,
1414.77	1443.759	一直到他要離開的那一天,我才知道他不是我親生母親。前一刻他還做完飯,洗完衣服,下一刻他就拎著一個皮箱出來,然後就給我這個表情,我其實根本不是你親生母親。然後一抹微微的笑,他就拎著皮箱走。然後下一刻我就被我父親帶到我最後一任養母的手中,
1445.555	1472.443	我看到我最後一任養母,第一面的時候,我當場在她住的地方放聲大哭,然後我爸爸賞我一個巴掌。他無法理解,我一個孩子,我多麼的懼怕,一個變動的環境。他無法理解,我心裡面多大的一個矛盾,我又
1473.712	1501.677	我渴望我父親能夠好好的來建立家庭。我渴望我父親不要繼續的把我丟給A保姆、B保姆、A後母、B後母。他不知道我裡面的那個懼怕,的那個衝擊。當我又被換到另外一個保姆的手中,而我以為那個是我的親生母親,可是其實不是。而又被換到另外一個的時候,我無法承受那個變動。
1503.404	1530.428	我成長的過程,就一路這樣子,扭曲、複雜、混亂的過程中長大。到我15歲那一年,其實我爸爸他後來生了重病,然後他一病不起。到我15歲那一年,我爸爸,他過世的前一天,跟我最後一任養母,起了一個非常大的衝突之後,然後隔一天,
1531.578	1558.713	他白天的時候他一個人嚴重的酗酒他是一個身上充滿疾病的一個人可是他嚴重的酗酒結果後來那一天下午回家的時候我就發現他意外死亡他倒在我家的樓梯間趴在樓梯上然後我以為我父親就是昏倒因為他是開腦流過的人所以他會習慣性的暈倒我走上樓梯的時候我才嚇一跳
1560.418	1587.126	我看到我父親吐了一整個樓梯的血,然後血沿著那個樓梯間這樣子流下來。我是我父親過世的時候第一個發現的人。當我信主之後,我常常在回想,為什麼主啊,你要讓我經歷這些東西。一個我,讓我最矛盾的一個親密關係的對象就是我的爸爸。
1589.599	1613.721	祂給我很多的傷害,祂也給我很多的渴望,而祂意外的離開,又是我第一個發現,而我發現祂的離開是這麼一個淒慘的狀況離開。我就在這樣的過程中成長,而我也感謝主,就在我父親意外死亡的那一年,15歲的時候,過沒有多久,
1614.906	1629.945	就有人傳福音給我,在我家附近的夜市裡面,有教會的基督徒發單上。我就開始從那時候接觸福音,然後我被帶去教會,開始參加團慶,參加主日。我是在鄉下教會長大的,在嘉義,很鄉下的地方。
1630.998	1657.728	然後我在那裡後來我自己在禱告中我遇見神我遇見耶穌來造訪我我還記得那三天晚上這是一個非常個人超自然的經歷然後我就在十五歲那一年的時候我就重生信主得救那後來一路的成長到現在我成為一個全職的傳道人我有兩個小孩子老大六歲多今年要上小學了
1658.473	1683.116	然後我的老二剛滿兩歲多。兩個非常非常的可愛。我給我兩個孩子取名,都是單名。我老大叫做詹琴,琴天的琴。Sunny。琴天的琴,陽光的意思。老二呢,叫做詹光。我就知道你會笑。詹耶穌的光。因為
1684.599	1703.625	當我信主之後,我知道,我深深的感恩,我也深深的知道,我上一代那個在情慾淫亂當中的咒詛,從我這一代已經停止了。我知道上帝已經醫治我,並且祂賦予我一個全新的未來。
1704.821	1734.121	我可以在男女的關係我可以在愛情我可以在婚姻的事上在我這一代開始有一個新的盼望因為在基督裡面舊事已過都變成新的了阿們我今天在這裡跟大家分享我的見證包括多家跟大家分享的見識告訴我們當中一些你如果跟我一樣是在破碎家庭是在非常不愉快的原生家庭成長過來的弟兄姊妹我要告訴你在基督裡面
1734.821	1763.784	再悲慘的過去都能夠被翻轉過來。我們不需要在信主之後仍然選擇活在我們過去被撒旦咒詛傷害影響的成長過程環境的負面回憶裡面。你不需要再活在負面回憶的綑綁裡面而一直影響神當你在基督裡之後祂要怎麼樣重新的來祝福你。如果一個
1766.186	1790.282	原生家庭父親有十世婚姻的孩子。父親一生當中在性的世上在情慾的世上混亂的一塌糊塗的孩子。一個從小渴望父親的愛但是卻從來沒有得到父親的愛。而且還親自的遇見看到他父親意外死亡的孩子。他都能夠因著遇見神
1791.459	1819.035	祂都能夠因著與神相遇,而祂的生命被翻轉。今天,祂有一個快十年的婚姻和兩個寶貝的孩子。我要宣告,但這樣的弟兄姊妹們,或是今天在我們當中的新朋友,不管你的過去的家庭成長過程如何,你現在的婚姻關係如何,你現在跟你男朋友女朋友的關係如何,當你在基督裡面,舊事已過都會變成新的。阿們。我們,
1819.991	1839.391	信主之後,我們都被命定要來終結我們上一代的祝福,開啟我們這一代跟我們下一代的祝福,終結上一代的咒術。所以今天我要跟弟兄姊妹來分享,就是父親,我們每一個人都需要爸爸,
1841.459	1869.612	我知道這句話在我們當中有一些人你聽到了非常的刺耳或是非常的心酸因為我們今天在這個所謂無父的時代裡面很多人父親的經驗是非常非常不好的、負面的可是我還是要說當我信主之後當我信主之後我真的還是能夠數算我父親曾經在他短暫陪伴我的時間裡面他所帶給我的一些恩典
1870.776	1890.322	當我還沒有信主的時候,我永遠心思意念裡面對祂就是充滿了悔恨、傷害的感覺、怨恨的情緒。但是當我信主之後,我知道我的父親他是一個人,他不完全。但是這位愛我的天父,他從來沒有放棄我。
