start	end	text
1891.271	1910.179	在我受苦的時候,祂一直陪伴我,祂讓我經歷過這些漫長的、受虐的、孤單的童年,是有意義的。我們可不可以對我們的未來、過去說,每一個受傷、受苦的過去都是有意義的。
1910.879	1937.339	都是為我們這些愛神的人效力的,為要讓我們可以被裝備來幫助在我們後面的世代,更多這樣子背景出生的人,透過我們的傷,能夠來醫治他們的傷。好不好,我們下面的時間,我們有一個四分鐘的短片。我要讓大家來看,在地上,可以真的經歷到父親真實的愛。
1939.292	1965.894	這樣的愛,或許在今天這個世代是非常稀少,但是它確實是真實存在。如果當我們在基督裡面,我們更深的來追求渴慕這位天父,讓你更多的浸泡在天父的愛中,你可以領受父親的祝福。阿門,你也可以帶出父親的祝福,在你未來的服事的當中,教會的生活當中。好不好,我們請同工們關燈,然後我們來看這個影片。Tim Hoyt
1979.48	2004.649	出生於美國麻州的瑞克一出生就是腦性麻痺的孩子四肢無法行動也無法言語只能用眼睛和大家交流許多醫師建議他的爸爸莫迪克和媽媽朱蒂把瑞克送到療養院去但是他的爸爸媽媽並不打算那樣做
2006.22	2032.468	他們決定要盡最大的努力﹐把瑞克留在家裡﹐扶養長大。三歲的時候﹐爸爸為瑞克製作了一臺小推車。小推車是瑞克的雙腳﹐讓他能和弟弟在家裡四處玩耍。他們帶著瑞克出門﹐嘗試讓瑞克做各種運動。
2033.473	2055.295	他可以釣魚,游泳,爬山,甚至當起曲棍球的守門員呢。瑞克活潑的個性,感染了周遭每個人。他不但進入小學就讀,也開始認識許多朋友。雖然有許多波折和困難,但還是一路唸到大學畢業。
2058.114	2075.724	有一天,瑞克的一句話改變了迪克爸爸的一生,也開啟了一段令人動容的旅程。瑞克告訴爸爸,當我們一起跑步的時候,我忘記自己是個行動不變的人,我感覺自己是正常人。
2077.568	2097.897	在那場比賽後,迪克爸爸開始訓練自己成為跑步選手,也為瑞克打造適合跑步的輪椅。迪克爸爸帶著瑞克上山下海。驚人的是,他們持續了33年,迪克父子從未在任何一場比賽中半途而廢。
2109.189	2138.577	迪克爸爸說我只是把我的雙背和雙腿借給我的兒子使用能讓瑞克快樂是天底下最幸福的事
2140.776	2163.489	瑞克兒子說,我這一生最想做的事,是讓爸爸在椅子上,由我來推他一次。長達33年的跑步生涯,迪克爸爸帶著瑞克征服了超過1000場馬拉松比賽,還包括夏威夷鐵人三項競賽和單車橫跨美國的創舉。
2165.742	2187.083	在充滿樂與苦的生命旅程中,競爭他們永不放棄的精神,一家人互相扶持奉獻的愛。這對父子黨以赫特二人組聞名全世界,他們的故事激勵了千百萬人,名為最美的奉獻。
2200.145	2216.193	這是在美國。
2228.524	2257.786	我們拍手把榮耀歸個神。這是在美國發生的一個真實的故事。一個孩子重度的身心障礙。但是當他有一天說爸爸我也想要我也想要參加看看馬拉松比賽、賽跑比賽。你可不可以幫助我?他的爸爸從來都不是一個跑步的運動員。他的爸爸六歲之後就從來再也沒有騎過腳踏車。他的爸爸從小就不會游泳。
2259.65	2274.158	但是,因著他的兒子的要求,他渴望滿足他兒子的渴望。他說,好,爸爸帶你去,爸爸陪著你。然後,這樣的一個父親,六歲起沒有騎過腳踏車,
2275.043	2302.84	也從來沒有學過游泳。他為了他的兒子去學這一切。在那33年的當中,他陪伴他兒子征服了一千次的馬拉松的比賽,各樣的鐵人的競賽。因著父親的愛,因著這個爸爸對他兒子的愛,他去學游泳,他去學騎腳踏車,他願意為他的兒子Rick做任何犧牲的付出,帶著他到處去參加競賽。
2306.152	2309.797	有一次有一個記者來問這個爸爸Dick說,欸Dick,
2311.305	2340.434	你原本都不是一個運動員,你也從來不會游泳的,也不善於騎腳踏車,可是因著你的兒子激發了你,成為一個慢跑,一個馬拉松的一個運動的潛能,那你要不要試試看,可不可以,你有一次,不要帶著你的兒子,你一個人去參加,你一定是會非常的有傑出的表現的,因為你有這種潛能被激發出來,可不可以你去報名一次,你一個人參賽。這個爸爸Dick回答這個記者說,
2341.954	2369.976	我不會獨自參賽的他下面說這一句話我參加比賽純粹是為了和兒子一起跑步、游泳、騎單車享受在這過程中和兒子一起親密的關係請你聽好這個爸爸說的話因為這正是天父今天要對我們每一個不管你信主多久的基督徒所說的話
2371.186	2386.301	我只是單純為了和我的兒子在一起,看到他滿足的笑容,這是我參加任何一場比賽的目的。我不會脫離我的兒子而獨自去參加任何所謂偉大的競賽。
2388.012	2412.934	他說他享受看到他兒子Rick臉上露出甜美笑容時那種帶給他深度的喜樂滿足的感覺這是一個父親他參加這麼多的比賽他付出這麼多的犧牲唯一的一個目的他要跟他的兒子在一起阿門弟兄姊妹你相信你所認識的這位神
2415.64	2440.059	我們稱祂為天父,你相信這位天父他是這樣子的看待你的嗎?你知道祂只有一個目的跟渴望,雖然祂身為一個創造宇宙萬物的真神,但是祂渴望,祂極度的渴望與你有個人的親密的關係,你相信嗎?祂絕對不是一個高高在上遙遠的神,祂非常的渴望超自然的造訪你,
2441.34	2465.505	尤其是在每一次你覺得你非常的孤單沒有安全感。恐懼傷痛被拒絕的時候。每一次當你感覺你的生命沒有價值的時候當你在職場上家庭婚姻上面受挫的時候。那個時刻就是天父他非常的渴望。請到他的愛在你身上的時刻因為。只有你。
2467.125	2491.818	流露出滿足的笑容的時候﹐天父的心才會感到﹐真正的滿足跟喜樂。一個父親﹐他總是渴望看見他的孩子﹐流露滿足的笑容﹐而不是帶著孤單傷痛﹐沒有價值感的活下去。阿們﹐這就是我們的天父﹐我們來看下一張。以賽亞書﹐
2493.148	2509.52	46章3到4節。我們一起來讀這齣經文好嗎?我們一起來讀這齣經文在PPT上面。好,我們一起來讀。1、2,請。雅各家,以色列家一切於聖的,要聽我言。你們自從生下,就蒙我寶寶。
2510.06	2538.004	第四節。我們再回到第三節。神告訴我們什麼?透過告訴以色列人的話,同樣也是在告訴我們這些在基督裡面神的兒女們。祂說,從我們生下來,祂就保抱我們。
2538.916	2561.978	神就以一個父親的形象,熱切的展示祂為父的愛在我們的身上。祂寶寶我們,祂懷吹我們在祂的懷中,第四節。然後,神說第四節是非常重要的經文。祂說,直到你們年老的年紀跟階段,我仍然要熱切的啟示,
2563.166	2581.728	我一個父親的形象在你們的身上。神仍然要更深的向我們啟示,即便到我們年老的,我們都做別人的父親跟阿公阿嬤爺爺了。神說祂都要更深的向我們pour out祂為父的愛。讓我們更深的感受到,
2583.183	2610.613	祂的懷摔,祂的懷抱,即便到我們年老到我們發白,祂仍然要更深的以一個父親的角色跟形象,向我們啟示祂和我們之間的親密關係。這就是為什麼,今天我們在這個世代,不論我們是哪一個年紀,不論是三十幾歲的,二十幾歲的,或是在我們當中五十歲、六十歲以上的長輩們,我們活著都需要父親。阿們。
2611.544	2640.891	我們活著的一天如果在你過去原生家庭成長過程中因著父親的一些傷害跟缺憾你沒有得到醫治那都是天父祂渴望繼續來填滿的那個部分所以我要說每個弟兄姊妹們今天這個訊息不論對哪一個年紀的人神都要攪動你的心祂不要你帶著任何一個過去成長過程中的悔恨跟傷害
2642.142	2667.587	而繼續的。過基督徒的生活。繼續的戴著偽裝演示的屬靈面具。活在人的面前。神要我們做一個自在的神的兒子。自在的有安全感的。有自我形象的活在神的家中。這是我們的父神所以我們來看下一張。所以。
2668.831	2697.862	我要告訴每一個弟兄姊妹,我們不會長大成熟到不再是天賦的小王子或是小公主。你可以告訴你旁邊的這句話嗎?來,告訴你左右旁邊的人。是的,我們不會長大成熟到我們不再是天賦的小王子或是小公主。我們活著的每一天,即便到我們年老髮白,好像以賽亞書46章第4節所說的,
2698.746	2726.556	我們都需要更深的去領受神是天賦的這個啟示。我要告訴大家在這個末世越來越多的混亂不法的一個世代。我們急需要活在這個啟示的裡面。神是我們的天賦。神是一位熱情的神。神渴望尋找我們每一個人向我們啟示彰顯請到祂的熱愛。
2727.773	2738.007	神渴望我們每一個人都知道,我們是他的心上人。阿們。如果你知道你所信的這位神,
2739.07	2764.689	祂是一位充滿情感的神,祂是一位熱切追求你的神,即便你仍然在你基督徒成聖的過程中,有犯罪,有跌倒,有迷失,有軟弱的時候,但是即便在那樣的時刻,你仍然知道這位神,祂仍然以無條件的愛接納你,愛你,肯定你,管教你,扶持你,站起來。神對你的情感這樣的一個啟示,
2765.896	2792.553	會幫助你在這個幕後黑暗的時代越來越多牧者跌倒傳道人跌倒教會資深的同工跌倒的一個時代你仍然可以在神的愛中鋼牆站立你懂我意思嗎今天我們在教會界裡面聽到越來越多同工資深的同工或是甚至是牧長傳道跌倒的事情
2794.48	2814.788	我們有多少人因此我們就活在懼怕的裡面。我們有多少人就活在論斷批評的裡面。可是神透過這些事情要告訴我們每一個代言將的弟兄姊妹。我們需要更深的紮根在你與神是一個父子關係的啟示裡面。
2817.415	2841.477	我們來看下面這節經文,約翰1書4章18節。好不好,我們一起來讀這節經文,約翰1書4章18節。請,愛裡沒有懼怕,愛即完全,就把懼怕除去。因為懼怕裡含著刑罰,懼怕的人在愛裡未得完全。這是我們很熟悉的一節經文說到,愛裡沒有懼怕。
2842.995	2869.649	真正的愛在一個人活在真正的愛裡有一個記號就是你看到這個人是一個充滿安全感沒有懼怕的人不是在他屬靈服侍被肯定的時候被玉冥牧師肯定的時候被他的小組員肯定的時候他有安全感沒有懼怕而是當他有軟弱跌倒的時候
2871.135	2897.406	當他受色情試探誘惑的時候當他在人際關係上面造成別人傷害他自己陷入缺陷的時候當他服事沒有做好的時候他沒有警醒的時候他仍然沒有懼怕沒有控告跟定罪他仍然有安全感說天父我要靠著你的愛和恩典重新站起來
2898.814	2927.827	這是我們這個世代的神的兒女,我們需要活出的一個愛的生命。在神的愛裡面,我們不再是被定罪的。那些在基督的如今不再被定罪,我們不在律法之下,我們乃是在恩典之下的。我要說,這不是縱容我們繼續的在罪裡面,在惡習的裡面不改變。我要說的是,改變的秘訣,就是你要更深刻的認識神為父的愛。
2928.985	2947.468	這樣的愛會激勵你,融化你,讓你不得不從你的罪跟軟弱裡面奔向祂的懷抱,而不是因此活在罪疚裡面遠離祂。我們需要這樣的愛,因此我下面要跟大家來分享,我們每一個人的生命中都需要聽見父親的三句話,
2949.718	2975.985	我們每一個人活著都需要常常的經歷聽到父親給我們的三句話而今天在座的父母親們我們也需要常常給我們的下一代這三句話而今天在我們當中的教會的所有的同工們弟兄姊妹們我們需要常常在神的家中給彼此弟兄姊妹這三句話這三句話是非常非常重要在我們這個無父的世代
2977.415	3006.908	在這個充滿懼怕、定罪、控告、恐懼、自我中心、自我保護的一個世代,我們需要勇敢地活在神的愛中,給予彼此這三句話。第一句話,下一張。這三句話,第一句話就是,我愛你。好不好,我可不可以請弟兄姊妹,你帶著一個家人般的深情的眼神,看著你旁邊的弟兄姊妹說,我愛你弟兄,我愛你姊妹,好嗎?來,告訴你旁邊的人。
3010.691	3028.93	可以的話好不好我請你做筆記在你的週報上面。我們都需要父親的這三句話第一句話就是我愛你。這句話在告訴我們愛是無關表現的接納。我們都需要這樣的愛無關表現的接納的愛。
3030.06	3056.182	我們都知道這三個字不是說說而已就夠了。我們都知道我們需要去感受它。我們需要去看見這句話是什麼意思。需要去經歷這句話的意思。為什麼我們需要聽見我愛你呢?聖經說在愛裡沒有懼怕。當我們被告知我愛你的時候。我們就會在愛裡面得到釋放跟完全。從那個恐懼不安的裡面得到釋放。我們要來看下一齣經文。
3058.08	3083.432	《馬太福音》第3章16-17節,我們來看耶穌的例子。這邊說,耶穌受了洗,隨即從水裡上來。天忽然為他開了。他就看見神的靈彷彿鴿子降下落在他身上。從天上有聲音說,這是我的愛子,我愛他,我喜悅的。如果你是讀自己的聖經,我要請你把這是我的愛子把它圈起來。
3084.582	3107.163	這段經文讓我們看到, 耶穌開始出來公開三年半在地上的服事的時候,祂先去約旦河受約翰的洗禮。而在那個洗禮的當中, 聖經記載一個超自然的現象就是,當祂在洗禮起來的那一刻,有一個清楚從天上來的聲音,對著耶穌說,這是我的愛子,我所喜悅的。
3108.217	3120.999	這個愛這個天父對祂的兒子耶穌所說的我愛你這一句話是在告訴我們我們每一個人都需要無關表現的接納為什麼
3121.92	3149.068	因為,請記得,耶穌聽到這個超自然啟示的聲音的時候,是祂剛開始出來服事的時候,也就是祂一個神蹟,一篇偉大的講道,一個超自然的一致四方的事工都還沒有做的時候,你懂我意思嗎?祂只是一個Nobody的時候,祂預備要出來三年半轟轟烈烈偉大的事奉之前,
3150.23	3173.291	神就告訴他說,我愛你。不因為你現在有沒有建立五百人的教會,一千人的教會,你趕鬼的多少事,你講過多少偉大的講道。No,天父就告訴他的獨生愛子說,我愛你。我對你的愛是無關表現的,我完全接納你這個人。
3173.951	3191.005	耶穌都還沒有講過任何一篇偉大的講道。祂還沒有行過任何一個神蹟騎士。祂也沒有醫治過任何一個人。天父就對他說,我愛你。親愛的淡江的弟兄姊妹們。天父今天同樣要對你說,祂愛你,無關你任何的表現。
3191.527	3220.175	無關你在這個教會裡面﹐你有沒有任何﹐榮譽的﹐服飾頭銜。無關你在職場上面﹐你有沒有任何﹐受人肯定的頭銜﹐地位、身份、收入。祂愛你﹐因為你這樣的存在。你懂我意思嗎?祂愛你﹐因為你就是祂所造的﹐這樣的一個美好的創造。祂對你的愛沒有任何的條件。所以弟兄姊妹﹐
3221.442	3248.479	無論你過去犯了什麼樣的錯,無論你過去有什麼樣的罪,無論你過去活在什麼樣的家庭裡面,你受過什麼樣的傷害,天父都告訴你,不要用過去的傷害,不要用你過去所曾經跌倒陷入的罪中,來定義現在的你。你要用天父對你的定義來定義你的身份,來確立你的自我價值。你是蒙愛的兒女。
3250.213	3278.904	你是萌愛的兒女。這是神所告訴我們,我們所需要的第一句話。第二件,第二句話,就是我以你為榮。下一章,天父告訴我們,我們活著需要常常聽見這句話,我以你為榮。這個意思是我們每個人都需要肯定。我們每一個人都需要肯定。好,我們要來看下面這出經文。剛剛我們所讀的是馬太福音第三章,過了十四章之後,
3279.991	3309.181	哇塞!他已經開始到處傳講許多偉大的講道、信息。蘋果的福音,他也帶出了許多的神蹟騎士的作為在地上。過了十四章之後,我們來看《馬太福音》十七章。這裡講什麼?好吧,我們一起來讀自己的經文。十七章,1、2、7。說話之間,忽然有一光明的雲彩遮蓋他,且有聲音從雲彩裡出來說,這是我的愛子,我所喜悅的,你們要聽他。
3310.708	3322.971	17章第5節,這裡是耶穌從剛剛第3章一跳跳的14章之後,出現的類似的神對耶穌說話的經文。而這個時候,耶穌
3324.514	3349.146	已經做了很多的事情。這挑了17章的過程當中,耶穌成就了許多的神跡奇事,祂成就了許多的事工,祂擺上了許多服事的心力,祂醫治,祂教導,祂行神跡奇事,祂也被人拒絕,也被人接納。原本有許多的人跟著祂,但是也隨著祂越來越強調十字架的信息,跟隨祂的群眾也越來越少了。
3350.555	3378.88	你知道耶穌剛出來服事的時候,動輒上萬人,數千人,跟著祂,你知道嗎?所以才會有五柄二魚餵跑五千人、四千人的神蹟。動輒,祂到哪裡?那裡就是一個萬人教會,千人教會。可是到了17章的時候,請你記得,如果我們參考約翰福音,你會知道,到耶穌服事的中期、後期,越來越多人就退去了。
3379.65	3404.874	因為耶穌的信息越來越嚴厲,越來越嚴肅,越來越要求。耶穌說,若有人要跟從我,就當背起他的十字架來跟從我。耶穌說,你們這些跟隨我的門徒,你們都會受,預備都會受到逼迫。將來你們在館長面前,君王面前受逼迫的時候,你們要怎麼樣怎麼樣做?你會看到這些信息出來,有越來越多人都覺得,
3406.954	3436.396	跟隨這位彌賽亞，原來這麼的辛苦。這真的是彌賽亞嗎?然後就退去了。許多人只是為了吃飽,只是為了看神蹟,只是為了從耶穌身上得好處,他們就退去了。我要說的是,你要看到耶穌在這個時候,17章的時候,祂的服事有一定的成就,但是祂的業績,我們可以這樣說嗎?祂的教會業績,祂的神國事工業績,好像怎麼倒退了?
3438.097	3466.272	那些剛出來的時候,動輒上萬人,數千人的場面,越來越多人退去了。可是就在這個時刻,17章第5節,耶穌祂又得到了另外一個經歷,在變相山上,神又再一次的超自然顯現對他說,這是我的愛子,我所喜悅的,你們要聽祂。你知道這句話是在標明什麼嗎?是在標明神,祂肯定耶穌,
3468.456	3486.998	祂說我以禰為榮。阿們這是神在告訴天父在告訴耶穌說我以禰為榮而這句話今天同樣天父要對我們每一個人說孩子我以禰為榮你不要再自貶你自己你不要再妄自菲薄
3487.841	3512.509	你要看到這位熱情的天父,他以你為榮。你今天坐在這裡敬拜神,就是神以你為榮的一件事情。你今天在這裡聽到這篇信息,你的流淚,你心裡面的攪動跟掙扎,那就是神看為為榮的事情了。神說我以你為榮,這是在告訴我們每一個人,我們每一個人活著需要被肯定。
3513.387	3534.228	我們活著需要無關表現的接納。我們活著也需要被肯定這件事情。神祂肯定你。祂肯定現在的屬靈光景的你。即便你覺得你還有很多的問題,你還有很多的軟弱,
3535.077	3562.8	不好的習慣需要成熟可是神肯定你繼續抓住他跟隨他不斷跌倒又再站起來他肯定你這樣的心阿們我求神的話釋放我們每一個人讓你更深的渴慕來追求認識這位愛你的父神他以你為榮他說你是我的驕傲阿們我們生命中需要的第三句話就是
3564.241	3590.476	你做得很好。好不好,你告訴旁邊的人說,你告訴你旁邊的人說,天父以你為榮。好,告訴你旁邊的人。天父以你為榮。然後再告訴你旁邊的人,天父說,你做得很好。天父說你做得很好。阿們。我們生命中需要父親的第三句話就是,我們需要天見天父對我們說,我們做得很好。
3591.988	3620.61	我們再來看17章第5節,好嗎?下一章。同樣的一節經文,我們再來看這一句話,它說,這是我的愛子,我所喜悅的,你們要聽他。這個意思就是,天父在告訴耶穌說,你做得很好。也就是你們有沒有看到,天父從來沒有因為耶穌,後來跟隨他的人數,教會的人數越來越少了。少到最後剩下12個門徒而已,少到剩下最後只剩下多少個門徒?
3622.193	3644.723	臨個門徒，在克西馬尼園那一夜。欸,妹媽，如果玉民哥服，啊,不,我開玩笑的。如果玉民哥服侍到有一天是這樣子的時候,你們能肯定他仍然是一個衷心熱情的牧師嗎?為什麼沒有聲音呢?他不在我就亂開玩笑,沒有,好。
3645.998	3667.106	其實我跟玉銘哥不是那麼熟,因為我進華省一年級的時候,他已經是三年級的學長。所有的學長當中,他讓我有一個非常深刻的印象就是,他是一個full of compassion,一個充滿熱情的人。我相信他的講道,讓大家共有的印象就是這樣,他是一個充滿熱情的人。
3667.944	3687.524	那個脊椎盤突出,也不能夠勝過他的熱情,對不對?他現在有沒有比較好一點?有齁。我還記得,哇,在華盛頓那時候,他坐著輪椅去上課。但是,你知道,天父以他的熱情為榮。天父說他做得很好。
3688.336	3715.71	不關乎我們服侍有沒有多少人為我們拍掌稱讚。不關乎我們服侍帶來多少小組員進到小組裡面,我們有沒有持續的增長。不關乎我們是不是樂團、金牌團,更professional,更專業,更有品質。不關乎這些,神因著我們一顆熱切愛祂,一個回應父神的愛的心所做的一切,神就告訴我們說,孩子,你做得很好。
3716.937	3729.366	你是我的驕傲。我以你為榮。我們需要的第三句話就是你做得很好。這告訴我們我們每一個人都需要被認同。
3730.486	3758.648	我們每一個人活著需要被認同。當父親說你做得很好的時候父親是在告訴你他為你所做的事情背書。背書是什麼意思呢?就是在支票的後面簽上你的名字表示你用你個人的名譽來擔保這張支票是有效的。選舉的時候為某人站臺表示這個候選人所說的話我用我的人格跟名譽來擔保。
3760.708	3782.708	這就是背書的意思當天父說你做得很好的時候天父對耶穌說天父同樣也對我們所有在基督裡面祂的孩子說弟兄姊妹你做得很好不要論斷自己不要活在不安全感的裡面一直跟別人比較不要遠離祂
3784.224	3811.608	你做得很好。你所需要的就是繼續的抓住父神的愛。活在祂的愛裡面。健康的長大。健康的在教會裡面服事。阿們。祂為你背書。當神公開替耶穌背書的時候。神顯明一個榜樣。神顯明一個事實就是我們人活著就是需要被認同。無關表現的接納。我們需要被肯定。我們需要被認同。
3812.227	3840.923	如果我們失去父親這三句話,我們會失去很多的祝福,而且我們會落入許多負面的影響。哪些影響呢?我們來看下一張。再下一張。如果我們生命中,如果我們的親子關係中,如果我們的教會生活中,不常聽見父親這三句話,不常充滿父親這三句話的價值信念運行在教會的環境裡的話,我們會
3842.892	3870.036	帶來這些影響。第一個,你會有深切的不安全感。第二個,你會容易被虛假的身份傷害。第三個,你會活在不成熟的生命當中。想想看這幾個,是不是跟你有關。第四個,你會變得很自私。服侍、付出會變成是一個出於自私動機的一種表現方式。表現主義、功利主義、成功的思想。
3871.442	3880.707	那都是因為缺乏活在父親的愛的那個安全感跟滿足的裡面。第五個,甚至會造成你個人生命的自我毀滅。
3882.654	3912.154	我們教會在過去三天,週四到週六,我們辦了三天的愛與關懷同性戀的研習會。這是我們在中正區的教會裡面第一次辦這樣的研習會,連結中正區的教會跟其他外教會。我們真的是戰戰兢兢的。因為你知道前一陣子,那個奇怪以前臺灣那個晚間熱門新聞都不會報教會,然後前一陣子一堆的教會都出來了。然後就是看到不斷的有攻擊抹黑批評教會的事情。
3912.654	3913.155	阿們。
3928.473	3948.227	我希望我們大家的教會也起來擁抱這樣的諸君。而你知道那些在同性戀傾向上面掙扎迷惘的人,其實他們真正的問題跟需要不是性,而是親密的關係。尤其是我們發現,許多的研究發現同性戀者,同性戀傾向的朋友們,
3949.36	3961.888	很多都是因為從小跟父親跟母親尤其跟父親的關係是不正常的是缺乏的是有破碎的而你看到這五個影響都是
3962.91	3990.685	和我們每一個人相關,不只是同性戀者,我們每一個人相關。當我們缺乏父親這祝福話語的影響力的時候,我們就會落入到這些問題的裡面。那麼最後,我們應該要怎麼樣來去領受天父的祝福呢?當我們知道,我們生命中,我們的教會中,我們的親子關係中,家庭中,我們需要常常的聽見父親這三句話,那麼最後,我們要怎麼樣領受天父的祝福?第一個,下一張。
