start	end	text
3991.903	4019.004	我們需要接受,上帝成為你的天父。我知道今天在我們當中有一些,你還沒有決心要來認識耶穌,接受耶穌進到你生命中的朋友們。今天我在一開始的時候,跟一個第一次來的弟兄,我還要說,是誰邀請你?啊,我自己進來的。好,我們等一下要給他一個瘋狂的愛的關懷問候。今天在我們當中的一些新朋友們,我真的誠摯的邀請你,
4020.452	4030.339	做一個單純的決定就是來回應這位愛你的天父這位神跟我們在臺灣滿天神佛的神明不一樣
4031.664	4054.377	沒有一位神像這一位神他自稱他是創造宇宙萬物獨一的真神也沒有一位神像這位神他說他向我們啟示他自己是他是一個熱切愛我們的神我們沒有一個人活在臺灣這個社會環境裡面會說觀音愛我媽祖愛我三太子愛我玄天叉叉愛我
4057.466	4072.423	只有這位神,祂不斷地藉著聖經告訴我們,我們是祂的孩子,祂是我們的父親,祂熱切地要追尋我們。我邀請大家,尤其是在我們當中的親朋友,
4073.012	4101.786	接受上帝成為你的天父。我們來看下面這節經文好嗎?耶利米蘇三章十九節。好,我們一起大聲的來讀這節經文,請。我說,我怎樣將你安置在兒女之中?我又說,你們必稱我為父,也不再轉去不跟從我。這節經文是神對以色列百姓所說的話,他同樣也是對我們今天每一個相信耶穌的兒女們,
4102.688	4126.25	祂對我們說,我怎樣將你安置在兒女之中?請你記得這句話在講什麼?神祂是用什麼樣的眼光看我們?所以,我要再次的說,不要用你過去成長的原生家庭的經歷來定義現在的你。就像我現在,我不會用我過去成長的原生家庭實質的,我爸爸實質混亂的婚姻來定義我自己是一個
4128.422	4152.337	亂七八糟家庭生的孩子,沒有人要的孩子,被丟來丟去,我不會這樣定義我自己。雖然那曾經是我生命成長過程的事實,但是真理大過我所經歷的事實。當你越讓真理來引導來定義你的人生,你就會越活出一個榮耀的見證,讓世人驚嘆,一個人這麼樣的破碎跟混亂,
4153.387	4176.123	他卻可以活出,今天可以活出如此的健康跟有自信,因為他認識誰才是他真正的父親。神告訴我們,我將你每一個人擺在兒女的行列中,不是擺在奴隸的行列中,不是擺在孤兒的行列中,神視我們為他的兒女,然後他說,你們必稱我為父,不再轉去跟從不是父親的神。
4178.575	4204.154	不再轉去尋找父親以外的情感需求。今天有多少的人活在性的氾濫的裡面,同居,不斷的換男女的朋友,或是在夜店的裡面,或是在外面的各式各樣的享樂的裡面。其實人真正的需要不是那些東西,而是需要親密關係。
4206.544	4228.181	而今天聖經告訴我們,只有我們找到創造我們的源頭那位父親,我們那個對親密關係的渴求才會得到滿足,我們的靈魂才會得到安息。第二,下一章,我要鼓勵大家,你要領受祂的祝福,並且回應祂。好不好,你願不願意打開你的心門,
4229.155	4255.096	在待會的時間,我們來禱告的時候,你就邀請祂進到你的生命中。你可能從來不認識這位神是誰,但是這位神簡單的告訴你,祂是你的父親。祂在告訴你,祂知道你從母婦出母胎,一路成長到今天,祂知道你所經歷的一切。祂要來醫治你,祂要讓你知道你是被愛的,你是被接納的。第三,
4256.681	4285.274	我要鼓勵大家,你要用神對你的接納來定義你的身份。神對你的接納就是剛剛我們所說的父親。我們每一個人活著需要父親的那三句話,還記得嗎?可不可以大聲的跟我一起來複述那三句話。第一個,我愛你。我們每一個人活著需要無關表現的接納。第二個,你需要什麼話?我以你為榮。這在表示我們每一個人都怎麼樣?我們需要被肯定。第三個,
4286.391	4314.282	你做得很好。這告訴我們每一個人都需要被認同。你的存在,你這個人是一個怎麼樣的,需要被認同。而天上的這位父親,祂要你用祂的眼光來定義你的身分。而那個關鍵是你今天要做一個決定。在我們當中的新朋友,你要接受耶穌進到你的生命中。耶穌祂在地上,就是彰顯父。
4315.418	4328.474	當你接受祂,你就會可以感受到﹐這位神是一位怎樣的神﹐祂愛你。而今天在我們當中﹐所有已經信主的基督徒們﹐我們需要重新的來認識﹐神是父親﹐這樣重大的啟示。
4329.701	4351.603	祂關係著我們越活在一個黑暗充滿事態,許多不法的事、跌倒的事,讓人愛心會漸漸冷淡的一個世態,我們怎麼樣仍然熱情的委身在教會的裡面,健康的和弟兄姊妹相處,建立關係,活出一個健康的服侍生活。我們請敬拜團上來。好吧,我們一起,閉上我們的雙眼,我們來禱告。
4355.589	4384.555	跟弟兄姊妹說聲抱歉,我們今天有見證有影片,所以我們時間有些delay,但是好不好讓我們仍然在最後這短短的回應的時刻,我們透過詩歌,我們透過我們在神面前的淚水,我們透過我們的悔改,今天神透過這邊的信息,一定讓你心裡面,浮現出許多的思想回憶傷痛,甚至
4387.449	4411.04	讓你感受到有一些事情你需要悔改到祂的面前。今天的信息甚至光照我們當中有一些人,你可能還活在一些黑暗跟罪的裡面。你有懼怕,你有一種罪疚感,你有一種不配的感覺,但是,我們今天要讓這位愛你的天父對你說,孩子,
4413.422	4438.611	你不論是在什麼樣的生命光景,你永遠是我的孩子。我愛你,我肯定你,我接納你,回到我的面前。我今天特別有感動要為在我們當中,你是跟我類似,你成長的過程中一直受到傷害,你一直受到一個沒有健全的爸爸,
4439.991	4448.994	繁體中文，臺灣國語。繁體中文，臺灣國語。繁體中文，臺灣國語。繁體中文，臺灣國語。
4466.544	4476.502	今天天父的愛要來釋放我們當中有這樣需要的人。請親愛的團來帶我們唱這首詩歌。讓我們每一個人從座位上站立起來好嗎?