start	end	text
3.968	31.978	各位姊妹平安，我們一起來思想,列王記上第十九章的第一節到第八節。國王雅哈就回到耶穌列城,將以利亞今天一整天在加密山上所行的一切事,以及他如何最後得勝了,並且用刀殺了這些假先知的事情,都告訴了皇后耶洗別。
33.097	36.603	耶洗別的意思就是巴黎在哪裡呢?
38.114	65.994	那早期,我們從第十六章,雅哈迎娶祂的時候,因為雅哈那時候想要在以色列北國,大力的推廣巴黎崇拜。所以呢,這個雅哈,巴黎在哪裡呢?因此他們從西頓,就把巴黎的信仰,大量的引介進來。所以呢,巴黎在哪裡?巴黎一開始在西頓。所以耶洗別的意思就是,巴黎在哪裡呢?
66.817	86.717	那到第19章這邊,這個巴力的先知都被殺光了。巴力也被證明是假神。因此這邊,耶洗別的名字又成為另外一個反諷,就是那如今巴力在哪裡呢?那但是耶洗別呢,也不是省油的燈。
87.858	103.532	耶洗別聽見雅哈跟他說的,就差遣人去見以利亞。這時候雅哈、耶洗別、以利亞都住在耶穌列城裡面,因為耶穌列城就在這個加密山的山下,不遠的地方。
105.265	125.645	我想以利亞在那邊可能正在等候好消息,因為他想說今天百姓已經知道耶和華才是真正的神。因為以利亞這個名字的意思就是耶和華是神。他想說今天一定會得到一個非常圓滿的結果,就是整個北國要重新整個回歸歸向神。
126.186	140.217	因為祂一直相信一件事情,耶和華在祂身上給祂的呼召跟使命,就是要使這個明星重新回歸神。就如同在第17章的時候,祂到西頓的撒勒法寡婦的家,
141.067	170.549	我們在那邊曾經分享過,這個西頓的婦人,知道自己活在罪中,而當耶和華隨著以利亞來到他家的時候,他就知道這個神要來審判他的罪,
171.049	198.232	或對付祂的罪。然後祂的孩子死了。祂直覺的反應就是因為我的罪。然後神追討我的罪。所以連帶我的孩子就死了。西頓的婦人﹐有罪的西頓婦人﹐我們可以把祂想像成是耶洗別﹐或是巴力崇拜﹐或是壞國王雅哈。死掉的孩子﹐我們可以想像是以色列。後來以利亞把這個死掉的孩子抱到自己的床上。
199.104	227.992	然後服在他的上面,三次向耶和華禱告說,耶和華,你讓我來到這寡婦的家,難道就是要讓這個孩子遭到災禍,使這個孩子死掉嗎?那,以利亞相信他的服事,不是一個叫人家死的服事。他相信他的服事,是叫人活的服事。因此呢,他就三次的禱告,孩子就活了。
228.695	235.449	三次禱告到18章的第一節講到以色列那非常嚴重的飢荒跟乾旱
236.459	264.945	也是三年所以這個又是一個山對山的一個比喻因此呢整個十九章的時候以利亞他想說在加密山上的這個大戰甲先知耶和華獲勝了以利亞獲勝了應該等待的就是勝利的甜美的果實以色列民心要整個歸向耶和華想不到耶洗別就猜前人去見他說明日約在這時候
265.964	277.311	我若不使你的性命像那些人指的是四百五十個拜巴力的假先知的性命一樣,願神明重重地降法於我。
278.456	299.411	這番話讓以利亞的反應是什麼?第三節以利亞見這光景見這個字有些經文翻譯翻成是害怕以利亞看見這光景或是他就害怕了他就起來逃命從這個逃到了南邊的猶大的
300.162	329.537	別氏巴從北部的耶穌列平原到南部的別氏巴大概150公里他一路狂奔然後到了別氏巴之後呢他就把他的僕人留在那裡自己在曠野漫無目的地走著一日的路程來到一棵羅藤小樹下坐在那裡心灰意冷要求死說耶和華罷了罷了就是夠了
330.708	354.165	求禰取我的性命吧,因為我不勝於我的獵主。我沒有比我的獵主更好。我沒有像我跟我的獵主一樣,沒有辦法挽回這個已經失敗的局面。我是一個失敗的侍奉者。然後呢,他就躺在羅藤樹下,太累了,身心俱疲,就睡著了。
355.93	364.8	為什麼這個以利亞在第18章的時候他當了一天全國的大英雄為什麼到第19章的時候
365.52	389.896	祂當場就變成了逃命的大狗熊。為什麼一個這麼有信心的先知,得勝的先知,三年的躲藏,然後在第17章經過生命重重被主磨練,好不容易被神見證,被神培育起來的一個偉大的先知,神的僕人,怎麼會
390.862	418.149	耶洗別一句話,就把他嚇到逃跑了。然後對自己的侍奉心灰意冷,甚至想要求死,要自殺。這會不會太誇張了?很多人就真的是百思不得其解。那我想可能有幾個可能的原因,但是我們無法確定到底是哪一個。第一個就是,這個以利亞,他在這個加密山上,
419.65	436.438	他下挑戰書是給雅哈王所奉養的450個拜巴黎的假先知,跟耶喜伯王后所奉養的400個拜亞瑟拉的假先知。
437.278	459.412	但是我們看到第18章的時候,真正跟他交手的只有那450個拜巴力的假先知,而最後被殺的也只有這450個拜巴力的假先知。那400個拜亞瑟拉的假先知,這些是約洗別的人馬,他們到底發生什麼事?
460.333	472.335	他們要嘛就是沒有上山接受挑戰但是這個可能性很小第二個就是他們有上山可是呢這個他們
473.37	493.161	他們沒有跟以利亞對抗。而以利亞也在打敗了450個巴力甲先知之後,他沒有動手把在現場的400個約洗別的人馬,這些拜亞瑟拉的甲先知,一併把他殺掉。
494.718	522.088	這給我們很大的困惑所以很可能是以利亞他本身有一種恐懼他一開始可能就判斷真正在這個國家操縱整個國家的垂簾聽政的可能就是這個皇后耶洗別因此他可能一開始他就不太敢惹耶洗別這是一種猜測以至於他明明打勝仗但他卻不敢去動到耶洗別的人
522.568	540.159	以至於在十九章的時候,耶洗別知道,哦,原來以利亞你怕我,所以呢,我就去恐嚇你,看看你有什麼反應。這是一種可能性。第二種可能性是,耶洗別跟他四百個拜亞瑟拉的假先知根本不屑,
540.879	564.541	去跟這個以利亞應戰。所以他們根本沒有上山。所以到第十九章的時候呢。耶喜別他就換耶喜別來挑戰這個以利亞。那以利亞為什麼會忽然要逃跑呢?如果他不是像第一種情形是他害怕耶喜別。因為他知道耶喜別可能是國中真正掌權的人。
565.026	590.355	雅哈可能都對他太太言聽計從以至於他敢動雅哈的人他不敢動耶洗別的人這是第一種原因但如果不是這第一種原因純粹是耶洗別不屑回應雅哈的這個伊利亞的挑戰那為什麼在第19章他只是一句話去挑戰伊利亞伊利亞就逃跑了很可能是伊利亞對於他侍奉的結果大失所望
591.288	613.586	他覺得他打了一個天大的勝仗,百姓看起來也都回歸到耶華的面前,可是這個結果竟然沒有辦法使得耶洗別他屈服,以至於這個以利亞對自己侍奉的結果,大失所望,心灰意冷,然後產生一種極度的厭倦,不想幹了。
614.445	636.5	然後呢,就不僅是辭職,還求死。那我們看到這兩種可能性,可能都有,也值得我們去思考。所以呢,以利亞這個睡著睡著,就有一個天使拍他,說起來吃吧。他觀看見頭旁邊有一瓶水與炭火燒的餅,他就死了喝了。
637.346	648.033	然後仍然躺下。然後呢,使者第二次來拍他。然後他就起來吃了喝了。使者告訴他說,起來吃吧,因為你當走的路甚遠。
649.224	672.879	藏著這飲食的力量,他就走了四十晝夜,到了神的山,就是河列山。弟兄姊妹,這邊讓我們看見,對於一個心灰意冷,或是害怕逃寶的先知以利亞,神沒有接受他求死的禱告。所以不要隨便跟神做求死的禱告。神說,你要走的路還很長遠,先起來吧。
673.319	696.619	然後就仗著這個飲食的力量,他就能夠到神的山去朝見神,當面跟神問個清楚,當面跟神談個清楚。今天的經文給我們很大的提醒,不論以利亞是哪一種問題,可能是他一開始裡面就有一個盲點,他其實一開始就決定不要去碰耶洗別,
697.278	709.734	那這個註定祂的侍奉,就會產生很大的失敗。如果我們一開始侍奉的時候,我們也是避重就輕,不去面對我們生命中最關鍵的那個問題,而是繞著祂旁邊打。
710.674	726.451	那這個通常不會有什麼太大的果效那如果是第二種情形是因為好像轟轟烈烈做了這麼大的浮世結果呢好像結果不如我們所預期我們就心灰意冷辭職不幹
727.432	746.409	那如果是這種情形也給我們很大的提醒我們是不是常常也這樣跟神鬧脾氣甚至動不動就說要不幹了、不來了甚至還求死我想神都不樂意看見我們用這種鬧脾氣的方式跟祂反映我們的情緒願神祝福大家