start	end	text
5142.493	5153.217	我也聽到有一位弟兄的話,他的工作很辛苦的,剛退休,居然把他整個退休金全部捐出來。
5153.217	5154.338	經濟上不是很豐富的。
5154.940	5158.584	然後黃牧師說,你這錢我絕對不能收了。
5158.584	5165.871	結果他說,黃牧師,我這錢不是捐給你的,我這錢是捐給我們的主的。
5165.871	5168.093	我聽到以後,我真的是極其感動。
5169.155	5173.678	求主幫助我們,讓我們真的就是願意來投進去。
5173.678	5183.825	很多年前,快20年前的話,李秀全牧師,我們很尊重的牧師,講過一篇道,講到宣教的話要仁道、賢道、禱告道。
5183.825	5192.111	那麼十幾年前我在這邊,我也把這篇信息,我用我的方式來表達,來分享過。
5192.111	5197.095	我們代言教會,我們要十年,多少堂?
5199.770	5202.592	居然答不出來,對不起。
5202.592	5205.354	現在我們有幾堂?
5205.354	5207.896	現在第一堂什麼堂?
5207.896	5208.576	淡水堂。
5208.576	5210.037	第二堂什麼堂?
5210.037	5210.498	淡海堂。
5210.498	5212.479	第三堂什麼堂?
5212.479	5213.059	桃園堂。
5213.059	5215.001	第四堂呢?
5215.001	5216.282	不知道。
5216.282	5222.086	那如果請問用算數來算好了,如果十年二十堂的話,平均一年要幾堂?
5224.053	5231.920	我們第四堂,我想今年第四堂最少出來的可能性會非常高吧。
5231.920	5235.884	我們不能用賭的啦,但如果要賭的話,我敢押今年會有第四堂跑出來。
5237.824	5247.631	每一個堂要開始的話,跟宣教一樣,就是人道、錢道、禱告道。
5247.631	5251.634	人要投進去,錢要投進去,禱告要投進去。
5251.634	5254.977	我們都投進去。
5254.977	5261.442	我們跟我們教會的一個莊牧師的意向,我們既然認同了,我們就一起往前走。
5262.022	5275.609	好,我們看了彼得,看了百夫長,看了雪洛夫人,看了瓊寡婦,另外這位女士的話呢,她把那麼貴的香膏,就交在主耶穌基督身上。
5275.609	5285.954	這個的話,其實你如果回去看的話,四福音裡頭都講類似的故事,未必講的是同一個故事,但是都是交的。
5285.954	5313.401	這裡頭很重要的一點的話呢, 主耶穌基督說, 祂是盡祂所能的。
5313.401	5317.384	所以這是一件非常好的美事。
5317.384	5323.568	將來你不論在哪裡,傳福音你就要講這件事情,我今天就要講這件事情。
5323.568	5325.889	你也要出去講,好不好?
5325.889	5339.831	我們一方面要把我們所有的交在主身上,另外一方面一樣的, 回頭的話,我們希望聖靈澆灌在我們身上。
5339.831	5341.492	阿們,好不好?
5341.492	5346.575	我們求神幫助我們,讓我們的生命的話,我們能夠往前走。
5346.575	5350.597	第一個例子我講的是亞當守在那邊。
5350.597	5380.957	我講《創世紀》二章的時候,我特別會請弟兄姊妹要留意的,就是你要很認真的守在那邊的時候的話, 我們不能停在那邊,因為2023年神在你身上,可能要做新事,可能要擴張你,可能要像2009年,我們沒有預知的情況下,被曠野開道路,燒木開江河,然後就跑到這裡來了。
5381.920	5382.820	對不對?
5382.820	5384.221	跟你們講了嘛。
5384.221	5387.003	江河是淡水河旁邊的淡江教會嘛。
5387.003	5387.843	對不對?
5387.843	5390.204	那你的生命當中,會怎麼樣?
5390.204	5390.965	不知道。
5390.965	5395.527	但是呢,我們把我們所能的,我們交在主身上。
5395.527	5400.890	看看聖靈,看看我們的主怎麼教我們,讓我們的生命被他所用。
5400.890	5401.971	阿們。
5401.971	5421.171	好,我們第六位的話呢,是要講,我們,這也是我肯定,肯定, 我們在生命當中,我們還在世上的時候,弟兄姊妹,我們每一位都來傳福音,學習保羅好不好。
5421.171	5425.993	然後,我們一起到天上去排隊,去見保羅。
5425.993	5428.374	我想他那個長龍,不知道有多長。
5428.374	5433.317	那我不知道天上他有沒有可能同時跟一百個人同時對話。
5433.317	5438.719	但是我真的很想跟他,他說,我就用他的羅馬書,他寫了13到14本。
5440.060	5442.042	新約的書,對不對?
5442.042	5446.166	那是新約時代最重要的神的仆人之一。
5446.166	5449.529	然後,祂不是十二門徒,要記得,對不對?
5449.529	5451.972	那祂的羅馬書是我最喜歡的。
5451.972	5454.814	我們把羅馬書一章一節讀一下好不好?
5454.814	5460.500	耶穌基督的仆人保羅奉召為使徒,特派傳神的福音。
5460.500	5462.142	我把這個傳字要抓出來。
5463.285	5466.987	祂傳,我們也來傳,好不好?
5466.987	5477.413	然後我們今天敬拜的時候,今天禱告的時候,我們被帶動了,我們要來為傳福音,我們來禱告。
5477.413	5492.492	求神帶領我們,我們往前衝的時候,我們像保羅一樣,我們免得將來碰到祂,真的排上隊的時候,祂說, 你在世上福音傳給多少人呢?
5492.492	5493.493	這是多少?
5500.333	5507.775	不要回答零,零在後面可以,前面最少加個一,那就十個,對不對?
5507.775	5511.216	再加一個零,就一百個,可以嗎?
5511.216	5513.176	我們彼此互相勉勵好不好?
5513.176	5517.017	好,第七位,當然我就回到我們主耶穌基督了。
5517.017	5521.058	講耶穌的話,那沒得講的,講都講不完的,對不對?
5521.058	5524.539	而且我已經被告知,我的時間已經到了,對不對?
5524.539	5527.940	但是主耶穌我們一定要念一下,約翰福音1章14節,來。
5528.660	5534.682	道成了肉身,住在我們中間,充充滿滿的,有恩典,有真理。
5534.682	5539.743	我們也見過祂的榮光,正是賦獨生死的榮光。
5539.743	5553.587	我把那個成字抓出來,主耶穌基督講主耶穌基督兩個成字是我最喜歡的,一個是祂道成肉身來到世界上,為了我們被釘死在釋迦上。
5553.587	5589.924	釋迦七言裡頭的最後一兩句話裡頭, 成了 祂已經告訴我們要怎麼樣才是對的。
5589.924	5591.146	求神幫助我們。
5591.146	5599.334	我們自己,我們旁邊,我們摯愛的,我們的弟兄姊妹,求神幫助我們。
5599.334	5602.577	我們越來越像基督。
5602.577	5607.181	我們既然是基督徒,我們就要像基督。
5607.181	5608.343	徒弟要怎麼樣?
5608.343	5609.424	要像師父啊。
5610.350	5613.731	繁體中文，臺灣國語。
5613.731	5615.531	繁體中文，臺灣國語。
5615.531	5617.232	繁體中文，臺灣國語。
5628.831	5659.201	阿們好不好2023年求主幫助我們在我們的生命裡頭的話呢我們就像我們今天所講的這14個故事的話呢能不能像亞當這樣守在那邊按著神的旨意能不能像以諾亞與神同行能不能像諾亞那邊神要他造什麼他就來造能不能像亞伯拉罕把他最心愛的 現上能不能像約瑟一生結果子。
5659.201	5662.482	能不能像以斯帖,他說死了就死吧。
5662.482	5669.344	能不能像但以理,他每天三次跪下來禱告。
5669.344	5677.566	能不能夠像彼得,他把他的一生的東西就一下子捨了就跟隨主耶穌基督。
5677.566	5683.745	能不能夠像百夫長的信心, 主啊,你說一句話,我的仆人就好了。
5683.745	5689.612	能不能像血肉婦人,摸著了耶穌的衣服就知道自己病好了。
5689.612	5695.398	能不能像窮寡婦,把她養生的全部投出來。
5695.398	5700.764	能不能像那位女士,把最棒的交在主身上。
5700.764	5708.425	能不能像保羅, 一生就是傳福音,傳福音,傳福音。
5708.425	5718.110	更重要的,我們能夠學習像主耶穌基督,我們Christian,是Christ-like,我們像主一樣。
5718.110	5723.153	那最後,我們來念一下,這是什麼?
5723.153	5726.094	大,大誡命,對不對?
5726.094	5727.175	也是說這個大誡命,來。
5728.117	5735.982	你要盡心、盡性、盡力、盡意愛主你的神。
5735.982	5740.145	這是我們教會把它叫做大誡命。
5740.145	5743.827	同時就要考大家了。
5743.827	5749.251	大使命要不要背一背?
5749.251	5750.052	所以你們要去。
5751.152	5759.801	十萬名做我的門徒,奉父子聖靈的名給他們施洗。
5759.801	5763.325	凡我所吩咐你們的,都教訓他們遵守。
5763.325	5764.266	然後怎麼樣?
5764.266	5770.452	我就長與你們同在實照世界的末了。
5770.452	5772.895	2023年新春快樂。
5772.895	5773.816	祝福大家!
5800.333	5805.842	弟兄姊妹平安，新年快樂，新春蒙福。
5805.842	5812.452	真的是非常感謝,願我們今年都成為雲彩般的見證。
5812.452	5813.554	阿們,謝謝你們。
5814.070	5818.874	好,我們來關心家裡的大小事。
5818.874	5832.304	首先呢,祝福大家新年快樂,新春蒙福,願耶和華祝福你們,保護你們,願耶和華使祂的眼光光照你們,賜恩給你們,願耶和華向你們養臉,使你們平安。
5832.304	5840.231	今天聚會結束的時候呢,教會有準備一些漂亮的經文卡紅包送給大家,請記得領。
5841.425	5843.907	我們一起來思想。
5843.907	5846.990	繁體中文，臺灣國語。
5846.990	5849.852	繁體中文，臺灣國語。
5860.981	5867.707	歡迎聚會結束的時候,到我們103教室,接受我們進一步的接待禮。
5867.707	5880.698	再來,弟兄姊妹繼續關心家裡的財務狀況,也繼續為我們的經償費,還有我們建堂的奉獻,守望禱告,來支持。
5880.698	5887.103	再來就是我們今年的第一次的壽喜,是在2月12號。
5887.103	5891.166	歡迎還沒有壽喜的, 繁體中文，我們一起來思想。
5891.166	5893.847	繁體中文，我們一起來思想。
5911.254	5915.516	繁體中文，臺灣國語。
5915.516	5919.217	繁體中文，臺灣國語。
5919.217	5923.498	繁體中文，臺灣國語。
5923.498	5925.099	繁體中文，臺灣國語。
5925.099	5928.460	繁體中文，臺灣國語。
5928.460	5930.161	繁體中文，臺灣國語。
5939.224	5941.147	繁體中文，臺灣國語。
5941.147	5957.846	繁體中文， 每個禮拜二的中午開始。
5972.073	5988.602	二月十三號由聯名跟那個路德夫婦所帶領的這個放下焦慮享受親密的這個生命會談的工作坊歡迎大家來參加可以掃這個QR CODE來報名再來是 來一張幸福人生講座。
5988.602	5998.205	我們的2月4號將邀請湯玉紅代書來講如何透過節稅來保全我們在屬世的財產。
5998.205	5998.766	屬世的。
5998.766	5999.586	非常的重要。
5999.586	6002.847	雖然不然屬天跟屬世都很重要。
6002.847	6005.188	歡迎大家可以來報名參加。
6005.188	6008.389	特別是邀請我們的社區的朋友來參加。
6008.389	6009.770	以上報告。
6009.770	6015.052	最後我們要請羅牧師來做祝福跟拆牌。
6017.773	6020.674	站起來,好嗎?
6020.674	6021.975	一起來領受祝福。
6021.975	6024.176	Hallelujah!
6024.176	6031.540	主,我們謝謝祢,我們在春節這一天,能夠在主日一起聚會是何等喜樂的事情。
6031.540	6039.064	願主祢自己來勉勵我們弟兄姊妹在2023年,主祢做心事的時候,我們跟得上。
6039.684	6054.075	主祢帶領我們的時候,按照今天孩子的信息裡頭提到的,這麼多的聖經上的典範,這麼多的如雲彩般的見證人,都是我們可以學習的。
6054.075	6061.020	願主祢真的是幫助我們,讓我們每一個人在2023年,我們就願意把自己擺上。
6061.020	6065.744	讓主祢使用我們,讓我們有願做的心,蒙主祢悅納。
6067.585	6097.788	阿們，阿們， 好 我們聚會到這裡結束 掰掰