start	end	text
2817.591	2825.695	常常神在我禱告當中,祂鼓勵我說,孩子,我看人不像人看人, 我看人不像人看人。
2825.695	2826.375	我看祂是王子。
2826.375	2829.035	我看祂是我為你量身訂做的。
2829.035	2835.157	你只要照著我的真理,順服,尊重祂,敬重祂,其他的事,我會來做。
2835.157	2839.438	我謝謝主,就在這當中,神把同心合一的靈放在我裡面。
2839.438	2844.379	我先通過禱告跟神對齊,我同神的心意,我順服真理的教導。
2844.379	2858.165	我謝謝主,就讓榮顯,我們在這樣三十幾年的婚姻當中,榮顯就祝福了我, 讓我不管在禱告事工﹐每天早上的服事﹐在牧區的牧養﹐在醫院我輪夜班﹐祂以前負責幫忙照顧孩子。
2858.165	2864.890	我就覺得說﹐神真的就是﹐量身訂做﹐為我預備了一個愛我的良人﹐讓我可以同心同心。
2864.890	2868.833	我也很羨慕說﹐我信主之後﹐我很羨慕全家信主。
2868.833	2874.476	我看到人家來教會﹐都常常是家人一起來﹐我那時候一個人來到臺北。
2874.476	2878.099	我就說﹐神啊我好希望﹐我的家人也都能夠蒙恩得救。
2879.258	2885.483	神告訴我說,孩子,你只要信,你必看見我的話語。
2885.483	2887.504	一人信主,就必全家得救。
2887.504	2888.285	阿們。
2888.285	2896.852	感謝主,這前前後後二十幾年,神就感動了我的妹妹,我的爸爸,我的媽媽,我的哥哥,我的姊姊,一個一個信主。
2897.432	2904.875	我們的神真是偉大奇妙的神,祂是凡事都能的神,祂透過這樣來成就我的信心,鼓勵了我。
2904.875	2915.099	我也感謝主,我在參加教會的禱告事工,我來到淡江教會十幾年的,透過淡江教會每一天早上的成禱, 我發現我越禱告體力越好。
2915.099	2919.042	我越禱告我的身心靈都喜樂、平安、健康起來了。
2919.042	2922.124	我覺得在這裡要鼓勵弟兄姊妹。
2922.124	2925.626	我覺得我們的禱告好像每次來到神的面前。
2925.626	2927.768	你就像那水龍頭要記得把它打開。
2928.148	2932.873	你要把水龍頭打開,神從天上來的火水江河就要充滿你。
2932.873	2935.916	神禱告的恩膏能力就要充滿你。
2935.916	2941.962	神就會讓我們在這樣的禱告當中,經歷祂的愛,經歷祂的醫治,經歷祂的安慰與祝福。
2941.962	2952.252	我謝謝主,神也讓我們每次禱告中,報名聲用所有的疲憊,所有的難過,所有的痛苦,所有的憂慮,神就透過這樣,像水龍頭那個大水就把它帶走了。
2952.432	2955.334	所以我鼓勵弟兄姊妹，讓我們就一起來禱告。
2955.334	2958.377	不管你是透過實體禱告、線上禱告。
2958.377	2961.199	現在教會每一天都有線上禱告會。
2961.199	2963.781	如果你很會禱告的人,我鼓勵你。
2963.781	2966.183	你會禱告的人,你要來參加禱告會。
2966.183	2967.724	你要來丟炭火。
2967.944	2972.086	讓這淡江教導告的力量﹐可以點燃更大更大。
2972.086	2976.049	如果你害怕導告的人﹐像我以前一樣﹐你就來學習導告。
2976.049	2980.191	你就在導告當中用神的話﹐用詩歌來導告。
2980.191	2986.255	就上線來﹐或者來參加主日前的導告會﹐或者參加我們禮拜五晚上的實體導告會。
2986.255	2994.760	在那當中﹐神那個群體的恩膏﹐當我們不會導告﹐我們跟喜歡導告的人在一起﹐聖靈的恩膏能力就運行在我們的生命。
2994.940	2998.905	我謝謝主,讓我透過這樣的禱告,我的身體越來越健康。
2998.905	3001.348	也祝福大家在禱告中不斷的經歷神。
3001.348	3004.152	感謝主,讓我們一起來禱告吧。
3004.152	3005.514	阿們,阿們。
3005.514	3011.501	跟隔壁的弟兄姊妹說,我們一起來禱告吧。
3011.501	3012.683	我們一起來禱告吧,阿們。
3013.780	3019.644	各位弟兄姊妹,有沒有被他的那個活力,金鼎電池的活力感染?
3019.644	3020.404	有齁。
3020.404	3026.948	好,我們待會主日呢,信職最後我要請蕙香姊來祝福我們齁。
3026.948	3034.153	每次呢,真的是跟蕙香姊在一起的時候,你很難不被他的那個活力所激動。
3035.179	3037.881	所以各位弟兄姊妹,我們周遭需要這樣的人。
3037.881	3041.723	弟兄姊妹,就像蕙香姊講的,互相點火。
3041.723	3042.984	阿門。
3042.984	3052.191	好,那我們呢,接著我們現在的每日嚴經詩義是進度我們每天的靈修進度是到哪裡呢?
3054.121	3056.023	馬可福音第幾章?
3056.023	3056.943	第六章。
3056.943	3059.145	我們到了馬可福音第六章。
3059.145	3062.968	今天是五餅二魚。
3062.968	3071.975	今天的信息我要跟大家一起來看的是,就是再往前一點。
3071.975	3074.838	第六章的第七節到第十三節。
3075.862	3079.723	受差的傳道者們。
3079.723	3084.184	所以呢,傳道者們,你們大家第一個印象是誰?
3084.184	3088.885	誰是傳道者們?
3088.885	3091.005	一片安靜,不敢說。
3091.005	3094.286	其實心裡很想說,啊牧師就是你啊。
3094.286	3097.726	牧師就是你啊,啊不然呢?
3097.726	3102.167	你如果聽美日言經師,你知道那個傳道者們是誰?
3102.167	3105.288	好,在座的,你是基督徒的,請舉手。
3106.613	3148.316	請你看一下 先不要放喔 看一下隔壁好 跟你隔壁的說你我有舉手的 你我都是傳道者 謝謝大家請放下手請放下所以各位弟兄姊妹這傳道者們不是只有我們傳道我們的職稱是傳道或牧師也不是只有全職的同工也不是只有待職的同工們只要我們是基督徒我們都是傳道者好那我們今天我們要一起來讀 我們今天要一起來讀馬可福音第六章。
3148.316	3151.479	我們一起來讀七到十三節。
3151.479	3154.983	如果你有聖經,你可以翻開你的聖經。
3154.983	3157.546	如果你需要聖經,你可以舉手。
3157.546	3160.329	如果需要,你也可以看螢幕。
3160.329	3167.116	其實我們螢幕可能最多是,我們還是希望大家有帶自己的聖經。
3168.404	3172.991	如果翻開馬可福音第六章,我們從第七節開始來讀。
3172.991	3176.938	待會我們來讀,我們就要看大家有沒有吃早餐,或者是精神好不好。
3176.938	3180.744	我們一起來讀,從第七節,請。
3181.630	3219.276	耶穌叫了十二個門徒來,拆遣他們兩個兩個的出去,也賜給他們權柄,制服污鬼,並且囑咐他們,行路的時候不要帶食物和口袋,腰帶裡也不要帶錢,除了拐杖之外,什麼都不要帶,只要穿鞋也不要穿兩件褂子, 又對他們說,你們無論到何處,進了人的家就住在那裡,直到離開那地方。
3219.276	3230.184	何處的人不接待你們,不聽你們,你們離開那裡的時候,就把腳上的塵土墮下去,對他們作見證。
3231.203	3243.289	門徒就出去,傳道叫人悔改,又趕出許多的鬼,用油抹了許多病人,治好他們。
3243.289	3246.111	這是阿們,這是神的話語,我們一起來低頭禱告。
3249.650	3251.693	親愛的恩主,謝謝祢。
3251.693	3261.085	謝謝祢讓我們可以生活在這科技這麼便利的時代,以至於我們隨手可得祢的話語聖經。
3261.085	3264.169	我們為這樣的恩典向祢獻上感謝跟讚美。
3264.650	3287.844	主啊是的求祢幫助我們這段時間分別為聖就是一起要來聆聽祢的話語一起要來透過祢的話語更認識祢也更明白祢的心意讓我們的心讓我們的生命也因著祢的話語 成為我們,滋養我們的養分,好教我們的生命,可以越加長大成熟。
3287.844	3292.425	謝謝耶穌,也願聖靈祢引領孩子,也引領我們眾人。
3292.425	3296.046	我們感謝禱告奉耶穌基督寶貴的名祈求。
3296.046	3297.746	阿們。
3297.746	3317.323	各位弟兄姊妹,我們看到我們剛讀到這段經文,我要跟大家分享的是,這段經文一開始有講到說,耶穌祂 叫他十二個門徒來,然後兩個兩個把他們拆遷出去。
3317.323	3354.376	透過這段經文,我要來跟大家一起分享 耶穌祂拆派這些門徒出去祂要賜給門徒四顆心不是五燈獎 是四顆心四顆心 四顆愛心什麼心呢 第一個 我們要來看第七節到第九節 耶穌叫了十二個門徒來拆解他們兩個兩個的出去耶穌祂叫門徒來 門徒如果沒有來,會不會有人被拆出去?
3354.376	3356.016	不會有。
3356.016	3372.220	所以當耶穌叫了門徒來,耶穌呼召了你跟我來,耶穌呼召了每一個基督徒來,如果我們沒有回應耶穌的呼召,我們能不能被拆出去?
3372.220	3372.800	我們不行。
3374.241	3401.574	感謝主那時候耶穌呼召的這十二個門徒回應了耶穌的呼叫他們來到耶穌的面前然後呢他們就被拆遣兩個兩個的出去兩個兩個會不會太麻煩了神啊我一個人我一個人多自由 我一個人我想要睡覺。
3401.574	3403.335	我累了我想吃。
3403.335	3403.876	阿給。
3403.876	3404.936	我就吃阿給。
3404.936	3405.877	對不對?
3405.877	3407.678	我累了我想要怎樣?
3407.678	3409.499	我要住的飯店。
3409.499	3411.641	我要住那個backpacker。
3411.641	3413.422	只要一張床就好了。
3413.422	3415.143	有地方洗澡就好了。
3415.143	3417.064	還有兩個兩個多麻煩啊。
3417.064	3419.105	另外那個可能是要住什麼?
3419.906	3480.442	他可能要住那種還有那種愛心浴缸的啦還要用那種玫瑰花瓣啦或者他要吃的是什麼鼎泰豐的小籠包他才會覺得滿足的啦這樣子會不會太麻煩了你光看那個十二個門徒十二個門徒他個性不一樣都不一樣耶你看他們兩個兩個要去傳福音容不容易 不容易我相信我們許多的人在跟隨神的這個道路上很多時候我們想到我們還要跟別人配搭我們還要在服事團隊裡面太麻煩了還要去小組我還要再有個耐心然後聽小組員有的還要講得樂樂等有的還有的也講也不想講但他個性都不一樣算了所以呢我就選擇當一個 主日的基督徒。
3480.442	3482.143	我就來主日就好了。
3482.143	3483.383	甚至因為疫情。
3483.383	3484.944	我也可以怎樣。
3484.944	3486.544	我連主日教都不用來。
3486.544	3487.585	多方便啊。
3487.585	3492.787	因為我把主日帶到我的家。
3492.787	3495.068	各位兄姊妹。
3495.068	3500.790	神很多時候祂並不要我們一個人。
3500.790	3501.350	因為怎樣?
3501.350	3502.771	一個人很容易軟弱。
3502.771	3502.971	對不對?
3505.299	3511.004	那你說那神呼召我們服事就一定得要兩個兩個嗎?
3511.004	3521.193	也不是一定啊 對不對神呼召但大部分的時間都是兩個兩個為什麼會是兩個兩個呢?
3524.224	3550.413	很多時候兩個還有一個彼此陪伴彼此幫助耶穌要我們在主裡學習彼此相愛彼此扶持彼此成全對不對你如果一個人你需要成全別人嗎不需要就只要我OK就好啦 但是今天如果有兩個人,像惠湘姊,她這麼的有活力,可能現在好低沉喔,心情真的超差的。
3550.413	3554.514	然後惠湘姊說,走,我們來禱告,禱告時間到了。
3554.514	3561.337	我可能需要更費力一點的跨出去那一步,願意跟她一起禱告。
3561.337	3565.358	可是在那禱告的過程,或在那服侍的過程,我們就會來經歷神。
3567.944	3570.466	繁體中文，臺灣國語。
3570.466	3571.927	繁體中文，臺灣國語。
3571.927	3574.289	繁體中文，臺灣國語。
3574.289	3575.209	繁體中文，臺灣國語。
3575.209	3577.891	繁體中文，臺灣國語。
3593.217	3625.835	我們人與人之間我們會非常的磨對不對因為我們每一個人的家庭背景我們的習慣都不一樣那個磨合的過程零零腳腳在磨的過程舒不舒服不舒服很喜歡這種跟人家一起磨的請舉手非常不舒服但是就很像成長痛 你會說我骨頭好痛喔因為在成長不要痛了。
3625.835	3707.382	我們都巴不得我們的孩子趕快孩子身體或者他們生命長大對不對長大會不會有成長痛會 為什麼因為他的骨頭本來這樣不斷的被擴張不斷的被擴張當那個被擴張的時候會不會有疼痛感 會有啊但是我們在我們的天然人裡面在我們的在這世界帶領我們挾持我們這個環境裡面我們很常要求的想要的是什麼舒適好就好安全溫暖讓我感覺好就好了所以你不要叫我成長就這樣很好我們很多人 我們在祝福別人的時候都說什麼祝福你一切順利對不對為什麼要順利就是不太多的其他的衝擊跟挑戰跟困難嘛對不對我們也是跟求神求說主啊求祢讓我可以一切順利對不對這樣的禱告這樣的願望有沒有錯沒有錯但是神有沒有說啊你信了基督徒之後你就天色常藍花香常伴有沒有沒有 所以在這個過程當中,我們是需要魔的。
3707.382	3714.468	我們從一個不認識神在這世界匣子上,我們有許多的世界的價值觀,不屬神的價值觀。
3714.468	3725.857	我們回到神的面前的時候,如果我們願意來到主的面前,我們願意來向神敞開,會有越多的世界的價值觀被聖靈來光照。
3726.920	3741.208	以至於我們回應神的時候,願意把這個神的價值觀交給神之後,我們可以回到,越來越回到神當初創造我們的那個樣式來。
3741.208	3755.337	所以各位弟兄姊妹,當我們看到這裡說,耶穌拆解他們兩個人出去,耶穌期待我們可以跟其他另外一個人或跟團隊我們可以一起同心。
3757.910	3759.611	因為我們要一起被拆出去。
3759.611	3762.293	我們是一起出去有任務的。
3762.293	3765.795	我們如果沒有同心,我們可不可以一起去完成任務?
3765.795	3766.856	沒辦法。
3766.856	3771.559	可是那個同那個心,第一個同的心是要同誰的心?
3771.559	3773.600	是要同神的心。
3773.600	3777.522	耶穌為什麼才請我們出去?
3777.522	3781.805	是因為有太多人不知道天國盡了。
3781.805	3784.487	有太多人不知道神國的福音。
3787.329	3848.757	就像那個浪子他出去了他那個爸爸他就是這麼的渴望這麼的希望他的那一些出去放蕩的孩子可以趕快回來一樣如果在家的大兒子沒有去體貼父親那個等候小兒子失而復得的那樣的心 就會像我們讀的浪子的故事大兒子的反應跟感受我都做你吩咐我的啦我都在家裡乖乖的做你要我做的可是你卻沒有寵愛我因為這個大兒子把自己當作是故宮他並沒有把自己當作是兒子體貼這位父親的心愛另外一個小兒子的心愛自己是兒子的心 所以如果我們鼓勵大家,我們一起在今年,我們更多的與神同心。
3848.757	3856.182	說,主啊,祢的心,祢的心腸,祢的心現在,祢在想什麼?
3857.363	3872.022	好不好,你的感受讓我也體會你,讓我更多貼近你的心,讓我知道你現在對哪一個人,是我身邊的人,你要使用我,你憐憫他,你要施恩憐憫他,你要使用我去跟他傳福音。
3872.483	3876.284	你要使用我成為那福音的出口。
3876.284	3879.405	求祢幫助我更多體貼祢的心。
3879.405	3887.768	另外一個同心就是跟在我們眼前的這一個人在我們眼前的這些團隊裡的成員同心。
3887.768	3890.088	因為我們是同一個目標。
3890.088	3891.169	是什麼?
3891.169	3894.710	神拆派我們給我們的使命。
3894.710	3898.391	我們要同一個心是同這個心同一個目標。
3899.445	3919.268	以至於當我們有紛爭的時候,當我們有摩擦的時候,我們知道我們要仰望我們的神,同那個心,那神怎麼說,神怎麼教導,我們才願意來迴轉,來一起把那個關卡能夠通過。
3921.169	3945.588	我最近除了剛剛惠香姐有分享到她跟榮顯哥他們在婚姻裡面有非常多的摩擦對不對可是他們到目前他們都還至今還是很同心很願意用心盡力的去經營他們的婚姻以至於他們現在的婚姻是非常甜美的 請留意我說,不是完美。
3945.588	3947.669	我沒有說他們婚姻很完美。
3947.669	3949.429	因為他們兩個都不完美,對不對?
3949.429	3950.570	慧香姊。
3950.570	3959.333	但他們的婚姻,他們嘗到那個甜味,嘗到那個甜美。
3959.333	3964.234	前幾天我去拜訪了一對夫妻,年輕的夫妻。
3964.234	3965.695	他們的個性也非常不一樣。
3967.022	3986.479	太太對宣教非常有負擔先生是非常熱切能夠被神來使用是一個非常聰明的一個弟兄我問他說那你們結婚之後你們婚姻你們有很多摩擦跟吵架嗎 他們說當然有。
3986.479	3993.101	我們一個是臺灣文化非常保守的長老會的保守的背景。
3993.101	3998.063	一個是在香港長大然後去美國讀書。
3998.063	4000.004	然後根本就是香蕉。
4000.004	4005.166	雖然是黃皮膚可是裡面是非常西方文化的。
4005.166	4008.687	那我說那你們怎麼現在還可以這麼的甜美。
4008.687	4011.068	兩個人互動非常有默契。
4011.068	4013.069	我說那你們有爭吵的時候你們怎麼辦?
4014.002	4023.988	那些人就是說,有不同,有爭吵,有衝突的時候,我們就趕快來看神到底怎麼說,怎麼教。
4023.988	4029.352	我就按神的方式,學習去愛我的妻子。
4029.352	4032.734	哇,很感動耶,很年輕的一對夫妻耶。
4034.172	4094.736	各位弟兄姊妹這就像這個童心這兩個兩個被拆出去若沒有童心兩個人願意知道一樣的目標是什麼知道說一樣的一個心志就是神祢怎麼教導當我們有衝突的時候我們就回到神的教導神祢教導我們怎麼做我們願意我做不到但聖靈求祢加添力量給我我願意 所以在這段經文裡面兩個兩個出去是需要同心的需要同我們神我們主的心我們也需要同彼此一起同心的邁向的目標願意來彼此成全那個同心我們才有可能一起出去完成那任務不然的話我們就很像我不知道你們有沒有聽過我的朋友他們跟閨蜜一起出去玩 一去旅行,兩個人吵架了。
4094.736	4097.297	就再次老死不相往來了。
4097.297	4099.338	有沒有聽過這種案例?
4099.338	4100.839	有。
4100.839	4108.183	因為他們的,他們一剛開始只是想,他們一剛開始的那個童心呢,只是想要去遊玩。
4108.183	4109.764	Happy的遊玩。
4109.764	4130.565	可是去到那個, 旅遊地點,他們的心就不再同心了,因為他們各自想要做各自的事情,然後不願意各自彼此的成全,有一個很好的溝通,以至於本來是非常緊密的,就這樣子,就散了,而且是彼此老實不相往來的。
4131.169	4144.203	所以在基督裡面,如果我們沒有有共同的目標,願意按著神的話語一起來努力,我們是沒辦法一起同心的來完成神的任務的。
4144.203	4150.670	所以第一個,神給受差者的四顆心,第一個,我們剛剛看到的經文就是要同心。
4151.476	4177.503	接著呢是 神 耶穌祂 裁判這十二個使徒祂賜給他們全病 至福無鬼所以 耶穌並沒有說 你們就去耶穌要裁判他們之前 叫他們來的時候他們來到主耶穌的面前之後 耶穌就賜給他們全病 所以他們不是靠著自己。
4177.503	4182.447	耶穌不是說,欸,師會,你就自己搞吧,出去。
4182.447	4187.151	你就跟以羅姊,你們兩個,就自己愛怎麼搞,你們兩個就自己出去。
4187.151	4188.792	沒有。
4188.792	4191.474	耶穌有賜給他們那個全餅。
4191.474	4196.578	賜給他們自己沒辦法有的屬天的能力跟全餅。
4199.821	4203.603	我現在要找四個人來做一下比喻。
4203.603	4204.883	來,唐莉。
4204.883	4206.424	來,比較瘦小的唐莉。
4206.424	4207.564	然後鄭達。
4207.564	4209.805	然後美如。
4209.805	4211.006	對,你們都出來。
4211.006	4211.906	美芸。
4211.906	4213.487	你們都出來。
4213.487	4217.528	然後我們再找一個瘦小一點的。
4217.528	4222.150	然後我們找一個壯一點的。
4222.150	4223.291	應該是有能力的。
4223.291	4225.512	來,小文來。
4225.512	4228.093	好,來,請你們四個來站中間一點。
4230.282	4247.857	這四個人呢 這唐利他是受差的,是耶穌的門徒之一。
4247.857	4253.563	是兩個兩個,但我們現在先用一個人的來做比喻,讓大家知道一下。
4253.563	4260.309	就是耶穌本來唐利他一個人,他是沒有能力的。
4260.309	4263.112	所以唐利你完全放鬆,你都沒有能力。
4264.087	4295.348	他是沒有能力喔他就是完全是管他沒有能力的現在耶穌賜給他全餅然後現在我們的主耶穌他說什麼我們奉耶穌基督的名那個就是神給我們的全餅對不對這個就是來代表耶穌神給我們的那個屬天的全餅是唐利沒有的所以你要站在他後面 那你要成為你的手,這樣。
4295.348	4298.551	你給他能力,他才能夠舉起。
4298.551	4305.037	你給他能力,他才能夠去做服侍別人。
4305.037	4314.126	如果沒有耶穌的權柄,沒有耶穌的能力,他沒辦法,他什麼都不能做。
4314.126	4317.809	所以今天他去跟美芸傳福音。
4318.865	4323.749	然後美雲就像我們沒有信主的人。
4323.749	4328.754	美雲他也是沒有什麼能力。
4328.754	4331.656	他有的能力是誰給的?
4331.656	4335.439	是這個掌管世界的誰?
4335.439	4340.043	黑暗權是撒旦給的能力。
4340.043	4341.865	所以他會怎樣?
4341.865	4346.068	他看到這個沒有他看到其他人他就想要打他對不對?
4347.244	4355.611	但是他的能力是,好來振達,你就是那個黑暗的幕後的黑手。
4355.611	4367.100	你就用他,他們兩個相遇的時候,美雲就用他就這個,這個黑暗的全職撒旦,就用美雲要來打他。
4367.100	4368.541	有沒有能力?
4368.541	4369.202	有能力。
4369.957	4406.924	好 所以呢他不能只被挨打 對不對所以就只有什麼倚靠耶穌的時候耶穌給他能力給他拿起耶穌給他權柄的時候他就可以打敗什麼他後面的這個黑暗權勢然後呢他就可以怎樣得著這個人透過耶穌的權柄幫助這個人醫治恢復願意讓他迴轉向神 所以如果我們沒有靠著耶穌給我們的權柄,我們可不可以做什麼?
4406.924	4407.865	不行。
4407.865	4427.341	所以呢,如果今天,如果今天呢,唐利他已經靠著耶穌基督的名,然後呢,他去服事他,可是呢,沒有馬上立即的那種 例如說他現在有暈眩﹖或者他發燒。
4427.341	4451.782	但是呢﹖唐利他奉耶穌基督的名來祝福他的時候﹖沒有馬上立即的那種﹖馬上立即的得著醫治﹖你會不會說﹖唐利﹖你很憤怒﹖你沒有能力﹖你會這樣說他嗎﹖ 應該是這位後面﹐他依靠的神﹐他的心意是什麼﹐我們不知道。
4451.782	4461.547	但是我們不會說﹐啊﹐唐莉﹐你怎麼這麼沒能力啊﹐哎喲﹐真是驚嗨﹐不會。
4461.547	4476.480	所以各位弟兄姊妹﹐當這兩個兩個門徒他們出去﹐耶穌拆派他們的時候﹐是給他那個全餅﹐他那個全餅是讓他可以﹐ 做祂靠祂自己做不到的事情。
4476.480	4484.766	那個全餅就是帶著屬天的能力然後去跟人傳福音。
4484.766	4487.929	結果好不好?
4487.929	4491.532	不是在於祂。
4491.532	4492.412	結果好不好?
4492.412	4495.875	是在於神的心意。
4495.875	4499.098	你可能第一個反應說神是不是不好?
4501.783	4503.184	不是神不好。
4503.184	4506.648	神知道什麼情況是最好的安排。
4506.648	4507.829	阿們。
4507.829	4510.452	神知道每一個人的心。
4510.452	4513.014	好的,我們給這四位拍拍手。
4513.014	4518.139	謝謝你們。
4518.139	4522.593	所以這個就是 神給我們的權柄。
4522.593	4526.155	很多時候我們常常去為人禱告為人服侍的時候。
4526.155	4528.976	我們忘記了要帶這個權柄。
4528.976	4532.218	那什麼叫做我們要記得這個權柄。
4532.218	4535.319	記得這個耶穌與我們同在。
4535.319	4540.041	就是我們裡面是不是常常連結於這位神。
4540.041	4544.544	你如果不確定你可以在服侍前你自己就先做個禱告。
4544.544	4547.465	你說主啊幫助我。
