start	end	text
6385.606	6395.994	願祢幫助我們,我們要同心合一,即使是鐵磨鐵,讓我們也能夠更多的摩塑出來一個更有祢的樣式的。
6395.994	6407.744	以至於我們可以同心的來服事,同心傳福音,同心的來建造基督教的,基督化的家庭,同心的能夠使我們可以在職場上發光。
6408.985	6413.949	主求祢幫助我們可以領受從祢來的能力跟信心。
6413.949	6417.032	以至於我們可以進到神國度的領域裡。
6417.032	6420.875	我們憑著信心領受祢賜給我們的權柄跟能力。
6420.875	6426.440	我們憑著信心就去與祢一起去服侍人去傳揚福音。
6427.841	6430.744	主啊,求祢加添耐心給我們。
6430.744	6440.032	無論環境再難,再折磨,再逼迫當中,主讓我們對祢的呼召,對要完成祢的使命,那個過程,我們有耐心。
6440.032	6443.696	不要被嚇住,不要被嚇倒了。
6443.696	6451.783	主啊,即使傳福音,別人不接受,主啊,我們要耐心等候,那個福音的種子發芽的時候。
6454.155	6462.022	我們在操練主啊﹐與祢更加敏銳﹐去傳福音﹐去服侍人﹐去操練我們的恩賜的過程。
6462.022	6463.944	我們也要對自己有耐心。
6463.944	6467.987	我們要對我們的團隊﹐同工們有耐心。
6467.987	6473.212	因為每一個人都在施工中。
6473.212	6477.496	主最後求祢幫助我們﹐體貼你的心腸。
6477.496	6481.259	祢怎麼愛我們﹐求祢更加的向我們顯明。
6482.961	6487.544	當我們不知道怎麼愛自己,我們也很難去愛別人。
6487.544	6496.451	當我們要用祢的方式愛我們自己,不再用世界告訴我們怎麼愛自己的方式來愛自己。
6496.451	6506.258	主讓我們因著深知祢愛我們,我們也用祢的方式愛自己,以至於我們就更加樂意的去用祢的愛去愛別人。
6509.582	6529.920	主我們要讚美祢,願淡江教會是一個彼此相愛,彼此成全,一起來建造教會,在這地,在國度傳揚福音的一個合祢心意的一群弟兄姊妹,合祢心意的祢的兒女。
6529.920	6540.307	好叫祢的榮耀在我們當中彰顯, 主啊,好叫祢的全能,在我們當中更多的彰顯。
6540.307	6547.770	更多人就看見我們當中,真有一位又真又活的奇妙主。
6547.770	6551.772	主謝謝祢,願祢得著祢當得的榮耀。
6551.772	6554.193	奉耶穌基督寶貴的名祈求。
6554.193	6558.174	阿賴路亞,感謝讚美主。
6558.174	6559.735	各位弟兄姊妹請坐。
6559.735	6563.437	我們把時間交給同工,來跟我們報告我們家裡的事。
6567.108	6571.931	各位傳道者們,大家平安。
6571.931	6575.154	能夠被神拆派,是神看得起我們。
6575.154	6581.158	願我們今天大家都領受這四顆心,成為神所拆派的傳道者們。
6581.158	6582.099	阿們。
6582.099	6585.081	我們一起來關心家裡的大小事。
6586.732	6588.573	我們一起來思想。
6588.573	6590.094	繁體中文，臺灣國語。
6607.722	6654.639	歡迎今天第一次來到我們當中的新朋友有沒有你今天是第一次來到我們當中請你揮揮手讓我們能夠來認識你讓招待能夠把那個姓名表拿給你這邊有一位D區有一位前面還有嗎還有今天好像有好多位是新來的 好像有兩位穿紅衣服的也是喔好 歡迎你等一下聚會完結束可以到我們的103教室然後讓我們更多的讓你介紹我們丹江教會讓你認識還有就是如果你已經在這裡參加聚會一段時間但是你還沒有參加小組誠摯的歡迎你加入我們的小組的大家庭一起彼此 一起來成長。
6654.639	6660.402	一起來透過小組，可以得到很多，關於教會要學習，跟服事的機會。
6660.402	6662.083	所以邀請你一定要來參加。
6662.083	6664.224	那一樣一週包上面有QR Code。
6664.224	6666.805	你一個掃進去，就有專人跟你聯絡。
6666.805	6667.365	好。
6667.365	6670.947	再來是我們一起來關心，家裡的財務狀況。
6670.947	6675.389	那目前呢，我們三堂的經常費，大概是要250萬。
6675.589	6680.413	感謝主,到上個禮拜已經有一百五十幾萬。
6680.413	6684.837	我們到年底的建堂預算是要達到五億。
6684.837	6689.621	目前還上缺大概四千八百三十萬。
6689.621	6692.203	請弟兄姊妹繼續的帶導跟支持。
6692.824	6716.966	好 再來就是 禱告會今天會 鄉姊妹 哇 強的你看她那麼有的活力我們是一個禱告的教會所以一定要來參加禱告會那麼邀請妳來參加我們所有單教教會很多的禱告會就歡迎妳來參加禮拜五真的可以回來實體參加一起禱告了好 一壘營會 3月4號 你只要是沒有參加過。
6716.966	6719.368	維生在淡江教會都可以來參加。
6719.368	6721.469	你曾經參加過想要來也歡迎。
6721.469	6723.891	OK請你把握機會。
6723.891	6726.212	再來就是有幾個課程介紹。
6726.212	6727.793	3月1號養生權開班了。
6727.793	6730.255	那請你邀請福音朋友一起來參加。
6730.255	6732.657	如果你自己想要運動也歡迎參加。
6732.657	6734.738	還有連長者的舞蹈班在禮拜四。
6734.738	6736.859	也歡迎你們可以來報名參加。
6736.859	6741.402	還有幸福人生講座3月份的 繁體中文，臺灣國語。
6741.402	6742.262	繁體中文，臺灣國語。
6767.688	6774.451	今天這個聚會結束在淡海堂有邀請葉老師來講這個引導力的根基是什麼。
6774.451	6776.792	如果你有需要也可以趕快衝過去。
6776.792	6778.853	再來就是呢。
6778.853	6779.933	等一下。
6779.933	6783.275	好上去。
6783.275	6784.335	就是呢。
6784.335	6786.476	每一個主日結束呢。
6786.476	6792.719	我們大廳都有中太陽的小朋友自己做的點心在賣。
6792.719	6794.899	還有一些飲料。
6794.899	6797.503	歡迎大家可以 我們一起來思想。
6797.503	6800.028	繁體中文，臺灣國語。
6800.028	6801.030	繁體中文，臺灣國語。
6806.527	6815.955	各位弟兄姊妹,我們現在大廳呢,大家就是可以看電梯前面,你可以看到有一個長桌,是大理石桌那邊。
6815.955	6824.041	我們鼓勵弟兄姊妹,會前或會後可以在那裡,可以彼此的交通,或者在那裡可以彼此的禱告。
6824.041	6828.325	那是就是我們可以在那裡交誼的一個場地。
6828.325	6833.549	那另外就是大家用完了,就請記得要保持乾淨。
6833.729	6840.693	我們也要向這棟樓來來去去的人做好見證。
6840.693	6844.175	另外最後我要請蕙香姊來到臺上。
6845.811	6849.314	我要請蕙香姊先為我們大家祝福。
6849.314	6859.661	你願意領受像蕙香姊她愛神,她願意禱告的那種活力,她願意服侍神的那種活力,傳福音的活力嗎?
6859.661	6874.392	她其實在醫院非常忙,可是她真的傳福音的那種活力,各位兄姊妹啊, 我們看到祂,我們就趕快跟著祂後面,說主啊,我也要像祂那麼愛,那麼會傳福音,這麼有活力,這麼有體力,而且這麼會禱告。
6874.392	6882.119	好不好,我們請,如果你願意,你就把你的手張開,說主啊,給蕙香姊的,給蕙香的,我也要。
6882.119	6884.000	我們一起請蕙香姊來祝福我們。
6884.821	6887.043	天父我們何等的感恩。
6887.043	6889.045	主啊我們要奉耶穌基督的名。
6889.045	6890.286	主啊你大能的烈焰。
6890.286	6891.127	主啊禱告的烈焰。
6891.127	6893.009	傳福音的烈焰。
6893.009	6895.111	主啊你充充滿滿的澆灌。
6895.111	6897.012	祝福在淡江教會。
6897.012	6899.555	祝福在我們每一個心中可慕。
6899.555	6901.276	主啊可慕用禱告回應你。
6901.276	6904.680	祝可慕用行動來愛你的弟兄姊妹。
6904.680	6905.861	主你大能的工作。
6906.101	6910.783	我要奉耶穌的名,主祢怎麼恩高我,讓我可以傳福音、禱告。
6910.783	6916.606	主啊,祢加倍的恩高,釋放祝福在我們的惠州,祝福在我們每一個人的生命裡。
6916.606	6920.427	謝謝耶穌,聽我們禱告,靠耶穌基督的名。
6920.427	6921.888	阿們。
6921.888	6924.409	阿們,Hallelujah,感謝主。
6924.409	6965.341	如果你願意回應神的呼召說,我想要出去傳福音,如果你願意參與探訪團, 或是你願意﹐你想要更多的﹐知道怎麼去跟人家傳福音﹐你想要更多的﹐被裝備的﹐一壘課程﹐一定是要上﹐一壘課程是淡江教會﹐最基礎﹐最基礎的﹐就是門徒的建造的課程﹐還沒上過的趕快報名﹐那如果你已經上過了﹐你還想要有其他的這一些﹐你說我想要做﹐可是我不知道怎麼做﹐歡迎你﹐ 繁體中文，臺灣國語。
6965.341	6966.402	繁體中文，臺灣國語。
6983.797	6987.461	我們一起來思想。
6987.461	6988.603	繁體中文，臺灣國語。
6988.603	6990.305	繁體中文，臺灣國語。
6990.305	6991.787	繁體中文，臺灣國語。
6991.787	6994.089	繁體中文，臺灣國語。
7004.855	7021.786	願天父上帝豐盛的慈愛,耶穌基督那救贖的大能,以及內住在我們裡面的聖靈,不斷的與我們交通,引領我們,常與你們眾人同在,從今時直到永遠。
7022.466	7025.528	也願主聖靈帶領我們。
7025.528	7027.930	我們聚會是為了散會。
7027.930	7029.632	我們散會之後。
7029.632	7032.214	我們要勇敢的來跨出去。
7032.214	7033.395	跟隨主。
7033.395	7035.957	按著聖靈的帶領。
7035.957	7039.480	我們要勇敢的與主同行。
7039.480	7041.081	與主同工。
7041.081	7044.063	好叫祢的福音被傳遍。
7044.063	7047.686	好叫祢在全地得著祢當得的榮耀。
7047.686	7050.328	奉耶穌基督寶貴的名祈求。
7050.328	7050.549	阿們。
7053.695	7239.016	如果還沒有受洗的想受洗的弟兄姊妹我們後面或者是我們網路上週報上有受洗的報名的那個表格歡迎你趕快受洗歸入主名謝謝大家 繁體中文