start	end	text
4549.633	4731.888	我靠我自己做不到我願意成為你的管道就像如果現在這一顆燈壞了這顆燈不亮了你會看那個燈泡是不是壞了對不對就是那燈泡是不是壞了就是我們嘛我們到底有沒有連結上那個電嘛對不對 但是這個如果燈泡是在最預備的狀態但是沒有亮你不會打電話去燈泡的公司說你們的燈泡壞了喔或你們燈泡有什麼問題喔你應該是會打電話說去臺電說你們現在電力是不是有問題喔 可是很多時候呢我們當我們在服侍的時候沒有看到立即的果效的時候我們很常懷疑的或者是覺得說很糟糕的是這個在我們眼前服侍我們這個人或是我們很常會對自己說主啊為什麼我這樣服侍為什麼沒果效你不是說奉祢的名醫治這個人就會得草他的疾病就可以得草醫治嗎為什麼沒有 那到底我們這樣問神的時候到底我是神還是祂是神很多時候是我是神吧因為我覺得我叫你我要為你奉祢的名去禱告的時候你就要按著我所講的去成就這樣才表示祂有大能可是我們的心態基本上已經是自己是神祂只不過是那個什麼我把它看成是什麼阿拉丁神燈 所以今天呢我們怎麼樣拿著神賜給我們的全餅我們的心態到底是不是真的是尊祂為神然後拿著祂給我們的全餅去服侍願神聖靈幫助我們、光照我們也加天信心給我們 另外是耶穌說你們什麼都不要帶除了拐杖之外什麼都不要帶所以各位弟兄姊妹待會你們的包包啊什麼都可以放著然後就可以出去傳福音了因為什麼都不要帶然後兩個兩個就這樣出去了你只要穿著鞋拐杖是幹嘛 美日言經莊牧師有說是什麼可能要走一段路對不對好長一段路在那時候交通跟路程沒有像我們現在這麼好你走路很多時候可能需要拐杖幫助你可以上下坡啦所以呢連食物也不要帶口袋也不要帶然後呢也不用多穿一件內衣什麼包袱都不用 耶穌啊祢好殘忍喔,祢要餓死我們嗎?
4731.888	4735.731	祢要吵死我們嗎?
4735.731	4739.014	不是的。
4739.014	4746.600	耶穌祂顧念這麼多還沒有認識神的人。
4746.600	4752.245	祂知道祂可以供應,祂知道我們還沒需要之前,祂早都已經供應好了。
4752.245	4756.609	祂要我們憑著信心去依靠祂為我們預備的這一切。
4758.387	4764.821	可是你說服侍神就什麼都沒有也沒有錢也不能存款。
4764.821	4766.265	我也不可以多買一件衣服。
4768.712	4831.922	沒有在路加福音12章那裡耶穌祂最後的晚餐的時候祂有跟門徒說什麼你們要預備錢囊你們如果沒有刀子你們要拿賣了衣服沒有錢買刀子你們就把衣服賣掉去買刀子所以耶穌祂會按著祂的狀況來來吩咐我們來帶領我們的 有些時候耶穌呼召我們去服侍別人有些時候也是會是一個人的但大部分時間耶穌的拆派都是兩個兩個例如說耶穌要進到耶路撒冷城最後要去面對祂的最後十字架的時候祂也是拆派兩個門徒去進到裡面的一個家庭然後去把驢子 預備好的驢子牽到耶穌那裡去,對不對?
4831.922	4833.562	都是兩個兩個。
4833.562	4837.564	因為耶穌祂要我們一同的是什麼?
4837.564	4842.006	同心的來完成神給的任務。
4842.006	4853.452	所以雖然不同階段神有不同的吩咐,但是弟兄姊妹,不會只有一直都是一個人的。
4853.452	4863.781	教會一個人成不成教會, 要一群人奉耶穌基督的名聚集建造才是教會。
4863.781	4871.988	因為PPT換一下因為 所以第二個是信心。
4871.988	4879.991	我們要領受從神來的許多的能力進到神國度的領域裡面。
4879.991	4883.652	我們只能憑著信心去領受。
4883.652	4887.473	今天如果神賜給我們的全餅看不看得見?
4887.473	4889.634	摸不摸得著?
4889.634	4891.815	我們去跟人家講的神看不看得見?
4893.558	4924.653	都只能看到神所創造或神所行的這一些超自然的才看得見對不對所以耶穌基督祂拆派兩個兩個人出去這兩個人祂給我們的權柄所以這兩個人像什麼他們等於就是耶穌的使者他們代表了神國來的使者被拆派出去 然後是要帶著信心的。
4924.653	4930.074	不然你不知道你手中其實已經有耶穌給的權柄。
4930.074	4936.696	你也不知道其實神已經為你前面預備了一切。
4936.696	4938.576	這些都是看不見的。
4938.576	4945.617	在於我們願不願選擇相信神祂所說的話。
4945.617	4949.858	祂說祂是信實、滿有憐憫、滿有慈愛、樂意次豐盛的神。
4949.858	4950.098	阿們。
4952.363	4958.348	接著耶穌說,無論你們到何處去,進了那人家就住在那裡,直到離開那個地方。
4958.348	4965.114	何處的人不接待你們,不聽你們,你們離開那裡的時候,就把腳上的塵土墮下去,對他們作見證。
4965.114	4975.923	各位弟兄姊妹,耶穌有沒有在跟他們打預防針,說你們去傳,會不會有人不聽你們,不接納你們。
4975.923	4975.943	會。
4977.619	5004.098	所以耶穌叫我們去傳福音 耶穌沒有說你們每次去傳只要靠我的能力你們每次去傳就一定那個人就一定都馬上接受你所傳的信息沒有那說 好啊 那我們還要去傳喔 我們的救主耶穌知道祂來的時候還是有很多人拒絕祂,甚至於要把祂釘在十字架殺祂。
5004.098	5009.383	耶穌有沒有說,這樣我不要來,你們自己出,你們自己不。
5009.383	5012.806	沒有。
5012.806	5017.410	耶穌還是為了當下看起來那一小群人,來到了這地上。
5018.183	5050.214	但因為透過這小群人願意相信耶穌透過這一群門徒願意相信耶穌回應耶穌的呼召以至於今天可以才有你跟我坐在這裡說我們是基督徒我們願意敬拜神我們願意來跟從神 阿們所以弟兄姊妹無論環境如何無論我們去傳如何我們都要勇敢的回應神的呼召 可是我們現在很常講什麼?
5050.214	5053.157	CP值高的我才要去做。
5053.157	5057.080	CP值高的我才要去消費。
5057.080	5059.122	CP值高的我才要去買。
5059.122	5059.462	是不是?
5059.462	5063.326	我們現在都常這樣嘛。
5063.326	5069.311	各位兄姊妹,CP值高了在傳福音這件事上,完全不能畫上等號啊。
5071.084	5077.988	不然我看很多你我﹐我們今天沒辦法認識神﹐沒有辦法得蒙救贖﹐坐在這裡敬拜神。
5077.988	5087.554	或許過去我們在傳福音的路上﹐我們有很多的挫敗。
5087.554	5097.601	或許你對你親人﹐對你的配偶﹐對你的小孩﹐對你所愛的爸媽﹐邀請他們來教會﹐已經邀請了一、二十年了。
5097.601	5102.301	你已經想說﹐啊,主啊﹐ 你愛他們比我愛他們多。
5102.301	5104.087	隨他們吧。
5104.087	5105.211	你都已經想放棄了。
5109.053	5111.535	但是你我沒有人知道。
5111.535	5113.396	我們每一次這樣邀請。
5113.396	5114.637	每一次這樣關懷。
5114.637	5117.719	每一次這樣跟他們講福音的時候。
5117.719	5118.900	什麼時候。
5118.900	5120.741	我們每一次做就很像什麼。
5120.741	5121.741	挖通隧道。
5121.741	5124.043	我每一次挖一瓢。
5124.043	5125.464	這次挖了沒通。
5125.464	5127.045	下一個人再挖一瓢。
5127.045	5128.246	還是沒有通。
5128.246	5129.366	下一個人再挖。
5129.366	5134.670	我們不知道誰挖的最後一瓢就是通的那一刻。
5134.670	5135.531	所以我們要不要繼續挖。
5136.578	5140.120	我們要挖,不然那個隧道是永遠都不會通的。
5140.120	5147.504	沒有人去傳道,沒有人去講,怎麼會有人聽到呢?
5147.504	5153.568	前幾天我在跟一個姊妹,我們在小組禱告的時候,在分享的時候。
5153.568	5157.130	我問她,最後我們說你有什麼要代導的?
5157.130	5160.832	她說我爸爸下個禮拜二,要做心導管的手術。
5163.046	5164.847	我說那你爸爸在家嗎?
5164.847	5165.247	他說在。
5165.247	5170.330	我說你要不要問你爸爸,願不願意讓我們為他祝福禱告?
5170.330	5173.611	他爸爸沒有信主。
5173.611	5176.053	然後一剛開始他有點愣住了。
5176.053	5179.495	他說嗯,好。
5179.495	5183.136	感謝主他勇敢的去問他爸爸。
5183.136	5185.778	他爸爸出乎他意外的說,好。
5187.756	5203.850	各位弟兄姊妹,如果他沒有按著我的感動去問他,如果他沒有勇敢地去跨越那一步去問他爸爸,有沒有可能讓他爸爸被禱告,能夠來接觸神一次?
5203.850	5204.171	沒有。
5206.988	5234.814	所以我鼓勵大家各位所以說我們不要消滅聖靈的感動可是當聖靈感動我們的時候當那個環境有的時候當你的同伴或你的其他的人說你要不要怎麼樣或者是你自己想說裡面有聲音跟他傳講耶穌關心這個人我們就勇敢的靠主跨越吧 我們不知道那結果如何。
5234.814	5236.696	但我的工作。
5236.696	5239.578	我的任務就是我去做。
5239.578	5240.619	結果交給神。
5240.619	5242.520	阿們。
5242.520	5244.682	所以這段經文我們。
5244.682	5246.043	神有給我們信心。
5246.043	5247.464	但也要耐心。
5247.464	5249.205	就像我剛剛分享的。
5249.205	5250.406	像我對我的家人。
5250.406	5254.128	我的家人我已經信主。
5254.128	5256.630	快30年了。
5256.630	5257.391	我的爸爸媽媽。
5257.391	5260.333	我的媽媽從一開始。
5260.333	5261.594	就是反對我受洗。
5263.422	5272.809	後來一開始我要進教會工作,他們擔心我經濟上沒有辦法,自己可以獨立。
5272.809	5277.552	他們一開始也不贊成我進教會做行政。
5277.552	5282.516	後來我要讀神學院,一開始他們也不贊成。
5282.516	5287.690	但是每一次我在跟他們分享之後, 我沒有跟他們槓。
5287.690	5295.998	我就跟神禱告說,神啊,如果出於祢,求祢讓他們願意,讓他們可以。
5295.998	5299.802	神就這樣一次一次一次的讓我去經歷。
5299.802	5308.992	我跟神禱告,然後我爸媽他們就自動,自己有一次在談話就說,你要去讀,你要去教會工作,你自己想清楚。
5308.992	5310.093	你如果要,你就去吧。
5311.664	5321.772	你要去神學院讀書,你如果想清楚了,他們的心就被轉化,我不知道為什麼。
5321.772	5329.878	但神知道,我做的就是來到神面前跟神說,神啊若出於你,求你來動工。
5329.878	5334.121	我就等候,我就耐心的等候。
5334.121	5336.663	現在我爸爸媽媽也還沒有認識神。
5339.804	5342.785	但是我要耐心的等候。
5342.785	5344.726	就像農夫。
5344.726	5345.786	我們做我們工作。
5345.786	5347.067	我們鬆土。
5347.067	5347.967	我們撒種。
5347.967	5349.467	我們澆灌。
5349.467	5353.489	我們可不可以使種子發芽。
5353.489	5354.269	不行。
5354.269	5356.390	我們要耐心等候。
5356.390	5359.591	可以使種子發芽的神的作為。
5359.591	5359.811	阿門。
5361.715	5366.921	耐心是我們現在這世代非常缺乏的。
5366.921	5369.123	所以更需要依靠聖靈。
5369.123	5373.008	各位弟兄姊妹。
5373.008	5376.592	最後耶穌才派他們出去要幹嘛?
5376.592	5377.272	任務是什麼?
5378.558	5381.240	是要去傳講神的道。
5381.240	5383.542	傳講天國盡了。
5383.542	5385.364	神的道天國盡了。
5385.364	5387.585	就是要人悔改。
5387.585	5388.987	悔改要幹嘛?
5388.987	5393.470	本來是在世界的這樣的一個管轄下。
5393.470	5395.572	什麼都是我好就好了。
5395.572	5396.753	我要賺多一點錢。
5396.753	5399.415	我要在這地上可以有多一點的權利。
5399.415	5400.576	多一點的地位。
5400.576	5402.157	多一點的讓人家覺得說。
5402.157	5404.179	你怎麼這麼厲害這麼會教小孩。
5404.179	5406.221	你們家怎麼這麼漂亮這麼大。
5406.561	5441.001	哇 你的先生怎麼 哇 他的工作職位這麼好 這麼高這就是地上告訴我們的我們要追求的可是呢當這個福音傳到的人告訴我們說喔 不是喔那位創造你我那位那位神啊祂創造你我的時候祂的心意不是這樣啊 我們呢是有罪的。
5441.001	5442.261	我們要願意怎樣?
5442.261	5445.562	我們要悔改。
5445.562	5448.242	悔改是什麼?
5448.242	5449.943	莊牧師長講的他原文是什麼?
5449.943	5451.563	after thinking 對不對?
5451.563	5453.204	就我們要想。
5453.204	5460.045	在想了之後我們願意回轉向這位愛我們的神。
5460.045	5462.506	回轉。
5462.506	5463.526	因為天國盡了。
5464.753	5466.874	我們要悔改。
5466.874	5474.878	我們現在很難跟人開口說,你要悔改信主,對吧?
5474.878	5484.223	還記不記得小時候,如果知道的話就會暴露你的年紀,小時候那個電線桿很多什麼,說你要悔改對不對?
5484.223	5486.604	信基督得永生,不信什麼?
5486.604	5488.905	下地獄。
5488.905	5497.433	我記得在過去的一二十年, 我們普遍性對這樣的信息非常反感。
5497.433	5499.234	反感。
5499.234	5500.194	反感。
5500.194	5502.014	對。
5502.014	5504.255	我們非常反感對不對。
5504.255	5509.176	覺得幹嘛這樣子一刀直接進去。
5509.176	5512.257	這樣子人家反而不信耶穌耶。
5512.257	5513.738	我不知道你有沒有這樣的想法過。
5513.738	5518.759	我曾經有過。
5520.913	5578.529	可是當我們真的回到神的話語的時候各位兄姊妹如果沒有早期這一群屬靈前輩他們這一些信息在那裡早期他們在這裡傳福音我們臺灣語會不會有這麼多人信主不會啊 所以我們可以用不同的方式去傳福音可是我們現在傳福音從過去那一刀斃命的那種鐘擺的這一端我們已經無形當中盪到鐘擺的另外一端耶穌愛祢 耶穌要醫治祢 耶穌要讓祢很豐盛居上不居下 居首不居尾這就是愛我們的神我們不敢講悔改我們不敢講罪 我們無形當中已經當到中半的這一段了。
5578.529	5583.295	但是福音的最關鍵的信息是什麼?
5583.295	5590.960	這位神來了若我們不悔改我們沒有辦法 回復。
5590.960	5593.801	我們沒有辦法可以出去老舊我。
5593.801	5596.481	我們沒有辦法得著。
5596.481	5598.102	我們如果沒有得到耶穌基督的救恩。
5598.102	5602.683	我們沒有辦法回復神當初創造我們那美好的樣式。
5602.683	5605.003	我們也只能什麼都是在這今生。
5605.003	5606.043	沒了就沒了。
5606.043	5612.745	我們更沒有辦法有永生。
5612.745	5616.126	所以各位弟兄姊妹。
5616.126	5617.746	我們真的是求神幫助我們。
5618.933	5625.901	耶穌祂那時候在這地上所做的,祂就是去傳天國經了,要人悔改。
5625.901	5632.048	然後這些醫病啊,這些趕鬼啊,這些是什麼?
5632.048	5639.157	因著耶穌基督的權柄、權能在那裡,因著祂對人的憐憫、附帶加上來的。
5640.435	5644.017	可是很多時候我們很常要的是什麼。
5644.017	5645.879	得一病得一治。
5645.879	5648.180	我們要的是人能夠得著釋放。
5648.180	5651.242	我們要的是人可以得著豐盛。
5651.242	5652.303	得著盼望。
5652.303	5653.724	得著喜樂。
5653.724	5655.906	可以財務得著解決。
5655.906	5658.888	但我們卻忘了我們其實。
5658.888	5661.870	真正應該要的是誰。
5661.870	5668.254	是那位主啊。
5668.254	5669.014	所以各位弟兄姊妹。
5670.043	5692.921	當門徒他們回應耶穌基督的呼召,拆遣他們出去了,他們去傳講,去叫人悔改,然後他們施行神給他們的權柄,去傳福音之外,也去釋放被求的人,被辱的人,也去醫治得著疾病的人。
5693.712	5763.904	這些都是在告訴那一些他們傳福音的對象我們這位神是有憐憫的神因為祂憐憫祂知道你的苦我們這位神是有權柄的祂的能力大過這些瑕疵人的黑暗權勢祂的能力大過疾病所以趕快來就近這位神趕快來迴轉向祂向祂悔改吧回到祂的面前吧這才是我們傳福音的什麼 關鍵跟重點你要去所以我們也需要有愛心跟憐憫的心對不對如果我們沒有那個愛心我們沒有辦法體貼神對人的憐憫但我們這個愛心要從哪裡來從神來所以是神先愛了我們我們那愛從我們裡面滿溢出來所以我們才能夠 傳成為那個愛的管道,讓周遭的人,讓我們傳福音的人也能夠接收到、領受到神的愛。
5763.904	5770.249	所以這是這段經文,我要跟大家一起分享,我們一起來思想,我們請敬拜團起來。
5775.026	5785.550	我們需要體貼我們神祂的心,就是祂要萬人得救,祂不要一人沉淪。
5785.550	5797.675	各位弟兄姊妹,我們的父神的心,祂就是憐憫著一些思想的人,還沒有認識神的人,所以祂樂意這些人都能夠來認識神,迴轉向神。
5800.998	5808.239	他們神非常樂意把祂的大愛讓這些人經歷。
5808.239	5810.700	那你跟我呢?
5810.700	5816.101	我們願意來回應這位呼召我們的神。
5816.101	5819.561	就像門徒回應耶穌的呼叫。
5819.561	5822.542	來到耶穌的面前。
5822.542	5826.222	然後來到耶穌面前領受耶穌賜給他們的權柄。
5826.222	5829.703	來到耶穌面前體貼耶穌的心腸。
5832.807	5837.810	來到父面前相信耶穌對我們說的話是真實的。
5837.810	5842.813	以至於我們願意勇敢跨出那個舒適圈。
5842.813	5849.377	而且我們願意跟另外一個人一起同心的往前走。
5849.377	5850.758	去傳福音。
5850.758	5853.720	去完成神給我們的使命。
5853.720	5855.260	神給我們的任務。
5855.260	5858.983	你願意嗎?
5858.983	5859.923	這條路好不好走?
5861.766	5863.787	不好走。
5863.787	5865.888	非常不好走。
5865.888	5869.290	耶穌說跟隨祂的路,那個門是什麼?
5869.290	5870.471	宰的門。
5870.471	5872.072	必須要怎樣?
5872.072	5877.275	捨己。
5877.275	5883.379	若我們沒有靠著神的光照跟加添給我們的力量,我們有沒有可能捨己?
5883.379	5883.819	不可能。
5886.408	5919.891	所以我們需要,我們能做的就是第一個回應神的護照,說神我願意,我靠我自己做不到,就像剛剛唐妮這樣,靠自己我什麼能力都沒有,我沒有辦法,我需要你給我屬天的權柄跟力量,以至於我這個什麼都不能做的器皿,要被你使用,好叫你的憐憫,你渴望那些, 還沒有認識神的人。
5919.891	5925.153	還在這世界上,載福載成的失喪的靈魂。
5925.153	5932.697	他們真的能夠,被神得著。
5932.697	5937.979	在這地上有多少人,他們不認識神,他們靠著自己。
5937.979	5939.880	可是他們很苦。
5939.880	5941.241	他們甚至想放棄。
5944.974	5948.115	我們是否能夠體貼神的這個心?
5948.115	5951.577	因為神真的很愛他們。
5951.577	5957.599	但是沒有人去傳道,怎能聽到呢?
5957.599	5959.280	各位弟兄姊妹,好不好美同其理?
5965.674	5969.636	你願意接受今天神要拆派你。
5969.636	5972.298	說神要拆派你出去。
5972.298	5975.520	我們常說我們聚會是為了散會。
5975.520	5977.461	神要拆派你我出去。
5977.461	5979.002	你願意回應呼召神。
5979.002	5983.085	神呼召你你願意回應說主我在這裡我願意。
5983.085	5986.227	我做不到但你幫助我。
5986.227	5989.889	我願意你幫助我。
5989.889	5991.670	即使再苦。
5991.670	5993.451	即使跟我的同伴。
5994.599	5999.426	跟我團隊一起服侍的我們要磨。
5999.426	6001.569	但我也願意祢來磨碩我們。
6001.569	6004.253	讓我們越磨是越契合。
6004.253	6006.316	不是彼此折磨而已。
6006.316	6008.360	主我做不到但祢幫助我。
6009.753	6027.737	讓我們更加同心,更加領受祢的信心,更加在主裡,因著知道我們所做的在天國裡,即使眼前沒有發生,我們也知道在靈界裡一定有發生,因為祢是垂聽禱告的神, 所以以至於我們有盼望。
6027.737	6029.518	我們知道你在做什麼事。
6029.518	6031.299	我們知道有你可以依靠。
6031.299	6034.301	以至於我們可以有你加添給我們的耐心。
6034.301	6036.222	我們願意忍住。
6036.222	6037.863	我們願意忍著。
6037.863	6039.404	我們願意堅忍。
6039.404	6040.085	即使再痛。
6040.085	6043.907	我們知道痛過之後就會成長。
6043.907	6045.929	我願意。
6045.929	6048.150	求神你把愛心給我。
6048.150	6050.192	祝我愛心不足。
6050.192	6051.793	我很常想要放棄。
6053.319	6063.804	祝求祢的愛大大充滿我﹐以至於我的愛﹐領受的愛﹐我可以溢﹐這個管道可以溢出來﹐給我周遭的人。
6063.804	6070.128	我不知道今天﹐這四顆心對你來講﹐你願意領受嗎?
6070.128	6075.690	好不好﹐我們就一起﹐我們就一起來禱告。
6075.690	6079.432	第一個﹐你願意回應神的呼召嗎?
6079.432	6081.914	只要是基督徒﹐你就是有大使命。
6083.114	6091.077	要去執行,你願意回應神的呼召,你就跟神說,神啊,我願意,我在這裡,求祢拆遣我。
6091.077	6108.825	如果你已經回應神的呼召,被神拆遣,去傳福音,說,主,謝謝祢拆遣我,謝謝祢,求祢繼續的帶領我拆遣我,我們一起來為自己禱告,我們也為我們的小組,我們為我們單單教會說,主啊,是的,我每一個人都要被祢拆排出去,我們同生的來開口。
6109.445	6113.528	祝你呼召我成為你的門徒。
6124.718	6128.702	主祢呼召我,祢拯救我,祢呼召我,主我在這裡。
6128.702	6152.003	主啊,是的,求祢幫助我,主我願意把我的一生獻給祢,主我願意把我的一生獻給祢,主啊,求祢幫助我,我願意把我的時間,心力,體力,能力都獻給祢,我把所有的獻給祢,求祢指教我,教導我, 長長不論,主要在高山低谷,我願意回應你的呼召。
6152.003	6153.844	主啊,是的,謝謝你裁判我。
6153.844	6155.764	主,是的,讓我長長敏銳聖靈的帶領。
6155.764	6160.666	我願意被你裁判,我願意跨出殊死圈去。
6160.666	6164.887	主啊,是的,去傳天國的福音。
6164.887	6168.429	主啊,我願意用各境各種方式。
6168.429	6171.950	主啊,去關懷,主啊,去為人祝福禱告。
6172.210	6175.934	主啊,去為人陪讀從懷疑到相信的課程。
6175.934	6178.798	去陪伴人家讀聖經也好。
6178.798	6182.903	主啊,試著去探訪,去醫院,為人祝福也好。
6182.903	6186.667	主啊,在這裡,求祢拆遷我,求祢拆遷我。
6186.667	6189.711	主啊,試著也求祢更多吸引我們。
6189.711	6190.472	Hallelujah!
6193.148	6222.862	接著我們就來為這四顆心來禱告有沒有什麼哪一個或哪幾個是你現在你非常需要的說主啊我很需要你給我同心同你的心同我同伴的心同我們這個一樣的屬靈大家庭的心因為我們的目標就是你就是你給我們的任務 我們先為我們自己可以同心,跟神同心,因為這是關鍵。
6222.862	6226.407	各位弟兄姊妹,我們為自己,為教會來禱告。
6226.407	6227.949	說,主啊,幫助我們。
6227.949	6229.130	我們同聲的來開口。
6230.538	6233.459	主啊,是的,讓我們可以同心。
6233.459	6237.902	主啊,讓我們同心合一,就是要來建造屬你的教會。
6237.902	6241.964	主,我們來教會,不是只是要建造這個硬梆梆的建築物。
6241.964	6245.865	我們來自教會,將建造的是人心。
6245.865	6249.787	主啊,我們一群人在哪裡,那裡就是你的教會。
6249.787	6253.350	我們一群人, 屬祢的百姓在哪裡﹖那裡就是教會。
6253.350	6267.842	主啊 使得讓我們能夠更加明白祢的心﹖讓我們更貼近祢的心﹖主啊 以致於當我們有衝突﹖我們有互相磨挫的過程﹖主我們有困難的時候﹖我們就回到祢的面前來。
6267.842	6282.973	主啊 求祢把祢的心一家天給我們﹖求祢把信心一家天給我們﹖主我們需要祢幫助我們﹖ 主啊,是的,我們在這裡,讓丹江教會是一個同心合一,建造教會,宣揚福音的教會。
6282.973	6286.636	主,我們讚美祢,Hallelujah!
6286.636	6298.225	最後我們呼求聖靈,加添信心給我們,加添耐心給我們,加添愛心給我們,讓我們更深刻來體會我們同生的為自己、為教會來禱告。
6298.865	6303.389	聖靈啊,聖靈啊,我們需要你。
6303.389	6305.510	聖靈啊,聖靈的靈,我們需要你。
6305.510	6308.112	我們每一個人的特質不一樣。
6308.112	6311.235	聖靈啊,我們需要你幫助我們。
6311.235	6316.259	我們要對你更加的信靠,更加有信心。
6316.259	6319.021	我們對我們眼前的同伴,我們也要有信心。
6319.021	6321.543	因為每一個人都是你所揀選的。
6321.903	6324.064	主啊,是的,求祢幫助我們。
6324.064	6327.166	對人的信心不是那種不踏實的。
6327.166	6332.850	主啊,乃是不放棄。
6332.850	6334.031	知道每一個人都是祢所揀選、祢所愛的。
6334.031	6338.594	主啊,每一個弟兄姊妹都是祢所揀選、祢所愛的。
6338.594	6339.134	主啊,幫助我們。
6339.134	6341.996	主啊,我們當中缺乏耐心的。
6341.996	6346.539	主啊,我們當中缺乏愛心的,求祢加添給我們。
6346.539	6351.763	主啊,是的,讓我們在基督裡 我們不斷不斷地在你的話語裡面榨根。
6351.763	6355.927	好像我們可以不斷不斷地向上結果。
6355.927	6361.291	主我們讚美你,我們敬拜你。
6361.291	6363.573	是的,主我們要讚美你。
6363.573	6368.777	主我們在座凡屬你的兒女,都是受差的傳道者。
6370.418	6372.642	但我們不是孤單一個人。
6372.642	6374.625	我們是一群。
6374.625	6380.635	你的百姓是受差的傳道者們。
6380.635	6384.061	抓獅的願你繼續在我們生命當中來動工。
