start	end	text
4.019	12.246	弟兄姊妹平安，我們一起照著今天每日嚴經事宜的進度一起來思想但以禮書第二章二十五節到最後
13.814	42.133	雅略就急忙將但以理領到王的面前,對王說:「我在貝魯的猶大人中遇見一人,他能將夢的講解告訴王。」王問稱為伯提莎莎的但以理說:「你能將我所做的夢和夢的講解告訴我嗎?」但以理在王面前回答說:「王所問的那奧秘是,
43.131	48.234	上帝非常的奇妙祂要透過一個
70.725	97.955	被俘虜的猶太少年人在巴比倫的王宮裡面王因為做了一個夢這個夢對他來講太過重要使他心神不寧但是呢他又竟然這個夢又忘記了因此他把這個巴比倫王宮裡面巴比倫人最喜歡這些天文學啊、占星術啊
99.445	119.215	關這個異象的、解異夢的這些責人術士都把他聚集起來。並且把這個巴比倫人從世界各國這個毀滅的國家所俘虜來的世界各國的精英少年人也都把他召聚過來。
120.196	128.897	可是他們沒有一個人能夠來回答王的問題,因為王沒有辦法將夢告訴他們,他們當然無法解夢。
129.804	155.737	神就安排了一個這麼奇特的場所。彷彿全世界一流頂尖的哈佛大學、劍橋大學、牛津大學。所有世界各地的高材生都被聚集到王的面前。但是卻沒有一個人能夠回答出這個問題。然後王就要殺他們所有的每一個人。然後他們說這個問題太難了。這個大概只有神能夠回答。因此神就
156.357	179.182	使用了一個猶太人,被俘虜的猶太人,少年人,但以理,要來回答這個問題。好在世界各國的精英面前,顯明,唯有神是智慧的神,唯有神是掌管歷史的神,唯有神是審判的神,也唯有神是憐憫幫助的神。誰能像神呢?
179.582	207.94	能夠掌管歷史﹐審判人類﹐然後來決定哪個王朝﹐哪個國王﹐誰興盛﹐誰衰微﹐然後又能夠拯救這些世界各國﹐被俘虜來的這些俘虜﹐上帝充滿了恩慈憐憫。這就是整個但以理書裡面﹐這四個猶太少年人﹐名字的意思。但以理就是﹐上帝﹐審判。哈拿尼亞的意思是﹐耶和華施恩。
209.087	224.482	以沙利﹐他的名字的意思是誰像上帝。最後一個是以沙利﹐亞沙利亞﹐亞沙利亞的名字的意思是什麼?是耶和華拯救,耶和華幫助。那我們繼續往下看。
225.35	254.297	那這個王啊,你在床上想到有關於後來的事,就是未來的事。原來呢,這個尼布賈尼薩王,他所做的夢是關乎到整個國家的未來的發展存亡,以及整個歷史的走向會怎麼走。尼布賈尼薩呢,跟著他的父親,在十年前,把亞述的尼尼維滅掉了。
255.128	281.586	然後開始又打敗了埃及。因此在天下稱霸。不過十年的時間而已。那尼布賈尼撒接替他的父親登基做王之後,他也非常的擔心跟想去了解他的國家未來會怎麼樣。因此想著想著就睡著了。然後就做了一個他忘記的夢。
282.773	285.364	王啊,你在床上想到後來的事。
286.169	312.6	那顯明奧秘式的主將將來必有的事指示你至於那奧秘的事顯明給我並非因我的智慧勝過一切的活人乃為使王知道夢的講解和心裡的思念。因此呢這個丹一里說不是我比這些世界各國的精英還要聰明喔
313.166	341.203	我也不過是一個凡人但是呢,掌管一切奧秘事掌管一切人類歷史命運的大到國家,小到個人的這一位永生的上帝祂要把這個王的夢的講解跟你心裡面所思念的這一切關乎到你的國家的未來人類歷史接下來的發展都要告訴你王啊,你夢見一個很大的象
342.312	369.24	這個像很高,極其光耀。站在你的面前,形狀甚是可怕。這個像的頭是金金的,金紫純金的。胸膛跟這個膀臂是銀的。肚腹跟腰是銅做的。腿呢是鐵的。那腿下面的腳是半鐵半泥的。
370.094	393.881	你正在觀看這一個這麼大的一個像的時候忽然就看見有一塊非人手所鑿出來的石頭就打在這半鐵半泥的腳上把腳砸碎了結果呢腳被砸碎之後呢他整個身體就倒下去了於是金銀銅鐵泥都一同被砸得粉碎
394.821	400.661	誠如夏天荷廠上的康匹被風吹散無處可尋
401.698	430.725	打碎這巷的石頭又變成一座大山充滿整個天下。這就是納夢。我們在王面前要講解的納夢。王啊!你是諸王之王天上的神已將國度、權柄、能力、尊榮都賜給你。凡世人所住之地的走獸並天空的飛鳥祂都交付你的手使你掌管這一切你就是納金頭。
431.561	441.122	喔!原來什麼夢讓這個王驚醒了驚醒驚嚇到一個地步連夢都忘了
441.852	466.148	卻仍然還是非常的驚嚇不已。原來他夢見了整個人類歷史發展的一個趨勢,以及它的一個變化,讓這個王,這個時候這個尼布賈尼薩是不可一世的王,他都非常的震驚,非常的恐懼,非常的驚訝,因為他知道這不是他的智慧能力可以促成的事情。
467.483	496.783	那但依理就說呢這個你呢就是最上面那個頭是金子是最有價值的因為這個是神把這個什麼這個權柄、國度、能力、尊榮賜給你的讓世人所住之地的包含動物走獸還有天空飛鳥祂也都交付你的手使你管理這一切所以呢你要謙卑呀
497.483	512.562	不是因為你跟你的爸爸厲害,把亞素人打敗,又把埃及人打敗,靠自己的能力得了天下。其實是神透過你們巴比倫人來審判悖逆神的。
513.268	539.841	以色列以及悖逆神的萬國萬邦不是你厲害是上帝把這些國家交付在你的手要讓他們敬畏神並且也讓你來管理這一切地上的走獸跟空中的飛鳥是39節但在你以後你的國家有一天也會滅亡其實我們後來就知道整個巴比倫帝國不到100年
541.049	568.135	巴比倫帝國裡面,尼布賈尼撒是第二任國王。他爸爸當國王沒有幾年就過世了。尼布賈尼撒當了國王當了四十幾年。在一個不到一百年的一個帝國歷史裡面,尼布賈尼撒當國王超過了二分之以上的時間。尼布賈尼撒之後所傳的這些王都很糟糕,一代不如一代。最後被波斯國滅亡。那在你以後必興起一國,
569.07	591.645	不及於你,你不假你殺。為什麼呢?那一國就是波斯。波斯國一直都在跟希臘糾纏不清,一直在打仗。打了兩次很有名的波斯跟希臘的戰爭,後來被拍成很多的電影,也寫進希臘的文學作品裡面。
594.002	611.525	接下來又有第三國就是銅必掌管天下你看那個金屬的貴重金屬金銀銅鐵在古代都是貴重金屬但是你看從金它的價值衰退成銀就代表說它的產生的一個
612.346	629.571	正面的有價值的影響力一直在衰減。也就是代表說這個世界在這些不同帝國的掌管之下整個世界的價值在神眼中越來越沒有價值越來越混亂越來越敗壞
630.503	649.439	第三國是同座的,他必掌管天下。第三個帝國指的是希臘帝國。在祖前三百多年的時候,亞歷山大帝所建立的希臘帝國,還有他後面的延續。
650.06	675.757	那沒有錯因為這個希臘帝國他這個版圖是最大的比起這個前面兩個帝國來講版圖是最大的第四國又必堅壯如鐵鐵能打碎剋制百物又能壓碎一切那國也必打碎壓制列國第四個就是羅馬帝國
676.237	698.049	那羅馬帝國的軍隊真的是所向無敵。這也是大家都知道的。那這金銀銅鐵來代表這個巴比倫、波斯、希臘跟羅馬也蠻貼切的。金代表巴比倫,因為巴比倫他非常喜歡用黃金裝飾他們的神廟、宮殿。
698.729	724.64	銀代表波斯,因為波斯他非常會經商。經商他是一個商業大國。銅代表希臘,因為希臘軍隊的盔甲盾牌,方形的盾牌,都是銅做的。鐵就剛好代表羅馬帝國的軍隊,他們的兵器都是鐵做的。
725.538	730.316	那你既見象的角和腳趾頭
730.964	758.535	一半是窯匠的泥一半是鐵那國將來也必分開在這個鐵的腿的下面那個腳跟他的腳趾頭他說是一半的鐵跟一半的泥混合而成的他說代表那個腿那個國將來會分開歷史真的就後來羅馬帝國就分成東羅馬帝國跟西羅馬帝國你寄件鐵
759.275	765.257	所以那整個力量都是分散的。這也跟後來整個
787.483	814.294	東羅馬帝國、西羅馬帝國的分開,然後這整個西羅馬帝國被所謂的歐洲的這個日耳曼民族這個侵略,然後整個民族大遷徙,民族混雜融合。這個真的是講的都是後來真的就發生了。44節,當那列王在位的時候,天上的神必另立一國,而且是永不敗壞。
815.179	837.181	也不歸別國的人。就他不會滅亡。不會被另外一個國家接替。卻要打碎滅絕那一切的國。這國必存到永遠。你既看出非人手所鑿出來的一塊石頭。從山而出。打碎金銀銅鐵泥。
839.206	867.669	金銀銅鐵都是貴重的金屬但是卻被一個毫無價值的石頭把它打碎而這一個石頭我們都知道代表就是耶穌基督我們後來從新約來看代表神要興起耶穌基督祂彌賽亞的國神的國天國然後呢來取代這所有這地上的這些帝國
868.712	894.017	所以呢那就是至大的神把後來必有的事給亡指明這夢準是這樣這講解也是確實的當時尼布賈尼撒王就伏伏在地向但以理下拜哇天啊這個這個國王向一個俘虜下拜並且吩咐人給他奉上貢物跟香品
894.377	921.623	王對但以理說,你既能顯明這奧秘事,你們的神誠然是萬神之神、萬王之王,又是顯明奧秘事的。於是,王高抬但以理,賞賜他許多上等禮物,派他管理巴比倫全省,又立他為總理,管理巴比倫的一切責事。但以理求王,王就派薩德拉、彌撒、
922.807	949.386	雅伯、尼哥,就是但以理那三個朋友,就是哈拿尼亞,然後這個哈拿尼亞,還有米沙拉,米沙利,還有亞沙利亞,這三個他的朋友,來幫助但以理,來管理巴比倫省的事務,只是但以理藏在朝中勢力。哇,這整個故事峰迴路轉,一個不起眼的猶太人俘虜,
950.367	967.427	神透過祂不僅是拯救了所有那些本來要被殺的世界各國的精英同時也讓這個尼布賈尼撒王心中的那種恐懼就是這個夢被解開了更讓尼布賈尼撒王擇福
968.404	995.616	這個的確祂的夢就是要講這樣的事情。這個夢也被解明瞭。祂知道這件事情不是人的手可以做的。這個只有天上的神能夠這樣來主導整個人類歷史的發展。因此祂就福福謙卑下來敬拜。我們一起來禱告。主啊今天的經文真的是讓我們敬畏禰。主我們不小看我們自己。就算我們是一個在苦難中的俘虜。
996.596	1020.198	神一樣可以透過我們來顯明你是萬神之神。如同保羅所說的在我們這瓦器裡面既然有耶穌基督這個寶貝我們就不怕被打碎我們四面受困也不會作難。謝謝主主禰是值得敬畏的因此我們不要被我們的環境打倒也不要被我們的
1020.759	1044.569	環境困住。我們要抬頭挺胸。來服侍禰。要誠心誠意的來跟隨禰。願禰的名透過我們得著榮耀。不僅能夠幫助人。使人離開各樣的挑戰跟患難。也可以帶領更多的人。來認識禰是獨一的真神。奉主耶穌的名禱告。阿們。願神祝福大家。