start	end	text
4.189	5.850	弟兄姊妹平安，我們一起來思想。
5.850	7.151	真言第二十一章。
7.151	12.936	我們來看第一節,第一節蠻多人都有聽過,但是意思卻不太明白。
12.936	19.000	王的心在耶和華的手中,好像攏鉤的水,隨意流轉。
20.350	60.987	壟溝的水壟溝指的就是渠道水道運河或是河流那這個水呢在這個渠道裡面他當然是順著渠道的這個方向或是轉彎來流動喔他說王的心喔好像是渠道的水 在上帝的手中,任凭上帝翻轉祂的手,代表翻轉祂的旨意,來隨意,就是隨上帝的意,隨上帝所喜悅,想要成就的方向來流轉。
60.987	89.616	我想這個經文給我們幾個思想, 我想第一個就是上帝會在人的生命中做感動的工作那我們就是要順服上帝的感動跟引導好讓蒙上帝喜悅的旨意可以透過我們來成就第二個就算我們是王我們是好像很有能力很有地位很有才幹經驗的人 我們也要知道一件事情。
89.616	94.258	上帝也要在我們生命中掌權作王。
94.258	97.680	甚至有一些壞領袖、壞王。
97.680	99.481	他一生悖逆。
99.481	100.701	但最後呢。
100.701	102.082	就算他悖逆神。
102.082	105.844	上帝一樣可以透過祂的悖逆。
105.844	107.925	來彰顯祂自己的榮耀。
107.925	111.026	祂透過審判這個壞王。
111.026	112.247	來顯明。
112.927	116.270	這個世界上,真的是有公義。
116.270	123.916	因此,不論你是不是一個王或領袖,都應該謙卑在上帝的旨意裡面。
123.916	131.403	愿每一個人的心,在耶和華手中,好像笼勾的水,隨耶和華的意而流轉。
131.403	136.948	第二節,人所行的,在自己眼中都看為證,唯有耶和華衡量人心。
136.948	142.631	人都覺得自己是對的, 但是只有神,祂知道你是對還是不對。
142.631	148.794	不僅是你表面是對還是不對,祂也可以知道你裡面是對還是不對。
148.794	153.856	第三節,行仁義公平,比獻祭更猛,耶和華悅納。
153.856	155.296	這是舊約一貫的精神。
155.296	164.921	神看重的還不是你獻祭不獻祭,獻祭獻得怎麼樣,神看的是你獻祭的態度,以及你平常的行事為人。
165.401	177.704	因此如果你平常在外面行事為人是非常讨神不喜悅的但來到教會 大大的奉献,高深的敬拜,这个神也不悦纳的。
177.704	184.508	第四节,恶人发达,永远是恶人的灯,眼高心傲,这乃是罪。
184.508	189.330	恶人呢,他眼高心傲,他从来没有因为他作恶而觉得羞惨。
189.330	194.633	然后让自己在那边发旺,灯在那边发光。
194.633	196.554	这更彰显,这一切都是罪孽。
197.534	218.319	第五節因情籌劃的乃至風譽形式急躁的都必缺乏再一次這個箴言來肯定勤奮以及用心盡責任規劃這些都會使我們 達到上帝要給我們的豐盛的祝福。
218.319	226.461	但是唯有做事情不好好規劃的、形式急躁的,最後都是缺乏跟失敗。
226.461	238.163	第六節,用鬼詐之蛇求財的,就是自己取死所得之財,乃是吹來吹去的浮雲,就是過眼雲煙。
238.163	240.804	因此,不義之財真的存留不久。
241.664	251.752	之前的箴言還說,惡人這一生急急盈盈所賺來的財富,最後上帝都要把他拿給義人去使用。
251.752	258.417	第七節,惡人的強暴必將自己掃除,因為他們不肯按公平行事。
258.417	260.999	這讓我們再次被提醒,惡有惡報。
260.999	266.123	最後惡人所做的,必然要把他自己都掃除。
266.123	269.846	他的暴力、他的邪惡,都要摧毀他自己。
270.947	300.987	第八節復罪之人復罪之人就是犯罪的人復罪之人的道路甚是彎曲至於清潔的人他所行的乃是正直第九節寧可住在房頂的角上房頂的角上就是說寧可住在屋頂的一個小小的角落 很擠,也不要在寬闊的房屋與爭吵的婦人同住。
300.987	315.220	他的意思是說,我寧可住在屋頂一個小小的角落,我也不要住在這個下面正常的房屋,寬闊的房屋裡面,與這個跟我爭吵的妻子同住。
315.981	343.271	那我想這個祂不是要教導我們要不要管太太的喜怒哀樂然後就說你是愚昧的婦人我不要管你我不要跟你在一起不是祂的意思是說要去好好的去解決去面對婚姻裡面溝通上的問題夫妻之間的爭吵不要逃避祂的意思是說 一爭吵我就躲到房頂的牆角裡面。
343.271	347.434	不是這個意思,而是說,我們應該要好好來,來去面對。
347.434	352.098	不能任憑家裡面,一直有這種關係的緊張跟爭吵。
352.098	359.617	第十節,惡人的心, 樂人受惑﹐他的眼﹐並不連續淋射。
359.617	369.860	惡人在這邊被形容為﹐幸災樂禍的人﹐也不憐憫﹐他淋射所遭遇的難處﹐跟這個傷痛。
369.860	377.642	十一節﹐洩漫的人受刑罰﹐愚蒙的人就得智慧﹐智慧人受訓毀﹐便得知識。
378.422	389.273	也就是說當傲慢的人他得著審判跟刑罰的時候這個時候 這是愚昧的人,看也會看懂。
389.273	392.695	他就得智慧說,我不要像他一樣。
392.695	401.500	那更何況是智慧的人,如果他有謙卑、受训悔的心,他更要得著上帝給他的真智慧。
401.500	404.281	十二節,義人思想惡人的家。
404.281	408.804	這個義人,也可以翻譯為公義的上帝,都可以。
408.804	415.108	所以呢,公義的上帝思想惡人的家,祂就知道惡人要傾倒,必至滅亡。
415.708	418.011	恶人的道路,神都知道。
418.011	423.357	神也明明白白在圣经里面告诉我们,恶人的道路就是灭亡。
423.357	428.743	十三节,塞耳不听穷人哀求的,祂将来呼吁,也不蒙应允。
428.743	433.669	你怎么对待别人,神有一天就让别人也怎么对待你,祂也要这样对待你。
435.213	438.675	暗中送禮物的,挽回怒氣。
438.675	442.818	懷中地的賄賂,只惜報怒。
442.818	448.322	我們在之前的幾個箴言裡面,有講到禮物跟賄賂兩個性質不一樣。
448.322	451.505	禮物比較是正面的,賄賂比較是負面的。
452.381	481.157	那但是這邊要講的說不論是正面還是負面的思想他們都有一個共同認知就是連賄賂者也知道我們都應該盡力去與人和好那更何況是義人我想他的道理就是告訴我們要挽回怒氣止息暴怒用這個合一的方式來使人與人之間應該和睦 十五節秉行公義﹐使義人喜樂﹐使作孽的人敗壞。
481.157	489.947	我們行公義﹐就會讓義人得保護﹐也讓這個惡人他的事蹟敗漏﹐得著這個審判。
490.828	517.297	我想這個是我們不要與作惡不公義的人同謀我們應該要伸張正義十六節迷離通達道路的必住在陰魂的會中就是走離開人生康莊大道的上帝的正道的人他最後必住在陰魂的大會之中就是他會死亡 十七節,愛厭樂的,必自窮乏。
517.297	519.599	好酒,愛膏油的。
519.599	526.746	膏油指的,不是那個受膏者那個膏油,指的是這些很肥美的食物。
526.746	531.191	好酒,愛膏油的,必不負足。
531.191	535.035	就是意思,都是在吃喝玩樂的人,他終必會敗亡。
536.783	557.477	十八節惡人做了義人的贖嫁奸詐人代替正直人什麽意思呢就是惡人想要害別人最後反倒害了自己所以呢他就是害人害己十九節寧可住在曠野不語 爭吵使氣,就是發脾氣的婦人同住。
557.477	577.871	婦人指的又是妻子,這跟剛剛講的那個是差不多,就是說,不是說你妻子跟你吵架你就躲到曠野去,而是說家裡有夫妻關係真的是有問題的要來面對,不要任憑妻子跟你在那邊不高興發脾氣,要勇敢來面對。
577.871	584.495	二十節,智慧人家中積蓄寶物高有,愚昧人 谁得来谁吞下。
584.495	587.657	愚昧人他不懂得积蓄。
587.657	590.718	他就是今天一天都把他花光了。
590.718	592.519	他人生没有规划。
592.519	594.600	以至于呢他就是得过且过。
594.600	598.022	最后呢就陷入贫穷跟败亡。
598.022	598.982	二十一节。
598.982	603.404	追求公义仁慈的就寻得生命、公义和尊荣。
603.404	605.886	我们常讲上帝是很公平的。
605.886	608.127	你要什么祂就给你什么。
608.127	609.367	你要的是诡诈、这个羞辱。
612.449	614.791	敗壞你真的要嗎?
614.791	632.367	好,祂就任憑你得到那些東西但你如果這一生要追求的是公義、聖潔、仁慈、尊榮和生命祂也是很信實的就把你渴望的來賞賜給你就看你跟我想要追求的是哪一條路呢?
633.148	640.193	二十二節,智慧人爬上勇士的城牆,傾赴他所倚靠的尖雷。
640.193	644.176	這邊講到兩種人,一種是智慧人,一種是勇士。
644.176	648.679	勇士代表說他的力量很大,或是他的資源很豐盛。
649.360	672.576	這邊告訴我們說其實人生很多事情不是靠勇、力氣或是靠你的資源有多少靠的是上帝的智慧從上帝那邊得著智慧的人祂能夠攻下最艱難的城牆都能夠被祂攻下 二十三节,谨守口语舌的,就是保守自己免受灾难。
672.576	676.158	郑燕常提醒我们,口舌言语的重要。
676.158	678.599	不要让口舌让自己遭祸。
678.599	683.101	二十四节,心骄气傲的人,名叫谢曼。
683.101	685.842	他行事狂妄,都出于骄傲。
687.927	731.481	新交契奧的人有一個名字他叫做謝曼他就是看什麼都就是很親密那這樣的人他當然行事就會非常狂妄因為他是一個驕傲的人 我们要留意很多时候我们有这种酸言酸语奋士嫉俗我想都跟这个有关其实有时候生命里面充满了骄傲骄傲的眼目会让我们看事情看得不准确最后我们会在里面吃很大的亏二十五节,懒惰人的心愿就是懒惰人的愿望将他杀害因他的手不肯做工 懶惰人的願望是什麼?
731.481	768.584	我想懶惰人的願望就是耗吃懶做擺爛躺平不勞而獲而這種願望會把他自己害死了因為他他不願意去工作他不願意去行動 二十六节有终日贪得无厌的也有义人施舍而不吝惜的那你要的是哪一种呢是贪得无厌只进不出还是上帝给你很丰盛你也愿意把祂施舍出去造福人群与人分享 那你愿意把它舍出去跟别人分享。
768.584	772.869	因为我们都是白白得来的,应该也要白白的分享喔。
772.869	779.746	你更愿意这样做,上帝就把你看作是一个 可以輸送祂祝福的管道。
779.746	785.711	祂就多多的把祂的祝福,輸送到你的生命裡面,好讓你再分享出去。
785.711	791.655	二十七節,惡人的祭物是可證的,何況祂存惡意來獻呢?
791.655	798.381	神不喜悅,神也不悅納,動機態度不對的獻祭奉獻禱告和服侍。
798.381	803.425	神是不得輕慢,也是不可欺騙的。
803.425	806.027	二十八節,做假見證的必滅亡。
806.527	809.469	唯有聽真情。
809.469	836.696	聽真情就是善於聆聽判斷的唯有善於聆聽判斷的人他所說的、他所言的其言長存也就是說道聽途說講的這些東西他不會長存的他也不會有真實影響力但是唯有善於聆聽跟判斷的人他的判斷跟聆聽卻能夠說出最有價值的話其言長存 29節。
836.696	840.699	惡人臉無羞恥,正直人行事堅定。
840.699	844.962	沒有人能以智慧、聰明、謀略、抵擋耶和華。
844.962	847.803	我想在神的面前,人人都要謙卑。
847.803	854.508	惡人臉無羞恥,然後自以為他的智慧、聰明、謀略,可以抵擋耶和華。
855.128	890.926	那唯有正直人他倚靠神行事堅定神就更加的把他自己的智慧聰明謀略賜給正直的人三十一節馬是為打仗之日預備的得勝乃在乎耶和華 這又是一個關於人應該要為自己的事負責任好好規劃勤勞負責但是我們也知道祂最後的結果是由耶和華來決定的喔這邊讓我們看見人的責任跟神的主權喔 在真言裡面,這樣的一個搭配,是常常讓我們看見。
890.926	896.367	鼓勵我們,要依靠上帝給我們的智慧、聰明、才幹,好好經營我們的人生。
896.367	900.948	但是也要讓我們生命裡面,讓出一個空間,讓出一個寶座。
900.948	908.829	讓神隨時可以進來坐在寶座上,來改變我們的計畫,來引導我們的既定的道路。
908.829	911.770	因為上帝的智慧,總是高過我們的智慧。
911.770	912.690	我們一起來禱告。
913.490	917.411	主,唯有祢是真正的智慧、聰明、谋略。
917.411	920.451	我们在祢面前无法抵挡祢。
920.451	923.332	我们只有更加的顺服、倚靠祢。
923.332	928.813	主,我们才能够从祢得着祢要赐给我们的聪明、智慧、谋略。
928.813	931.893	而使我们走在蒙福的道路上。
931.893	936.554	谢谢主,祝福我们更加谦卑的来被祢吸引、跟从祢。
936.554	939.835	奉主耶稣的名祷告,阿们。
939.835	940.655	愿神祝福大家,