start	end	text
18.780	24.666	弟兄姊妹平安，我們繼續按照每日言經事宜的進度,繼續來思想阿摩斯書第八章。
24.666	28.750	第八章這邊要講到阿摩斯所看見的第四個異象。
28.750	35.696	第七章告訴我們阿摩斯看到了蝗蟲、火和準神的三個異象。
35.696	38.880	上帝面對不悔改的以色列人,祂不再寬容。
39.770	43.293	而第八章這邊要看見的一項,我們一起來思想。
43.293	49.338	第一節,主耶和華又指示我一件事,我看見一筐夏天的果子。
49.338	52.141	他說,阿摩斯啊,你看見什麼?
52.141	55.443	我說,看見一筐夏天的果子。
55.443	60.388	耶和華說,我們以色列的結局到了,我必不再寬恕他們。
60.828	66.052	結菊這個字,跟樹木結果字。
66.052	72.357	結菊跟結果字,這個是同一個字,就是雙關語。
72.357	79.383	夏天的果子不能再放了,再放就要爛了,因為夏天的果子放在那邊已經熟透了。
79.923	106.753	在下一步就是會爛掉所以代表這個結局已經到了百姓死不悔改所以以色列的結局已經到了耶和華說他不再寬恕他們了主耶和華說那日殿中的詩歌變為哀嚎必有許多屍首在各處拋棄無人作聲到那天就真的是 沒有辦法再挽回了。
106.753	111.114	所以阿摩斯的心中,我想當然這時候是非常的難過。
111.114	129.640	弟兄姊妹,我們常常也很納悶我們自己,為什麼都要等到大禍臨頭,或是上帝出重手,我們才願意聽上帝的話語的勸,聽聖靈的勸,來改正我們,或是悔改呢?
129.640	160.953	好像就是不見棺材不掉淚, 第四節上帝繼續來舉例你們這些要吞吃窮乏人是困苦人衰敗的當聽我的話你們說月朔幾時過去我好賣糧食安息日幾時過去我好擺開脈子來賣 月朔就是新月,就是月初,初一的意思。
160.953	177.908	這邊談到有一些這些奸商,那這個旧約聖經吩咐以色列人,安息日還有月朔都要休息, 專心的來到神的面前,尋求上帝的救贖。
177.908	186.093	但這些奸商呢,他們每天在想,就是怎麼樣繼續做生意,來騙人,然後來剝削這些窮人。
186.093	189.415	如同第四節所說的,要吞吃窮乏人。
190.691	195.474	所以他們根本不想守玉樹和安息日。
195.474	201.377	很有意思,第四節說,使困苦人衰敗的,當聽我的話。
201.377	202.798	這是奸商。
202.798	208.861	使衰敗的,這個字,跟安息日,這是同一個字根。
208.861	216.531	就是說,這個反諷, 這個你們應該是要停止你們這樣的作為。
216.531	220.556	你們應該在安息日的時候好好來到上帝面前悔改。
220.556	222.458	但你們現在卻停不下來。
222.458	228.425	你們要在安息日還在想怎麼來使別人衰敗。
228.425	231.248	使別人的生命停下來。
231.248	231.748	這是一個反諷。
233.558	266.089	然後他就說他們的奸商的腦袋是這樣我賣出的時候用小聲抖我收銀錢的時候用大的這個蹭錘用詭詐的天平來欺哄人在一買一賣之間都用詭計就是不公平的金糧來騙錢 好用銀子買平安人,用一雙鞋換窮乏人,將壞了的脈子再賣給人。
266.089	278.721	所以呢,這個貧窮的人,就越來越窮,甚至窮到一個地步,要買一雙鞋,還得把自己賣了,才有錢買一雙鞋。
279.411	309.319	代表就是說在這些官商勾結的情形之下窮乏人真的是無路可走第七節耶和華指著雅各的榮耀雅各指的就是以色列榮耀原文是驕傲狂妄所以耶和華指著雅各的驕傲狂妄啟示說他們的一切行為我必永遠不會忘記 第八節,地豈不因這事震動嗎?
309.319	312.341	其上的居民,不也悲哀嗎?
312.341	318.024	地必全然像尼羅河藏起來,又如同埃及河,湧上落下。
319.053	323.635	阿摩斯書他是寫於大地震之前兩年。
323.635	361.215	所以上帝其實一直在給以色列人警告他也要透過接下來要發生的大地震提醒百姓阿摩斯之前已經說過預言會有大地震來而這大地震只是大毀滅的前兆 所以當這大地震來的時候,人應該去省思這種安逸無慮的生活,繼續過這種道德敗壞,做傷天害理,敬拜偶像,驕縱豔樂,目中無神,目中無人,毫無公平毫無憐憫的日子還要多久,還能維持多久呢?
361.715	400.999	神啊祂的憤怒一來大地震一來整個把你翻掉那時候你再也沒有挽回的機會了地震來的時候那個河水漲起漲落代表那個地震非常的大 第九節主耶和華說道那日我必使日頭在午間落下使地在白昼黑暗接下來這幾節都我們可以留意他的開頭都強調我我我所以耶和華說道那日 這一切我都會讓他來這樣子進行。
400.999	406.784	包含說,他讓我們覺得很不正常的情形會出現。
406.784	413.730	我必使日頭在午間就落下,使地在正午時間的白晝忽然變為黑暗。
414.411	416.093	大毀滅來臨。
416.093	420.918	我必使你們的節旗,變為悲哀,歌曲,變為哀歌。
420.918	424.601	你們本來自以為還在敬拜我,對不起,我看穿你們了。
424.601	429.026	你們根本表面敬拜我,心裡面都敬拜魔鬼,敬拜偶像。
429.026	433.371	所以就在你們的節旗的時候,我讓毀滅來臨。
434.087	439.131	在你們用歌曲敬拜我的時候,我讓你們變成唱哀歌。
439.131	452.001	神不給你面子,也不配合你的演出,不配合你們這些宗教活動的演出,不給你留情面,讓你的節旗、敬拜都變成悲哀的哀歌。
452.001	454.823	眾人腰束麻袋,頭上光禿。
454.823	498.600	頭上光禿代表就是這個拔頭髮,然後呢這個 好像懊悔或是說他們被俘虜的時候頭髮被剃掉被羞辱使這場悲哀如喪獨生子至終如痛苦的日子一樣上帝的大毀滅來的時候那個悲痛就是使人失去了一切的盼望一個人他失去了獨生子他等於就是沒有任何盼望他活著就沒有價值跟意義了這個比他自己死還痛苦 第十一節,主一合法說,日子將到,我必要命饑荒降在地上。
498.600	507.665	剛剛不是用賣糧食的奸商來做一個控訴的百姓奸詐,不公不義的事實嗎?
507.665	513.448	現在繼續要用跟糧食有關的,就是饑荒來宣告上帝的審判。
513.448	515.249	他要命饑荒降到地上。
516.937	527.226	人飢餓非因無餅,甘渴非因無水,乃因不聽耶和華的話。
527.226	532.130	這句話很有名,很可能是阿摩斯書裡面最有名的一句話,我們再讀一次。
532.130	540.117	人飢餓非因無餅,甘渴非因無水,乃因不聽耶和華的話。
541.135	544.558	他們必漂流從這海到那海。
544.558	550.144	就飄蕩在這個西邊的地中海跟東邊的死海中間。
550.144	557.291	然後呢從北邊到東邊往來奔跑尋求耶和華的話。
557.291	565.640	就是以色列人到處在國境裡面到處要去尋找 這個上帝使這麼大的毀滅來臨了。
565.640	567.542	使這個饑荒臨到我們了。
567.542	568.663	審判來了。
568.663	574.129	他們到處那時候想要去尋找耶和華有沒有話語要賜給我們。
574.129	575.370	要應許我們。
575.370	576.291	要赦免我們。
576.291	576.931	要拯救我們。
577.432	580.894	因為之前,他們都禁止阿摩斯說預言。
580.894	588.997	禁止阿摩斯為耶和華說話,管教他們,攻擊他們,提醒他們,他們就很刺耳。
588.997	591.739	南國來的,跑到我們北國來做什麼?
591.739	595.160	回去回去,不准再說話。
595.160	599.983	所以你既然禁止神透過祂的先知說話,那完蛋了。
599.983	608.029	在上帝的審判來臨的時候, 那個時候你要去找耶和華的話,你卻找不到了。
608.029	617.338	所以讓我們看見,就是第一,那個饑荒的災難來臨的時候,其實為什麼會饑荒會來到?
617.338	619.480	是因為人不聽耶和華的話。
620.316	623.738	所以呢,上帝就讓這個饑荒來到。
623.738	627.039	但是更深一層的意涵,要告訴我們什麼?
627.039	656.527	就是說,當神已經不再藉著先知對我們說話,當神已經閉口不言了,因為我們硬心,祂就閉口不言,定義要讓毀滅,或是審判連到的時候,天啊,在那個時候,才要去找耶和華的話,卻耶和華不願意向我們說話,所以我們找不到耶和華的話, 那一種情形是比饑荒更可怕的。
656.527	661.492	饑荒已經讓我們覺得害怕,因為沒有吃到食物,就會餓死嘛。
661.492	666.877	然後饑荒通常跟旱災一起來,我們沒有水喝,也會渴死。
666.877	671.601	但是呢,造成饑荒跟旱災的原因是因為,神的審判領導。
672.517	674.517	而神的審判臨到的時候。
674.517	676.958	我們又找不到神願意對我們說話。
676.958	680.518	我們就解決不了這個神的審判的事實。
680.518	683.699	我們沒有辦法讓我們逃脫神的審判。
683.699	686.699	那個是比饑荒沒有餅。
686.699	688.820	比旱災沒有水喝。
688.820	691.100	更可怕更可怕的事情。
691.100	694.521	所以他才說人饑荒並非因。
694.521	696.101	因為沒有餅可以吃。
696.101	698.501	甘渴也不是因為沒有水可以喝。
698.501	700.202	人會落到這個田地。
700.202	702.002	乃是因為不聽耶和華的話。
703.814	716.660	在審判管教來的時候,找不到上帝的話,聽不到上帝赦免的話,拯救的話語,比飢荒、乾旱更可怕。
716.660	722.943	十三節當那日,美貌的處女和少年的男子,必應乾渴發昏。
724.548	757.027	這些少男少女年輕人就是國家未來的希望在第七章第十節的時候也談到當審判來臨的時候是這些少年人們的叔叔伯伯在幫他們收屍因為他們都被殺了剛剛我們在第八章的第十節講到耶和華的審判日子來到的時候那場悲哀如喪獨生子一樣 所以這些少男少女國家未來的希望,眼看就都要死了。
757.027	769.095	但在這個時候,百姓竟然他們找不到上帝的話的時候,他們沒有在那邊哀哭悔改等候神再次對他們開口說話。
769.095	772.577	他們到處找不到上帝的話,他們就放棄了。
772.577	780.105	他們就指著撒瑪利亞的牛賭, 啟示說,薩瑪利亞的牛賭,永遠是薩瑪利亞的罪。
780.105	783.248	我們知道指的就是拜金牛賭。
783.248	792.236	他們指的金牛賭,啟示說,但啊,因為在北邊的那個但,也有拜金牛賭的地方。
792.236	796.520	南部的這個伯特利,也有拜金牛賭的地方。
796.520	810.812	但啊,我們指著你那裡的火神啟示, 又說,我們指著別世巴的神道,因為是活道,也是他們欽拜的一種偶像,也來啟示,代表什麼?
812.449	843.476	當他們以前不願意神對他們說話神就真的不再說話了使審判管教領導然後他們就痛苦難當他們那時候才想要來尋求神對他們說話可是神沒有對他們說話他們也不願意繼續等候神在神面前哭哀哀哭痛悔等候神願意再次對他們開口說恩言他們連這個動作也不等了 他們什麼你不說話就算了。
843.476	847.399	他們轉過頭來又重新去找金牛賭。
847.399	850.460	然後宣告發誓說。
850.460	852.742	你是這個活神。
852.742	854.463	你一定可以救我們。
854.463	856.684	甚至呢在北國。
856.684	858.765	這樣尋找金牛賭還不夠。
858.765	860.286	還跑到南國。
860.286	862.808	很南邊的別世巴那邊。
862.808	865.889	也去那邊尋找偶像。
865.889	867.690	你是活的道。
867.690	870.192	你是在曠野中可以為我們開道路的活道。
872.159	878.322	耶和華說,這些人都必鋪倒,永遠不再起來。
878.322	887.186	今天經文讓我們看見,當我們硬心背逆的時候,那幕後的光景,是何等的可怕,何等的淒涼。
887.186	894.010	真的,人飢餓並不是因為沒有餅,乾渴也不是因為沒有水,怎麼會落到這種田地呢?
894.010	895.711	都是因為我們不願意聽耶和華的話。
896.544	928.641	所以最可怕的事情不是你日常生活中找不到餅吃找不到水喝而是日常生活中神不再對你說話你找不到神的話找不到神的應許找不到腳前的燈找不到路上的光那個比你沒有水和餅吃喝更可怕我們一起來禱告主願我們在乎你的話願我們珍惜你的話語提醒 和聖靈在我們心中的指教。
928.641	939.047	免得我們在患難來的時候,管教來的時候,主啊,找不到祢的恩言,找不到祢自己的拯救的應許。
939.047	947.853	主,我們就陷入極大的絕望,陷入極大的枯乾,陷入極大的極惡與死亡。
947.853	950.594	主啊,讓祢的話語不要離開我們。
950.594	957.355	主啊,讓我們回到祢的話語裡, 在你的話語裡有救恩之樂。
957.355	958.817	奉主耶穌的名祷告。
958.817	959.477	阿們。
959.477	960.679	願神賜福大家。