start	end	text
10.162	11.903	弟兄姊妹平安，我們一起來思想。
11.903	16.204	《約翰福音》第十二章的第十二節到二十二節。
16.204	34.652	第二天,就是逾越節前五天,就有許多上來過節的人,聽見耶穌將要到耶路撒冷,就拿著棕樹枝出去迎接祂,喊著說:"和善那,奉主名來的以色列王,是應當稱頌的。
36.152	41.154	這邊講到很多人來耶路撒冷過逾越節。
41.154	43.915	他們很多人特別是要來看耶穌的。
43.915	49.157	因為他們認為耶穌就是要來做王的那一位彌賽亞。
49.157	53.779	拿著棕樹枝來迎接耶穌進入耶路撒冷聖城。
54.957	59.659	基本上中述之只有祝彭節才會拿中述之。
59.659	61.260	現在是什麼節?
61.260	62.401	逾越節。
62.401	64.302	那怎麼會拿中述之呢?
64.302	66.543	原來是有歷史典故的。
67.705	76.772	在祖前167年的時候,那時候耶路撒冷是被這個希臘的國王所統治的。
76.772	91.585	那希臘的國王就很煩,因為那時候他正在跟埃及那邊打仗,可是這個猶太人三天兩頭在那邊造反,所以他一直希望說把這個猶太人的這個傳統的信仰把它除掉。
92.125	100.252	祂很希望祂的管轄的國土裡面,都是統一的一個希臘化的一個文化跟宗教。
100.252	103.315	不然祂的國家會內憂外患。
103.315	105.157	那祂叫做安提亞四世。
105.157	118.331	那祂就在祖前167年的時候,祂在耶路撒冷的聖殿的祭壇上面, 他不僅是獻豬,這個猶太人覺得豬是最髒的,不潔淨。
118.331	127.396	他不僅是獻豬,他還在祭壇上直接設立這個希臘人的神像。
127.396	129.717	所以猶太人抓狂了,受不了了。
130.077	136.601	所以就有一個叫馬加比家族的祭司家族起來反抗。
136.601	146.727	從祖前167年打戰,打到祖前164年,馬加比家族拿下了耶路撒冷,就竭盡了聖殿,把偶像除掉。
146.727	151.790	這就是我們在約翰福音第十章講的修殿節的由來。
152.534	159.537	因此在祖前164年,他們光復耶路撒冷之後,他們就拿了中述之慶祝怎麼樣?
159.537	164.678	推翻外邦人的統治,恢復聖殿的捷徑。
164.678	167.179	所以拿中述之的由來是這樣。
167.179	184.465	甚至在23年之後,在祖前141年,瑪迦比家族進一步在整個猶大地區都已經推翻了希臘人的統治之後, 他們也再次拿起這個中樹枝來慶祝。
184.465	194.749	所以,現在在這個逾越節的時候,百姓拿中樹枝吶喊,然後歡呼耶穌進來作王。
194.749	199.050	他的宗教,真的是政治意味是非常高的。
199.050	204.992	這就是所有的這個猶太人的觀賬,跟這個宗教領袖最害怕的事情。
204.992	211.798	因為他們知道這個一作亂, 羅馬人絕對會把他們的這個自治權全部拿走。
211.798	217.803	猶太人就名存死亡了,就真的是滅國了。
217.803	223.988	在這邊,14節,耶穌就得了一個驢驅,就騎上去。
223.988	229.332	如今上所記,這邊指的是撒加利亞書第9章9到10節。
230.503	238.790	在這邊呢,這個約翰就引用了一段話,習安的民啊,不要懼怕,你的王騎著驢驅來了。
238.790	250.379	這些事,門徒起先不明白,等到耶穌得了榮耀以後,才想起這話是指著祂寫的,並且眾人果然向祂這樣行了。
251.954	269.635	撒加利亞書有一個預言,就是明賽亞來的時候,祂是要帶來公義,祂要帶來和平,而且祂是謙謙和和的,謙謙卑卑的,不是騎著馬來的,是騎著,謙謙卑卑的騎著驢車進來作王的。
270.179	276.320	祂要統管這個萬國,並且祂帶來公義跟和平。
276.320	283.302	所以耶路撒冷的居民不要害怕,因為不會帶來戰爭,是帶來真正的和平。
283.302	290.444	因此呢,這邊他們就用,約翰就用這個經文事後,他們就把這個連在一起。
290.964	317.213	和善納的意思原本是求祢拯救在詩篇裡面常常會出現和善納和善納所以他們就是要呼喊求神派下君王來拯救我們脫離外邦人的統治 十七節,當耶穌呼喚拉撒路,叫他從死裡復活,出墳墓的時候,同耶穌在那裡的眾人就作見證。
317.213	322.794	眾人應聽見耶穌行的這神蹟,就出去迎接他。
322.794	331.016	法利塞人彼此說,看啊,你們是徒勞無益,世人都隨從他去了。
331.016	341.832	十一章十二章一直讓我們看見,耶穌叫拉撒路從死裡復活這個大神蹟, 讓很多人都相信耶穌是彌賽亞。
341.832	344.853	然後宗教領袖擋也擋不住。
344.853	365.740	雖然在第11章的時候,大祭司蓋亞法說,就剛好利用這個機會,我們就把耶穌殺掉,讓百姓死了心,再也不要去盼望什麼這種來作亂的彌賽亞,免得羅馬人藉這個機會修理我們,把我們滅掉。
366.664	371.127	所以,其實我們可以去思考一個事情。
371.127	376.170	耶穌叫拉撒路從死裡復活這件事情,是一個超級大的神蹟。
376.170	382.894	祂一方面吸引了很多人來相信耶穌,這給我們看見神蹟的第一個功用。
382.894	388.597	神蹟騎士的確是可以吸引人,把人帶到耶穌這裡來的。
388.797	390.838	這是無庸置疑的。
390.838	415.551	但第二個我們要進一步更深的去省思神蹟騎士有時候把人帶來到耶穌面前可是他們所想要來信的那個耶穌不一定是耶穌祂來想要扮演的那一種彌賽亞這個我們在約翰福音講很多次了現在百姓們都因為拉撒路死裡復活的神蹟 拿著棕樹枝來迎接耶穌。
415.551	426.361	可是他們迎接耶穌,我們講棕樹枝,就是期待一個重現馬加比家族推翻外族統治的成功的革命的君王。
427.227	428.949	耶穌來是要做這個嗎?
428.949	430.190	不是啊!
430.190	435.876	可是這些人因著拉撒路從死裡復活的大神蹟就直接跳到下一格是什麼?
435.876	491.365	就是祂就是要來幫助我們脫離外邦人統治的大英雄很可惜耶穌不是要當這種大英雄 所以呢神蹟一方面可以使人快速到耶穌面前來但快速到耶穌面前來的時候我們耶穌一定會進一步做一個工作就是像撥洋蔥一樣讓我們去檢視我們信心的動機跟本質到底是什麼我們所期待的那個彌賽亞未必是耶穌想要扮演的彌賽亞喔這個是很重要的事情那二十節 那時上來過節禮拜的人當中,甚至有幾個希臘人,他們來見加利利博塞大的菲利,求他說:「先生, 我們願意見耶穌,非力去告訴安德烈,安德烈同非力去告訴耶穌。
491.365	494.086	這是一個非常反諷的一個記載。
494.086	506.250	因為在19節,法利塞人就彼此說,看啊,我們大家在這邊想要把耶穌除命,是徒勞無益的,世人都去跟隨祂了。
506.250	516.084	約翰立刻記載,沒有錯,連那些不是猶太人的這個希臘人, 他們來到耶路撒冷,他們也去找耶穌了。
516.084	529.696	那時候有一些非猶太人,他們心中想要認識、親近以色列所敬拜的獨一真神,所以他們也會來這邊過節。
529.696	535.521	但他們到聖殿去的時候,就在聖殿的比較外圍,叫做外邦人院。
536.118	542.321	這個是給那些非猶太人去敬拜神的地方。
542.321	551.025	也就是耶穌潔淨聖殿的時候,把賣牛羊、鴿子兌換引擎的人趕出去的那個地方,是在外邦人院。
551.025	564.586	這也給我們一個提醒,耶穌潔淨聖殿除了赤責百姓,你們說這個殿是花了46年蓋的, 可是你們來的時候,卻只是在做買賣。
564.586	566.387	這不是很諷刺嗎?
566.387	574.315	耶穌一方面在對付人來到神的殿,來到教會的時候,動機不純正。
574.315	577.098	這是耶穌第一個潔淨聖靈在對付。
577.098	578.599	第二個在對付是什麼?
578.599	592.386	對付你們這些猶太人為了自己獻祭的方便,買牛羊鴿子的方便, 退換銀錢的方便,你們就犧牲了外邦人親近神的權利。
592.386	598.748	你們就債用了外邦人員,讓那邊塞滿了鴿子、牛、羊,然後那個買賣。
598.748	605.349	你們根本就影響了外邦人在這邊向神禱告,親近神的機會。
605.349	607.310	這是給教會很好提醒。
607.310	630.725	教會有時候,如果只是在服務, 現在的會友,什麼都以現在的會友的聚會方便為考量,卻犧牲了外邦人或是福音朋友,神把他們帶來親近神,跟神禱告的機會,這個耶穌也不喜悅了。
631.254	646.093	所以教會不要只是內聚,教會在思考聚會,在思考教會的方向的時候,很多時候我們要記得,教會如果不宣教,教會若不走出圍牆,教會就有禍了。
646.093	647.015	願神祝福大家。