start	end	text
10.299	20.593	弟兄姊妹平安，我們一起來思想。約翰福音第16章的第16節到33節。耶穌說,等不多時,你們就不得見了。
21.698	48.663	再等不多時,你們還要見我。第一節講的就非常有這個生命的智慧。他說很快的等不多時,你們就因為我要死了,所以你們就見不到我。那但是呢,再一次的等不多時,我就要復活,你們就要見我。人生就是這樣,在每一次我們遇到很多的困難的時候,神就是鼓勵我們,
49.343	65.429	等不多時,等不多時,神就要把復活的能力彰顯在我們生命裡面。我們今晚可以往下看,就可以明白耶穌的心意。十七節有幾個門徒就彼此說,祂對我們說,等不多時,你們就不得見我。
66.049	81.53	再等不多時,你們還要見我。又說,因我往父那裡去。這是什麼意思呢?門徒彼此說,他說等不多時,到底是什麼意思呢?我們不明白他所說的話。
82.551	107.569	弟兄姊妹,我們可能常常讀這個約翰福音的時候,都覺得門徒怎麼這麼笨,反應這麼遲鈍。我們甚至看這個以色列人在舊約的時候,覺得他們也是怎麼這麼笨,出埃及記的時候怎麼都學不乖學不會,結果40年在曠野倒閉。我們其實可以來明白一件事,先知先覺的人很少。
108.49	124.028	後知後覺的人也不多,但是不知不覺的人有夠多。我們像門徒這個後知後覺,但我們可能是不知不覺。很可能神將他對我們生命中一些重要的真理,
124.889	150.415	針對我們個人或是我們教會甚至我們的國家社會已經不知道講多少次講一百次我們還是不懂不明白說穿了沒有用心聽說穿了心裡面根本不信悖逆不應順服神所以我們在笑以色列人或笑耶穌的門徒的時候他們是後知後覺沒有錯但是小心你我是不是不知不覺
151.459	177.872	19節,耶穌看出他們的狀況,就說,我說,等不多時,你們就不得見我,但再等不多時,你們還要見我。你們為這話彼此相問嗎?我實實在在地告訴你們,你們將要痛哭、哀嚎,世人倒要喜樂,因為耶穌要被釘死了。你們將要憂愁,然而你們的憂愁要怎麼樣?變為喜樂。
178.592	198.09	21節就好像婦人生產的時候,哇,很辛苦就憂愁,因為他的時候到了,既生了孩子,就不再紀念那苦楚,因為歡喜世上生了一個人。你們現在也是憂愁,但我要再敬你們,你們的心就喜樂了。
198.37	227.578	這喜樂也沒有人能奪去。弟兄姊妹,人生就是這樣。耶穌也告訴我們,就是會有試探,在世上會有苦難,但在他裡面有真平安。時候到了,就是會有試驗的時候,會有考驗的時候,時候到了。但是呢,時候到的時候呢,等不多時,拯救就到了。上帝的這個垂聽禱告,給我們所開的道路就到了。
227.858	246.242	人生就是這樣,等不多時,再等不多時,等不多時,再不等不多時。我們的信心是否願意持續的來等候神呢?23節,祂告訴我們說,到那日,你們什麼也就不問我了。我實實在在的告訴你們,
247.415	249.177	沒有錯,當我們在這個被試驗的時候,
264.138	290.758	信心在被考驗的過程中有很多問號但是耶穌鼓勵我們祂事先告訴我們現在耶穌不是人生就一帆風順等不多時考驗就到了但是我們要倚靠主憂愁就會變成喜樂因為祂要替我們開道路到時候那個喜樂是怎麼樣?祂說是世人奪不走的哇!太棒!那個喜樂是任何的事情都不能奪走那一種
291.459	312.528	經過生產,經過這種信心熬煉的過程,所最後所認識神的那一種美好的信仰經歷,那是世人奪不走的喜樂。而且到時候什麼也都不用問了,因為都明白了,知道這是一條天路之旅,就是這樣子,沒有人可以奪走這個喜樂。
313.268	340.145	那二十五節,耶穌說,這些事我是用比喻對你們說的。時候將到,我不用再用比喻對你們說,乃是要將父明明的告訴你們。到那日,你們要奉我的名祈求。我並不對你們說,我要為你們求父。我父自己愛你們,因為你們已經愛我,又信我是從父出來的。
340.725	366.932	我從父出來,到了世界,我又離開世界,往父那裡去。弟兄姊妹,這邊我們可以來思考一下。耶穌說道那路。道那路基本上在以色列,不論是舊約或新約,通常指的是末日,就是神要來的時候。到新約我們可以理解為,就是耶穌基督第二次要再來的時候。
367.312	387.891	但在約翰福音的上下文這邊也可以理解成包含了耶穌基督從死裡復活之後因此他告訴我們就是要等候等候而且等候之後我們就能夠怎麼樣明白神的作為如同這邊所說的要把父怎麼樣這個明明的來顯給我們
388.251	417.511	那這邊要教導我們第二件事情就是說要將父明明的告訴我們那第二個告訴我們什麼就是說我們禱告耶穌說是奉祂的名向天父祈求禱告那天父必要成就並不是我們有什麼利害或是天父欠我們以至於我們禱告祂都要成就我們是奉主耶穌的名禱告什麼叫奉主耶穌的名禱告就是你想要
418.251	440.923	禱告這件事情。你想要看見這件事情可以成就。你想要看見這件事情可以實現。是因為耶穌想成就。是因為耶穌祂想要實現。因此耶穌藉由你的禱告。跟祂一起同工。來經歷這件事情。最後榮耀的成就。可以來榮耀神的名。可以來榮神義人。
441.323	458.762	所以你的禱告祈求若不是耶穌想要的根本就違背耶穌的真理或是違背聖人的代理天父當然不會垂聽因此很多時候我們禱告不蒙應允是不是也要思考我說我奉主耶穌基督的名
459.343	462.006	我們要常常在禱告裡面親近聖靈。
477.346	496.567	讓我們明白,聖靈給我們的感動是要去怎麼做。這個都是非常重要的事情。二九節,門徒說,如今你是明說,並不用比喻了。現在我們曉得,你凡事都知道,也不用人問你。因此,我們信你是從神來的。
497.108	521.998	弟兄姊妹,耶穌剛剛在責備他們說,你們在那邊都聽不懂我在講什麼,還在問我說什麼等不多時,再等不多時,你要往哪裡去。耶穌剛剛就稍微責備他們一下。現在他們就說,你不用再講了,我們都懂了,我們都信了。結果呢,31節耶穌說,現在你們信嗎?看哪時候將到。
522.858	545.812	且是已經到了,你們要分散,各歸自己的地方去,留下我獨自一人。其實我不是獨自一人,因為有父與我同在。我將這些事告訴你們,是要叫你們在我裡面有平安,在世上有苦難,但你們可以放心,我已經勝了世界。
546.613	569.885	在我們講到耶穌告訴門徒說,你們以為你們現在已經信心很充分了,你們都不會跌倒,錯了,你們跌倒的時候將到了,而且已經到了,你們都要跑光光,只留下我一個人去被釘十字架。因此耶穌說,我將這些事告訴你們,
570.265	591.068	是要我們在耶穌基督裡面有平安。哪些事呢?包含耶穌告訴我們說,你們會憂愁,因為你們會看見我被釘十字架,你們會害怕。接下來還有包含就是,世上的人會攻擊你們,因為世界觀完全不一樣,價值觀不一樣,會有很多的逼迫。
591.408	621.168	包含耶穌說不要擔心,因為等到復活的力量在你們身上運行的時候,你們就會喜樂。這個喜樂呢,也是世人所不能奪走的。更包含祂去乃是要拆下聖靈寶貴時來,讓我們能夠把真理有根有基的得找在我們的裡面。也更包含這個我們會軟弱跌倒的事實,
621.408	649.878	耶穌都先告訴我們了。都是讓我們在事後,可以有平安。包含我們軟弱跌倒,像人土一樣,不認主的,也要有平安。不是說你犯罪就平安,平平安就犯罪,不是這個意思。而是你犯罪軟弱跌倒之後,你要勇敢的回到主耶穌基督裡面。因為只有在耶穌基督裡面,才有真正的平安。
650.538	668.329	我們才不會繼續做罪的奴僕。或是我們才不會一直受罪的控告。因為只有回到耶穌基督的理念。我們才能夠一起有份以祂勝過世界的得勝。我們在世上有苦難。有別人給我們的苦難。
668.609	690.8	也有我們給我們自己所捅的褸子的困難但這些都不是重點重點是要回到耶穌基督的裡面因為只有在那裡才有勝過世界以及勝過我們自己軟弱跌倒逝世的這一種得勝的平安接納的平安願神祝福大家