start	end	text
4127.598	4186.343	這位以馬內利﹐嬰孩的君王﹐ 下一節 第七節 來 弟兄姊妹 很奇妙在第九章仍然是以一個小孩子的來當作主角來告訴我們這一個救贖的故事代表神祂完全理解在我們生命裡面那一個以馬內利的小孩的吶喊 那位以馬內利小孩的懇求。
4186.343	4193.306	那位以馬內利小孩在哭泣中,仍然期待神的醫治與安慰。
4193.306	4206.333	那位在驚恐害怕,不斷的害怕自己生命中怎麼會有熊,自己的生命裡面怎麼關著一隻獅子,自己的裡面怎麼躲著豺狼的生命的驚恐的以馬內利小朋友。
4207.534	4223.659	又害怕自己的生命會被上帝審判,因此他非常的驚恐的,又很害怕的,但是又好像存著一股相信說,這一位承諾要與我永遠同在的上帝,祂應該不會選擇放棄我。
4227.961	4238.609	耶穌基督完全認同人充滿掙扎、軟弱、苦難、傷痛、罪惡的這樣的一個生命歷程。
4238.609	4243.453	祂深知這一切,因為祂從嬰孩開始誕生。
4243.453	4246.555	祂的名也是伊瑪內利。
4246.555	4256.162	我們的神並非不能不能夠體會我們的軟弱,只是祂勝過了一切的試探。
4256.162	4257.283	我們繼續來看第11章。
4262.654	4264.535	11章就是我們剛剛所讀的。
4264.535	4269.158	我們要從第6節到第9節,我們要再讀一次。
4269.158	4271.239	預備,來。
4271.239	4284.786	財郎必與綿羊羔同居,豹子與山羊羔同臥,少壯獅子與牛犢並肥畜同群,小孩子要牽引他們。
4284.786	4293.632	牛必與熊同食,牛犢必與小熊同臥, 獅子必吃草,與牛一樣。
4293.632	4298.216	吃奶的孩子,必玩耍在毀蛇的洞口。
4298.216	4302.859	斷奶的嬰兒,必按手在毒蛇的穴上。
4302.859	4316.110	在我聖山的片處,這一切都不傷人,不害物,因為認識耶和華的知識要充滿遍地,好像水充滿洋海一般。
4316.817	4330.063	你認為一個爸爸還是一個媽媽要向他的孩子承認我裡面同時是一個姨媽那裡的小朋友但我裡面同時也是一匹野獸。
4330.063	4381.061	你現在孩子你現在正在經歷的人生的試探軟弱跌倒嫉妒驚嚇暴力謊言 其實我是祢的爸爸我跟祢的經歷都一樣我現在還在經歷我裡面有這一些但最寶貴的是我的神讓我裡面的以馬內利的小孩沒有死 當越來越多的父親願意跟這樣的孩子分享他真實生命的狀況,會讓你的孩子,不論是你肉身的孩子,還是屬靈的孩子,他裡面的姨媽那裡的小孩不會死。
4381.061	4407.265	當你如果讓你的孩子,不論是屬靈的孩子,還是肉身的孩子,誤以為, 誤以為我所認為的那位比我好的、比我堅強的長輩、父母,他的生命裡面完全是以馬內利,而沒有任何的野獸,沒有任何凶暴的動物在裡面。
4407.265	4416.767	你只是在營造一個謊言,這個謊言會把他從上帝的面前,把這個小孩子親自的殺死。
4416.767	4417.828	你懂意思嗎?
4417.828	4422.923	因為他會覺得他沒救了, 他不配,他人生沒有盼望。
4422.923	4427.416	他不知道一件事情,我們人生裡面,就是永遠會住著這兩種東西。
4429.002	4460.419	而耶穌基督祂來到這個世界上跟我們經歷了一樣的事情但祂得勝了祂得勝了祂又在十字架上替我們擔當我們失敗所造成的種種不堪的爛攤子不堪的破碎關係所帶來的傷害以及將來要面對上帝的審判耶穌基督都為我們這一切承擔在十字架上了祂好讓祂的得勝 能夠不斷的激勵我們的生命﹐引導我們的生命。
4460.419	4468.594	讓我們裡面的以馬內利的小朋友﹐越來越強壯﹐越來越堅定﹐越來越倚靠神。
4469.275	4474.277	我昨天跟這個走出埃及協會的祕書長一起吃飯。
4474.277	4485.640	他們就是一個專門幫助一些朋友們在性別的認同上產生一些困惑跟不確定的人。
4485.640	4489.581	而這些已經實際影響他們的人生跟生活的人。
4489.581	4494.543	他以一個過來人的一個經歷,跟我有些分享。
4494.543	4497.304	這是他個人的選擇。
4497.304	4506.974	他選擇 祂相信,祂可以依靠神,而讓祂裡面的以馬內利的小孩子不死。
4506.974	4529.153	即便祂裡面的誘惑跟祂的痛苦是這麼真實的存在,每一天,祂說祂最大的一個挑戰就是,當祂已經決定,當祂在教會裡面已經,那時候祂還是平信徒,祂是會友, 他已經承擔了很多重要的服事。
4529.153	4531.314	他已經是教會的一個領袖。
4531.314	4544.621	而甚至當他已經決定即將要去報考神學院,他想要這一生成為傳道人的時候,他發現他裡面的有一頭熊忽然活起來了。
4546.903	4574.820	這個熊強大到一個地步要吞吃掉牠裡面這一個以馬內利的小朋友以至於牠幾乎在神的面前放棄說一切都是假的啦什麼傳道人不用了啦我就是熊努力了半天我就是熊沒有用我就是一個熊 不用去考了。
4574.820	4576.321	不用服事了。
4576.321	4578.803	甚至不用去敲碑了。
4578.803	4580.824	沒救。
4580.824	4581.805	沒救。
4581.805	4584.146	就是這樣。
4584.146	4589.630	我相信這種故事在我們很多人生命當中也正在好像要上演當中。
4589.630	4590.631	或是已經上演了。
4592.927	4600.036	可是在他那個時候,他最無助軟弱,他覺得神應該也放棄他,任憑他裡面的姨媽那些小孩。
4600.036	4605.843	結果被熊吞吃掉的時候,他感受到神給他一個平安跟一個接納。
4605.843	4608.907	神對他說,你來找我,來找我。
4610.947	4657.368	他就從他的家用跑步的跑到好遠的跑到他的教會去跑了不知道多久然後衝進那個禱告室在那邊大聲的放聲痛哭他把他心中很多對於神的一種困惑跟不解為什麼我裡面同時有一個已滿能力的小朋友但又同時住著一隻這麼巨大真實可怕的熊呢為什麼在他跟神吶喊完之後 聖靈工作,聖靈運行,神安慰他,神鼓勵他,神讓他明白一件事情,只要你願意繼續相信我,你裡面那一個以馬尼的小孩子永遠不會死,阿們。
4657.368	4665.192	就是這麼一個這麼微小的芥菜種一般的小小的信心,抓住了他。
4665.192	4669.854	他從此踏上服事的道路,你覺得他裡面那隻熊還在嗎?
4671.357	4676.609	這麼多年過去了,我跟你講那隻熊都在。
4676.609	4763.953	但是上帝讓他,讓這一位同工在他還沒有 參與到以後耶穌基督第二次再來在這個地上建立神的國度而我們這些願意跟隨神的聖徒在那個時候都要首先從死裡復活然後跟耶穌基督一起在那個國度裡面怎麼樣傳揚祂的福音訴說祂的救恩因為在那個時候我們裡面的生命已滿了你的小孩可以跟熊住在一起甚至連我們裡面的獅子牠都轉性了 也是我們的生命裡面不再有衝突因為神極大的恩典把我們拖住了但是那天還沒有來對不對耶穌基督還沒有再來但最美的事情是什麼 每一個願意信靠神、願意信靠耶穌基督救恩的以馬列尼的小朋友在今生今世就在你的今生今世你都可以不斷的體會到你的生命裡面的以馬列尼的小孩不僅不會死你會看到熊越來越小你會看到獅子越來越小你會看到豺狼越來越沒有力量來攻擊你而你裡面的那個神同在的以馬列尼的小孩卻越來越堅定 越來越信靠神,越來越有智慧,越來越有分辨力,越來越有決定力。
4763.953	4772.778	不用等到耶穌基督第二次再來,神的國完全實現的時候,今生今世你就可以開始品嘗到這一種滋味。
4772.778	4774.639	聖經說這叫怎麼樣?
4774.639	4780.583	御嘗天國的滋味,就是這樣。
4780.583	4781.184	我們看第12章。
4783.404	4795.792	第12章是以馬內利信息的結論是一首感恩的詩歌這首詩歌分成上半段跟下半段 上半段主要在講一件事情。
4795.792	4798.514	我們來讀第一節到第三節。
4798.514	4801.516	第一節到第三節,預備,來。
4801.516	4813.665	到那日,你必說,耶和華,我要稱謝你,因為你雖然向我發怒,你的怒氣卻已轉消,你又安慰了我。
4814.326	4820.387	看啊,神是我的拯救,我要倚靠祂,並不懼怕。
4820.387	4828.089	因為主耶和華是我的力量,是我的師哥,祂也成了我的拯救。
4828.089	4833.290	所以,你們必從救阿的泉源歡然取水。
4833.290	4837.131	第一節告訴我們我們的神祂赦免我們的過分。
4837.131	4852.620	因為曾經我們這個熊在爆炸的時候, 不受控制的時候,我們做了很多不該做的事,說了很多不該說的話,想了很多不該想的想法跟念頭。
4852.620	4865.846	但是當我們裡面的以馬內利的小朋友再一次 舉起微弱的手,抓住神的時候,神就赦免我們,並且想辦法讓我們的姨媽那些小朋友可以站起來。
4865.846	4873.673	因此第一節告訴我們說,我們要稱謝神,因為神雖然在我們變成熊的時候向我們發怒,但是祂怎麼樣?
4873.673	4879.098	又因此我們來到祂的面前,祂又赦免我們,真的是安慰我們。
4879.098	4883.842	第二節祂就說,看啊,上帝是我的拯救,我要依靠祂,並不懼怕。
4884.326	4885.086	來,這一節我們一起念,預備,來。
4885.086	4887.108	這一段經文是從摩西過洪海的時候。
4887.108	4888.448	摩西過洪海經歷了神的得勝。
4905.538	4935.654	弟兄姊妹 到那日到那日是哪一日就是耶穌基督第二次再來那一日就是祂要完全來實現祂對這個世人的拯救的那一天 已經是最後一天了。
4935.654	4946.644	但是在這邊呢,他卻說,弟兄姊妹,神對於人類的集體拯救的第一件大的事情,就是什麼?
4946.644	4950.867	就是帶領以色列百姓怎麼樣出埃及。
4960.555	4998.755	也就是說神對人類的一個集體的大型的拯救一開始的事件就是過鴻海事件以至於在那時候摩西代表全人類向上帝所訴說的一個感謝的詩歌這一首詩歌在人類的歷史歷代裡面在人類的集體的以馬內利的歷史歷代的這個過程裡面要反覆的被唱不斷的被唱不斷的被唱說 神是我的力量,神是我的詩歌,祂也成為我的拯救,祂赦免我的過犯,祂不再對我發怒,祂安慰了我,祂醫治了我,祂拯救了我。
4998.755	5008.545	這樣的詩歌,要從過紅海的那一天開始,一直唱到,到那日,耶穌基督第二次再來到這個世界上的時候,要不斷的傳唱。
5008.985	5014.569	以至於第三節他說,所以你們必從救恩的泉源不斷的取水。
5014.569	5019.313	不斷的取水,好像救恩是一個湧泉,不斷湧流出救恩來。
5019.313	5021.575	我有需要的時候,我就引用它。
5021.575	5041.467	這個就是說,歷史歷代以及你個人的生命裡面,不管發生什麼事情,不管在高山還是低谷,你隨時都可以來到這個救恩的泉源裡面, 像神說,祢是我的拯救,祢是我的倚靠,祢是我的師哥,祢是我的力量,祢是我的拯救。
5041.467	5050.592	這是每一個姨媽那裡的小朋友之所以可以活下去的秘訣。
5050.592	5053.233	你要不斷的來到救恩的泉源,歡然取水。
5054.121	5057.062	因為祢的神已經替祢得勝了。
5057.062	5060.824	祢的神可以幫助祢勝過祢裡面的熊跟獅子。
5060.824	5067.167	祢的神可以幫助祢勝過這個世界上的熊跟獅子。
5067.167	5074.031	不論何時,祢都要來到救恩的泉水,救恩的泉源,歡然取水。
5074.031	5076.592	阿們。
5076.592	5080.134	這種事情要一直發生到什麼時候?
5080.134	5090.798	祂再來,祂再來, 我們來讀第四節以後,到第六節一起來讀,預備,來。
5090.798	5103.947	在那日,你們要說,當稱謝耶和華,求告他的名,將他所行的傳揚在萬民中,提說他的名已被遵從。
5103.947	5114.452	你們要向耶和華歌唱, 四到六節告訴我們,因此我們在全地都要傳唱這樣的一個得勝的詩歌。
5114.452	5115.072	阿們。
5115.072	5138.495	剛剛講的是一到三節,是講任何時間, 都要傳唱這樣的詩歌,都要去歡然取水。
5138.495	5148.138	4到6節告訴我們說,不論你在什麼地方,你也都要向世人唱這一首得勝的詩歌,不斷的把神的得勝宣揚出去。
5148.138	5150.059	宣揚什麼?
5150.059	5167.507	在我裡面住著兩個人,一個是以馬內利的小孩,他仍然渴望,仍然相信,耶和華是我的拯救, 耶和華是我的力量。
5167.507	5171.052	耶和華是我的得勝與安慰。
5171.052	5177.280	即便祂旁邊有野獸在環繞著祂,祂仍然相信。
5178.302	5194.630	而這樣的相信必然會經歷一個得勝的結果,就是你的神真的要拯救你,你的神真的要醫治你,你的神真的要使你在救恩的泉源中歡然取水。
5194.630	5205.176	因此我們走遍世界,面對不同的人,都要跟他講的就是這一個故事,就是這一個故事。
5205.176	5214.259	最後我要邀請幾位爸爸跟我一起上來, 我們這些爸爸們要恢復姨媽那裡小朋友的精神。
5214.259	5217.280	想要帶領大家來唱一首詩歌。
5217.280	5228.606	這首詩歌就是告訴我們,我們要向每一個人,並且在每一個地方,讓他知道一件事情。
5228.606	5230.046	我們的神是得勝的神。
5230.046	5232.748	我們的神是使我們得勝的神。
5232.748	5290.726	我盼望每一個爸爸,每一個媽媽, 每一個弟兄 每一個姊妹勇敢的面對你的生命你裡面雖然有很你雖然是熊師母 你雖然是熊我雖然是豺狼但使我們兩個可以和平相處 並且成為福音的同工的原因是你跟我生命裡面都有一個相信並且渴望上帝同在的以馬內利小朋友 阿們這是我們共同的基礎 世雄 建華我看你們兩個裡面也住的不同動物為什麼還能在一起為什麼還願意在一起 為什麼還敢在一起。
5290.726	5295.869	我有時候不知道丹妮怎麼還敢跟你在一起。
5295.869	5299.992	我常常不知道你太太為什麼還願意跟你在一起。
5299.992	5304.735	但是我回想我太太為什麼敢跟我在一起,我就明白這一切的奧祕。
5304.735	5313.741	因為她跟我裡面都有一個仍然願意相信神,願意同在的小朋友。
5315.998	5317.720	很感謝神。
5317.720	5319.962	我們經歷那麼多事。
5319.962	5324.026	那個小朋友沒有死。
5324.026	5325.347	以至於我們可以在一起。
5325.347	5326.488	阿們。
5326.488	5327.069	感謝主。
5327.069	5329.091	我看兩位也是不遑多讓。
5333.336	5335.498	讓我們的孩子知道事實好不好。
5335.498	5338.400	讓我們的孩子知道真相。
5338.400	5342.643	我們不完美,但感謝神我裡面有一個渴望。
5342.643	5346.106	我相信神願意與我同在。
5346.106	5348.808	孩子啊,你要相信神要與你同在。
5348.808	5352.250	不論你今天什麼樣的事情,你要相信神與你同在。
5352.250	5354.492	來,爸爸告訴你,我曾經, 阿們。
5369.224	5405.371	我們是祢的百姓， 祝你是我們的聖。
5405.371	5411.134	用讚美打開城門。
5411.134	5416.497	來預備求恩的道路。
5416.497	5419.339	呼喊吧!
5419.339	5421.240	聖地百姓呼喊吧!
5422.927	5431.040	耶和華你將這城教給我們。
5431.040	5435.787	讓讚美的聲音不停息。
5437.346	5441.167	大聲,別落走的。
5441.167	5448.529	呼喊吧,神的百姓呼喊吧。
5448.529	5455.130	耶和華,祢將真誠交給我們。
5455.130	5462.597	讓高高的聲音, 不解釋﹐直到我們﹐看見不行。
5462.597	5485.051	是祢的耐心﹐處理﹐是我們的一生﹐用善美﹐ 弟兄也上來,國旗也上來。
5485.051	5489.173	弟兄也上來,上來上來上來。
5489.173	5493.296	弟兄上來,呼喊吧,聖地百姓呼喊吧。
5493.296	5497.839	耶和華,祢將這城教給我們。
5507.381	5513.743	讓讚美的聲音,不停息。
5513.743	5520.125	如同大水,也不抽底。
5520.125	5524.567	呼喊吧,神的百姓呼喊吧。
5524.567	5530.549	耶和華,祢將這城交給我們。
5532.995	5556.657	讓道靠的聲音﹐不懈惜﹐直到我們﹐看見不熄﹐呼喊吧 聖地百姓呼喊吧 耶和華﹐一場淡海交給我們。
5556.657	5565.021	讓讚美的聲音﹐不停息。
5565.021	5569.543	如同大水﹐淹沒草地。
5569.543	5575.486	呼喊吧﹐聖地百姓呼喊吧。
5576.493	5581.957	耶 耶和華一箱淡水交給我們。
5581.957	5589.363	讓高高的聲音不懈惜。
5589.363	5595.948	直到我們看見父親。
5595.948	5600.712	呼喊吧 聖地百姓呼喊吧。
5601.596	5619.745	耶和華你向桃園交給我們,讓讚美的聲音,鼓起起,如同大水淹沒沖停。
5622.875	5661.239	呼喊吧 聖地百姓呼喊吧耶 耶和華你將高雄交給我們讓高的聲音 不懈惜直到我們 乾淨呼吸讓高的聲音 不懈惜 最大掌聲歸掉我們的神。
5661.239	5661.999	哈利路亞。
5661.999	5663.619	哈利路亞。
5663.619	5663.659	阿們。
5663.659	5665.800	感激耶穌。
5665.800	5679.222	你知道為什麼我請這些爸爸們上來嗎?
5679.787	5685.689	因為原本安排那個兒祖親子大現師。
5685.689	5693.471	結果兒祖校長說,嘿,我們的家長都很內向啊,很害羞啊,不敢上臺啊。
5693.471	5696.112	我說這是謊言,阿們。
5696.112	5699.693	你看這些家長們,這些弟兄們,有沒有雄壯威武?
5699.693	5701.234	有啊,欸,掌聲鼓勵。
5701.234	5707.736	我們來禱告,我們來禱告。
5712.159	5715.724	神啊,我們所信的不是一個宗教。
5715.724	5720.450	我們所信的是一位活生生的救主。
5720.450	5725.778	這個救主應許我們,祂是一位與我同在的神。
5727.073	5759.270	不論我裡面這個以馬內利的小孩,正遭遇什麼樣的衝擊,什麼樣的軟弱,什麼樣的跌倒,什麼樣的過分,即便我心裡面有時候獅子變大了,有時候熊跑出來,有時候豺狼在我裡面控訴我,但神啊,祢自己也成為以馬內利了, 祢理解我們的一切。
5759.270	5762.352	祢知道我們的軟弱。
5762.352	5766.616	但祢仍然選擇為我死在十字架上。
5766.616	5771.039	也為我的家人死在十字架上。
5771.039	5776.444	好讓我們裡面以馬內利的小孩永遠不死。
5776.444	5779.346	這是我們活下去的盼望。
5779.346	5783.330	也是我們經歷祢得勝的管道。
5783.330	5788.064	主我在祢面前承認 我沒有什麼好誇口的。
5788.064	5794.928	我如果要誇口我就誇我的耶穌基督為我這個罪人死在十字架上。
5794.928	5796.508	阿們。
5796.508	5799.510	主我願意用一個比較真實的生命來面對自己。
5800.828	5805.470	面對家人,面對世界,面對上帝。
5805.470	5810.533	勇敢的承認我裡面常常會有高山低谷,會有狀況。
5810.533	5818.917	但我感恩的是,神把那個以馬內利的小孩的生命,深深的放在我裡面。
5818.917	5822.759	主啊,仰望祢的人,必不至於羞愧。
5823.319	5831.803	祝福臺上所有的弟兄們以及所有的家庭不論是肉身的家庭還是屬靈的家庭。
5831.803	5837.425	我們在祢面前都從祢救恩的泉源歡然取水。
5837.425	5854.013	我們要用讚美打開臺灣的每一個城的城門為神祢救恩的道路預備好讓更多人勝過仇敵勝過獅子與熊讓我們的生命成為一個充滿讚美感謝 榮耀 得勝的生命。
5854.013	5855.334	奉耶穌基督的名禱告。
5855.334	5856.795	讓我們大聲一起說。
5856.795	5857.716	阿們。
5857.716	5859.598	我們派上的榮光感謝歸給我們的神。
5859.598	5860.959	哈利路亞。
5860.959	5861.879	感謝主。
5861.879	5863.120	哈利路亞。
5863.120	5865.422	來給臺上的弟兄們一個掌聲鼓勵。
5865.422	5869.125	耶。
5869.125	5870.006	好,感謝主。
5870.006	5870.587	好,我們請坐。
5882.261	5882.261	喂?
5882.261	5882.261	喂?
5882.261	5887.706	你在哪裡啊?
5887.706	5890.449	我沒有看到你啊。
5890.449	5893.792	唉,聚會結束了啦,趕快走了。
5893.792	5895.474	報告時間?
5895.474	5896.054	幹嘛啊?
5896.054	5899.738	報告時間你回去看週報就好了,不用在那邊聽啦。
5899.738	5902.901	嗶,嗶嗶嗶,這位同學,這位同學。
5902.901	5904.362	誰在講話?
5904.362	5906.004	欸,報告時間很重要吧,嗶嗶嗶。
5908.234	5909.495	我們一起來思想。
5909.495	5912.238	繁體中文，臺灣國語。
5912.238	5915.001	繁體中文，臺灣國語。
5915.001	5917.744	繁體中文，臺灣國語。
5917.744	5933.488	繁體中文， 好,以上哪些在電子週報可以看到?
5933.488	5935.589	小心回答。
5935.589	5939.450	一,上週主日敬拜師哥。
5939.450	5940.791	有,好。
5940.791	5947.655	二,莊牧師不愛吃的五種食物應該有 拿出手機來,拜託。
5947.655	5951.078	牧師在下面,他喜歡吃什麼,不喜歡吃什麼,等一下下去問他。
5951.078	5954.501	怎麼會寫在週報上呢?
5954.501	5956.762	那第三個,淡水塘參觀。
5956.762	5961.226	淡水塘有參觀,淡水塘超漂亮的,一定可以參觀的。
5961.226	5966.751	淡水塘沒有參觀申請票,淡海塘才有,好嗎?
5966.751	5970.173	那第四個肢體代表事項,總有了吧?
5970.173	5970.394	有嗎?
5971.834	5997.765	有嗎 有啦 裡面有很多內容各位新朋友千萬不要被我們誤導了我們週報裡面呢我們來看一下上一張歡迎大家可以來掃描QR code裡面各個堂會的所有的活動包括肢體的需要都會在裡面可以看得到喔 好的,那我們今天要來歡迎﹐第一次來到淡江教會﹐淡海堂的新朋友。
5997.765	6002.048	讓我們邀請你一起站立起來﹐我們可以來歡迎你﹐有沒有?
6002.048	6013.137	這邊有﹐哇,好多新朋友喔﹐好多新朋友喔﹐二樓的新朋友也歡迎你﹐四樓也有喔﹐四樓也有很多﹐歡迎你們﹐一次歡迎﹐永遠歡迎。
6013.137	6019.322	請繼續站立﹐直到我們招待同工﹐將我們的新朋友的錶﹐交在你的手上﹐還有小禮物喔。
6020.623	6047.294	好的 新朋友請注意囉我們在會後我們會有一個我們在二樓會有一個歡迎新朋友的茶會那我們會請同工帶你下去那請你留步參加然後我們也會有贈送我們的小禮物下一張小禮物精美的小禮物 好的,我們的小禮物真的很精美,除了現在拿到,你等一下到二樓的時候還會有一個喔。
6047.294	6054.661	教會不只歡迎新朋友,我們同時也歡迎願意回憶烘焦,一起來擔任全職同工的弟兄姊妹。
6054.661	6060.788	所以各位請留意職務的需求、內容,還有雙堂投地履歷的方式喔。
6061.869	6066.253	看來精力充沛的人,兩個都可以同時應徵耶。
6066.253	6067.835	真的是會分身嗎?
6067.835	6069.136	有練過齁?
6069.136	6077.104	不行啊,我們要先禱告,大家好好的禱告,看上帝要呼召你為身在哪一個職務,我們再來投地履歷喔。
6078.643	6086.231	好的,我們在5月14號的下午兩點,在淡海堂的酒樓,會有我們今年第一次的喜禮。
6086.231	6095.720	那我們截止報名會是在4月29號,所以邀請你想受喜,你還沒受喜,你周遭的有慕道朋友想受喜的人,儘快報名。
6095.720	6101.266	然後接下來我們還會有兩次的受喜課程,請要報名的弟兄姊妹要留時間參加。
6102.244	6105.105	你的福音朋友還沒有辦法決定要受洗嗎?
6105.105	6110.307	不用擔心,我們之前有報告,你有福音朋友,我們有什麼?
6110.307	6111.868	我們有陪攤員喔!
6111.868	6126.273	接下來呢,我們在4月29號,去年我們教會大概有約100位的弟兄姊妹有接受裝備,是在從懷疑到相信的這個課程, 接下來在下禮拜的4月23號有三件事要發生。
6146.578	6148.562	那三件事呢?
6148.562	6153.193	第一件事情就是我們的高雄福音中心要正式開幕了!
6153.193	6154.496	將掌聲榮耀背部的神!
6157.551	6160.972	好,那大家看這個圖呢,是不是有點奇怪呢?
6160.972	6162.572	是不是好像有一些誤會?
6162.572	6165.773	但其實不是喔,我們那個before跟after沒有反過來。
6165.773	6169.894	我們的before就是呢,還在裝修之前的樣子。
6169.894	6171.315	還沒裝修之前的樣子。
6171.315	6175.136	然後after是現在正在進行裝修的樣子。
6175.136	6176.876	所以請大家不要誤會。
6176.876	6180.357	然後接下來我們這個福音中心呢,會比較溫馨迷你一點。
6180.657	6188.019	主要有三個功能,第一個功能是發展小組,第二個是福音陪讀,第三個是裝備門徒。
6188.019	6194.821	所以在開幕的那天,我們是邀請高雄當地的弟兄姊妹一起來參與。
6194.821	6200.343	我們教會也會回傳當天開幕的一些精華影片給大家看。
6200.343	6204.184	所以淡水的弟兄姊妹,請務必留步啊。
6204.184	6209.226	我們一起用禱告來參與,將我們的場地空間留給高雄當地的朋友喔。
6210.026	6212.769	繁體中文，臺灣國語。
6212.769	6233.309	繁體中文， 這一次是4月23號。
6233.309	6237.831	下個禮拜天主日在淡海堂是一個見證分享會。
6237.831	6238.991	這是一個福音聚會。
6238.991	6245.214	我們邀請到專業的音樂人古浩老師來到我們中間,用音樂說故事給大家聽。
6245.214	6248.676	歡迎大家能夠邀請福音朋友一起來聽他美好的見證。
6248.916	6265.476	早上第一場見證還不夠﹐我們下午還有﹐我們由職場團契﹐特別邀請李少倫博士﹐來為我們分享裝世代﹐壯世代﹐還有壯世代﹐所以在當天的下午﹐請大家弟兄姊妹﹐可以留步來聽這個分享會。
