start	end	text
6266.544	6297.636	OK 我們上個禮拜報告完之後呢這個芳寮的小劇場的獎堂現在只剩六個名額囉相信大家應該不會只有記得我們的年輕的童工說他最喜歡汽油的味道啦我們現場送的精油絕對不會這麼特別一定是親和力非常好的而且我們有多款的口味可以讓你跟你的福音朋友至少有一支會適合你們只剩六個名額請把握機會來報名喔 好的,現場有沒有23歲到35歲的弟兄姊妹幫我舉個手好嗎?
6298.780	6299.901	有有有。
6299.901	6301.361	勇敢的舉手。
6301.361	6302.842	蠻多蠻多的。
6302.842	6303.882	好的。
6303.882	6308.064	那有沒有覺得是不是什麼人都不懂你的啊?
6308.064	6309.445	也有對不對?
6309.445	6312.706	這個聚會就是特別為了你來舉辦的喔。
6312.706	6314.347	你你你都不懂我。
6314.347	6320.770	我們在4月30號的中午12點到1點半,由我們約束亞團契所舉辦的這個聚會。
6320.770	6322.651	所以邀請大家可以留步來參加。
6324.019	6391.164	好的上禮拜我們已經讓大家知道教會現在有多一個職堂奉獻的項目那今天有一個好消息就是我們高雄福音中心的奉獻的專戶也已經開通了歡迎大家如果你是對高雄的職堂奉獻特別有感動有負擔的可以直接來參看週報裡面有詳細的劇情呃 詳細的資訊不是劇情 好 那即日起呢在我們的愛樂書房就是在1.5樓的夾層也有一個要用作職堂拓點的奉獻的一個義賣那它這個是可以滴精油的擴香花那這個如果你有觀察市價就知道它大概比市價的定價低了30%完全都會作為職堂奉獻來使用歡迎大家會後可以來參觀選購這非常限量請把握機會喔 好的,接下來在三樓面對舞臺的左手邊﹐有我們的先知信的醫治團隊﹐要來等著大家去﹐他們來﹐我挪你一下,進行服事﹐所以邀請弟兄姊妹來﹐可以讓我們同工來為你醫治和禱告。
6391.164	6397.447	然後接下來我們邀請先知信團隊的樂天弟兄﹐來為我們講今天的圖畫的領受。
6404.548	6406.749	弟兄姊妹們平安。
6406.749	6410.950	那我分享一下我今天這幅畫的領受的經文。
6410.950	6413.751	那是在雅各書的五章七節。
6413.751	6417.352	弟兄們啊,你們要忍耐,直到主來。
6417.352	6423.754	看啊,農夫忍耐等候,地理寶貴的出產,直到得了秋雨春雨。
6424.531	6429.375	然後再來是這個詩篇一百二十六篇的五到六節。
6429.375	6432.197	流淚灑腫的必歡呼收割。
6432.197	6436.560	那帶腫流淚出去的必要歡歡樂樂地帶著和睏回來。
6437.551	6452.462	我禱告的領受就是感覺到喜笑,因為在這當中知道重生來的豐盛會臨到,不論是過去心情的工作,信心的等候,及自己生命的預備,都會帶來一個果效。
6452.462	6464.511	鼓勵一些的弟兄姊妹,你過去的等候,以及在信心裡的預備耕耘,都不會白費,能帶出生命的果實,以及生活上的不同,是進入一個豐收的季節。
6464.991	6475.396	那禱告的對象，就是為長時間信心等候神，盼望能夠看到，因為順福跟隨神，而帶出生命的，果孝的弟兄姊妹。
6475.396	6488.902	那有需要禱告的弟兄姊妹，待會會後的話，可以到面對舞臺，左側的這個一字式的，服侍的區域，我來為你們祝福禱告。
6488.902	6491.744	好的 最後我們請牧師，來為我們做祝福與裁判。
6492.790	6530.350	好 我們一起起立來領受從神來的祝福 願天父上帝的慈愛,耶穌基督十字架救恩的大能,聖靈的帶領與感動,與每一位弟兄姊妹同在,打發我們、差遣我們,回到我們的崗位跟角色裡面,為主做見證,傳揚耶穌基督偉大的救恩,從淡水、淡海、桃園、高雄, 直到第幾。
6530.350	6532.011	奉耶穌基督的名禱告。
6532.011	6533.592	讓我們一起說阿們。
6533.592	6535.154	我們拍掌把榮耀感謝。
6535.154	6536.314	悲給我們的神。
6536.314	6537.235	Hallelujah。
6537.235	6538.396	讚美耶穌。
6538.396	6538.916	感謝主。
6538.916	6540.297	願神祝福大家。
6540.297	6542.399	早上的主日聚會都在這邊。
6542.399	6543.259	神與各位同在。
6572.329	6573.781	繁體中文，