start	end	text
6687.983	6695.846	主,我們在祢的戰場裡面,永遠是一個新兵,永遠是一個順服的新兵,永遠是一個願意跟隨祢的新兵。
6695.846	6698.226	謝謝耶穌,我們敬拜祢,哈利路亞。
6698.226	6714.891	是的,主,讓我們不再做躺平族,主,讓我們起來,起來,起來承擔責任,起來回應使命,起來看見需要,起來跟上腳步,起在那邊批評論斷, 不如就起來做吧。
6714.891	6716.332	就起來跟隨。
6716.332	6719.453	自然神就會調整我們的舵的方向。
6719.453	6723.974	神啊,祢積分的風吹向我們的時候,就讓我們起來順勢而為。
6723.974	6725.974	主,我們讚美祢,哈利路亞。
6725.974	6728.475	在祢面前都是向祢說願意的人。
6728.475	6731.276	在祢面前都是願意向祢開口說阿妹的人。
6731.596	6783.711	我們暫時舉起手來﹐懇求這個時候聖靈就來工作﹐將祂自己的想法﹐祂的恩膏﹐祂的能力﹐祂的機會﹐高抹在我們身上﹐渴慕的人就必得著﹐願意的人就能夠跟隨﹐我們舉起手來﹐開口向聖靈來禱告﹐親愛的聖靈寶貝使﹐在我們當中運行﹐祈福的風吹向每一位弟兄姊妹﹐ 現場的每一位每一位今天早上在我們當中的每一位在線上的每一位你都親自數點你機會的風吹向他們改變他們的心智改變他們的態度改變他們的身段主讓他們再次站起來 繁體中文，臺灣國語。
6783.711	6784.892	繁體中文，臺灣國語。
6810.469	6812.050	繁體中文，臺灣國語。
6812.050	6830.898	繁體中文， 愿每一张风帆都升起来。
6830.898	6841.862	让圣灵引领我们,不在原地打转,而是跟随着圣灵的风,勇敢起帆,放心跟随神。
6841.862	6846.023	奉耶稣基督的名祷告,让我们一起欢迎神说,阿们。
6846.023	6847.624	我们拍掌,把荣耀感谢。
6849.787	6852.549	都歸給我們的主,哈利路亞。
6852.549	6855.972	讚美耶穌,哈利路亞。
6855.972	6859.595	謝謝主,謝謝主,哈利路亞,讚美主。
6859.595	6866.300	感謝神,坐下前跟旁邊的人說,通達食物,跟隨主向前走,阿們。
6866.300	6869.402	通達食物,跟隨主向前走,阿們。
6880.128	6881.218	我是瑞田。
6881.218	6881.803	我是真愛。
6882.312	6913.170	和大家一起來關心家裡的大小事首先要再次邀請大家可以拿出你的手機掃描我們的電子週報特別是新朋友我們的電子週報裡面有各個堂會的活動訓練 課程還有帶導事項很需要大家一起常常來關心喔好 說到新朋友有沒有第一次來到淡江教會的新朋友呢歡迎從座位上起立我們一起來歡迎你有沒有 在哪裡?
6913.170	6913.850	新朋友在哪裡?
6913.850	6914.571	來這邊。
6914.571	6916.273	歡迎歡迎。
6916.273	6917.534	四樓有沒有呢?
6917.534	6921.918	四樓有沒有新朋友?
6921.918	6925.282	歡迎你們。
6925.282	6928.905	會後我們會在二樓有一個新人茶會。
6928.905	6934.411	歡迎大家和新人一起來參與。
6934.411	6934.691	好的。
6935.794	6938.276	我們的SOZO密集班要開課囉。
6938.276	6941.280	這次我們開課有提供線上的課程。
6941.280	6944.923	希望大家都能夠好好的把握。
6944.923	6947.165	請問什麼是SOZO呢?
6947.165	6948.587	這是一個好問題喔。
6948.587	6954.132	SOZO是一種幫助我們可以跟神更親近的工具。
6954.132	6958.697	其實我自己在接受SOZO這個服飾的時候,感覺非常的溫暖。
6959.718	6965.280	會幫助我直接在禱告中﹐就會聆聽神的聲音﹐會與神相遇。
6965.280	6967.921	這是一個非常特別的服事。
6967.921	6983.746	所以我們很歡迎﹐你想要更認識﹐更多體驗SOZO﹐更多的﹐進一步的認識SOZO﹐甚至你願意被訓練﹐能夠來透過這個工具﹐能夠幫助人跟神更親近的弟兄姊妹﹐請把握機會﹐可以來報名參加。
6985.828	7000.693	福音車出動了,教會為了體貼我們國中的弟弟妹妹們有交通跟安全的考量,然後我們派出福音車,然後輔送他們從淡水塘到淡海塘的距離。
7000.693	7001.673	所以呢?
7001.673	7010.576	國中的弟弟妹妹們,或者是家中有國中生的爸爸媽媽們,我們可以在每週五的中午12點以前來預約。
7011.613	7014.576	好的,教會對年輕人真的太好囉。
7014.576	7020.102	接下來這個月我們在7月22號,要跟大家一起來追韓劇。
7020.102	7029.792	這一次我們追韓劇呢,不只是真的有韓國人要來到我們的現場,而且這些人呢,都是韓國大地教會的宣教士。
7029.792	7034.697	應該都有聽過這一間在宣教上面,非常非常用力的一間教會喔。
7035.077	7039.128	這一次呢,不只來一個宣教室,我們來了十二位。
7039.128	7043.160	所以各位,你一定有機會可以跟歐巴、歐妮講到話喔。
7044.189	7050.454	如果你的小孩﹐不太喜歡來教會﹐但是很喜歡來追星的﹐歡迎都來一起來報名。
7050.454	7056.478	把握機會﹐但是如果你不喜歡追星﹐你其實喜歡自己﹐直接上台高歌一曲的那種。
7056.478	7067.226	來﹐我們也有機會﹐讓你可以參與﹐在每個月的﹐單數週的﹐禮拜六的下午﹐大洲愛樂合唱團﹐歡迎你來參加。
7067.927	7070.209	為什麼要跑那麼遠?
7070.209	7074.233	因為這是淡江教會巴黎牧區的重要活動。
7074.233	7076.735	一切都是為了要傳福音啦。
7076.735	7079.738	所以歡迎大家趕快來看一下你手機的名單。
7079.738	7082.581	有誰是愛唱歌的朋友又住在巴黎呢?
7082.581	7083.442	趕快來邀請他。
7084.770	7103.799	我是少奶奶在那個這個是由嘉貝媽媽也是路德阿姨來為我們做分享她曾經在青年教會有做簡單的介紹然後讓我看到了她熱情還有她 現在也已經成為許多人的幸福導師。
7103.799	7107.482	然後今天是報名截止,活動是下週。
7107.482	7109.644	希望大家都趕快來報名。
7109.644	7111.385	趕快來報名喔!
7111.385	7114.508	接下來我們有兩件下週的事情要提醒大家。
7114.508	7117.210	第一個是禮拜五晚上的禱告會。
7117.210	7124.216	在過去兩個多月呢,我都在高雄,跟高雄的弟兄姊妹一起連線來參與我們的禱告會。
7124.957	7142.826	我深深感受到,個人在內事的祷告,非常的重要,但是跟眾聖徒一起聚集祷告,那又是一種特別難得,非常不一樣的恩典跟能力,那個恩膏會在那裡面,所以歡迎大家再好好的把握,你可以親自來到現場參加的機會喔。
7143.746	7145.247	繁體中文，臺灣國語。
7145.247	7171.165	繁體中文， 今天會後我們會有洗禮,然後壽喜典禮。
7171.165	7174.029	時間是在下午的兩點。
7174.029	7179.075	歡迎大家可以帶著木道友朋友一起來參加我們的壽喜典禮。
7180.333	7208.123	好的在這個時候我們也可以想一想你還有沒有什麼朋友還沒有受洗如果就是你要報名下一期囉我們的每個月都會有洗禮的主日是在第二週是需要受過洗禮的課程的訓練所以如果你還沒有受洗把握機會讓我們在屬靈裡面成為一家人我們最後請牧師來為我們做祝福與拆牌 好,我們先一起起立。
7208.123	7211.866	我們在聚會結束前,我們要最後一次來禱告。
7211.866	7226.359	我們要來舉起禱告的手,為我們所有淡江的肢體們,包含淡海、淡水、桃園、高雄、萬華,所有的弟兄姊妹,在整個接下來一周蒙神帶領。
7226.359	7233.785	每一個教會的弟兄,每一個分堂的弟兄姊妹,都能夠被聖靈來引導跟感動,能夠怎麼樣?
7233.785	7234.405	通達什麼?
7235.572	7244.238	上帝的旨意,上帝給的機會,以及上帝給的這個任務好不好。
7244.238	7262.210	我們舉起禱告的手來,我們禱告的手來求神來使用我們這五個堂點的弟兄姊妹,在下個禮拜一整週裡面都來跟隨神,都來經歷神,都來通達事物,並且非常看重神給我們每一天的生命、生活跟使命。
7262.210	7265.412	我們舉起禱告的手,我們同聲開口為這五個堂點來禱告。
7265.572	7321.834	哈雷路亞 主我們感謝讚美祢哈雷路亞主我們恭恭敬敬的將我們在淡水堂在淡海堂在桃園堂在高雄福音中心還有我們即將要來進行的萬華主我們都懇求主讓我們在這五個地方的弟兄姊妹接下來一周主都來跟隨祢的心意主讓我們不是躺平一周 祖兒是豎緊腰帶說神啊祢的仆人使祢在這裡求祢拆遷我求祢對我說話謝謝祖打開我們的眼睛打開我們的耳朵讓我們明白祢在我們生命中的提醒明白祢在我們生命中的方向鼓勵以及祢所賜給我們那寶貴的話語謝謝祖願每一個弟兄姊妹祖兒都來操練成為通達實務的人 都來成為能夠把握時機的人。
7321.834	7324.816	主啊,因為這個時代黑暗邪惡。
7324.816	7328.538	主啊,因此祢鼓勵我們要愛惜廣陰。
7328.538	7330.118	因為主來的日子近了。
7330.118	7335.321	主啊,讓每一個勇士、戰士都豎緊腰帶,起來跟隨祢。
7335.321	7338.242	謝謝主,感謝、讚美神。
7338.242	7339.723	主啊,讚美祢。
7339.723	7341.764	祢是拆派我們的神。
7341.764	7343.725	祢是祝福我們的神。
7343.725	7345.406	祢是建造我們的神。
7345.406	7347.227	主,因此我們要全心來仰望祢。
7347.807	7368.296	因此願天父上帝的慈愛,主耶穌基督十字架救恩的能力,聖靈在我們心中的感動、帶領跟鼓勵,常與我們眾弟兄姊妹同在,從今時直到永永遠遠,讓我們大聲的向神說阿們。
7368.296	7372.978	我們拍著我們榮耀感謝,歸給我們所愛的神,讚美耶穌,哈利路亞。
7373.558	7375.159	愿神祝福大家。
7375.159	7376.560	我们今天就到这边。
7376.560	7378.702	我们前后左右彼此问候。
7378.702	7379.802	愿神赐福大家。
7379.802	7380.062	哈利路亚。
7406.067	7425.654	繁體中文，臺灣國語。
7449.548	7460.895	我們一起來思想。
7460.895	7467.900	繁體中文，臺灣國語。