start	end	text
4806.152	4868.466	即使你躺平你擺爛你寧靜離職心中還是非常翻騰完全不安息的所以你會發現安息是一個力量可是躺平是一個是一個落跑你就從你應當所負責的事情中間沒有辦法再承擔責任所以以撒加原本是服苦的仆人因為他躺平他寧靜離職 可是他後來成為通達實務的組長是因為他們明智的做出了有價值的選擇跟改變也就是他們在好的時機點把握了好的時機做了有承擔的決定這就是他們翻身的原因我們前面講到通達實務現在要強調把握時機 我們知道在新約聖經中間有兩個字講到時間。
4868.466	4874.950	一個字chronos,它指的是日子、時候、許久。
4874.950	4879.093	比方說我們常常講編年史,就是chronical。
4879.093	4883.436	歷代字就是chronikos,所以歷代字就是一種編年史。
4883.436	4888.300	更有趣的是納利亞傳奇,你們有看過這個電影,對不對?
4888.300	4888.560	沒有啊。
4889.394	4921.167	它的英文名字居然叫Chronicles of Narnia所以你就知道Chronicles 它是指很長的一段時間很長的一段平常的日子可是新約裡面還有一個字講時間叫做 Charos 這個說法已經非常普遍了,你可以在很多別的地方已經聽到討論這個事情。
4921.167	4922.688	那Kronos是什麼呢?
4922.688	4923.890	Kairos是什麼呢?
4923.890	4927.493	耶穌在約翰福音7章6節,祂說我的時候怎麼樣?
4927.493	4929.115	還沒有到。
4929.115	4933.099	所以這兩個時間其實是不一樣的。
4933.099	4936.362	其實Kairos基本上應該翻成時機。
4937.483	4939.204	就是timing。
4939.204	4946.486	所以你的一生中間會有非常多的chronos,然後組成一個charos。
4946.486	4954.269	比方說你讀書讀書,是chronos,然後忽然考上大學是什麼?
4954.269	4954.269	charos。
4954.269	4961.051	你生活生活都是一般時間,忽然間遇見你老婆,那是什麼?
4963.234	4967.778	是charis,那個moment,那個時機點。
4967.778	4971.781	你進到一個特殊嚮往的一個工作,那個是charis。
4971.781	4981.129	所以我們人生會有幾個重要的charis,可是它是從一連串的chronos組成的,當然兩個都非常重要了。
4981.129	4982.970	可是我們把重點放到這個charis。
4984.514	4996.403	以弗洛所述第五章,保羅就說,你們要謹慎行事,不要像愚昧人當像智慧人,要愛惜光陰,因為現今的世代邪惡。
4996.403	4999.905	不要做糊塗人,要明白主的旨意,如何?
4999.905	5007.231	所有的解經家都告訴我們愛惜光陰,不是叫你早起起來寫作業,小時候。
5008.985	5013.949	到現在說早點出去開車比較不塞車,不是。
5013.949	5020.195	所有的解經家都告訴我們,愛惜光陰真正的意思是把握時機,因為這個光陰其實是 charis。
5020.195	5034.630	所以正確的解釋是保羅說,你們要學會把握時機, 所以你會發現祂在這個地方很清楚的跟我們說了幾件要、幾件不要。
5034.630	5043.719	要把握時機,要明白主的旨意,要謹慎行事,不要像愚昧人,不要做什麼?
5043.719	5045.541	糊塗人。
5045.541	5057.542	所以你就很清楚的看見,保羅很清楚的告訴我們說,在每一個時代, 你需要知道這是一個什麼樣子的時代。
5057.542	5068.149	你不要做一個愚昧人,不要做糊塗人,好像都看不懂一樣,都不知道你是誰,或者是你處的環境是一個什麼樣的環境。
5068.149	5074.354	你要謹慎,你要明白主的旨意,你明白的時候,你要怎麼樣?
5074.354	5075.915	把握時機。
5075.915	5079.178	所以這個就是保羅這一段經文,他真正所要說的。
5080.213	5088.319	所以我們看到保羅在這個地方,兩個不要、三個要,然後就是如何來把握時機。
5088.319	5096.165	所以我們會看見通達時務跟把握時機,其實是連在一起的兩件事情。
5096.165	5098.987	你通達時務,你才會怎麼樣?
5098.987	5099.728	把握時機。
5100.845	5111.712	我們來看看如何明白John Maxwell有一本書叫做《從內做起》,這是他的風觀作。
5111.712	5119.738	我們知道John Maxwell是牧師,可是他在美國做管理大師,非常有名,大概二、三十本書了。
5119.738	5129.084	這本是他的風觀作,現在這些很知名的作家都在風觀作,二、三十年精華都在這一本,所以你只要看這一本就可以了。
5130.845	5133.808	你怎麼明白向內你感覺到了什麼?
5133.808	5154.123	你的自我察覺 看過去,你的過去的歷史發生什麼事情,你學到什麼東西。
5154.123	5158.564	看周圍旁邊的人正在發生什麼事情,就是整個環境。
5158.564	5162.285	像上明埋上帝要你做的事情,然後怎麼樣?
5162.285	5164.945	看前方,你就會看到hot picture。
5164.945	5174.767	這個是John Maxwell他所提供的一個如何洞察時機,如何找到你現在該做什麼事情的一些法則。
5174.767	5176.788	當然他這本書看很多,不只是這個。
5177.688	5184.899	我們就要來談談教會的時機是一個什麼樣子的時機。
5184.899	5224.063	去年10月21號協敬會 有一個論壇叫做關鍵面對主題叫做回不來的羊走出去的教會事實上我從去年開始去各種不同的教會我都會問說回流率如何現在已經差不多回來了看你們應該都流回來了可是早些的時候有的時候那個回流量真的是比較流不多了因為很多人都留在網上了覺得在家看網實在太方便了 所以他就用這個回不來的羊走出去的教會作為主題。
5224.063	5226.963	給大家看一個很可怕的數字。
5226.963	5230.824	2017年的時候全臺是154萬基督徒。
5230.824	5234.385	我們其實當時候已經號稱6%了。
5234.385	5240.446	可是2022年的時候全臺是79萬基督徒。
5240.446	5244.006	據說是退回到公元2000年的數字。
5244.006	5244.686	差不多那時候是2%。
5244.686	5245.067	衰退了49%。
5248.507	5256.369	當然這個統計可能有疏失,因為真的不回教會就統計不到。
5256.369	5262.471	如果你決定做網民的話,那就統計不到了。
5262.471	5268.973	可是其實也會看到整個疫情打下來,的確臺灣教會產生很多的問題。
5269.753	5271.735	跟我們所想像的不一樣。
5271.735	5275.498	我看貴教會應該回流的差不多,對不對?
5275.498	5276.619	應該差不多都回來了。
5276.619	5278.141	我們有連線嗎?
5278.141	5280.223	我們現在有在直播嗎?
5280.223	5281.704	有。
5281.704	5283.966	直播的,歡迎您偶爾也回來一下。
5284.787	5287.230	讓我們可以統計到你。
5287.230	5300.226	所以我們就會發現,這個的確會成為一個現象,甚至有些教會無力做網路直播的,他的弟兄姊妹可能就真的跑到別人教會去,或者是回不來。
5301.442	5305.125	所以這個是一個很真實的現象。
5305.125	5308.468	所以我們其實就要來思想,可是很有趣。
5308.468	5312.812	他說少了49%,卻增加了305間教會。
5312.812	5314.633	這是到底發生什麼事情?
5314.633	5318.676	就是這個微教會跟網路教會紛紛興起。
5318.676	5325.042	所以你的確發現,面對後疫情,傳福音的方式需要重新思考。
5326.510	5328.973	我有上貴教會的網站。
5328.973	5331.956	我們牧師好像有很多節目,對不對?
5331.956	5333.477	這個很好,我告訴你。
5333.477	5334.058	為什麼?
5334.058	5336.140	因為你這個可以keep人。
5336.140	5336.481	為什麼?
5336.481	5339.464	因為可能不是貴教會的人也會來看。
5339.464	5344.890	其實你就會發現,後疫情時代已經完全變成不一樣的一個情況。
5345.350	5361.231	像我做喬治書房也是這樣,我開始做的時候剛好就是疫情開始的時候,可是我不是為了疫情而做,而是覺得我電視的節目停了,我需要一個新的平台來對話,所以後來就想到說我可以介紹各種不同的書,包括基督教,包括不是基督教的書。
5361.732	5363.574	所以,你知道嗎?
5363.574	5368.198	開始上網之後,忽然間那個對話量怎麼樣?
5368.198	5370.981	就開始迴旋上升。
5370.981	5377.627	我最多有一萬四的點閱量,當然跟別人不能比,可是也感謝主了。
5377.927	5382.189	所以意思就是說,你開始有一個新的平台,可以跟別人怎麼樣對話。
5382.189	5385.391	我們可以透過很多不同的方式傳遞。
5385.391	5388.852	大概四、五千的時候,我都知道還在教會裡面留。
5388.852	5394.255	超過五、六千我就知道已經留到職場去了,因為有些書是職場的書。
5394.255	5400.478	所以我知道超過五、六千甚至上萬的,已經都留到非基督徒那邊去看了。
5400.478	5406.621	所以這就是我們可以用一種不同的方式來跟這個社會來對話。
5407.261	5412.983	所以我們會發現,我們傳福音的方式更新,我們的牧養方式可能也更新。
5412.983	5428.428	我最近讀這個《教練的心》這一本,那我用這本書,其實我也跟我們的同工在談,就是我們將來牧養的方式,除了教導,除了協談諮商之外,有沒有可能有一個新的教練模式。
5428.428	5444.700	這個教練模式其實不是體育的教練, 其實它是一個現在已經很專業,這個要拿執照的,其實它是一個coaching,就是人生的coaching,或者是企業的coaching,怎麼樣用這種方式幫助人們自主的做出解決方案來。
5444.700	5459.853	那我覺得,其實基督徒應該越來越懂得自主管理,自主做決策,所以這本書其實,因為我們牧羊是不是還是傳統的那種牧羊方式,還是有一些新的思維幫助牧者可以來做牧羊的事情。
5460.742	5467.066	再來的時候,就是堂會拓殖是不是重新需要思考?
5467.066	5476.993	我上貴教會的網站,貴教會已經在桃園,還有我們是講的高雄,還有萬華,都開始了新的事工。
5476.993	5496.612	其實臺灣是有它的所謂工業鏈,就是產業不同的聚落,從北到南都有不同的聚落,可是我最近發現整個臺灣的地貌在改變, 比方說我們的彰化已經成為風電大線,因為風電進來,很多年輕的工程師去了彰化。
5498.933	5501.654	所以我就跟彰化的同工說,你們知道嗎?
5501.654	5509.515	你們的人口結構會改變,已經不是阿公阿嬤了,已經都是可能會是小帥哥進來了。
5509.515	5516.477	你們要開始想想看你們的客戶,你們要提供什麼樣的服務,來爭取這些新客戶。
5516.477	5525.620	後來我有一個學生是彰化,他是回田中去, 做花農,兼開教會,這個叫雙職。
5525.620	5533.724	就是一面開他們家很大一個花的種植場,然後他也在那邊開拓教會。
5533.724	5546.069	他就跟我說,老師真的彰化好多新的房子,我都在想說誰買,就賣光了,他就想說臺北人來炒地皮,結果不是,其實就是被這些風電工程師進駐。
5546.069	5549.371	那風電工程師進駐,他就會在那邊結婚生小孩,有沒有?
5550.367	5552.990	整個聚落就改變了。
5552.990	5554.231	整個人口結構改變。
5554.231	5556.574	現在臺灣正在發生這樣的事情。
5556.574	5559.276	我們會發現,其實屏東也發生這樣的事情。
5559.276	5560.277	請給我PPT。
5560.277	5568.306	屏東是光電大線。
5568.306	5571.469	為什麼不動?
5571.469	5572.030	請動一下。
5575.623	5579.647	花蓮,就是地熱。
5579.647	5579.988	為什麼?
5579.988	5582.811	因為現在全世界在拼新能源。
5582.811	5585.333	這個已經是新產業了。
5585.333	5588.657	比爾蓋茲沒有來了,可是他投資了。
5588.657	5600.059	所以, 我為了來貴教會講道,很慎重的上網去查新北市淡水鎮的發展。
5600.059	5606.906	所以呢,淡水已經變成許多人想要移居的首選。
5607.585	5614.553	包括在地人,包括甚至老外。
5614.553	5615.214	為什麼呢?
5615.214	5620.120	因為交通建設完全不一樣,所以害我今天早上走丟。
5620.120	5624.005	交通建設跟以前完全不一樣。
5624.005	5627.269	這個日照中心,很多長照機構進來了。
5628.490	5634.935	然後呢,貴教會剛好站在非常關鍵的位置。
5634.935	5640.619	你們的舊堂在老市鎮跟一旗的中間。
5640.619	5644.401	你們的新會堂本地在一旗跟二旗的中間。
5644.401	5648.885	你們知道你們這麼會選location嗎?
5648.885	5650.926	這是上帝選的。
5650.926	5654.829	所以你看我已經幫你們勾起來了,這是我畫的。
5654.829	5656.250	兩個圓圈圈是我畫的。
5657.193	5676.219	淡海新市鎮一起,包括行政中心,美麗新影城,科技大學,運動中心,游泳池,攀岩,淡海安居,這些社會住宅都進來了。
5676.219	5681.981	國小,因為新移民進來就要生小孩,小孩就要國小,國小就國中。
5683.541	5688.905	希望在2036年,人口數達到13萬,目前是5萬。
5688.905	5692.767	哇,你們是大戶。
5692.767	5698.871	你們這個市場很大了。
5698.871	5709.138	然後呢,二期就會有很多產業進來,包括電子零件、塑化、生技,金屬、機械、文創、食品,通通都會進來。
5709.138	5711.020	請問工作進來就會什麼?
5712.551	5713.711	人就進來。
5713.711	5714.031	為什麼?
5714.031	5718.213	因為他可能就選擇居住在淡水。
5718.213	5720.413	你們真的前景大好。
5720.413	5727.815	所以第二期發展完了的時候,淡水會成一個完全不一樣的地方。
5727.815	5739.494	我今天早上走錯路, 我很早就出來就是怕走錯路,因為有一陣子沒有來淡水,我來淡水都是去老市鎮。
5739.494	5759.184	所以我想說,昨天Google了半天,說要走燈輝大道,結果燈輝大道完全長得不像我以前想的那個樣子,我以前想到是很大一條路,結果居然我看過去都是那個, 都是橋樑,我就想說應該不是這一條。
5759.184	5762.448	我再走,後來就走到老市鎮。
5762.448	5774.619	你們如果是老淡水,你就知道我就被那個導航帶到環繞,最後才來到我們崁頂五街。
5774.619	5803.837	我後來跟牧師說,我感謝主, 雖然走丟了,可是我好像再一次認識淡水,從老市鎮,那個結構,那個人口,那個房屋,有沒有,然後被帶到新市鎮,有沒有,看到你們豪宅一堆,有沒有,可是都是棟具很遠,所以你們要蹲清木鱗,然後呢,我就發現教會在這裡。
5803.837	5804.937	那我要講什麼?
5804.937	5810.567	It's a good timing. 那是一個好的時機。
5810.567	5824.975	包括你在工作上,包括你在參與在神的國度的擴張上,其實它是一個非常好的時機。
5824.975	5832.980	當整個生活風暴改變,就業機會,人口結構都改變的時候,就是一個非常好的時機。
5835.009	5845.541	我們來看個人實際,剛才已經提過了這個,我很快講這個林書豪的見證,大家都很熟悉林書豪,對不對?
5845.541	5863.496	林書豪最近這個週刊訪問他,叫做你所不知道的林書豪,他說他林來風爆紅之後, 每一個人都把他當作搖錢鼠,想要出名,想要賺錢,他沒有辦法相信任何人。
5863.496	5875.688	他後來有一點點停滯期,被交換來交換去,所以他有五年自我封閉。
5875.688	5888.559	後來有一個人來找他,這個人叫做影響力投資的一個系統,就跟他說, 我們現在會有一個影響力投資,你要不要參與?
5888.559	5892.642	他就想到他在讀大學的時候,他輔修社會系。
5892.642	5901.609	他就知道他鄰近有一個社區,他進去服務的時候,很多的小孩子終生無法翻身,因為太貧窮了。
5902.773	5918.286	所以他就很清楚知道,當他還有一些資源的時候,他可以投資在這個所謂影響力的投資的裡面,就是改善非常多弱勢家庭的生活,以及讓他們有一個新的機會。
5918.286	5932.980	所以呢,他就開始投資這個所謂的 永續投資,或者是所謂影響力投資,現在他可以影響600萬弱勢的家族,能夠得到他的益處。
5932.980	5941.905	然後你看這張照片,他不在意背後世人,背後世人代表他自我封閉,而是他開始怎麼樣?
5941.905	5942.626	笑臉怎麼樣?
5944.718	5967.659	所以找到上實地的計畫在於你知道在這個時代還有什麼缺口也就是說還有什麼人有需要其實包括商業人家也說需要就是商機你懂我的意思嗎 這個社會需要就是缺口。
5967.659	5982.573	當你會發現,無論在工作中間有一個需求,你如何去滿足這個需求,或者在社會中間有一個需求,你如何去滿足這個需求的時候,你會找著自己的定位。
5982.573	6000.797	我剛才有一頁跳過去,就講到這個神學家布納克說, 祂說,你裡面的深醉的渴望,跟上帝的呼召互相對應的時候,那個就是你該委身的點了。
6000.797	6007.181	所以在面對後疫情時代,其實所有的事情都在重新洗牌。
6007.181	6012.024	我們怎麼樣可以通達時務,而且把握時機。
6012.024	6037.516	不做糊塗人,不承諾躺平主, 勇於承擔責任,思考在今天,無論在教會的裡面,在社會的裡面,在職場的裡面,還有什麼需要是你可以委身,可以擔責,可以去承擔的時候,那就是你的good timing,就是你的好的時機。
6038.456	6041.357	所以我們要一起來禱告。
6041.357	6059.501	我們請敬拜團幫助我們用神機會的風,上帝總是給我們機會,我們怎麼樣要敏銳上帝工作的時刻,讓我們能夠通達時務,能夠把握時機,包括我們的教會,能夠成為時代的祝福。
6059.501	6061.341	我們請敬拜團直接進來。
6069.206	6100.942	好 請主啊 謝謝祢 謝謝祢萬事萬物 各安其事我們就直接進來囉你開始 曾昭文 沒有收到這個信息,要唱這首詩歌。
6100.942	6105.064	好,好,那沒關係。
6105.064	6107.626	沒關係,沒關係,我沒有辦法帶。
6107.626	6109.407	OK,可以放YouTube嗎?
6109.407	6111.248	同工。
6111.248	6113.669	好,我們就先一起來禱告。
6113.669	6118.211	阿蕾利亞,阿蕾利亞。
6118.211	6120.072	耶穌,謝謝祢,謝謝祢。
6120.072	6122.894	好不好,弟兄姊妹,你可以按手在自己的身上。
6124.343	6135.507	我們謝謝祢,只要祢創造萬物,都有祢的心意,包括我們每一個人,祢把我們放在這個時代。
6135.507	6138.728	只要我們謝謝祢,我們謝謝祢。
6138.728	6145.010	好,我們請進YouTube,我們先用詩歌。
6145.010	6145.690	Hallelujah!
6174.428	6177.150	主啊 謝謝祢。
6177.150	6182.352	主啊 祢看我們每一個人都是祢的寶貝。
6182.352	6184.994	在我們的一生中間。
6184.994	6188.776	主啊 祢給我們很多重要的特色。
6188.776	6194.719	主啊 讓我們能夠敏銳。
6194.719	6196.060	此時此刻。
6196.060	6198.861	主啊 祢所要做的是什麼。
6198.861	6200.943	阿利利亞。
6200.943	6202.944	讓我們能夠進入到祢的心意。
6204.121	6209.384	進入到祢的對我們的命定。
6209.384	6212.025	我們一起站立起來。
6212.025	6215.107	變神機會的風。
6215.107	6225.393	當神機會的風吹起,主帶領我乘風波浪。
6225.393	6243.846	在生命每個轉換處,都經歷過大難, 我們音樂聲音撥響,我們來禱告。
6258.439	6276.218	Hallelujah主啊我把每一位弟兄姊妹都恭敬的交在你的手中主啊向我們顯明你的心意讓我們中間沒有一個糊塗人 讓我們中間沒有一個是躺平的,是寧靜離職的。
6276.218	6284.901	無論在我們人生任何一個角色上,都讓我們能夠剛剛好的進入你所給我們的職份。
6284.901	6300.046	包括在我們的家庭裡面,包括在我們的工作裡面, 包括藻藻界的教會,藻藻在這個時代,藻藻在這個社區所能夠產生的影響力。
6300.046	6305.069	藻藻讓我們真正是一群可以用影響力來投資的人。
6305.069	6307.069	祝我們謝謝你。
6307.069	6320.655	It's a good time. It's a good timing, 噢喳喳幫助我們,噢喳喳都能夠成為通達實務,把握時機和你心意的人。
6320.655	6325.637	主啊,我們謝謝,謝謝主把時間交給牧師。
6325.637	6335.221	好,我們繼續來禱告,我們繼續來回音的聲音。
6335.759	6338.841	我們來回應我們的主。
6338.841	6341.243	感謝詹老師。
6341.243	6344.005	謝謝詹老師帶給我們美好的信息。
6344.005	6351.850	我們需要來回應祂,回應這位向我們說話的神,祂告訴我們祂的心意。
6351.850	6355.172	弟兄姊妹,你通達食物嗎?
6355.172	6359.195	我看我們當中蠻多人通達食物,但是是那個可以吃的食物。
6360.759	6362.680	就是地上的食物你很通達。
6362.680	6364.500	哪裡有好吃的啊?
6364.500	6365.881	哪裡有好玩的啊?
6365.881	6368.222	哪裡買房子比較便宜啊?
6368.222	6370.522	哪裡做什麼投資啊?
6370.522	6372.463	你都很清楚。
6372.463	6375.764	你好像很通達這些地上。
6375.764	6378.165	耶穌說這是會朽壞的食物。
6378.165	6381.866	耶穌說不要為會朽壞的食物怎麼樣?
6381.866	6383.027	勞力啊。
6383.027	6386.688	如果你這一生努力只是為了這一些,所以耶穌說太不值得了。
6387.654	6390.059	這些是神量給我們的。
6390.059	6401.907	但更重要的是﹐你是否能夠明白﹐上帝的心意﹐實務實務﹐ 包含了時間,包含了時機,包含了神給的機會。
6401.907	6411.114	事物事物,包含神要你承擔的責任,包含神要你起來回應你的呼召,意向跟使命。
6411.114	6432.594	很多時候我們在職場,或是我們在自己在事業上的角色,可能是一個很不錯的人,可能是一個職場的老兵,職場的老師,職場的老總, 但是有沒有可能,好像很長一段時間,你已經變成了這個教會的小白。
6432.594	6439.763	或是在屬神的整個戰場上,你已經慢慢變成鐘擺跟什麼?
6439.763	6441.966	不要這樣老擺,傷感情。
6441.966	6442.247	大擺。
6444.667	6466.338	弟兄姊妹,其實如何讓自己從一個過去曾經還蠻不錯的一個老兵、老練的人,但如今可以再一次的來佩搭神的工作,能夠走進去神給我們的這個整個一個新的時機,其實就是需要,剛剛喬老師有講,需要怎麼樣?
6466.338	6467.579	創新。
6467.579	6470.881	你的想法要改變,還有你的心態要改變。
6471.561	6487.180	你如果想永遠就是說我以前怎麼樣啊以前已經過去了現在最紅的食物是什麼通達食物嘛現在最紅的食物是什麼食物創意料理 這個加這個,這樣也可以吃喔?
6487.180	6489.340	對,可以吃。
6489.340	6493.322	就是說我們心態要改變,我們的生命要改變。
6493.322	6494.722	其實最重要是怎麼樣?
6494.722	6497.483	態度要改變。
6497.483	6505.206	有時候我們太老兵,太老油條,神叫不動了,神漸漸就不叫你了。
6505.606	6509.349	我們來回應神。
6509.349	6514.194	我們求神幫助我們。
6514.194	6523.588	主啊,我還不是當躺平族的時候, 我還不是安息主懷的時候。
6523.588	6526.210	主啊,我的生命仍然在這裡。
6526.210	6528.071	這是祢賜給我的生命。
6528.071	6530.092	這是祢救贖的生命。
6530.092	6533.094	這是祢要恩膏的生命。
6533.094	6535.395	這是祢要差遣的生命。
6535.395	6537.297	神啊,我在這裡。
6537.297	6539.378	求祢贖點我的時候,我們三百獎民宿祭。
6539.718	6541.959	神會數第二次的。
6541.959	6544.380	第二次數你的時候,你在不在?
6544.380	6547.181	第二次數你的時候,你態度改變了嗎?
6547.181	6551.683	剛剛喬老師講的信息,第一次數的時候,以撒加怎麼樣?
6551.683	6553.564	就是推卸責任了。
6553.564	6555.245	但第二次數的時候,祂有沒有改變?
6555.245	6555.865	有。
6555.865	6557.346	祂改變,神就用祂了。
6557.346	6557.846	反而是怎麼樣?
6558.166	6558.466	阿們。
6579.514	6583.678	做这个仆人领袖的心志,我想是非常重要的。
6583.678	6591.344	好不好,我们就同声开口,我们就为今天的信息,神所提醒我的,我们向神来祷告,向神来感谢。
6591.344	6600.772	再次把你自己生命的主权献上给神,求神改变你的态度,改变你的思维,打开你的眼界,不做神国的躺平主,阿们。
6601.613	6610.155	讓我們繼續成為一個﹐被神來引導﹐通達實務﹐掌握機會的風﹐跟著神往前走。
6610.155	6617.517	我們沒有能力造浪﹐但我們絕對可以手牽手﹐一起踏上聖靈所運行的浪頭。
6617.517	6618.037	阿們。
6618.037	6621.317	這是我們在一起﹐非常重要的團契﹐的一個秘訣。
6621.317	6622.038	阿們。
6622.038	6624.978	不要落單﹐落單你自己很容易就被吞沒掉了。
6624.978	6627.299	我們同聲開口為自己的祷告。
6627.299	6628.019	神啊我們感謝祢。
6628.439	6632.705	透過今天的信息再一次的提醒我們。
6632.705	6633.446	主祢仍然在輸點我們。
6633.446	6635.149	主祢仍然在呼召我們。
6635.149	6636.871	主啊大環境在變。
6636.871	6639.675	主我們自己的生命的季節在轉變。
6639.675	6642.660	但唯一不變的就是神祢輸點我這個人。
6642.660	6644.803	神祢向我這個人說話。
6645.043	6651.965	神祢的恩典的時候,仍然牽著我,要繼續往前走,不論是高山還是低谷。
6651.965	6654.766	主啊,祢恩待我們,恩待我們,待到祢的面前。
6654.766	6655.886	主啊,安靜下來。
6655.886	6660.767	主啊,看明白祢的心意,看明白祢的作為。
6660.767	6668.271	無眾在曠野裡面迷糊的人,神啊,神啊,給我們一個 全新的胡人的心態的形式。
6668.271	6670.892	給我們一個全新的一個前輩的心。
6670.892	6678.017	給我們一個全新的,主啊,道控自己,好讓你自己在我們生命中做新事的機會。
6678.017	6681.760	神啊,因為你新酒是要澆灌在新皮帶裡面。
6681.760	6684.242	喔,主啊,脫去我們的旧人。
6684.462	6687.983	將我們那個老油條的那種心態拿去。
