start	end	text
2862.090	2866.372	讓我知道說,其實聖經祂預言了好多好多事情。
2866.372	2870.994	也謝謝Amanda,因為你的見證,我媽媽受到了感動。
2870.994	2872.274	感謝主。
2872.274	2876.596	我覺得上帝,祂在我們中間,祂使下了祂的大能。
2876.596	2882.218	上帝要做的事情是沒有什麼辦不到的。
2882.218	2885.620	媽媽她今年也跟著我一起受洗了。
2885.620	2885.620	Amen。
2885.620	2886.540	感謝主。
2889.804	2893.269	我想說媽我愛你,上帝更愛你。
2893.269	2898.595	我媽媽常常說她好像從鄉下來的,什麼都不會,什麼都不懂。
2898.595	2902.761	我說你別擔心,只要上帝都懂,祂都在你旁邊。
2904.360	2913.666	感謝主祂一直都沒有放棄我,然後很久沒有見的家人,他們一看到我就說,欸,靜妍,你怎麼氣色越來越好?
2913.666	2917.908	我覺得那不是好聽的話,因為上帝已經進來我的心中了。
2917.908	2927.174	我現在每天我很渴慕祂,我每天都會不管在洗澡啊,開車啊,我都會禱告,然後會哼著詩歌。
2928.541	2956.056	因為我知道上帝祂單單就是因為愛我,然後我也想要把這份愛呢,分享給在座的每一個人,讓你們知道說,上帝其實祂真的好奇妙喔,因為我一直覺得,我以前不敢大聲的說,其實我是信基督徒的,其實我對這個是很有興趣,很有信心,可是我會害怕,可是越來越讀聖經,我覺得, 我變勇敢了。
2956.056	2961.769	我現在能站在這裡,我覺得這個就是上帝給我的勇氣。
2961.769	2962.010	阿們。
2963.507	2968.028	本來要有一些手稿,其實我一上台我都忘光了。
2968.028	2975.550	我求上帝祂能使用我,能利用我的口,能分享到上帝的好,讓大家都知道。
2975.550	2980.771	上帝祂就是因為愛我們,祂就是愛我們的獨一無二。
2980.771	2987.773	現在我也希望說,我的家人可以跟我一起慢慢的接近耶穌,能認識耶穌。
2987.773	2993.396	感謝讚美主,我將今天一切的榮耀, 全都歸給上帝。
2993.396	2999.960	謝謝,謝謝。
2999.960	3004.164	我們非常謝謝靜田,她是很勇敢喔。
3004.164	3010.688	我第一次打電話給她,邀請她上台做見證,她嚇得要命,她說我行嗎?
3010.688	3012.570	你們看她今天有沒有分享得很好。
3013.336	3049.486	很棒很穩而且幾乎都沒有看稿子所以我們真的是覺得神很恩典恩待他在信主的過程當中他從懦弱變成勇敢而且現在是非常的追求所以我們在他受洗之後有姊妹為他做懷香課程的陪讀讓他更堅定 那我今天呢,要來跟大家分享的是興起發光這樣子的一個主題。
3049.486	3056.011	我記得小時候在颱風來襲的時候,那時候颱風經常是很大。
3056.011	3058.973	颱風來襲的時候其實是我們是很開心的,為什麼?
3058.973	3061.655	因為那時候就可以犯規。
3061.655	3062.455	犯規是什麼呢?
3062.455	3063.596	就是可以吃泡麵。
3064.957	3069.103	然後呢,因為大到一個程度呢,經常就停電。
3069.103	3073.870	但停電的時候呢,家裡就會點蠟燭。
3073.870	3080.340	雖然蠟燭小小的,但是那個燈光就照亮一家人,然後就覺得很溫暖。
3080.981	3085.103	尤其在那個時候,我爸爸會講故事。
3085.103	3096.629	我覺得那種溫馨的感覺,那種全家人就圍在那個小燭光,聽故事的那種感覺,一直到現在我都很難忘。
3098.268	3109.251	還有呢,另外一個經歷就是,我從歐洲回來,然後呢,剛開始教書的時候,我是兼課,然後在夜間部教書。
3109.251	3113.712	那教書教到一半的時候,第一次,啪!
3113.712	3116.273	燈光全滅,嚇我一跳。
3116.273	3122.675	然後呢,我還沒有反應過來的時候,就看學生全部都往外衝,然後有一個人很好心說,小心!
3122.675	3123.455	不要踩到老師!
3125.145	3127.786	想說這是怎麼回事。
3127.786	3158.424	我還在想的時候一下燈又打亮了那種歡呼聲我到現在我都記憶猶新那是我在做老師的過程當中的新生訓練但是我也覺得很溫馨他們有注意到我就是不管燈光是小到像蠟燭一樣 或者是啪一下全亮的那種感覺。
3158.424	3162.006	只要有光就不一樣。
3162.006	3181.879	所以今天我們要一起從以賽亞書的60跟61章裡面我們來看神如何幫助我們 能夠興起發光,能夠幫助我們,呼召我們成為祂光明的使者,來做光做眼。
3181.879	3186.982	我剛才講的兩個例子呢,都是停電。
3186.982	3190.464	停電,要讓它再亮起來,容易不容易?
3190.464	3191.885	其實沒那麼難,對不對?
3193.336	3200.745	但是人心裡的黑暗卻有時候會是一輩子我們的夢魘。
3200.745	3209.755	所以怎麼樣我們可以跟上帝合作,做光做眼,把人心裡面的黑暗把它帶出來。
3209.755	3212.038	這是我們要學習的功課。
3212.038	3213.039	我們一起來禱告。
3213.660	3236.740	施主我們感謝讚美祢,主要謝謝祢給我們這樣子美好的一天,主要讓我們來到這裡,主要我們聚集要聆聽祢的話語,求祢打開我們靈裡的眼,靈裡的耳朵,敞開我們的心, 主啊,主啊,祢來帶領孩子,讓孩子口所說的每一句話,主啊,都是來自於祢,主啊,都帶著能力。
3236.740	3244.964	主啊,也幫助我們在整個過程當中,不管是分享的或者是聆聽的,主啊,我們每一個人都受益。
3244.964	3253.047	我們奉耶穌的名斥責所有不屬神的這些黑暗勢力,要攪擾我們,看見聽見的,完全要離開我們。
3253.387	3253.587	阿們。
3270.043	3277.611	好,那我們一起先來看以賽亞書的六十章的一到三節。
3277.611	3279.674	來,我們一起來念。
3279.674	3284.559	新起發光,因為你的光已經來到。
3284.559	3287.582	耶和華的榮耀發現照耀你。
3288.183	3293.847	看哪,黑暗遮蓋大地,幽暗遮蓋萬民。
3293.847	3301.373	耶和華卻要顯現照耀你,祂的榮耀要獻在你身上。
3301.373	3307.398	萬國要來救你的光,君王要來救你發現的光輝。
3308.865	3328.050	我們看到59章的後面,在闡述完上帝藉著一位救贖主,就是彌賽亞,他跟西安的百姓立了新約之後,我們看到這一章一開始,他就四個字給我們,那是興起發光。
3328.050	3331.431	興起發光,它是一個命令式。
3331.431	3358.454	所以我們可以看到,那不是一個建議, 那不是一個我們可以做可以不做的那是一個什麼命令命令你要興起發光好在這個時候神沒有緊緊抓住百姓他之前犯的錯 只要是離惡向善的百姓,祂就說,你們起來興起發光。
3358.454	3375.935	祂不追究你過去做了什麼,說了什麼,這一切都已經過去,因為神已經跟我們立了心願, 所以這邊講興起發光,因為你的光已經來到,這是一個完成式,是不是?
3375.935	3378.277	就祂已經來到。
3378.277	3385.821	所以在當時的以色列,以色列民他們是處於黑暗當中。
3385.821	3390.103	那這些被救贖的百姓,為什麼他們可以興起發光?
3390.103	3393.065	是因為他們裡面有光嗎?
3394.718	3396.279	當然不是。
3396.279	3400.621	是因為神公義的日頭已經照在他們身上。
3400.621	3405.283	所以他們因著神,他們可以興起,他們可以發光。
3406.476	3409.737	所以我們看到第二節,祂說,看啊!
3409.737	3412.438	對我們每個人來講,這好像是一個驚嘆號。
3412.438	3414.018	來來來,看啊!
3414.018	3418.459	黑暗遮蓋大地,幽暗遮蓋萬民。
3418.459	3424.541	但是,我們剛剛看到第一節,你的光已經來到,神的光已經來到。
3424.541	3426.762	然後呢,祂說耶和華,卻要。
3427.602	3434.667	在黑暗當中,我們有一個轉折是,耶和華卻要發現、照耀你。
3434.667	3437.330	祂的榮耀要顯在你身上。
3437.330	3452.962	我特別把那兩個要把它標成黃色的,是因為我要讓大家來看見,那是神要,祂是主動的要來讓我們可以救著祂的光,我們可以興起,可以發光。
3452.962	3455.724	所以這是祂主動而且祂定義這麼做。
3457.415	3464.838	我們可以知道黑暗跟光明它是對立的。
3464.838	3476.162	所以以色列先知他預言說當黑暗一片的時候神的百姓要跟大家暗在一起嗎?
3476.162	3477.683	要跟大家黑在一起嗎?
3479.070	3480.671	當然不要。
3480.671	3482.392	所以我們要幹什麼?
3482.392	3483.792	我們要興起發光。
3483.792	3487.995	所以興起發光是神對祂的百姓的應許。
3487.995	3492.097	而且是神對祂的百姓的呼召。
3492.097	3493.958	祂要我們興起發光。
3493.958	3497.900	今天我們是不是也是生活在一個黑暗的世代裡?
3497.900	3499.580	是嗎?
3499.580	3502.382	但是我們可以做不一樣的事。
3504.292	3511.738	現在的全世界是戰爭頻傳,疫情很嚴重。
3511.738	3517.383	時而我們受到金融風暴的這樣子的威脅,我們會害怕。
3517.383	3529.012	有很多很多的天災人禍,有很多很多我們看到身旁有身心靈疾病的人,太多黑暗的事情,黑暗的狀況。
3529.753	3547.039	我們還好有神,祂做我們的光,祂在旁邊包圍著我們,以至於我們有這樣子的本事,可以在黑暗一片好像看起來沒什麼盼望的這樣子的世界裡面我們興起,我們發光。
3548.746	3554.931	我們再來看下面以賽亞書的61章1到3節。
3554.931	3558.914	我們先一起來念,然後再一節一節的來看。
3558.914	3561.496	我們來念61章的第一節,來。
3562.329	3589.482	主耶和華的靈在我身上,因為耶和華用高高我,叫我傳好信息給謙卑的人,拆遣我醫好傷心的人,報告被辱的得釋放,被囚的出監牢,報告耶和華的恩年和我們神報仇的日子,安慰一切悲哀的人。
3590.674	3609.694	賜華冠與喜安悲哀的人,代替灰塵,喜樂由代替悲哀,讚美衣代替憂傷之靈,使他們稱為公義樹,是耶和華所栽的,叫他得榮耀。
3611.357	3616.479	好,那我們先來看61章的第一節。
3616.479	3622.122	這段的經文主耶和華的靈在我身上,因為耶和華用高高我。
3622.122	3626.744	事實上它是一個與待雙關的用法。
3626.744	3628.025	這個我到底是誰呀?
3629.906	3632.307	是以賽亞,對不對?
3632.307	3662.728	但是祂也指的是耶穌祂預指將來的彌賽亞會應驗彌賽亞的這樣的一份執事會應驗在將來的耶穌身上所以以色列人他們曾經被囚被辱但是上帝應許說祂的救恩要領到他們要釋放他們自由要安慰他們 因此,耶和華的靈在以賽亞的身上。
3662.728	3672.130	祂要以賽亞去傳好訊息給前輩的人,祂要祂去醫好傷心的人,跟報告貝魯的得釋放。
3672.130	3683.033	當然,我們也在路加福音的第四章十八、十九節裡面,我們看到耶穌也宣告了這一段以賽亞書的經文。
3684.292	3695.317	他宣告自己是應許當中的彌賽亞要來拯救世人,要傳訊息給謙卑的人,要醫好傷心的人,要報告貝魯的得釋法。
3695.317	3704.322	所以他在那一段的經文裡面講到的是他降世為人跟他使命的這些的內容。
3705.282	3716.621	所以我們看到在舊約裡面,神要使用一個人,祂會用聖靈,用聖靈來賜給那個人智慧跟能力。
3716.621	3727.366	那祂也會用祂的恩膏來高抹, 表示說那是從他而來的一個子分,尤其是祭司跟君王。
3727.366	3735.696	因此我們看到主耶和華的靈在我身上,表示聖靈已經高抹他了。
3735.696	3739.521	聖靈高抹了這個仆人之後,他就不會離開他。
3741.101	3754.631	就如同我們在新約裡面看到,耶穌基督祂在約旦河裡面受洗之後,聖靈降在祂的身上,祂才可以開始去服侍人。
3754.631	3764.678	所以我們知道,聖靈的內住是因為耶和華主動用膏來膏我們。
3764.678	3770.765	因此, 彌賽亞可以完成工作是聖靈恩膏的結果。
3770.765	3777.012	我們也看到在聖經裡面敘述保羅的工作。
3777.012	3781.797	他因著聖靈的帶領,他去耶路撒冷。
3781.797	3784.800	我們看到他勇敢的心跟隨聖靈。
3785.623	3792.834	捆綁在牢獄裡面的生活都沒有辦法消磨他傳福音的心智。
3792.834	3799.965	各樣的苦難也沒有辦法讓他能夠不為神工作。
3799.965	3811.093	因此, 我們看到,不管是保羅或者是耶穌,都需要有聖靈的高模,那何況是我們。
3811.093	3819.360	我們也需要聖靈的幫助,聖靈的內助,才能夠完成神要我們完成的大使命。
3821.852	3880.081	然後也是第一章的後面接下來我們看到三個不定詞是我用黃色的字來把它標出來的三個不定詞在講的就是神要以賽亞祂做的三個祂的呼召祂的使命是什麼 第一個是傳好信息給謙卑的人再來是醫好傷心的人最後是報告被辱的得釋放我們看到傳好信息給謙卑的人謙卑的人指的就是也是貧窮或者是困苦或者是卑微的人 它可以指的是因為社會或經濟的問題陷於困難當中的這些的人。
3880.081	3891.868	它也可以指的是在屬靈的層面上是因為敬畏上帝,看自己好像一無所有,那種靈性謙卑的人。
3893.524	3902.028	所以我們知道,在聖經裡說,耶穌來不是招義人,而是招罪人。
3902.028	3907.290	所以祂是困苦貧窮的人的避難所,是他們的救贖者。
3907.290	3911.092	再來,醫好傷心的人。
3911.092	3918.335	我們看詩篇的147篇的第三節說,祂醫好傷心的人,裹好他們的傷處。
3920.418	3930.747	這個跟以賽亞書42章第三節的壓傷的爐位它不折斷,僵纏的燈火它不吹滅,好像互相的呼應。
3930.747	3945.340	所以我們看到,耶穌祂不僅是要喚醒那些痛悔、謙卑的人,祂也要成為傷心人的醫治者。
3947.244	3954.727	最後我們看到貝魯的得釋放,貝球的出監牢。
3954.727	3973.974	我們看到耶穌祂不僅是可以釋放身體受困擾的人,比如說我們看到祂行神蹟,祂讓瞎子看見,祂讓耳聾的可以聽見,祂叫大麻瘋的可以得醫治。
3975.111	3980.855	祂也做靈性上釋放的工作。
3980.855	3991.381	但是呢,我們看到祂用報告這樣子的一個字眼,表示這是已經成就的事。
3991.381	3999.186	不是我們人能做什麼,而是神已經成就了。
3999.186	4010.892	耶穌已經為我們釘死在十字架上, 但是我們沒有報告的話,我們沒有說出去,人是沒有辦法知道的。
4010.892	4030.919	人就好像有一個慣性,當我們被奴隸,當我們被擄被囚,我們沒有被告知,沒有人告訴我們,我們已經被釋放了,我們好像就會在被囚被擄的地方出不來。
4032.363	4047.287	這很像是一頭大象,我們從小把它關,把那個腳鎖在鏈子上,它就會習慣在它所活動的範圍裡面可能轉圈圈,它出不來。
4047.287	4048.828	這是它的慣性。
4048.828	4052.209	所以報告是一個非常重要的事情。
4054.445	4090.296	我們再往下看的第二節是報告耶和華的恩年和我們神報仇的日子安慰一切悲哀的人這邊的報告後面有兩個受詞第一個是耶和華的恩年第二個是我們神報仇的日子耶和華的恩年我們是在耶穌第一次降臨的時候祂報告祂的恩年 然後呢,報告神報仇的日子是在祂第二次要來的時候,我們要報告祂報仇的日子。
4090.296	4099.779	所以祂第二次降臨的時候,不再是慈愛救贖,祂要做公義的審判。
4099.779	4106.540	那我們這邊看到的恩年,事實上是從立位記的二十五章來的。
4106.540	4115.110	在以色列人他們進迦南地的時候, 每六年,神要他們休息一年。
4115.110	4126.961	然後呢,七次七年,到了第五十年的時候,就稱為恩年,或者是自由年,或者是西年。
4126.961	4132.146	它是神要以色列百姓分別為聖的一年。
4133.524	4143.532	在那一年,神要宣告這些百姓他們的試煉跟苦難已經過了。
4143.532	4149.196	所有欠債的、為奴的全部被釋放。
4149.196	4152.839	連悲哀的人也可以完全得醫治。
4152.839	4159.925	所以我們看到,耶穌為我們帶來的是屬靈的醫治。
4159.925	4161.486	祂是耶和華的受膏者。
4162.978	4176.272	祂要帶領我們所有的人,所有被擄歸回的這些的人,來對世人的身心靈進行一個醫治跟釋放的工作。
4176.272	4181.798	所以我們要有這樣子的警覺性,是神賦予我們這樣的使命。
4182.278	4186.122	要把好消息傳遞出去。
4186.122	4190.326	好消息莊牧師已經講過很多遍了。
4190.326	4192.128	是什麼?
4192.128	4196.312	是神要來我們生命當中做王掌權。
4196.312	4198.454	祂要來治理我們這個人。
4198.454	4200.556	那我們要把它傳出去。
4201.084	4224.118	因此我們要效法耶穌,我們也要出去傳揚好消息,要來成為一個有影響力的人,來影響我們身旁的人,也就是我們要為神來做光做顏,我們要以師上的靈魂為念,我們要成為一個在黑暗當中為神興起,為神發光的人。
4225.759	4229.900	所以我們仔細看看身邊。
4229.900	4238.623	事實上在這個身旁有很多人陷在苦難當中。
4238.623	4245.986	不管是身體的、心理的、經濟的關係上各樣的苦難當中。
4246.886	4257.890	我們是不是有這樣子的一個眼光來看到說,哇,看啊,這些人需要幫助。
4257.890	4265.032	看啊,神要我們做什麼可以來幫助這些人。
4265.032	4270.534	我們看看最近幾年可能大家比較有感的就是新冠肺炎。
4271.783	4279.848	新冠肺炎讓我們很多人好像對人的安全感有了一些的問號。
4279.848	4289.093	好像碰到人的時候我們很擔心這個到底他身上有沒有病毒,有沒有細菌。
4289.093	4296.697	或者是我們也看到曾經有一度這個世界好像因著新冠肺炎停擺了。
4298.336	4304.660	我看到我以前到歐洲的時候,有很多很多觀光勝地,一個人都沒有。
4304.660	4309.664	我想這怎麼回事,那段日子。
4309.664	4323.393	然後呢,我們也看到最近的統計說,到今年4月為止,全世界新冠肺炎,因為新冠肺炎死的人大概有700萬左右。
4323.393	4339.730	最近在報紙上也看到,臺灣, 從去年到今年的統計,新冠肺炎成為我們十大死因的第三名。
4339.730	4351.728	除了第一名,已經41年都高居寶座第一位的癌症之外, 新冠肺炎已經變成第三名。
4351.728	4358.452	所以,單單一個新冠肺炎就讓世界變得這個樣子,好像風雲變色。
4358.452	4364.797	我們大家都一起經歷過這一切。
4364.797	4372.822	我們看到每天的新聞裡面,很多都是好消息還是壞消息?
4372.822	4373.623	都是壞消息。
4374.770	4378.235	但是,神要我們報告的是什麼?
4378.235	4380.758	好消息。
4380.758	4389.588	所以呢,把世界的壞消息, 在人身上變成好消息。
4389.588	4392.329	這就是我們的任務。
4392.329	4409.479	因為靠著神,祂可以帶領我們救人,脫離疾病,脫離貧窮,脫離心靈上的折磨,脫離失敗的關係,脫離一切黑暗的瑕疵。
4409.479	4411.700	但我們有沒有這樣子的一個意識?
4413.524	4423.927	耶穌帶來了福音,祂是可以影響我們的生命的,祂是可以讓我們的生命不再一樣,而且是脫胎換骨。
4423.927	4439.132	只要我們願意去傳這個好消息,人聽見了,當他們願意把手伸給神的時候,他們的生命就不再一樣,讓神可以成為他們真正的生命的主宰。
4439.132	4450.843	所以耶穌說,我是世界的光, 跟從我的就不在黑暗裡走,必要得生命的榛光。
4453.251	4459.753	所以,神可以救人脫離黑暗,迎向有盼望的人生。
4459.753	4466.114	我們繼續往下一個,第三節來看。
4466.114	4470.795	次華冠與錫安悲哀的人,代替灰塵。
4470.795	4480.797	喜樂遊代替悲哀,讚美衣代替憂傷之靈,使他們稱為公義樹,是耶和華所栽的,叫祂得榮耀。
4480.797	4492.583	這邊的次, 後面有三個代替,讓我們很清楚地看到,神如何翻轉一個人的生命。
4493.677	4511.473	他用灰塵、悲哀、憂傷之靈這些不好的東西來換掉,換掉他百姓的生命裡面的就是賜給他百姓的生命裡面新的東西。
4511.473	4512.855	新的東西是什麼呢?
4512.855	4519.681	是華冠,是喜樂遊,是讚美衣,公藝術跟榮耀。
4521.630	4526.138	這些是我們神特別的恩典。
4526.138	4530.045	祂讓我們不好的東西交給祂,但是呢,我們拿到好東西。
4531.152	4561.061	這邊的灰塵在以色列人過去的習慣裡面是他們碰到悲傷的事情他會把灰塵弄到頭上他們開心的時候在身上塗喜樂油我們看到神做這樣的轉換在他們的生命當中做更新做翻轉的一個工作使他們成為公益數 公益術它的意思也是領袖是強人的意思。
4561.061	4570.210	也就是神祂可以讓我們從這樣子悲哀的情境當中被翻轉而成為祂的榮耀。
4572.108	4588.461	這是何等讓人家欣慰的事情,而且我們覺得,天啊,神看我會是祂的榮耀,是祂可以栽植的一個領袖,祂何等的看重我。
4591.084	4627.348	我們看到61章的一到三節是我們身為神子民我們有什麼樣的使命接下來我們可以看到興起發光若是我們跟著神的腳步祂的呼召來走的話我們興起發光會有什麼果效第一個我們將可以看到生命的一個轉變 在接下來以色亞書的61章第4節裡面,先知描述了興起發光的人說什麼?
4627.348	4637.251	他說他們可以重建荒廢之地,可以修補被毀壞的誠意。
4637.251	4642.073	所以我們看到我們是可以成為神祝福人的工具。
4643.899	4658.967	我們不僅可以靠著神幫助我們身旁的人可以有外面的建造,我們可以幫助他們裡面的靈性剛強起來有內在的建造。
4658.967	4676.176	所以我們身為神的子民,身為神的孩子,身為神的仆人, 我們要用愛跟真理來改變這個世界,來關心我們身旁的神所帶給我們的人。
4676.176	4691.247	但是,當我們為著神,靠著神,興起發光的時候,我們不可以驕傲,因為那不是我們的本事,那是我們靠著神而有的。
4692.398	4707.704	是神祂成就了這一切,祂讓我們跟祂一起,以至於祂是光源,我們救著祂,我們就可以照亮別人,我們就可以影響別人。
4707.704	4740.133	從這個看到生命的轉變, 這個標題我就看到我們教會從2012年開始我們的SOZO服飾我們的SOZO服飾事實上看到許多人的生命因此而得到改變SOZO這個字在新約裡面事實上它出現了大概有100次 它的意思是什麼?
4740.133	4743.036	我們一起來看最後。
4743.036	4745.978	我給大家一個完整的意思。
4745.978	4748.341	我們可不可以一起來念。
4748.341	4752.244	使完全醫治恢復健康。
4752.244	4757.069	使某人從彌賽亞的審判中得釋放。
4757.069	4763.455	從阻礙人接受彌賽亞拯救的魔鬼手上得救。
4765.452	4773.397	所以我們看到ZOZO這個字,它就包括醫治、釋放、救恩。
4773.397	4779.540	它是聖經裡面唯一一個包括這三個層面的一個詞語。
4779.540	4788.085	它講到的是人的身、心、靈,可以透過這樣子的一個服侍的過程得到祝福。
4790.674	4798.420	那我覺得很榮幸的是,我有機會成為第一屆SOZO的學員跟服事同工。
4798.420	4806.826	我在整個服事的過程,我真的看到有很多人的生命得到改變。
4806.826	4810.609	就十幾年前我們剛開始做的時候,我們覺得我們可以做什麼?
4811.664	4816.048	但是,跟聖靈同工,真的可以做很多。
4816.048	4830.761	所以看到有些人,他們帶著很憂傷的一個眼神,然後有氣無力地走進我們要等待的區塊。
4830.761	4835.185	他可能攤在沙發上,一點力氣都沒有。
4836.493	4852.579	但是我們看到他接受完SOZO服飾,神的靈在當中動工,神親自的帶領,這些人有的,哇,真的看見,他走進服飾的房間跟走出去,他的臉完全不一樣。
4852.579	4858.638	他的臉放光了, 好像皮膚都變白了,很漂亮。
4858.638	4862.599	有的呢,還又唱又跳地跑出去。
4862.599	4867.641	後來,聽說他們的生命就得到很大的改變。
4867.641	4873.863	我覺得這個不是說我們可以驕傲什麼,因為都是聖靈在工作。
4873.863	4880.585	但是,有幸成為一個見證聖靈工作的人,真的很開心。
4881.971	4888.058	甚至有一些人他們接受過服侍之後他們的回饋。
4888.058	4892.403	他說,我感覺有一陣黑煙跑出去。
4892.403	4899.891	我感覺好像那個憤怒的門,或者是悲傷的門,就砰,他好像聽到那個聲音。
4903.319	4926.231	好像我腳上的鎖鏈啪一下被斷開,其實我是看不見,也沒聽到,但是我覺得在他們的敘述當中,因為他就是親身經歷,你就會看到哇,神奇妙的作為,真的是在他們身上,他就自己看到感覺到那個被釋放的過程。
4928.951	4949.727	也有人在被服侍的過程當中,好像捆綁他們數十年的那種自卑感、罪疚感,那種心頭的負擔被拿掉,或者是他藏在心裡面可能十幾年的傷痛被抑制。
4953.865	4967.889	他的過去不認識神的時候,可能跟偶像有一些的立約被撕掉,或者是他們被黑暗挾制,那個鎖鏈也被斷開。
4970.759	4976.944	家庭的關係被恢復等等,其實例子很多很多。
4976.944	4990.856	當我們看到有人被醫治,有人被釋放的時候,我們就會讚嘆神的工作真是美好,然後有神真好。
4990.856	4994.720	再來我們看我們的見證將影響人。
4996.527	5006.154	在《馬太福音》的5章13到16節裡面講,我們是神手中的光跟鹽。
5006.154	5015.542	我們是光的話,就不要放在斗底下,要放在燈台上,這樣子可以照亮一家的人。
5017.005	5028.251	當我們的光像這樣照在人前的時候,人看到我們的所作所為,他們就會把榮耀歸給我們的神。
