start	end	text
5028.251	5041.197	所以我們一般的人,我們在追求我們的名位的時候,我們可能要追求的是財富、地位或名譽。
5043.029	5048.651	但我們不是一般的人,我們是屬神的人。
5048.651	5063.117	我們屬神的人,我們要的地位就是為了要去服侍人,為的是要去成全人,去照顧跟牧養神帶到我們身旁的人。
5065.520	5136.636	所以當我們願意為神興起發光的時候旁邊的人會看說你們這個基督徒不太一樣因為神要我們是在人有困難的時候我們要來安慰他們帶給他們生命的盼望他說成為基督徒不是我們的生命就一帆風順沒有任何的風浪 而是我們在面對風浪的時候我們的反應不一樣我們的表現不一樣但是要做到這樣子我們必須要跟神有很深的關係很深的信任的關係所以一般人他會看到我們做出來的見證說你們基督徒好像有用不完的愛 或者是說,你們碰到難處的時候,你們沒有像一般人一樣在抱怨,在驚慌當中,而你們是穩的。
5136.636	5141.017	那到底是為什麼?
5141.017	5148.139	為什麼你們在這樣子的情況當中,仍然有喜樂,仍然有平安?
5148.139	5154.180	所以,我們做什麼,比我們說什麼更重要。
5156.220	5172.104	當我們願意因著神的緣故,我們去做,去反應,讓人家受到影響,看到有神的生命真是不一樣的時候,我們的見證就更加的有影響力。
5172.104	5176.365	所以我可以跟大家來分享幾個見證。
5176.365	5184.607	第一個見證就發生在我們教會,是我們現在的實習傳道,順心的身上。
5186.442	5192.264	他在十幾年前的時候為什麼會進入教會?
5192.264	5224.371	因為那個時候他的父親肝癌末期而他是一個做什麼就很認真的人他之前是拜佛他就拜得很認真但是那時候他覺得他的信仰好像沒有辦法給他真正的安心剛好碰到他的上司是我高中跟大學的同學 就給了他一本滿福寶,兩片CD,安慰他。
5224.371	5229.839	他就覺得心裡不太一樣,然後就自己來找教會。
5230.708	5235.651	他想要進到教會來看看到底有什麼不一樣。
5235.651	5240.014	這是他的一個生命的見證。
5240.014	5242.195	他也可以影響人。
5242.195	5249.139	那另外一個故事呢,是我要來講是有一本書叫做《上帝在哪裡》。
5249.139	5254.383	那這本書呢,原來是只有英文。
5254.383	5256.564	那為什麼它會後來有中文版?
5258.541	5261.984	這當中就有一個動人的故事。
5261.984	5271.994	那個故事是有一位中國的醫生,他到葉門去跳水。
5271.994	5275.258	跳水的地方叫做天堂谷。
5275.258	5282.085	結果一跳,頸椎受傷,全身癱瘓。
5284.258	5289.762	那個對他而言,原來是一個非常有成就,非常有能力的人。
5289.762	5292.985	對他而言,這是一個很大的打擊。
5292.985	5300.030	因此,從那時候開始,他跟他母親就一直想,他怎麼樣可以結束他的生命。
5300.030	5310.719	但這個時候,就有一個他的朋友是日本人,給他的一本書,那本書是英文的,是一位美國的基督徒叫熊尼寫的。
5312.329	5326.962	瓊妮也是在她很年輕的時候,18歲的時候,她因為有一個事故,她脊椎癱瘓,她沒有辦法動,被困在床上。
5328.592	5365.545	結果他靠著家人靠著教會的朋友靠著他自己讀經這樣子的過程讓他裡面的人就剛強起來他就有信心來面對他說我要精彩的活下去我不要卑微的死去因此他就寫了這樣子的一本自傳而這本自傳 叫這位中國的醫生,他叫張許。
5365.545	5368.686	他被打動,他感動了。
5368.686	5373.127	他說這樣子的一個生命,他可以活得這麼精彩。
5373.127	5380.169	他就用七年的時間在重病當中,他就把那本書翻譯成中文。
5381.391	5413.380	所以那本書它的書名叫《上帝在哪裡》但它裡面的內容不在問上帝在哪裡我到底你在哪裡為什麼讓我遇到這樣子的事情不是而它是在見證上帝真實的同在 因此這本書,它不斷的鼓勵殘障的朋友,在低谷當中的朋友,他們即使在黑暗當中,也可以活得精彩。
5413.380	5417.502	所以這個是一個見證影響他人的例子。
5419.036	5432.467	我最近也看到一個影片,也很感動,它這個見證是一個17歲的肯亞少年人所做、所活出來的見證。
5432.467	5433.928	是什麼呢?
5433.928	5457.430	他只有17歲,但是他成立一個基金會, 他成立這個基金會以後呢,透過這個基金會來籌款,來幫助當地他所遇到的有需要的人,窮人,給他們衣服,給他們食物,給他們遮風避雨的住處。
5457.430	5471.214	他甚至參加美國達人秀,然後呢,用一首詩歌, 讓全場被打動。
5471.214	5475.537	讓所有的評審一起按下那個鈕說過關。
5476.544	5484.886	他拿到一百萬美金,繼續可以救這些他旁邊,神帶到他旁邊的人。
5484.886	5492.889	所以我等一下放,請我們的PPT手幫我們放短短的精華的片段。
5492.889	5497.390	他唱的歌,歌詞我覺得很動人,但是太長了。
5497.390	5501.071	我可以念一小段給大家聽。
5501.071	5505.212	他的歌名叫做Promises,就是應許。
5507.125	5513.828	他一開始唱,亞伯拉罕的神,你是立約的神。
5513.828	5523.253	信實的應許者,一次又一次,你已證明了你會履行你所說的話。
5525.282	5533.629	儘管暴風雨來臨,風吹草動,我仍然堅定不移。
5533.629	5538.673	讓我的心學會當你說一句話的時候,它必定實現。
5538.673	5543.517	你對我的信實是偉大的,從日出到日落。
5543.517	5547.420	我要讚美你的名字,你對我的信實是偉大的。
5547.420	5550.102	我們一起來看這精彩的一小段。
5552.654	5580.349	The God of Abraham, the God of covenant, and faithful promises.Time and time again, you have proven, you do just what you said.Though the storms may come and the winds may blow, I remain steadfast. 我們一起來思想。
5580.349	5589.012	繁體中文，臺灣國語。
5667.227	5689.880	很感謝主,不管我們在什麼樣的位置上,不管我們的年紀多大或多小,我們都可以為神興起發光,成為榮耀神的見證。
5689.880	5702.163	第三點是我們將更多享受關係, 因著神要我們去成為別人的幫助,成為人的天使。
5702.163	5710.349	你當然要把你的心力跟時間放在神帶到你身邊的人。
5710.349	5716.053	你為他付出關心,你成為他的鼓勵跟天使。
5716.834	5728.207	神自然會改變,改變這個人,也讓你們的關係可以更進一步,更上層樓。
5728.207	5732.431	所以,神也會讓我們享受在關係當中。
5732.892	5740.674	一個人如果我們要活得健康,我們要靠關係感跟成就感都要平衡。
5740.674	5750.696	神透過這樣子我們付出的過程,用行動來幫助人的過程,也讓我們享受在關係當中。
5750.696	5756.037	第四是可以帶動社區、社會、國家的改變。
5757.910	5771.453	因為我們興起發光不僅是影響我們個人,影響我們的家庭,我們可以帶動整個社會跟社區,國家甚至的一個改變。
5771.453	5785.076	因為當我們一個一個起來為神興起發光的時候,這整個社會將因為神的愛跟神的公義片傳而有所改變。
5787.619	5796.387	所以我們要領人信主,我們要改變這個社會,我們必須要起來傳揚福音。
5796.387	5800.872	我們在韓國大地教會,看到這個教會真是不一樣。
5802.432	5855.677	他們一進教會就知道傳福音是我們的本分是我們教會非常重要的一件事情所以我們聽他們分享整個教會歷史的時候真的是非常的佩服他們從12個人他們教會只有12個人的時候就開始要大家出去傳福音 如果從一般人的角度來看才12個人我都好我這裡面的人慢慢的多一點我再說傳福音的是但他們不是他們12個人就開始往外傳福音他們有什麼他們就願意給什麼出去這是非常令人動容的事情當我們願意給的時候神就會給我們更多所以我們看到他們現在是一個10萬人的教會 他們每年可以拆派三千個人,到國外去傳揚福音。
5855.677	5862.219	他們幾乎是每一個弟兄姊妹,他就是一個福音使者。
5862.219	5870.862	所以我們在吃飯的時候,就看到旁邊就有人在做一對一的訓練,在上課。
5870.862	5874.243	然後那個尊榮文化在他們當中,我們真的是覺得非常的折服。
5875.691	5876.972	彼此的尊榮。
5876.972	5889.219	他們甚至有一個社會宣教的事工,他們鼓勵弟兄姊妹去找到有困難的人,找到需要幫助的人,去走進需要裡面。
5889.219	5909.690	這是我們要學習的,我們不是要獨善其身,我們要把神的 福音傳遞出去是因為我們領受了這麼多神美好的一個供應,祂的醫治跟釋放的時候,我們不要就把它放在自己裡面,因為你存久了就會不見了,神給你的恩典就會不見了,因為呢,神的法則是我們要給。
5910.350	5914.334	我們願意走出去的時候,祂就會給我們更多。
5914.334	5931.735	所以我們看到這個教會,它透過各樣的方式,它透過101的門徒訓練,它透過拆派宣教士,或者是透過鼓勵弟兄姊妹,你不是被拆派那個人,你就是 我們一起來思想。
5931.735	5933.155	繁體中文，臺灣國語。
5933.155	5934.876	繁體中文，臺灣國語。
5950.009	5965.906	每一個人如果願意為神所用,讓我們把福音視為己任,讓傳福音這樣子的一個事工成為我們的文化,我們的教會就會不一樣。
5968.183	5986.657	面對這樣子被好像疫情所困住,或者是有一些經濟的狀況所壓住,甚至我們好像因著跟對岸的關係不太穩定,而有許多的擔心在裡面。
5986.657	5993.422	這樣子的一個時局有很多的不容易。
5993.422	5994.783	但是你相信嗎?
5996.169	5999.232	神會帶領我們往前。
5999.232	6007.899	神會在這個困難的時刻,跟著我們,帶著我們寫使徒行傳的29章。
6007.899	6009.040	為什麼是29章?
6009.040	6012.563	因為在聖經裡面,我們只有28章,對不對?
6012.563	6015.286	29章就是要我們跟神一起寫。
6015.286	6019.009	你要它是精彩的,你就要動起來。
6019.009	6021.912	你就要願意,你就要願意走出去。
6023.012	6036.743	所以,剛才我們看到的以賽亞書60章61章的經節,神透過這樣的經節在鼓勵我們要興起發光,要為祂所用。
6036.743	6043.668	我們的教會需要我們每一個人,需要你跟需要我,每一個人都要站出來說我願意。
6044.309	6054.416	我願意貢獻我一己的力量,我願意來服侍我身旁的人,我願意為神走出去,來完成神的大使命。
6054.416	6068.986	不管是在你自己的家庭,在家族裡面,在社區,在社會,在國家,在你的職場當中,你都可以是一個有影響力的人,因為神已經,祂的光已經在我們的生命當中。
6069.206	6075.868	我們是可以願意站出來的時候,我們就可以為他興起,為他發光。
6075.868	6079.309	在這樣子黑暗的世代裡面,你的心有沒有被激動?
6079.309	6085.111	神要我們用愛,要用真理來影響旁邊的人。
6085.111	6091.773	我們對靈魂是不是有負擔,我們願不願意為這些的靈魂,我們多走一里路,我們多付出一點。
6095.282	6105.885	我們願不願意回應神的呼召,來重建荒廢的地方,為世人帶來盼望跟救恩。
6105.885	6110.187	這是我們要來思考,我們要來禱告。
6110.187	6116.189	我們願不願意來讓神帶領,做一個行道的人。
6118.968	6127.633	不要再一直把我們的眼光放在現在我們生命當中的難處上。
6127.633	6135.437	因為當我們看到神的愛,當我們看到神的偉大的時候,這些難處都已經不再是難處。
6135.437	6140.180	我們要像日葵一樣,像太陽花一樣,我們就是看著神。
6140.180	6143.141	看著神,我們就成為一位有光的人。
6143.141	6148.244	看著神,所有的黑暗就在我們的後面,沒有辦法影響我們。
6151.323	6154.207	所以我們願意為神所用嗎?
6154.207	6159.073	我們願意用我們的愛來服侍別人嗎?
6159.073	6164.120	我們願意用神的真理來彰顯祂的公義嗎?
6164.120	6165.502	或者是去憐憫?
6167.961	6172.705	去照顧神帶到你身邊有需要的人。
6172.705	6183.373	當我們願意的時候,他們的生命的傷口被清掉,他們再一次的活跳跳的起來的時候,他們就可以為神所用。
6183.373	6186.335	就可以成為一個神過的精兵。
6186.335	6192.320	就可以成為你生命故事當中,你的使徒行傳29章的一則故事。
6196.067	6211.972	我們最後要提醒大家的是,神要我們興起,要我們發光,不是為了自己,而是為了榮耀神,而是為了祝福神帶到我們身邊的人。
6211.972	6212.752	我們一起來禱告。
6214.872	6223.216	是的主,我們感謝讚美祢,我們真的是需要祢的恩典跟祢的幫助。
6223.216	6236.063	謝謝祢呼召我們興起發光,求祢賜下聖靈的力量和智慧,讓我們可以成為祢的見證,彰顯祢的榮耀。
6237.688	6249.033	幫助我們在黑暗當中,成為光明的明燈,來帶領那些失散的靈魂回到你的懷抱。
6249.033	6262.439	求你塑造我們成為有愛心,願意關懷人的人,讓我們可以跟人建立真摯的關係,帶領他們認識你。
6265.862	6281.706	幫助我們每一個人成為被祢裁判的人,去重建荒廢的地方,修補毀壞的關係,為這個世界帶來祢的恩典和救贖。
6281.706	6286.968	我們的禱告奉耶穌的名,我們一起說,阿們。
6286.968	6290.869	阿們,我們拍著馬榮,感謝貴給我們的神。
6294.326	6322.725	來 告訴你 可不可以說我們要興起發光我們要興起發光但是你有沒有光63跟61章告訴我們一個道理就是真正會發光的是上帝上帝好像太陽祂會發光所以神總是叫我們做光做眼沒有叫我們發光發眼 發炎不太好,發光也發不了,只能做光為什麼?
6322.725	6332.748	因為上帝好像太陽在發光,然後我們像月亮,就是來造出上帝在我們生命中,照亮我們的生命。
6332.748	6356.736	因此我們來想像一下,好像上帝是發光的太陽,然後我們是能夠來彰顯出神的榮光的那個月亮, 好讓地球上在黑暗遮蔽大地裡面的人,可以在黑暗當中,可以看見光,看見亮光。
6356.736	6361.799	我們像上帝是太陽發光,我們是月亮做光。
6361.799	6364.840	然後呢,黑暗中的人看見了光。
6364.840	6366.121	有押韻,感謝主。
6366.121	6368.222	我們講一次。
6368.222	6372.203	好,這個上帝是太陽發光。
6372.203	6373.504	上帝是太陽發光。
6373.504	6375.265	我們是月亮做光。
6375.913	6377.314	我們是月亮做光。
6377.314	6378.776	黑暗中的人看見了光。
6378.776	6382.459	黑暗中的人看見了光。
6382.459	6390.867	感謝主,這樣子才能夠到61章裡面,上帝透過祂高摩我們,祂的靈高在我們身上。
6390.867	6393.950	我們才能夠向別人報告這個好消息。
6393.950	6397.414	上帝能夠讓我這個瞎眼的,現在可以看見。
6397.654	6402.676	讓我這個生命原本是被關在監獄裡面的人,現在可以釋放得自由。
6402.676	6404.237	你看看我,看看我。
6404.237	6408.759	所以你也可以,因為上帝也要照亮你的生命。
6408.759	6409.420	阿們。
6409.420	6410.780	感謝主。
6410.780	6412.701	但是月亮常常不見了。
6412.701	6413.842	月亮會不會不見?
6413.842	6417.744	你知道月亮一天裡面有12小時不見。
6417.744	6418.444	去哪裡?
6418.444	6420.985	因為月亮常常會躲在地球後面。
6420.985	6422.446	你知道嗎?
6422.446	6424.087	我們也會常常想要躲起來。
6424.855	6426.717	你同意嗎?
6426.717	6428.239	所以基督徒也是怎麼樣?
6428.239	6431.623	有時候會想要躲起來,會逃避。
6431.623	6433.225	但是我們需要怎麼樣?
6433.225	6437.690	再次來靠近神,讓神的光再次照亮我們。
6437.690	6441.574	我們才能夠讓神在我們生命中的光,也去照亮其他人。
6441.574	6443.016	阿們。
6443.016	6449.346	所以你這個月亮逃避上帝, 我們都蠻常發生的。
6449.346	6453.289	所以我們也不要就這樣子害怕。
6453.289	6455.190	因為神知道我們的軟弱。
6455.190	6456.511	所以我們一起來唱這首詩歌。
6456.511	6457.832	然後我們一起來禱告。
6457.832	6459.854	來回應今天的信息好不好。
6459.854	6463.236	因為我們總是要回到與主相遇的那個原點。
6463.236	6466.599	總是要回到主愛我們的十字架。
6466.599	6467.700	我們一起起立好不好。
6467.700	6468.740	我們請敬拜團隊。
6468.740	6469.861	我們用第三首詩歌。
6469.861	6471.442	我們一起來敬拜。
6471.442	6474.424	然後我們一起來向神有一個回應的禱告。
6474.424	6475.025	哈利路亞。
6476.067	6482.250	我就是不能明白。
6482.250	6486.852	你為何不會鬆開手。
6486.852	6496.216	總在我無助的時候對我說。
6498.166	6508.249	你還愛我,我總是無法想像。
6508.249	6513.630	耶穌為我是在釋迦。
6513.630	6525.680	我的罪如此的深,但你的慈愛, 神的完全。
6525.680	6533.022	不會忘記那是祢的答案。
6533.022	6539.445	祢拯救我脫離的一切。
6540.725	6546.731	我是如此不累,你愛很難貼。
6546.731	6553.778	沒有你,我生命不可能完結。
6553.778	6559.524	主,我愛你,生命獻上給你。
6559.524	6563.808	為你而活,生命才有意義。
6566.698	6581.645	你為我而死﹐我只願為你活﹐不會放棄﹐永遠不分離。
6581.645	6591.069	東離西有多遠﹐我的腿全身也甜蜜。
6594.923	6617.797	每一顆月亮不要再逃避太陽,神的愛再次吸引我們,來到十字架前面,讓主耶穌的愛赦免、醫治、扶持和呼召,再次帶領我們成為做光、做眼的人。
6617.797	6626.522	黑暗遮蓋大地,有很多人需要出監牢, 很多人的生命需要能夠再一次的看見盼望。
6626.522	6629.544	有很多人的生命需要離開一切的瑕疵。
6629.544	6635.067	因此弟兄姊妹，我們不要再躲避上帝。
6635.067	6638.049	說神啊我在這裡。
6638.049	6640.891	神啊我回到祢的面前來了。
6640.891	6640.971	謝謝主。
6640.971	6646.635	從來沒有忘記過在十字架前面與祢相遇的那一天。
6646.635	6649.137	是祢帶我走出了監牢。
6649.137	6652.099	使我重新看見哈利路亞。
6653.234	6660.298	我不會忘記認識祢的難點。
6660.298	6666.502	祢拯救我脫離的一切。
6666.502	6672.766	我是如此不配,離愛的能感解。
6674.070	6689.870	向神把我們手舉起來,再一次敞開我們的生命,讓祂的光照進來在我們裡面,生命才有意義。
6692.210	6715.596	我们同声开口为自己来祷告,求主耶稣的爱,再一次来照亮我的生命,再一次来充满我,说我愿意回应祢,再一次成为光成为盐, 神啊 讚美祢。
6715.596	6719.137	讓我們不斷的回到祢十字架的救恩裡面。
6719.137	6725.558	充滿我,醫治我,呼召我,教導我,建造我。
6725.558	6727.519	謝謝主,開口向神來禱告。
6727.519	6732.200	哈利路亞,開口向神來禱告。
6732.200	6733.260	是的,主,我們讚美祢。
6733.260	6737.721	每一個在祢面前的弟兄姊妹,要像一顆月亮一樣,再一次的領受祢的光。
6737.721	6750.249	即便我們這個月亮的表面坑坑巴巴,裡面有很多 但當祢的榮光再次照亮我們的時候,神啊,我們就可以與祢同工,可以與祢同行。
6750.249	6757.654	我們生命中的幽暗,被祢的光明,被祢的得勝所取代。
6757.654	6761.898	是的主,麻怪要代替灰塵,喜樂又要代替憂傷。
6763.439	6766.722	公義樹要取代我生命中的羞恥。
6766.722	6772.407	謝謝主,讓我再次成為像月亮一樣,被你照亮的生命。
6772.407	6777.832	好像我周遭的人看見,神在我生命中的恩年,他們就歡喜快樂。
6777.832	6784.938	他們就說,我也要,我也要, 來認識這位賜人生命有恩典的神。
6784.938	6796.367	謝謝主,讚美主,再次使用我們的生命,成為一個跟著神往前走,跟著神繼續能夠在地上做光做眼的生命。
6796.367	6802.352	謝謝主,讚美你,讓我不斷地回到你十字架的恩典裡面。
6802.352	6805.795	奉耶穌基督的名祷告,讓我們一起說阿們。
6806.135	6810.976	弟兄姊妹們平安，我們一起來關心教會的大小事。
6836.681	6843.523	有沒有第一次來教會聚會的新朋友,可以舉舉手,可以在桌子上揮揮手,可以站起來。
6843.523	6846.944	歡迎,一次歡迎,永遠歡迎。
6846.944	6848.785	願單張教會成為你屬靈的家。
6857.363	6864.828	我們有為新朋友準備一些精美的小禮物,就有紀念筆或USB隨身碟,然後還有精美L夾。
6864.828	6867.570	下一張。
6867.570	6870.272	好,這是我們電子週報的QR code。
6870.272	6875.435	所有課程的連結跟活動,詳細的資訊都會在電子週報。
6875.435	6879.638	所以請每位弟兄姊妹務必要有這個電子週報的網頁。
6879.638	6885.142	所以不會操作的可以到,主日會後可以到一樓櫃檯請同工協助掃描。
6885.142	6885.582	好,下一張。
6887.022	6908.131	六月二十二號還有二十三號因為端午節連假關係所以放假兩天然後還有六月二十三號禮拜五的復興禱告會也是暫停一天所以大家要記得不要跑來好 下一張 我們每週晚上的八點到九點都有這個淡江教會的禱告會。
6908.131	6913.776	願我們都成為那個禱告的柴火,一起眺望淡江教會禱告的烈火。
6913.776	6920.542	如果不會禱告,真的是可以來在當中體驗,來操練,讓我們真的是禱告的生命越發的成長起來。
6920.542	6921.623	好,下一張。
6924.002	6945.540	在6月25號還有7月2號有一個壽喜課程所以歡迎大家可以邀請身邊還沒有壽喜的朋友然後可以讓他們來參加然後我們正式的壽喜典禮會在7月9號舉行 我們今天主日會後,在淡海堂我們有醫治式的活動。
6945.540	6949.683	我們有圖卡、繪畫還有醫治的禱告。
6949.683	6952.365	歡迎弟兄姊妹可以來體驗,一起來禱告。
6952.365	6965.834	我們今天先日慶團隊的同工,我幫大家領受一幅畫。
6965.834	6967.055	我分享一下經文。
6968.422	6974.946	在路加福音的4章26到27節,然後我唸給大家聽。
6974.946	6984.912	又說,神的國如同人把種撒在地上,黑夜睡覺白日起來,這種就發芽漸長,那人卻不曉得如何這樣。
6985.981	7011.834	我領受的就是,弟兄姊妹,如果你在一些的困難或軟弱,或覺得自己很有限,好像現在的處境是覺得自己很軟弱很有限,那真的是要定心在神,要把自己的生命交託給神, 讓自己的生命真的是可以勇往直前,不要一直定睛在軟弱或者是缺乏或者是挫折當中。
7011.834	7019.216	雖然環境好像讓自己覺得好像很失敗什麼的,但是就是定睛在神勇往直前,向著標竿直跑。
7019.216	7025.158	可能一段時間你回頭看,你生命不知不覺成長了,你的福祉也不知不覺被擴張了。
7025.538	7041.008	所以就是要真的是定心在神,如同鴿子眼定心在神的這個裡面,把自己的生命交托給神,你的生命會不知不覺的在神的掌權,聖靈的工作裡面成長起來。
7041.008	7047.373	如果弟兄姊妹有需要祷告的主日結束,我會在面對舞台的左側為大家祷告。
7055.708	7056.314	下一張。
7058.456	7087.750	我們等一下主日會後在12點還有1點到1點半的時間,然後在7樓我們有邀請到魏俊凱還有王欣怡夫婦,然後會跟我們分享見證,然後就是分享他們在經歷各種困難,然後神如何讓他們重新回到神的面前,然後陪伴他們,然後就是歡迎大家可以去參加,然後我們以後有被有侵蝕,所以鼓勵大家多多參與。
7088.541	7095.389	我們愛樂廚房有推出這個沙崙玫瑰與古中百合的香水瓶。
7095.389	7101.115	玫瑰有分紅白紫色,還有百合的香氣。
7101.115	7106.882	如果你要買單瓶的話,一件是590元,還有自由配任選兩支特價是880元。
7108.183	7115.348	如果你想要每種玫瑰香氣的顏色都買的話,特價是1190元。
7115.348	7121.252	如果你想要再加一個百合的香氣的話,行家價是1520元。
7121.252	7124.974	歡迎大家主日會後可以到愛樂書房試聞選購。
7124.974	7135.021	這個淡江教會會有資料填寫的部分,我們請李昱牧師來跟我們解說。
7136.578	7148.764	好,我們看到有會員資料填寫,這個是我們在一個一個堂會要建造的過程當中,我們更需要提早一化我們的會員資料。
7148.764	7155.567	所以呢,為什麼要填寫這個會員資料,我們可以看一下,往下看幾個問題。
7155.567	7162.310	第一個呢,我們以前是可能用紙本的一個系統,或者是我們用Google或其他的一個表單。
7162.790	7187.492	那這些的表單它裡面的資料我們填上去之後我們都不知道會不會有外流的一個狀況那如果是我們自己的會員系統的話我們這些的資料就不會外流我們只有公教會裡面的使用來 再下一張 然後誰會看到你所填的資料。
7187.492	7190.694	我們小組員填的資料,小組長可以看到。
7190.694	7192.935	小組長的資料,區長可以看到。
7192.935	7194.797	區長的資料,區牧可以看到。
7194.797	7196.558	所以一層一層的這樣子把關。
7196.558	7200.561	我們不會把資料隨便就流傳出去。
7200.561	7200.721	再來。
7202.756	7205.498	這有什麼方便性?
7205.498	7217.930	就是以後呢,我們如果要報名教會的任何的系統或參加什麼活動的時候呢,我們只要掃QR code或者是填寫我們的名,就是用我們的名字就可以把所有的資料叫出來。
