start	end	text
7217.930	7224.055	我們不用重複填寫這些的資本資料,可以省去很多的時間。
7224.055	7224.135	再來。
7225.452	7226.392	往下一張。
7226.392	7235.497	再來呢,在裡面,我們所有的會友資料的系統裡面,就會有您參與各樣活動或是課程的資料。
7235.497	7238.298	那我們一調,就是一調出來就可以看到。
7238.298	7245.362	那您的小組長,也可以因此而看到你的進程,你可能在哪一方面需要補強等等。
7245.362	7249.344	那你自己需要了解的時候,你也可以看到的。
7252.022	7256.786	再來,我們教會的意象就是要拓殖堂點。
7256.786	7263.211	在拓殖堂點的過程當中,我們需要許許多多的弟兄姊妹一起來,大家一起往前進。
7263.211	7275.001	我們可以透過這樣的系統,我們也了解弟兄姊妹的狀況,知道我們可以由哪一些在某一個區塊一起往前跑的這些弟兄姊妹。
7276.596	7297.002	我們待會若是你在小組裡面還沒有填到資料表或者是您還沒有參加小組我們的弟兄姊妹請到一樓或二樓拿我們的A5有一個A5的表格 麻煩大家填一下。
7297.002	7306.670	然後呢,一樓有一個專門放會有資料的一個玻璃,不是玻璃,那個好像是塑膠的透明箱,你就把它放進去。
7306.670	7315.037	那二樓的話,我們是放在二樓櫃台,空白的表格填完之後,我們就放在我們那個美美的奉獻箱裡面。
7315.037	7316.818	我們就把它投進去。
7316.818	7320.421	麻煩大家多一個動作,我們大家都受益。
7320.421	7323.244	接下來我們把時間交給我們的裝牧師。
7329.155	7334.461	不好意思,換一個輕鬆一點的音樂。
7334.461	7337.084	太感性了。
7337.084	7341.989	我要招募一批人。
7341.989	7343.671	輕鬆一點。
7343.671	7345.293	老王,輕鬆一點。
7348.012	7357.359	我要招募一些可以做交通指揮的特工隊。
7357.359	7360.041	請待會到一樓去報名。
7366.305	7370.949	我先講一下交通的問題,主要就是停車問題。
7370.949	7378.475	丹海新市鎮當初規劃的時候蠻特別的,路邊幾乎都沒有規劃停車位。
7378.475	7382.058	好像是丹海新市鎮的人都不會有親戚朋友來看他。
7384.360	7387.161	我不知道為什麼他都不規劃停車位。
7387.161	7392.324	然後很多的道路旁邊不是黃線就是紅線,根本就不能停車。
7392.324	7395.566	所以我們也是很苦惱。
7395.566	7398.527	我們已經很努力地地下挖了兩層蓋停車場。
7398.527	7403.390	還租了一塊地,也把它蓋成停車場。
7403.390	7407.592	大概可以容納九十台車子,但是我們都知道還是不夠。
7407.592	7411.594	所以我們需要解決一些問題,因為樹大怎麼樣?
7412.841	7414.842	遭風,真的。
7414.842	7418.525	你去別的社區,隨便看有人停黃線,都沒事。
7418.525	7420.987	只要是我們就會有事。
7420.987	7424.329	立刻就會傳到細縮淡水,什麼有的沒有的。
7424.329	7428.452	里長辦公室、警察局都會接不完電話,就是比較被針對性。
7428.452	7445.246	所以要跟弟兄姊妹溝通一件事情,只要是我們地下室跟平面的停車場停滿了, 您就是得需要停到後舟路那裡去,或是需要停到水管公園那裡去,海邊那裡。
7445.246	7448.610	我是一直禱告說,我們斜對面不是在整地嗎?
7448.610	7453.455	其實我看見它那個地方裡面,進去是有很多地方可以停車的。
7453.951	7459.533	可是我不知道營建署什麼時候可以開放,讓車輛可以進去停車。
7459.533	7460.954	那邊至少可以停一百台。
7460.954	7462.955	我們就看神有沒有這樣的恩典。
7462.955	7468.417	上次我跟內政部長有提到,那個地方可不可以讓我們停車。
7468.417	7470.138	他說可以再討論。
7470.138	7471.939	我希望神為我們開路。
7471.939	7479.182	所以我想要招募有一些弟兄姊妹,你就是很勇猛,刮風下雨你都不怕。
7479.582	7482.823	那一個禮拜大概只有差不多兩三位。
7482.823	7484.243	大概用輪班的方式。
7484.243	7486.483	然後這邊。
7486.483	7490.024	其實就是引導弟兄姊妹說。
7490.024	7491.425	就是不要停路邊。
7491.425	7493.945	或是說地下室還有位子。
7493.945	7495.025	我稍微提一下。
7495.025	7498.426	有沒有一些同工是登記停地下室的。
7498.426	7500.606	提早有登記的。
7500.606	7502.047	我做一個新的調整。
7502.047	7503.407	七月份開始。
7503.407	7505.668	請你登記地下室停車的。
7505.668	7507.328	你九點四十以前一定要進來。
7508.643	7511.785	不好意思,因為現在車位很寶貴。
7511.785	7513.327	9點40以前,你一定要進來。
7513.327	7515.188	因為我預設你會來參加會前禱告。
7515.188	7517.690	你是服侍同工嘛。
7517.690	7520.492	所以我預設你會參加會前禱告。
7520.492	7523.034	會前禱告是幾點?
7523.034	7523.234	9點50。
7523.234	7526.577	所以你9點40聽好這三個廁所。
7526.577	7527.697	來,9點50會前禱告。
7527.697	7528.138	合理嗎?
7528.138	7529.759	我覺得蠻合理的。
7529.759	7539.786	所以呢,9點40以後,你沒有進來,我就把剩下的空位,地下室空位讓給 還沒有車位的弟兄姊妹。
7539.786	7543.008	所以指揮交通他要蠻技術性的。
7543.008	7547.210	需要配合說,欸知道說9點40以後我下面還有幾個位置。
7547.210	7548.530	寸土寸金啊。
7548.530	7551.592	不然他就可能要停到後舟路去了。
7551.592	7552.813	或是水管公園。
7552.813	7555.194	如果天氣不好他走過來蠻辛苦的。
7555.194	7555.454	可以嗎?
7555.794	7559.918	所以待會有心要跟我一起有這個革命情感。
7559.918	7562.020	我沒事我也會去指揮。
7562.020	7565.363	有看到主任牧師在那邊指揮。
7565.363	7570.088	第一個提醒弟兄姊妹只能停停車場。
7570.088	7576.274	有人問我說我們的大門口沒有黃線可不可以停車。
7576.274	7580.138	其實那是因為我們蓋好之後沒有把黃線騎回去。
7582.910	7584.651	那個一樣可以被開單的。
7584.651	7585.692	真的,我沒有騙你。
7585.692	7589.214	第二個,因為凱丁湖路很窄。
7589.214	7590.475	公車很大。
7590.475	7592.877	路邊只要有停,會車就會有問題。
7592.877	7596.199	我們保證又會上那個吸收淡水。
7596.199	7596.819	你知道嗎?
7596.819	7598.340	我們都是被放大檢驗。
7598.340	7628.088	那因為有些... 弟兄姊妹還不知道這個原因以為說神特別恩待淡江教會這門口就是白線不是 是我們沒有騎回去所以牧師再重申一次大門口我們不停車好不好大門口不停車因為很多人不知道以為可以停大門口不停車周邊不停車機車起停大門出去之後左前方有很多機車格 繁體中文，臺灣國語。
7628.088	7630.550	繁體中文，臺灣國語。
7651.323	7655.427	請大家踴躍來填這個會友的資料。
7655.427	7665.656	我是說真的,因為我們太多各單位自己用那個什麼表單,你填下去的資料被送到哪裡我真的都不知道。
7665.656	7667.898	所以我們現在自己創一個封閉系統。
7668.882	7680.974	我們自己創一個封閉系統,只要透過我們教會設的QR Code進來的,你的資料不會到外面,只會到裡面,除非有一個人把你的資料盜賣,這個人叫莊玉明,懂意思嗎?
7680.974	7682.315	所以他是非常安全的。
7682.315	7687.200	他剛剛講一大堆什麼,誰可以往下看,沒事不會看,你知道嗎?
7687.200	7687.700	什麼時候會看?
7687.700	7688.781	想徵召人。
7689.582	7695.484	他有什麼特殊的才能恩賜,我們才會進去用電腦抓,不會沒事進去看的。
7695.484	7706.828	再來他這個裡面,他有一些個資上我們的一些保護,例如說你地址,你不想讓別人知道你住哪裡,因為很多仰慕者會去偷偷看你。
7706.828	7715.833	你就只要寫新北市淡水區, 勘定五路,後面統統不要填就好了。
7715.833	7718.555	整條勘定五路都是你家,這樣好不好?
7718.555	7721.058	所以不太需要擔心什麼這些東西。
7721.058	7724.721	那其他的都是跟活動報名、保險有關。
7724.721	7728.685	手機、姓名、身份證,這個都是跟保險有關的。
7728.685	7730.967	不然你每次都要重填一次,真的非常麻煩。
7731.203	7735.744	上這個課也填一次,去郊遊一次,烤肉又填一次,你都快煩死了。
7735.744	7755.670	所以我們希望說,我們所有的人都進這個會員系統,這樣可以幫助你,我們直接電腦就可以幫你做記錄,你每一次參加的每一個裝備課程,參加的每一個特會,都會幫你留下記錄,你自己可以隨時進去看,你在淡江教會的成長記錄,它就是這麼方便。
7755.670	7763.373	我們現在先幫大家,就是你填資本資料,我先幫你建檔, 以後就一切都很方便。
7763.373	7763.814	可以嗎?
7763.814	7765.815	大家在這裡響應好不好?
7765.815	7767.936	不要就是miss掉好不好?
7767.936	7771.898	好,我們一起來領受從神的祝福跟裁判。
7771.898	7774.600	讓我們一起說阿們。
7774.600	7777.161	哈利路亞,感謝神。
7789.616	7792.959	愿神祝福每一位弟兄姊妹,继续做光做颜。
7792.959	7793.820	阿们。
7793.820	7799.966	好,我们今天聚到这边,愿神祝福大家,所有的影音敬拜团队留在原地。
7799.966	7800.566	影音。
7816.681	7853.838	繁體中文， 我們一起來思想。
7853.838	7868.671	繁體中文，臺灣國語。