start	end	text
1.169	6.932	很高興可以再次被邀請回到淡江教會,跟大家一起來學習神的話語。
6.932	13.076	時間過得非常快,我們已經結束了2020年,進入2021年。
13.076	20.800	過去一年我想是非常痛苦的,但是神保守臺灣,讓我們還可以實體的敬拜神。
20.800	23.722	同時我們的神訓本身也可以有實體的課程。
24.002	37.831	的確神保守,特別看顧這個世界,讓這個疫情本身很快的可以停下來,讓這些疫苗本身可以很快的、大幅度的被使用。
37.831	47.938	那麼今天早上跟大家來思考,就是路加福音的第十一章這邊的第一節跟第四節,跟大家來了解到底什麼是真禱告。
48.558	54.122	很多時候我覺得傳道人沒有得到他應該得到的尊重。
54.122	57.544	很多時候我們覺得說做傳道蠻簡單的。
57.544	62.347	禮拜天講一篇道,週間沒有人知道。
62.347	65.910	如果天氣好的話,他可以選擇去探訪弟兄姊妹。
65.910	70.313	如果天氣不好的話,可以在家裡面問弟兄姊妹來禱告。
70.313	74.575	我想這樣對禱告的了解是非常有問題的。
74.575	78.338	同時為服事的了解也是非常有問題的。
78.558	159.408	我不得不跟大家坦承我個人的祷告生活是斷斷續續的不太容易像瑪利亞蹲在耶穌面前好好的來聆聽耶穌所教導的很多時候我覺得我的祷告生活像什麼呢像我是抓到那個捉襟的角落但是沒有辦法持續的做下去但是當我看到耶穌的祷告生活的話祷告是祂整個生命的核心 對我來講禱告是尊讚的準備但對耶穌來講禱告就是尊讚這就是尊讚耶穌本身不是在彼拉多加的長廊祂留下大雪點滴在地上祂甚至也不是在盤燈這個加略山的時候祂留下大雪點滴在地上祂乃在可西馬尼恩禱告的時候祂留下大雪點滴在地上 我想大家如果有機會跟著耶穌跟著門徒到的那個地方就是可西馬里看耶穌禱告你們會覺得說這個人的確沒有什麼用當他面對那麼大的一個挑戰他只會做一件事情就是禱告 其實我們知道說當這些兵丁來捉拿耶穌的時候,反而這些門徒們都逃走了,耶穌就在那裡坦然無懼的來面對這些捉拿祂的這些兵丁。
159.408	169.617	因此今天早上非常合理的在這個新的一年開始的時候,跟大家一起來思考就是路加福音的第11章這邊的第1節到這邊的第4節。
169.957	176.863	这个时候我们来看一下神的话语如何教导我们,透过这个经文来帮助我们来学习祷告。
176.863	188.732	请大家看这个经文,这边的第一节这样说,耶稣在一个地方祷告,祷告完了,有个门徒对他说,求主教导我们祷告,向约翰教导他的门徒。
189.633	194.495	这里看到说,弟兄姊妹﹗我们看到说,耶稣在祷告,有门徒们在观察。
194.495	203.059	这里应该是一个门徒中间的代言者,他就来要求耶稣说,主啊,教导我们如何来祷告。
203.059	211.763	这个要求里面,弟兄姊妹﹗我看到两件事情,看到第一,在约翰的门徒训练里面,祷告是非常重要的。
211.763	217.886	不但这样子,我们看到说,这里门徒们要求耶稣说,主啊, 教導我們如何來禱告。
217.886	224.010	我们会想说这些门徒们已经跟随主将近三年,他们应该会禱告。
224.010	228.532	为什么这个时候才要求耶稣说,主啊,教导我们如何来禱告。
228.532	232.835	门徒们没有要求说,主啊,教导我们如何来赶鬼,没有。
232.835	237.537	耶稣的门徒们也没有说,主啊,教导我们如何来医病,也没有。
237.537	242.220	耶稣的门徒们也没有说,主啊,教导我们如何让五千个人吃饱,也没有。
242.500	311.723	这里看到说耶稣的门徒要求耶稣说主啊教导我们如何来祷告弟兄姊妹如果祷告是可以教的话祷告是可以学的不晓得大家有没有学过祷告我在神学院教书将近三十年我们知道说其实我们从来没有开过一门课教导我们学生如何来祷告我们都觉得说这些准传道门他们知道如何来 但是你看到說門徒們就要求耶穌說主啊教導我們如何來禱告我想你會要求一位達人一位專家來教導你要學的東西如果你要學習如何打高福球我想你會請為高福球的教練來教導你如何打高福球 这里看到说门徒们要求耶稣说主啊教导我们如何来祷告耶稣知道说祷告应当在门徒们的生命当中祂就会回应门徒 教導他們如何來禱告。
311.723	315.465	這個禱告往往被稱為是主禱文。
315.465	456.550	弟兄姊妹跟大家報告一下這個是一個誤稱不應當把它稱為主禱文但是我想這個事實不太容易改變因為你看我的印象這個就是主禱文甚至有很多牧師在祂的禱告會的結束的時候說我們用耶穌的這個禱告來做我們的這個聚會的結束甚至有把主禱文用毛筆字寫一寫貼在我們牆壁上 所以因此你看我的理解就是這個是一個主導文但是跟大家了解一下這個禱告不應當把它稱為是主導文為什麼不應當把它稱為是主導文的因為這裡有些的祈求是這位沒有犯罪的耶穌祂不需要這樣祈求這裡一個祈求說赦免我們的罪因我們赦免凡虧欠我們的人 基督耶穌是那位無罪的救主祂不需要這樣跟天父祈求赦免所以這個禱告不應當把它了解成為這個主導文這個禱告不會是主耶穌的禱告這個禱告我想是一個比較好的稱呼把它稱為是門徒的禱告這個禱告是基督耶穌教導門徒們的那個禱告 这个祷告弟兄姊妹是一个祷告的典范这个祷告也是一个祷告的大纲如同我眼前的讲道的大纲引导我讲道的这个内容这个祷告要引导大家如果在神面前跟神来祈求这个祷告不是我们在主路学里面教导我们的孩子让他可以背下来当他有需要的时候就跟神说两句弟兄姊妹不是这个祷告在表达我们跟天父的那一个特别的关系 那么到底耶稣在那一天如何教导门徒们来祷告呢这个是我们就来看这个经文的第二节耶稣说你们祷告的时候要说弟兄姊妹请问一下你们祷告的时候在说什么 很多時候你看我是想到什麼就說什麼不是嗎很多時候我們把禱告了解成為一種說話的方式我們覺得說禱告說的精彩禱告就精彩所以因此很多時候我聽我的學生禱告的時候就聽到說他是某某教會出來的那個學生他有那個教會那個牧師禱告的口氣我不曉得淡江教會的弟兄姊妹你們禱告的口氣是不是跟教牧師的禱告口氣是不是一樣的 但是我聽我的學生祷告就知道說他某某台北什麼堂的教會的牧師就這樣祷告耶。
456.550	460.733	弟兄姊妹很多時候我們把祷告當作是一種說話的方式。
460.733	463.855	但弟兄姊妹祷告不是一種說話的方式。
463.855	466.136	祷告同時也不是一種思想的方式。
466.136	467.697	不是我們思想的經常。
468.677	487.827	我们祷告就精彩很多时候我们看到说很多弟兄姊妹祷告他从创世记祷告到启示录他的祷告里面包括好多的说教其实弟兄姊妹祷告不是一种思想的方式那到底祷告是什么呢基督耶稣说我们祷告的时候要说我们在 天上的父。
487.827	491.269	弟兄姊妹這個是你和我最容易不小心的地方。
491.269	493.891	這個是你和我最容易大意的地方。
493.891	496.973	這個是你和我容易最不重視的地方。
496.973	500.656	很多時候你看我祷告不是從天父開始。
500.656	503.218	你看我祷告是從我個人需要開始。
503.218	504.379	主啊我要這個。
504.379	506.080	主啊祢祝福這個。
506.080	507.641	主啊祢醫治我這個。
507.641	508.622	我我我我我。
509.480	766.909	我们祷告很多时候是从我自己的需要开始但基督耶稣告诉我们说所有的祷告应该从神开始所有的祷告都是神为中心的祷告所以耶稣告诉我们说我们祷告的时候一开始的时候应当非常简单的非常容易的非常舒畅的从我们嘴巴里出现那句话我们在天上的父 弟兄姊妹我們知道說在Jewel裡面我們找不到一個例子屬於神的人到神面前禱告的時候說我們在天上的父大衛沒有這樣禱告丹利沒有這樣禱告亞伯拉罕沒有這樣禱告他們禱告的時候沒有說我們在天上的父神 甚至於我們知道說到了新約到新約的時候我們看到說其實我們可以找到275個例子弟兄姊妹對不起我沒有算過有人算過有275個例子當屬於神的人到神面前禱告的時候祂們就說我們在天上的父為什麼呢因為主耶穌基督的緣故祂讓你和我禱告的時候可以說我們在天上的父神 甚至於我也知道說有些弟兄姊妹他們禱告的時候沒有辦法很容易說我們在愛天上的父為什麼 因為他從小沒有爸爸因為他爸爸是一個常常不在家的爸爸或者爸爸是一個喜歡賭的爸爸或者爸爸是一個喜歡嫖的爸爸所以因此他禱告的時候沒有辦法很容易說我們在愛天上的父神 但弟兄姊妹不管怎麼樣不管我們地上的父親是怎麼樣但是我們只要說是主耶穌基督的緣故祂讓你向我禱告的時候可以說我們在天上的父神 前幾年在這個丹麥丹麥的首都這個哥本哈根他們在展覽一個鐘這個鐘據我了解耗盡百萬美金所製造的鐘這個鐘本身非常昂貴但這個鐘本身也非常的準據我了解這個鐘本身它每兩百年時間才需要調它時間一致每兩百年這個鐘本身會落差五分之二秒非常準 不但這樣子這個中不但貴不但準通這個中本身也非常的複雜祂可以告訴我哪一秒哪一分哪一個小時哪一天哪一周哪一月哪一年哪一個世紀非常的複雜但是這個中本身雖然貴雖然複雜同時這個中本身有個很大的問題就是它每兩百年需要調它的時間一次 那为什么这些制造中的人知道说这个中本身每两百年需要调它的时间一致每两百年这个中本身会落差五分之二秒呢因为他们是以这个宇宙的大中来调这个时间我们知道说大概三百年之前在欧洲一个很重要的运动叫做启蒙运动在启蒙运动的时候当时他们在思想神的时候就把这个神了解成为祂好像是一个制造中的这个神 他們觀察這個宇宙的時候發現這個宇宙本身是一個很機密的宇宙宇宙裡面有非常多的自然律這個宇宙本身它是一個很棒的循環看到說這個潮會進來潮會退下去這個太陽會起來會下去這個世界是一個很棒的循環 當他們看這個宇宙的時候發現到說宇宙本身像一個很機密的鐘他們就把神視為是一個製造鐘的這個神這個神本身創造這個世界的時候祂就把這個鐘上的發條就讓這個鐘本身按照祂的自然律來運行神就暫時放下這個世界暫時離開到 Starbucks 去喝咖啡那麼神本身咖啡喝完的 他就覺得說這個世界應該結束了就回來結束這個世界所以當時我們看到說他們對神的理解被稱為是一種自然神觀的這個神這個神本身是一個創造者但這個神本身不是一個維護者 这个神本身我们知道说祂创造了世界,创造了世界的时候祂就让这个世界自己去运作,神就不太去干扰这个世界,所以这个世界本身不要期待太有什么神迹奇事,因为神祂在斯塔堡喝咖啡,所以祂让这个世界自己去运作,自己去跑,这个叫做自然神观的那一个神。
767.449	772.473	就如同一個父母親生了孩子以後就讓他置身置面。
772.473	895.965	我的女兒有一個同學她當時被找到的時候是在中國的洞車的廁所找到的 他另外同學本身當時候被找到的是在中國的一個垃圾桶裡面找到當他被找到的時候他整個臉整個身體被螞蟻咬到現在被咬的那個傷痕還在這個孩子已經18歲了他用這個擦這個什麼粉末來遮蓋那些的傷痕因為他們父母親本身生了他之後就把他丟在垃圾桶裡面把他丟在這個洞車的廁所裡面 很多時候我們看到說我們的神有點像這個父母親一樣就像當時候三百年前那位知人神官的神這個神是一個創造者神但是祂不是為父者神弟兄姊妹當我們看這個禱告的時候這個禱告不容許我們對神的了解是那位什麼呢那位只是給我們新生命那位神這個神要跟我們維持一種非常活潑的關係 但弟兄姊妹也非常可惜,很多弟兄姊妹喜歡這種的安排,神啊祢在天上,我在地上,神啊祢給我新生命,我已經買到了這個上天堂的飛機票,我已經在將來,我在將來這個天上退休的時候,已經做好了安排,神你管你的事情,我管我的事情,這個是一個很棒的安排, 弟兄姊妹 這個經文本身不容許我們被了解成為神只是那個啟動我們新生命給我們新生命那位神那麼神就離開去喝咖啡我們就做我們自己的事情這個經文不容許我們了解這樣子這個經文告訴我們說我們的神是那位我們在天上的父神 那当我们来到神面前祷告的时候基督耶稣告诉我们说必须要优先的跟天父求什么呢请大家来看一下这个经文的第二节的后面几个字 它说我们在天上的父愿能多尊祢的名为圣 什么叫做愿能多尊祢的名为圣。
895.965	901.728	耶稣告诉我们说我们祷告的时候必须要优先的来考虑祂的名。
901.728	904.690	弟兄姊妹怎么叫做愿能多尊祢的名为圣。
904.690	908.793	我们知道说在近东其实名称很重要。
908.793	912.135	我们知道说在中国的社会里面名字也很重要。
912.135	915.717	我们觉得说一个人名字改了,运就改了。
916.237	937.577	甚至有人都說我們給我們孩子取名我花好多時間在想說到底怎麼給這個孩子取一個好名字甚至於我們的公司本身的名字也很特別我們公司被稱為鴻海鴻達鴻基都是在鴻跟當然不同的鴻都是在鴻為什麼他們很喜歡鴻呢 所以因此看到說一定有祂的意義在裡面。
937.577	944.661	我們知道說其實名字對我們來講非常重要,對神來講名字也非常的重要。
944.661	951.905	我知道說有一些的牧師他們的名字在他們生命的重要的轉捩點的時候,他名字也改了。
951.905	954.807	一個牧師叫做弘以利亞,大家還記得嗎?
955.691	957.753	一个牧师叫做庄以西解。
957.753	958.933	一个牧师叫做孙耶翰。
958.933	961.395	一个牧师叫做黄彼得。
961.395	963.717	一个牧师叫做沈保罗。
963.717	969.541	他的名字不是保罗,不是彼得,不是约翰,不是以利亚,也不是以西解。
969.541	974.385	是在他们生命的重要的转捩点的时候,他们名字也改了。
974.385	977.867	我们知道说其实亚伯拉罕的旧名字叫做亚伯兰。
977.867	981.850	神把他名字从亚伯兰改成亚伯拉罕。
981.850	983.892	其实彼得也是这样子。
984.701	1046.535	彼得的舊名字叫做西門當他還沒有碰到耶穌的時候他的生命是一盤散沙神就把他名字從西門改成彼得 Petra 那個 rock 我们知道说现在的这个教宗他名字叫做Francis其实他不是Francis弟兄姊妹他是来自阿根廷的那个主教叫做Jorge Bergoglio我们知道说他做了教宗之后他名字就从Jorge改成Francis 那个上個教宗本身的名字叫做什麼呢叫做Joseph Ratzinger他的原來名字叫Joseph但是他做了教宗之後就從這個Joseph改成什麼呢Benedict他是第16個Benedict意思就是說在教宗歷史裡面有好多的Benedict好多的教宗都喜歡稱自己為Benedict稱自己為本土為什麼喜歡稱自己為本土呢旁邊一個本土修道會大家知道嗎 OK 前段時候我們還有一些弟兄姊妹，我們一起在那邊靈修。
1046.535	1051.640	所以一直看到說本土在這個歷史裡面是一個很重要的人物。
1051.640	1055.924	他是西方修道主義的創辦人。
1055.924	1059.788	那修道主義我們知道說是最悠久的一個團體。
1060.469	1069.618	很多時候我們對修道院不太了解,但是它是最悠久的,沒有一個公司在現在那麼悠久的一個體制、一個機構。
1069.618	1140.423	我們知道說,大家這些教徒們都喜歡稱自己為本土,因為本土是一個很棒的,它是一個屬靈人,它是一個牧養弟兄姊妹的那位Benedict, 所以因此看到說其實好多教宗本身喜歡稱自己為本土所以因此很多人在他們生命的重要的轉捩點的時候他們的名字也改了所以耶穌告訴我們說我們禱告的時候必須要優先考慮神的名願能多尊祢的名為聖什麼叫做願能多尊祢的名為聖呢弟兄姊妹非常容易瞭解就是把神當作神來看待 其实很多時候我們把神推到我們生活的邊緣弟兄姊妹神不在我們生命的核心當你和我有需要的時候我們才去抱神的大腿好噁心喔不是嗎當我躺在家父病亡的時候我才去抱神的大腿但一般在我們生活當中的面神在我們生活的邊緣是那個邊緣神 邊緣神。
1140.423	1141.283	我們不太需要祂。
1141.283	1143.704	弟兄姊妹我們需要祂嗎?
1143.704	1145.825	當你開車的時候我們需要神嗎?
1145.825	1150.387	當你在公司裡面在那裡算股票的時候你需要神嗎?
1150.387	1153.708	當你在你公司裡面做研究的時候你需要神嗎?
1153.708	1154.569	好像不太需要耶。
1155.538	1246.479	因此很多時候神在我們生活的邊緣但這個禱告告訴我們說我們禱告的時候必須要優先考慮神的名願能多尊祢的名為聖我們要把神當作神來看待神不應當放在我們生命的邊緣祂應該在我們生命的核心很多時候我聽弟兄姊妹在禱告發現到他們不在禱告他們在亵渎 因為有別的名更重要有別的名更重要有那個什麼名呢那個名校的名更重要有那個黨的名更重要有那個家族的名更重要有那個名牌的名更重要 但耶穌提醒我們說我們禱告的時候必須要優先的考慮到神的名願能多尊祢的名為聖願大家都要尊神的名為聖大家都要把神當作神來看待 不但這樣子的經文告訴我們說不但優先的要考慮到神的名同時要考慮到神國的計畫請大家看一下這個經文第二節後半段所說的願祢的國降臨願祢的旨意行在地上如同行在天上 不但要關心神的名,同時要關心神國的計畫。
1246.479	1249.322	弟兄姊妹,你看我所關心的是什麼國呢?
1249.322	1377.073	我想在座的弟兄姊妹,你們所關心的是中華民國,有人所關心的是中國,有人所關心的是美國,有人所關心的是澳大利亞國,甚至有人關心臺灣國,但臺灣國還沒有出現好像是,如果出現的時候告訴我一下, 那么所以我们关心的是这个地上的国但是耶稣说我们要关心神的国你们关心神的国吗关心神的国吗有没有如同这个基督所说的愿你的国降临什么叫做愿你的国降临弟兄姊妹其实很容易了解有人说一本好的传记不一定要从这个伟人的生开始写可以从这个伟人的死开始写 道過來因為他生下來跟他後來成就好像沒有太多直接的關係所以可能可以從他成就開始來談在談他的這個過去成長的這個過程將那個道過來瞭解可以幫助我們瞭解到底什麼叫做願你的國降臨弟兄姊妹我們知道說歷史是有方向的歷史是有目標的我們知道說 弟兄姊妹到底這個歷史要往哪裡去呢在這個混亂這個世界當中裡面那麼多人天天上千的人這個上萬的人我們知道說其實回天這個離開這個世界這個到底歷史要往哪裡去 其实弟兄姊妹很多時候我們的歷史觀是受到我們中國人的那個歷史觀的影響在中國的歷史觀當中裡面是循環式的歷史觀有前世有今生是循環式的有點像那個dunkin donuts但是那個甜圈圈的循環式的前世今生前世你做的好事今世會做郭台銘的太太所以這個是很棒的循環 我們這種前世今生的觀念,但是弟兄姊妹,聖經上的歷史觀不是循環式的,不是甜千圈式的,是直線的,是有目標的有方向的。
1377.073	1379.435	那麼那個目標那個方向是什麼呢?
1379.435	1419.566	如果大家打開啟示錄就知道說, 那個最終的方向是什麼就是在那一天大家都要跪拜祂大家都要承認祂是萬王之王萬主之主弟兄姊妹這個就是歷史的最終極的目標神的國要全然降臨大家要跪拜祂大家要稱祂為萬王之王萬主之主 當我們想到神的國要降臨我們不得不想到說神的國本身祂要落實在我們生命的每一個角落神國的價值觀我們知道這個神國的國王是誰呢就是那個King Jesus 就是那位君王耶穌耶。
1419.566	1427.371	所以當我們信耶穌的時候我們就在這個國裡面有份我們就知道說這個國的國王是耶穌。
1427.371	1436.437	這個國的國王本身我們必須要把祂的價值觀把國度的價值觀活化在我們的生命的裡面。
1436.437	1444.161	所以當我們想到神的國要降臨的時候我們不得不想到 神的國本身今天要落實在我們生活的每一個角落。
1444.161	1448.084	神國的價值觀會影響到中午我到哪裡去吃飯。
1448.084	1452.189	神的國的價值觀影響我開什麼牌子的氣色。
1452.189	1455.732	神國的價值觀會影響我這個怎麼看我的存款。
1455.732	1459.336	神國的價值觀會影響我到微風廣場的時候買什麼樣東西。
1459.336	1462.838	神國的價值觀會影響我 住在什麽社區。
1462.838	1466.959	神國的價值觀會影響我在這個丹江教會要如何的投入。
1466.959	1473.680	神國的價值觀會影響我在丹江教會關心到丹江教會的建堂的時候我要奉獻多少錢。
1473.680	1480.002	弟兄姊妹今天你是看到說這裡的經文本身跟我們今天的生活是有直接的關係。
1480.002	1485.283	耶穌說我們禱告的時候必須要說願祢的國降臨。
1485.283	1490.564	但願神的國的價值觀落實在我們生命的每一個角落。
1491.084	1613.712	不但這樣子這個經文本身要告訴我們說其實當我們來到神面前祈求的時候耶穌告訴我們說不但優先的關心到祂的名關心到神國的計畫我們這個時候就進到這個禱告的第二個部分看到說來關心家裡的需要 请大家注意一下这个祷告的前后的关系优先是把神放在第一位再来谈家里的需要谈我们的需要请大家看这边的第三节这边说我们日用饮食天天赐给我们什么叫做我们日用饮食天天赐给我们这里出现那个字日用日用那个字英文叫做daily 那麼這個字本身弟兄姊妹過去學者們不太懂得翻這個字因為他們找不到類似的字在第一世紀的其他文獻裡面所以因此他們在翻這個字的時候是在猜要翻這個字用猜的結果被他們猜對了怎麼知道被猜對了因為他們在考古的時候發現到一張 歐巴桑上市場買菜的一個買菜的列單那個歐巴桑就列出來如同我的太太要去沃克買菜的時候就列出來要買什麼菜那麼那個歐巴桑在第一世紀的時候他也列出來他要買什麼菜那個天天要買的菜旁邊一個瓜福就是那個日日用daily為日用的飲食為那一天所需要的 來禱告 為那一天所需要的來跟上帝來祈求所以因此我們看到說這裡基督耶穌告訴我們說我們禱告的時候必須要為我們日用的飲食為我們天天所需要的跟祂來祈求但弟兄姊妹我深深相信如果這個祈求不列在這裡的話我想在座的弟兄姊妹不會這樣禱告為什麼呢因為你家的冰箱太大了 這個7-11太方便了。
1613.712	1619.058	不但有7-11,同時有Family Mart,有這個全家,太方便。
1619.058	1621.080	要吃什麼就有什麼。
1621.080	1625.525	打開冰箱要什麼,打開家的這個櫥子裡面就有什麼。
1625.525	1627.567	泡麵統一一多讚。
1628.592	1659.691	所以什麽叫做日用飲食天天賜給我們我們不懂得這個弟兄姊妹我們哪一個人做這樣禱告我們不懂得什麽叫做我們日用飲食天天賜給我們耶穌提醒我們我們必須要天天都來依靠祂我的媽媽前幾年被神接回天家媽媽幾年前她被這個發現有這個胰臟癌 當時我媽媽在美國,醫生說要開刀了。
1659.691	1667.914	所以就開刀了,就把胰臟的40%把它切掉,把胰管也切掉了,手術非常順利。
1667.914	1670.875	因此,醫生說手術完以後要做什麼?
1670.875	1672.395	做化療。
1672.395	1677.577	我在臺灣,媽媽在美國,就跟媽媽講說,媽媽你可以回到臺灣做化療。
1677.577	1683.740	所以媽媽就打議了,就從美國搬回臺灣,在臺灣的和姓,就在附近,和姓做化療。
1684.360	1689.207	那麼我過去也碰到我的學生,他們也得了癌症。
1689.207	1696.617	我才上禮拜六參加我一個學生的追思禮拜。
1696.617	1701.444	那麼現在到處都是癌症,到處都是。
1702.039	1705.342	到處都是,連傳道人都不會避開。
1705.342	1708.084	求主幫助我們保守我們的身體啊。
1708.084	1713.609	那麼我過去有為這些在化療當中的學生來禱告。
1713.609	1719.595	但是我從來沒有體會過一位歐巴桑在化療當中,歐巴桑住在我家。
1719.595	1723.839	當時我媽媽在化療的時候,頭髮天天掉啊。
1723.839	1728.223	不但這樣子,她臉是紅紅腫腫的,像去墾丁衝過浪一樣。
1729.189	1736.754	不但這樣子媽媽的嘴巴是潰爛的吃一個飯本身還要吃還麻醉嘴巴還要漱口還吃止痛藥。
1736.754	1742.898	弟兄姊妹我才發現連吃都是上帝的恩典。
