start	end	text
1742.898	1750.924	弟兄姊妹今天早上你可以拿起那一塊麵包那個喝那一杯豆奶那個是上帝的恩典。
1752.176	1785.721	那個是祂所供應的不但供應你那個麵包供應你那個豆奶同時讓你可以享受那個麵包豆奶的美味耶穌說我們日用飲食求神天天賜給我們拜託弟兄姊妹不要等到你躺在家父病房靠著呼吸器在呼吸的時候才跟天父要求說神啊我們日用飲食天天賜給我們 我一個學生在臺北牧會,他有一天在騎機車,結果被車子撞到。
1785.721	1790.662	那麼車撞到的時候我們看到說,其實車子撞到那還好,更嚴重是什麼呢?
1790.662	1798.244	他的這個jaw,這個什麼,下巴這個骨頭就裂開了。
1798.244	1799.164	裂開了怎麼辦呢?
1799.164	1801.864	要裝一個鋼釘在裡面。
1801.864	1805.105	他就告訴我說,他三個月連吸都痛。
1807.366	1948.507	他在告訴我說周老師連吃都是上帝的恩典耶穌說我們禱告的時候跟天父求我們日用飲食天天吃給我們弟兄姊妹請大家注意一下這個禱告出現兩次的復甦的我們我們日用飲食天天吃給我們兩次的復甦的我們到底耶穌在講什麼 弟兄姊妹我不得不跟大家坦承我的祷告非常個人化非常私化我今天早上為我的講道來祷告為我的寶貝女兒來祷告為我的太太祷告我今天早上沒有為民靈祷告沒有為家牧師祷告沒有為丹江教會祷告其實就告訴我我祷告非常的私化耶穌的教導說我們祷告不要那麼私化不要那麼的個人化我們祷告必須要關心到大家的需要 耶穌說我們日用食天天賜給我們什麼意思呢我們跟天父求說天父求祢給我兩打饅頭神就伸開祂的手給我們兩打饅頭當我們從神的手中領受這兩打饅頭的時候我們會想說一打饅頭這禮拜吃另外一打饅頭冰在冰箱裡面下禮拜吃 弟兄姊妹 這個不是這經文的意思這經文什麼意思呢這經文的意思就是我們跟神說神啊求祢給我兩檔饅頭神就伸開祂的手給我們兩檔饅頭當我們從神的手中領受這兩檔饅頭的時候一檔饅頭自己吃另外一檔饅頭分享給那些有需要的人吃這個才是個經文的意思弟兄姊妹懂不懂我們日用飲食耶穌說今日賜給我們 所以因此基督耶穌說我們禱告的時候不但要考慮祂的名考慮祂的國同時要關心到大家的需要接著我們看到說基督耶穌告訴我們說不但要考慮大家需要同時為大家的赦免饒恕來祈求請大家看這邊的第四節聽到沒有 那個 第五世紀教會最偉大的神學家叫做奧古斯丁。
1948.507	1951.429	不曉得大家知道奧古斯丁是誰。
1951.429	1953.571	他是一個牧師。
1953.571	1961.878	他在西坡北非一個城市牧會39年。
1961.878	1969.003	我們神學老師很怕我們的畢業生牧會3.9年。
1969.003	1971.025	很多牧師他們也在流動。
1972.312	1976.356	你們感謝神,你們牧師是埋在這裡。
1976.356	1978.799	很多牧師埋不下去。
1978.799	1986.147	所以因此看到說在這邊,奧古斯丁當時在牧會的時候,他就教導他的弟兄姊妹這個禱告。
1986.147	1988.910	都留下來的,現在你都可以讀到。
1988.910	2048.166	這個已經將近兩千年前的事情, 你的文獻都留下來的當奧古斯丁教導他的弟兄姊妹這個禱告的時候他說這個祈求是一個可怕的祈求這個祈求是一個恐怖的祈求弟兄姊妹你知道說到底奧古斯在說什麼為什麼把這個祈求視為是一種可怕的祈求呢這個時候我們再回來注意一下這個經文怎麼說好不好這個經文說赦免我們的罪因為我們也赦免凡虧欠我們的人 我们都跟神说神啊求祢赦免我的罪求祢的宝血厚厚遮盖我们但请大家注意一下这里提到说因为我们也赦免凡亏欠我们的人我们赦免人跟我们从神那里领受赦免是绑在一起的 意思就是說當我們從神的那裡領受赦免的時候我們就比較容易去饒恕赦免那些傷害我們的人。
2048.166	2054.772	當我們沒有辦法好好去饒恕那些傷害我們的人的時候其實我們沒有真正得到神的赦免。
2054.772	2061.178	一個得到神的真正赦免的人他就比較容易去饒恕赦免那些傷害他的人。
2062.039	2138.725	弟兄姊妹 這個世界充滿了傷害不曉得在座的弟兄姊妹你們哪一位從來沒有受過傷害可不可以舉個手 拜託你們舉個手哪一個人從來沒有受過傷害這個世界充滿了傷害 夫妻彼此傷害丈夫傷害妻子妻子傷害丈夫孩子傷害父母親父母親傷害孩子在公司裡面老闆傷害他的屬下屬下傷害他的老闆在學校裡面老師傷害學生學生傷害老師甚至於在教會裡面弟兄姊妹傷害牧師真的牧師也傷害弟兄姊妹 這個世界充滿了傷害所以這個祈求其實耶穌要提醒我們是禱告裡面非常重要的赦免我們的罪因我們赦免凡虧欠我們的人我一個好朋友是在臺灣做宣教師宣教師他是從美國來的宣教師他結婚三十年但是要離婚為什麼現在孩子都大了 兩個老人不需要用惡言彼此惡待。
2138.725	2142.088	彼此用惡言來對待,不需要。
2142.088	2144.590	因為臺灣的健保又那麼好。
2144.590	2147.272	不需要,大家可以做自己的事情吧。
2147.272	2147.733	為什麼呢?
2147.733	2152.337	因為30年前傷害沒有解決。
2152.337	2156.721	所以30年之後,他們就彼此傷害。
2156.721	2159.504	所以因此要離婚,把這個家都拆掉了。
2160.333	2236.753	弟兄姊妹這一看到說基督耶穌提醒我們當我們從神那裡得到聖免神怎麼用恩典來待我我就怎麼用恩典來待那些傷害我們的人耶穌說我們禱告的時候不但要關心到家裡的需要同時要關心到家裡的饒恕 接著看到說這裡基督耶穌又提到另外一個祈求請大家來看這裡的第四節的最後部分這裡耶穌告訴我們說不但為家裡的饒恕來禱告同時要為家裡的保護來禱告請大家看這邊的第四節最後面所說的不叫我們遇見試探救我們脫離熊餌 什麼叫做不叫我們遇見屍炭就我們脫離兇惡是不是我們沒有跟神禱告說不叫我們遇見屍炭等一下我們走出淡江教會的時候就會碰到屍炭碰到兇惡嗎我想這個不是基督耶穌的意思這裡的經文本身其實基督耶穌用一個很特別的方式很特別的表達方式來幫助我們了解這個祈求祂所用的方式叫做Litotus什麼叫做Litotus呢就是間接肯定法 用間接的方式來肯定一件事情。
2236.753	2238.414	不叫我們欲見失探。
2238.414	2239.975	救我們脫離凶惡。
2239.975	2242.837	這個間接肯定祂要幫助我們。
2242.837	2244.839	祂要保護我們。
2244.839	2246.660	其實在我們日常生活裡面。
2246.660	2248.361	我們常常用Light Totus。
2248.361	2251.223	常常用這個所謂的間接肯定法。
2251.223	2253.765	我們說沒事沒事沒事。
2253.765	2256.206	沒事就是間接肯定法。
2256.206	2258.287	就是間接肯定就沒有問題。
2258.287	2260.069	間接肯定都很順的很好。
2260.589	2263.291	我们说这个餐厅不错不错不错。
2263.291	2265.973	代表说这个餐厅很赞的意思。
2265.973	2268.815	意思说就间接肯定餐厅很赞。
2268.815	2270.576	用这个间接肯定法。
2270.576	2275.440	同样的看到说基督耶稣就在这边用这个方式来表达就是间接肯定法。
2275.440	2282.945	如同在约翰福音的第6章的37节那一说到我这里来的我总不丢弃他。
2282.945	2378.370	基督耶稣用间接肯定法告诉我们说所有来到祂面前的 他接納他擁抱所以因此看到說在這裡基督耶穌同樣的用這個方式祂說不叫我們意見試探救我們脫離凶惡弟兄姊妹我再跟大家分享如果這個祈求不列在這裡的話我想大家不會這樣禱告為什麼因為大家滿喜歡碰到試探 我們覺得說人生沒有屍炭是一個灰色的人生人生有屍炭才是一個彩色的人生弟兄姊妹我不需要跟他們坦承我連坐高鐵都會碰到屍炭我不曉得你們會不會這樣子到處都屍炭非常不容易要求神天天的保守否則就落在這個魔鬼的圈套的裡面這裡提到說不叫我們遇見屍炭救我們脫離凶惡幾年前我有機會到中國去那麼住在旅館裡面 我的皮箱都還沒打開就有人打電話給我說周先生啊你需不需要按摩不曉得大家有沒有碰過我想在座好多弟兄姊妹你搞不好都去過中國出差中國旅館是服務到家在臺灣的旅館沒有這個服務在美國的旅館沒有這個服務我去歐洲服事的時候也沒有這種服務但在臺灣在中國就有這個服務打電話來說你需不需要按摩我說對不起啊我不需要按摩把電話掛掉 過了幾分鐘又來了。
2378.370	2458.231	他說周先生你需要什麼樣的服務我幫你叫啊很便宜耶 我说 对不起 我不需要什么服務就把电话挂掉耶稣说 不叫我们意见试探救我们脱离凶恶当我们有试探的机会的时候弟兄姊妹求主拿掉试探的倾向当我们有试探的倾向的时候求主拿掉试探的机会弟兄姊妹我们知道说这个经文本身不再告诉我们说 不是 弟兄姊妹不要看錯這個經文本身耶穌在提醒我們所有的事在後面就是魔鬼 他目的要摧毁我们跟天父的关系他目的就是不要我们关心到神的名关心到神的国关心到家里的需要关心到彼此的劳数他也不要我们关心到神的饱腹他要摧毁我们跟神的关系弟兄姊妹绝对不要看错这个经文本身不只是在告诉我们说要做个好男人做个好女人不是要告诉我们说其实所有的世上的后面就是魔鬼 祂要摧毀我們跟天父的關係。
2458.231	2472.144	但是不管怎麼樣,當你和我到神面前祷告的時候,求主幫助我們,讓我嘴巴很容易地出現那句話,我們在天上的父。
2472.144	2479.471	當我在準備這篇道的時候,我就想起好幾年前,我跟我女兒在我家裡面玩的遊戲。
2479.787	2482.049	神給我兩個寶貝的女兒。
2482.049	2490.515	神非常偏心把最好的給姜牧師。
2490.515	2493.598	這個女兒跟他們玩遊戲,什麼遊戲呢?
2493.598	2499.202	我把十塊錢放在我手心,把手握起來。
2499.202	2504.667	我就跟我女兒講說,女兒,哪一個可以扒開爸爸的手,十塊錢是他們的。
2504.667	2508.305	所以我的手很硬, 他們扒不開啊。
2508.305	2512.606	因此就幫他們預備一個國際條約。
2512.606	2514.046	國際條款。
2514.046	2516.987	就動一下爸爸的小手指頭。
2516.987	2518.188	手就打開。
2518.188	2520.128	十塊錢是他們的。
2520.128	2523.149	他們好喜歡抓著我玩這個遊戲。
2523.149	2525.290	為什麼一個下午可以賺好幾十塊錢?
2525.290	2532.532	弟兄姊妹,當我想到這個遊戲的時候,想到我們跟神的禱告就這樣子。
2533.336	2569.777	我跟神說 神啊 求祢給我十塊錢神就伸開了手 給我們十塊錢神啊 我要在淡水買一個別墅求主幫助我可以買到別墅神就聽我們禱告 買到那個別墅神啊 我的兒子要到美國去讀他的碩士求主幫助他可以順利的進到那個好的學校去讀那個碩士神也聽我們禱告 讓寶貝兒子去讀的碩士回來找到一個好的工作神啊 我的媽媽腳痛 求主醫治媽媽的腳痛,神就醫治媽媽的腳痛。
2569.777	2589.402	當我們從神的手中拿到十塊錢,當我們的兒子到了美國讀完祂的碩士,當神聽我們的禱告,我們買到那個別墅,神聽我們禱告,醫治媽媽的這個腳痛的時候,我們就把神的手就推開。
2589.402	2589.742	不是嗎?
2590.452	2596.677	很多時候我們只要神手中的十塊錢,拿到十塊錢之後,我們就把那個手推開。
2596.677	2601.421	弟兄姊妹,你看我非常愚昧無知。
2601.421	2610.168	為什麼只要神手中的十塊錢,不要神的手?
2610.168	2614.751	當你有神的手的時候,你什麼都有了。
2614.751	2627.746	所以怪不得,耶穌說,禱告的時候要說, 我們在天上的福,擁有祂的手,你就擁有的一切。
2627.746	2631.530	我們來禱告。
2631.530	2640.809	阿爸天父我們感謝在面祢, 我們不得不承認,如同門徒們看到他們的需要,我們真的不會禱告。
2640.809	2644.472	我們不曉得我們在祢裡面有那麼大的福氣。
2644.472	2649.256	求主教導我們,求主也幫助我們,在祂面前禱告。
2649.256	2655.001	感謝主,幫助我們透過祢的話語,讓我們知道我們跟祢的關係是那麼的特別。
2655.001	2658.864	祢是那位我們在天上的父,我們是屬於祢的寶貝的恩女。
2658.864	2662.607	當我們擁有祢的時候,我們就擁有了一切。
2662.807	2666.352	我們就這樣祈求,是奉耶穌的名來祈求。
2666.352	2666.632	阿們。