start	end	text
1950.094	1966.034	現在你知道某一件事,你心中有感動,你覺得神要叫你去奉獻,但是你想,我這個手機要換新的已經很久了,我正在存錢,我沒有多餘的錢。
1966.034	1971.362	當我們在北疆的時候, 我想到一個很有趣的事。
1971.362	1974.705	在北疆我們接觸了一些哈薩克人。
1974.705	1979.108	那個西北地方啊,非常愛吃羊肉。
1979.108	1982.410	那個煮的羊肉一大塊一大塊很肥啊。
1982.410	1986.193	如果你們有去過,我覺得非常的好吃。
1986.193	1989.276	也不是很有那種羊騷味。
1989.276	1993.679	所以他們的當地的人跟哈薩克人很愛吃羊肉。
1993.679	1997.242	但是當我們認識他們的時候,我們發現他們很多一個個都胖胖的。
1997.961	2008.944	那我就問有一個太太,那個太太就跟我說,她說我們這裡的人啊,到了四十多歲常常就中風了。
2008.944	2010.644	她的先生還是個醫生。
2010.644	2018.967	我說你先生是醫生,那他應該知道吃這個東西的後果就是比較容易中風啊,那可不可以少吃一點呢?
2018.967	2019.747	她就看著我。
2020.367	2050.846	他覺得這是匪夷所思的我怎麼可能少吃這個肥羊肉一定要吃那神怎樣認平神並沒有把我們手裡的肥羊肉打在地上當我們做一些不合神心意的事情的時候神並沒有讓我們當下就受到苦果如果神當下讓我們受到苦果的話求神給我們有這個智慧讓我們認得那個 是不可以的。
2050.846	2052.246	立刻回頭。
2052.246	2054.228	但是就像法老一樣的。
2054.228	2055.848	我們為什麼會那樣做?
2055.848	2057.109	因為有情慾嘛。
2057.109	2061.531	比如那個情慾就是,我就是喜歡吃這個肥羊肉啊。
2061.531	2063.332	他們吃起來很可怕的。
2063.332	2066.694	半斤一斤,一斤半兩斤,這樣吃哦。
2066.694	2069.196	不是像我們一塊一塊地吃哦。
2069.196	2074.398	這樣子吃的話,承著你心裡的情慾,做這些事情。
2074.398	2076.259	你的人際關係怎麼樣?
2076.259	2078.801	你的家庭關係可能神會認平。
2079.241	2082.062	你的工作態度可能神會認平。
2082.062	2086.643	你的健康可能神會認平。
2086.643	2096.606	所以最後從認平到救恩是什麼關鍵?
2096.606	2098.026	悔改。
2098.026	2101.027	任何時候悔改都不遲。
2101.027	2108.349	不要在乎請問法老走到最後長子被殺之前他悔改可不可以?
2109.701	2111.522	任何時候都可以。
2111.522	2116.466	長子死了,他可不可以悔改,不要去再追殺硬著心。
2116.466	2120.008	可以,但是通通都沒有。
2120.008	2121.970	這個地方我們一起來讀。
2121.970	2134.839	我們若認自己的罪,神是信實的,是公義的,必要赦免我們的罪,洗盡我們一切的不義。
2134.839	2137.501	我們請那個帶領敬拜的上來。
2137.501	2158.174	我們在這個地方來看, 這個說起來就是一句話,要赦免我們的罪,洗盡我們的不義,但是關鍵是我如何回頭。
2158.174	2161.616	我如何回頭?
2161.616	2164.557	神願不願意我們回頭?
2164.557	2165.497	我們的困難在什麼?
2167.858	2179.890	困難在我自己的意願太強了,我的習慣太堅固了,我就是12點以前不能睡覺,所以我的身體就是老是睡眠不夠。
2179.890	2186.196	這些東西太堅固了,讓我們沒有辦法悔改,但是神會幫助我們悔改。
2187.363	2189.204	祂會幫助我們悔改。
2189.204	2197.946	我們要相信,剛剛小曼帶敬拜的時候,她說她預備的時候,她就心裡就是想到信心兩個字。
2197.946	2201.848	我們現在馬上要進入我們的新堂來聚會。
2201.848	2214.532	求神在這個時候幫助我們,讓我們不再繼續在各個方面來認平我自己做神不喜悅、浪費生命的事。
2215.401	2226.888	讓我能夠回頭在神在我生命者旨意跟前面的護照下面對準前面的道路往前面行我們來