start	end	text
2002.076	2021.400	即使是傳道人, 是,你以為你懂,但你不懂,而且你不敢,不敢面對我,不敢求。
2021.400	2023.081	好不好今天的心情?
2023.081	2042.523	如果在我們當中有慕道的朋友,你第一次來到教會,你第一次接觸基督教,我這邊有一個邀請, 你的心中是否正在為什麼事情,然後你擔憂了好些時間,甚至影響你的生活作息,你的健康。
2042.523	2046.665	朋友,你需要從上帝來的平安。
2046.665	2064.332	在我們當中的每一個基督徒, 我們真的需要從聖靈來的幫助,讓我們可以在真理當中重新檢視、覺察自己的生活,還有你的家庭,每一個關係、職場。
2064.332	2075.140	這是這麼細微的事情,這麼我們理所當然的小事情,但是其實它很大。
2077.244	2088.126	如果它已經影響了你的關係﹐你的健康﹐你的作息﹐我們真的要好好的﹐面對這個基本功。
2088.126	2101.849	我相信明年聖靈在丹山教會﹐會有很大的工作﹐但是我們真的要好好在乎﹐這麼細微﹐這麼小的工作﹐在乎聖靈怎麼帶領我們﹐是嗎?
2101.849	2106.910	願上帝祝福每位弟兄姊妹﹐接下來把時間交給會員牧師﹐來帶領我們播病。