start	end	text
18.592	20.233	弟兄姊妹平安，我們一起來思想。
20.233	22.915	以色拉記第九章第一節。
22.915	24.556	這事做完了。
24.556	25.837	什麼事做完了?
25.837	28.379	就是第八章最後所說的。
28.379	33.783	他們終於經過四個月的時間,從巴比倫來到了耶路撒冷。
34.343	41.729	然後把這個巴比倫地區為聖殿所奉獻的金銀都交給耶路撒冷的祭司。
41.729	43.991	然後他們也在那邊獻祭。
43.991	48.875	以色拉也忙碌一些行政的拜訪。
48.875	54.620	就是把這個國王的玉子交給這些總督們還有省長們。
55.060	62.349	希望他們按照國王的指示來幫助百姓供應聖殿裡面所需用的。
62.349	75.184	所以這些事情做完了之後,時間過得很快,已經又過了四個半月,因為到第十章我們就會發現已經過了四個半月, 那眾首領就來見我。
75.184	95.828	這些首領不知道是指跟以色列一起第二波一起歸回的這一些隨行的領袖還是當地領袖可能都有喔然後他們對以色列說以色列民和祭司以及立位人 他們並沒有離絕。
95.828	98.289	離絕的意思是分開、分別為聖。
98.289	100.550	仍然跟他們混雜在一起。
100.550	108.133	沒有離絕迦南人、赫人、比利喜人、伊布斯人、雅門人、摩押人、埃及人、亞摩利人。
108.133	117.938	他們仍然效法這些國的名,就是跟隨他們的價值觀,甚至很可能跟他們也有一些拜偶像。
118.558	125.021	然後在道德行為上面,行了可證物的事情。
125.021	142.148	第二節,因他們為自己和兒子,娶了這些外邦女子為妻,以至於聖節的種類和這些國的名混雜了,而首領跟官長在這件事情上為罪魁。
142.148	161.805	因此這些像以色拉匯報的這些首領,他們認為, 今天在耶路撒冷的這一些以色列百姓,為什麼沒有走在神的價值觀裡面,而且行許多可證的事,是因為他們跟異族通婚。
161.805	173.537	《出埃及記》第34章15到17節,《申命記》第7章1到4節,還有其他許多經文,上帝不只一次, 禁止他們跟外族同婚。
173.537	184.587	就是因為他們跟外族同婚的話,他們所生的兒女,會跟著媽媽去信他們的偶像,接受他們的價值觀。
184.587	187.129	因此,神一直禁止這樣的事情。
187.129	191.393	但如今,他們好不容易被擄歸回了。
191.393	193.556	可是呢,他們仍然跟外族同婚。
194.241	200.146	跟外族通婚可能有很多的原因,也包含那時候的外族勢力強大。
200.146	208.753	所以他們也希望透過跟他們通婚,來取得一些平衡或是保護。
208.753	214.697	第二節說,他們為自己的兒子娶了,這外邦女子為妻。
214.697	217.580	這邊的娶,它的原文是拿。
218.200	227.590	Take也就是說他們為自己的兒子拿了這些女子來做他們的妻子。
227.590	239.803	所以聖節的種類聖節不是代表他們道德完美無瑕而是說他們是分別為聖不跟價值觀不一樣的人 混雜在一起。
239.803	241.243	但如今都已經混雜了。
241.243	242.684	帶頭的是誰?
242.684	246.005	帶頭的就是首領跟官長。
246.005	255.570	第三節,以色拉他說,我一聽見這件事情,就撕裂衣服和外袍,拔了頭髮跟鬍鬚, 金聚幽悶而坐。
255.570	265.035	代表過去這四個月裡面,以色拉他在忙碌許多的事情,他沒有發現這個事情。
265.035	272.479	所以現在就是說,這些首領們跟他們回報,跟他回報的時候,他才知道事態如此嚴重。
272.479	280.824	撕裂衣裳跟外袍,還有拔頭髮跟鬍鬚,都代表他極度的悲哀,在神的面前痛苦悔改。
281.544	291.150	第四節,凡為以色列神言語而佔盡的,都因這被辱歸回之人所犯的罪,聚集到我這裡來。
291.150	296.394	我就驚懼憂悶而坐,直到現晚祭的時候。
296.394	302.578	現晚祭,就是在黃昏之前,時間是猶太人的第九小時。
302.578	307.001	他們是從早上六點開始算,第幾小時、第幾小時。
307.001	309.503	所以第九小時就是下午三點左右。
309.923	316.608	因此呢,以色拉他驚懼憂悶,坐在那裡,不發一語。
316.608	325.295	然後呢,其他的人也陸陸續續跟他在一起,在那邊驚懼憂悶而坐,一直到獻晚祭的時刻。
325.295	337.404	第五節獻晚祭的時候,以色拉就起來,心中愁苦,穿著撕裂的衣袍,雙膝跪下,向耶和華我的神舉手,然後就禱告。
337.824	404.383	以色拉他知道百姓犯了這麼嚴重的罪他不是用憤怒來表達他是以在神的面前痛苦憂傷來表達那他就跟神禱告說我的神啊我抱愧蒙羞不敢向我的神仰面以色拉說我很慚愧我真的是在祢面前沒有臉見祢 那其實不是以色拉做錯什麼事而是他的同胞們八十年前歸回的這一批同胞們做錯事可是以色拉就在那邊為他的同胞來向神羞愧的認罪因為我們的罪孽滅頂我們的罪惡滔天 從我們列祖直到今日,我們的罪惡甚重,因我們的罪孽,所以我們和君王祭司都被交在外邦列王的手中,然後殺害、擄掠、搶奪、臉上蒙羞,正如今日的光景。
404.923	415.885	以色列說,我們以色列人從以前一開始,被你拯救出埃及的時候到現在,其實我們都是一直在犯罪,然後又不悔改。
415.885	424.527	你才使我們國破家亡,被殺害、被擄掠、被搶奪,臉上蒙羞,正如今日一樣。
424.527	431.428	第八節,現在耶和華我們的神暫且施恩於我們,給我們留些逃脫的人。
432.517	436.353	使我們安穩如釘子,釘在祂的聖所。
437.346	444.390	我們的神好光照我們的眼目,使我們在受挾制之中稍微復興。
444.390	449.853	第八節這邊提到,現在是因為神給我們恩典,讓我們願意悔改。
449.853	458.998	我們好不容易才可以從貝魯之地,被神拯救、釋放,可以從貝魯之地回到耶路撒冷。
458.998	463.861	這是神暫且施恩於我們,給我們留下愚民跟逃脫的人。
464.241	475.288	如今很感謝神,八十年過去了,使我們安穩如釘子,就在祢的聖所,在耶路撒冷,沒有再次被擄走。
475.288	488.396	這是神使我們在被擄當中稍微的復興,使我們的眼睛可以被祢的光重新打開,不再是做瞎子在黑暗之地。
489.377	496.199	第九節,我們是奴僕,然而在受挾制之中,我們的神仍然沒有丟棄我們。
496.199	508.402	在波斯王眼前向我們施恩,叫我們復興,能重建我們神的殿,修其中毀壞之處,使我們在猶大和耶路撒冷有強原。
508.402	527.471	不僅聖殿重修完畢,在之前大立屋往時代就已經 透過神在波斯列王的心中所動的弓,使得聖殿修好了,然後城牆也有一些在重建的過程當中。
527.471	532.294	這都是神給我們的恩典,祂沒有因我們犯罪就完全離棄我們。
532.294	537.157	第十節,我們的神既是如此,我們還有什麼話可說呢?
537.637	576.380	因為我們已經離棄你的命令,就是你藉你的僕人眾仙之所吩咐的說,你們要去德維葉之地是污穢之地,因列國之民的污穢和可證的事,叫全地從這邊直到那邊滿了污穢,所以不可將你們的女兒嫁給他們的兒子,也不可為你們的兒子娶他們的女兒, 永不可求祂們的平安和祂們的利益,這樣你們就可以強盛吃這地的美物,並遺留這地給你們子孫永遠為業。
576.380	583.502	以色列這邊繼續禱告說,我們現在已經在祢面前羞愧的無話可說了。
583.502	585.802	我們已經完全理清祢的命令。
585.802	587.063	什麼命令呢?
587.063	598.208	就是祢之前曾經藉由祢的僕人先知所吩咐我們的, 就是說,我們為什麼能夠出埃及,然後得著這個應許之地?
598.208	602.590	神祢沒有欠我們,是祢白白賞賜給我們的。
602.590	614.814	而這塊地之前,祢是賞賜給迦南地的列族,也就是我們剛剛在第九章的第一節所讀到的很多那些迦南人、赫人、比利、喜人這些人。
615.674	621.760	神原本是把應許之地、迦南地是賜給這些列祖、列國。
621.760	624.042	可是呢,他們把那地污穢了。
624.042	626.885	他們把神的地污穢了。
626.885	628.247	糟蹋了。
628.247	631.009	拜偶像,行各種可證的事。
631.009	634.493	所以神才讓以色列人來取代他們。
634.493	638.156	但如今以色列人竟然跟他們做一模一樣的事。
638.797	658.831	那神特別就是知道說﹐如果跟他們混雜在一起﹐沒有分別為勝﹐特別是如果跟他們通婚﹐那你們的下一代﹐就會跟著這些外邦人走了﹐而且呢﹐他們也不會來專心敬拜神﹐在道德上也會行更多可證悟的事。
658.831	677.930	所以你們不要跟他們通婚﹐也不要為他們求平安和他們利益﹐ 不是說心胸狹窄,而是說外邦人他們都一直得罪神,行罪惡的事,他們若不悔改,神怎麼可能把平安跟祝福繼續給他們呢?
677.930	680.093	因此呢,你們不要效法他們的榜樣。
680.981	700.649	十三節,神啊,我們因自己的惡行和大罪,遭遇了這一切的事,就是國破家亡被辱,因我們跟那些外邦百姓一模一樣,並且祢刑罰我們,輕於我們的罪所當得的,又給我們留下這些人。
700.649	706.674	以示大家非常清楚知道, 以色列不斷的得罪悖逆神,早該滅亡了。
706.674	714.281	若不是神的恩典,為他們存留一些愚民,他們早就亡族滅國了,滅種了。
714.281	721.389	我們豈可再違背祢的命令,與這行可證之事的民結親了。
722.466	747.106	現在好不容易神讓我們被擄歸回了但是我們如果還是跟以前一樣去效法這地的百姓並且跟他們結親行一樣可證物的事那還得了啊而我們現在正在做這樣的事若這樣行你豈不向我們發怒將我們滅絕以至沒有一個剩下逃脫的人嗎?
747.892	756.357	耶和華以色列的神,因祢是公義的,我們這剩下的人才得以逃脫,正如今日的光景。
756.357	762.321	看啊,我們在祢面前有罪惡,因此無人在祢面前站立得住。
762.321	771.627	因為神是公義的,祂刑罰了以前的這些迦南地的百姓,才使以色列人可以得地為業。
771.627	810.309	也因為神是公義的, 因為這個把百姓擄走的這些帝國他們在神面前驕傲自大所以神也刑罰他們因為神是公義的所以當祂賜下悔改的心的時候這些在巴比倫被擄之地的人他們就向神悔改神就把他們帶回來了神都是公義的可是我們這些蒙了大恩的以色列人卻是不義的因為我們 沒有紀念神的公義慈愛,反而在歸回之後繼續做跟以前一樣的事。
810.309	812.770	我們怎麼能夠在祢面前站立得住呢?
812.770	816.572	怎麼承受得起祢再一次向我們發怒呢?
816.572	818.873	我們一起來禱告。
818.873	834.122	主啊,憐憫我們,有時候當祢幫我們解決犯罪所帶來的 痛苦的結局,或是罪的苦果之後,我們固態萌發,又回到以前的日子。
834.122	838.804	主啊,真不知我們的心要向祢剛硬到幾時。
838.804	839.204	求主憐憫我們。
839.204	844.186	主讓我們不要再回去過一樣犯罪的生活。
844.186	847.328	要珍惜神給我們的恩典。
847.328	851.309	不讓我們在曠野中度過自己的一生。
851.309	852.770	求主幫助我們。
852.770	854.371	奉主耶穌的名禱告。
854.371	854.631	阿們。
854.991	856.341	願神賜福大家。