start	end	text
1822.056	1823.196	是眾叛親離嗎?
1824.241	1826.462	或者是飢餓。
1826.462	1834.147	大饑荒中間,餓死的,難道基督徒都不成為基督徒了嗎?
1834.147	1835.548	不能暖。
1835.548	1840.051	難道凍死的人都棄絕神了嗎?
1840.051	1842.012	神就不愛他了嗎?
1842.012	1843.353	危險。
1843.353	1846.195	刀劍。
1846.195	1857.850	差不多十幾年前在美國的高中,有一些 高中生每個禮拜一次在那個國旗桿旁邊聚會讀聖經、禱告。
1857.850	1865.735	結果有一個學生拿著槍進來,對著那個帶領的女孩子,就說,你要相信耶穌,我就打死你。
1865.735	1868.316	你要說你不信耶穌,我就讓你活。
1868.316	1872.638	那個女生說,我相信耶穌,當下就打死了。
1872.638	1879.342	這個能夠讓這樣子的殉道,能夠讓你跟神的愛隔絕嗎?
1881.425	1913.262	保羅在最後他用了很堅定的話他說羅馬書不清楚回去再看你現在聽了之後你再看的時候就不一樣的眼睛了他說我深信保羅說我深信沒有能使我們與基督的愛隔絕的那是生還是死你怕死嗎 所有的受造物都怕死。
1913.262	1917.606	因為我們被造的時候不是被造來死的。
1917.606	1919.687	我們是被造來活的。
1919.687	1922.910	我們唯一有的就是我們自己的生命。
1922.910	1924.951	所以我們怕死。
1924.951	1929.635	但是請問,你信了耶穌之後,你會怕死嗎?
1931.340	1936.142	很奇妙的是,信了耶穌之後,就不再怕死。
1936.142	1943.485	天使掌權的,有能的,那個未知的靈界,你以前怕鬼嗎?
1943.485	1946.226	信了耶穌之後,怕不怕?
1946.226	1948.647	不怕,奇妙。
1948.647	1958.252	耶穌的愛,基督的愛,現在的或將來的事,你過去生命中有做一些不可挽回的錯事嗎?
1958.252	1964.938	如果你沒有, 一定有。
1964.938	1969.662	那這樣的事,能夠讓我跟基督的愛隔絕嗎?
1969.662	1975.446	像我講的,我把我的女兒教成那樣一個樣子,現在這麼辛苦。
1975.446	1978.208	那,感謝神,她還是愛我。
1978.208	1983.231	即使這樣一個媽媽,這種樣,也不能夠讓基督的愛跟我隔絕。
1983.231	1990.615	那高處的,低處的, 我到底要住在哪裡才比較靠近基督的愛呢?
1990.615	1997.538	現在最流行的,很多朋友的講就是說,你趕快叫某某人坐飛機到臺灣來。
1997.538	2001.479	因為臺灣呢,這個新冠疫情又控制得這麼好。
2001.479	2004.660	然後呢,你看美國,那個叫做什麼?
2004.660	2008.602	水深火熱,又淹水,然後又大火。
2008.602	2011.783	然後你看香港呢,怎樣?
2011.783	2019.186	簡直是, 想像不斷的事情一直來,這個社會各方面一直在被摧毀,被摧毀。
2019.186	2021.687	趕快到臺灣來吧。
2021.687	2028.629	可是那一切的事都不能夠讓我們跟基督的愛隔絕。
2028.629	2034.911	並不是說我們要搬家或者要做什麼事是不對的,不是講這個。
2034.911	2043.118	而是說不論我們在哪裡,神的愛都在那裡跟我們 不能隔絕。
2043.118	2054.141	那另外,別的受造之物,就是凡是我們已知的之外,都不能夠讓我們跟神的愛隔絕。
2054.141	2060.682	那剛剛講到了,怎麼樣領受這個愛?
2060.682	2064.343	一樣的,是靠相信。
2064.343	2065.643	靠相信。
2065.643	2069.024	你要相信神是這樣的愛你。
2070.657	2075.240	因此在羅馬書裏面就用了亞伯拉罕的例子。
2075.240	2080.643	亞伯拉罕就是以色列人的信心之父。
2080.643	2083.745	你認為亞伯拉罕的信是怎樣的信?
2083.745	2090.409	當我們看見別人的信的時候,我們都會覺得人家的信都是很立定如山,很堅固的信。
2090.409	2095.472	我就這樣子,我就相信,我就相信,沒有人能夠推動我的。
2095.472	2096.513	我們來看看亞伯拉罕。
2098.643	2110.971	其實當你看亞伯拉罕的時候,亞伯拉罕的信,他從離開他的家鄉吳爾,出來的時候,希伯來書就告訴我們,他根本不知道到哪裡去。
2110.971	2112.892	所以你說他信什麼?
2112.892	2114.573	他信什麼?
2114.573	2116.754	他就相信神叫他出來。
2116.754	2118.235	就這樣簡單。
2118.235	2122.758	所以亞伯拉罕的信,你會發現,它不是一帆風順的信。
2123.439	2131.344	他的信是一路摸黑,一路面對未知,不知道,是這樣的相信。
2131.344	2138.989	所以當亞伯拉罕終於摸摸摸,從那個烏爾摸到哈蘭,然後他還得住在那裡啊。
2138.989	2143.172	住在那裡,前面到底要住多久,也不知道啊。
2143.172	2148.536	但是在這個中間終於摸到這個迦南地了,應許地了,結果大饑荒。
2150.316	2155.640	如果是你相信的話,如果神愛你,你會覺得怎樣?
2155.640	2162.845	我從那麼遠的地方跟隨你,跟到這個地方來,我終於到了你要來我來的地方,就怎麼飢荒呢?
2162.845	2163.085	飢餓。
2163.085	2166.968	飢餓能不能讓你跟神的愛隔絕?
2166.968	2169.510	不能啊,但是會讓你跑到埃及去啊。
2170.299	2179.828	跑到埃及去,然後就對老婆做了一個所有的世上老婆都不能夠原諒的一件事,就把她送給法老了。
2179.828	2186.335	幸虧神不讓亞伯拉罕的無能,讓撒拉跟他的愛隔絕。
2186.954	2189.437	把撒拉又帶回來了。
2189.437	2195.586	然後你就看見呢,神跟他說,哇,你的孩子要像海邊的沙,天上的星那麼多。
2195.586	2202.575	結果弄了個半天,那他就說,好,那就這個,叫做我的僕人以利以謝。
2202.575	2203.437	結果上帝說不是。
2204.360	2205.641	好吧,不是。
2205.641	2206.121	他怎麼樣?
2206.121	2207.622	他還是相信哦。
2207.622	2208.843	還是跟隨哦。
2208.843	2212.065	你已經看見亞伯拉罕生命裏面已經犯了一些錯誤了。
2212.065	2212.826	但是怎麼樣?
2212.826	2213.386	犯錯。
2213.386	2214.127	不要害怕。
2214.127	2215.328	你還是回來。
2215.328	2218.790	因為沒有能使你跟基督的愛隔絕相信他。
2218.790	2224.094	到了99歲上帝跟他說,哎,對不起,這已是瑪利也不是。
2224.094	2236.656	所以你可以看見,請問,亞伯拉罕到死的時候有沒有看見神那個滿天的星到處的 沙那麼多的後裔,他有沒有看見?
2236.656	2238.098	沒有。
2238.098	2240.841	但是羅馬書告訴我們,他是怎樣?
2240.841	2251.953	他仰望神的應許,總沒有因不信心裡起疑惑,反倒因信心裡得兼顧,把榮耀歸給神前,滿心相信神所應許的必能成就。
2253.422	2259.685	他相信他死的時候沒有看見他看見一個苗這個苗是什麼?
2259.685	2262.607	就是神雞生出來的以撒嗎?
2262.607	2293.908	但是他沒看見可是你知道神對亞伯拉罕的這個大的應許到今天這個圖畫仍然畫在我們的生命中間就是你跟我你跟我因著相信耶穌這麼幾千年下來我們仍然成為亞伯拉罕的真的子孫 這樣子大的愛的應許,這樣子能力的彰顯,是我們短短的有限的生命,亞伯拉罕有限的生命能夠看見的嗎?
2293.908	2295.168	看不到。
2295.168	2297.509	但是信心的眼睛怎樣?
2297.509	2299.290	就看到。
2299.290	2346.079	所以在我們每個人的生命裏面,你會有許多的不明白,許多的不明白,並且按照 真實的現象一個苦楚接著一個苦楚每一個苦楚都是操練我們鼠簾的肌肉讓我們跟神更加的靠近但是呢神也知道我們祂不會讓我們永遠痛苦所以苦楚一下安息一下苦楚一下安息一下越來越靠近祂因此越來越有祂的樣式在下面接著過程中間我們來看羅馬書8章25節 但我們若盼望那所不見的,就必忍耐等候。
2346.079	2350.162	要忍耐、要等候,感謝神祂憐憫我們的軟弱。
2350.162	2360.830	所以雖然我們忍耐等候,但是祂在我們忍耐等候的過程中,常常給我們一些勉勵,讓我們可以等候下去,可以忍耐下去。
2360.830	2363.252	神就是這樣子的貼心。
2363.252	2368.256	所以最後呢,就羅馬書八章二十八節,我們一起來讀。
2368.848	2379.032	我們曉得萬事都互相效力,叫愛神的人得益處,就是按祂旨意被造的人。
2379.032	2383.114	這一段經文我們太熟悉了,好,太熟悉了。
2383.114	2389.582	萬事互相效力叫愛神的人得益處, 這個為什麼我們說我們要相信神的愛?
2389.582	2395.586	因為我們在生命裡面我們有很多的我希望我的孩子婚姻幸福。
2395.586	2398.048	我希望我們的政府能夠安定。
2398.048	2400.410	我希望窮人能夠有飯吃。
2400.410	2403.292	我希望世界不要一天到晚打仗。
2403.292	2406.394	我希望那個火災主你可不可以下雨讓他能夠滅掉。
2406.834	2414.438	但是呢,神是按照祂的心意做事,因為神是好神,因為神有祂極大的一個圖畫。
2414.438	2428.604	在這個大的圖畫中間,你要因為相信神的愛,所以任何你感覺苦楚的事情,你心裡都要知道,這是為你好。
2428.604	2431.586	最後我要做一個我媽的見證。
2431.586	2435.147	我的媽媽到今年九月底,她就滿99歲。
2436.903	2444.547	所以他的身體是還不錯的,他可以自己上下床,甚至於很辛苦地自己洗澡都可以的。
2444.547	2453.572	但是呢,我跟他說,你的壽命已經超過了你眼睛的壽命,跟你耳朵的壽命,他的器官已經用得不行了。
2453.572	2463.397	所以眼睛基本上已經看不見了,連報上,我們就為了他訂報紙,因為他這樣可以知道嘛,就他現在最大的那個標題都看不見了。
2464.155	2467.536	然後聽話也是基本上聽不太見了。
2467.536	2472.157	所以電視打開來也不知道外面的訊息。
2472.157	2475.598	那天就坐在他的房間裏面。
2475.598	2477.778	他就說我已經認識主了。
2477.778	2479.939	我一生也跑到這裏。
2479.939	2482.079	我本來就是覺得要幫助大家。
2482.079	2486.080	現在不但不幫助大家人家都要來幫助他。
2486.080	2490.201	所以他就說主耶穌那你就接我去吧。
2490.201	2495.377	但是呢 他跟我講這個,我也沒辦法回答。
2495.377	2500.120	有一天吃晚飯的時候,他就回來跟我講,他說我決定了。
2500.120	2508.543	他說我跟神說,你要我活多久,我就活多久。
2508.543	2513.205	你認為他前面的活,會越活越好嗎?
2513.205	2518.728	還是越活越悶,越活越軟弱?
2518.728	2557.844	但是呢, 他就說我跟神說我決定了好像他決定要死馬上就可以死的樣子但是這是一個心態了他就說我決定了我跟神說你要我活到多久我就活到多久當我想到這個的時候我現在如果我是他我沒有辦法面對那樣子的痛苦但是呢因為是他日子如何力量也如何愛也多大 所以,弟兄姊妹們,讓我們一起來相信神的愛。
2557.844	2561.326	我們來禱告。
2561.326	2564.848	親愛的主,我們謝謝你。
2564.848	2567.610	你從來不是著急的神。
2567.610	2571.393	要我們現在就有力量,面對以後的日子。
2571.393	2573.674	你永遠是現在的神。
2573.674	2577.357	你在我現在的艱難中,你就與我同在。
2578.439	2583.782	你用你的愛來緊緊地鼓勵我,保護我,安慰我。
2583.782	2589.725	讓我看見不明白的東西,我可以因為知道你的愛,我就可以不懂。
2589.725	2596.888	讓我走不下去的,我可以因為你愛我,我就靠著你一點一點地往前挪移。
2596.888	2602.131	主啊,給我們那個對愛的相信,堅定我們的眼目,定睛在你身上。
2602.705	2608.387	我們把我們的生命獻給祢,因為我們的生命不獻給祢,獻給誰呢?
2608.387	2609.368	誰呢?
2609.368	2614.370	主啊,求祢悅納我們,這樣禱告奉耶穌基督的名。
2614.370	2614.670	阿們。