start	end	text
3.985	32.356	弟兄姊妹平安，我們一起來思想以賽亞書第六十四章。六十四章跟上一章六十三章的結構非常的類似。都是這些上帝親自設立在耶路撒冷的這些守望者。我們來回顧一下這些守望者。他們是在六十二章的六節七節裡面提到的。耶路撒冷啊,我在禰城上設立守望的,他們晝夜必不靜默。
33.353	61.054	呼籲耶和華的,你們不要歇息。也不要使他,不要使上帝,歇息。這些守望者,晝夜守望呼籲耶和華,他們不休息。然後他們也不要讓神休息。要讓神,只等到神祂建立耶路撒冷,使耶路撒冷在地上成為可讚美的。
62.056	91.478	因此這些守望者,他們非常的委身,非常的擺上。這也是神所要帶給我們真正的復興。真正的復興還不是外在的復興,而是我們這些耶和華的僕人,是否能夠成為上帝可用的器皿。這才是真正的復興。因此呢,六十三章、六十四章裡面,這些守望者,他們明白、認識神的屬性,
92.483	119.934	神一方面是公義的審判者,神另外一方面祂也是慈愛的救贖者。因此他們知道,神祂公義的審判,一定會臨到全地。沒有人站在祂面前,可以逃脫上帝公義憤怒的審判。而另外一方面,這些守望者看見,當然包含他們自己在內,他們看見他們的同胞百姓,
120.589	148.442	同時也看見自己生命中還有很多軟弱還有很多悖逆神的地方因此他們心裡就非常的著急就拼命的更迫切的禱告懇求神不要停止甚至是加速復興更新赦免祂這些軟弱的僕人們軟弱的百姓的這樣的工作不要歇息不要停止
149.497	177.664	如今我們來看第64章,也是在講一樣的道理。前面先講上帝公義的審判,一定會領到全地。後面祂就開始又在求情,又在禱告,懇求主那赦免的工作,更新的工作,繼續的進行,速速的完成。這是祂們禱告的負擔。祂們沒有看見耶路撒冷,
178.592	207.868	被在地上成為可讚美的。他只要一天沒有看見神的國是這樣子來彰顯上帝的聖潔、公義、榮耀。他們就不停止他們的呼籲、帶導跟守望。哇!真盼望我們也是加入這樣的行列裡面。六十四章第一節。願你列天而降。願山在你面前震動。我們很喜歡唱
208.643	236.962	類似的詩歌,呼求神列天而降。但是我們可能要更知道,這樣的經文,其實它都是在描述上帝列天而降,在全地施行公義的審判。那是沒有人可以擔當得起。所以我們呼求神列天而降,如果沒有明白需要上帝十字架的救贖在裡面的話,
237.824	267.226	那神列天而降,真的是全世界最可怕的事了。願禰列天而降,願山在禰面前震動,好像火燒乾柴,又像火將水燒開,使禰敵人知道禰的名,使列國在禰面前發戰、戰鬥。禰成行,我們不能逆料可畏的事。那時禰降臨,山林在禰面前
267.961	291.628	震動。第三節就講到,當初,上帝的百姓,除了埃及,過了鴻海,經過曠野,來到西乃山下,跟神立約。面對公義聖潔的上帝,百姓全部都嚇得要死。山野都震動了,然後呢,有火跟雷電的聲音。
292.329	320.997	大作所以呢百姓都非常害怕第三節就說你曾經行過我們不能逆料那些可畏那些令人感到非常可畏害怕的事情第四節從古以來人未曾聽見未曾耳聞未曾眼見在你以外有什麼神為等候祂的人行事第四節畫風一轉
321.8	351.481	從面對上帝可怕的審判要臨到全地的這一幅景象,第四節畫風一轉。自古以來,除了禰以外,沒有任何一個其他的神,能夠幫助求告祂的人,脫離上帝公義的審判。因此呢,只有禰,只有禰願意為了那等候禰的人,行大事。等候禰的人,是什麼樣的人呢?
352.261	379.936	就是等候上帝賜下救恩來赦免、悔改、醫治、更新我們這些過去軟弱犯罪的人使我們能夠重新與神和好不會被祂的憤怒、公義來審判除禰以外沒有別的神能夠救我們脫離公義憤怒的審判只有禰為我們預備一個不一樣的救恩第五節
380.845	410.073	你是那位迎接你迎接那歡喜行義紀念你道的人上帝悅納那些真實的悔改並且真實的行上帝的正道的那些人上帝稱他們為義人但是我們呢我們跟我們的同胞目前的光景真的是還不是很好甚至有些同胞有些我們所愛的人
410.435	439.272	仍然在犯罪的生活裡面。所以呢,你曾發怒,我們仍然犯罪。這景況已久,我們還能得救嗎?因此呢,這些帶導者和所望者,心裡面也是非常的著急。但是他們更是相信,神不會見死不救。神是一個不離不棄的慈愛的上帝。因此呢,即便上帝已經
440.111	466.168	發怒在我們身上。上帝的公義的管教,已經把我們管教的頭破血流了。我們已經吃盡苦頭,可是我們心還很剛硬,仍然犯罪。主啊,我們這個情況已經很久了,我們還可以得救嗎?你覺得可以嗎?可以的。因為上帝應許,要帶領祂的百姓,完全的翻轉他們。第六節,我們都像不潔淨的人。
466.749	495.516	所有的義都像汙穢的衣服。剛剛第五節我們才說,神祂要親自迎接那些歡喜,喜歡行義,喜歡活出一個義人的生活,紀念上帝正道的人。很可惜我們大部分的人偏偏都不是。那我們怎麼辦呢?我們都是不潔淨的人。我們所能夠誇口的義,在你的面前,被你檢驗的時候,
496.032	522.798	根本都是汙穢的衣服在你面前根本就沒辦法過關的我們都像葉子漸漸枯乾我們的罪孽好像風把我們吹去並且無人求告你的名無人奮力抓住你原來你掩面不顧我們使我們因罪消化我們的光景比我們自己想像的還要糟糕
523.353	550.298	我們到一個地步沒有人求告你也沒有人要奮力抓住你得找拯救而我們在這個極度灰心軟弱的狀況裡面也常常覺得你掩面不顧我們你任憑我們讓罪孽把我們融化第八節耶和華現在你仍是我們的父是的耶和華即便如此我們相信你仍然是不會放棄我們的天父
551.186	580.349	我們是泥,你是窯匠,我們都是你手的工作。耶和華,求你不要大發震怒,也不要永遠紀念罪孽,求你垂顧我們,我們都是你的百姓。這些帶導者向神禱告,我們願意成為泥土、陶土,我們尊重你就是窯匠,我們願意生命在你面前謙卑、放下,
581.527	605.625	讓禰重新來雕塑我們的生命。我們要再一次回到禰的手中,成為禰手裡榮耀的工作。第十節,禰的聖意,也就是禰的聖城,變為曠野,席安變為曠野,耶路撒冷成為荒場。我們聖結華美的殿,就是我們列祖讚美禰的所在,如今被火焚燒。
606.237	632.479	我們所羨慕的美帝竟都荒廢。耶和華,有這些事,你還忍得住嗎?你仍然靜默,使我們深受苦難嗎?這些守望者再次向神呼籲,求神速速地來進行祂救贖的工作,復興的工作,不要停止祂對我們救贖的計畫。
633.217	660.69	祂甚至說,我們從前我們的祖先在那邊讚美禰的慈愛、拯救的所在,如今都已經因為禰的管教,被火焚燒,成為荒場跟荒野。這樣的事情,禰還能夠忍住嗎?禰不是慈愛的神嗎?禰還能夠忍住禰的慈愛嗎?這個忍住,其實在上一章,六十三章,
661.391	690.395	的十五節已經出現過了那邊是被翻譯成止住了在六十三章的十五節這些守望者說求禰從天上垂顧從禰聖潔榮耀的居所觀看禰的熱心和禰大能的作為如今在哪裡呢禰愛慕我們的心腸和憐憫向我們止住了原文就是向我們忍住了求禰那愛我們的心
690.896	720.332	憐憫我們的心,不要再向我們忍住了。你之前向我們伸出公義審判的綁臂,我們受管教了。現在求禰伸出禰慈愛救贖的綁臂,使我們被禰復興。我們一起低頭來禱告。主啊,其實當我們在被管教裡面受苦的時候,禰告訴我們,禰是與我們同受患難,同受苦楚。
721.903	750.952	主禰自己最忠心的彌賽亞僕人在十字架上替我們擔當罪孽跟審判羞辱跟失敗的時候祂完全可以體會禰憐憫禰百姓的心禰真的是與禰的百姓一同哀痛一同受患難但是主禰沒有放棄禰救贖的工作即便我們不斷的悖逆禰禰還是用禰慈愛的手
752.09	780.125	要把祂們挽回。主我們看見這些禰在耶路撒冷所設立的守望者跟呼籲者。主祂們。晝夜不停的呼求禰。復興禰自己的百姓。拯救禰自己的百姓。主如今我們也要像這些守望者一樣。為我們自己。為我們的同胞。為我們所愛的家人。晝夜來呼求。向禰來呼籲。求禰不要停止。
781.271	793.035	禰在我們身上,拯救的計畫。求禰的慈愛與憐憫,不要向我們忍住。謝謝主,奉主耶穌的名禱告。阿們。願神賜福大家。