start	end	text
4.189	5.810	弟兄姊妹平安，我們一起來思想。
5.810	10.373	哥倫多前書第九章第十五節到最後。
10.373	15.657	保羅說但這全餅我全沒有用過。
15.657	65.705	也就是祂是使徒祂是傳福音的全時間主的工人但祂從來沒有用過那些禮當讓教會來供應祂經濟跟生活所需的一切的這種全餅祂都沒有用過 保羅說我現在對你們寫這個話並非要你們這樣對待我保羅說我現在提醒你們這件事情不是要提醒你們以前沒有這樣子供應我保羅說我不是這個意思因為我寧可死也不叫人使我所誇的落了空保羅說我寧可死也不要我所誇口的落了空他誇口什麼十六節 保羅說我傳福音原沒有可誇的,因為我是不得已的。
65.705	69.107	什麼叫做傳福音是不得已的?
69.107	74.109	原文叫做不得已的,原文叫做被所需要壓著。
75.265	116.211	被必須壓著也就是說保羅他傳福音的時候他生命裡面覺得他被一個負擔一個天大的負擔緊緊的壓在他的生命他的心裡面壓在他的靈魂上面就是傳福音我必須傳福音把福音傳揚給世人這是必須的事情 因此這就是保羅傳福音的態度他說因為我是不得已的因為我被必須傳福音這樣的使命感深深的壓著壓在我的心上壓在我的靈魂上面 然後呢若不傳福音我便有禍了。
116.211	118.492	不是說他不傳福音上帝就要咒詛他。
118.492	124.714	而是說一種對傳福音有這種這麼強烈的熱烈使命感的人。
124.714	129.155	他會覺得我若不傳福音我這個人活著也沒有意義了。
129.155	129.936	我就完蛋了。
130.930	132.091	十七節。
132.091	136.994	我若甘心樂意做這件事情﹐就有賞賜。
136.994	144.178	我若不甘心樂意去傳福音﹐這個傳福音的責任﹐也已經託付給我了。
144.178	149.121	那他若甘心樂意來傳福音﹐他的賞賜是什麼呢?
149.121	152.083	既是這樣﹐我的賞賜是什麼呢?
152.083	159.667	就是我傳福音的時候﹐叫人不花錢得福音﹐免得用盡我傳福音的權柄。
160.845	181.816	保羅在第九章的上半段講到作為一個傳福音的使徒他有權柄讓教會供應他一切經濟生活上所需要的但是保羅說他從來不使用這個權柄 不要讓這個權柄用掉、用盡。
181.816	183.999	因為它只有一個目的。
183.999	187.723	它要讓領受福音的外邦人知道。
187.723	191.448	福音不是你用錢、花錢買來的。
191.448	194.472	福音就是白白的恩典。
194.472	195.213	是你不配。
195.964	198.945	也不能,也不該得的。
198.945	202.925	但上帝白白的恩待了你們。
202.925	211.687	我想特別對於哥林多的市民來講,他們是一群白手起家苦過來的人。
211.687	223.570	如今在經濟上有一些成就,但是特別是這樣背景的人,有沒有可能對於金錢這個事情,有時候比較在意。
224.633	247.180	有沒有可能保羅在一開始跟他們傳福音的時候,就特別有感受到這一點,以至於他打定了一個主意,他要傳白白的福音,甚至是也不接受他們在經濟上的供應,要讓他們知道,其實福音是花錢買不到的,要感恩,要謙卑,要領受。
247.180	258.697	我們繼續往下看,十九節,保羅說我雖是自由的, 沒有人這個能夠逼迫他做什麼事情的,無人俠管。
258.697	265.283	然而我甘心做了眾人的僕人,為要多得人。
265.283	269.587	像猶太人,我就做猶太人,為要得猶太人。
269.587	278.014	像律法以下的人,我雖不在律法以下,還是做律法以下的人,為要得律法以下的人。
278.780	282.982	保羅他說他向猶太人傳福音。
282.982	291.667	他向這個在接受摩西律法的這些在律法以下守律法的人傳福音的時候。
291.667	293.168	保羅知道一件事情。
293.168	299.051	我們在整個這個哥倫多前書一到四章就講了一個最重要的觀念。
299.051	303.133	保羅認為整個基督徒生命的根基。
304.906	333.408	這個價值觀的總原則就是耶穌基督為我們這個罪人釘了十字架的這個救恩道理其他的都是次要的其他的希臘羅馬人的文化價值觀猶太人的文化價值觀或是外邦人他們還沒有信主之前他們說 渴望的﹐或是偏好的﹐一些主流思想﹐人生觀。
333.408	335.869	保羅認為那個都是次要的。
335.869	345.997	最重要的是要明白﹐耶穌基督在十字架上﹐為我們這個罪人而死的﹐這個白白救恩的福音道理﹐才是最主要的。
345.997	350.240	因此保羅他不會被這些次要的問題捆綁。
350.240	353.422	因此他像什麼人﹐他就做什麼人。
353.422	356.184	他不在這些次要的問題上﹐跟別人起衝突。
356.544	392.336	例如說21節像沒有律法的人就是沒有接受摩西律法的外邦人他就做沒有律法的人為要得著沒有律法的人其實我在神面前不是沒有律法在基督面前正在律法之下保羅說不要誤會喔我不是不遵守各種有形無形的律法在基督的面前我就是遵守基督的律法也就是十字架救恩的道理 二十二節,像軟弱的人,我就做軟弱的人,為要得著軟弱的人。
392.336	396.762	不是說有人軟弱,我就跟他一起爛,一起犯罪,不是的。
396.762	405.212	例如說,之前在這個第八章的時候,講到那些 認為偶像算不得什麼。
405.212	409.193	所以吃祭拜偶像之物沒有什麼。
409.193	413.454	特別是到人家廟會裡面去吃廟的流水席。
413.454	414.634	那沒有什麼。
414.634	419.295	然後就強逼那些有疑慮的弟兄妹一起來吃。
419.295	421.696	逼他這樣來操練信心。
421.696	426.078	保羅說 你讓那些軟弱弟兄的良心受虧損。
426.078	429.841	他吃了之後回去一直定罪自己。
429.841	431.683	這種就是沒有愛心。
431.683	435.285	因此保羅說他像軟弱的人他就做軟弱的人。
435.285	440.769	他不強逼他們做超過他們信心能夠去做的事情。
440.769	444.872	因為他要用愛來陪伴扶持他們。
444.872	449.456	所以呢保羅說像什麼樣的人我就做什麼樣的人。
449.974	452.535	無論如何總要救些人。
452.535	457.357	他的中心思想就是要傳福音救人。
457.357	459.799	因為他傳福音是不得已的。
459.799	464.741	他傳福音是被必須所壓著的。
464.741	472.345	凡我所行的,都是為福音的緣故,為要與人同得這福音的好處。
472.345	478.287	豈不知在場上賽跑的都跑,但得獎賞的只有一人。
478.287	482.117	你們也當這樣跑, 好叫你們得獎賞。
482.117	485.981	凡較力爭勝的,諸事都有節制。
485.981	492.689	他們不過是要得能壞的冠冕,我們卻是要得不能壞的冠冕。
492.689	496.233	所以,我奔跑,不像無定向的。
496.233	498.196	我鬥拳,不像打空氣的。
498.814	505.178	我是功課己身,叫聲服我﹔恐怕我傳福音給別人﹔自己反被棄絕了。
505.178	526.438	保羅最後用這個希臘羅馬背景的人最熟悉的這個體育競賽來勉勵哥林多教會的人要效法保羅保羅說在這個場上賽跑比賽的大家都在跑 但最後這個得獎賞的得勝的也只有一個人。
526.438	532.344	他說凡較力爭勝的就是參加競賽的諸事都有節制。
532.344	540.210	代表他都要經過過程中經過很嚴格的 自我訓練、自我的克制。
540.210	544.593	在飲食、在練習上面要付很大代價。
544.593	578.464	保羅說他們這麼努力的為了這個目標付這麼大的代價克制自己、訓練自己然後努力向前為了這個目標可以放下所有其他這些次要的問題次要的這些評估他們只不過是要得著一個會壞掉的冠冕 何況是我們這些要得著不會壞掉的冠冕的人我們豈不是該比這些專業的運動員更加的努力更加的向著標竿直跑嗎?
578.464	583.498	因此保羅說他奔跑 不像無定向的。
583.498	586.039	他跑,他知道自己在做什麼。
586.039	589.080	他知道自己是一個福音的跑者。
589.080	592.642	他為了要把福音傳給更多的人,多德人。
592.642	595.083	他不計較任何的東西。
595.083	596.564	他要為主多德人。
597.244	627.213	他說我鬥拳不像打空氣的我一拳打出去參加拳擊比賽一拳打出去我要正中目標正中紅心因為我知道我自己在做什麼二十七節保羅說我是功課己身叫聲服我保羅說我參加比賽最大的對手就是我自己我跟我自己比賽我要讓我自己這個 往著一個目標。
627.213	629.754	就是傳揚福音的目標。
629.754	631.215	過我的一生。
631.215	633.916	其他的我覺得都沒有關係。
633.916	635.157	都無所謂。
635.157	636.878	我要為主多得靈魂。
637.910	642.893	保羅說,恐怕我傳福音給別人,自己反被棄絕。
642.893	649.316	棄絕不是說下地獄滅亡,而是原本是失去競賽的資格,被淘汰。
649.316	665.965	保羅說,我是在傳福音了,可是我自己這個跑者,我也要好好的讓自己不斷地成長,不斷地更為傳福音發熱發光,免得我在這一場比賽裡面,我還沒有跑到終點,我就被淘汰了。
666.425	669.789	今天保羅給我們的分享,非常感動人。
669.789	673.914	弟兄姊妹,保羅他這一生,就是為福音奔跑。
673.914	676.937	而我們這一生,也是如此嗎?
676.937	683.555	還是我們跟哥林多教會的人一樣,我們信了主之後, 祖克意味。
683.555	684.776	顛倒過來。
684.776	702.109	反而是透過靠信主耶穌來完成以前我們在世界上所得不到的身份、內涵或是這些頭銜或是財產或是安全感、幸福感、價值感。
702.109	755.927	耶穌基督只是幫助我們得到以前我們在世界上、在社會上 做一個失敗者或是二等公民的時候所得不到的那些夢想那些境界今天透過信主耶穌來幫助我們得到那一些是這樣嗎那這個就是顛倒了我們一起來禱告主我們今天透過保羅的分享主我們說主啊祢感動保羅的靈加倍的感動我們 保羅說他被必須傳福音這樣的一個熱情使命感深深的壓著他的生命無法迴避這樣的護照因此他像什麼人他就做什麼人他生命中分得清楚優先次序那些不是耶穌基督十字架道理的價值觀 祂認為都是小事。
755.927	757.607	祂不會被那個拘泥住。
757.607	759.748	祂也不會被那個定罪。
759.748	762.489	祂也不靠那些來稱義。
762.489	766.811	祂只是忠心的做十字架福音的僕人。
766.811	772.493	主啊願祢把保羅這樣的一個心,這樣的一個精神,主啊也分賜給我們。
772.493	775.474	好像我們這一生,主啊奔跑不是沒有定向。
776.510	779.231	鬥拳不是向空氣打拳。
779.231	784.013	讓我們主啊,真的是在傳福音給別人的時候,我們自己沒有被淘汰。
784.013	789.535	謝謝主,聽我們的禱告,奉主耶穌基督的名,阿們。
789.535	790.536	願神祝福大家。