start	end	text
18.865	23.432	弟兄姊妹平安，我們繼續按照每日言經事義的進度繼續來思想。
23.432	113.328	創世紀第34章的18節到最後哈姆就是事件城的城主和他的兒子事件喜歡字化 雅各的兒子們說要結婚要通婚可以你們要受割離男人都要受割離因為我們這個是敬拜耶和華的我們都受割離再來你們做這麼不要臉的事強暴了我們的妹妹你們是不乾淨的除非你們也願意受割離然後分別為勝才算為潔淨的不然你們太骯髒了我們不要跟你們通婚 所以哈某跟他的兒子事件喜歡這話那少年人就是事件做這事並不言辭就回去立刻做因為他喜愛雅各的女兒他在他父親家中也是這個人最尊重的因為是個事件成了王子 哈姆在他兒子事件到本城的門口對本城的人說這些人與我們和睦不如許他們在這地居住做買賣這地也寬闊足夠可以容下他們我們可以取他們的女兒為妻他們也可以把我們的女兒嫁給他兒子 唯有一件事我們必須做,他們才肯應允與我們同住,成為一樣的人民。
113.328	118.670	就是我們中間所有的南丁都要受割離,和他們一樣。
118.670	125.053	他們的群畜、財貨和一切的牲口,豈不都歸我們嗎?
125.053	129.275	只要依從他們,他們就與我們同住。
129.275	142.153	這個城主呢,他就在城門口召聚所有的南丁說, 這些人跟我們之前也都和平相處,不如讓他們在這個地方就定居吧,也可以做買賣。
142.153	147.954	我們這個地方是一個大城,也很寬闊,容納他們這些人口沒有問題。
147.954	155.687	那我們可以進一步來通婚, 然後,而且通婚之後呢,說穿了,他們就變世間人啦。
155.687	162.553	那,這個他們一切的財富跟人口,和身口,也不就歸世間了嗎?
162.553	165.715	這個對我們來講,這是很划算的。
165.715	174.243	但是呢,如果要通婚,他們也要求我們,就是我們要受割禮,這樣子才可以跟他們一樣。
174.243	177.886	因為他們的男人也都受割禮,所以我們的男人也需要受割禮。
179.428	197.919	二次節,凡從城門出入的人都聽從哈姆和他兒子事件的話,大家就聽從領袖的吩咐,而且覺得這樣也不錯,無形中的併吞了這些人的人口跟產業,事件也可以壯大。
197.919	228.647	於是凡從城門出入的男子、男丁都受了割離,到了第三天,就是割離完第三天,眾人正在疼痛的時候, 受割離,就是把生殖器山的包皮割掉,在還沒有復原傷口那幾天是很痛的,到第三天可能是最痛那一天,眾人正在疼痛的時候,雅各的兩個兒子,就是抵拿的, 哥哥西緬跟利未。
228.647	229.948	雅各有四個太太嘛。
229.948	234.131	那底拿是這個利雅生的。
234.131	237.874	那這個西緬跟利未也是利雅生的。
237.874	240.376	所以是同父同母的親哥哥。
240.376	245.140	他們就是很生氣他妹妹被人家欺負。
245.140	252.085	所以他們就各拿刀劍趁著眾人想不到的時候來到城中把一切事件成的南丁都殺了。
252.841	257.963	事件城裡面的男丁根本連走路都有困難,因為傷口痛得不得了。
257.963	276.550	所以這些雅各的兒子們,可能也率領一些僕人們進來,就殺了所有事件城裡面的男子,又用刀殺了哈姆,就是城主和他的兒子事件,把底拿從事件家裡帶出來就走了。
276.550	277.551	代表什麼?
277.551	284.779	底拿被強暴之後,人被扣留在事件城裡面, 所以這些人也是蠻可惡的。
284.779	288.141	所以這個時候就趕快把他的妹妹也救出來了。
288.141	296.725	雅各的兒子們因為他們的妹子受了玷污,就來到被殺的人那裡,擄掠了那城。
296.725	297.725	看起來是怎麼樣?
297.725	304.328	就是說帶頭的是西緬利未,可是其他的兒子們好像也都參與了這樣的行動。
304.328	309.331	當然也包含了他們家的那些僕人們,一起參與了屠殺的行動。
309.991	311.551	然後就這個怎麼樣?
311.551	321.093	就奪取了士賤城他們的羊群、牛群和驢並成立還有田間所有的一切的財產。
321.093	329.975	男人殺光之後又把他們一切的財貨還有孩子、婦女並房中所有的一切都擄掠去了。
329.975	330.655	代表什麼?
330.655	337.337	就是男的殺光小孩跟婦女全部搶走財產也全部都把他搶走一空。
338.490	351.202	雅各知道這個事情之後,就對西面和立位說,你們連累我,使我在這地的居民中,就是迦南人和比利喜人中,有了臭名。
351.202	359.851	我的人丁既然稀少,他們必聚集來擊殺我,我和我的全家的人都必滅絕。
360.964	370.360	雅各說你們兩個帶頭做這樣的事情你就不怕迦南人跟比利時人他們來為事件成的人報仇嗎?
371.374	374.735	我們人口比不上這些加拿人。
374.735	377.616	我們又是來這邊寄居的。
377.616	379.556	他們如果來報仇。
379.556	381.677	我們全部死光了。
381.677	384.238	然後雅克就覺得很煩。
384.238	386.318	剛剛才這個。
386.318	389.299	逃過拉班的追殺。
389.299	391.980	後來又逃過以掃的追殺。
393.166	394.987	好不容易都穩定下來了。
394.987	396.468	現在又。
396.468	398.530	捲入事件層這個事件。
398.530	401.051	我們接下來要面對的是。
401.051	402.532	迦南人的追殺。
402.532	404.614	那是更可怕的事情。
404.614	407.215	整個迦南地區的人都會以我們為敵。
407.215	410.818	你這樣是會讓我們滅族。
410.818	412.099	雅各真的很辛苦。
412.099	413.920	雅各他就是這20年來。
413.920	416.361	幾乎沒有一天有好日子過。
416.361	417.562	到處都在搏鬥。
417.562	419.684	到處都在。
419.684	422.325	跟拉班搏鬥。
422.325	422.966	跟田野。
423.660	458.106	惡劣的環境搏鬥,跟田野的野獸,要來搶牠的牧的羊,來搏鬥,跟拉班的兒子們搏鬥,然後又要逃跑的時候,又要面對拉班的追殺,面對姨嫂的追殺,好不容易穩定下來,現在又要這個,然後女兒又被人家強暴欺負,然後現在,兒子又殺了人家全部的男人,然後接下來加拿人,不知道會對我們怎麼樣, 雅各這20年真的,不是人過的日子,很痛苦。
458.106	467.010	他這樣子責備他的兒子們,可是他的兒子西米跟立威說,他們說,他豈可待我們的妹子如同妓女嗎?
467.010	471.832	這兩個兒子也不甘示弱說,我們就任憑我們的妹妹這樣被欺負嗎?
471.832	474.333	把她當妓女糟蹋嗎?
474.333	478.475	所以看起來雅各,也真的是不知道該怎麼辦。
478.475	481.096	我們看今天的經文,我們一起來禱告。
482.995	521.674	主有時候我們血氣上昇的時候我們做事情不會考慮結果因為我們不願意讓這個事情由耶和華來審判由耶和華來判斷因為妹妹抵拿的名字意思就是判斷主 懇求主在我們大小事情上 特別在我們憤怒生氣祈禱想殺人祈禱想玉石俱焚祈禱想報復的時候求聖靈在我們心中將我們的心思意念奪回到上帝的面前使我們在神的面前可以安靜 使我們來尋求神的面。
521.674	522.975	讓神做判斷。
522.975	525.036	讓神來審判。
525.036	527.138	讓神告訴我們該怎麼做。
527.138	529.439	而不是在血氣中行事。
529.439	530.560	求主憐憫我們。
530.560	531.460	幫助我們。
531.460	533.121	奉主耶穌的名禱告。
533.121	533.942	阿們。
533.942	535.423	願神賜福大家。