start	end	text
18.899	58.048	弟兄姊妹平安，我們繼續按照每日嚴經事宜的進度繼續來思想創世紀第五章的十八節到最後也請各位可以繼續來支持訂閱這本每日嚴經事宜的手冊對於幫助我們養成每日讀經靈修的好習慣有非常大的幫助你可以個人使用、小組使用也可以全教會使用 而我們所錄製的每日眼睛事宜的這個視頻就是針對它來當作進度進行雲文、歷史地理背景還有神學還有教牧生活實踐的一些應用的補充。
58.048	76.133	我們就來看5章的18節繼續來看亞當的一個兒子賽特還有他的後代的這個家族的戲譜18節雅烈活到162歲 生了以諾以諾這個人非常有名我們待會介紹他。
76.133	83.094	雅列生以諾之後又活了八百年並且生兒養女。
83.094	87.956	雅列共活了九百六十二歲就死了。
87.956	94.617	雅列是聖經裡面所記載活的第二長壽的人活了九百六十二歲。
94.617	108.307	二十一節以諾活到六十五歲生了馬吐撒拉 以諾生瑪土撒拉之後,與神同行三百年,並且生兒養女。
108.307	117.074	以諾共活了三百六十五歲,以諾與神同行,神將他娶了去,他就不在世了。
117.074	120.316	我們特別來解釋一下以諾這個部分。
120.316	137.201	我們發現從這個之前人類犯罪之後,就要面對一個很嚴肅的問題, 神告訴亞當說你們如果不聽我的話犯罪犯罪的結局就是死。
137.201	142.675	因此在他們犯罪之後我們就看見 這個兩個很重要的線索。
142.675	145.836	第一個,就是他們不能與神同在了。
145.836	147.797	他們不能與神同行了。
147.797	155.802	他們從伊甸園被趕出去,從伊甸園的大門口,在東邊朝東的部分。
155.802	163.026	我們之前也談過,伊甸園也可以看成是人類第一個敬拜上帝的聖所,會墓。
163.026	167.228	那這個會墓的門口,聖殿的門口也都是朝東。
168.729	175.891	亞當夏娃就被趕出去了,沒有辦法繼續與神同在,繼續與神同行。
175.891	188.573	而他們所生的兒子該隱更慘,該隱殺了他的弟弟亞伯之後,繼續被神放逐趕得更遠,所以就更不能與神同在。
188.573	206.459	該隱那時候跟這個耶和華求情說,我現在被你趕得往東邊更遠去了,我就不能見你的面了, 我很怕其他﹐亞當的﹐兒子們﹐或是他的後代們﹐會追殺我﹐因為我殺人。
206.459	217.146	所以我們看見說﹐該隱他就是﹐與神越隔越遠﹐不能與神同行﹐不能與神同在﹐甚至不能見神的面。
217.146	223.841	所以我們就可以看見﹐ 能不能與神同行,就是一個很重要的一條線索。
223.841	242.840	而到第五章的時候,我們可以看見,第五章從第一節開始一直往下,雖然我們看起來,這個亞當另外一個兒子賽特,還有他的後代以挪氏的子孫們,都活了好幾百歲,八百多歲、九百多歲,但他們的結局都是怎麼樣?
242.840	242.860	死。
243.609	247.216	每一個人都是活了幾歲就死了,活了幾歲就死了。
247.216	253.728	就算你覺得好像活了好幾百歲夠長,但結局還是死,還是得接受這個犯罪的結果。
254.940	288.954	所以我們在以諾身上就看到神留下了一個美麗的一個記號或伏筆以諾可以與神同行而且可以與神不僅在地上同行三百年而且神因為太喜歡他了因為他非常敬畏神很愛神神就讓他不會死沒死以諾的結局是沒有死直接被神接走了 所以他是一個不僅在地上與神同行三百年的人,他最後是永遠與神同行。
288.954	295.762	第二個,他在地上,他的結局沒有死,他是直接被神接走了。
295.762	344.059	所以以諾給我們一個很美的記號,其實神對人的心意, 還是希望人可以永遠與祂同行永遠與祂同在第二個神對人美好的心還是希望人不要死人不要繼續活在罪的懲罰跟結果裡面因為罪的公價就是死所以以諾是一個很美的記號祂永遠與神同行與神同在第二個死在祂生命中沒有全世祂永遠活著 那這讓我們很感恩,這個就是一個預告,代表說我們這一些信靠主耶穌十字架救恩的人,我們也可以靠著主耶穌基督,我們可以永遠與神同在。
344.059	356.429	我們就算在地上的肉體的生命有一天會死,但是我們的靈裡面的生命卻永遠不會死,我們永遠與神同在,永遠與神同行。
356.429	438.095	這邊也有一些小部分可以讓我們有一些提醒, 雖然這個以諾他與神同行三百年但他並沒有離家出走他也沒有躲到修道院裡面去他繼續生兒養女所以弟兄姊妹與神同行講的不是這個躲到深山裡面去離開家庭出家去了與神同行指的是對上帝一種敬拜的態度與神同行指的是一種 一種敬愛神愛神愛人的生活方式再來整個這個亞當的後代特別是這個以諾氏的後代裡面這個以諾是活的壽命最短的人他只活了365年 他的爸爸亞烈是活第二久的世界上壽命第二長的人962歲他的兒子更不得了他的兒子馬吐沙拉是活最久的人活到969歲我們來看一下馬吐沙拉活到187歲生了拉麥馬吐沙拉生拉麥之後又活了782年並且生兒養女馬吐沙拉共活了969歲就死了 我們可以看見以挪氏的後代有拉麥、馬吐薩拉。
438.095	446.100	而該隱的後代也有拉麥這些類似的名字。
446.100	451.504	因為他們基本上來講都是親戚,所以取一樣的名字也不會特別奇怪。
451.504	459.609	這給我們一個省思,人其實不一定要地上活得久,重點是活的品質怎麼樣。
460.623	549.955	弟兄姊妹每個人會活多久我們不知道但重點你是否願意珍惜每一天與神同行像以諾一樣的那才是有意義的人生28節拉麥活到182歲生了一個兒子給他起名叫挪亞挪亞的意思就是休息使人可以休息下來停下來可以得到安慰 這個拉麥就說這個兒子必為我們的操作和手中的勞苦安慰我們代表就是說這個拉麥他們在地上也是需要辛苦的工作也需要這個面對許多生命中的挑戰以挪世這個系統的後代都是屬於敬畏神的人在這個新約彼得後書二章五節 那邊有一段很難解的經文那邊講到說這個挪亞一家八口挪亞是傳義道的一個人傳公義的道他是一個傳神公義道理的傳道者然後他這個一家八口得救其實在這個彼得後書二章五節他 希臘文真正的原文是,挪亞是第八個公義的傳道者。
549.955	551.896	什麼叫第八個?
551.896	556.498	是他這個挪亞他們全家的第八,他們全家有八個人的意思嗎?
556.498	570.287	其實不是的,就是從以挪氏開始,以挪氏開始是第一代的話,挪亞是第八代,代表以挪氏開始呼求耶和華的名, 他的後代的子孫呢。
570.287	572.328	都是呼求耶華的名。
572.328	574.568	都是耶華公義的傳道者。
574.568	577.149	那所以呢。
577.149	579.689	我們就繼續往下看。
579.689	580.229	拉麥呢。
580.229	582.030	他們都還記得一件事情。
582.030	587.071	就是神給這個夏娃有審判。
587.071	590.752	但是神給夏娃也有救贖的預言。
590.752	592.592	就是夏娃呢。
592.592	595.593	他會有一個女人的後裔。
595.593	596.913	就是女人的種子。
597.756	600.499	祂要給人類帶來休息。
600.499	601.400	帶來安息。
601.400	603.202	帶來安慰。
603.202	605.464	因為祂要勝過魔鬼。
605.464	607.086	就是蛇。
607.086	608.727	祂要傷蛇的頭。
609.957	613.640	就是致命的一擊,祂要真正的制服罪惡。
613.640	619.505	而蛇會傷女人的腫子,或是女人的後衣的腳跟。
619.505	625.550	代表女人的後衣在跟魔鬼爭戰的時候也會受傷,但是只傷到腳跟。
625.550	629.474	但是魔鬼卻傷到頭,致命的一擊。
629.474	633.698	我們從新約就告訴我們,那個女人的後衣指的就是耶穌基督。
634.258	682.348	拉麥生這個兒子挪亞的時候他也很希望他的兒子就是那個傳說中的女人的後裔能夠給他們帶來安慰 我們繼續往下看他說這個兒子必為我們的操作和手中的勞苦安慰我們這操作勞苦是因為耶和華咒詛帝所以代表拉麥他也很希望說這個全地被耶和華咒詛的這個問題能夠解決他們都盼望救贖的來到這都是因為人犯罪的結果亞當犯罪的結果帝就被咒詛了 拉麥生挪亞之後,又活了五百九十五歲,並且生兒養女。
682.348	688.251	拉麥共活了七百七十七歲,七七七歲就死了。
688.251	691.853	挪亞五百歲生了閃含雅佛。
691.853	699.837	這句話的意思就是說, 要嘛就是挪亞從500歲開始生小孩。
699.837	706.979	要嘛就是挪亞在這個500歲之前就把小孩都生完了。
706.979	715.341	那我們從接下來的幾個章節裡面,我們會發現應該是挪亞在500歲開始生孩子。
715.981	719.002	那這個接下來我們會再說明。
719.002	720.683	我們先一起來禱告。
720.683	726.885	主讚美祢,主願我們世世代代都成為上帝公義的傳道者。
726.885	736.979	主願我們生命活著,不在於活得長或短, 在於活者有沒有品質,在於活者是不是與神同行。
736.979	767.103	謝謝主,主耶穌你是那位應許裡面女人的後裔,女人的種子,你傷了魔鬼的頭,你在十字架上為我們受的苦難, 拯救我們安慰我們使我們離開罪的咒詛使這個世界也不再成為被咒詛的對象謝謝你你是我們生命中真正的安慰者真正的救贖者奉耶穌基督的名禱告阿們願神賜福大家