start	end	text
3.865	6.066	弟兄姊妹平安，我們一起來思想。
6.066	9.668	哥林多後書第五章第十一節到最後。
9.668	14.090	我們既知道主是可畏的，所以勸人。
14.090	14.810	為什麼呢?
14.810	25.776	因為第十節保羅說我們眾人有一天當耶穌基督第二次再來的時候我們都要在基督的台前向主交賬。
25.776	31.638	上帝要按著我們行善或行惡來報應我們個人。
32.739	36.320	因此我們在神面前是顯明的。
36.320	39.362	我們沒有辦法瞞得過神。
39.362	44.244	我們這一生在神的面前,神都看得一清二楚。
44.244	47.845	所以千萬不要自欺欺神。
47.845	53.928	不要以為我們這一生可以糊裡糊塗的就這樣過去。
53.928	57.309	因此保羅說我們在神面前是顯明的。
57.309	58.230	因為我們敬畏主。
59.172	67.439	但保羅更盼望說在你們哥林多人的良心裡我們也是顯明的。
67.439	93.585	因此在哥林多後書裡面保羅一直在解釋辯護不希望哥林多教會弟兄姊妹因為對保羅一些計畫上的安排或是一些言詞上的表達對保羅產生誤解 以至於,連同保羅向他們所傳揚的耶穌基督的福音,也被哥林多教會的弟兄姊妹所拒絕。
93.585	104.157	所以保羅希望說,我盼望在你們的良心裡,我們對你們也是顯明的,沒有任何的攔阻,沒有任何的障礙物。
105.077	109.924	我們不是向你們再一次的舉倦自己。
109.924	113.990	保羅說,乃是叫你們因我們有可誇之處。
114.940	116.460	向誰誇呢?
116.460	124.382	好對那憑外貌,不憑內心誇口的那一群假教師。
124.382	138.486	保羅說,我不是要再一次的自己說自己有多好,乃是要再一次的把我們當中一些障礙物拿掉,使我們在你們的良心裡面是顯明的。
139.224	174.670	讓你們去回想並且更認識我們跟你們相處的這一段時間裡面的形式為人好叫那些趁我們不在你們當中的時候來攻擊我們的一些假教師可以被你們為我們所做的見證所博導他們就不再隨便攻擊我們這些人呢他們是憑外貌不憑內心誇口的人 他們外貌原文是臉,憑臉誇口,不憑心誇口的人。
174.670	180.374	保羅說,我跟你們之間如果是顯明的,你們就懂我們的心了。
180.374	183.877	你們就知道我們的內心,我們真實的為人。
183.877	189.241	就不像是那些只看外面表象來誇口的人。
189.241	197.187	因此保羅希望他跟哥林多的弟兄姊妹之間是沒有隔閡的,真的是心跟心之間的交往。
198.148	227.367	13節保羅說我們若果癲狂是為神若果謹守是為你們保羅他已經沒有任何的後顧之憂了他是為主耶穌基督的福音全力擺上以至於別人看保羅覺得他們是瘋狂的人其實每一個蒙了耶穌基督福音拯救大恩的人都應該像保羅一樣 沒有後顧之憂。
227.367	229.409	再也沒有保留的。
229.409	232.411	領受新約的執事。
232.411	235.193	傳揚耶穌基督救人。
235.193	240.958	使人出黑暗,入奇妙光明的福音的這種使命。
241.578	242.799	沒有保留的。
242.799	245.182	與主同心與主同行。
245.182	247.925	那在世人來看這個是癲狂的。
247.925	253.510	可是保羅認為這是蒙恩的人最自然最正常的表現啊。
253.510	255.472	這又哪有什麼奇怪的。
255.472	259.837	但是保羅說可是為了要傳揚福音給人的緣故。
260.503	266.029	免得別人對我們又有一些誤解啊,不必要的論斷。
266.029	276.680	所以我們對神雖然是癲狂的,但我們對人,對你們哥林多人,我們是謹守的,是循規蹈矩的,是沒有亂來的。
276.680	284.159	免得你們對我們產生誤會, 拒絕我們這個人,連我們所宣揚的福音,你們一併也拒絕。
284.159	289.260	哇,那這就不得了,得不償失。
289.260	296.702	14節,原來基督的愛激勵我們,因我們想,一人既替眾人死,眾人就都死了。
296.702	306.765	並且祂替眾人死,是叫那些活著的人,不再為自己活,乃為替他們死而復活的主而活。
307.585	336.355	保羅說因為耶穌基督已經一個人替我們眾人的罪惡付上了代價祂替我們死在十字架上以至於我們就可以不用再害怕面對上帝公義的榮光 我們就不用再害怕,我們會進入永遠的死亡,永遠的滅亡,上帝公義的審判。
336.355	343.563	因此保羅說呢,面對滅亡,面對死亡這件事情,我們已經死過了。
344.224	354.908	所以我們人生在世,現在要好好面對的,不是死亡的問題,不是滅亡的問題,因為我們已經出死入生了。
354.908	358.029	我們現在要好好面對的是活著的問題。
358.029	361.830	弟兄姊妹,這是每一個基督徒最大的問題。
361.830	368.413	不知道為誰而活,不知道如何而活,不知道活著是為了什麼。
368.933	377.097	因此保羅說,祂替眾人死,是叫那些活著的人,不再為自己活。
377.097	385.100	當你只是為你自己活,你就真的會不知道為什麼你還要活著,你活著是要做什麼。
385.100	392.364	弟兄姊妹,保羅說,乃是要為替他們死而復活的主而活。
393.268	399.631	很多人在想說有一天我來到基督的臺前。
399.631	405.154	很多人在擔心那時候到底上帝是會判我上天堂還是判我下地獄?
405.981	411.144	這個我到底是會進天堂還是進到地獄永遠滅亡。
411.144	415.727	這個對保羅來講他的思考從來不在這個層次裡面。
415.727	417.929	這個層次太低了。
417.929	429.676	保羅認為他所挂慮的一切事情就是將來在基督的臺前的時候 到底主看他是不是一個忠心的仆人。
429.676	438.400	有沒有好好把托付給他的新約的職事,就是傳揚耶穌基督救人的福音的道理,忠心的傳揚出去。
438.400	441.401	這才是保羅在基督臺前所擔心的事。
441.401	446.703	而不是擔心說在基督臺前到底是被判上天堂,還是被判決下地獄。
446.703	452.145	弟兄姊妹, 在基督臺前的時候你所面對的是什麼呢?
452.145	455.125	你所擔心的、挂慮的是什麼呢?
455.125	485.510	是跟保羅一樣是否忠心沒有違背主給我們的托付和使命還是只是今生渾渾噩噩而活然後基督再來的時候心中擔憂不知是上天堂還是下地獄十六節所以我們從今以後不憑著外貌 認人了,雖然憑著外貌認過基督,如今卻不再這樣來認祂了。
485.510	495.873	十六節這邊不憑著外貌,原文是肉體,跟在第十二節說憑外貌夸口,那個外貌是臉的意思。
495.873	499.114	但是中文都翻外貌,但是意思都差不多。
500.316	508.124	保羅說,我們從今以後不會再憑著外貌或肉體來認基督。
508.124	511.487	也就是說,什麼是外貌,什麼是肉體?
511.487	520.536	就是那些不是聖經的真理的那一些價值觀,那一些人的好物,那一些人的標準。
521.237	523.138	來判斷基督。
523.138	525.459	以及來判斷聖徒。
525.459	529.401	保羅其實在哥林多前書後書一直在講一個觀念。
529.401	533.984	他提醒弟兄姊妹不要再用你信主之前。
533.984	541.068	你在外邦社會裡面的那一些價值觀那一些標準不要把它夾帶進教會。
541.068	549.892	然後今天不是用耶穌基督十字架的真理來判斷聖徒的生活生命該怎麼塑造。
550.913	574.606	還繼續使用以前你還沒有信主的時候的那一些世俗的觀念價值觀來評估我是不是一個成功的基督徒或是別人是不是一個成功的基督徒這都是憑外貌來認人 保羅以前也是憑外貌來認基督,以至於他認不出耶穌就是基督。
574.606	579.589	而且還拼命逼迫基督徒,殺了很多的基督徒。
579.589	584.531	直到耶穌基督光照了他,讓他知道他的眼睛瞎了。
585.452	590.916	他的心裡面的眼睛瞎了,以至於看不到耶穌就是基督。
590.916	599.763	因此保羅說,我不會再憑外貌來認基督,來認聖徒,憑外貌認我自己。
599.763	603.766	十七節,若有人在基督裡,他就是新造的人。
604.480	606.101	原文沒有的人。
606.101	613.848	就是說如果有人在基督裡他接受耶穌基督的救恩他就是新的創造。
613.848	617.551	舊事已過都變成新的了。
617.551	628.919	保魯在這邊再一次來描述一個蒙恩得救的聖徒彷彿經歷了一場 神新的創造。
628.919	643.762	如同在第四章六節的時候,保羅也說,一個在基督裡面的人,他如同神在創世期的時候,吩咐光從黑暗裡面出來,照亮這樣的人的生命。
643.762	649.443	其實一個被神拯救的人,就是一個重新被創造的人。
649.443	652.784	舊事已過,都變成新的。
652.784	697.014	保羅說十八節,一切都是出於神, 神藉著基督使我們與祂和好因我們犯罪了就成為神的敵人因此神藉著基督叫我們能夠重新與祂和好又將勸人與祂和好的職份也就是新約的職份新的約定是基督新跟我們立的約而不是舊的約舊的約是律法是叫人死沒有出路的 新的約是神赦免悔改的人,使我們被稱為義,能夠做神的兒女,得著永遠的生命。
697.014	705.839	有聖靈做職,做這個押金, 因此這是一個非常榮耀的職份。
723.046	728.929	保羅就說這個職份耶穌基督已經賜給他們了。
728.929	754.179	19節這就是神在基督裡叫世人與自己和好不將他們的過犯歸到世人他們自己的身上並且將這和好的道理託付了我們所以我們做基督的使者就好像神借我們 勸你們一般,甚至我們是替基督求你們與神和好。
754.179	756.480	哇,保羅真的是情詞迫切。
756.480	760.601	他說是神藉著我們勸你們,苦口婆心。
760.601	765.162	甚至說我們是替基督求你們與神和好。
765.162	772.023	因為保羅看出來,如果人不藉著基督與父神和好,就是死亡。
772.363	774.305	就是永遠的滅亡。
774.305	787.581	但是如果是藉著基督,得以能夠再一次與神的和好,就進入新的創造,成為一個新的人,有不一樣的生命,並且進到神的榮耀裡面去。
788.302	796.545	保羅說,神使那無罪的替我們成為罪,好叫我們在祂裡面成為神的義。
796.545	801.266	這就是神在基督耶穌裡面給我們的一個奇妙的交換。
801.266	813.210	叫耶穌基督這位聖潔公義的、無罪的、擔當我們這個軟弱犯罪的罪人,一切本來該受的刑罰、咒詛、毀滅與死亡。
813.490	826.378	而由耶穌基督跟我們團契,將祂的聖潔、公義、生命、智慧、能力、地位也都分享給我們,因為祂與我們一起團契。
826.378	828.160	我們一起來禱告。
828.160	833.543	主讚美你,主我們這蒙大恩的人,應該要跟保羅一樣,為神癲狂。
834.804	869.288	因為我們真的是義無反顧的應該要一起來領受這新約的職勢這耶穌基督在基督裡面我們可以與神和好也勸人與神和好不致滅亡反得永生主啊我們應該全力以赴的為神癲狂我們更應該為了讓這個福音能夠進到人的生命裡面我們要謹守自己 免得我們的職份被人毀謗,以至於別人無法被福音拯救。
869.288	872.492	願保羅這樣的榜樣也成為我們的榜樣。
872.492	877.818	若有人在基督裡,他就是全新的創造,舊事已過都變成新的。
877.818	879.520	奉主耶穌的名禱告。
879.520	880.321	阿們。
880.321	881.443	願神祝福大家。