start	end	text
1683.228	1696.516	就是當別人有機會真的看到基督徒被福音改變、轉化的生命長什麼樣子的時候,其實就算他們沒有選擇接受,他們應該也會看到,哇,其實這福音是美的,是好的,是善的。
1696.516	1697.677	是,是。
1697.677	1708.063	在馬來西亞的場景呢,大概呢,我們基本上就不會說擔心說,我跟一些 不同的宗教,特別是回教徒做朋友,我怕會被他拉過去。
1708.063	1713.046	我在馬來西亞覺得應該不太會有這樣的擔憂。
1713.046	1717.629	我覺得應該說還是蠻自信吧。
1717.629	1725.514	只是關鍵點就是這個工作本身,我說過嘛,它主要的關鍵點是一個見證。
1725.514	1729.417	對應的是一個國家建設或者社會建設的參與。
1729.991	1739.589	更重要的是打破情緒政治﹑對國家的掌控﹑對各種不同族群的掌控。
1739.589	1745.369	真正交往過許多虛假論述﹑ 不是這樣子的。
1745.369	1747.510	我認識的不是你們所講的。
1747.510	1752.091	反正這些論述就沒有市場了。
1752.091	1754.872	謝謝Jimmy、阿牧師今天的分享。
1754.872	1762.515	我覺得一方面也看到在不同處境當中,我們面對的挑戰不同,也會發展出不同的神學論述來回應。
1762.875	1796.780	但另外一方面也提醒其實基督徒的我們傳的信息是和好的福音這和好的福音其實也可以在公共領域當中以這個愛的實踐做朋友的實踐來展現出來最後我也很好奇想問君秘牧師就是對於使命門徒podcast每一次的最後我都會問被訪問的嘉賓你有沒有希望未來這個podcast可以訪問誰或者是談論哪些主題 你是問我說希望這個節目可以繼續訪問誰,或者談到什麼課題對吧?
1796.780	1798.381	對,對。
1798.381	1799.682	我非常喜歡這樣的節目。
1799.682	1814.514	我覺得就是,最起碼呢,我覺得嘉華牧師會聯繫我,最起碼他是希望就讓馬來西亞的這種的基督教的展現,或者基督教神學的這種的展現, 繁體中文，臺灣國語。
1820.896	1833.660	展開,理解,通過這個節目,就理解不同處境當中的信仰群體,他們的思考,他們的展現,成為彼此的一種的參照,彼此的參照。
1833.660	1848.104	我覺得這個節目,可以繼續的,就讓更多的不同處境的基督徒的聲音,或者的神學論述,可以彼此的在平台裡面,彼此的理解,彼此的學習。
1848.104	1850.125	謝謝你居民牧師,謝謝你今天的分享。
1852.807	1855.109	謝謝張俊明博士的分享。
1855.109	1857.792	你去過比前更遠的地方嗎?
1857.792	1861.616	你讀過《走到比前更遠的地方》這本書嗎?
1861.616	1870.826	這本書講述了一個華人家庭離開美國矽谷或稱龜谷的幽臥生活,搬至火山小島的宣教故事。
1871.630	1883.325	作者陳維恩宣教士談到,華人往往願意為了賺錢而前往他鄉打拼,但我們願意為宣教的緣故走到比前更遠的地方嗎?
1883.325	1888.812	我們下週一起來聽聽陳維恩宣教士的故事,以及他對宣教的看法。