start	end	text
4.036	5.637	弟兄姊妹平安，我們一起來思想。
5.637	16.662	尼西米記第八章一到十二節,到了七月,七月叫做提斯利月,是他們的以色列的新年。
16.662	31.170	以色列百姓們跟隨著尼西米的呼召,他們用了五十二天把城牆蓋好了,是在這個以路月的二十五號,也就是他們六月二十五號完工。
32.568	37.572	為了要在新年前,把這個最好的禮物獻給神。
37.572	44.197	因此呢,他們完工之後呢,這個尼西米就放他們回家,休息幾天。
44.197	47.080	到了七月,新年到了。
47.080	49.782	七月對他們來講是很重要。
49.782	53.485	七月一號是吹角節,就是他們的過年。
55.111	59.495	七月十號是贖罪日,非常重要的日子。
59.495	63.279	在七月十五號到二十二號是祝彭節。
63.279	67.222	祝彭節是以色列三大節旗最大的節日。
67.222	71.926	三大節旗是逾越節、五旬節跟祝彭節。
71.926	79.774	祝彭節又成為秋天的秋收節,歡慶神給他們美好的收成。
80.981	91.868	因此呢,到了七月新年,以色列人第一節,那時他們如同一人聚集在水門前的寬闊處。
91.868	99.773	很多人就在新年的時候就來到耶路撒冷聖城,他們都是同心合一,所以叫如同一人。
100.674	103.695	大家全部聚集在水門前的寬闊處。
103.695	104.955	做什麼呢?
104.955	108.276	要請文士以色拉。
108.276	115.957	以色拉是個文士,就是通常文士通常也都是立位人。
115.957	124.639	那這個就請他來將耶和華藉著摩西傳給以色列人的律法書帶來。
124.639	129.960	以色拉比尼西米早13年回到耶路撒冷,帶領百姓認識神的律法。
130.640	143.431	因此在這個城牆蓋好了幾天之後這個新年的日子大家就希望以色拉帶領大家來遵行神的律法。
143.431	168.311	第二節,七月初一日祭司以色拉將律法書帶到聽了能明白的男女會眾面前應該就是成年人或許也包含十二歲以上的孩童 猶太人是這樣,一個人,一個男人,十二歲,滿十二歲了,他就要自行對律法負責。
168.311	176.152	在水門前的寬闊處,從清早到降午,降午就是正午,十二點。
176.152	181.373	在眾男女一切聽得能明白的人面前,讀著律法書。
181.373	183.154	民眾的反應是什麼呢?
183.154	193.728	眾民側耳而聽, 代表他們經歷這一場很不容易的一個建造城牆的過程。
193.728	200.433	他們心中更是敬畏神,因此他們就要來聽上帝的律法。
200.433	209.300	第四節,文士以色拉站在特別為這件事所特別預備的木臺上面。
209.300	212.583	木臺的原文是木頭架起來的一個塔樓。
213.899	225.788	那除了以色拉站在這個牧台上面呢,還有另外十三個人也跟他一起站在上面,他們這十三個人,應該就是猶太人的領袖。
225.788	236.076	有馬他提亞、世馬、亞奈亞、烏利亞、希勒迦和馬西亞站在他的右邊,右邊站了六個人。
236.954	248.062	然後左邊站了七個人﹐有畢大雅﹐以薩利﹐瑪基亞﹐哈順﹐哈巴大雅﹐薩加利亞和米蘇蘭﹐站在他的左邊。
248.062	262.974	以色拉呢﹐就站在眾民以上﹐木台比較高﹐在眾民的眼前展開書卷﹐不是用翻的﹐那時候還沒有這種書本﹐那時候都是羊皮卷﹐他把這個卷軸打開。
264.394	269.959	然後呢,祂就一展開的時候,眾民就站起來。
269.959	270.820	代表怎麼樣?
270.820	274.323	就是要敬聽神的話語。
274.323	278.386	第六節,以色拉就稱頌耶和華至大的神。
278.386	282.790	一稱頌,眾民都舉手應聲說,阿們!
282.790	283.691	阿們!
283.691	287.454	然後就低頭,面拂於地,敬拜耶和華。
288.763	292.726	接下來呢,又有另外十三位,他們是立位人。
292.726	301.652	他們要來協助百姓,能夠明白以色拉剛剛所宣讀的律法內容。
301.652	351.748	另外這十三位立位人是,耶穌亞、巴尼、士利比、亞敏、雅谷、撒比泰、和地亞、馬西亞、基利他、亞薩利亞、約沙拔、哈南、皮萊亞、 和利未人和這個翻譯不太好應該是說和應該是就是利未人這13個人他們都是利未人他們要使百姓明白律法百姓都站在自己的地方他們清清楚楚地念神的律法書講明意思使百姓明白所念的也就是說呢以色拉站在臺上旁邊站了13個以色列領袖 臺下也站了十三個立位人。
351.748	366.135	他們就分別走到百姓每一個他們聚集的地方去講解剛剛以色拉所傳講的上帝的律法的內容。
366.135	376.321	因此以色拉他不是孤軍奮戰他還有一群立位人幫手來幫助他讓以色列百姓明白神的律法。
377.705	393.653	第九節這時候神掌尼西米和做祭司的文士以色拉以及教訓百姓的立位人對眾民說:「今日是耶和華你們神的聖日,不要悲哀哭泣。
393.653	433.228	」這是因為眾民聽見律法書上的話都哭了眾民聽見律法書上所說的內容 我想最主要就是講到﹐一開始神與亞伯拉罕立約﹐然後又救他們出埃及﹐經歷千辛萬苦﹐然後使他們得地為業﹐結果他們因為悖逆神﹐屢次惹神的憤怒﹐最後國破家亡﹐然後被擄到巴比倫的地方﹐ 后来神又怜悯他们,使他们悔改。
433.228	434.329	神就把他们又带回来。
434.329	440.976	我想大概这些内容,大概就是在谈这些事情。
440.976	445.020	因此百姓一听怎么样,就都哭了。
445.020	455.645	既懊悔以前以色列人为什么要这么悖逆, 然後當然心中也是感謝神,給他們機會,憐憫他們,把他們帶回來。
455.645	460.889	但是呢,很激動,所以所有的百姓都哭成一團。
460.889	474.559	但是呢,妮西米他們就叫百姓,今天是耶和華的聖日,今天是過年,今天也是來歡慶、城牆重建。
474.559	478.282	因此呢,我們不要哭泣,我們要歡喜快樂。
479.121	487.109	只要我們繼續來遵行神的正道,我們就不會再經歷這樣的,過去這種悲慘的事情了。
487.109	488.991	因此我們要歡喜快樂。
488.991	499.743	第十節,又對他們說,你們去吃肥美的,喝甘甜的,有不能預備的,就分給他,因為今日是我們主的聖日。
499.743	507.231	你們不要憂愁, 因靠耶和華而得的喜樂,是你們的力量。
507.231	513.634	因此呢,這些領袖們就鼓勵所有的百姓要去吃喝快樂。
513.634	519.637	如果當中有些比較窮的,沒有預備食物,那有餘的就分給他們吧。
519.637	523.899	今天是同樂的日子,歡喜快樂。
523.899	527.780	因為靠耶和華而得的喜樂,是我們的力量。
527.780	530.702	我們不應該再悲傷,因為神恩待了我們。
531.664	544.429	十一節,於是立位人使眾民靜默下來,就說,今日是聖日,不要作聲,也不要憂愁,作聲我想是哭聲。
544.429	555.012	十二節,眾民就都去吃喝,也分給人,然後呢,大大快樂,因為他們明白所教訓他們的話。
555.012	565.002	因為他們明白, 只要繼續忠心的﹐遵行神的正道﹐過去遭難的日子﹐就不會再發生了。
565.002	571.464	他們明白了神做事的法則﹐信實的應許﹐他們就歡喜快樂。
571.464	573.864	我們一起低頭來禱告。
573.864	580.105	是的主,我們要來向祢感謝,因為祢三番兩次的挽回我們。
580.105	594.083	主,雖然我們好像被各樣的軟弱、罪惡﹐ 以至於被仇敵掳到天涯海角但主只要當我們受聖靈的感動主啊!
594.083	605.607	受祢話語的提醒願意迴轉歸向祢就算我們淪落到天涯海角主祢也要把我們帶回來重新建造我們的生命主啊!
605.607	620.141	尼希米記建造城牆其實是在代表祢要重建我們的生命重建我們的信仰 主啊,恩待我們,叫我們一生住在祢的城裡,歡喜快樂。
620.141	621.942	奉主耶穌的名祷告。
621.942	622.862	阿們。
622.862	624.283	願神賜福大家。