start	end	text
4.172	5.813	弟兄姊妹平安，我們一起來思想。
5.813	8.796	箴言第十九章的第一節到第十五節。
8.796	14.780	第一節,行為純正的貧窮人,勝過乖、妙、愚妄的富足人。
14.780	19.804	中文的翻譯會讓我們思想可能是在比較貧窮跟富足的人。
19.804	26.369	但是由於他的原文沒有富足人,所以我把他的原文的翻譯再翻一次。
26.369	54.851	貧窮人走在正直的道路上,勝過 嘴唇講乖妙言語的愚昧人所以他是要不是要對照貧窮跟富足他說就算我們物質上比較缺乏但我們卻願意走在一個上帝給我們的正道上面的人這樣的人勝過於 每一天嘴巴都講一些乖妙。
54.851	57.354	乖妙就是不正、彎曲。
57.354	66.342	甚過於每天嘴巴都講一些不正、不是純正的話語的人,而那樣的人是一個愚昧的人。
66.342	74.410	寧可做一個有智慧但是卻物質貧窮的人,也不要做一個乖妙的愚昧人,沒有智慧。
75.452	85.421	那在箴言裡面呢,特別是在第二個大段落,第10章到第22章的16節裡面,裡面有一個很重要的主題,就是探討財富。
85.421	97.573	財富常常在這一個段落裡面,被當作是上帝祝福恩寵、義人或是謙卑的智慧人,神給他的一個看得見的祝福的果子。
99.053	161.901	那你會覺得很奇怪在這個大段落裡面好像比較多都是在肯定是富有的人然後對於這個窮乏人貧窮人比較多是責備那他有他的上下文的定義所以你用箴言說要小心因為在這個段落裡面他講的貧窮人 指的是那些不受教走乖妙的道路以至於他的身心靈一直困在曠野裡面找不到出路而貧窮窮乏身心靈貧窮又不受教所以一直在死胡同裡面的愚昧人 因此呢這個箴言這邊講的富有人跟愚昧人跟那個貧窮人祂的定義跟我們在聖經其他部分要切入的角度講財富跟貧窮的角度不太一樣喔那其實行為純正的貧窮人祂 是富有的人,因為他雖然物質缺乏,但他卻心靈豐盛。
161.901	169.124	第二節,心無知識的乃為不善,腳步極快的難免犯罪。
169.124	226.002	他的原文, 少翻譯了所以原文應該是有熱心卻無知識的乃為不善腳步極快的難免犯罪這邊講的是這個心靈或是這個他這個做決定做事情太過急躁 沒有三思而後行那這是不好的而且會出錯甚至可能會犯罪因此有熱心卻無知事沒有三思而後行或是想到就立刻去做但是卻沒有好好的三思而後行都是不會讓事情成為一件美事美好的事反而會把事情搞砸 第三節,人的愚昧請拜祂的道,他的心也抱怨耶和華。
226.002	236.610	這邊講的說,當一個人他因為只依靠自己而不願意依靠神,他就是一個愚昧的人,他會把他自己的道路搞砸了。
236.610	241.774	但他卻不會去反省,他反而會抱怨耶和華。
242.415	245.676	那這個是愚昧人常常有的表現。
245.676	277.403	弟兄姊妹這樣聽起來我們常常也是愚昧人我們常常不會去反省跟檢討自己為什麼會把事情搞成這樣我們第一個都是先怨天尤人埋怨神不幫助我們不祝福我們第四節財務使朋友增多但窮人朋友遠離記得我們這邊的箴言對於財富跟貧窮的定義是 上帝祝福義人跟智慧人的果子。
277.403	290.596	因此呢,一個被神祝福的人, 他的財物增多,他也成為一個樂意使用財物來祝福分享的人,自然他的朋友就增多。
290.596	299.779	但是一個窮人在這邊指的是,他是一個乖僻的人,他不願意被神來改變,以至於路越走越窄。
299.779	302.920	那朋友勸他也勸不聽,所以朋友也都遠離他。
303.968	311.472	第五節,做假見證的必不免受罰,吐出謊言的終不能逃脫。
311.472	314.293	真言有一個主題叫我們敬畏神。
314.293	322.237	因此,不敬畏神而做假見證陷害人的,神祂會查驗的,神也會懲罰的。
322.237	330.601	第六節,好施散的,有多人求祂的恩情,愛送禮的,人都為祂的朋友。
330.601	333.163	這段經文也很容易引起大家的誤解。
334.002	338.566	也是要放在真言的脈絡裡面,不然會誤用。
338.566	341.909	好施散的,其實原文是尊貴的人。
341.909	345.832	尊貴的人,有多人來求他的恩情。
345.832	357.983	在真言裡面,尊貴的人、義人、智慧人,都是因為謙卑、願意走神的正道的人,以至於神使他高升,神使他有尊榮、尊貴。
357.983	365.987	而這樣的人, 很多人都會來尋求祂的幫助,因此尊貴的人,多有人求祂的恩情。
365.987	392.112	反之,神如果讓我們成為一個有尊榮、有尊貴的人,我們就應該要去祝福更多現在在窘迫裡面的人,即便他可能是還在曠野打賺的人,我們也是要來幫助他,陪他多走一里路,好讓他也來尋求神的智慧,走出人生的康莊大道, 愛送禮的人都以祂為朋友。
392.112	394.533	中文翻的不夠強烈。
394.533	399.916	他說,愛送禮的所有的人都願意來做祂的朋友。
399.916	401.417	所有的人。
401.417	404.999	愛送禮呢,這邊講的不是賄賂。
404.999	412.883	這邊講的愛送禮物,這個禮物,指的是祂很樂於分享,很樂於把神給祂的,跟眾人分享。
413.183	423.765	它跟十八章的十六節的那個禮物是同一個字,但是卻跟十七章的第八節的那個賄賂是不同的字。
423.765	436.508	因此這邊講的不是送紅包、走後門、然後耍特權的這種賄賂,講的是另外一個字,禮物,指的是慷慨、願意分享。
436.508	444.055	所以呢, 願意分享,送別人禮物的人,所有的人都很樂意做他的朋友。
444.055	450.701	第七節,貧窮人,弟兄都恨他,何況他的朋友,更遠離他。
450.701	454.785	他用言語追隨,他們卻走了。
454.785	457.027	第七節是第六節的一個對比。
458.166	464.874	第六節讓我們看見蒙神恩寵的這個義人、智慧人。
464.874	468.578	神使他得尊榮而成為尊貴的人。
468.578	472.763	他也善用神給他的資源去祝福更多的人。
472.763	474.065	他的朋友就很多。
474.445	490.777	但第七節反觀,那些一直不聽神的勸,一直不願意走出生命曠野的人,他就越見越來越貧窮,身心靈越來越貧窮,以至於他沒有人會來找他,大家都遠離他。
491.698	544.037	以至於他用言語追隨追隨原本就是追趕他用言語來拜託他的朋友不要離開他可是他的朋友都覺得你都講不聽所以就都遠離他而去第八節得著智慧的愛惜生命原本是愛惜自己的生命一個得著智慧的人他就會保守自己的人生他會 愛自己的生命因為他知道這個生命其實是可以蒙神很大的祝福跟被神重用的人生因此保守聰明的必得好處好處指的是益處 因此一個願意謙卑在神面前,被神管教,讓神來改變他的人,他就是一個有智慧的人。
544.037	554.385	他也會更看重自己的人生,因為他知道他的人生可以成為一個很有意義的人生,一個可以容神益人的人生。
555.026	571.375	反之,在人生裡面找不到智慧的人,常常不知道自己為什麼還要活下去,覺得自己人生沒有用,沒有意義,因此他就會不斷的浪費自己每一天寶貴的光陰。
571.375	576.899	第九節,做假見證的不免受罰,吐出謊言的也必滅亡。
576.899	579.060	這樣的經文在箴言常常出現。
579.940	588.165	第十節,愚昧人厭樂度日,是不合宜的,何況僕人管轄王子呢?
588.165	594.449	這邊講到說愚昧的人每天生活奢侈、過日子,這個是不正確的。
594.449	598.691	另外一個不正確,指的是說做僕人,卻管轄王子。
598.691	603.754	王子指的是統治者,或是他的領袖、他的主人。
603.754	604.935	這兩種都不合適。
605.435	611.865	這個愚昧的人每一天艷樂度日,終至滅亡。
611.865	620.679	那做一個跟隨者,他應該要去敬畏這個帶領他的人,感恩帶領他的人。
621.169	627.015	而不是凡事悖逆、自以為聰明、不受教。
627.015	630.338	其實今天在教會裡面常常我們也會要學習這樣的功課。
630.338	634.783	就是我們常常不是很順服。
634.783	638.747	我們都覺得憑什麼我要聽祂的話。
638.747	642.791	有時候神在我們生命中設立一些人來帶領我們,是我們的福氣。
643.712	651.777	但我們卻因為常常自己的驕傲,卻沒有辦法,來享受這一種,被人帶領的福氣。
651.777	655.079	十一節,人有見識,就不輕易發怒。
655.079	658.882	寬恕人的過失,便是自己的榮耀。
658.882	670.410	一直面繼續講到,就是心胸的寬大,然後能夠控制自己的EQ,自己的情緒,不輕易發怒。
670.410	684.346	快快的聽,慢慢的說, 慢慢的動怒,並且就算在裡面聽的時候聽到別人對你的侮辱或是誤解,我們也會來控制我們自己的情緒。
684.346	687.569	寬恕人的過失,便是自己的榮耀。
687.569	691.872	我想這句話講的真是有很深的道理。
691.872	698.237	十二節,王的憤怒好像獅子吼叫,他的恩典卻如草上的甘露。
698.985	753.871	這句話有一體兩面一方面提醒我們做領袖的就是王的憤怒好像獅子的吼叫做領袖的要留意他自己對待被他帶領的人的態度因為說我們的憤怒像獅子的吼叫會使人害怕會使人感受到恐懼 而我們對被帶領者的恩典卻可以像這個小草上面的甘露可以來滋潤他的生命因此我們做領袖的要正確的使用神給我們的權柄要正確的來使用神給我們的可以給別人的恩典跟給別人的鼓勵那相反麵呢 就是說,被帶領者我們要謹守自己的言行舉止。
753.871	762.096	因為上帝在這個世界上,有設立了一些規則跟一些權柄,要在我們生命的旅途中,來幫助我們成長。
762.096	771.801	所以我們不要散漫隨便,要學習去敬重跟謹守神在我們生命中設立的權柄,很多時候是為了我們的益處的緣故。
772.722	781.348	十三節,愚昧的兒子是父親的禍患,妻子的爭吵如雨連連滴落。
781.348	792.356	這邊讓我們來看見,箴言非常重視家庭教育,家庭裡面的關係,不論是親子之間,還是夫妻之間。
792.356	798.160	因此呢,愚昧的兒子你不去好好管教,終究會成為父親你的禍患。
798.780	817.627	而跟妻子之間的關係沒有來進步,沒有來增溫,讓妻子不斷的跟你爭吵,如同家裡這個房子漏水一樣,雨不斷的滴在你的房子裡面,你也會不好受,家裡也不安寧。
818.387	826.973	十四節,房屋錢財是祖宗所遺留的,唯有賢惠的妻是耶和華所賜的。
826.973	830.396	這節很棒,可以跟十三節一起連著看。
830.396	843.205	因此呢,代表說,很多東西是人可以給你的,你的父母可以給你的,你的老闆可以給你的,你的文品可以給你的,你的工作可以給你的。
844.172	847.134	那但是有些東西是祂們給不起的。
847.134	852.137	例如賢惠的妻子是耶和華賞賜給你的祝福。
852.137	857.461	因此我們要去珍惜有一些是神特別賞賜給我們的恩典跟福分。
857.461	861.184	我們要好好去經營,也要格外的珍惜。
861.184	865.606	十五節,懶惰使人沉睡,懈怠的人必受飢餓。
865.606	868.889	箴言裡面一直強調勤奮勤勞的價值。
869.309	889.884	批評懶惰的敗壞那使人能夠勤勞是因為他生命裡面有異象他走在神的道路上蒙神帶領懶惰的原因是因為生命沒有異象渾渾噩噩過日子當然是懶惰因為他不知道為什麼而來奮鬥 我們一起來禱告。
889.884	891.625	主我們感謝讚美祢。
891.625	893.085	主願祢祝福我們。
893.085	895.326	今天的話語也光照我們。
895.326	897.666	讓我們在面對自己的家庭。
897.666	899.006	面對朋友。
899.006	901.767	面對工作的勤奮。
901.767	903.427	面對財富。
903.427	905.208	我們都有正確的觀念。
905.208	907.068	可以來容神益人。
907.068	909.489	走在祢賜福的道路上。
909.489	910.329	謝謝主。
910.329	911.569	聽我們的禱告。
911.569	913.010	奉主耶穌的名。
913.010	913.890	阿們。
913.890	914.950	願神祝福大家。