start	end	text
3743.046	3776.686	我做得不好因為我們就是用我們的身體和聲音和情感和意志來呈現這個角色沒得擋所以有時候會有一種混淆所以你會不太能分辨說到底是表演的問題還是我個人的問題那以及他的殘忍他的競爭你能不能夠在這樣的競爭下你仍然強壯仍然有力量可以去面對每一次淘汰之後你要怎麼樣去調整你的步伐 我覺得這也是除了企圖心以外這個健康要很強壯。
3776.686	3782.269	所以我會建議年輕人真的是照顧好自己。
3782.269	3786.992	我想這個問題還有一點點細節也可能有關聯。
3786.992	3793.836	剛剛才知道 在邱穎老師的回憶裡面,你是屬於那種很會讀書。
3793.836	3803.963	我不知道你是不是很用功、很愛讀書,但是想問一下,讀書這件事情跟把演藝事業做好有沒有關聯?
3804.684	3835.167	其實我也是跟著一下其實我不是很會讀書我高中以前都不是很會念書我的成績大概都是中等所以這就是神很奇妙的作為我並不是在學業成績上很好的學生但神知道祂要把我放什麼位置祂就是會把我放進去因為我那一年的招生考是到現在戲劇系都沒有人打破我們的紀錄我們有一千兩百個人來考只取三十個 十五男十五女。
3835.167	3837.268	至此以後沒有這麼多人來考過。
3837.268	3839.128	所以它是高度競爭。
3839.128	3842.550	可是我竟然從來沒有學過表演。
3842.550	3843.850	沒看過戲。
3843.850	3845.511	我就被選上。
3845.511	3847.652	那到底是誰讓我進去。
3847.652	3850.413	我深知到真的是神的手。
3850.413	3852.514	祂知道祂要把我放在哪裡。
3852.514	3854.775	所以當我進到這個學校以後。
3854.775	3856.716	我反而變得很會讀書。
3857.056	3858.697	繁體中文，臺灣國語。
3858.697	3859.878	繁體中文，臺灣國語。
3874.428	3879.594	知識的範疇上,其實我就很饑渴,很想學。
3879.594	3882.256	所以這個一定是有幫助的。
3882.256	3889.064	那是各方面,我想每一個行業在知識技能的拓展上,它是越深刻,越深度是越好的。
3890.623	3903.232	我想我們的時間越來越接近尾聲,那經過這樣的對話,不知道我們在場連我三位是不是有沒有什麼要結束的話想講一講。
3903.232	3911.117	我今天坐在這裡,因為從我這個角度看你們,我感覺真的很羨慕,你們真的像同學會,多年來。
3911.237	3915.640	不只這樣,還有一種錯覺,感覺你們像姊妹。
3915.640	3920.364	這個不是一種面貌的相似,而是一種氣質的相似。
3920.364	3927.450	那我終於慢慢的會議過來,你們的專業都有神的帶領。
3927.450	3930.892	所以就這個意義,你們真的是姊妹。
3930.892	3946.167	可不可以請香琪老師,你覺得還有什麼話要說, 整個的談話當中﹐也許你覺得還想強調什麼﹐或者什麼感想﹐還有邱穎老師﹐然後我再講點話﹐我們就來準備結束。
3948.302	3962.473	我覺得我很感謝神,我從來沒有想到有一天,神可以使我的故事,或者是我所經歷的事情,能夠有機會分享。
3962.473	3973.741	我覺得福音很不容易傳,尤其在現代這個敵基督的一個環境,和一個各種世俗的價值,影響下面是很難的。
3974.462	3978.503	但我很感謝神,祂裝備我,祂預備我。
3978.503	3997.989	祂讓我經歷一件事情是,有的時候當你跟神的關係好,當你跟神的生命存全的時候,當你常常對焦於神的計畫和心意的時候,你在那裡做好你的事情,神會使你成為福音,而不是你說了什麼。
3998.933	4074.157	或者用一些律法，或教訓人，應該怎樣，對錯，我覺得神會用我們，祂會有祂自己的榮耀，在我們的身上，以至於讓我們開始，可以經歷你在那裡， 就是一個神在地上的說話和見證人那我也發現這是很有力量的所以我很需要更多的加強我跟神的關係因為神把我裝備好了我只要在那裡神會透過我用很巧妙的方式來說福音的故事 謝謝我剛剛聽到您說您在角色裡面所以能夠因著這些角色而更能夠體會神的愛我其實覺得神的愛無邊而love is not fair所以我也謝謝你今天願意來到我們這當中感謝主感謝主謝謝感謝主是 我只能講我的感想,不代表大家。
4074.157	4086.981	就是說,最大的感動,像湘琦老師,已經算是資深又有知名度,非常成功的演員、演藝、藝術家。
4087.637	4089.257	表演藝術家。
4089.257	4092.778	但是他看自己像瓦器。
4092.778	4095.619	所以當承受上帝的恩典那一種激動。
4095.619	4099.800	我希望我也能夠長期有這個心。
4099.800	4101.540	我只是瓦器。
4101.540	4104.681	那上帝竟然願意使用這個瓦器。
4104.681	4106.801	把寶貝放在我裡面。
4106.801	4109.081	非常非常的感動。
4109.081	4111.342	那另外我學到一件事情。
4111.342	4113.502	就是在幾次談話。
4113.502	4115.403	包括這一次我們正式的談話。
4116.664	4149.320	湘琦老師提到要入戲要去繳這件事情可能對我做一個服侍者來講特別有意義因為上帝交託我們的職務有時候我們的人還沒有辦法調整到被上帝使用那這個時候要靠信心來入戲因為神要我做這件事情我就非得做雖然我不夠 我力量不夠,我不配,但是神要用,我就要入戲。
4149.320	4202.729	但是另外一方面,當服侍的職務又退回到日常生活的時候,我又要學習適度的去角,因為畢竟那不是服侍場,比如說我在服侍身份上有牧師的身份,但是我在對待兒女的時候,我至少要從牧師的角色去角, 我要轉入戲到父親的角色﹖甚至是朋友的角色﹖但是如果我把牧師的角色﹖帶回家裡﹖我跟兒女之間的張力就大了﹖所以我會覺得﹖神給你的經歷﹖因為你用簡單的話這樣敘述﹖但是給我很豐富的聯想﹖我也相信在這方面﹖我們有很多要再向你學習的地方﹖ 因為我們這個節目就是在追求亞大。
4202.729	4205.832	敬畏英華是智慧的開端。
4205.832	4209.075	認識至聖者便是聰明。
4209.075	4215.782	這個亞大就是要生命投入裡面才能夠真正明白的認識。
4215.782	4218.926	從敬畏上帝而來的認識就是亞大。
4219.667	4222.511	就是智慧聰明。
4222.511	4227.877	祝我們大家在我們生命中的亞大都大大成長。
4227.877	4229.679	今天的節目告一段落。
4229.679	4230.440	大家再見囉。