start	end	text
1.783	5.550	知識就是力量,學習就是成長。
5.550	8.415	我是神學工作者林宏信。
8.415	11.401	這裡是知識健身房,Knowledge Gym。
14.906	19.927	我們鍛鍊的不是muscle,我們鍛鍊的是yata。
19.927	22.068	yata是希伯來文,認識。
22.068	29.969	這不是一般的認識,是必須藉由生命投入才能明白的知識。
29.969	41.852	我們非常歡迎大家一起來知識健身房KG,與我們一起經歷yata的成長,讓我們更多認識上帝,認識自己。
88.404	90.505	知識就是力量。
90.505	92.585	學習就是成長。
92.585	95.406	我是神學工作者林鴻信。
95.406	100.787	這位是舞蹈藝術專業老師陳秋瑩老師。
100.787	103.748	我們要歡迎今天晚上的貴賓。
103.748	109.370	金馬獎影後北藝大教授陳湘琪老師。
115.589	123.852	首先讓我們用一個簡單的快問快答,讓我們很快的來認識陳湘琦老師。
123.852	132.474	簡單的問題,簡單的回答,請你用直覺當下的反應,不要考慮超過五秒鐘。
132.474	133.935	請邱穎老師提問。
133.935	136.796	請問湘琦,你一天睡多少小時?
138.695	140.817	一天至少要八小時。
140.817	143.099	真的有睡這麼久嗎?
143.099	146.122	就是很需要,我需要睡眠。
146.122	150.246	因為你又拍戲,又要教書。
150.246	153.649	所以我們一直以為,你大概一天隻睡四個小時。
153.649	154.089	不行。
154.089	155.070	還保持這麼好。
155.691	160.172	第二個問題請問您有最欣賞的演員嗎?
160.172	160.832	是誰?
160.832	163.893	又是為什麼?
163.893	186.002	我其實蠻喜歡法國的一個女演員叫做朱莉葉·畢諾許我非常喜歡她因為她的表演不單只是自然而且在角色的詮釋上非常的有深度然後她所接拍的影片的這種含義意涵對我來說都很有意思所以我非常喜歡她 謝謝你。
186.002	188.225	我們還有下一題,總共有四題。
188.225	195.999	香吉老師,我們想知道,你在整本聖經這麼多卷書裡面,你印象最深的是哪一卷?
196.869	200.512	都印象深刻。
200.512	203.153	講幾卷。
203.153	212.040	心情不好的時候,就會讀詩篇,跟著大衛一起把自己的情感宣洩,讚美主,重新得力。
212.040	214.441	覺得自己很笨的時候,就讀箴言。
215.162	220.546	因為每一天都可以讀一張真言,然後裡面有非常多的智慧。
220.546	227.392	那其次的話就是按照教會的進度,我就是其實每一卷書都覺得很珍貴。
227.392	234.838	那個人也蠻喜歡羅馬書啦,就會反覆的讀羅馬書,覺得它是一個很重要的基石。
234.838	247.576	那第二個問題,湘琪老師,當你知道再度入圍, 金馬獎最佳女主角那一剎那,你當下的反應是什麼?
247.576	257.843	我不記得我當下反應,但是林老師現在問我,我會覺得上帝真好。
257.843	265.628	我覺得,就是覺得自己何德何能,神給我很多的機會。
266.510	277.074	然後又用非常巧妙的方式﹐帶領我完成角色﹐然後最後還給我入圍的機會。
277.074	285.138	我覺得我很不配﹐是神無用的僕人﹐但是神還是這麼的愛我。
286.442	289.083	啊,抱歉,好像才剛開始。
289.083	291.144	就覺得有點激動。
291.144	292.065	感謝主。
292.065	292.825	對,感謝主。
292.825	297.087	我們其實之前,我認識你也算有一段時間了。
297.087	300.008	在大學的時候就認識您。
300.008	302.610	我其實覺得您是非常努力的。
302.610	314.894	對,所以我其實是覺得, 我感覺我們基督徒在世界上的表現,神給我們這些恩惠是瓦器裡面裝著寶貝。
328.558	336.405	所以湘琦老師,也許你剛剛那些謙虛的表示是看到瓦器,但是你裡面有寶貝。
336.405	338.327	阿們,謝謝。
338.327	345.113	我其實也因著這樣,我們其實更希望你能夠跟我們分享更多你的人生故事。
345.113	359.998	那我就很想請問湘琦,就是從你從小出生在那個基督教家庭, 那你什麼時候真的這個基督教信仰才真的紮根在你的生活裡面?
359.998	362.899	我小時候是媽媽帶我去教會。
362.899	369.221	那其實我就是經歷了很多那種在教會長大的孩子會經歷的一些過程。
369.701	444.174	也就是說這個信仰跟我的關係好像是透過媽媽的介紹比較多是媽媽夾在中間的一個帶領並不是真的跟神有一個直接的關係那一直其實是到我大學念到大學三年級的時候我有機會參加了一個特會在那個特會的裡面我被聖靈充滿 在那一刻好像神的靈就是觸摸到我我第一次感受到神是這麼親密的與我同在也在那一刻我深深的感覺到我做錯很多事情然後我深深感覺到對神很虧欠所以在認罪悔改的當中我就跟神做了一個勵志就是從現在開始我要真的來認識祢 感謝主,因為我也想問說在基督教家庭生活的長大的年輕人現在其實是越來越多了可是好像對於有些年輕人來說這個基督教的生活裡面是基督本身是可有可無所以如果以現在的您來說您如何 能夠對這些年輕人想要說些什麼話嗎?
444.174	455.476	或者是對於那時候您還沒有真正讓基督紮根在你心裡面的那個時候的你自己,您有想要對他說什麼話嗎?
455.476	459.757	可有可無,因為我自己也經歷過一樣的過程。
459.757	463.298	那我其實深深地感覺到信仰是需要過程的。
464.138	466.601	我覺得這些過程都是好的。
466.601	468.864	我覺得我們必須產生疑問。
468.864	471.227	我們可以對神產生懷疑。
471.227	475.192	我們也可以離開神去試一試其他的非神系統。
475.192	477.815	我覺得終究會證明一件事。
477.815	479.317	就是這位神是真神。
479.838	514.738	所以我現在反而覺得﹖這個過程是有它的必要﹖而且在這個過程裡面﹖才會真正的建立﹖就像我剛剛說的是﹖我自己跟神的關係﹖所以其實我對自己﹖過去有一段時間﹖就是也是有一點走迷﹖然後對世界的價值文化﹖整個是被吸引﹖單溺在那個過程當中的﹖那一段經歷﹖其實我現在想起來﹖我並不會感覺定罪﹖ 但是會覺得說那是神允許,祂給我練習,有一個自由的選擇,最後證明祂才是真神。
514.738	526.969	所以那時候您的父母可有做一些什麼樣的動作,或者是什麼樣的事情,讓你可以重新再回到神面前?
526.969	528.811	基本上我爸媽根本什麼都不知道。
529.872	534.238	那我覺得是誰做，真的就是神做。
534.238	543.290	神允許我跑一跑，然後在祂所定的時間，然後祂就決定收獻，然後祂用祂的方式，來對我說話。
543.290	545.933	是神做，而不是我父母做的。
546.374	564.871	所以我相信對於我們這些做藝術工作的人就追求完美這件事情其實是好像本來就是理所當然的可是這樣子的一個性格或狀態是不是會影響您在信仰上面的追求?
565.555	610.006	我覺得在信仰上面如果真的有這樣子一個完美的追求好像還不錯可是往往都是相反的反而是這個完美是在現實的裡面的一個困境那我其實對於完美主義在我身上一直到我大三開始重新面對這個信仰的時候我才發現 我裡面的這個完美主義有一個很嚴重的牢籠使我自己其實不能真的認識神認識神的什麼呢認識神祂是恩典的神祂不需要我的完美是祂的完美來完成我要做的事我可以不完全但我的神是全知全能的神祂的完全會成就我 繁體中文，臺灣國語。
610.006	611.668	繁體中文，臺灣國語。
611.668	613.630	繁體中文，臺灣國語。
613.630	615.011	繁體中文，臺灣國語。
634.275	666.529	也許有些父母是會希望他們強迫他們去教會或者是強迫他們做一些什麼事情我只記得之前我們有一些談論談話中我們有說到愛與逼迫這兩個其實是一線之隔您如何讓這樣子的一個關係或者是這樣子的一個行行動或者是方式讓他能夠 讓您在您的學校裡面﹐可以幫助這些年輕人。
667.585	784.546	其實這個愛與逼迫真的是一線之隔因為愛真的是為對方好可是逼迫本身對我來說就是要去面對說有時候我們是為對方好那在為對方好的時候我們不由自主的有一種掌控要去控制這個的時候其實那個對正在成長中和在尋求認識神的人來說其實那個會是一個反效果 那我覺得應該是接續的是一個接納和等候要給他們適度成長的自由然後我覺得我們做了我們該做的事情後你就要觀看神接手的作為因為真的是耶和華神親自會澆灌 那這個等候也就像我們剛剛前面說的是需要有一段時間讓他真實的來建立他跟神的關係但是如果我們是用一個掌控掌管的方式來主導他你要這樣做或那樣做的話其實反而攔阻他認識神因為你把你自己擋在他跟神之間我覺得反而那是一個攔阻所以其實你真正要對 請問湘琦在您分享福音的時候有沒有什麼事情是讓您印象深刻不論好壞 我會想到因為我在大學是大一的班導師那同學們如果遇到一些困難或者是難過的時候都會敲我的門進來我印象很深有一屆大一的一個女孩子她敲門進來那她真的是遇到很大她過不了的關而且這個關是跟整個原生家族有關然後當下其實我也不知道怎麼去幫助她所以我有發出邀請說老師可不可以為你禱告 我們一起來思想。
784.546	787.908	繁體中文，臺灣國語。
787.908	790.089	我們一起來思想。
790.089	790.989	繁體中文，臺灣國語。
790.989	792.950	我們一起來思想。
792.950	794.171	繁體中文，臺灣國語。
810.299	812.400	我們一起來思想。
812.400	814.421	繁體中文，臺灣國語。
814.421	815.902	繁體中文，臺灣國語。
815.902	817.763	繁體中文，臺灣國語。
817.763	819.703	繁體中文，臺灣國語。
819.703	820.984	繁體中文，臺灣國語。
833.490	891.865	然後我就說要給他自由和時間去發現你這很奇妙後來這個女孩子大三的時候兩年後我已經不是班導師了他又悄悄門進來然後又是一樣的問題其實他過不了關而且現在加了更多的問題然後這一次我看著他我還是告訴他說某某某老師真的不知道怎麼幫助你我可不可以為你禱告 這一次他就告訴我說﹖可以老師﹖然後我為他禱告﹖以後我就問他說﹖那我可不可以邀請你﹖跟老師一起去教會﹖那他就點點頭說﹖可以﹖後來這個女孩子﹖當然她信主受洗﹖現在也非常的愛主﹖而且更奇妙的是﹖當時他所說家裡所有的問題﹖經過這幾年後﹖他爸爸也信主﹖他兩個妹妹也信主﹖所有家庭那又大又難﹖解決不了的事﹖神全部解決﹖ 太好了,感謝主。
891.865	893.026	對,真的感謝主。
893.026	900.614	所以您在學校裡面的那樣輔導的工作,您是如何做到這些輔導的事?
900.614	937.459	基本上我一定會分三個階段,一個階段就是他們願意講我就聽, 我覺得聆聽太重要那是一個支持而且我可以理解他們的感受那他們在講的過程中當然會導入他們為什麼這麼痛苦他們對生命人生的一些負面的價值想法這個時候其實我就會來跟他們分享在我信仰裡面我認定的人生的價值和意義是什麼 然後以及從這個信仰裡面﹐可以帶給我們什麼樣的盼望﹐仍然有路可走﹐其實這應該是我在﹐輔導學生的時候﹐我一般都會經過的一個過程。
937.459	943.482	是﹐是﹐是﹐我想﹐林老師之前就﹐一些問題要問您。
943.482	951.046	是﹐香綺老師﹐你的分享當中﹐我有感覺到﹐信仰帶給你﹐非常非常大的動力。
951.766	970.913	但是我們有一個疑惑因為在專業上的期待跟信仰會不會有張力比如你提到信仰幫助我們接受自己的不完美但是專業卻力求完美要催逼自己 信仰帶給我們自由,很大的空間。
970.913	981.259	但是專業似乎要節制,要訓練,要把自己能夠往那個最好的表現。
981.259	985.721	那在這個張力當中,你會不會覺得你是怎麼樣去處理的?
987.022	1018.325	這是一個很好的問題,我先從自己還沒有真正被神得著的時候,被完美主義所挾制的時候,確實我覺得只會被這種完美的自我要求和一個高度的表現所驅動,所以那個時候其實是非常不快樂的, 但是我自從真的跟神重新連上,生命有一個重新的重生,更新以後,其實我才瞭解到在恩典的理念可以補足,做到很多我做不到的。
1018.325	1021.501	我開始學習放手, 繁體中文，臺灣國語。
1021.501	1023.002	繁體中文，臺灣國語。
1023.002	1024.064	繁體中文，臺灣國語。
1042.483	1092.867	因為以前都是我自己扛,現在就是,這就是我的賴皮神學,昨天我的學生還跟我說,老師我記得你的賴皮神學,我說對,我們就是跟神賴皮,因為祂就是掌管一切,那我們幹嘛那麼辛苦,就是丟給祂,而且釋放,就看祂怎麼做,我說我的阿爸父很喜歡做,祂是超人,你只要給祂做, 所以其實我覺得反而在這個當中我並沒有失去不追求卓越但是在追求的過程中我是邀請神進來一起工作我覺得只要神進來工作以後祂就會改變很多東西而且你也會透過神的眼光看到什麼才是完美 是神做的事情的完美,不在於我們今天呈現的成果的完美,而是你看到神的能力,神的恩典彰顯中,那樣一個這麼美好的完美。
1092.867	1095.730	所以我覺得這是一個很好的平衡。
1095.730	1103.179	當信仰進來的時候,我們確實可以在我們的專業上有更多的突破,那是因為神介入和參與。
1103.677	1108.159	是,你的回答真的是開了我們的眼界。
1108.159	1119.224	一般設想會有張力的地方,卻是因為神的包容,神的超過,遠超過我們所思所想,反而是更圓融。
1119.224	1170.726	那我就會想到說,包括我自己在內,所有的觀眾應當都會很有興趣想知道, 好,真的是很感謝神, 真的不知道神是怎麼創造我的因為我跟我的家人跟我的父母是很不一樣的他們裡面是沒有這個喜歡表演的經歷我的家庭是一個隱藏隱藏再隱藏你最好在角落不要被人家發現比較安全 這是一個非常保守的家庭。
1170.726	1186.945	但是好像神有一步一步的﹐帶領我瞭解﹐先是從一個熱情和嚮往﹐一開始你會有一種熱情﹐比如說高中的時候﹐我看到有北藝大的時候﹐我就怦然心動﹐然後就會覺得心是嚮往﹐ 好像其他的你都覺得沒什麼興致。
1186.945	1190.387	你就有一個心好像想往這裡去。
1190.387	1191.907	這當然是第一步。
1191.907	1195.089	所以果然你也進到北一大開始念書。
1195.089	1197.451	然後接觸到一些課程訓練的時候。
1197.451	1200.553	你更明確你對這件事情你很被吸引。
1200.553	1202.674	你想要在這三方面精進。
1202.674	1204.215	你想要朝這個方向發展。
1204.735	1225.528	那其實我最大的確定應該是我念完了以後也拍了我的第一部電影而且那部電影也得到很好的口碑也到坎城影展那個時候有非常多的片約來那時候應該就是盡可能去演了 可是在那個關鍵點的時候,我其實有跟神做一些勵志的禱告。
1225.528	1231.075	我需要有一些很清楚的印證,知道神要怎麼帶我前面的路。
1231.075	1234.099	那個時候我有另外一個選擇,是出國念書。
1234.099	1238.424	那時候很多人就告訴我說,如果出國念書,你其實就沒有機會了。
1238.424	1246.671	所以我其實有跟神禱告說,主啊, 我按著祢給我的感動,我也仍然有想要進修的機會。
1246.671	1252.714	可是這個世界的聲音告訴我說,當你再出去念書以後,你以後的表演機會就沒有了。
1252.714	1260.079	所以我跟神說,我是很喜歡表演,但是如果這個機會不是祢給我的,那沒有就沒有了吧。
1260.759	1263.742	就像以色列要死就死吧。
1263.742	1265.283	就是讓神來帶。
1265.283	1268.305	所以這是一個主權交給神以後。
1268.305	1270.607	我覺得當主權交給神以後。
1270.607	1273.510	神的說話和帶領會變得很清楚。
1273.510	1275.011	很明確。
1275.011	1277.393	因為我覺得人是很短視的。
1277.393	1279.295	我只能看到近的。
1279.295	1281.457	我只能感受到我喜歡的。
1281.457	1284.379	可是我並不知道就長遠而言。
1284.379	1287.322	這是不是神造我的一個計畫和命定和呼召。
1287.602	1319.321	所以這個時候其實我就是把主權交給神那我記得我要出國的時候我的老師和一些好朋友們就說從此以後你不會再有機會因為你出國就斷了這些所有的關係然後一定會有新的人上來可是我就說沒關係神已經開路讓我念書了我就去可是也很奇妙我念書才一結束馬上 就是學位才一拿到,馬上神就安插人跟我接洽,又接回來。
1319.321	1334.886	那我覺得這是很奇妙的,因為我其實那個時候就跟神說,主啊,我並不需要世界的經紀人,如果祢要我繼續表演,這是祢喜歡的,我演的時候,祢很高興,那祢就親自為我安排機會。
1335.486	1338.789	那事實上,神證實這件事。
1338.789	1350.522	所有我能夠這麼有恩典的演到這麼多後面的一些很好的重量級的一些戲,其實都是神在當中很巧妙的安排。
1350.522	1355.988	所以我就很清楚知道說,神是開門開路說你可以繼續往下走。
1356.288	1361.052	所以我聽起來真的覺得不可思議。
1361.052	1366.597	表演藝術這一塊要投入那麼多,而且裡面很複雜。
1366.597	1374.224	你要面對很多選擇,然後你又能夠在學校當老師,因為你跟學生的關係是那麼緊密。
1374.684	1379.106	我覺得好像不可能合在一起的在你身上都做到了。
1379.106	1382.147	我相信邱穎老師還有很多問題要問你。
1382.147	1415.400	是,因為其實在信仰裡面,你要如果說那個劇作本身是有衝突的,您如何來抉擇,或者說您在選擇這些創作的劇作裡面,你有什麼樣特別 其實就像我剛剛說的,神是我的經紀人。
1415.400	1420.103	所以其實每一次邀約演出的時候,我都要花一些時間禱告主。
1420.623	1428.030	我還是要問神,那如果神覺得不合適,就求神也幫我挪去,也不讓我得罪人。
1428.030	1431.853	那神也真的很奇妙的都一直在做這樣的工作。
1431.853	1440.441	但不可否認的,我覺得在我進入到教育職場之前的我,我確實對創作這件事情充滿高度的熱情。
1440.441	1446.206	只要這個作品本身的藝術性和議題夠深刻, 繁體中文，臺灣國語。
1446.206	1448.628	繁體中文，臺灣國語。
1448.628	1450.289	繁體中文，臺灣國語。
1450.289	1451.830	繁體中文，臺灣國語。
1468.899	1501.308	一不小心表演就會變成我的神雖然我也是跟神禱告但是你會覺得你更愛這件事我覺得信仰到現在階段的我我已經知道什麼都不能夠超過神我雖然喜歡但他們不能是我的偶像所以為了神我必須做更多的取捨和選擇所以這個階段的我其實會需要更多的時間詢問神所以其實這幾年我其實推掉蠻多片真的很多 那因為都會覺得不合適了。
1501.308	1504.190	而且有時候不合適會覺得說。
1504.190	1506.771	不管他的議題是不是夠深刻。
1506.771	1509.293	就是你在靈裡面會覺得不平安。
1509.293	1512.255	所以就是一樣就是不要。
1512.255	1516.878	那也其實也帶來神也同時在這個當中給我平安的意念。
1516.878	1519.680	所以我就是照著這樣子的方式來做取捨。
1521.459	1533.012	所以我也很想請問有沒有什麼樣的事件讓你印象最深刻是神的恩典或者是什麼樣的見證能夠跟我們一起分享?
1534.565	1536.466	這個是指哪一方面的?
1536.466	1547.171	就是在你做這樣子的一個戲劇的創作理念,你有沒有什麼樣可以跟我們分享的見證?
1547.171	1550.272	我覺得神很奇妙,因為一開始我大學是念戲劇系。
1550.272	1558.136	戲劇其實是劇場,那我從來沒有想過有一天我會有機會參與影像的表演。
1558.916	1580.921	對,那我覺得神很奇妙,神真的很愛祂的兒女,祂既然給祂的孩子有這樣子的一個恩賜,或者一種感動和熱情,神會拓寬祂的幔子,而且不是我拓寬的,是神自己拓寬,所以我從一個劇場的表演者,可以攝入到影像的表演,這對我來說是不可思議的。
1581.561	1582.842	我們一起來思想。
1582.842	1584.162	繁體中文，臺灣國語。
1598.729	1601.571	劇場打開到影像。
1601.571	1609.197	而且更妙的是臺灣其實並沒有哪一個電影的學系有電影表演這個主修。
1609.197	1609.878	對。
1609.878	1612.320	其實神是一步一步在安排。
1612.320	1618.725	因為我差不多在影像表演裡面差不多經過了十年的琢磨調整。
1618.725	1623.889	因為影像表演跟戲劇舞臺劇的表演其實在表演上是要調整的。
1624.309	1628.892	那你不實際去做,你只是教科書,你其實是不能理解的。
1628.892	1638.919	我也是,神就給我機會學習,祂給你機會演,又給你機會學習,其實是來預備下一個階段,祂要你成為一個老師。
1638.919	1647.485	所以當我們學校電影系說,想要請我組成這個電影表演組的時候,哇,我真的覺得,真是太奇妙了。
1647.485	1651.308	神已經預備我十年,來準備當電影表演的老師。
1651.988	1657.252	所以我就可以來組織架構,而且我瞭解鏡頭跟表演的關係。
1657.252	1662.035	那如果之前我完全沒有經驗,我還是會照演舞臺劇的方式教他們。
1662.035	1666.738	所以他們並不理解,面對鏡頭的時候,我們要做什麼樣的調整。
1666.738	1674.043	所以我覺得這真的是N點又N點,一步一步,然後完成神真正在我生命裡面的拼圖。
1674.043	1680.148	既是演員的基礎,然後又到了一個 繁體中文，臺灣國語。
1680.148	1682.130	繁體中文，臺灣國語。
1701.067	1704.748	然後回來又直接投入到教學裡面。
1704.748	1710.410	其實讓我們這些就是你的同學朋友們是很驚訝的。
1710.410	1719.012	所以感謝主你成為就在學校裡面幫助這些年輕人聚集在一起給他們輔導。
1719.012	1720.293	所以謝謝你。
1720.293	1724.374	對我們還有一些問題想問你。
1724.374	1738.481	就是您覺得就是您 從事表演藝術工作﹐最大快樂跟痛苦﹐有沒有讓你有感受﹐就在這部分﹐對。
1739.206	1774.432	我覺得也是一個階段一個階段以前是在表演的時候當下的時候你很享受就是你可以去扮演另一個人生因為我的人生可能比較簡單比較單純然後透過這個過程我可以去扮演別人去理解別人可是在這個階段我會突然理解到說表演這件事情是一個愛的行動 因為在我們接到角色的時候,我們常會提醒自己,就是說如果你不愛這個角色,你不認同他,其實你沒有辦法扮演他。
1775.452	1781.817	所以我覺得在這過程中,你是不斷的操練自己在多愛一個跟你不一樣的人。
1781.817	1785.280	多愛一個跟你不一樣的人生和去理解。
1785.280	1792.326	所以我覺得反而是在這過程中,神幫助我怎麼樣去愛在我身邊跟我不一樣的人。
1792.326	1797.371	而且可以透過不一樣的背景和不一樣的狀況,我可以理解他們的困境。
1797.371	1800.894	我覺得反而是打開了愛的能力。
1801.374	1849.100	到最後表演變成一個愛的呼喚和一個愛的練習所以使我可以有機會去接觸到更多不同的人的時候我心裡好像很自然就有一種換過來的同理心因為演員很快就要換進到那個角色的裡面那也在輔導學生或者跟朋友談話的時候就是你會很快有那個同理心你很快就可以換到他的位置去理解他的困境和理解他的感受 所以我覺得是表演幫助我神透過這個管道幫助我更多的認識人和學習去愛人這很不容易耶在這裡我就有個問題想追下去 你剛剛提到那個同理心,信仰讓你同理心比以前更豐富。
1849.100	1856.527	那麼入戲的過程,特別你有演過一些比較邊緣人的角色。
1856.527	1861.692	那麼要怎麼樣在入戲當中不真正受傷。
1861.692	1865.315	那這個戲結束以後要去角,要離開這個角色。
1865.896	1871.997	要怎麼樣能夠去角,但是不被一些不好的記憶傷害。
1871.997	1874.638	我不知道你是怎麼做的?
1874.638	1877.559	林老師也是很了解表演人的危險。
1877.559	1880.940	這個工作是真的是很危險的工作。
1880.940	1886.201	因為我們都是在情緒的那種很危險的繩索上很小心的走。
1886.681	1893.907	所以為什麼早期有非常多的演員,我們會看到他們在情緒、情感上很受傷或最後想不開。
1893.907	1896.510	因為有很多情緒的東西會纏繞。
1896.510	1901.934	這個纏繞也包含他所扮演的角色裡面所帶出來的那些情感。
1901.934	1908.640	那如果他沒有一個很好的去角的時候,跟現實生活中的他,角色的他,那是一種混雜。
1908.640	1911.483	混雜到最後的時候,他會不知道他自己到底是誰。
1911.903	1918.025	而且我們在扮演很多角色的時候,這些角色之所以精彩,就是因為他們的層次是複雜的。
1918.025	1926.127	所以當你在處理和在做研究和進入的時候,這其實都是一個危險的過程。
1926.127	1934.889	所以演員對我而言,我現在反而覺得身心的健康很重要,因為這個職業是有職業傷害的。
