start	end	text
18.848	26.415	各位姊妹平安，我們按照每日眼睛事宜的進度,要一起來思想小先知書,納洪書。
26.415	31.419	小先知書總共有十二卷,納洪書是第七卷。
31.419	35.303	納洪作者,他的名字是安慰的意思。
35.303	113.098	我們從納洪書短短的只有三章,可以看得出來上帝在安慰 受到亞述帝國欺壓的南國猶大在安慰南國猶大的百姓納洪書的寫作時間比較難確定但是經過可能的推算我個人認為應該介於祖前663年到祖前612年之間 大概離約拿書一百年左右在納洪書之前一百年左右先知約拿也曾經對尼尼維城的百姓發過預言跟信息 而那時候正是雅數或是尼尼維最衰弱快要滅亡的時候但是想不到先知約拿對他們發出上帝的訊息之後竟然尼尼維城的人都悔改了所以他們就復興了之後上帝就使用他們成為上帝管教中東地區驕傲列國的上帝的棍子然後就 灭掉了许多的国家,包含北国、以色列。
113.098	122.246	但想不到呢,这个亚述,被上帝使用之后,他竟然骄傲自大,自比为神。
122.246	127.150	后来呢,就做了很多残暴,这些可恶的事情。
127.150	137.959	在这个约拿之后,大概一百年左右,上帝又兴起了纳弘先知,来警告尼尼韦,要他悔改,不然他的结局就是灭亡。
138.780	141.641	这大概就是纳弘书的背景。
141.641	150.786	我们就来看第一章第一节,论尼尼韦的墓事,就是伊勒戈斯人纳弘所得的墓事。
150.786	154.188	伊勒戈斯详细的地点,我们比较没有办法确定。
154.188	159.551	我们就来看上帝对尼尼韦的愤怒的预言是什么。
159.551	165.696	第二节,耶和华是忌邪施暴的神, 祭邪,就是嫉妒。
165.696	176.953	我們可以來看見,雅數,或是尼尼韋,因為尼尼韋曾經長期,擔任雅數帝國的首都。
176.953	183.879	尼尼韋並沒有珍惜上帝, 來使用它,成為上帝器皿的這樣一個寶貴機會。
183.879	191.205	凡人是自高自大,甚至敬拜各樣的偶像,甚至自比為神。
191.205	194.708	神是一個忌諧的神,或是忌妒的神。
194.708	202.512	在神的眼中,對於那個拜偶像, 或是跟偶像連結的這種事情,神是無法容忍的。
202.512	207.093	所以神是一位忌邪,也是忌妒的神。
207.093	211.735	同時祂也是一位施暴的神,就是祂會報仇的神。
211.735	219.978	講不聽,警告你不聽,神就會在你身上報仇,公義的審判會領到你。
219.978	222.319	耶和華施暴,大有憤怒。
222.319	224.759	耶和華報仇,大有憤怒。
224.759	228.557	向他的敵人施暴, 向他的仇敵怀怒。
228.557	232.660	他的仇敵现在就是尼尼韦,就是亚述。
232.660	239.685	耶和华不轻易发怒,大有能力,万不以有罪的为无罪。
239.685	247.895	在旧约时代,如果你要问任何一个先知或以色列人, 到底耶和華上帝是一個怎麼樣的上帝。
247.895	250.396	他們通常都會給一個標準的答案。
250.396	253.597	就在出埃及記第34章第6節。
253.597	262.601	這個是耶和華親自跟摩西自我介紹我耶和華是一位什麼樣的耶和華上帝。
262.601	271.845	而在之前一百多年前約拿書第4章那個地方約拿也曾經將來描述耶和華上帝是一個什麼樣的上帝。
273.183	300.101	我们再来看一下出埃及记第34章的第6节第7节我来读给各位听耶和华在摩西面前对摩西宣告说耶和华耶和华是有怜悯有恩典的神 不輕易發怒,並有豐盛的慈愛和誠實,為千萬人存留慈愛,赦免罪孽,過犯和罪孽。
300.101	313.607	這邊談到耶和華,他是一個滿有恩典憐憫,願意赦免那些 願意謙卑悔改的人,包含以色列人,當然也包含之前約拿時代的寧寧維城的人。
313.607	327.299	但同時耶和華也是一個公義審判的神,所以祂萬不以有罪的為無罪,必追討他的罪,自父及子,直到三世代。
328.080	347.538	他是一個願意憐憫赦免、謙卑悔改的罪人的上帝,也是一個對死不悔改的罪人,不會以他的有罪為無罪,沒看見他犯罪,一定會追討,而且自父及子,直到三世代。
347.538	355.500	所以第三節納洪書一章三節說,耶和華不輕易發怒,大有能力, 萬不以有罪的為無罪。
355.500	360.409	這邊就把出埃及記34章第6節做一個最精簡的一個摘錄。
361.374	366.558	祂曾旋風和暴風而來,雲彩圍祂腳下的塵土。
366.558	374.404	代表當上帝要來刑罰這個亞樹的時候,祂比亞樹還要可怕百倍。
374.404	379.168	亞樹帝國對那些中東國家來講,真的是災難。
379.168	382.230	祂所精緻處,沒有人可以抵擋祂。
382.230	384.732	而且亞樹又非常的殘暴。
384.732	387.815	這邊講到說,伊兒華是比亞樹更可怕的敵人。
389.121	397.389	祂乘著暴風旋風而來,腳踏雲而來,沒有人可以抵擋祂,列天而降。
397.389	402.954	祂赤澤海,使海乾了,並且使一切的江河乾河。
402.954	407.479	海、江河在祂面前,都不能抵擋耶和華。
407.479	413.356	巴山和加密的樹林也會衰殘, 黎巴嫩的花草也都衰殘。
413.356	423.539	所以樹林花草一看到耶和華他們的茂盛以及他們的繁榮、美貌也都會衰敗。
423.539	432.281	所以人間的這些虛浮的這些軍事的力量或是經濟的繁榮當耶和華要來審判的時候沒有人可以抵擋。
433.814	438.195	大山因耶和华他而震动,小山也都消化。
438.195	439.735	融化的意思。
439.735	443.596	大地在他面前突起,代表地震而变形。
443.596	447.656	世界和住在其间的也都会如此。
447.656	450.277	所以没有人可以抵挡耶和华。
450.277	454.578	我们认为这些不会动摇的大地跟大山、大海、大河。
454.578	459.298	耶和华一来,他们都会变形扭曲。
459.298	460.879	他发愤恨,谁能立得住呢?
460.879	462.039	就是谁能站得住呢?
462.671	465.714	他發烈怒,誰能擔當得起呢?
465.714	475.005	他的憤怒如火一樣傾倒出來,甚至連磐石都會因耶和華他而崩裂、碎掉。
475.005	487.012	第七節,耶和華本為善, 在患難的日子為人的保障,就做人的避難所堡壘,並且耶和華他會認得那些投靠他的人。
487.012	497.220	一百年前的時候,當約拿對尼尼維人講上帝的信息的時候,他們就認罪、謙卑、悔改。
497.220	535.384	所以在那個時候就是耶和華本為善, 在尼尼維人患難的日子,成為尼尼維人的保障,就是保領,並且耶和華會認得那些願意來投靠他的人,包含悔改的尼尼維人,當然也包含現在向耶和華哀求悔改的這些猶大人, 第八節但祂是除了祂是憐憫慈愛的赦免的神之外祂也是公義審判的上帝所以第八節祂必以葬意的洪水代表祂的憤怒 像那個大水泛濫的河水一樣。
535.384	542.270	尼尼維城就在底格里斯河,那個兩河流域,其中一條就是在底格里斯河的旁邊。
542.270	548.516	他要淹沒尼尼維,又驅逐仇敵進入黑暗。
548.516	554.060	他要使尼尼維進入毀天滅地的黑暗裡面。
554.060	592.122	我們之前, 看見在其他的先知書裡面也常常提到這些以色列的仇敵入侵以色列的時候如同大河的洪水氾濫不論是巴比倫或是亞述都曾這樣被形容但是比巴比倫跟亞述這些從兩河流遇來的敵人更可怕的上帝祂是比這些河水的氾濫還要可怕的上帝 第九節,你你為人,設何謀來攻擊耶和華呢?
592.122	596.183	就是你籌劃什麼樣的計謀來攻擊耶和華呢?
596.183	598.924	你們以為能夠抵擋耶和華嗎?
598.924	603.585	祂必將你們滅絕盡盡,一個都不留。
603.585	607.386	災難不再興起,或是仇敵不再興起。
607.386	611.807	什麼叫你你為人,你的災難或你的仇敵不會再興起第二次。
611.807	614.888	就是沒有下一次的,上帝還一次把你們滅亡。
616.391	629.740	你們會像蟲雜的荊棘,像喝醉的人,東倒西歪沒有抵抗的能力,你們像那些沒有用的荊棘, 又如枯乾的穗結全然燒滅。
629.740	638.124	如同那個枯乾的穗葉、穗草,沒有用了,會被農夫燒掉了,全然燒滅。
638.124	645.108	有一人從你那裡出來,圖謀邪惡,設惡計,要攻擊耶和華。
645.108	715.852	就算你們泥泥微塵裡面有任何人, 想要用什麼計謀來抵擋攻擊耶和華對你們的審判也沒有用處十二節耶和華如此說尼尼維雖然勢力充足代表目前的狀況是屬於尼尼維人他們的國家強盛的時候所以這個因為在祖前663年 亚述王亚述巴尼帕曾经攻入埃及结束了埃及的第25王朝所以那算是亚述的一个巅峰时刻所以很可能 納洪書的時代是在雅數雖然狀況還蠻好的時代軍隊還很強盛的時刻所以很可能就是在約拿書之後一百年左右就是最後一任雅數強大的國王雅數巴尼帕還在位的時候雅數巴尼帕一死之後他的國家就很衰弱進入內亂沒有多久在祖前612年尼尼維城就被巴比倫跟馬代 人的聯軍滅亡。
715.852	723.219	所以尼尼維雖然勢力充足﹐人數繁多﹐也會被剪除﹐歸於無有。
723.219	729.325	所以尤大﹐我雖然使你受苦﹐卻不再使你受苦。
729.325	731.147	誰使尤大受苦呢?
731.147	766.301	就是耶和華上帝﹐ 他曾經透過亚述来管教犹大,但亚述却过头了,他把自己自以为神,目中无神,目中无人,所以先来换上帝来管教亚述,然后因为犹大愿意悔改,所以上帝也要拯救犹大, 现在我必从你的颈项,就是你的脖子上,折断他,就是亚述的恶,扭开亚述他绑在你身上的绳索,要来拯救犹大南国。
766.301	773.226	耶和华已经发出命令,指着尼尼韦说,你名下的人必不留后,要绝子绝孙,要完全毁灭。
775.708	802.675	我必從你的神廟中除滅雕刻的偶像和鑄造的偶像我必因你的筆漏就是我必因為你的卑鄙使你歸於墳墓要滅絕你你的偶像也不能救你看啊 有報好信息傳平安的人的他們的腳,要登到山上去,登高一呼,來講好消息,平安的信息。
802.675	803.936	對誰說呢?
803.936	808.300	猶大可以守你的節旗,還你所許的願吧。
808.780	816.424	代表有好消息要告訴這些猶大人他們多年來在亚述的铁蹄之下很痛苦。
816.424	821.727	他們不斷在节期的時候向耶和华许愿求神拯救他们。
821.727	828.591	如今耶和华要派使者跟他們報好信息说你们得救的时刻要来临了。
828.591	834.334	因为那惡人就是亚述不再从你中间经过就不再侵略你了。
834.334	834.714	他已经灭绝尽尽了。
836.237	841.237	這當然是一個預言,警告亚述,再不悔改,神就要消滅你了。
841.237	842.060	我們一起來禱告。
843.626	851.273	主求祢讓我們從納洪書第一章的信息,給我們很好的提醒和光照。
851.273	861.623	神曾經一百年前拯救過尼尼維人,他們願意悔改,神就給他們機會,並且成為神管教列國的器皿。
861.623	867.468	但後來他們就自高自大,就變成神的仇敵,神就要來滅絕他們。
868.029	875.017	主常常祢恩待我們,從卑微和憤徒中抬舉我們,使我們可以成為上帝的仆人。
875.017	880.764	但有時候我們就是會因此驕傲自大,忘了自己是誰,而被祢管教。
880.764	886.510	恳求主幫助我們,光照我們,讓我們常常回到事奉祢蒙召的原點。
886.971	896.794	再一次認清自己是誰﹐而你是誰﹐使我們一生可以在祢面前謙卑致捷﹐而成為祢願意使用的貴重器皿。
896.794	898.395	奉主耶穌的名祷告。
898.395	899.255	阿們。
899.255	900.615	願神赐福大家。